PartnerName,Id,Title,Description,Brand,Link,ImageLink,CategoryName,Mrp,OfferPrice,EffectivePrice,Availability,PartnerIdFromUrl,PartnerIdFromDb
Flipkart,,R K's Aroma Gold Facial Kit 750 g(Set of 5),"For All Skin Types:The perfect recipe for a dazzling, radiant complexion. R.K’s 24K Gold Face Kit gets rid of pollutants, removes residual debris, and makes skin feel rich with vitality and health every time you use it. The power of natural tube rose and mogra flower oil does wonders for blood circulation, awakening the skin cells and filling them with life. Say goodbye to lifeless complexions forever and embrace your new, beautiful glow.",R K's Aroma,http://dl.flipkart.com/dl/r-k-s-aroma-gold-facial-kit-750-g/p/itmennw8tv47pfb6?pid=FCKENNW8DMYWRVZE&affid=siddarthk,http://img.fkcdn.com/image/facial-kit/v/z/e/5-r-k-s-aroma-750-gold-facial-kit-200x200-imaen7jjf2fp2anr.jpeg,Health and Beauty>Body and Skin Care>Face Care>Facial Kits,1450.0,1348.0,1348.0,true,FCKENNW8DMYWRVZE,FCKENNW8DMYWRVZE
Flipkart,,R K's Aroma Gold facila kit - Single use (Pack 2) 250 g(Set of 6),"For All Skin Types:The perfect recipe for a dazzling, radiant complexion. R.K’s 24K Gold Face Kit gets rid of pollutants, removes residual debris, and makes skin feel rich with vitality and health every time you use it. The power of natural tube rose and mogra flower oil does wonders for blood circulation, awakening the skin cells and filling them with life. Say goodbye to lifeless complexions forever and embrace your new, beautiful glow.",R K's Aroma,http://dl.flipkart.com/dl/r-k-s-aroma-gold-facila-kit-single-use-pack-2-250-g/p/itmennw8jykvpmde?pid=FCKENNW823GUJEFK&affid=siddarthk,http://img.fkcdn.com/image/facial-kit/e/f/k/6-r-k-s-aroma-250-gold-facila-kit-single-use-pack-2-200x200-imaenqyurdmkqrjk.jpeg,Health and Beauty>Body and Skin Care>Face Care>Facial Kits,220.0,220.0,220.0,true,FCKENNW823GUJEFK,FCKENNW823GUJEFK
Flipkart,,R K's Aroma Diamond Facial Kit 750 g(Set of 5),"Perfect for skin of all types and ages. R.K’s Aroma Diamond Kit visibly invigorates the complexion. Made with natural tube rose and violet leaf oil, this kit has superb skin tightening and smoothening properties, pleasantly reviving the skin, making it smooth and radiant throughout the day. Let the wondrous properties of natural tube rose, violet leaf and mogra oils work their natural magic on your skin.",R K's Aroma,http://dl.flipkart.com/dl/r-k-s-aroma-diamond-facial-kit-750-g/p/itmennw8frnhhhyp?pid=FCKENNW8KZC8EZGN&affid=siddarthk,http://img.fkcdn.com/image/facial-kit/z/g/n/5-r-k-s-aroma-750-diamond-facial-kit-200x200-imaenqyuqwzsrmyw.jpeg,Health and Beauty>Body and Skin Care>Face Care>Facial Kits,1875.0,1743.0,1743.0,true,FCKENNW8KZC8EZGN,FCKENNW8KZC8EZGN
Flipkart,,R K's Aroma Pearl Facial Kit 750 g(Set of 5),"For All Skin Types:RK’s Pearl Kit balances the complexion of your skin, reducing dark spots, deep facial lines and the harmful effects left by the sun’s rays. With its toning and hydrating properties, it breathes new life into the texture and feel of skin. Expect to see a definite change in the texture and appearance of your complexion as well as adis appearance of wrinkles or facial lines.",R K's Aroma,http://dl.flipkart.com/dl/r-k-s-aroma-pearl-facial-kit-750-g/p/itmennw8mgn9s5fy?pid=FCKENNW8HBSGQ274&affid=siddarthk,http://img.fkcdn.com/image/facial-kit/2/7/4/5-r-k-s-aroma-750-pearl-facial-kit-200x200-imaenqyuhphhhrsz.jpeg,Health and Beauty>Body and Skin Care>Face Care>Facial Kits,1310.0,1218.0,1218.0,true,FCKENNW8HBSGQ274,FCKENNW8HBSGQ274
Flipkart,,R K's Aroma Pearl Facial Kit-Single use (Pack 2) 250 g(Set of 6),"For All Skin Types:RK’s Pearl Kit balances the complexion of your skin, reducing dark spots, deep facial lines and the harmful effects left by the sun’s rays. With its toning and hydrating properties, it breathes new life into the texture and feel of skin. Expect to see a definite change in the texture and appearance of your complexion as well as adis appearance of wrinkles or facial lines.",R K's Aroma,http://dl.flipkart.com/dl/r-k-s-aroma-pearl-facial-kit-single-use-pack-2-250-g/p/itmennw8yq2kd2eu?pid=FCKENNW8BNSGAZYP&affid=siddarthk,http://img.fkcdn.com/image/facial-kit/z/y/p/6-r-k-s-aroma-250-pearl-facial-kit-single-use-pack-2-200x200-imaenqzcbqnhnj5h.jpeg,Health and Beauty>Body and Skin Care>Face Care>Facial Kits,170.0,170.0,170.0,true,FCKENNW8BNSGAZYP,FCKENNW8BNSGAZYP
Flipkart,,R K's Aroma Skin Whightning Kit-Single use (Pack 2) 250 g(Set of 6),"RK’s skin whitening kit evens skin tone, offers protection from the sun’s UV rays and provides rich nourishment against every day agents that dry out the skins natural moisture. It ensures your skin stays supple and beautiful through the day. Naturally formulated for a healthy and nourished skin that appears radiant and bright, it restores the skin’s softness, making it lighter within weeks of application.",R K's Aroma,http://dl.flipkart.com/dl/r-k-s-aroma-skin-whightning-kit-single-use-pack-2-250-g/p/itmennw8uv7sqbs8?pid=FCKENNW8TWFH6GUK&affid=siddarthk,http://img.fkcdn.com/image/facial-kit/g/u/k/6-r-k-s-aroma-250-skin-whightning-kit-single-use-pack-2-200x200-imaenqzcmffgfzhp.jpeg,Health and Beauty>Body and Skin Care>Face Care>Facial Kits,170.0,170.0,170.0,true,FCKENNW8TWFH6GUK,FCKENNW8TWFH6GUK
Flipkart,,Shrih Active Peptides Totale Skin Care Kit 4 g(Set of 4),"Active Peptides Totale Skin Care Kit.ACTIVE PEPTIDE FOREVER YOUTH EXFOLIATING GEL- 80gWith gentle rubbing, the refreshing gel can mildly remove the dirt, grease and aged horniness that are difficult to clean, dredge pores to make nutrients more easily absorbed, moisten aged horniness and remove the dirt so as to make your skin refreshing and comfortable, brimming with energy and vitality, which is applicable to all skin types.Ingredient: aqua, glycerin, propylene glycol, carbomer, acetyl hexapeptide-8, steartrimonium chloride, aloe yohju matsu ekisu, dmdm hydantoin, perfume.ACTIVE PEPTIDE FOREVER YOUTH FACIAL MASK- 20g With plentiful plant active peptides, this product can help your skin to better absorb nutrients, soften the horny layer and dredge the skin âwater passageâ to hydrate your skin, so as to make your dry and dull skin restore luster and elasticity, keeping your skin tender and watering.Ingredient: aqua, propylene glycol, glycerin, xanthan gum, sodium hyaluronate, dimethylol urea, dipotassium glycyrrhizate, glyceryl polymethacrylate, tranexamic acid, citric acid, bacopa monniera extract, acetyl hexapeptide-8, methylisothiazolinone, peg-40 hydrogenated castor oil, perfume.ACTIVE PEPTIDE FOREVER YOUTH ESSENCE â 40gSpecially designed for inelastic and dull skin, this product is a base essence with quite good absorption effects, which provides the needed water and nutrients for the skin, and can lightly integrate and permeate your skin, so as to create young healthy and highly elastic skin.Ingredient: aqua, glycerin, sodium hyaluronate, panthenol, propylene glycol, calcium disodium edta, xanthan gum, carbomer, triethanolamine, papain, aloe yohju matsu ekisu, acetyl hexapeptide-8, betaine, peg-40 hydrogenated castor oil, imidazolidinyl urea, perfume.ACTIVE PEPTIDE FOREVER YOUTH BB CREAM â 30gWith rich hydrating ingredients such as glycerin, etc. this product can instantly give your skin a new look, block the ultraviolet, cover skin blemishes, conceal pores and reduce the skin damage caused by sunburn, so as to bring a brand new experience to your skin.Ingredient: aqua, glycerin, propylene glycol, titanium/titanium dioxide, tocopherol, cyclomethicone, hyaluronic acid, caprylic/capric glycerides, aloe yohju matsu ekisu, allantoin, acetyl hexapeptide-8, sodium chloride, ci 77492, ci 77491, methylparaben, propylparaben, parfume, polyglyceryl-2 stearate, peg-4 sorbitan stearate.Weight And Kits include: (1) Active Peptides Totale Gel: 80g (2) Active Peptides Totale BB Cream: 30g (3) Active Peptides Totale Essence : 40g (4) Active Peptides Totale Mask: 4Packet of 20g",Shrih,http://dl.flipkart.com/dl/shrih-active-peptides-totale-skin-care-kit-4-g/p/itment5kzxdyrzf7?pid=FCKENT5KDGK2WHE2&affid=siddarthk,http://img.fkcdn.com/image/facial-kit/h/e/2/4-shrih-4-active-peptides-totale-skin-care-kit-200x200-imaens9etvuav63t.jpeg,Health and Beauty>Body and Skin Care>Face Care>Facial Kits,4999.0,3200.0,3200.0,true,FCKENT5KDGK2WHE2,FCKENT5KDGK2WHE2
Flipkart,,One Personal Care Target Dark Circle(48 g),"A hydrating and revitalizing daily eye treatment that alleviates the appearance of puffiness, dark circles, and signs of fatigue.",One Personal Care,http://dl.flipkart.com/dl/one-personal-care-target-dark-circle/p/itmenhtwevgnkr5n?pid=EGLENHTWH7NRBRSG&affid=siddarthk,http://img.fkcdn.com/image/eye-gel/r/s/g/one-personal-care-48-target-dark-circle-200x200-imaenhqtcr7yyznp.jpeg,Health and Beauty>Body and Skin Care>Eye Care>Eye Gels,599.0,229.0,229.0,true,EGLENHTWH7NRBRSG,EGLENHTWH7NRBRSG
Flipkart,,Clinique Skin Supplies for Men(15 ml),"Clinique Skin Supplies for Men Anti-Fatigue Cooling Eye Gel 15ml/0.5oz,All Skin Types: Buy Clinique Eye Creams,Clinique Skin Supplies for Men Anti-Fatigue Cooling Eye Gel 15ml/0.5oz,All Skin Types,Item Condition: 100% authentic, new and unused. Clinique Skin Supplies for Men Anti-Fatigue Cooling Eye Gel 15ml/0.5oz,All Skin Types.Type: Gel.",Clinique,http://dl.flipkart.com/dl/clinique-skin-supplies-men/p/itmdy9nbus4eccsm?pid=EGLDY9NBE5HUCTYM&affid=siddarthk,http://img.fkcdn.com/image/eye-gel/t/y/m/clinique-15-skin-supplies-for-men-200x200-imadyaeja4umr79u.jpeg,Health and Beauty>Body and Skin Care>Eye Care>Eye Gels,7514.0,4510.0,5012.0,true,EGLDY9NBE5HUCTYM,EGLDY9NBE5HUCTYM
Flipkart,,"StBotanica Under Eye Gel (With Vitamin E, Cucumber, Argan Oil)(60 ml)","Are you TIRED of Eye bags, Dark Circles, Puffiness and Tired Looking Eyes? Our new and innovative mix of the perfect ingredients will give you Radiant & Youthful Eyes by: • Managing Dark circles, Puffiness, Dryness and Sagging around the eyes. • Increasing elasticity and plumps the skin around eyes. • Providing a youthful texture around the eyes. • Moisturizing the delicate eye area. it is also Useful for the entire face. Can be applied all over the face for an enhanced glow and a more radiant looking face. When applying St.Botanica Under Eye Gel around your eye, notice how refreshing the gel is for all skin types yet effective with Hyaluronic acid to get incredible eye therapy results. Wrinkles lessen quickly, puffiness improves drastically, and dark circles lighten giving way to radiant, glowing, healthy eyes that pop. BENEFITS: - Manages eye puffiness and bags. - Manages appearance of fine lines, wrinkles and age spots. - Manages under eye dark circles. - Nourishes, hydrates and protects skin around the eyes. Get ready to say goodbye to dark circles, puffiness and crow's feet & welcome to a rejuvenated youthful look with fabulously radiant eyes.",StBotanica,http://dl.flipkart.com/dl/stbotanica-under-eye-gel-with-vitamin-e-cucumber-argan-oil/p/itmencrdezuqzp9m?pid=EGLENCRDT4ZHEZCF&affid=siddarthk,http://img.fkcdn.com/image/eye-gel/z/c/f/stbotanica-60-under-eye-gel-with-vitamin-e-cucumber-argan-oil-200x200-imaehvgnxezxebgv.jpeg,Health and Beauty>Body and Skin Care>Eye Care>Eye Gels,1338.0,1070.0,1070.0,true,EGLENCRDT4ZHEZCF,EGLENCRDT4ZHEZCF
Flipkart,,"Steel Paris Manicure Set Best Quality(250 g, Set of 7)",,Steel Paris,http://dl.flipkart.com/dl/steel-paris-manicure-set-best-quality/p/itmemes7f9wmpz99?pid=MNKEMES7WEY4GD54&affid=siddarthk,http://img.fkcdn.com/image/manicure-kit/d/5/4/steel-paris-250-manicure-set-best-quality-200x200-imaemedwbhhwrynm.jpeg,Health and Beauty>Body and Skin Care>Hand Care>Manicure and Kits,249.0,249.0,249.0,true,MNKEMES7WEY4GD54,MNKEMES7WEY4GD54
Flipkart,,"Oxyglow Mani-Pedi Care Kit(400 g, Set of 4)",Undergoing manicure and pedicure is more than just a special treat. It's matter of grooming and keeping your hands and feet in good health. Regular manicures and pedicures help prevent infection and other skin problems. This process prevents your feet and hands from skin disorders.,Oxyglow,http://dl.flipkart.com/dl/oxyglow-mani-pedi-care-kit/p/itmenga7gsc27yvm?pid=MNKENGA7RKKKVRG6&affid=siddarthk,http://img.fkcdn.com/image/manicure-kit/r/g/6/oxyglow-400-mani-pedi-care-kit-200x200-imaen8djgpudfzxq.jpeg,Health and Beauty>Body and Skin Care>Hand Care>Manicure and Kits,650.0,552.0,552.0,true,MNKENGA7RKKKVRG6,MNKENGA7RKKKVRG6
Flipkart,,"beauty studio 7 in 1 Manicure Pedicure Kit(7 g, Set of 7)",It is known to all that a manicure or pedicure makes our nails look fantastic. Hands and feet are most exposed to weather and all that dirt than any other parts of your body. A thorough manicure and pedicure gets rid of the dirt and grime easily collected through proper cleansing and skin exfoliation. Dead skins are removed leaving your hands and feet softer and smoother reducing the appearance of wrinkles. It aids in increasing blood circulation and also keeps fungal infections at bay.,beauty studio,http://dl.flipkart.com/dl/beauty-studio-7-1-manicure-pedicure-kit/p/itmenpf7zjssdxyr?pid=MNKENPF44QGYHZ8N&affid=siddarthk,http://img.fkcdn.com/image/manicure-kit/z/8/n/beauty-studio-7-7-in-1-manicure-pedicure-kit-200x200-imaenpb3czrz58dv.jpeg,Health and Beauty>Body and Skin Care>Hand Care>Manicure and Kits,1250.0,650.0,650.0,true,MNKENPF44QGYHZ8N,MNKENPF44QGYHZ8N
Flipkart,,"ChinuStyle 7 Pc Manicure Set(7 g, Set of 7)",,ChinuStyle,http://dl.flipkart.com/dl/chinustyle-7-pc-manicure-set/p/itmemgf4tjt8bqhx?pid=MNKEMGF4ZD2HNYYD&affid=siddarthk,http://img.fkcdn.com/image/manicure-kit/y/y/d/chinustyle-7-7-pc-manicure-set-200x200-imaemct8jgem9kvu.jpeg,Health and Beauty>Body and Skin Care>Hand Care>Manicure and Kits,399.0,224.0,249.0,true,MNKEMGF4ZD2HNYYD,MNKEMGF4ZD2HNYYD
Flipkart,,"Empreus 7 in 1 Manicure Kit(7, Set of 1)","This is a designer home manicure set; you get 7 tools along with a nice place to store them. It is a great product that really brings much more convenience and beauty to your life. This easy to use set comes with all basic tools you need for normal nail grooming and even comes with an attractive pouch. This incredible little set helps to make your fingernails and toenails healthy and beautiful while coming to you at a special low price, so don't forget to order yours today! Product Features: Contains basic tools you need for normal grooming, manicure. A great set to keep all your nail beauty tools organized and in one place. Provided with an attractive designer holder case. Compact design for travel and home use. Take care of your nails conveniently and easily.",Empreus,http://dl.flipkart.com/dl/empreus-7-1-manicure-kit/p/itmeejgzsgfgtfyz?pid=MNKEEJGZX2CJYDAN&affid=siddarthk,http://img.fkcdn.com/image/manicure-kit/n/h/z/empreus-7-7-in-1-manicure-kit-set-200x200-imaee7bagyd9vmng.jpeg,Health and Beauty>Body and Skin Care>Hand Care>Manicure and Kits,1645.0,399.0,399.0,true,MNKEEJGZX2CJYDAN,MNKEEJGZX2CJYDAN
Flipkart,,"Empreus Manicure Kit In Leatherette Case (7 Pc.) - Small(7, Set of 1)","This Is A Designer Home Manicure Set; You Get 7 Tools Along With A Nice Place To Store Them. It Is A Great Product That Really Brings Much More Convenience And Beauty To Your Life. This Easy To Use Set Comes With All Basic Tools You Need For Normal Nail Grooming And Even Comes With An Attractive Pouch. This Incredible Little Set Helps To Make Your Fingernails And Toenails Healthy And Beautiful While Coming To You At A Special Low Price, So Don'T Forget To Order Yours Today! Product Features: Contains Basic Tools You Need For Normal Grooming, Manicure. A Great Set To Keep All Your Nail Beauty Tools Organized And In One Place. Provided With An Attractive Designer Holder Case. Compact Design For Travel And Home Use. Take Care Of Your Nails Conveniently And Easily.",Empreus,http://dl.flipkart.com/dl/empreus-manicure-kit-leatherette-case-7-pc-small/p/itmeejgzhypzduvf?pid=MNKEEJGZPAUZ6HHV&affid=siddarthk,http://img.fkcdn.com/image/manicure-kit/n/h/z/empreus-7-7-in-1-manicure-kit-set-200x200-imaee7bagyd9vmng.jpeg,Health and Beauty>Body and Skin Care>Hand Care>Manicure and Kits,1249.0,325.0,325.0,true,MNKEEJGZPAUZ6HHV,MNKEEJGZPAUZ6HHV
Flipkart,,"JS 9 in 1 Set Manicure Pedicure Nail Clipper(1, Set of 9)","This elegant faux leather case comes packed with 9pcs of tools one would need for manicuring, grooming or daily use.Tools Inlude: Large nail clipper, medium nail clipper, cuticle clipper, scissor, nail file, tweezer, cuticle pusher, earpick and acne needle Great for keeping your nails and cuticles looking perfect Beautifully packaged in an attractive case, with easy zipper closure, convenient to use and carry Material: Tools are made of stainless steel, case is made of faux leather Nail Tools Color: Sliver Please note : available leather design in stock will be sent",JS,http://dl.flipkart.com/dl/js-9-1-set-manicure-pedicure-nail-clipper/p/itmeddnrgjfngzqg?pid=MNKEDDNRB5HGHH75&affid=siddarthk,http://img.fkcdn.com/image/manicure-kit/h/7/5/js-1-9-in-1-set-manicure-pedicure-nail-clipper-200x200-imaeddyae4me9dt2.jpeg,Health and Beauty>Body and Skin Care>Hand Care>Manicure and Kits,599.0,375.0,375.0,true,MNKEDDNRB5HGHH75,MNKEDDNRB5HGHH75
Flipkart,,Faces Faces Ultime Pro Lip Creme-Sunset Mimosa+ Faces Hi Shine Nail Enamel Tinted Red(Pack of 2),,Faces,http://dl.flipkart.com/dl/faces-ultime-pro-lip-creme-sunset-mimosa-hi-shine-nail-enamel-tinted-red/p/itmencn6uemuq5rt?pid=MKTENCN6BSX3U29H&affid=siddarthk,http://img.fkcdn.com/image/makeup-kit/2/9/h/faces-faces-ultime-pro-lip-creme-sunset-mimosa-faces-hi-shine-200x200-imaemygfpwh9npay.jpeg,Health and Beauty>Makeup>Makeup Kits,878.0,878.0,878.0,true,MKTENCN6BSX3U29H,MKTENCN6BSX3U29H
Flipkart,,Too Faced Faced - Sugar Pop Sugary Sweet Eye Shadow Collection(Pack of 1),"Give eyes some sugar with our colorful palette of nine deliciously enticing, shimmer and glitter shadows in vanilla, chocolate and candy inspired hues that allow limitless, irresistibly sweet looks for eyes that sparkle and pop! Rich Pigments: Our exclusive true color, pure pigmented eye shadows offer rich color payoff Blendable: Our luxurious, silky smooth formula blends effortlessly for an airbrushed effect Step-by-Step Instructions: Includes our signature Glamour Guide with three looks to get you started. Paraben Free Gluten Free",Too Faced,http://dl.flipkart.com/dl/too-faced-sugar-pop-sugary-sweet-eye-shadow-collection/p/itmek3fgfcvzgnfa?pid=MKTEK3FGY5CBVSRZ&affid=siddarthk,http://img.fkcdn.com/image/makeup-kit/s/r/z/too-faced-faced-sugar-pop-sugary-sweet-eye-shadow-collection-200x200-imaejyk2jvv3sxy6.jpeg,Health and Beauty>Makeup>Makeup Kits,11816.0,7475.0,8306.0,true,MKTEK3FGY5CBVSRZ,MKTEK3FGY5CBVSRZ
Flipkart,,W7 Natural Nudes Naked Eye Colour Palette New (W7 - 'In The Nudes' Natural Nudes)(Pack of 1),"This fantastic eye palette from W7 In The Nude is perfect for taking you from day to night. This gorgeous eye palette contains 12 eye shadow shades including from left to right: Latte, Angel, Venice, Marilyn, Copper Pot, Sun Kissed, Alice, Bad Manners, Coffee Cup, Mud Slide, Tokyo & Fashionista.",W7,http://dl.flipkart.com/dl/w7-natural-nudes-naked-eye-colour-palette-new-w7-in-nudes-nudes/p/itmek3fhyqkz4zf5?pid=MKTEK3FHE4VJTZY2&affid=siddarthk,http://img.fkcdn.com/image/makeup-kit/z/y/2/w7-natural-nudes-naked-eye-colour-palette-new-w7-in-the-nudes-200x200-imaejyk2zdfezkyc.jpeg,Health and Beauty>Makeup>Makeup Kits,2717.0,1575.0,1751.0,true,MKTEK3FHE4VJTZY2,MKTEK3FHE4VJTZY2
Flipkart,,Coastal Scents 26 Shadow Blush Combo Palette(Pack of 1),"The 26 shadow blush palette comes in nearly nude, browns, taupes, peaches, pinks, rose, and rich plums. There are 21 shadows and 5 blushes in shimmer, pearl, and matte shades. Some of the shadows can be used as blushes with great results.",Coastal Scents,http://dl.flipkart.com/dl/coastal-scents-26-shadow-blush-combo-palette/p/itmek3fhzfm5e5hm?pid=MKTEK3FHNFZHZQFE&affid=siddarthk,http://img.fkcdn.com/image/makeup-kit/q/f/e/coastal-scents-26-shadow-blush-combo-palette-200x200-imaeh2cjznc7yhyd.jpeg,Health and Beauty>Makeup>Makeup Kits,4305.0,2646.0,2940.0,true,MKTEK3FHNFZHZQFE,MKTEK3FHNFZHZQFE
Flipkart,,Ben Nye Nye Magicake Face Paint Palettes CFK-12 (12 Colors)(Pack of 1),Ben Nye Makeup Magicake Face Painting Palettes come in 6 and 12 colors that provide the essentials to design virtually any configuration. The Ben Nye Makeup Magicake Face Painting Palettes is for the Professional and the metal box is ideal for face painters and artists on-the-go. All Magicake Palettes shades are available as refills (02/rm). Empty 6 color Palette Box (02/bxe6) and 12 color Palette Box (02/bxe12) available to fill as you wish,Ben Nye,http://dl.flipkart.com/dl/ben-nye-magicake-face-paint-palettes-cfk-12-12-colors/p/itmek3fhsdvbee9n?pid=MKTEK3FHNBBFXZGZ&affid=siddarthk,http://img.fkcdn.com/image/makeup-kit/z/g/z/ben-nye-nye-magicake-face-paint-palettes-cfk-12-12-colors-200x200-imaejyk2sygehewg.jpeg,Health and Beauty>Makeup>Makeup Kits,11837.0,7276.0,8085.0,true,MKTEK3FHNBBFXZGZ,MKTEK3FHNBBFXZGZ
Flipkart,,"Ivation Makeup Kit - 36 Pc Set Including Eyeshadow, Blusher, Lip Gloss and Brush Set(Pack of 1)",Trendy and Stylish design makes this item a great gift idea for Makeup Beginners,Ivation,http://dl.flipkart.com/dl/ivation-makeup-kit-36-pc-set-including-eyeshadow-blusher-lip-gloss-brush/p/itmek3fhqwhfs8rq?pid=MKTEK3FHAFNAUDNC&affid=siddarthk,http://img.fkcdn.com/image/makeup-kit/d/n/c/ivation-makeup-kit-36-pc-set-including-eyeshadow-blusher-lip-200x200-imaejyk2zpjtpzrk.jpeg,Health and Beauty>Makeup>Makeup Kits,7169.0,3537.0,3930.0,true,MKTEK3FHAFNAUDNC,MKTEK3FHAFNAUDNC
Flipkart,,Tarte Pin up Girl Amazonian Clay 12-hour Blush Palette 2014 NEW(Pack of 1),"What it is:An exclusive blush set with five brand-new, Amazonian clay-infused blushes and two wearable hair pins-all encased inside of a Parisian-inspired clutch.What it does:This 12-hour wear, Amazonian-clay infused blush palette instantly awakens the complexion and adds rich dimension. With five flattering, craveable blushes, you can accessorize your entire look and add a touch of sparkle and sheen with the two wearable hair pins. This chic, portable palette makes the perfect gift for the spontaneous blush enthusiast. This giftable palette includes two wearable hair pins with rhinestone and pearl-draped elements for that perfectly ""pinned up"" look, and it features soft, whimsical packaging and a chic carrying case that's reminiscent of a vintage clutch and inspired by the pristine elegance of the Parisians.This set contains:- 5 x 0.158 oz Amazonian clay 12-hour blushes in Breathless (pinky beige), Embraced (plummy rose), Whimsy (light pink), Bashful (rosy peach), Irreplaceable (mauve rose)- 2 hair pinsWhat it is formulated WITHOUT:- Parabens- PhthalatesWhat else you need to know:These products are dermatologist tested.",Tarte,http://dl.flipkart.com/dl/tarte-pin-up-girl-amazonian-clay-12-hour-blush-palette-2014-new/p/itmek3fhtjadgtay?pid=MKTEK3FHFCZACHHC&affid=siddarthk,http://img.fkcdn.com/image/makeup-kit/h/h/c/tarte-pin-up-girl-amazonian-clay-12-hour-blush-palette-2014-new-200x200-imaejyk2djgvsh96.jpeg,Health and Beauty>Makeup>Makeup Kits,9951.0,6477.0,7197.0,true,MKTEK3FHFCZACHHC,MKTEK3FHFCZACHHC
Flipkart,,"city color Contour & Define - Contour, Bronzer, Blush, Highlight #F0038(Pack of 1)","City Color contour and define palette. This set comes with a fold-up contour and define quad palette, contains contour, bronzer, blush, highlight. Net wt. 4 Ã— 0.137 oz. each standard size. The palette approximately 5 Ã— 5 inches wide. Super high grade materials used in production. Provides cover up to the skin in any light. Well coordinated and trendy color. Gives a striking makeup results. To improve the natural and smooth look.",city color,http://dl.flipkart.com/dl/city-color-contour-define-contour-bronzer-blush-highlight-f0038/p/itmek3fgzaj2xzx2?pid=MKTEK3FGHBABNSCJ&affid=siddarthk,http://img.fkcdn.com/image/makeup-kit/s/c/j/city-color-contour-define-contour-bronzer-blush-highlight-f0038-200x200-imaejyk2jbavggng.jpeg,Health and Beauty>Makeup>Makeup Kits,1769.0,1432.0,1592.0,true,MKTEK3FGHBABNSCJ,MKTEK3FGHBABNSCJ
Flipkart,,"e.l.f. Cosmetics 111 Piece Everyday Palette, 0.36 Ounce(Pack of 1)","Set Includes:64 eye shadows, 32 lip glosses, 4 blushes, 4 bronzers, 4 eye brushes, 2 lip brushes, 1 face brush",e.l.f. Cosmetics,http://dl.flipkart.com/dl/e-l-f-cosmetics-111-piece-everyday-palette-0-36-ounce/p/itmek3fhf8vtgtwr?pid=MKTEK3FHVWR5KKFC&affid=siddarthk,http://img.fkcdn.com/image/makeup-kit/k/f/c/e-l-f-cosmetics-111-piece-everyday-palette-0-36-ounce-200x200-imaeh2cj2gb8y9ug.jpeg,Health and Beauty>Makeup>Makeup Kits,8057.0,5218.0,5798.0,true,MKTEK3FHVWR5KKFC,MKTEK3FHVWR5KKFC
Flipkart,,Coastal Scents Revealed 3 Eyeshadow Palette(Pack of 1),"The Revealed 3 palette features twenty all-new elegant eye shadows, in a stunning variety of hues and textures. Discover infinite possibilities with a combination of looks, perfect for every eye color.   Ingredients:   Talc, Mica, Aluminum Starch Octenylsuccinate, Magnesium Stearate, Kaolin, Dimethicone, Phenyl Trimethicone, Ethylhexyl Palmitate, Octyldodecyl Stearoyl Stearate, Polymethyl Methacrylate, o-Cymen-5-ol, BHT. May Contain: Mica and Titanium Dioxide, Silica, Iron Oxides, Chromium Hydroxide Green, Chromium Oxide Greens, Manganese Violet, Ultramarines, Ferric Ferrocyanide, FD and C Red 40 Al Lake, FD and C Yellow 5 Al Lake, FD and C Blue 1 Al Lake   Product Specifications: Dimensions:  Palette - 7.25"" x 3.75"" x 0.5"" (18.415cm x 9.525cm x 1.3cm) Net Weight:  30g (1oz.)",Coastal Scents,http://dl.flipkart.com/dl/coastal-scents-revealed-3-eyeshadow-palette/p/itmek3fguqhq7nkq?pid=MKTEK3FGXZYMMHFQ&affid=siddarthk,http://img.fkcdn.com/image/makeup-kit/h/f/q/coastal-scents-revealed-3-eyeshadow-palette-200x200-imaejyk2auw2gfsa.jpeg,Health and Beauty>Makeup>Makeup Kits,4754.0,3094.0,3438.0,true,MKTEK3FGXZYMMHFQ,MKTEK3FGXZYMMHFQ
