PartnerName,Id,Title,Description,Brand,Link,ImageLink,CategoryName,Mrp,OfferPrice,EffectivePrice,Availability,PartnerIdFromUrl,PartnerIdFromDb
Flipkart,,Anokhi Ada Fruit designed Hair Band(Multicolor),"Set of 6 Multicolored Plastic Hair Bands for Girls, with Fruits inside the outer layer of each hair band",Anokhi Ada,http://dl.flipkart.com/dl/anokhi-ada-fruit-designed-hair-band/p/itmedshw3nutpghh?pid=HACEDSHWPSJSEZJG&affid=siddarthk,http://img.fkcdn.com/image/hair-accessory/z/j/g/haa-0128-6-anokhi-ada-hair-band-fruit-designed-200x200-imaedsk4h2sjs2sx.jpeg,Health and Beauty>Hair Care>Hair Care Accessories>Hair Accessories,300.0,199.0,199.0,false,HACEDSHWPSJSEZJG,HACEDSHWPSJSEZJG
Flipkart,,Pink Rose Rose Charm Hair Pin(Red),"Beautifully crafted, which combines the attributes of a Pink Rose, which are Passion, Admiration, Grace, elegance, Gratitude and Appreciation. Designed to compliment you…",Pink Rose,http://dl.flipkart.com/dl/pink-rose-charm-hair-pin/p/itmeedzx3qfbzrhn?pid=HACEEDZX2WFC3SPC&affid=siddarthk,http://img.fkcdn.com/image/hair-accessory/s/p/c/pinkrose-ha-144-1-pink-rose-rose-charm-200x200-imaeecgdhdkaettm.jpeg,Health and Beauty>Hair Care>Hair Care Accessories>Hair Accessories,1428.0,649.0,649.0,false,HACEEDZX2WFC3SPC,HACEEDZX2WFC3SPC
Flipkart,,Fayon Apricot Leaf Hair Pin(Brown),Add this pretty leafy hair pin to your hair for a feminine touch. Check out our funky jewelry trends. Fayon is all about fun and so is our funky fashion hair accessories collection. You’ll find on-trend styles and funky accessory options that are sure to make you smile.,Fayon,http://dl.flipkart.com/dl/fayon-apricot-leaf-hair-pin/p/itmeevdmukqvgctk?pid=HACEEVDM6WK773WM&affid=siddarthk,http://img.fkcdn.com/image/hair-accessory/3/w/m/36301-1-fayon-apricot-leaf-200x200-imaeet2gr2fqrk8g.jpeg,Health and Beauty>Hair Care>Hair Care Accessories>Hair Accessories,1020.0,244.0,306.0,true,HACEEVDM6WK773WM,HACEEVDM6WK773WM
Flipkart,,Fayon Strings With Comb Hair Chain(Gold),"This multi strand headband is a glam slam for your do. Layered gold chains add the sparkle + shine perfect for any occasion. Stay chic and stylish with trendy jewelry.Flaunt the latest runway trends with Fayon's unique, quality trendy jewelry. Every season, our designers capture key jewelry trends with fresh new trendy necklaces, trendy bracelets, trendy rings, trendy earrings and other trendy accessories.",Fayon,http://dl.flipkart.com/dl/fayon-strings-comb-hair-chain/p/itmeevdmzrkfg8uc?pid=HACEEVDMAF4QFA8Z&affid=siddarthk,http://img.fkcdn.com/image/hair-accessory/a/8/z/34001-1-fayon-strings-with-comb-200x200-imaeetfzpgvvjzcz.jpeg,Health and Beauty>Hair Care>Hair Care Accessories>Hair Accessories,990.0,237.0,297.0,false,HACEEVDMAF4QFA8Z,HACEEVDMAF4QFA8Z
Flipkart,,Fayon Pearl Flower Rhinestone Hair Band(White),Gold glitter gives a festive sparkle to this unique rhinestone pearl flower.Shop Designer Modern jewelery for a stunning look. Contemporary hair accessories in modern designs is a hot hair accessories trend that is here to stay! The key element to all modern hair accessories designs is its simplicity. These minimal hair accessories styles are designed for today’s women with modern urban lifestyles.,Fayon,http://dl.flipkart.com/dl/fayon-pearl-flower-rhinestone-hair-band/p/itmeevdmvzacqcka?pid=HACEEVDMCHFKCHGD&affid=siddarthk,http://img.fkcdn.com/image/hair-accessory/h/g/d/76518-1-fayon-pearl-flower-rhinestone-200x200-imaeet7nwnyvqycp.jpeg,Health and Beauty>Hair Care>Hair Care Accessories>Hair Accessories,1240.0,297.0,372.0,true,HACEEVDMCHFKCHGD,HACEEVDMCHFKCHGD
Flipkart,,Fayon Tiny Pearl Hair Pin(White),"Add some bling to your ensemble with this stunning hair accessory or headgear that makes it a great choice. Show off your personal style with personalized daily casual jewelry from Fayon.Reflect your unique style at work with Fayon's stylish, daily, casual necklaces that allow you to express your individuality with style.",Fayon,http://dl.flipkart.com/dl/fayon-tiny-pearl-hair-pin/p/itmeevdmacr3p8ck?pid=HACEEVDMGGMYK6EC&affid=siddarthk,http://img.fkcdn.com/image/hair-accessory/6/e/c/73068-1-fayon-tiny-pearl-200x200-imaeet3zgz7vkfkk.jpeg,Health and Beauty>Hair Care>Hair Care Accessories>Hair Accessories,1310.0,419.0,524.0,true,HACEEVDMGGMYK6EC,HACEEVDMGGMYK6EC
Flipkart,,Fayon Leaf With Pearl Hair Pin(Pink),"Add this pretty leafy hair pin to your hair for a feminine touch. Party in style with Fayon's newly launched hair accessories. Fayon has fabulous party jewelry and special occasion hair accessories for every event on your calendar. Shop from our store for head-turning party necklaces, party bracelets, party earrings , party rings and party hair accessories",Fayon,http://dl.flipkart.com/dl/fayon-leaf-pearl-hair-pin/p/itmeevdmhughfkzh?pid=HACEEVDMHHUZG58P&affid=siddarthk,http://img.fkcdn.com/image/hair-accessory/5/8/p/36303-1-fayon-leaf-with-pearl-200x200-imaeet34ttbgznjx.jpeg,Health and Beauty>Hair Care>Hair Care Accessories>Hair Accessories,1020.0,244.0,306.0,true,HACEEVDMHHUZG58P,HACEEVDMHHUZG58P
Flipkart,,Fayon Chic Stylish Leaf Hair Pin(Silver),Add silver shine to your hairs with this highly polished hair clip. Show off your personal style with personalized chic stylish hair accessories from Fayon. Reflect your unique style with personalized hair accessories. Fayon has stylish and customized hair accessories that allow you to express your individuality with style.,Fayon,http://dl.flipkart.com/dl/fayon-chic-stylish-leaf-hair-pin/p/itmeevdmtfwrqdah?pid=HACEEVDMJ3QMZWRR&affid=siddarthk,http://img.fkcdn.com/image/hair-accessory/w/r/r/36300-1-fayon-chic-stylish-leaf-200x200-imaeet23fzm4knry.jpeg,Health and Beauty>Hair Care>Hair Care Accessories>Hair Accessories,1330.0,319.0,399.0,true,HACEEVDMJ3QMZWRR,HACEEVDMJ3QMZWRR
Flipkart,,Fayon Stylish Bronze Coin Hair Chain(Bronze),"Make a stylish yet simple statement with the Win it all headgear. Try it with a jumpsuit , casual dress !!! Show off your personal style with personalized chic stylish jewelry from Fayon.Reflect your unique style with personalized jewelry. Fayon has stylish necklaces and customized jewelry that allow you to express your individuality with style.",Fayon,http://dl.flipkart.com/dl/fayon-stylish-bronze-coin-hair-chain/p/itmeevdmgty9cdwq?pid=HACEEVDMMVSQDXHG&affid=siddarthk,http://img.fkcdn.com/image/hair-accessory/x/h/g/34010-1-fayon-stylish-bronze-coin-200x200-imaeetfsjgvmk8te.jpeg,Health and Beauty>Hair Care>Hair Care Accessories>Hair Accessories,1040.0,332.0,416.0,true,HACEEVDMMVSQDXHG,HACEEVDMMVSQDXHG
Flipkart,,Fayon Wire Stylish Flower Hair Pin(Gold),Adorn hair with circles of iridescent sparkle when you add these pretty hair clip.Show off your personal style with personalized daily casual hair accessories from Fayon.Reflect your unique style at new hair accessories from FAYON store that allow you to express your individuality with style.,Fayon,http://dl.flipkart.com/dl/fayon-wire-stylish-flower-hair-pin/p/itmeevdmfxg6w8gu?pid=HACEEVDMTU4PRHQJ&affid=siddarthk,http://img.fkcdn.com/image/hair-accessory/h/q/j/76325-1-fayon-wire-stylish-flower-200x200-imaeet6tq9khpzh3.jpeg,Health and Beauty>Hair Care>Hair Care Accessories>Hair Accessories,830.0,199.0,249.0,false,HACEEVDMTU4PRHQJ,HACEEVDMTU4PRHQJ
Flipkart,,Fayon Leaf Shape Hair Pin(Grey),Add this pretty leafy hair pin to your hair for a feminine touch. Check out our funky jewelry trends. Fayon is all about fun and so is our funky fashion hair accessories collection. You’ll find on-trend styles and funky accessory options that are sure to make you smile.,Fayon,http://dl.flipkart.com/dl/fayon-leaf-shape-hair-pin/p/itmeevdmhargkfzg?pid=HACEEVDMYYNQZWCK&affid=siddarthk,http://img.fkcdn.com/image/hair-accessory/w/c/k/36302-1-fayon-leaf-shape-200x200-imaeet3yugxchhvg.jpeg,Health and Beauty>Hair Care>Hair Care Accessories>Hair Accessories,1020.0,244.0,306.0,true,HACEEVDMYYNQZWCK,HACEEVDMYYNQZWCK
Flipkart,,Fayon Trendy Costume Flower Hair Pin(White),"This fascinator has vintage flair.Stay chic and stylish with trendy hair accessories .Flaunt the latest runway trends with Fayon's unique, quality trendy hair accessories. Every season, our designers capture key trends with fresh new trendy hair pin,hair band ,hair rubber band and other trendy hair accessories.",Fayon,http://dl.flipkart.com/dl/fayon-trendy-costume-flower-hair-pin/p/itmeevdmshutbppz?pid=HACEEVDMZZ4SFTHF&affid=siddarthk,http://img.fkcdn.com/image/hair-accessory/t/h/f/76307-1-fayon-trendy-costume-flower-200x200-imaeet4w4paagmyg.jpeg,Health and Beauty>Hair Care>Hair Care Accessories>Hair Accessories,1000.0,240.0,300.0,true,HACEEVDMZZ4SFTHF,HACEEVDMZZ4SFTHF
Flipkart,,GalexiaR Blue Bow Fork Style Maker Insert Tuck Comb For Bun(Blue),"Great for medium to long hair,will hold your hair very well all the day.Style statement new fashion hair accessory can be wear with any casual dressing.",GalexiaR,http://dl.flipkart.com/dl/galexiar-blue-bow-fork-style-maker-insert-tuck-comb-bun/p/itmee47mzj7rmhnt?pid=HACEE47MRYVPEZYE&affid=siddarthk,http://img.fkcdn.com/image/hair-accessory/z/y/e/hp0057-1-galexiar-bun-blue-bow-fork-style-maker-insert-tuck-comb-200x200-imaee2nbz7vfhgxj.jpeg,Health and Beauty>Hair Care>Hair Care Accessories>Hair Accessories,289.0,159.0,159.0,false,HACEE47MRYVPEZYE,HACEE47MRYVPEZYE
Flipkart,,AirFlow 30 Second Style Hair Extension,"Add length, fullness color and highlights to your hair easily with a ponytail hairpiece addition.They attach in just seconds, giving you an instant new look that will leave them wondering how you did it.It is a long length synthetic clip-on ponytail hairpiece with layered effects and out curls.It features a 2-in-1 attachment, and can be attached to your hair quickly and easily by claw clip. Features: Length: Long, 22inchTexture: Wavy/Out-CurlsFiber: SyntheticType: Ponytails2 in 1 hairstyleThe quality of top grade quality synthetic hair is fabulous, second only to human hairIt can be treated as your own hairThe lifespan of Top Grade Quality synthetic hair ranges from 2-4 years depending on careThey are Top Grade Quality Swiss FiberIt feels smooth and it’s easy to comb; almost the same as human hair and suitable for daily wearEasy to use and low maintenanceAffordable",AirFlow,http://dl.flipkart.com/dl/airflow-30-second-style-hair-extension/p/itmee7zfwybkrttq?pid=HAEEE7ZFKZ9YGKJ6&affid=siddarthk,http://img.fkcdn.com/image/hair-extension/c/z/d/aqp7-1-airfine-pony-30-second-style-200x200-imaee4kgsbc8zzn4.jpeg,Health and Beauty>Hair Care>Hair Care Accessories>Hair Extensions,1649.0,899.0,899.0,true,HAEEE7ZFKZ9YGKJ6,HAEEE7ZFKZ9YGKJ6
Flipkart,,AirFlow 30 Second Style Hair Extension,,AirFlow,http://dl.flipkart.com/dl/airflow-30-second-style-hair-extension/p/itmee7zfhrjhvu8p?pid=HAEEE7ZF65JP5RMX&affid=siddarthk,http://img.fkcdn.com/image/hair-extension/k/t/j/aqp-28-1-airflow-pony-30-second-style-200x200-imaee4kpd623pyzh.jpeg,Health and Beauty>Hair Care>Hair Care Accessories>Hair Extensions,1649.0,899.0,899.0,true,HAEEE7ZF65JP5RMX,HAEEE7ZF65JP5RMX
Flipkart,,AirFlow 30 Second Style Hair Extension,"Add length, fullness color and highlights to your hair easily with a ponytail hairpiece addition.They attach in just seconds, giving you an instant new look that will leave them wondering how you did it.It is a long length synthetic clip-on ponytail hairpiece with layered effects and out curls.It features a 2-in-1 attachment, and can be attached to your hair quickly and easily by claw clip. Features: Length: Long, 22inchTexture: Wavy/Out-CurlsFiber: SyntheticType: Ponytails2 in 1 hairstyleThe quality of top grade quality synthetic hair is fabulous, second only to human hairIt can be treated as your own hairThe lifespan of Top Grade Quality synthetic hair ranges from 2-4 years depending on careThey are Top Grade Quality Swiss FiberIt feels smooth and it’s easy to comb; almost the same as human hair and suitable for daily wearEasy to use and low maintenanceAffordable",AirFlow,http://dl.flipkart.com/dl/airflow-30-second-style-hair-extension/p/itmee3rmpvjstxyk?pid=HAEEE3RMQBBCZTNA&affid=siddarthk,http://img.fkcdn.com/image/hair-extension/2/z/y/aqp-222-1-airfine-pony-30-second-style-200x200-imaee4keqa84nduf.jpeg,Health and Beauty>Hair Care>Hair Care Accessories>Hair Extensions,2499.0,675.0,675.0,true,HAEEE3RMQBBCZTNA,HAEEE3RMQBBCZTNA
Flipkart,,Unimark Remedies comfart Non-electric 2 L Hot Water Bag(Pink),,Unimark Remedies,http://dl.flipkart.com/dl/unimark-remedies-comfart-non-electric-2-l-hot-water-bag/p/itmee2htnjqcsv6f?pid=HWBEE2HTWQFKN26T&affid=siddarthk,http://img.fkcdn.com/image/hot-water-bag/2/6/t/1212-2-unimark-remedies-non-electric-comfart-200x200-imaeefcsydzrbjzg.jpeg,Health and Beauty>Health Care>Medicines & Treatment,250.0,199.0,199.0,true,HWBEE2HTWQFKN26T,HWBEE2HTWQFKN26T
Flipkart,,Ibaadat water Bag Electric 0.5 L Hot Water Bag(Blue),,Ibaadat,http://dl.flipkart.com/dl/ibaadat-water-bag-electric-0-5-l-hot/p/itmeejnv2rv2xsgw?pid=HWBEEJNVJMYZGTFA&affid=siddarthk,http://img.fkcdn.com/image/hot-water-bag/t/f/a/012-0-5-ibaadat-electricl-water-bag-200x200-imaedcswumtphzge.jpeg,Health and Beauty>Health Care>Medicines & Treatment,641.0,239.0,239.0,true,HWBEEJNVJMYZGTFA,HWBEEJNVJMYZGTFA
Flipkart,,Bodystat BS 1500 Body Fat Analyzer,"BODYSTAT 1500 Body Composition Analyser includes Bioelectrical Impedance Unit BS 1500-1; with standard accessories- Leadwires- 1 pair ;100 Disposable Short electrodes(25 tests);Calibrator; Comprehensive Users Guide; Duracell batteries AA (6); Pictorial Quick guide; 12 months Parts & labour Warranty on a return to Factory basis ( excludes Lead wires)Increasingly used by Gyms, Fitness centres.Personal trainers find this Portable, Handheld device a great option to keep a trend on their Clients' fitness levels because of its great Accuracy.",Bodystat,http://dl.flipkart.com/dl/bodystat-bs-1500-body-fat-analyzer/p/itmedknyuwbqkzuw?pid=BFAEDKNY5DWRQCEG&affid=siddarthk,http://img.fkcdn.com/image/body-fat-analyzer/c/e/g/bodystat-bs-1500-200x200-imaedhabxvyxyjxm.jpeg,Electronics>Health and Personal Care>Health Care>Body Fat Analyzers,157800.0,157800.0,157800.0,true,BFAEDKNY5DWRQCEG,BFAEDKNY5DWRQCEG
Flipkart,,Naturence Harbal Fruit Care(100 g),"This fruit care glow pack from Naturence Harbal is a natural product that rejuvenate the skin in no time. It helps keep pimples and blemishes at bay through your twenties while giving you that perfect clear skin glow. It helps neutralise free radicals caused by daily aggressions. Enriched with natural components, it helps stimulate the cells to strengthen skin barrier for optimal hydration. It helps skin to appear softer, smoother, brighter, more elastic and energetic. A perfect treatment for dull and lifeless skin, this one is simply worth it.",Naturence Harbal,http://dl.flipkart.com/dl/naturence-harbal-fruit-care/p/itmee3xfxgmfuh2s?pid=FCPEE3XFFYEAUYA8&affid=siddarthk,http://img.fkcdn.com/image/face-pack/y/a/8/naturence-harbal-100-fruit-care-200x200-imaee5qjsc9nzbqq.jpeg,Health and Beauty>Body and Skin Care>Face Care>Face Packs,680.0,670.0,670.0,true,FCPEE3XFFYEAUYA8,FCPEE3XFFYEAUYA8
Flipkart,,Hansaplast My Handy Kit First Aid Tape(Pack of 2),"Small cuts and bruises are a common phenomenon amongst chidren. The tendency of a child to get hurt is very and that is precisely what makes the Hansaplast My Handy Kit a quintessential product for each child to have it in his/her school bag. To ensure ease & convenience of usage of first aid by every one and to enable kids in attending the cuts and minor wounds by themselves, the Handy Kit is equipped with pre-cut and individually packed disinfectant swabs, cotton cum gauze pad, qauze roll, binding tape and Hansaplast plasters. This First Aid Kit enables the user in protecting at least 12 to 14 cuts and minor wounds without any hassle of usage. The First Aid Kit comes in 12 exciting collectible printed boxes.Content:Disinfectant swabsCotton cum Gauze PadGauze rollBinding TapeHansaplast plasters",Hansaplast,http://dl.flipkart.com/dl/hansaplast-my-handy-kit-first-aid-tape/p/itmee4fmsryqzxaz?pid=FAPEE4FMPSBYGK9T&affid=siddarthk,http://img.fkcdn.com/image/first-aid-tape/k/9/t/hansaplast-my-handy-kit-200x200-imaee3eggfxznmmn.jpeg,Health and Beauty>Health Care>Medicines & Treatment>First Aid Tapes,160.0,160.0,160.0,true,FAPEE4FMPSBYGK9T,FAPEE4FMPSBYGK9T
Flipkart,,Bath & Body Works BOURBON STRAWBERRY & VANILLA(236 ml),,Bath & Body Works,http://dl.flipkart.com/dl/bath-body-works-bourbon-strawberry-vanilla/p/itmeejpzfez5aehk?pid=MSCEEJPZYMC9HKYA&affid=siddarthk,http://img.fkcdn.com/image/moisturizer-cream/k/y/a/bath-and-body-works-236-bourbon-strawberry-vanilla-200x200-imaeej36fmb9dgxh.jpeg,Health and Beauty>Mens Grooming>Body and Skin Care>Moisturizers and Creams,1100.0,999.0,999.0,false,MSCEEJPZYMC9HKYA,MSCEEJPZYMC9HKYA
Flipkart,,Dirty Works Shea Body Butter,,Dirty Works,http://dl.flipkart.com/dl/dirty-works-shea-body-butter/p/itmeds9ag3wehecw?pid=MSCEDS9AGSXCSWT7&affid=siddarthk,http://img.fkcdn.com/image/moisturizer-cream/w/w/y/dirty-works-300-shea-you-care-body-butter-200x200-imaedqd8jwhub9kp.jpeg,Health and Beauty,750.0,750.0,750.0,true,MSCEDS9AGSXCSWT7,MSCEDS9AGSXCSWT7
Flipkart,,VASELINE INTENSIVE CARE ALOE SOOTHE(400 ml),,VASELINE,http://dl.flipkart.com/dl/vaseline-intensive-care-aloe-soothe/p/itmed8hvcpr3gr8h?pid=MSCEEJPZTHU7PDFT&affid=siddarthk,http://img.fkcdn.com/image/moisturizer-cream/d/f/t/vaseline-400-intensive-care-aloe-soothe-200x200-imaeekdpczxjkgnm.jpeg,Health and Beauty>Mens Grooming>Body and Skin Care>Moisturizers and Creams,449.0,414.0,414.0,false,MSCEEJPZTHU7PDFT,MSCEEJPZTHU7PDFT
Flipkart,,Patanjali Anti Wrinkle Cream(100 g),"Removes Dryness, Wrinkle, Dark Spots",Patanjali,http://dl.flipkart.com/dl/patanjali-anti-wrinkle-cream/p/itmeegqtng9czpux?pid=ATAEEGQTEJFY4XCH&affid=siddarthk,http://img.fkcdn.com/image/anti-ageing/x/c/h/patanjali-100-anti-wrinkle-cream-200x200-imaeedzavyyp7vg9.jpeg,Health and Beauty>Body and Skin Care>Face Care>Anti Ageing,300.0,300.0,300.0,false,ATAEEGQTEJFY4XCH,ATAEEGQTEJFY4XCH
Flipkart,,Herbline Firm Skin Cream,A rich and very special blend of powerful herb extracts helps in skin tightening and stretches away wrinkles. A night care cream for extra dry and mature skin.,Herbline,http://dl.flipkart.com/dl/herbline-firm-skin-cream/p/itmee3w5hgb6ezmq?pid=ATAEE3W5RZYNWNFE&affid=siddarthk,http://img.fkcdn.com/image/anti-ageing/n/f/e/herbline-50-firm-skin-cream-200x200-imaee3egpgyyayh4.jpeg,Health and Beauty>Body and Skin Care>Face Care>Anti Ageing,185.0,166.0,166.0,true,ATAEE3W5RZYNWNFE,ATAEE3W5RZYNWNFE
Flipkart,,Dirty Works Dark Circle Cream,,Dirty Works,http://dl.flipkart.com/dl/dirty-works-dark-circle-cream/p/itmeds9abymtejdb?pid=ATAEDS9AHWRFSYFX&affid=siddarthk,http://img.fkcdn.com/image/anti-ageing/y/f/x/dirty-works-4-5-dark-circle-cream-200x200-imaedqcf2dh6b2vx.jpeg,Health and Beauty>Body and Skin Care>Face Care>Anti Ageing,750.0,750.0,750.0,false,ATAEDS9AHWRFSYFX,ATAEDS9AHWRFSYFX
Flipkart,,Beauty Of Life 3 Pairs Criss-Cross Eyelashes Value Pack,3 Pairs Criss-Cross False Eyelashes with Eyelash Adhesive,Beauty Of Life,http://dl.flipkart.com/dl/beauty-life-3-pairs-criss-cross-eyelashes-value-pack/p/itmedm44des4mchh?pid=FLSEDM44MK5BXNYH&affid=siddarthk,http://img.fkcdn.com/image/false-eyelash/n/y/h/3-fel3-3-beauty-of-life-3-pairs-criss-cross-eyelashes-value-pack-200x200-imaedhzwykgbfgzt.jpeg,Health and Beauty>Beauty Accessories>Makeup Accessories>False Eyelashes,2598.0,499.0,499.0,false,FLSEDM44MK5BXNYH,FLSEDM44MK5BXNYH
Flipkart,,Beauty Of Life Natural looking Criss-Cross False Eyelashes,Natural looking criss-cross false eyelashes. No glue included.,Beauty Of Life,http://dl.flipkart.com/dl/beauty-life-natural-looking-criss-cross-false-eyelashes/p/itmedst6ze3ryhgn?pid=FLSEDST69VPVAYQZ&affid=siddarthk,http://img.fkcdn.com/image/false-eyelash/y/q/z/2-fel014-beauty-of-life-natural-looking-criss-cross-false-200x200-imaedrmkun7w9zsg.jpeg,Health and Beauty>Beauty Accessories>Makeup Accessories>False Eyelashes,649.0,149.0,149.0,false,FLSEDST69VPVAYQZ,FLSEDST69VPVAYQZ
Flipkart,,Beauty Of Life Criss-Cross Natural Looking False Eyelashes,Beautiful criss-cross natural looking false eyelashes. No Glue included.,Beauty Of Life,http://dl.flipkart.com/dl/beauty-life-criss-cross-natural-looking-false-eyelashes/p/itmedxnpdtvbspbn?pid=FLSEDXNPW5ZH75ZT&affid=siddarthk,http://img.fkcdn.com/image/false-eyelash/5/z/t/2-013-beauty-of-life-criss-cross-natural-looking-false-eyelashes-200x200-imaedwvxnhwhaahq.jpeg,Health and Beauty>Beauty Accessories>Makeup Accessories>False Eyelashes,499.0,125.0,125.0,false,FLSEDXNPW5ZH75ZT,FLSEDXNPW5ZH75ZT
Flipkart,,"Beauty Of Life 3 Pair Clubbing,Full Looking False Eyelashes With Glue","High quality Full looking Clubbing False eyelashes, combo pack of 3 pair false eyelashes and eyelash glue",Beauty Of Life,http://dl.flipkart.com/dl/beauty-life-3-pair-clubbing-full-looking-false-eyelashes-glue/p/itmedm58qhajjqw8?pid=FLSEDM587U4SJEPD&affid=siddarthk,http://img.fkcdn.com/image/false-eyelash/e/p/d/3-fel3-4-beauty-of-life-3-pair-clubbing-full-looking-false-200x200-imaedmyakwzxq3sq.jpeg,Health and Beauty>Beauty Accessories>Makeup Accessories>False Eyelashes,2598.0,499.0,499.0,false,FLSEDM587U4SJEPD,FLSEDM587U4SJEPD
Flipkart,,Beauty Of Life Criss Cross Shape Clubbing False Eyelashes,Full heavy looking party and Clubbing false eyelashes,Beauty Of Life,http://dl.flipkart.com/dl/beauty-life-criss-cross-shape-clubbing-false-eyelashes/p/itmedrph7ggphwgj?pid=FLSEDRPHCYU7RE3G&affid=siddarthk,http://img.fkcdn.com/image/false-eyelash/e/3/g/2-023-beauty-of-life-criss-cross-shape-clubbing-false-eyelashes-200x200-imaedrm8zb7pfcb4.jpeg,Health and Beauty>Beauty Accessories>Makeup Accessories>False Eyelashes,599.0,125.0,125.0,false,FLSEDRPHCYU7RE3G,FLSEDRPHCYU7RE3G
Flipkart,,Olivia Herbal Hair Removing Cream (Pack of 2),This exotic hair remover is available in a cream formulation with a soothing lemon fragrance Have a soft and smooth skin like never before by using this excellent hair remover made of lemon and Aloe Vera Aloe Vera has exceptional skin benefits that moisturize the skin without any greasy feel and prevents skin dryness significantly It has wonderful nutritional qualities and antioxidant properties that help your skin to heal quickly It has anti-inflammatory properties that help in reducing skin inflammation and heals the skin quickly and naturally with minimal scarring Lemon has high nutritional value that benefits your skin by removal of toxins from your body It contains citric acid that fades spots gradually and evens your skin tone,Olivia,http://dl.flipkart.com/dl/olivia-herbal-hair-removing-cream-pack-2/p/itmeemn72wdehgvr?pid=HRMEEMN7HFSFZXHQ&affid=siddarthk,http://img.fkcdn.com/image/hair-removal/x/h/q/olivia-120-herbal-hair-removing-cream-pack-of-2-200x200-imaeemjccqkeuhfx.jpeg,Health and Beauty>Body and Skin Care>Body Care>Hair Removal,170.0,156.0,156.0,false,HRMEEMN7HFSFZXHQ,HRMEEMN7HFSFZXHQ
Flipkart,,Mistine Clear Skin Hair Remover Cream(50 g),"Product Description:Mistine Clear Skin Hair Remover Cream Has Ingredients Which Include Portulaca Extract, Gymnema Sylvestre Leaf Extract, Hentowhite And Almond Oil. It Is A New Product Introduced In About July 2015. The Net Weight Is 50 G.- Portulaca Extract And Acetyl Tetrapeptide-15. Helps Prevent Skin Irritation, Even On Sensitive Skin.- Gymnema Sylvestre Leaf Extract And Mushroom Extract. Smooth Skin Look Better.- Hentowhite And Niacinamide Gives Skin Smooth Consistency.- Almond Oil To Help Restore Moisture To The Skin. Helps Keep Skin Smooth And Healthy. For Radiant Skin Smooth ConsistencyDirections:1. Apply A Thin Spread Over 5-10 Minutes.2. Using A Spatula Or A Sponge To Wipe The Cream Off.3. Then Rinse With Clean Water.",Mistine,http://dl.flipkart.com/dl/mistine-clear-skin-hair-remover-cream/p/itmeek2rwmhv8mdk?pid=HRMEEK2RKCATZ8UA&affid=siddarthk,http://img.fkcdn.com/image/hair-removal/8/u/a/mistine-50-clear-skin-hair-remover-cream-200x200-imaecvgmrwsut2ym.jpeg,Health and Beauty>Body and Skin Care>Body Care>Hair Removal,2000.0,700.0,700.0,true,HRMEEK2RKCATZ8UA,HRMEEK2RKCATZ8UA
Flipkart,,Rythmx Purple Lipstick 35 4 g(Shade - 535),,Rythmx,http://dl.flipkart.com/dl/rythmx-purple-lipstick-35-4-g/p/itmeegnr4yhefaj6?pid=LSKEEGNRZWHGSPJM&affid=siddarthk,http://img.fkcdn.com/image/lipstick/p/j/m/rythmx-4-purple-lipstick-35-200x200-imaeeab6xwjemkwb.jpeg,Health and Beauty>Makeup>Lips>Lipsticks,300.0,191.0,213.0,true,LSKEEGNRZWHGSPJM,LSKEEGNRZWHGSPJM
Flipkart,,Color Fever Bomb Matte Lipstick 13-14-15 12 g,"Lip Bomb is the lipstick the world is talking about. Try it and you will know why. The secret to gorgeous lips is secret no more! The refreshingly tingly Lip Bomb comes in 24 captivating shades. Ranging from reds to browns and pinks, Lip Bomb is here to complement and brighten Indian skin tones. Now you really have no excuse to wear the same shade, all day every day. more more close close Lip Bomb is:,Ultra Long Wear Super Smooth & Soft, Not Animal Tested, Has no Animal Ingredients Along with over 25%* increase in plumpness, Lip Bomb does so much more ,Reduces fine lines, Retexturises lips,Provides deeper hydration,Defines the lip contours ��� Protects against UVA & UVB rays. Contains SPF 15",Color Fever,http://dl.flipkart.com/dl/color-fever-bomb-matte-lipstick-13-14-15-12-g/p/itmed3yqbvxnzazg?pid=LSKED3YQZQ5ZKRPD&affid=siddarthk,http://img.fkcdn.com/image/lipstick/r/p/d/color-fever-12-bomb-matte-lipstick-13-14-15-200x200-imaed2yvtmugtr7f.jpeg,Health and Beauty>Makeup>Lips>Lipsticks,1197.0,527.0,527.0,true,LSKED3YQZQ5ZKRPD,LSKED3YQZQ5ZKRPD
