PartnerName,Id,Title,Description,Brand,Link,ImageLink,CategoryName,Mrp,OfferPrice,EffectivePrice,Availability,PartnerIdFromUrl,PartnerIdFromDb
Flipkart,,Natures Aloe Vera Moisturising Beauty Gel(100 g),,Natures,http://dl.flipkart.com/dl/natures-aloe-vera-moisturising-beauty-gel/p/itmengpvasqmbk6n?pid=MSCENGPSYCVX5FGR&affid=siddarthk,http://img.fkcdn.com/image/moisturizer-cream/f/g/r/natures-100-aloe-vera-moisturising-beauty-gel-200x200-imaen7e6cwtzng2v.jpeg,Health and Beauty>Body and Skin Care>Face Care>Moisturizers and Creams,170.0,170.0,170.0,true,MSCENGPSYCVX5FGR,MSCENGPSYCVX5FGR
Flipkart,,Olay Moisturizing Cream(100 g),"The Olay Story A brainchild of a chemist, Olay was born out of love and was Graham Wulff’s gift to his doting wife. Graham wanted to create a new beauty product that would leave his wife’s skin nourished and moisturized without leaving a greasy feel. Graham and Dinah started an extensive research and finally created the legendary Oil of Olay Beauty Fluid. Today, Olay is a well-known and trusted brand that promises the dainty ladies healthy and beautiful skin. Olay delivers products that are safe for its customers by ensuring that each product manufactured undergoes a thorough quality test. Celebrate beauty and pamper your skin with Olay. Olay Moisturizing Cream Moisturizing Cream from Olay not only replenishes your skin but also provides intense nourishment and moisturization for up to 12 hours. The active formula smoothens lines and wrinkles on your face while softening your dry skin. Claim Enriched with active ingredients, this cream provides moisturization to achieve a younger-looking skin. Features and Benefits - This moisturizing cream has a special moisture binding system that instantly locks in essential moisture to leave your skin feeling soft and supple. - Olay Moisturizing Cream contains fluids are similar to the natural elements present in the skin and hence is both effective and safe. Directions Gently apply a small amount of this cream on both face and neck twice in a day for better results. Ingredients This Moisturizing Cream is a perfect blend of glycerin and mineral oil combined with water, cetyl alcohol, petrolatum, cyclopentasiloxane, stearyl alcohol, isopropyl palmitate, carbomer, dimethicone, sodium hydroxide, PEG-100 stearate, stearic acid, fragrance, methylparaben, PEG/PPG-20/20 dimethicone, titanium dioxide, imidazolidinyl urea, propylparaben, disodium EDTA, benzyl benzoate, alpha-isomethyl ionone, citronellol, linalool, amyl cinnamal and CI 17200 to give you soft and supple skin.    ",Olay,http://dl.flipkart.com/dl/olay-moisturizing-cream/p/itmdmhqf4z5bypyy?pid=MSCDMHQYHNJFEHMP&affid=siddarthk,http://img.fkcdn.com/image/moisturizer-cream/h/m/p/olay-100-moisturizing-cream-200x200-imaeh9drejqpagks.jpeg,Health and Beauty>Body and Skin Care>Body Care>Moisturizers and Creams,440.0,440.0,440.0,true,MSCDMHQYHNJFEHMP,MSCDMHQYHNJFEHMP
Flipkart,,Jergens Jergens Ultra Healing Extra Dry Skin Moisturizer Nourishes & Heals(621 ml),"Increase the beauty of your body with intense nourishment and moisturization offered by this Ultra Healing Extra Dry Skin Moisturizer from Jergens. A Deeply Hydrating Moisturizer Enriched with a naturally organic formulation, this body lotion acts as a deeply hydrating moisturizer for your dry skin. Specially-created Formula with Vitamin 3 Complex This Jergens Ultra Healing Extra Dry Skin Moisturizer is specially formulated with the goodness of Vitamin 3 complex to feed your skin with rich nourishment. Heals Dryness at the Source and Locks in Moisture for 24 hours The Jergens Ultra Healing Extra Dry Skin Moisturizer Nourishes and Heals lotion blends with your skin to heal dryness at the source and retains the moisture level for up to 24 hours.",Jergens,http://dl.flipkart.com/dl/jergens-ultra-healing-extra-dry-skin-moisturizer-nourishes-heals/p/itmey7fxvg7bea7y?pid=MSCD93YTCHUG8GYR&affid=siddarthk,http://img.fkcdn.com/image/moisturizer-cream/g/y/r/jergens-621-jergens-ultra-healing-extra-dry-skin-moisturizer-200x200-imaebvmgbuhjudeb.jpeg,Health and Beauty>Mens Grooming>Body and Skin Care>Moisturizers and Creams,549.0,495.0,495.0,true,MSCD93YTCHUG8GYR,MSCD93YTCHUG8GYR
Flipkart,,Dove Beauty Cream(74 ml),"Dove Beauty Cream 74ml Dove Beauty Cream is for complete daily skin care. Moisture is the key to beautiful skin and new Dove beauty cream with its light and nourishing moisture formula keeps your skin feeling soft and smooth during and after application. Use it regularly, day and night to keep your skin feeling beautiful.",Dove,http://dl.flipkart.com/dl/dove-beauty-cream/p/itmeexcygesjmrt2?pid=MSCEM3E2E8KAQWQH&affid=siddarthk,http://img.fkcdn.com/image/moisturizer-cream/w/q/h/dove-74-beauty-cream-200x200-imaehcj8dnmysngu.jpeg,Health and Beauty>Mens Grooming>Body and Skin Care>Moisturizers and Creams,950.0,599.0,599.0,true,MSCEM3E2E8KAQWQH,MSCEM3E2E8KAQWQH
Flipkart,,Oriflame Sweden Giordani Gold CC Cream SPF 35- Light(40 ml),All-in-one make-up/skincare solution with unique combination of lightweight texture and lasting medium coverage make-up. With Patented Anti-Ageing Brightening Technology to improve skin’s clarity and luminosity. SPF 35. UVA/UVB filters.,Oriflame Sweden,http://dl.flipkart.com/dl/oriflame-sweden-giordani-gold-cc-cream-spf-35-light/p/itmemqv6hhy4vp4s?pid=MSCEMQV6GVDMYNRN&affid=siddarthk,http://img.fkcdn.com/image/moisturizer-cream/g/e/z/oriflame-sweden-40-giordani-gold-cc-cream-spf-35-natrual-200x200-imaemqrhmdzpgrqc.jpeg,Health and Beauty>Body and Skin Care>Face Care>Moisturizers and Creams,999.0,590.0,590.0,false,MSCEMQV6GVDMYNRN,MSCEMQV6GVDMYNRN
Flipkart,,Lotus HERBALS NUTRAMOIST� Skin Renewal Daily Moisturising Creme SPF-25(50 g),"The goodness of cherry and plum will nourish your skin in a unique way, as Lotus Herbals comes with Nutramoist Skin Renewal Daily Moisturizing Cream. For all those men and women looking for the right product to protect your skin, this moisturizing skin could be your spt choice. The Lotus Herbals Nutramoist Skin Renewal Daily Moisturizing Cream is enriched with cherry, plum and grape extract. Also, the plum extract will nourish your skin and enhance the elasticity. Besides moisturizing your skin, this cream will protect your skin from tanning. With the non-greasy texture this Daily Moisturizing Cream has, you can ensure it not to make your face look oily. You need not worry if this Daily Moisturizing Cream suits your skin, as its suits all skin types. You can apply this Lotus Herbals Cream and go out for a beach party not worrying about your skin getting tanned, as this cream is a great sunscreen. Directions for Use Take an adequate amount of this cream onto your palm. Gently spread on your face. Can be used during the day.",Lotus,http://dl.flipkart.com/dl/lotus-herbals-nutramoist-skin-renewal-daily-moisturising-creme-spf-25/p/itmeza3xrsznk5wg?pid=MSCD93YTFBDWSQYR&affid=siddarthk,http://img.fkcdn.com/image/moisturizer-cream/q/y/r/lotus-50-herbals-nutramoist-skin-renewal-daily-moisturising-200x200-imaeza444dsgerzw.jpeg,Health and Beauty>Mens Grooming>Body and Skin Care>Moisturizers and Creams,395.0,329.0,366.0,false,MSCD93YTFBDWSQYR,MSCD93YTFBDWSQYR
Flipkart,,Bhumija Lifesiences GLYSHINE(200 g),,Bhumija Lifesiences,http://dl.flipkart.com/dl/bhumija-lifesiences-glyshine/p/itmez672tgtzt4hn?pid=MSCEZ672KSADASJQ&affid=siddarthk,http://img.fkcdn.com/image/moisturizer-cream/s/j/q/bhumija-lifesiences-200-glyshine-original-imaez2ez2dr7x2zj.jpeg,Health and Beauty>Mens Grooming>Body and Skin Care>Moisturizers and Creams,499.0,499.0,499.0,true,MSCEZ672KSADASJQ,MSCEZ672KSADASJQ
Flipkart,,Avon Hydra Radiance Replenishing Cream(50 g),"This light-weight hydrating cream replenishes dry, flaky skin for a healthy dewy look. Formulated exclusively with Ulex Europaeus Extract, it is superior in enhancing skin hydration.",Avon,http://dl.flipkart.com/dl/avon-hydra-radiance-replenishing-cream/p/itme55k7kqx7fkgh?pid=MSCE55K7ZGR7FJ5Z&affid=siddarthk,http://img.fkcdn.com/image/moisturizer-cream/j/5/z/avon-50-hydra-radiance-replenishing-cream-200x200-imae55efgqxpqb5g.jpeg,Health and Beauty>Mens Grooming>Body and Skin Care>Moisturizers and Creams,469.0,410.0,410.0,true,MSCE55K7ZGR7FJ5Z,MSCE55K7ZGR7FJ5Z
Flipkart,,Sebamed Clear Face Care Gel(50 ml),"It is beneficial for its gentle, yet deep cleansing action that partners to fight against pimples, blackheads and other impurities.Oil free and very lightLeaves the skin smooth",Sebamed,http://dl.flipkart.com/dl/sebamed-clear-face-care-gel/p/itmeyw2nemy9pwag?pid=MSCEYW2NMSXGWH8J&affid=siddarthk,http://img.fkcdn.com/image/moisturizer-cream/h/8/j/sebamed-50-clear-face-care-gel-200x200-imaefgyryvdqhvr8.jpeg,Health and Beauty>Body and Skin Care>Face Care>Moisturizers and Creams,500.0,500.0,500.0,true,MSCEYW2NMSXGWH8J,MSCEYW2NMSXGWH8J
Flipkart,,Plum Green Tea Mattifying Moisturizer(50 ml),,Plum,http://dl.flipkart.com/dl/plum-green-tea-mattifying-moisturizer/p/itme2fk8sfhv6zpm?pid=MSCE2FK8MZV5ZRNX&affid=siddarthk,http://img.fkcdn.com/image/moisturizer-cream/r/n/x/plum-50-green-tea-mattifying-moisturizer-200x200-imae2ewzucerdzqh.jpeg,Health and Beauty>Body and Skin Care>Face Care>Moisturizers and Creams,450.0,450.0,450.0,true,MSCE2FK8MZV5ZRNX,MSCE2FK8MZV5ZRNX
Flipkart,,OxyGlow Oryza Veg Peel The Natural Healer(100 g),,OxyGlow,http://dl.flipkart.com/dl/oxyglow-oryza-veg-peel-natural-healer/p/itmez93yzyrhhhzy?pid=MSCEZ93YKFPS6YYV&affid=siddarthk,http://img.fkcdn.com/image/moisturizer-cream/y/y/v/oxyglow-100-oryza-veg-peel-the-natural-healer-200x200-imaez9y6qbyff2yv.jpeg,Health and Beauty>Body and Skin Care>Face Care>Moisturizers and Creams,290.0,290.0,290.0,true,MSCEZ93YKFPS6YYV,MSCEZ93YKFPS6YYV
Flipkart,,OxyGlow Intensive Moisturising Lotion(200 ml),,OxyGlow,http://dl.flipkart.com/dl/oxyglow-intensive-moisturising-lotion/p/itmej4tc5fzthyhu?pid=MSCEZA3GMWYQHVGN&affid=siddarthk,http://img.fkcdn.com/image/moisturizer-cream/v/g/n/oxyglow-200-intensive-moisturising-lotion-200x200-imaez9yrxsyjmprw.jpeg,Health and Beauty>Body and Skin Care>Body Care>Moisturizers and Creams,295.0,295.0,295.0,true,MSCEZA3GMWYQHVGN,MSCEZA3GMWYQHVGN
Flipkart,,Secret Blendz Multi Purpose Gel(100 g),,Secret Blendz,http://dl.flipkart.com/dl/secret-blendz-multi-purpose-gel/p/itmezfxykn7hgkqe?pid=MSCEZFXYXGME38S6&affid=siddarthk,http://img.fkcdn.com/image/moisturizer-cream/8/s/6/secret-blendz-100-multi-purpose-gel-200x200-imaezfvqnqpsmcxq.jpeg,Health and Beauty>Body and Skin Care>Face Care>Moisturizers and Creams,180.0,180.0,180.0,true,MSCEZFXYXGME38S6,MSCEZFXYXGME38S6
Flipkart,,Glenmark Elovera Imf Cream 50gm(50 g),,Glenmark,http://dl.flipkart.com/dl/glenmark-elovera-imf-cream-50gm/p/itmedaz48qchtjgb?pid=MSCEDAZ4FTBZHKTT&affid=siddarthk,http://img.fkcdn.com/image/moisturizer-cream/k/t/t/glenmark-50-elovera-imf-cream-50gm-200x200-imaedak5bubw5bf3.jpeg,Health and Beauty,200.0,199.0,199.0,true,MSCEDAZ4FTBZHKTT,MSCEDAZ4FTBZHKTT
Flipkart,,Dionis Lotion Blue Ridge Wildflower(240 ml),"Dionis fans everywhere rave about our signature hand and body lotion. Infused with wholesome goats milk, it soothes dry skin with restorative proteins, vitamins and minerals. This special formulation absorbs readily into the skin and is ideal for every day use. Available in: Unscented, Vanilla Bean, Shenandoah Rose, Virginia Hyacinth, Blue Ridge Wildflower, Love, Sugar Hollow Spice, Cucumber Mint, Elderberry Quince & Hawthorn Witch Hazel",Dionis,http://dl.flipkart.com/dl/dionis-lotion-blue-ridge-wildflower/p/itmee4ghwufyyr4z?pid=MSCEE4GHBQGHSU4F&affid=siddarthk,http://img.fkcdn.com/image/moisturizer-cream/u/4/f/dionis-7200-lotion-blue-ridge-wildflower-200x200-imaee88rykfgybzt.jpeg,Baby Care>Grooming>Lotions & Creams,3446.0,3101.0,3446.0,true,MSCEE4GHBQGHSU4F,MSCEE4GHBQGHSU4F
Flipkart,,"Bath & Body Works Lot of 3 Aromatherapy Eucalyptus Spearmint Stress Relief Body Cream (Eucalyptus Spearmint), each(240 ml)",Lot of 3 Bath & Body Works Eucalyptus Spearmint Stress Relief Body Cream 8 fl oz each- The perfect way to relax and think clearly after a long days work. Made with Eucalyptus and spearmint essential oils to relax and uplift you. Absorbs quickly and provides hours of moisturization.,Bath & Body Works,http://dl.flipkart.com/dl/bath-body-works-lot-3-aromatherapy-eucalyptus-spearmint-stress-relief-cream-eucalyptus-spearmint-each/p/itmee4gkpefghu7q?pid=MSCEE4GKVF6HKVHP&affid=siddarthk,http://img.fkcdn.com/image/moisturizer-cream/v/h/p/bath-body-works-7200-lot-of-3-aromatherapy-eucalyptus-spearmint-200x200-imaeebcnbqxkf8za.jpeg,Baby Care>Grooming>Lotions & Creams,6000.0,5346.0,5941.0,true,MSCEE4GKVF6HKVHP,MSCEE4GKVF6HKVHP
Flipkart,,Etude House Moistfull Aloe Lotion(150 ml),"Milk lotion containing enriched Baobab Tree extracts and Organic Aloe, soothes the skin with soft and comfortable wear.",Etude House,http://dl.flipkart.com/dl/etude-house-moistfull-aloe-lotion/p/itmee4ghsdnhawwh?pid=MSCEE4GHC6ZVY8TJ&affid=siddarthk,http://img.fkcdn.com/image/moisturizer-cream/8/t/j/etude-house-150-moistfull-aloe-lotion-200x200-imaee88rmczcggfr.jpeg,Baby Care>Grooming>Lotions & Creams,3381.0,3042.0,3381.0,true,MSCEE4GHC6ZVY8TJ,MSCEE4GHC6ZVY8TJ
Flipkart,,Laneige Free International Shipping + Water Bank Moisture Cream (All Skin / )(50 ml),FREE INTERNATIONAL SHIPPING (8~14 DAYS) WITH TRACKING NUMBER. A 100% ORIGINAL and NEW product. FREE EXPEDITED SHIPPING (3~5 DAYS) ON ORDERS OVER $300 !!! (But Except Special Price Sets! ),Laneige,http://dl.flipkart.com/dl/laneige-free-international-shipping-water-bank-moisture-cream-all-skin/p/itmee4gk6d954f2y?pid=MSCEE4GKZRBGZTZ3&affid=siddarthk,http://img.fkcdn.com/image/moisturizer-cream/t/z/3/laneige-50-free-international-shipping-water-bank-moisture-cream-200x200-imaeebczaushpkua.jpeg,Baby Care>Grooming>Lotions & Creams,5978.0,5380.0,5978.0,true,MSCEE4GKZRBGZTZ3,MSCEE4GKZRBGZTZ3
Flipkart,,selltop15 material girl flirty fruit body lotion(201 ml),"Enrich your skin with this irresistibly hydrating, nourishing Material Girl Body Lotion. Apply all over to hydrate, moisturize and leave skin deliciously scented and super soft.Key Fragrance Notes: Orange Zest, Iced Apple, Red Berry.",selltop15,http://dl.flipkart.com/dl/selltop15-material-girl-flirty-fruit-body-lotion/p/itmee4gkjvkahryz?pid=MSCEE4GKZWFYRTGA&affid=siddarthk,http://img.fkcdn.com/image/moisturizer-cream/t/g/a/selltop15-505-material-girl-flirty-fruit-body-lotion-200x200-imaeebczz2q4ngh6.jpeg,Baby Care>Grooming>Lotions & Creams,2968.0,2671.0,2968.0,true,MSCEE4GKZWFYRTGA,MSCEE4GKZWFYRTGA
Flipkart,,Vaseline Intensive Care advanced Repair Fragrance Free 600 ml(600 ml),,Vaseline,http://dl.flipkart.com/dl/vaseline-intensive-care-advanced-repair-fragrance-free-600-ml/p/itmeduq7vdm639ya?pid=MSCEDUQ7NSTHZZKZ&affid=siddarthk,http://img.fkcdn.com/image/moisturizer-cream/z/k/z/vaseline-600-intensive-care-advanced-repair-fragrance-free-600-200x200-imaedtnvh9n7a9fz.jpeg,Health and Beauty>Mens Grooming>Body and Skin Care>Moisturizers and Creams,1450.0,1199.0,1199.0,true,MSCEDUQ7NSTHZZKZ,MSCEDUQ7NSTHZZKZ
Flipkart,,Alaffia Shea Butter Antioxidant Body Cream(120 ml),"This rich moisturizer combines antioxidant fair trade coffee and teas with our certified fair trade handcrafted shea butter and virgin coconut oil to help protect, hydrate and balance your skin. Aloe and red palm oil protect further from skin damaging free radicals. Recommended for all skin types. Equality-Empowerment-Beauty. These are the three principles that Alaffia follows to not only bring customers the best natural, fair trade skin and hair care, but also to help relieve the cycle of poverty in Togo. Alaffia empowers West African communities to become sustainable through the fair trade of indigenous resources. We encourage empowerment through our community projects, our women's cooperatives, and through education and involvement in our local customer communities. We firmly believe that the cooperation of people across the world is an essential part of building sustainability in all communities.",Alaffia,http://dl.flipkart.com/dl/alaffia-shea-butter-antioxidant-body-cream/p/itmee4ghfrpkyyhj?pid=MSCEE4GHAZG5F4ZY&affid=siddarthk,http://img.fkcdn.com/image/moisturizer-cream/4/z/y/alaffia-3600-shea-butter-antioxidant-body-cream-200x200-imaee88qsrwmhmsb.jpeg,Baby Care>Grooming>Lotions & Creams,2793.0,2421.0,2691.0,true,MSCEE4GHAZG5F4ZY,MSCEE4GHAZG5F4ZY
Flipkart,,Juara Mattefying Moisturizer-Sweet Tea & Ginger(60 ml),,Juara,http://dl.flipkart.com/dl/juara-mattefying-moisturizer-sweet-tea-ginger/p/itmee4ghhwfdhgeq?pid=MSCEE4GHKYYJHRTF&affid=siddarthk,http://img.fkcdn.com/image/moisturizer-cream/r/t/f/juara-1800-mattefying-moisturizer-sweet-tea-ginger-200x200-imaee88xk9hqgynr.jpeg,Baby Care>Grooming>Lotions & Creams,9775.0,2962.0,2962.0,true,MSCEE4GHKYYJHRTF,MSCEE4GHKYYJHRTF
Flipkart,,Silicium Laboratories Silicium Wild Rose(50 ml),"This intensive moisturizer re-establishes the natural balance of the skin at the cellular level by hydrating and favoring the formation of a lipid barrier in the corneous layer of the epidermis. Skin texture is improved and elasticity is increased for healthy, younger-looking skin. Skin immediately becomes ultra smooth and silky to the touch. Silicium Wild Rose Cream supports the synthesis of collagen and elastin, both of which have a firming and tightening action on the skin. This proprietary formula reduces fatigue, diminishes the appearance of fine lines and wrinkles and restores luminosity. Visible results after only one application.",Silicium Laboratories,http://dl.flipkart.com/dl/silicium-laboratories-wild-rose/p/itmee4ghrjcgpsme?pid=MSCEE4GHNXRCGZHN&affid=siddarthk,http://img.fkcdn.com/image/moisturizer-cream/z/h/n/silicium-laboratories-50-silicium-wild-rose-200x200-imaee88nbmdee2hb.jpeg,Baby Care>Grooming>Lotions & Creams,10646.0,9581.0,10646.0,true,MSCEE4GHNXRCGZHN,MSCEE4GHNXRCGZHN
Flipkart,,Olay Age Defying Anti-Wrinkle Targeted Wrinkle Treatment(30 ml),Olay Anti-Wrinkle Targeted Wrinkle Treatment is especially designed for your pronounced wrinkles. Its precision applicator delivers the concentrated formula with anti-wrinkle ingredients exactly where you need them.,Olay,http://dl.flipkart.com/dl/olay-age-defying-anti-wrinkle-targeted-wrinkle-treatment/p/itmee4ghkqfp6svm?pid=MSCEE4GH4XZZZDAA&affid=siddarthk,http://img.fkcdn.com/image/moisturizer-cream/d/a/a/olay-900-age-defying-anti-wrinkle-targeted-wrinkle-treatment-200x200-imaee88nxfwjf4kr.jpeg,Baby Care>Grooming>Lotions & Creams,2200.0,1694.0,1694.0,true,MSCEE4GH4XZZZDAA,MSCEE4GH4XZZZDAA
Flipkart,,Ancient Minerals goodnight magnesium lotion(75 ml),"Ancient Minerals Magnesium Lotion Goodnight is a smooth, quickly absorbed emulsion of magnesium, MSM and melatonin in a skin-nourishing base of certified organic oils. Melatonin is a ubiquitous and powerful free radical scavenger that easily crosses cell membranes, however, production of melatonin is thought to decrease as we age. Rich in plant moisturizers including coconut oil and shea butter, this lotion soothes and hydrates without leaving your skin feeling waxy or greasy. Ancient Minerals Magnesium Lotion Goodnight delivers 3mg melatonin and 25mg elemental magnesium per 1 mL.",Ancient Minerals,http://dl.flipkart.com/dl/ancient-minerals-goodnight-magnesium-lotion/p/itmee4gkggkkyfhs?pid=MSCEE4GKBDBUKDH2&affid=siddarthk,http://img.fkcdn.com/image/moisturizer-cream/d/h/2/ancient-minerals-60-goodnight-magnesium-lotion-200x200-imaeebcjxsdczfep.jpeg,Baby Care>Grooming>Lotions & Creams,4065.0,3399.0,3777.0,true,MSCEE4GKBDBUKDH2,MSCEE4GKBDBUKDH2
Flipkart,,Algenist Targeted Deep Wrinkle Minimizer Women(15 ml),Targeted deep wrinkle minimizer by algenist for women 0.5 oz treatment.,Algenist,http://dl.flipkart.com/dl/algenist-targeted-deep-wrinkle-minimizer-women/p/itmee4ghbd9mmfrc?pid=MSCEE4GHMUEMVEEQ&affid=siddarthk,http://img.fkcdn.com/image/moisturizer-cream/e/e/q/algenist-450-targeted-deep-wrinkle-minimizer-women-200x200-imaee88ybgvj2bdf.jpeg,Baby Care>Grooming>Lotions & Creams,7185.0,6466.0,7185.0,true,MSCEE4GHMUEMVEEQ,MSCEE4GHMUEMVEEQ
Flipkart,,Vaseline Healthy Hands And Nails Lotion(100 ml),Made with keratin and vitamin e.Formulated to bring moisture and softeness back to your hands.Learn more about skin at vaselinecom.,Vaseline,http://dl.flipkart.com/dl/vaseline-healthy-hands-nails-lotion/p/itmegwkzf6nev4hc?pid=MSCEGWKZHZ5SFRAT&affid=siddarthk,http://img.fkcdn.com/image/moisturizer-cream/r/a/t/vaseline-100-healthy-hands-and-nails-lotion-200x200-imaegxx6gd3zqggs.jpeg,Health and Beauty,1916.0,1374.0,1374.0,true,MSCEGWKZHZ5SFRAT,MSCEGWKZHZ5SFRAT
Flipkart,,smellgood Ivory Shea Butter Soft & Creamy(946 ml),"WE HAVE UNREFINED AFRICAN IVORY SHEA BUTTER 32oz (2 POUNDS) AND SUPER FRESH SEE OUR FEEDBACK!! IF YOUR UNHAPPY LET US KNOW WE ARE HERE TO MAKE YOU HAPPY AWESOME PRODUCT INTERNATIONAL ORDERS WELCOME. FRESH IN FROM GHANA ALWAYS SEE OUR OTHER LISTINGS USES OF SHEA BUTTER Shea butter can be used to treat: 1. Dry skin, eczema, infant eczema, Rashes 2. Treats dark spots, stretch mark , burns, lessens the irritation in psoriasis, wrinkles, blemishes, Diaper rash, scars & skin discolorations. 3. Moisturizes and Heals Skin - relieves symptoms of extreme dryness, eczema, dermatitis and skin allergies 4. Anti-inflammatory Properties .Provides Pain relief from swelling and arthritis. 5. In Nigeria, shea butter (popularly called ori in Yoruba) is used for the management of sinusitis and relief of nasal congestion. This is due to its hydrating properties which help in relaxing the tension in the facial skin, thus easing respiration. 6. Improves muscle relaxation and stiffness in joint aches/arthritis. 7. Strengthens Cuticles and Nails 8. Hair conditioner for dry and brittle hair. 9. Used for Chapped lips. 10. Used as a sun blocking lotion. Protects With a Natural Sunscreen (due to its rich content of vitamin E and D).It reduce the effects of UV damage on the skin. Product of Ghana Directly from the Importers !",smellgood,http://dl.flipkart.com/dl/smellgood-ivory-shea-butter-soft-creamy/p/itmee4ghppqchnkk?pid=MSCEE4GHMHETHWVD&affid=siddarthk,http://img.fkcdn.com/image/moisturizer-cream/w/v/d/smellgood-28800-ivory-shea-butter-soft-creamy-200x200-imaee88ytgeqwkqf.jpeg,Baby Care>Grooming>Lotions & Creams,3363.0,3026.0,3363.0,true,MSCEE4GHMHETHWVD,MSCEE4GHMHETHWVD
Flipkart,,Zum Rub Body Moisturizer Tea Tree-Citrus -(75 ml),"The lively, cleansing aroma of tea tree meets tangy citrus.",Zum,http://dl.flipkart.com/dl/zum-rub-body-moisturizer-tea-tree-citrus/p/itmee4ghyauga3bt?pid=MSCEE4GHMAMPHCUW&affid=siddarthk,http://img.fkcdn.com/image/moisturizer-cream/c/u/w/zum-2250-rub-body-moisturizer-tea-tree-citrus-200x200-imaee88yyyf6jfmq.jpeg,Baby Care>Grooming>Lotions & Creams,2623.0,2360.0,2623.0,true,MSCEE4GHMAMPHCUW,MSCEE4GHMAMPHCUW
Flipkart,,Botanical Beauty ABSOLUTE GOLD 24K(61.2 ml),"Experience firm, moist skin with this rich, super-hydrating moisturizer that delivers nutrients and antioxidants to encourage a healthy, vibrant skin. Shea Butter, Bio-active Antioxidants, Seaweed Extract and Sunflowers Oil help reduce dryness and repair cellular damage. Excellent for all skin types, this moisturizer also contains 24 Karat Gold, Collagen and Hyaluronic Acid to help deter free radicals and combat signs of aging, leaving skin a radiant, youthful glow.",Botanical Beauty,http://dl.flipkart.com/dl/botanical-beauty-absolute-gold-24k/p/itmee4ghv243aqc6?pid=MSCEE4GHY8FMV9DR&affid=siddarthk,http://img.fkcdn.com/image/moisturizer-cream/9/d/r/botanical-beauty-1800-absolute-gold-24k-200x200-imaee88vpcxegp3q.jpeg,Baby Care>Grooming>Lotions & Creams,6444.0,5799.0,6444.0,true,MSCEE4GHY8FMV9DR,MSCEE4GHY8FMV9DR
Flipkart,,Oriflame Sweden Nature Secrets Hand Cream(75 ml),"When extra nourishment is needed for sensitive skin, indulge in the soothing care of Jojoba and Mango. Jojoba effectively moisturises skin while you get an intense layer of protection from Mango Kernel Butter. 75 ml.",Oriflame Sweden,http://dl.flipkart.com/dl/oriflame-sweden-nature-secrets-hand-cream/p/itmefbyefswespth?pid=MSCEFBYEZSDZNYAH&affid=siddarthk,http://img.fkcdn.com/image/moisturizer-cream/y/a/h/oriflame-sweden-75-nature-secrets-hand-cream-200x200-imaefa4jt9k3k7fs.jpeg,Health and Beauty>Mens Grooming>Body and Skin Care>Moisturizers and Creams,292.0,292.0,292.0,true,MSCEFBYEZSDZNYAH,MSCEFBYEZSDZNYAH
Flipkart,,Revlon Photo Ready BB Cream Skin Perfector SPF 30(30 ml),"Fragrance-free, hydrating formula that provides broad-spectrum sun protectionTexture meshes well with skin and blends easilySheer coverage and dewy finish is ideal for a soft, natural lookFlattering colors for light to medium skin tonesHydrates like moisturizer smoothes like primer covers like foundationBlurs flaws like concealerProtects with SPF 30 like sunscreen translucent photochromatic pigments bend and reflect light so skin looks radiant and perfected in any light",Revlon,http://dl.flipkart.com/dl/revlon-photo-ready-bb-cream-skin-perfector-spf-30/p/itme96sxuc8hrtx5?pid=MSCE96SXFFB92SVY&affid=siddarthk,http://img.fkcdn.com/image/moisturizer-cream/s/v/y/revlon-30-photo-ready-bb-cream-skin-perfector-spf-30-200x200-imae96zguysyzpck.jpeg,Health and Beauty,650.0,650.0,650.0,true,MSCE96SXFFB92SVY,MSCE96SXFFB92SVY
Flipkart,,The Body Shop Vitamin E Face Lotion Spf 15(50 ml),This light moisturising lotion with SPF 15 hydrates and protects the skin. Light and easily absorbed Contains SPF 15 for UVA and UVB protection Leaves skin soft and healthy-looking,The Body Shop,http://dl.flipkart.com/dl/body-shop-vitamin-e-face-lotion-spf-15/p/itmdngzgv8tkty3x?pid=MSCDMEZUZB28CPMG&affid=siddarthk,http://img.fkcdn.com/image/moisturizer-cream/p/m/g/the-body-shop-50-vitamin-e-face-lotion-spf-15-200x200-imadmnm6fqnp6qfu.jpeg,Health and Beauty>Body and Skin Care>Body Care>Moisturizers and Creams,1295.0,1295.0,1295.0,true,MSCDMEZUZB28CPMG,MSCDMEZUZB28CPMG
