PartnerName,Id,Title,Description,Brand,Link,ImageLink,CategoryName,Mrp,OfferPrice,EffectivePrice,Availability,PartnerIdFromUrl,PartnerIdFromDb
Flipkart,,Byredo Palermo Eau De Parfum Spray Eau de Parfum  -  100 ml,"A citrus fragrance for contemporary women Crisp, greenery, clean & invigorating Top notes of orange, lemon, bergamot & bigarde Heart note of rose Base notes of musk & ambrette flower Launched in 2010 Suitable for spring or summer wear",Byredo,http://dl.flipkart.com/dl/byredo-palermo-eau-de-parfum-spray-100-ml/p/itmeh6fzwwajahkp?pid=PEREH6FZTSAHAAHT&affid=siddarthk,http://img.fkcdn.com/image/perfume/a/h/t/eau-de-parfum-byredo-100-palermo-eau-de-parfum-spray-200x200-imaekz4hpsy3gzua.jpeg,Health and Beauty>Fragrances>Perfumes>Eaux De Parfum,20196.0,16023.0,16023.0,true,PEREH6FZTSAHAAHT,PEREH6FZTSAHAAHT
Flipkart,,Maitre Parfumeur et Gantier Jardin Du Nil Eau De Toilette Spray Eau de Toilette  -  100 ml,"An aromatic fragrance for men Crisp, warm, sensual & enlivening Top note of citruses Heart notes of geranium, rose & jasmine Base notes of amber, patchouli & vetiver base Perfect for all occasions",Maitre Parfumeur et Gantier,http://dl.flipkart.com/dl/maitre-parfumeur-et-gantier-jardin-du-nil-eau-de-toilette-spray-100-ml/p/itmeh6fznvjz9hte?pid=PEREH6FZD5VTEHE5&affid=siddarthk,http://img.fkcdn.com/image/perfume/h/e/5/eau-de-toilette-maitre-parfumeur-et-gantier-100-jardin-du-nil-200x200-imaekz4gavwwmqzy.jpeg,Health and Beauty>Fragrances>Perfumes>Eaux De Toilette,11934.0,8118.0,8118.0,true,PEREH6FZD5VTEHE5,PEREH6FZD5VTEHE5
Flipkart,,Penhaligon's Empressa Eau De Toilette Spray Eau de Toilette  -  100 ml,"A citrus fruity fragrance for contemporary women Inspired by the beauty & nacrescence of pearls, precious silks & fine fabrics Crisp, sweet, warm, deep, delectable & bewitching Top notes are blood orange, bergamot, mandarin orange, peach, blackcurrant & dewberry Middle notes are rose, geranium, neroli, cardamom, pink pepper & black pepper Base notes are vanilla, cacao, olibanum, amber, musk, woody accords, patchouli & sandalwood Launched in 2014 Perfect for all occasions",Penhaligon's,http://dl.flipkart.com/dl/penhaligon-s-empressa-eau-de-toilette-spray-100-ml/p/itmeh6fqz2ngezpd?pid=PEREH6FQM4WPPQ9S&affid=siddarthk,http://img.fkcdn.com/image/perfume/q/9/s/eau-de-toilette-penhaligon-s-100-empressa-eau-de-toilette-spray-200x200-imaekz4gz2mrnt2j.jpeg,Health and Beauty>Fragrances>Perfumes>Eaux De Toilette,15606.0,6758.0,6758.0,true,PEREH6FQM4WPPQ9S,PEREH6FQM4WPPQ9S
Flipkart,,Demeter Coriander Tea Cologne Spray Eau de Cologne  -  120 ml,"An aromatic green fragrance for women & men Pure, fresh, spicy & soothing Contains notes of coriander & tea Recommended for day or warmer seasons wear",Demeter,http://dl.flipkart.com/dl/demeter-coriander-tea-cologne-spray-eau-de-120-ml/p/itmeh6fnyubz5gsz?pid=PEREH6FNFMBWKENN&affid=siddarthk,http://img.fkcdn.com/image/perfume/e/n/n/eau-de-cologne-demeter-120-coriander-tea-cologne-spray-200x200-imaekz4hwegnqe4q.jpeg,Health and Beauty>Fragrances>Perfumes>Eaux De Cologne,3672.0,2125.0,2125.0,true,PEREH6FNFMBWKENN,PEREH6FNFMBWKENN
Flipkart,,Etro Shaal-Nur Eau De Toilette Spray Eau de Toilette  -  100 ml(For Women),"An oriental woody for contemporary women Named after an Indian princess Light, fresh, exotic, complex & charismatic Top notes of lemon, bergamot, grapefruit, Brazilian rosewood, coriander & mandarin orange Middle notes of Karo-Karounde, rosemary, terragon, rose, thyme & petitgrain Base notes of incense, nutmeg, opoponax, vanilla, amber, patchouli & vetiver Recommended for colder seasons wear",Etro,http://dl.flipkart.com/dl/etro-shaal-nur-eau-de-toilette-spray-100-ml/p/itmeh6fzcweffzsn?pid=PEREH6FZ3HESSYDG&affid=siddarthk,http://img.fkcdn.com/image/perfume/y/d/g/eau-de-toilette-etro-100-shaal-nur-eau-de-toilette-spray-200x200-imaekz4gs7fxjqb6.jpeg,Health and Beauty>Fragrances>Perfumes>Eaux De Toilette,13614.0,6545.0,6545.0,true,PEREH6FZ3HESSYDG,PEREH6FZ3HESSYDG
Flipkart,,Comme des Garcons Pharrell Williams Girl Eau De Parfum Spray Eau de Parfum  -  100 ml(For Women),"A floral woody fragrance for contemporary women Crisp, spicy, warm, sensual & voluptuous Top notes of neroli, lavender & white pepper Heart notes of iris, styrax & violet Base notes of vetiver, patchouli, cedar & Australian sandalwood Perfect for all occasions",Comme des Garcons,http://dl.flipkart.com/dl/comme-des-garcons-pharrell-williams-girl-eau-de-parfum-spray-100-ml/p/itmeh6fp6pd8ffzw?pid=PEREH6FPYD6WGE6V&affid=siddarthk,http://img.fkcdn.com/image/perfume/e/6/v/eau-de-parfum-comme-des-garcons-100-pharrell-williams-girl-eau-200x200-imaekz4hqyeyrmrj.jpeg,Health and Beauty>Fragrances>Perfumes>Eaux De Parfum,11934.0,9818.0,9818.0,true,PEREH6FPYD6WGE6V,PEREH6FPYD6WGE6V
Flipkart,,Il Profvmo Imprinting Eau De Parfum Spray Eau de Parfum  -  100 ml,"Classified as a refreshing, subtle, oriental fragrance Masculine & lingering scent Blended with fresh, spicy ingredients Recommended for romantic wear",Il Profvmo,http://dl.flipkart.com/dl/il-profvmo-imprinting-eau-de-parfum-spray-100-ml/p/itmeh6fzc6g9yk2h?pid=PEREH6FZKPZ86ZRF&affid=siddarthk,http://img.fkcdn.com/image/perfume/z/r/f/eau-de-parfum-il-profvmo-100-imprinting-eau-de-parfum-spray-200x200-imaekz4g7sxyvhn3.jpeg,Health and Beauty>Fragrances>Perfumes>Eaux De Parfum,15147.0,8415.0,8415.0,true,PEREH6FZKPZ86ZRF,PEREH6FZKPZ86ZRF
Flipkart,,Marc Jacobs Daisy Dream Blush Eau De Toilette Spray (Limited Edition) Eau de Toilette  -  50 ml,"A floral fragrance for young women Light, fresh, clean, watery, powdery & delightful Top note of violet, bergamot & water lily Heart notes of freesia, rose & Lily-of-the-Valley Base notes of vetiver & musk Launched in 2016 as a limited edition Suitable for spring or summer wear",Marc Jacobs,http://dl.flipkart.com/dl/marc-jacobs-daisy-dream-blush-eau-de-toilette-spray-limited-edition-50-ml/p/itmeh6fzjr286qyz?pid=PEREH6FZKVZGMA8V&affid=siddarthk,http://img.fkcdn.com/image/perfume/a/8/v/eau-de-toilette-marc-jacobs-50-daisy-dream-blush-eau-de-toilette-200x200-imaekz4ghbbtkhxf.jpeg,Health and Beauty>Fragrances>Perfumes>Eaux De Toilette,7160.0,6290.0,6290.0,true,PEREH6FZKVZGMA8V,PEREH6FZKVZGMA8V
Flipkart,,Pierre Balmain Eau DIvoire Eau De Toilette Spray Eau de Toilette  -  100 ml,"A floral fruity fragrance for modern women Light, sweet, juicy, playful & cheerful Top notes of bergamot & red currant Heart notes of osmanthus blossom & magnolia Base notes of patchouli, musk & ambrettolide Launched in 2000 Recommended for spring or summer wear",Pierre Balmain,http://dl.flipkart.com/dl/pierre-balmain-eau-divoire-de-toilette-spray-100-ml/p/itmeh6fzz3hb6g4m?pid=PEREH6FZDSWYQR4Y&affid=siddarthk,http://img.fkcdn.com/image/perfume/r/4/y/eau-de-toilette-pierre-balmain-100-eau-divoire-eau-de-toilette-200x200-imaekz4gcxtxnmhh.jpeg,Health and Beauty>Fragrances>Perfumes>Eaux De Toilette,10098.0,6333.0,6333.0,true,PEREH6FZDSWYQR4Y,PEREH6FZDSWYQR4Y
Flipkart,,La Perla In Rosa Eau De Toilette Spray Eau de Toilette  -  80 ml(For Women),"A chypre fruity fragrance for modern women Fresh, juicy, sweet, feminine & tempting Top notes of raspberry, pink pepper & pear Heart notes of cyclamen, rose & violet Base notes of amber, patchouli & sandalwood Launched in 2012 Perfect for all occasions",La Perla,http://dl.flipkart.com/dl/la-perla-rosa-eau-de-toilette-spray-80-ml/p/itmeh6fqjyygbcug?pid=PEREH6FQWZ4ATSMG&affid=siddarthk,http://img.fkcdn.com/image/perfume/s/m/g/eau-de-toilette-la-perla-80-in-rosa-eau-de-toilette-spray-200x200-imaekz4g4jfbhss5.jpeg,Health and Beauty>Fragrances>Perfumes>Eaux De Toilette,6188.0,2975.0,2975.0,true,PEREH6FQWZ4ATSMG,PEREH6FQWZ4ATSMG
Flipkart,,Marni Marni Rose Eau De Parfum Spray Eau de Parfum  -  65 ml,"An oriental floral fragrance for modern women Fresh, spicy, peppery, warm & inviting Top notes of cardamom, mint, raspberry, blackcurrant & almond Heart notes of rose absolute, Bulgarian rose & violet Base notes of patchouli, cedar, vanilla & white musk Launched in 2013 Perfect for all occasions",Marni,http://dl.flipkart.com/dl/marni-rose-eau-de-parfum-spray-65-ml/p/itmeh6fzshncgth7?pid=PEREH6FPGGSFXNPV&affid=siddarthk,http://img.fkcdn.com/image/perfume/n/p/v/eau-de-parfum-marni-65-marni-rose-eau-de-parfum-spray-200x200-imaekz4gwrcxh5xg.jpeg,Health and Beauty>Fragrances>Perfumes>Eaux De Parfum,9639.0,9393.0,9393.0,true,PEREH6FPGGSFXNPV,PEREH6FPGGSFXNPV
Flipkart,,Costume National Pop Collection Eau De Parfum Spray - Blue Bottle (Unboxed) Eau de Parfum  -  50 ml,"A fruity floral fragrance for modern women Crisp, sweet, juicy, warm, powdery & bewitching Top notes of grapefruit, blackcurrant & raspberry Heart notes of jasmine & rose Base notes of patchouli, cashmeran & amber Launched in 2011 Suitable for spring or summer wear The quality of this unboxed item is as fresh & genuine as the original packing",Costume National,http://dl.flipkart.com/dl/costume-national-pop-collection-eau-de-parfum-spray-blue-bottle-unboxed-50-ml/p/itmeh6fndrgyunhe?pid=PEREH6FZSKDR8NNN&affid=siddarthk,http://img.fkcdn.com/image/perfume/n/n/n/eau-de-parfum-costume-national-50-pop-collection-eau-de-parfum-200x200-imaekz4hjf9nbz7y.jpeg,Health and Beauty>Fragrances>Perfumes>Eaux De Parfum,6885.0,3613.0,3613.0,true,PEREH6FZSKDR8NNN,PEREH6FZSKDR8NNN
Flipkart,,Yves Saint Laurent La Nuit De LHomme LIntense Eau De Parfum Spray Eau de Parfum  -  100 ml,"An oriental floral fragrance for men Soft, deep, sweet, smooth, powdery & seductive Top notes of violet & iris Middle notes of vanilla & sage Base notes of patchouli & tonka bean Launched in 2015 Recommended for evening or colder seasons wear",Yves Saint Laurent,http://dl.flipkart.com/dl/yves-saint-laurent-la-nuit-de-lhomme-lintense-eau-parfum-spray-100-ml/p/itmeh6fpnkumdcpc?pid=PEREH6FPESU7UHQF&affid=siddarthk,http://img.fkcdn.com/image/perfume/h/q/f/eau-de-parfum-yves-saint-laurent-100-la-nuit-de-lhomme-lintense-200x200-imaekz4g5atcrbyy.jpeg,Health and Beauty>Fragrances>Perfumes>Eaux De Parfum,8628.0,8628.0,8628.0,true,PEREH6FPESU7UHQF,PEREH6FPESU7UHQF
Flipkart,,Loewe Loco Loewe Eau De Parfum Spray Eau de Parfum  -  100 ml(For Women),"A fruity-floral fragrance for modern women Fresh, alluring & enlivening Contains notes of sweet vanilla, exotic patchouli & jasmine Blended with citrus Italian bergamot, orange blossom & spicy cardamom Perfect for all occasions",Loewe,http://dl.flipkart.com/dl/loewe-loco-eau-de-parfum-spray-100-ml/p/itmeh6fzqfys5xhq?pid=PEREH6FZY6SGPEYZ&affid=siddarthk,http://img.fkcdn.com/image/perfume/e/y/z/eau-de-parfum-loewe-100-loco-loewe-eau-de-parfum-spray-200x200-imaekz4gqmvgbnhy.jpeg,Health and Beauty>Fragrances>Perfumes>Eaux De Parfum,8990.0,6500.0,6500.0,true,PEREH6FZY6SGPEYZ,PEREH6FZY6SGPEYZ
Flipkart,,Jivago Connect Eau De Toilette Spray Eau de Toilette  -  75 ml(For Women),"An aldehydic chypre fragrance for women Fresh, unique, sensual & inviting Top notes are mandarin orange, cassis, narcissus & aldehydes Middle notes are jasmine, clove & myrhh Base notes are vetyver, musk, ylang-ylang & vanilla Launched in 2003 Perfect for all occasions",Jivago,http://dl.flipkart.com/dl/jivago-connect-eau-de-toilette-spray-75-ml/p/itmeh6fzqpq9yw8v?pid=PEREH6FZ958VD9H8&affid=siddarthk,http://img.fkcdn.com/image/perfume/9/h/8/eau-de-toilette-jivago-75-connect-eau-de-toilette-spray-200x200-imaekz4gzufcjrge.jpeg,Health and Beauty>Fragrances>Perfumes>Eaux De Toilette,5304.0,2295.0,2295.0,true,PEREH6FZ958VD9H8,PEREH6FZ958VD9H8
Flipkart,,Krizia Pour Homme Eau De Toilette Spray Eau de Toilette  -  50 ml,"A citrus woody fragrance for men Spicy, fresh, sweet, bright, warm & inviting Top notes of mandarin, bergamot & black pepper Heart notes of elemi, nutmeg, sagebrush, artemisia & cinnamon Base notes of iris, cedar, sandalwood, vanilla, white musk & tonka bean Launched in 2014 Perfect for all occasions",Krizia,http://dl.flipkart.com/dl/krizia-pour-homme-eau-de-toilette-spray-50-ml/p/itmeh6fznrcgcpb5?pid=PEREH6FPD8TXVJV2&affid=siddarthk,http://img.fkcdn.com/image/perfume/j/v/2/eau-de-toilette-krizia-50-pour-homme-eau-de-toilette-spray-200x200-imaekz4gzgfjn34t.jpeg,Health and Beauty>Fragrances>Perfumes>Eaux De Toilette,5508.0,2975.0,2975.0,true,PEREH6FPD8TXVJV2,PEREH6FPD8TXVJV2
Flipkart,,Lancaster Sol Da Bahia Eau De Toilette Spray Eau de Toilette  -  100 ml,"A citrus gourmand fragrance for modern women Inspired by the rich perfumes of Brazil, the organizer of 2014 FIFA World Cup Fresh, sweet, savory, warm & bewitching Top notes of citruses Heart note of coconut Base note of musk Launched in 2014 as a limited edition Recommended for spring or summer wear",Lancaster,http://dl.flipkart.com/dl/lancaster-sol-da-bahia-eau-de-toilette-spray-100-ml/p/itmeh6fzvpadpum2?pid=PEREH6FZS54ARQMV&affid=siddarthk,http://img.fkcdn.com/image/perfume/q/m/v/eau-de-toilette-lancaster-100-sol-da-bahia-eau-de-toilette-spray-200x200-imaekz4gw6c48hda.jpeg,Health and Beauty>Fragrances>Perfumes>Eaux De Toilette,5508.0,2040.0,2040.0,true,PEREH6FZS54ARQMV,PEREH6FZS54ARQMV
Flipkart,,Jivago White Gold Eau De Toilette Spray Eau de Toilette  -  75 ml,"A sparkling floral fragrance for contemporary women Crisp, lavish, sensual & feminine Contains genuine white gold to deliver positive giving energy With notes of white peony, lily of the valley, orris Vanilla & musk Encased in a beautiful two-piece bottle symbolic of the physical & spiritual worlds Launched in 2010 Ideal for all occasions",Jivago,http://dl.flipkart.com/dl/jivago-white-gold-eau-de-toilette-spray-75-ml/p/itmeh6fzjtggvahn?pid=PEREH6FZJV4XA9UJ&affid=siddarthk,http://img.fkcdn.com/image/perfume/9/u/j/eau-de-toilette-jivago-75-white-gold-eau-de-toilette-spray-200x200-imaekz4gpkwjp7yf.jpeg,Health and Beauty>Fragrances>Perfumes>Eaux De Toilette,7987.0,6078.0,6078.0,true,PEREH6FZJV4XA9UJ,PEREH6FZJV4XA9UJ
Flipkart,,L'Occitane Eau De Cade For Men Eau De Toilette Spray Eau de Toilette  -  100 ml,"An aromatic fougere fragrance for modern men Soft, crisp, clean, elegant & inviting Top note is bergamot Middle notes are cedar & pink pepper Base notes are juniper & labdanum Launched in 2014 Perfect for all occasions",L'Occitane,http://dl.flipkart.com/dl/l-occitane-eau-de-cade-men-toilette-spray-100-ml/p/itmeh6fpthvuya7j?pid=PEREH6FPYVHPTDZN&affid=siddarthk,http://img.fkcdn.com/image/perfume/d/z/n/eau-de-toilette-l-occitane-100-eau-de-cade-for-men-eau-de-200x200-imaekz4ghqujahjf.jpeg,Health and Beauty>Fragrances>Perfumes>Eaux De Toilette,5324.0,5324.0,5324.0,false,PEREH6FPYVHPTDZN,PEREH6FPYVHPTDZN
Flipkart,,Christian Dior Dune Eau De Toilette Spray Eau de Toilette  -  100 ml,"A legend in scents for modern men Explores essences of fig, black currant and sage Blended with notes of sandalwood, cedar and basil Captures the spicy scent exclusively Perfect for evening wear",Christian Dior,http://dl.flipkart.com/dl/christian-dior-dune-eau-de-toilette-spray-100-ml/p/itmeh6fzgcnzdxdn?pid=PEREH6FZNTP3FDCJ&affid=siddarthk,http://img.fkcdn.com/image/perfume/d/c/j/eau-de-toilette-christian-dior-100-dune-eau-de-toilette-spray-200x200-imaekz4h5hzjtfvu.jpeg,Health and Beauty>Fragrances>Perfumes>Eaux De Toilette,8118.0,8118.0,8118.0,true,PEREH6FZNTP3FDCJ,PEREH6FZNTP3FDCJ
Flipkart,,J. Lo Still Eau De Parfum Spray Eau de Parfum  -  100 ml,"A floral fragrance for women Clean, fresh, calming & alluring Top notes are white pepper, mandarin orange, rice, apple, earl grey tea Middle notes are honeysuckle, orange blossom, freesia, jasmine, lily of the valley Base notes are sandalwood, musk, amber, iris, pepper",J. Lo,http://dl.flipkart.com/dl/j-lo-still-eau-de-parfum-spray-100-ml/p/itmeh6fz7q9f5dnr?pid=PEREH6FZKBQEFQM2&affid=siddarthk,http://img.fkcdn.com/image/perfume/q/m/2/eau-de-parfum-j-lo-100-still-eau-de-parfum-spray-200x200-imaekz4gvbmdr5h8.jpeg,Health and Beauty>Fragrances>Perfumes>Eaux De Parfum,7344.0,5100.0,5100.0,true,PEREH6FZKBQEFQM2,PEREH6FZKBQEFQM2
Flipkart,,The Different Company Oriental Lounge Eau De Parfum Spray Eau de Parfum  -  90 ml,"A spicy oriental fragrance for men & women Inspired by the spirit, life & breath of the Orient Fresh, sweet, bright, warm, sophisticated & mysterious Top notes of Kaloupil leaves, bergamot & pepper Heart notes of red rose & satinwood Base notes of tonka bean, labdanum & amber Launched in 2009 Recommended for evening or colder seasons wear",The Different Company,http://dl.flipkart.com/dl/different-company-oriental-lounge-eau-de-parfum-spray-90-ml/p/itmeh6fqf8vhaejk?pid=PEREH6FRN2REYFF4&affid=siddarthk,http://img.fkcdn.com/image/perfume/f/f/4/eau-de-parfum-the-different-company-90-oriental-lounge-eau-de-200x200-imaekz4ggywhbtft.jpeg,Health and Beauty>Fragrances>Perfumes>Eaux De Parfum,22491.0,17170.0,17170.0,true,PEREH6FRN2REYFF4,PEREH6FRN2REYFF4
Flipkart,,Demeter Mojito Cologne Spray Eau de Cologne  -  120 ml,"A fragrance for men inspired by the Cuba-originated alcoholic drink Fresh, relaxing, uplifting & long-lasting Contains notes of white rum, sugar cane juice, lime, sparkling water & mint Suitable for daytime & casual wear",Demeter,http://dl.flipkart.com/dl/demeter-mojito-cologne-spray-eau-de-120-ml/p/itmeh6fngmnpymux?pid=PEREH6FNFQVCDMPV&affid=siddarthk,http://img.fkcdn.com/image/perfume/m/p/v/eau-de-cologne-demeter-120-mojito-cologne-spray-200x200-imaekz4hdg5ztdsr.jpeg,Health and Beauty>Fragrances>Perfumes>Eaux De Cologne,3672.0,2125.0,2125.0,true,PEREH6FNFQVCDMPV,PEREH6FNFQVCDMPV
Flipkart,,Penhaligon's Eau De Cologne Spray Eau de Cologne  -  100 ml,"A citrus fragrance for men & women Crisp, sensual & uplifting Contains notes of citruses, orange & neroli Recommended for causal & daytime wear",Penhaligon's,http://dl.flipkart.com/dl/penhaligon-s-eau-de-cologne-spray-100-ml/p/itmeh6fq6zghxz7c?pid=PEREH6FQXMVPHGVB&affid=siddarthk,http://img.fkcdn.com/image/perfume/g/v/b/eau-de-cologne-penhaligon-s-100-eau-de-cologne-spray-200x200-imaekz4gyzfzwdkt.jpeg,Health and Beauty>Fragrances>Perfumes>Eaux De Cologne,13770.0,10668.0,10668.0,true,PEREH6FQXMVPHGVB,PEREH6FQXMVPHGVB
Flipkart,,Hard Candy Eau De Parfum Spray Eau de Parfum  -  100 ml(For Women),"A flirty & playful fragrance for sexy ladies Seductive, charismatic & uplifting Top notes of white tea & pink peppercorn Middle notes of rose & jasmine Base notes of caramel sweetness & vanilla With hints of cashmere musk Suitable for anytime wear",Hard Candy,http://dl.flipkart.com/dl/hard-candy-eau-de-parfum-spray-100-ml/p/itmeh6fzz8xtdrzy?pid=PEREH6FZ3BBZ9KKU&affid=siddarthk,http://img.fkcdn.com/image/perfume/k/k/u/eau-de-parfum-hard-candy-100-eau-de-parfum-spray-200x200-imaekz4g8st3anh4.jpeg,Health and Beauty>Fragrances>Perfumes>Eaux De Parfum,4862.0,1785.0,1785.0,true,PEREH6FZ3BBZ9KKU,PEREH6FZ3BBZ9KKU
Flipkart,,Marc Jacobs Lola Eau De Parfum Spray Eau de Parfum  -  100 ml,"A truly feminine fragrance for sexy, chic women Playful, cool, flirtatious & sophisticated Top notes of pink peppercorn, pear, ruby red grapefruit Heart notes of rose, peony, geranium Base notes of vanilla, tonka bean, creamy musk Lingering for day-and-night wear",Marc Jacobs,http://dl.flipkart.com/dl/marc-jacobs-lola-eau-de-parfum-spray-100-ml/p/itmeh6fzxyfrrdvn?pid=PEREH6FZEFHEZG98&affid=siddarthk,http://img.fkcdn.com/image/perfume/g/9/8/eau-de-parfum-marc-jacobs-100-lola-eau-de-parfum-spray-200x200-imaekz4gqvzyyjpw.jpeg,Health and Beauty>Fragrances>Perfumes>Eaux De Parfum,8078.0,7098.0,7098.0,true,PEREH6FZEFHEZG98,PEREH6FZEFHEZG98
Flipkart,,"Marc Jacobs Oh,Lola! Sunsheer Eau De Parfum Spray Eau de Parfum  -  50 ml","A floral fruity fragrance for modern women Light, crisp, savory & bewitching Top notes of raspberry, wild strawberry & pear Heart notes of peony, magnolia & cyclamen Base notes of vanilla, sandalwood & tonka bean Launched in 2012 Suitable for day time or warmer seasons wear",Marc Jacobs,http://dl.flipkart.com/dl/marc-jacobs-oh-lola-sunsheer-eau-de-parfum-spray-50-ml/p/itmeh6fq4j9hgneg?pid=PEREH6FQNU22PYDM&affid=siddarthk,http://img.fkcdn.com/image/perfume/y/d/m/eau-de-parfum-marc-jacobs-50-oh-lola-sunsheer-eau-de-parfum-200x200-imaekz4g3czgkprz.jpeg,Health and Beauty>Fragrances>Perfumes>Eaux De Parfum,6885.0,5525.0,5525.0,true,PEREH6FQNU22PYDM,PEREH6FQNU22PYDM
Flipkart,,Jivago White Gold Eau De Parfum Spray Eau de Parfum  -  50 ml(For Women),"A lavish floral fragrance for contemporary women Crisp, delicate, sensual & feminine Contains genuine white gold to deliver positive giving energy Features notes of white peony, lily of the valley, orris, rosewood, musk & vanilla Launched in 2010 Perfect for all occasions",Jivago,http://dl.flipkart.com/dl/jivago-white-gold-eau-de-parfum-spray-50-ml/p/itmeh6fzzzrtzmht?pid=PEREH6FZYHGYUX9H&affid=siddarthk,http://img.fkcdn.com/image/perfume/x/9/h/eau-de-parfum-jivago-50-white-gold-eau-de-parfum-spray-200x200-imaekz4ghxp9vr65.jpeg,Health and Beauty>Fragrances>Perfumes>Eaux De Parfum,9282.0,6333.0,6333.0,true,PEREH6FZYHGYUX9H,PEREH6FZYHGYUX9H
Flipkart,,Crabtree & Evelyn Verbena & Lavender De Provence Cologne Spray Eau de Cologne  -  100 ml,"A citrus floral fragrance for women & men Contains notes of verbena, lavender, cedarwood, white amber & tonka bean Crisp, sweet, breezy, vibrant & uplifting Launched in 2013 Perfect for all occasions Free of propylene glycol",Crabtree & Evelyn,http://dl.flipkart.com/dl/crabtree-evelyn-verbena-lavender-de-provence-cologne-spray-eau-100-ml/p/itmeh6fpqbqyghsx?pid=PEREH6FQMAJKJAAD&affid=siddarthk,http://img.fkcdn.com/image/perfume/a/a/d/eau-de-cologne-crabtree-evelyn-100-verbena-lavender-de-provence-200x200-imaekz4hgyfgtpdh.jpeg,Health and Beauty>Fragrances>Perfumes>Eaux De Cologne,4315.0,3613.0,3613.0,true,PEREH6FQMAJKJAAD,PEREH6FQMAJKJAAD
Flipkart,,Prada Candy Florale Eau De Toilette Spray Eau de Toilette  -  80 ml(For Women),"A floral fruity fragrance for contemporary women Soft, crisp, clean, warm, powdery & enlivening Top note of limoncello Heart note of peony Base notes of benzoin, musk, caramel & honey Launched in 2014 Perfect for all occasions",Prada,http://dl.flipkart.com/dl/prada-candy-florale-eau-de-toilette-spray-80-ml/p/itmeh6fpy4g2uacz?pid=PEREH6FPN6HHDGFZ&affid=siddarthk,http://img.fkcdn.com/image/perfume/g/f/z/eau-de-toilette-prada-80-candy-florale-eau-de-toilette-spray-200x200-imaekz4gkwcqfu5r.jpeg,Health and Beauty>Fragrances>Perfumes>Eaux De Toilette,8310.0,7905.0,7905.0,true,PEREH6FPN6HHDGFZ,PEREH6FPN6HHDGFZ
Flipkart,,Courreges Eau De Courreges Eau De Toilette Spray Eau de Toilette  -  100 ml,"Fascinating, intoxicating, seductive and bewitchin Refreshes the skin Relaxes the senses Recalling the purity of mountain air and cascading water",Courreges,http://dl.flipkart.com/dl/courreges-eau-de-toilette-spray-100-ml/p/itmeh6fpskqymwha?pid=PEREH6FP5XHEHGSS&affid=siddarthk,http://img.fkcdn.com/image/perfume/g/s/s/eau-de-toilette-courreges-100-eau-de-courreges-eau-de-toilette-200x200-imaekz4hjykhbwnm.jpeg,Health and Beauty>Fragrances>Perfumes>Eaux De Toilette,5967.0,3273.0,3273.0,true,PEREH6FP5XHEHGSS,PEREH6FP5XHEHGSS
Flipkart,,Demeter Kamikaze Cologne Spray Eau de Cologne  -  30 ml,"A citrus fragrance for women & men Sharp, fresh, sweet, boozy & invigorating Contains notes of vodka, orange, lime & sugar Recommended for day or warmer seasons wear",Demeter,http://dl.flipkart.com/dl/demeter-kamikaze-cologne-spray-eau-de-30-ml/p/itmeh6fptgyguzk3?pid=PEREH6FPNQDFCFR3&affid=siddarthk,http://img.fkcdn.com/image/perfume/f/r/3/eau-de-cologne-demeter-30-kamikaze-cologne-spray-200x200-imaekz4hpmhwyfvy.jpeg,Health and Beauty>Fragrances>Perfumes>Eaux De Cologne,1836.0,1063.0,1063.0,true,PEREH6FPNQDFCFR3,PEREH6FPNQDFCFR3
Flipkart,,Demeter New Leaf Cologne Spray Eau de Cologne  -  120 ml,"An aromatic green fragrance for men & women Crisp, simple, natural & uplifting Contains notes of green leaves Suitable for day or warmer seasons wear",Demeter,http://dl.flipkart.com/dl/demeter-new-leaf-cologne-spray-eau-de-120-ml/p/itmeh6fzgb2mbdqy?pid=PEREH6FZEBQY3YDV&affid=siddarthk,http://img.fkcdn.com/image/perfume/y/d/v/eau-de-cologne-demeter-120-new-leaf-cologne-spray-200x200-imaekz4hhsypvytq.jpeg,Health and Beauty>Fragrances>Perfumes>Eaux De Cologne,3672.0,2125.0,2125.0,true,PEREH6FZEBQY3YDV,PEREH6FZEBQY3YDV
Flipkart,,Katy Perry Royal Revolution Eau De Parfum Spray Eau de Parfum  -  100 ml,"A floral fruity fragrance for modern women Crisp, sweet, smooth, deep & intoxicating Top notes of pomegranate & freesia Heart notes of jasmine, orange flower & sandalwood Base notes of blackthorn, vanilla orchid, leather & musk Launched in 2014 Perfect for all occasions",Katy Perry,http://dl.flipkart.com/dl/katy-perry-royal-revolution-eau-de-parfum-spray-100-ml/p/itmeh6fzggwtqyjs?pid=PEREH6FZ9SSEEBAA&affid=siddarthk,http://img.fkcdn.com/image/perfume/b/a/a/eau-de-parfum-katy-perry-100-royal-revolution-eau-de-parfum-200x200-imaekz4ghqdh845y.jpeg,Health and Beauty>Fragrances>Perfumes>Eaux De Parfum,5416.0,4463.0,4463.0,true,PEREH6FZ9SSEEBAA,PEREH6FZ9SSEEBAA
Flipkart,,Penhaligon's Ellenisia Eau De Parfum Spray Eau de Parfum  -  100 ml,"A floral fragrance for modern ladies Elegant, glamorous & tempting Top notes of mandarin orange & violet leaf Middle notes of jasmine, gardenia, rose & tuberose Base notes of plum & vanilla Ideal for all occasions",Penhaligon's,http://dl.flipkart.com/dl/penhaligon-s-ellenisia-eau-de-parfum-spray-100-ml/p/itmeh6fzvgf7ghmj?pid=PEREH6FZAU4G6YSH&affid=siddarthk,http://img.fkcdn.com/image/perfume/y/s/h/eau-de-parfum-penhaligon-s-100-ellenisia-eau-de-parfum-spray-200x200-imaekz4gbfzcvszk.jpeg,Health and Beauty>Fragrances>Perfumes>Eaux De Parfum,13311.0,7395.0,7395.0,false,PEREH6FZAU4G6YSH,PEREH6FZAU4G6YSH
