PartnerName,Id,Title,Description,Brand,Link,ImageLink,CategoryName,Mrp,OfferPrice,EffectivePrice,Availability,PartnerIdFromUrl,PartnerIdFromDb
Flipkart,,Paul Mitchell Awapuhi Wild Ginger Keratin Intensive Treatment (For Dry and Damaged Hair)(150 ml),"An intensive nourishing & conditioning treatment Formulated with KeraTriplexTM, an exclusive blend of keratin protein Helps repair every strand & protect against damage Contains Awapuhi extract to replenish every strand with intense moisture Hair appears sleeker, shiner & healthier looking Perfect for dry or damaged hair",Paul Mitchell,http://dl.flipkart.com/dl/paul-mitchell-awapuhi-wild-ginger-keratin-intensive-treatment-for-dry-damaged-hair/p/itmens7tpvgv4sfj?pid=HTTENS7TRUJEFSBH&affid=siddarthk,http://img.fkcdn.com/image/hair-treatment/s/b/h/paul-mitchell-150-awapuhi-wild-ginger-keratin-intensive-200x200-imaensb5grkpty2h.jpeg,Health and Beauty>Hair Care>Hair Treatments,9999.0,9999.0,9999.0,false,HTTENS7TRUJEFSBH,HTTENS7TRUJEFSBH
Flipkart,,AlfaParf Semi Di Lino Moisture Nutritive Mask (For Dry Hair)(500 ml),"An intensely hydrating & nutritive mask treatment Contains Nutri-Sugars complex to balance a healthy hydro-level of the hair shaft Blended with Color Fix complex to protect & maintain color intensity Loaded with Shine Fix complex to deliver 24-hour time release shine Instantly detangles hair & improves its combability Reveals suppler, sleeker, more manageable & healthier looking hair Ideal for dry & frizzy hair Free of sulfate or unfriendly ingredients",AlfaParf,http://dl.flipkart.com/dl/alfaparf-semi-di-lino-moisture-nutritive-mask-for-dry-hair/p/itmens7tybzjsmcu?pid=HTTENS7TGPSVG3X8&affid=siddarthk,http://img.fkcdn.com/image/hair-treatment/3/x/8/alfaparf-500-semi-di-lino-moisture-nutritive-mask-for-dry-hair-200x200-imaensb6cstp3csj.jpeg,Health and Beauty>Hair Care>Hair Treatments,9999.0,9999.0,9999.0,false,HTTENS7TGPSVG3X8,HTTENS7TGPSVG3X8
Flipkart,,Valmont Regenerating Cleanser (Hair Repair) 702001(100 ml),"A lavish, supple & creamy shampoo Helps remove dirt & offers anti-aging benefits Enables hair & scalp to be receptive for consequent treatments Features a triple DNA & keratin rich formula Reinforces hair from root & sleeks capillary fiber Restores luminous & vigorous hair",Valmont,http://dl.flipkart.com/dl/valmont-regenerating-cleanser-hair-repair-702001/p/itmens7taykwv4yz?pid=HTTENS7TZEYXZZZT&affid=siddarthk,http://img.fkcdn.com/image/hair-treatment/z/z/t/valmont-100-regenerating-cleanser-hair-repair-702001-200x200-imaensb7phurnkyh.jpeg,Health and Beauty>Hair Care>Hair Treatments,9999.0,9999.0,9999.0,false,HTTENS7TZEYXZZZT,HTTENS7TZEYXZZZT
Flipkart,,AlfaParf Lisse Design Keratin Therapy Rehydrating Mask (Salon Size)(500 ml),"A therapeutic, keratin-rich re-hydrating mask Helps preserve & prolong the effects obtained with the Lisse Design Keratin Therapy treatment Contains Hydrolyzed Keratin Complex & quaternized Collagen that offers long-lasting results Blended with an effective emollient Babassu Oil, a precious oil from the Amazon Restores moisture to hair while slowing down the natural drying process Hair appears suppler, sleeker, more lustrous & manageable Perfect for all hair types Free of parabens & formaldehyde",AlfaParf,http://dl.flipkart.com/dl/alfaparf-lisse-design-keratin-therapy-rehydrating-mask-salon-size/p/itmens7tszq3pcwz?pid=HTTENS7TYMTSAT2E&affid=siddarthk,http://img.fkcdn.com/image/hair-treatment/t/2/e/alfaparf-500-lisse-design-keratin-therapy-rehydrating-mask-salon-200x200-imaensb7f9pvfdyy.jpeg,Health and Beauty>Hair Care>Hair Treatments,9999.0,9999.0,9999.0,false,HTTENS7TYMTSAT2E,HTTENS7TYMTSAT2E
Flipkart,,Joico K-Pak Leave-In Protectant - To prevent damage (New Packaging)(250 ml),"Leave-in treatment for dry, damaged & chemically treated hair Unique foaming formula detangles & smoothes out hair Re-structures hair with exclusive Keratin Silicone Complex Increases elasticity, strength & luminosity Alleviates static without loading weight Delightfully scented with tropical fruit smell",Joico,http://dl.flipkart.com/dl/joico-k-pak-leave-in-protectant-prevent-damage-new-packaging/p/itmens7tgzg4hhth?pid=HTTENS7T2Y8RDH6S&affid=siddarthk,http://img.fkcdn.com/image/hair-treatment/h/6/s/joico-250-k-pak-leave-in-protectant-to-prevent-damage-new-200x200-imaensb6rxcuy8sq.jpeg,Health and Beauty>Hair Care>Hair Treatments,9999.0,9999.0,9999.0,false,HTTENS7T2Y8RDH6S,HTTENS7T2Y8RDH6S
Flipkart,,CHI Curl Preserve System Treatment(950 ml),"A low pH intense conditioning treatment Helps nourish & recover hair bouncy Formulated with Ceramino Interlink Complex Loaded with CHI 44 Ceramic Technology, amino acids & proteins Delivers vitality, volume & conditioning to hair Balances hydration composition to an ideal level Shields hair color from fading Unveils radiant, perfectly-defined & frizz-free curls",CHI,http://dl.flipkart.com/dl/chi-curl-preserve-system-treatment/p/itmens7t2wj5zxdk?pid=HTTENS7TBTSPWJ96&affid=siddarthk,http://img.fkcdn.com/image/hair-treatment/j/9/6/chi-950-curl-preserve-system-treatment-200x200-imaensb6xh9ydead.jpeg,Health and Beauty>Hair Care>Hair Treatments,9999.0,9999.0,9999.0,false,HTTENS7TBTSPWJ96,HTTENS7TBTSPWJ96
Flipkart,,Kerastase Kerastase Resistance Age Recharge Firming Gel-Masque(200 ml),"A treatment that revitalizes hair & works inside out on hair fiber Lightweight & easily absorbed without adding weight to hair Increases hair resistance against external aggressions Hair becomes stronger, thicker & shiny with vitality Hair remains in body & easy for styling To use: Gently massage in with fingertips to work evenly into hair particularly on the most weakened areas",Kerastase,http://dl.flipkart.com/dl/kerastase-resistance-age-recharge-firming-gel-masque/p/itmens7tkkhpewfw?pid=HTTENS7QEGHUHPJH&affid=siddarthk,http://img.fkcdn.com/image/hair-treatment/p/j/h/kerastase-200-kerastase-resistance-age-recharge-firming-gel-200x200-imaensb6fzsjpupg.jpeg,Health and Beauty>Hair Care>Hair Treatments,9999.0,9999.0,9999.0,false,HTTENS7QEGHUHPJH,HTTENS7QEGHUHPJH
Flipkart,,Joico K-Pak Deep-Penetrating Reconstructor - For Damaged Hair (New Packaging)(150 ml),"Extremely hydrating treatment with pH 3.5 for overly dry, damaged hair Re-structures hair with exclusive Keratin Silicone Complex Penetrates deeply to seal the cuticle Increases elasticity, strength & luminosity Leaves hair silky smooth, manageable & healthy",Joico,http://dl.flipkart.com/dl/joico-k-pak-deep-penetrating-reconstructor-damaged-hair-new-packaging/p/itmens7t5t7za37r?pid=HTTENS7TUZ2FMKVZ&affid=siddarthk,http://img.fkcdn.com/image/hair-treatment/k/v/z/joico-150-k-pak-deep-penetrating-reconstructor-for-damaged-hair-200x200-imaensb7sncvnx7t.jpeg,Health and Beauty>Hair Care>Hair Treatments,9999.0,9999.0,9999.0,false,HTTENS7TUZ2FMKVZ,HTTENS7TUZ2FMKVZ
Flipkart,,Amika Leave In Cream (For All Hair Types)(250 ml),"A deeply conditioning leave in cream Contains healing Obliphica berry rich in antioxidants, vitamins, healthy fatty acids, Omega 3, 6, 7 & 9 Blended with Argan nut oil to replenish, hydrate hair & restore its natural balance Provides definition & manageability without overloading hair Hair appears sleek, lustrous & healthy looking Perfect for all hair types Paraben-free, safe for color treated hair To use: Apply to palm, massage or scrunch through wet hair. No need to rinse off",Amika,http://dl.flipkart.com/dl/amika-leave-cream-for-all-hair-types/p/itmens7txevkkhtz?pid=HTTENS7THKUFJVVM&affid=siddarthk,http://img.fkcdn.com/image/hair-treatment/v/v/m/amika-250-leave-in-cream-for-all-hair-types-200x200-imaensb6xzfb6kcb.jpeg,Health and Beauty>Hair Care>Hair Treatments,9999.0,9999.0,9999.0,false,HTTENS7THKUFJVVM,HTTENS7THKUFJVVM
Flipkart,,La-Brasiliana Spruzzi Zero 24 Hours Keratin Treatment With Collagen Aloe Vera &amp; Lavender Oil(1000 ml),"A keratin-based leave-on treatment spray Formulated with Collagen, Aloe Vera & Lavender Oil Helps deliver & seal in moisture Improves vitality & flexibility of hair Designed for faster application & only a 24-hr shampoo style restriction Repairs damage induced by bleaching, perms & thermal heat Hair appears smoother, stronger & healthier looking Perfect for all hair types For professional stylist use only",La-Brasiliana,http://dl.flipkart.com/dl/la-brasiliana-spruzzi-zero-24-hours-keratin-treatment-collagen-aloe-vera-amp-lavender-oil/p/itmens7tzjjkmnc7?pid=HTTENS7THMGN9GT7&affid=siddarthk,http://img.fkcdn.com/image/hair-treatment/g/t/7/la-brasiliana-1000-spruzzi-zero-24-hours-keratin-treatment-with-200x200-imaensb6ahf3bygz.jpeg,Health and Beauty>Hair Care>Hair Treatments,9999.0,9999.0,9999.0,false,HTTENS7THMGN9GT7,HTTENS7THMGN9GT7
Flipkart,,Kerastase Nutritive Nutri-Thermique Thermo-Reactive Intensive Nutrition Masque (For Very Dry and Sensitised Hair)(500 ml),"An intensely hydrating treatment masque Features a thermo-reactive formula to retain moisturizing elements deep inside hair fiber Contains patented nourishing agents to work on most sensitised areas of hair fiber Forms a shielding film all around hair fiber to prevent dehydration Reveals suppler, more radiant & more manageable hair Excellent for very dry & sensitised hair",Kerastase,http://dl.flipkart.com/dl/kerastase-nutritive-nutri-thermique-thermo-reactive-intensive-nutrition-masque-for-very-dry-sensitised-hair/p/itmens7tbqmnbth5?pid=HTTENS7QGFEVHAWZ&affid=siddarthk,http://img.fkcdn.com/image/hair-treatment/a/w/z/kerastase-500-nutritive-nutri-thermique-thermo-reactive-200x200-imaensb6g9yemyq3.jpeg,Health and Beauty>Hair Care>Hair Treatments,9999.0,9999.0,9999.0,false,HTTENS7QGFEVHAWZ,HTTENS7QGFEVHAWZ
Flipkart,,Bumble and Bumble Bb. Repair Blow Dry(150 ml),"A serum-in-creme treatment for dry or damaged hair Lightweight & instantly penetrates into hair Helps repair split ends & combat heat, breakage, UV damage Proven to protect hair with each single blow dry Leaves hair smooth, manageable & healthy for up to 3 days To use: Apply on clean, damp hair before blow-drying",Bumble and Bumble,http://dl.flipkart.com/dl/bumble-bb-repair-blow-dry/p/itmens7tcnbepbyr?pid=HTTENS7TEHGW3GT3&affid=siddarthk,http://img.fkcdn.com/image/hair-treatment/g/t/3/bumble-and-bumble-150-bb-repair-blow-dry-200x200-imaensb6zxj2aety.jpeg,Health and Beauty>Hair Care>Hair Treatments,9999.0,9999.0,9999.0,false,HTTENS7TEHGW3GT3,HTTENS7TEHGW3GT3
Flipkart,,Frederic Fekkai PrX Reparatives Intense Fortifying Masque (Indulgent Repair)(198 ml),"An intensely reparative & strengthening mask for overworked hair Contains keratin & silk proteins to deliver moisture while detangling each strand Reinforces keratin structure & prevents keratin loss Shields hair from effects of styling & processing Hair appears suppler, sleeker, bouncier, naturally shiny & healthier looking Great for hair that undergoes regular heat styling & chemical processing",Frederic Fekkai,http://dl.flipkart.com/dl/frederic-fekkai-prx-reparatives-intense-fortifying-masque-indulgent-repair/p/itmens7t7spjzgwa?pid=HTTENS7THKFAHZHG&affid=siddarthk,http://img.fkcdn.com/image/hair-treatment/z/h/g/frederic-fekkai-198-prx-reparatives-intense-fortifying-masque-200x200-imaensb7jgdhfznz.jpeg,Health and Beauty>Hair Care>Hair Treatments,9999.0,9999.0,9999.0,false,HTTENS7THKFAHZHG,HTTENS7THKFAHZHG
Flipkart,,Apivita Color Protection Restructuring Hair Mask with Sunflower &amp; Honey (For Colored Hair)(150 ml),"A natural color protecting & restructuring mask for color treated hair Formulated with sunflower to protect from solar radiation, damaging effects of environment & styling products Blended with honey to improve hair texture & preserve hair's natural hydration Maintains hair color's shine & vitality Repairs damages & shields split ends Unveils suppler, smoother, stronger & more flexible hair with vibrant color To use: Apply to shampooed hair, leave on for 3-5 minutes. Rinse well with lukewarm water. Use 1-2 times a week or as needed",Apivita,http://dl.flipkart.com/dl/apivita-color-protection-restructuring-hair-mask-sunflower-amp-honey-for-colored-hair/p/itmens7t9ttry5ct?pid=HTTENS7TDWSSK8FV&affid=siddarthk,http://img.fkcdn.com/image/hair-treatment/8/f/v/apivita-150-color-protection-restructuring-hair-mask-with-200x200-imaensb65mncwfu6.jpeg,Health and Beauty>Hair Care>Hair Treatments,9999.0,9999.0,9999.0,false,HTTENS7TDWSSK8FV,HTTENS7TDWSSK8FV
Flipkart,,Goldwell Kerasilk Rich Keratin Care Daily Mask - Smoothing Transformation (For Unmanageable and Damaged Hair)(150 ml),"A special hair care for unruly & damaged hair Formulated with a unique blend of precious keratin & silk proteins Incredibly tames hair with increased smoothness Leaves hair sleek without weighing it down With the support from Kerashape Technology, hair remains silky smooth for up to 5 months",Goldwell,http://dl.flipkart.com/dl/goldwell-kerasilk-rich-keratin-care-daily-mask-smoothing-transformation-for-unmanageable-damaged-hair/p/itmens7t4azfzswx?pid=HTTENS7TDVCNZGZP&affid=siddarthk,http://img.fkcdn.com/image/hair-treatment/g/z/p/goldwell-150-kerasilk-rich-keratin-care-daily-mask-smoothing-200x200-imaensb6zqjp9zhb.jpeg,Health and Beauty>Hair Care>Hair Treatments,9999.0,1530.0,1530.0,true,HTTENS7TDVCNZGZP,HTTENS7TDVCNZGZP
Flipkart,,Kerastase Kerastase Nutritive Oleo-Relax Smoothing Mask (Dry &amp; Rebellious Hair)(500 ml),"A hair masque to calm dry, frizzy, unmanageable hair Nourishes, softens & smoothes hair Hair becomes smoother, soft & easy to comb Makes you feel comfortable & confidence throughout the day",Kerastase,http://dl.flipkart.com/dl/kerastase-nutritive-oleo-relax-smoothing-mask-dry-amp-rebellious-hair/p/itmens7thaayh8pe?pid=HTTENS7TYHSA4G7N&affid=siddarthk,http://img.fkcdn.com/image/hair-treatment/g/7/n/kerastase-500-kerastase-nutritive-oleo-relax-smoothing-mask-dry-200x200-imaensb7kbn73j32.jpeg,Health and Beauty>Hair Care>Hair Treatments,9999.0,7395.0,7395.0,true,HTTENS7TYHSA4G7N,HTTENS7TYHSA4G7N
Flipkart,,"Nioxin System 2 Scalp Treatment with UV Defense Ingredients For Fine Hair, Noticeably Thinning Hair(200 ml)","A daily leave-in scalp treatment with sunscreen factors Protects scalp from the damage of UVA/B rays Delivers essential botanical, nutrients, antioxidants & vitamins Shields against residues & DHT build up on scalp Creates & maintains a healthy scalp environment Helps improve appearance of thinning hair",Nioxin,http://dl.flipkart.com/dl/nioxin-system-2-scalp-treatment-uv-defense-ingredients-fine-hair-noticeably-thinning-hair/p/itmens7tfzyppgka?pid=HTTENS7TFT8XGZJA&affid=siddarthk,http://img.fkcdn.com/image/hair-treatment/z/j/a/nioxin-200-system-2-scalp-treatment-with-uv-defense-ingredients-200x200-imaensb6vgmsjzzf.jpeg,Health and Beauty>Hair Care>Hair Treatments,9999.0,9999.0,9999.0,false,HTTENS7TFT8XGZJA,HTTENS7TFT8XGZJA
Flipkart,,Joico Moisture Recovery Treatment Balm - For Thick / Coarse Dry Hair (New Packaging)(250 ml),"A highly nourishing hair treatment Contains an intensely hydrating Hydramine Sea Complex Blended with murumuru, olive & shea butters Offers nourishment to rescue dry hair Hair appears softer, smoother, bouncier & more revived Perfect for thick & coarse dry hair",Joico,http://dl.flipkart.com/dl/joico-moisture-recovery-treatment-balm-thick-coarse-dry-hair-new-packaging/p/itmens7tpckzkmpk?pid=HTTENS7QW7JMPCNA&affid=siddarthk,http://img.fkcdn.com/image/hair-treatment/c/n/a/joico-250-moisture-recovery-treatment-balm-for-thick-coarse-dry-200x200-imaensb6hqdhdzvt.jpeg,Health and Beauty>Hair Care>Hair Treatments,9999.0,9999.0,9999.0,false,HTTENS7QW7JMPCNA,HTTENS7QW7JMPCNA
Flipkart,,Living Proof Restore Instant Repair (For All Hair Types)(118 ml),"An advanced, instant hair transformer Helps correct & treat hair before, during & after styling Developed with a Restorative Shield, featuring patented Healthy Hair Molecule (OFPMA) Instantly repairs current split ends while preventing 93% of new split ends Makes hair 15x stronger after just one use Perfect for all hair types Safe for color & chemically treated hair Sulfate-free, silicone free, oil-free To use: Apply a small amount to damp hair, focusing on ends. Follow with styling products. Style as usual. Apply to dry hair in moderation for additional smoothing",Living Proof,http://dl.flipkart.com/dl/living-proof-restore-instant-repair-for-all-hair-types/p/itmens7tkzyxdypz?pid=HTTENS7TUG3CWE7P&affid=siddarthk,http://img.fkcdn.com/image/hair-treatment/e/7/p/living-proof-118-restore-instant-repair-for-all-hair-types-200x200-imaensb76hvpenjz.jpeg,Health and Beauty>Hair Care>Hair Treatments,9999.0,9999.0,9999.0,false,HTTENS7TUG3CWE7P,HTTENS7TUG3CWE7P
Flipkart,,BioSilk Clarifying Treatment(350 ml),"Helps eliminate minerals, buildup or residue on hair Formulated with silk based treatments Revives hair back to its healthy condition Loaded with silk proteins Helps penetrate into hair to reinforce strands from within Restores clarified & stronger hair",BioSilk,http://dl.flipkart.com/dl/biosilk-clarifying-treatment/p/itmens7tuz8rdbcg?pid=HTTENS7TNKSZZPYY&affid=siddarthk,http://img.fkcdn.com/image/hair-treatment/p/y/y/biosilk-350-clarifying-treatment-200x200-imaensb7qbf2gwwe.jpeg,Health and Beauty>Hair Care>Hair Treatments,9999.0,9999.0,9999.0,false,HTTENS7TNKSZZPYY,HTTENS7TNKSZZPYY
Flipkart,,Carol's Daughter Monoi Repairing Anti-Breakage Spray(150 ml),"An anti-breakage leave-in conditioner spray Formulated with strengthening Monoi Oil, a nutrient-rich blend of vitamins & minerals Creates the perfect balance that banishes shedding & eases detangling Blended with Coconut Water to protect hair all day long Leaves hair smooth & healthy looking Free of silicones, parabens, mineral oil, artificial colors & petroleum To use: Shake well before use, making sure the two parts have fully combined. Hold 6-8 inches away from wet hair & spray all-over. No need to rinse out",Carol's Daughter,http://dl.flipkart.com/dl/carol-s-daughter-monoi-repairing-anti-breakage-spray/p/itmens7tfafmkz5s?pid=HTTENS7TYNFKH4SE&affid=siddarthk,http://img.fkcdn.com/image/hair-treatment/4/s/e/carol-s-daughter-150-monoi-repairing-anti-breakage-spray-200x200-imaensb7yhetgzex.jpeg,Health and Beauty>Hair Care>Hair Treatments,9999.0,9999.0,9999.0,false,HTTENS7TYNFKH4SE,HTTENS7TYNFKH4SE
Flipkart,,Majik Hair Building Fibers Black Refill Pack(50 g),"MAJIK presents Hair thickening fibre - a Revolutionary , Temporary hair camouflage. Finally a solution to fine or thinning hair. Majik introduces 100 percent human hair thickening fibres. It is a revolutionary way of concealing thinning hair.These fibres are developed with a special technology by which they tend to cling on to individual strands and make them seem thicker and fuller immediately. It is just like adding HAIR to your hair and the instant results are incredible. Majik hair fibres are cut and washed with a special technology which helps in retaining the electrostatic properties of the hair used in manufacturing of the fibre. They are then dyed and charged in a special environment. The dried human hair fibres are then hygienically packed in the special retaining containers. These fibres can be applied quickly with mess by simply shaking the container over the thinning area releasing thousand s of microscopic color matched hair fibres which intertwine with and branch off of your existing natural hair. Majik special Hair bonding Spray is the perfect hair fixative for use with the Majik fibers, creating a strong bond between the microfiber and the hair shaft",Majik,http://dl.flipkart.com/dl/majik-hair-building-fibers-black-refill-pack/p/itmekp8jmzp5qu88?pid=HTTEKPANEARBUG3P&affid=siddarthk,http://img.fkcdn.com/image/hair-treatment/g/3/p/majik-50-hair-building-fibers-black-refill-pack-200x200-imaenrg9xzcagt8p.jpeg,Health and Beauty>Hair Care>Hair Treatments,1299.0,854.0,949.0,true,HTTEKPANEARBUG3P,HTTEKPANEARBUG3P
Flipkart,,Aveda Smooth Infusion Style-Prep Smoother(100 ml),"This treatment helps make styling faster & easier Contains exclusive plant extracts from organic aloe, maize & guar bean Imparts a smooth surface on hair Organic tapioca combats humidity for up to 12 hours Wheat protein shields off surface damage for heat styling Deliciously scented with fresh spicy citrus-floral To use: Apply to damp hair after shampoo & conditioner",Aveda,http://dl.flipkart.com/dl/aveda-smooth-infusion-style-prep-smoother/p/itmens7tkubh898g?pid=HTTENS7THDF8BECH&affid=siddarthk,http://img.fkcdn.com/image/hair-treatment/e/c/h/aveda-100-smooth-infusion-style-prep-smoother-200x200-imaensb6uv4bkgkt.jpeg,Health and Beauty>Hair Care>Hair Treatments,9999.0,9999.0,9999.0,false,HTTENS7THDF8BECH,HTTENS7THDF8BECH
Flipkart,,Carol's Daughter Marula Curl Therapy Softening Hair Mask(200 ml),"A rejuvenating & softening hair mask for curls Packed with Marula, a rich oil harvested for 12,000 years in Madagascar Helps instantly restore & soften curls Boosts definition & manageability of curls Formulated with Sweet Almond Oil for hydrating benefits Unveils bouncier, shinier & perfectly spiral curls To use: Massage into clean, wet hair. Leave on for 5-7 minutes & rinse well. For an extra-deep treatment, put on a shower cap & sit under a warm hood dryer for 10-15 minutes, rinse off",Carol's Daughter,http://dl.flipkart.com/dl/carol-s-daughter-marula-curl-therapy-softening-hair-mask/p/itmens7twe4ggcdz?pid=HTTENS7TRNQPANEY&affid=siddarthk,http://img.fkcdn.com/image/hair-treatment/n/e/y/carol-s-daughter-200-marula-curl-therapy-softening-hair-mask-200x200-imaensb7m3tuzxhs.jpeg,Health and Beauty>Hair Care>Hair Treatments,9999.0,9999.0,9999.0,false,HTTENS7TRNQPANEY,HTTENS7TRNQPANEY
Flipkart,,CHI Transformation System Phase 1 - Solution Formula A (For Resistant/Virgin Hair)(473 ml),"A revolutionary transforming hair treatment Developed with an Advanced American Technology Features ceramic heat, negative ions, pure natural silk & Cationic Hydration Interlink Helps dramatically transform frizzy, curly or coarse hair without any harsh chemicals or ammonia Leaves hair smooth, straight & manageable Works with Transformation System Phase 2 - Bonder Formula A Ideal for resistant or virgin hair For professional use only",CHI,http://dl.flipkart.com/dl/chi-transformation-system-phase-1-solution-formula-for-resistant-virgin-hair/p/itmens7tpkdnguxy?pid=HTTENS7TFCGCWDHN&affid=siddarthk,http://img.fkcdn.com/image/hair-treatment/d/h/n/chi-473-transformation-system-phase-1-solution-formula-a-for-200x200-imaensb6gnb9cdr5.jpeg,Health and Beauty>Hair Care>Hair Treatments,9999.0,9999.0,9999.0,false,HTTENS7TFCGCWDHN,HTTENS7TFCGCWDHN
Flipkart,,Schwarzkopf BC Repair Rescue Deep Nourishing Treatment (For Damaged Hair)(200 ml),"A deep nourishing treatment for normal to extremely damaged hair Provides intensive care for long lasting repairing benefit Fortifies hair to restore new strength & resilience Leaves hair silky smooth & healthy To use: Apply to towel-dried hair & comb through, leave on 5-10 minutes then rinse off",Schwarzkopf,http://dl.flipkart.com/dl/schwarzkopf-bc-repair-rescue-deep-nourishing-treatment-for-damaged-hair/p/itmens7tmnjefnzk?pid=HTTENS7QDEMJPYFH&affid=siddarthk,http://img.fkcdn.com/image/hair-treatment/y/f/h/schwarzkopf-200-bc-repair-rescue-deep-nourishing-treatment-for-200x200-imaensb6ttsruhvk.jpeg,Health and Beauty>Hair Care>Hair Treatments,9999.0,9999.0,9999.0,false,HTTENS7QDEMJPYFH,HTTENS7QDEMJPYFH
Flipkart,,"Nioxin System 2 Scalp Treatment For Fine Hair, Noticeably Thinning Hair with UV Defense Ingredients(100 ml)","A daily leave-in scalp treatment with sunscreen factors Protects scalp from the damage of UVA/B rays Delivers essential botanical, nutrients, antioxidants & vitamins Shields against residues & DHT build up on scalp Creates & maintains a healthy scalp environment Helps improve appearance of thinning hair",Nioxin,http://dl.flipkart.com/dl/nioxin-system-2-scalp-treatment-fine-hair-noticeably-thinning-hair-uv-defense-ingredients/p/itmens7tbmfuzjjt?pid=HTTENS7TNXYCZPPB&affid=siddarthk,http://img.fkcdn.com/image/hair-treatment/p/p/b/nioxin-100-system-2-scalp-treatment-for-fine-hair-noticeably-200x200-imaensb7xncupspk.jpeg,Health and Beauty>Hair Care>Hair Treatments,9999.0,9999.0,9999.0,false,HTTENS7TNXYCZPPB,HTTENS7TNXYCZPPB
Flipkart,,"Carol's Daughter Marguerites Magic Hairdress Restorative Cream (For Dry, Brittle &amp; Textured Hair)(226 ml)","A restorative cream for dry, brittle & textured hair Rich cream that is quickly & easily absorbed into hair Contains a rich blend of Soybean Oil, Cocoa & Shea Butters Deeply nourishes hair to repair & restore natural strength Beeswax protects hair from damage caused by styling or chemical processes Leaves hair soft, silky, manageable & healthy No mineral oil or petroleum to keep hair naturally shiny without greasy a look",Carol's Daughter,http://dl.flipkart.com/dl/carol-s-daughter-marguerites-magic-hairdress-restorative-cream-for-dry-brittle-amp-textured-hair/p/itmens7thu6huxys?pid=HTTENS7TR8SNAFVB&affid=siddarthk,http://img.fkcdn.com/image/hair-treatment/f/v/b/carol-s-daughter-226-marguerites-magic-hairdress-restorative-200x200-imaensb7jrgcj5ue.jpeg,Health and Beauty>Hair Care>Hair Treatments,9999.0,9999.0,9999.0,false,HTTENS7TR8SNAFVB,HTTENS7TR8SNAFVB
Flipkart,,Paul Mitchell Curls Full Circle Leave-In Treatment(200 ml),"A versatile leave-in conditioner for curls Features a lightweight creamy texture Helps hydrate, detangle & tame frizz without overloading hair Replenishes dry locks & protects against damage Unveils suppler, sleeker, bouncier & more manageable curls To use: Apply a generous amount to damp or towel-dried hair. Gently work through with fingers or a comb. Scrunch curls for enhanced shape. Air dry or diffuse",Paul Mitchell,http://dl.flipkart.com/dl/paul-mitchell-curls-full-circle-leave-in-treatment/p/itmens7thzdrmqmf?pid=HTTENS7TWE53PGUA&affid=siddarthk,http://img.fkcdn.com/image/hair-treatment/g/u/a/paul-mitchell-200-curls-full-circle-leave-in-treatment-200x200-imaensb7zttmwfcj.jpeg,Health and Beauty>Hair Care>Hair Treatments,9999.0,9999.0,9999.0,false,HTTENS7TWE53PGUA,HTTENS7TWE53PGUA
