PartnerName,Id,Title,Description,Brand,Link,ImageLink,CategoryName,Mrp,OfferPrice,EffectivePrice,Availability,PartnerIdFromUrl,PartnerIdFromDb
Flipkart,,MAKEUP REVOLUTION LONDON DUO FACE Highlighter,"The Duo Face Sculpt provided effortless contouring in one duo palette. An all over powder which is easy to blend that goes on matte, then you can build up the contour powder to add definition. Silky and easy to blend formula.",MAKEUP REVOLUTION LONDON,http://dl.flipkart.com/dl/makeup-revolution-london-duo-face-highlighter/p/itmeg7as6vf5gdwc?pid=HGLEG7ASAPJEKZT5&affid=siddarthk,http://img.fkcdn.com/image/highlighter/z/t/5/makeup-revolution-london-duo-face-200x200-imaehymefxuddkcn.jpeg,Health and Beauty>Makeup>Face>Highlighters,850.0,800.0,800.0,true,HGLEG7ASAPJEKZT5,HGLEG7ASAPJEKZT5
Flipkart,,Listerine Strip,Zero Calories Dissolve Instantly Sugar Free,Listerine,http://dl.flipkart.com/dl/listerine-strip/p/itmefm4qb5vf9wvp?pid=BFREFM4QWDGZHRTR&affid=siddarthk,http://img.fkcdn.com/image/breath-freshener/r/t/r/30020656-listerine-24-200x200-imaefhdmnjq6eag5.jpeg,Health and Beauty>Body and Skin Care>Oral Care>Breath Fresheners,349.0,245.0,245.0,false,BFREFM4QWDGZHRTR,BFREFM4QWDGZHRTR
Flipkart,,Listerine Pocketmist Spray,"Its gentle mist helps kill 99% of bad breath germs,* promoting a cleaner, fresher mouth.  Keep LISTERINE® POCKETMIST® on your keychain, in your purse, at your desk.  You never know when you'll need a little refresh.",Listerine,http://dl.flipkart.com/dl/listerine-pocketmist-spray/p/itme5xczzsgyr7vx?pid=BFRE5XCZ5YSFHTXY&affid=siddarthk,http://img.fkcdn.com/image/breath-freshener/t/x/y/cool-mint-listerine-15-4-pocketmist-200x200-imae5w4kfzr94tjk.jpeg,Health and Beauty>Body and Skin Care>Oral Care>Breath Fresheners,850.0,750.0,750.0,false,BFRE5XCZ5YSFHTXY,BFRE5XCZ5YSFHTXY
Flipkart,,Listerine Pocket Mist Spray,,Listerine,http://dl.flipkart.com/dl/listerine-pocket-mist-spray/p/itmeagtcdupf8zzz?pid=BFREAGTCMUVXYTNN&affid=siddarthk,http://img.fkcdn.com/image/breath-freshener/t/n/n/0568-listerine-7-7-pocket-mist-200x200-imaeagryub3fy9kz.jpeg,Health and Beauty>Body and Skin Care>Oral Care>Breath Fresheners,495.0,350.0,350.0,false,BFREAGTCMUVXYTNN,BFREAGTCMUVXYTNN
Flipkart,,Noxzema Premium Pivot Twin Blade Disposable Razor,,Noxzema,http://dl.flipkart.com/dl/noxzema-premium-pivot-twin-blade-disposable-razor/p/itmeagu6ue4bqtsf?pid=DSREAGU6AG9Q8MAH&affid=siddarthk,http://img.fkcdn.com/image/disposable-shaving-razor/m/a/h/2-noxzema-premium-pivot-twin-blade-200x200-imaeagshdgjc9vjy.jpeg,Health and Beauty>Body and Skin Care>Body Care>Hair Removal>Disposable Shaving Razors,350.0,195.0,195.0,false,DSREAGU6AG9Q8MAH,DSREAGU6AG9Q8MAH
Flipkart,,Carmex Ultra Moisturizing Twist SPF 15 Lime,"New!With A Fresh New FlavorSpf 15 SunscreenIt Soothes. It Heals. It Protects.®Discover How This New Ultra Smooth, Extra Moisturizing Formula Makes Your Lips Feel Incredible. This Fun, Fresh New Flavor Is Unlike Anything You'Ve Tried From Carmex Before. For Over 70 Years The Woelbing Family Had Been Making Carmex Lip Balm. Tested On Family Members - Not On Animals.IndicationsLip Moisturizer And Sunscreen.Drug Interaction PrecautionsThis Is A Personal Care Item, And Should Be Used By One Ind",Carmex,http://dl.flipkart.com/dl/carmex-ultra-moisturizing-twist-spf-15-lime/p/itmeb7yhcxmh5gxf?pid=LPBEB7YHZ6XH6XFE&affid=siddarthk,http://img.fkcdn.com/image/lip-balm/x/f/e/carmex-4-25-ultra-moisturizing-twist-spf-15-200x200-imaeb6bjs7ayfft4.jpeg,Health and Beauty>Body and Skin Care>Lip Care>Lip Balms,350.0,295.0,295.0,false,LPBEB7YHZ6XH6XFE,LPBEB7YHZ6XH6XFE
Flipkart,,Burt's Bees Orchid Tinted Blush,"For just a hint of color and a whole lot of conditioning. The Botanical Waxes in these softly tinted balms will take your lips to lovely in one pretty swipe.• Adds a hint of natural color• Nourishes with Shea Butter and Botanical Waxes Read more at http://www.burtsbees.com/Tinted-Lip-Balm---Blush-Orchid/01772-00,default,pd.html#GSCLDO3PI1SlWbkM.99",Burt's Bees,http://dl.flipkart.com/dl/burt-s-bees-orchid-tinted-blush/p/itmebknpgvzay8jx?pid=LPBEBKNPUPGXAEXG&affid=siddarthk,http://img.fkcdn.com/image/lip-balm/e/x/g/burt-s-bees-4-25-orchid-tinted-200x200-imaebgmhh98hdzfd.jpeg,Health and Beauty>Body and Skin Care>Lip Care>Lip Balms,995.0,795.0,795.0,false,LPBEBKNPUPGXAEXG,LPBEBKNPUPGXAEXG
Flipkart,,EOS Visibly Soft Lip Balm Sphere Coconut Milk,"Evolution of Smooth™Get noticed with visibly softer lips. Nourish your lips with the delicious flavor of coconut milk.Immediately Softer, More Beautiful LipsHydrates & Nourisheseos visibly soft™ lip balm sphere absorbs deeply to nourish lips for a softness you can see and feel. Enriched with natural conditioning oils, moisturizing shea butter and antioxidant vitamins C & E, eos restores and smooths lips from the inside out.More softness - more to smile about.Petroleum free. Paraben free. Gluten free",EOS,http://dl.flipkart.com/dl/eos-visibly-soft-lip-balm-sphere-coconut-milk/p/itmebj7umjbgk7ax?pid=LPBEBJ7UGZ9ECWXW&affid=siddarthk,http://img.fkcdn.com/image/lip-balm/w/x/w/eos-7-visibly-soft-lip-balm-sphere-200x200-imaebgnszrwj4knt.jpeg,Health and Beauty>Body and Skin Care>Lip Care>Lip Balms,650.0,550.0,550.0,false,LPBEBJ7UGZ9ECWXW,LPBEBJ7UGZ9ECWXW
Flipkart,,Blistex Lip Vibrance Lip Protectant SPF 15 With Sunscreen,,Blistex,http://dl.flipkart.com/dl/blistex-lip-vibrance-protectant-spf-15-sunscreen/p/itmebj7v4bmaaseg?pid=LPBEBJ7VTHQBUFGJ&affid=siddarthk,http://img.fkcdn.com/image/lip-balm/f/g/j/blistex-3-69-lip-vibrance-lip-protectant-spf-15-200x200-imaebghsn54bnsz4.jpeg,Health and Beauty>Body and Skin Care>Lip Care>Lip Balms,550.0,450.0,450.0,false,LPBEBJ7VTHQBUFGJ,LPBEBJ7VTHQBUFGJ
Flipkart,,"Carmex Moisture Plus Ultra Hydrating Lip Balm Spf 15 Clear Vit E Aloe Moisturising, Clear Gloss Finish",Carmex Moisture Plus Ultra Hydrating Lip Balm SPF 15 Clear 0.08 oz,Carmex,http://dl.flipkart.com/dl/carmex-moisture-plus-ultra-hydrating-lip-balm-spf-15-clear-vit-e-aloe-moisturising-gloss-finish/p/itmebknphu7ez3ge?pid=LPBEBKNPZCZ6SYVC&affid=siddarthk,http://img.fkcdn.com/image/lip-balm/y/v/c/carmex-2-moisture-plus-ultra-hydrating-lip-balm-spf-15-clear-200x200-imaebgneps9pwb6x.jpeg,Health and Beauty>Body and Skin Care>Lip Care>Lip Balms,1250.0,750.0,750.0,false,LPBEBKNPZCZ6SYVC,LPBEBKNPZCZ6SYVC
Flipkart,,Carmex Click-Stick Moisturizing Lip Balm Cherry,"Carmex Moisturizing Lip Balm Cherry Click Stick, 0.15 OzSunscreen Spf 15Long-Lasting Relief For Dry Chapped LipsIt Soothes, It Heals, It ProtectsNo. 1 Pharmacist Recommended Lip Balm",Carmex,http://dl.flipkart.com/dl/carmex-click-stick-moisturizing-lip-balm-cherry/p/itmebknp5hh6bf5n?pid=LPBEBKNPU3YZMWUY&affid=siddarthk,http://img.fkcdn.com/image/lip-balm/w/u/y/carmex-4-25-click-stick-moisturizing-lip-balm-200x200-imaebgmruu5ugdun.jpeg,Health and Beauty>Body and Skin Care>Lip Care>Lip Balms,350.0,295.0,295.0,false,LPBEBKNPU3YZMWUY,LPBEBKNPU3YZMWUY
Flipkart,,Burt's Bees Moisturizing Lip Balm Mango,,Burt's Bees,http://dl.flipkart.com/dl/burt-s-bees-moisturizing-lip-balm-mango/p/itmebcahjhgtbqus?pid=LPBEBCAHYM7SZRTP&affid=siddarthk,http://img.fkcdn.com/image/lip-balm/r/t/p/burt-s-bees-4-25-moisturizing-lip-balm-200x200-imaebbv77zrrnck9.jpeg,Health and Beauty>Body and Skin Care>Lip Care>Lip Balms,750.0,495.0,495.0,false,LPBEBCAHYM7SZRTP,LPBEBCAHYM7SZRTP
Flipkart,,Carmex Click Stick Moisturizing Spf 15 Strawberry,Carmex Click-Stick Moisturizing Lip Balm SPF 15 Strawberry 0.15 oz,Carmex,http://dl.flipkart.com/dl/carmex-click-stick-moisturizing-spf-15-strawberry/p/itmebmtu2nudhe8n?pid=LPBEBMTUYNDCGPFE&affid=siddarthk,http://img.fkcdn.com/image/lip-balm/p/f/e/carmex-4-25-click-stick-moisturizing-spf-15-200x200-imaeb6bty8dmycgg.jpeg,Health and Beauty>Body and Skin Care>Lip Care>Lip Balms,350.0,295.0,295.0,false,LPBEBMTUYNDCGPFE,LPBEBMTUYNDCGPFE
Flipkart,,Carmex Moisture Plus Clear Gloss Finish CHIC Soft Vanilla,"It soothes. It heals. It protects.We don't think you need to sacrifice function to be fashionable. That's why we came up with new ultra hydrating lip balm.It comes in a sleek, slant tip applicator that looks fabulous and works even better.It's formulated with vitamin E, aloe, shea butter and SPF 15 to penetrate, moisturize and protect your lips.Use under or over lipstick, or of course, the satin gloss finish looks great by itself - keeping your lips soft, supple and smooth.Apply liberally 15 minutes before sun exposure. Reapply at least every 2 hours. use a water resistant sunscreen if swimming or sweating. Children under 6 months: Ask a doctor. Protect this product from excessive heat and direct sun.",Carmex,http://dl.flipkart.com/dl/carmex-moisture-plus-clear-gloss-finish-chic-soft-vanilla/p/itmecgmcqe6mxfp9?pid=LPBECGMCD6SCXUQG&affid=siddarthk,http://img.fkcdn.com/image/lip-balm/u/q/g/carmex-2-moisture-plus-clear-gloss-finish-chic-200x200-imaecg3n9pgbraca.jpeg,Health and Beauty>Body and Skin Care>Lip Care>Lip Balms,750.0,500.0,500.0,false,LPBECGMCD6SCXUQG,LPBECGMCD6SCXUQG
Flipkart,,Blistex Complete Moisture SPF 15 Complete Moisture,"Moisture PlusUltra-Hydrating IngredientsPenetrates To Quench Dry LipsA Surge Of Moisture Lips Can FeelTreat Your Lips To A Unique Moisturizing Sensation!Complete Moisture™ Combines Advanced Hydrating Ingredients With Moisture Itself To Deliver A Super-Moisturizing Effect You'Ll Feel Immediately.Penetrating Moisturizers: Complete Moisture Is Formulated With Moisturizing Ingredients That Actually Penetrate Into Dry Lips, Instead Of Just Sitting On The Surface.Contains Moisture: Unlike Ordinary Lip Balms, Complete Moisture Actually Contains Moisture Itself To Quench Dry, Thirsty Lips. It'S A Difference You'Ll Notice Instantly.Sun Protection/Sun Alert: Aminobenzoic Acid (Paba)-Free Complete Moisture Provides Spf 15 Protection. Limiting Sun Exposure, Wearing Protective Clothing, And Using Sunscreens May Reduce The Risks Of Skin Aging, Skin Cancer And Other Harmful Effects Of The Sun",Blistex,http://dl.flipkart.com/dl/blistex-complete-moisture-spf-15/p/itmecmyepmxxfggn?pid=LPBECMYEVCRCVUET&affid=siddarthk,http://img.fkcdn.com/image/lip-balm/u/e/t/blistex-4-25-complete-moisture-spf-15-200x200-imaeckdepkhcwtae.jpeg,Health and Beauty>Body and Skin Care>Lip Care>Lip Balms,395.0,300.0,300.0,false,LPBECMYEVCRCVUET,LPBECMYEVCRCVUET
Flipkart,,Burt's Bees Ultra Conditioning Kokum Butter,"Ultra Conditioning Lip Balm with Kokum ButterKiss dry lips goodbye. Clinically proven to offer 4 hours of long-lasting moisturization, this ultra-hydrating lip conditioner is infused with rich Kokum, Shea, and Cocoa Butters. Giving you more butters and less wax than other balms, so your lips will be left soft and super smooth. It's hydration at its very highest, with no added flavors or fragrancesRead more at http://www.burtsbees.com/Ultra-Conditioning-Lip-Balm-with-Kokum-Butter",Burt's Bees,http://dl.flipkart.com/dl/burt-s-bees-ultra-conditioning-kokum-butter/p/itmebv89z4rhwyhb?pid=LPBEBV89NXQQ9JH3&affid=siddarthk,http://img.fkcdn.com/image/lip-balm/j/h/3/burt-s-bees-4-25-ultra-conditioning-200x200-imaebuhgemaxkkqe.jpeg,Health and Beauty>Body and Skin Care>Lip Care>Lip Balms,650.0,495.0,495.0,false,LPBEBV89NXQQ9JH3,LPBEBV89NXQQ9JH3
Flipkart,,Blistex Protectant SPF 15 Orange Mango,"Lip Protectant / SunscreenComforts & Protects LipsMoisturizes Dry LipsRefreshing Fruit BlendBlistex Orange Mango Blast moisturizes, protects and refreshes lips with a tantalizing fruit blend.Super Smooth MoisturizationOrange Mango Blast is fortified with antioxidant vitamins C & E and rich moisturizers to quench your lips. It's a smooth-gliding balm that leaves lips feeling protected and totally juicy.Refreshing Flavor SensationOrange Mango Blast is a delicious pairing of two tasty fruit flavors: Juicy Orange melds with sweet, tropical mango for a tangy explosive combination. It's as delicious as it is effective.",Blistex,http://dl.flipkart.com/dl/blistex-protectant-spf-15-orange-mango/p/itmecmye2rdrkszn?pid=LPBECMYEGYGYJFTP&affid=siddarthk,http://img.fkcdn.com/image/lip-balm/f/t/p/blistex-4-25-protectant-spf-15-200x200-imaeckd63zdvrwwf.jpeg,Health and Beauty>Body and Skin Care>Lip Care>Lip Balms,395.0,300.0,300.0,false,LPBECMYEGYGYJFTP,LPBECMYEGYGYJFTP
Flipkart,,Carmex Moisture Plus Limited Edition Girly Soft Vanilla,,Carmex,http://dl.flipkart.com/dl/carmex-moisture-plus-limited-girly-soft-vanilla/p/itmecgnbzshx5hnf?pid=LPBECGNBZGGKGH8R&affid=siddarthk,http://img.fkcdn.com/image/lip-balm/h/8/r/carmex-2-moisture-plus-limited-edition-girly-200x200-imaecg3zpr6kkmcm.jpeg,Health and Beauty>Body and Skin Care>Lip Care>Lip Balms,750.0,550.0,550.0,false,LPBECGNBZGGKGH8R,LPBECGNBZGGKGH8R
Flipkart,,chapstik Classic Skin Protectant Subscreen Classic,"Your lips need more than just moisture; they need protection. ChapStick Classic Skin Protectant/Sunscreen hydrates your dry lips and keeps them safe from the sun’s harmful rays with SPF 4. With your lips protected from the sun, the ChapStick also gives you soft, moisturized, healthy lips every day.,Features & Benefits:Helps protect chapped lips",chapstik,http://dl.flipkart.com/dl/chapstik-classic-skin-protectant-subscreen/p/itmecvwxk8jzyqjt?pid=LPBECVWXZHDGZGUU&affid=siddarthk,http://img.fkcdn.com/image/lip-balm/g/u/u/chapstik-4-classic-skin-protectant-subscreen-200x200-imaecvgazzyeqrk5.jpeg,Health and Beauty>Body and Skin Care>Lip Care>Lip Balms,350.0,250.0,250.0,false,LPBECVWXZHDGZGUU,LPBECVWXZHDGZGUU
Flipkart,,Burt'S Bees Island Passion Fruit,"Take a mini-vacation with our tropically-inspired lip balm. Infused with Passion Fruit Extract and a touch of Coconut Oil, it's sure to give you beautiful lips on or off the beach.* Softens lips with Passion Fruit Extract and Coconut Oil. * Sweet Passion Fruit flavor . * Medium-weight, creamy formulaRead more at http://www.burtsbees.com/Island-Lip-Balm/02200-00,default,pd.html#1h6YiaYSUzfBpuoI.99",Burt'S Bees,http://dl.flipkart.com/dl/burt-s-bees-island-passion-fruit/p/itmecayjvuz5ta88?pid=LPBECAYJNWUDYAYZ&affid=siddarthk,http://img.fkcdn.com/image/lip-balm/a/y/z/burt-s-bees-4-25-island-200x200-imaecaf5d98qxdtx.jpeg,Health and Beauty>Body and Skin Care>Lip Care>Lip Balms,650.0,495.0,495.0,false,LPBECAYJNWUDYAYZ,LPBECAYJNWUDYAYZ
Flipkart,,Burt's Bees Tinted Lip Balm Honeysuckle,"Keep Your Lips Moisturized And Nourished While Adding A Hint Of Color With Tinted Lip Balm From Burt'S Bees.This Balm Is 100 Percent Natural And Contains Nourishing Ingredients Like Shea Butter, Among Others, To Help Keep Your Lips Smooth, Soft And Beautiful. Tinted Lip Balm From Burt'S Bees Comes In A Variety Of Nine Pretty Shades. Botanical Waxes Help Make This Lip Balm A Great Choice In Natural Lip Care Products.Tinted Lip Balm From Burt'S Bees Can Help Make Your Lips Soft, Supple And Healthy With A Naturally Pretty Hue. Get It Today At Evitamins!",Burt's Bees,http://dl.flipkart.com/dl/burt-s-bees-tinted-lip-balm-honeysuckle/p/itmedc5svamjv83n?pid=LPBEDC5SCX3ME5U7&affid=siddarthk,http://img.fkcdn.com/image/lip-balm/5/u/7/burt-s-bees-4-25-tinted-lip-balm-200x200-imaedc2arz5ngyeq.jpeg,Health and Beauty>Body and Skin Care>Lip Care>Lip Balms,999.0,825.0,825.0,false,LPBEDC5SCX3ME5U7,LPBEDC5SCX3ME5U7
Flipkart,,Chap-Eze Skin Protectant Medicated,,Chap-Eze,http://dl.flipkart.com/dl/chap-eze-skin-protectant-medicated/p/itmeej44zyc5zfzv?pid=LPBEEJ44THBCFNJS&affid=siddarthk,http://img.fkcdn.com/image/lip-balm/n/j/s/chap-eze-4-25-skin-protectant-200x200-imaeeej2sgrachp6.jpeg,Health and Beauty>Body and Skin Care>Lip Care>Lip Balms,450.0,399.0,399.0,false,LPBEEJ44THBCFNJS,LPBEEJ44THBCFNJS
Flipkart,,Carmex Classic Moisturizing Lip Balm Classic,"Used on its own to give a fresh and natural appearance, or as a lipstick undercoat or sealant, Carmex will leave your lips nourished and conditioned.",Carmex,http://dl.flipkart.com/dl/carmex-classic-moisturizing-lip-balm/p/itme9feb2purgbgx?pid=LPBE9F36MYC8ZU3W&affid=siddarthk,http://img.fkcdn.com/image/lip-balm/u/3/w/carmex-10-classic-moisturizing-lip-balm-200x200-imae9fyeysvzbyrg.jpeg,Health and Beauty>Body and Skin Care>Lip Care>Lip Balms,600.0,295.0,295.0,false,LPBE9F36MYC8ZU3W,LPBE9F36MYC8ZU3W
Flipkart,,BLISTEX lip medex value size medex,"DescriptionValue SizeRelieves Sore Lips & Restores Moisture BalanceQuickly Cools & ComfortsBlistex Lip Medex has an Ultra-Med formula to provide quick cooling lip relief you can feel working.Lip Medex also helps to restore a healthy moisture balance to lips.Sore Lips: Lip Medex's medicated ingredients deliver a noticeable and immediate cooling action in provide fast relief from the hot, itching sensations that accompany sore lips.Serious Dryness: Lip Medex provides a special barrier that helps lip cells return to their natural moisture balance.UsesFor the temporary relief of pain and itching associated with minor lip irritationTemporary protects and helps relieve chapped or cracked lipsHelps protect lips from the drying effects of wind and cold weatherSuggested UseAdults and children 2 years of age and older: Apply to affected area not more than 3 to 4 times dailyChildren under 2 years of age: Consult a doctor",BLISTEX,http://dl.flipkart.com/dl/blistex-lip-medex-value-size/p/itmefydjq5vffczg?pid=LPBEFYDJMUZMMSTJ&affid=siddarthk,http://img.fkcdn.com/image/lip-balm/s/t/j/blistex-10-75-lip-medex-value-size-200x200-imaefwexdzvhaz4c.jpeg,Health and Beauty>Body and Skin Care>Lip Care>Lip Balms,595.0,475.0,475.0,false,LPBEFYDJMUZMMSTJ,LPBEFYDJMUZMMSTJ
Flipkart,,Burt's Bees Beeswax Lip Balm Vitamine & Peppermint,"The original. The best. And still your favorite. The must-have balms have been playing in purses and pockets since 1991. Beeswax conditions skin, while antioxidant Vitamin E moisturizes. A final hint of Peppermint Oil provides that one-of-a-kind refreshing tingle. The result? Smooth, supple lips everyone will be buzzing about.",Burt's Bees,http://dl.flipkart.com/dl/burt-s-bees-beeswax-lip-balm-vitamine-peppermint/p/itme482z23sg5h9u?pid=LPBE482ZNHWQ8BP2&affid=siddarthk,http://img.fkcdn.com/image/lip-balm/b/p/2/burt-s-bee-4-25-beeswax-lip-balm-vitamine-peppermint-200x200-imaeyut5bvjjkmzf.jpeg,Health and Beauty>Body and Skin Care>Lip Care>Lip Balms,599.0,495.0,495.0,false,LPBE482ZNHWQ8BP2,LPBE482ZNHWQ8BP2
Flipkart,,Burt's Bees Lip Balm Vanilla,"A luxuriously complex and comforting lip balm bursting with all-natural vanilla. Couple that with moisturizing Shea Butter and soothing Vitamin E, and you’ve got a true treat for happy lips.Nourishes with Shea Butter and Antioxidant Rich Vitamin EComplex Vanilla scent• 100% Natural",Burt's Bees,http://dl.flipkart.com/dl/burt-s-bees-lip-balm-vanilla/p/itme482zz9q8fdnj?pid=LPBE482ZJUZUKBDM&affid=siddarthk,http://img.fkcdn.com/image/lip-balm/b/d/m/burt-s-bee-4-25-lip-balm-vanilla-200x200-imae45wkm8xhnm7z.jpeg,Health and Beauty>Body and Skin Care>Lip Care>Lip Balms,599.0,450.0,450.0,false,LPBE482ZJUZUKBDM,LPBE482ZJUZUKBDM
Flipkart,,Himalaya Intensive Lip Balm Natural(4.5 g),,Himalaya,http://dl.flipkart.com/dl/himalaya-intensive-lip-balm-natural/p/itme3n3xmj4h8v3m?pid=LPBE3N3XMJYHKFYN&affid=siddarthk,http://img.fkcdn.com/image/lip-balm/f/y/n/himalaya-herbals-4-5-intensive-lip-balm-200x200-imae3n5gvcfusx95.jpeg,Health and Beauty>Body and Skin Care>Lip Care>Lip Balms,100.0,95.0,95.0,false,LPBE3N3XMJYHKFYN,LPBE3N3XMJYHKFYN
Flipkart,,Burt's Bees Ultra Conditioning Lip Balm with Kokum Butter(4.25 g),"Kiss dry lips goodbye. Clinically proven to offer 4 hours of long-lasting moisturization, this ultra-hydrating lip conditioner is infused with rich Kokum, Shea, and Cocoa Butters. Giving you more butters and less wax than other balms, so your lips will be left soft and super smooth. It's hydration at its very highest, with no added flavors or fragrances.Clinically proven to moisturize for 4 hours with 1 applicationHypo-allergenic with no added flavors or fragrancesReplenishes skin with Kokum, Cocoa and Shea Butters that melt on lipsLeaves lips feeling soft, supple and healthy",Burt's Bees,http://dl.flipkart.com/dl/burt-s-bees-ultra-conditioning-lip-balm-kokum-butter/p/itme482zmhrrgacn?pid=LPBE482ZVYDHPSYV&affid=siddarthk,http://img.fkcdn.com/image/lip-balm/s/y/v/burt-s-bee-4-25-ultra-conditioning-lip-balm-with-kokum-butter-200x200-imae47fakgrhsrgy.jpeg,Health and Beauty>Body and Skin Care>Lip Care>Lip Balms,599.0,450.0,450.0,false,LPBE482ZVYDHPSYV,LPBE482ZVYDHPSYV
Flipkart,,Chap Ice Lip Balm Spf-15 (Made in USA) Moisture,"Tried and true, our most popular lip balms make any first time user become a lip balm enthusiast. Are your lips a little chapped? Repair the damage with Chap Ice lip balm. Not only will you repair your lips, you can protect them with our SPF formulas! Uses: Helps prevent & temporarily protects chafed,chapped,cracked,dry & windburned lips.",Chap Ice,http://dl.flipkart.com/dl/chap-ice-lip-balm-spf-15-made-usa-moisture/p/itme5h4xrxhcubdk?pid=LPBE5H4XUY8HH72X&affid=siddarthk,http://img.fkcdn.com/image/lip-balm/7/2/x/chap-ice-4-25-lip-balm-spf-15-made-in-usa-200x200-imae4ygtdqjagamh.jpeg,Health and Beauty>Body and Skin Care>Lip Care>Lip Balms,300.0,250.0,250.0,false,LPBE5H4XUY8HH72X,LPBE5H4XUY8HH72X
Flipkart,,Mentholatum Medicated Lip Balm Sport,"Natural Ice Sport® is specially designed for extreme weather conditions and provides year round protection from the effects of sun, wind, cold, and heat.",Mentholatum,http://dl.flipkart.com/dl/mentholatum-medicated-lip-balm-sport/p/itme5qp5hzg2fxwk?pid=LPBE5QP5HFGNABVH&affid=siddarthk,http://img.fkcdn.com/image/lip-balm/7/2/n/mentholatum-4-5-medicated-lip-balm-200x200-imae5qsmaf96psxw.jpeg,Health and Beauty>Body and Skin Care>Lip Care>Lip Balms,200.0,200.0,200.0,false,LPBE5QP5HFGNABVH,LPBE5QP5HFGNABVH
Flipkart,,Mentholatum Medicated Lip Balm Original,"Natural Ice® Original smooth glide on formula and cooling sensation has become a favorite of the National Ski Patrol. It’s formula gives long lasting protection and helps heal dry, chapped lips.",Mentholatum,http://dl.flipkart.com/dl/mentholatum-medicated-lip-balm-original/p/itme5qp5hzg2fxwk?pid=LPBE5RVW4WNVD72N&affid=siddarthk,http://img.fkcdn.com/image/lip-balm/7/2/n/mentholatum-4-5-medicated-lip-balm-200x200-imae5qsmaf96psxw.jpeg,Health and Beauty>Body and Skin Care>Lip Care>Lip Balms,300.0,250.0,250.0,false,LPBE5RVW4WNVD72N,LPBE5RVW4WNVD72N
Flipkart,,Mentholatum Medicated Lip Balm Cherry,"Natural Ice® Cherry distinctive cherry scent and cooling sensation makes it a favorite of millions. It’s smooth glide-on formula gives long lasting protection and helps heal dry, chapped lips.",Mentholatum,http://dl.flipkart.com/dl/mentholatum-medicated-lip-balm-cherry/p/itme5qp5hzg2fxwk?pid=LPBE5QP5CAHS2HKU&affid=siddarthk,http://img.fkcdn.com/image/lip-balm/h/k/u/mentholatum-4-5-medicated-lip-balm-200x200-imae5qsmbkffffk3.jpeg,Health and Beauty>Body and Skin Care>Lip Care>Lip Balms,300.0,295.0,295.0,false,LPBE5QP5CAHS2HKU,LPBE5QP5CAHS2HKU
Flipkart,,Chap Ice Lip Balm Spf -4 (Made in USA) Cherry,"Tried and true, our most popular lip balms make any first time user become a lip balm enthusiast. Are your lips a little chapped? Repair the damage with Chap Ice lip balm. Not only will you repair your lips, you can protect them with our SPF formulas! Uses: Helps prevent & temporarily protects chafed,chapped,cracked,dry & windburned lips.",Chap Ice,http://dl.flipkart.com/dl/chap-ice-lip-balm-spf-4-made-usa-cherry/p/itme5h4xcgey9rn6?pid=LPBE5H4XBNYGRTKU&affid=siddarthk,http://img.fkcdn.com/image/lip-balm/t/k/u/chap-ice-4-25-lip-balm-spf-4-made-in-usa-200x200-imae4ygtejs6dzkx.jpeg,Health and Beauty>Body and Skin Care>Lip Care>Lip Balms,200.0,140.0,140.0,false,LPBE5H4XBNYGRTKU,LPBE5H4XBNYGRTKU
Flipkart,,Chapstick Skin Protectant Moisturizer Original,,Chapstick,http://dl.flipkart.com/dl/chapstick-skin-protectant-moisturizer-original/p/itme7xc47xzdnxtm?pid=LPBE7XC4DYR3Z6HD&affid=siddarthk,http://img.fkcdn.com/image/lip-balm/6/h/d/chapstick-12-skin-protectant-moisturizer-200x200-imae7wgkrkn3pzzu.jpeg,Health and Beauty>Body and Skin Care>Lip Care>Lip Balms,900.0,699.0,699.0,false,LPBE7XC4DYR3Z6HD,LPBE7XC4DYR3Z6HD
Flipkart,,Blistex Silk and Shine Natural,"Silk & Shine'S Unique Silk And Vitamin Formula Makes Lips Feel Satiny Smooth And Enhances Their Natural Appearance With A Light Glossy Shine.Super-Silky Lips: Silk & Shine Feels Satiny Soft Going On And Leaves Your Lips Feeling That Way. Silk Extracts, Special Moisturizers And Vitamins B5 And E Help Create A Silky Texture That Makes Lip Surfaces Smooth And Supple. It Feels Great!A Touch Of Shine: Silk & Shine Imparts A Touch Of Sheer Gloss To The Lips For A Healthy, Finished Appearance. Your Lips Will Look As Good As They Feel.Spf 15 Sun Protection",Blistex,http://dl.flipkart.com/dl/blistex-silk-shine-natural/p/itme72hhn84kxcqz?pid=LPBE72HHFWRX7V4T&affid=siddarthk,http://img.fkcdn.com/image/lip-balm/v/4/t/blistex-3-69-silk-and-shine-200x200-imae7ybma7dyxgfg.jpeg,Health and Beauty>Body and Skin Care>Lip Care>Lip Balms,600.0,450.0,450.0,false,LPBE72HHFWRX7V4T,LPBE72HHFWRX7V4T
Flipkart,,Chapstick Skin Protectant LipSpiration Flava-Craze,,Chapstick,http://dl.flipkart.com/dl/chapstick-skin-protectant-lipspiration-flava-craze/p/itme7wq4jqhtnuxv?pid=LPBE7WQ4ZXA3RHGG&affid=siddarthk,http://img.fkcdn.com/image/lip-balm/h/g/g/chapstick-12-skin-protectant-lipspiration-200x200-imae7wjzvyhxphqp.jpeg,Health and Beauty>Body and Skin Care>Lip Care>Lip Balms,900.0,599.0,599.0,false,LPBE7WQ4ZXA3RHGG,LPBE7WQ4ZXA3RHGG
Flipkart,,Chapstick Skin Protectant Classic Original,,Chapstick,http://dl.flipkart.com/dl/chapstick-skin-protectant-classic-original/p/itme7wq4bdehgz9g?pid=LPBE7WQ4ZNENHZYK&affid=siddarthk,http://img.fkcdn.com/image/lip-balm/z/y/k/chapstick-4-skin-protectant-classic-200x200-imae7wk4ngyahx8y.jpeg,Health and Beauty>Body and Skin Care>Lip Care>Lip Balms,600.0,350.0,350.0,false,LPBE7WQ4ZNENHZYK,LPBE7WQ4ZNENHZYK
