PartnerName,Id,Title,Description,Brand,Link,ImageLink,CategoryName,Mrp,OfferPrice,EffectivePrice,Availability,PartnerIdFromUrl,PartnerIdFromDb
Flipkart,,Tattoo Goo Healix Gold + Panthenol Lotion 2oz & Free Heal It(No Design),"Tattoo Goo Healix Gold+Panthenol Lotion - 2ozTattoo Goo Aftercare Lotion Healix Gold + Panthenol This is a water based formula with a unique combination of Vitamins A & D, healthy skin ingredients, and proven moisturizers that helps to restore your skins moisture balance while boosting the tattoo healing process to ensure quicker healing and better looking tattoos. A revolutionary formula with PANTHENOL, the world's most recommended tattoo aftercare ingredient, to create new and improved Tattoo Goo Lotion. Extra emollients help draw moisture from the air, enhancing the humectant process. This skin repair and moisturizing formula revitalizes tattoo COLOR with great care useful for both the old as well as new tattoo. It heals and protects dry skin. The Lotion was developed for people having sensitive skin. It is gentle enough to use on the face and is perfect for everyday use. It offers a completely non-greasy solution that will absorb quickly and deeply into the skin to provide you with long lasting protection, not only against dryness but against bacteria too. This is an excellent solution, given that it contains all of the essential healing ingredients without any of the negative additions; there is no petroleum to clog the pores, and it smells considerably better than petroleum based products but does not contain any additional dyes or fragrances. The Lotion is available in a 2oz tube. Heat- It A Tattoo healing soap, cleans and beats swelling and pain of fresh Tattoo, made up of natural extract (Minerals, Vitamins) from pure vegetable oils and glycerin, in pack of 1oz .Clean your tattoo twice a day with Heal-it",Tattoo Goo,http://dl.flipkart.com/dl/tattoo-goo-healix-gold-panthenol-lotion-2oz-free-heal/p/itmeggfse8mp4w2q?pid=TTTEGGFSQSQ9MZDN&affid=siddarthk,http://img.fkcdn.com/image/tattoo/z/d/n/tgg-pl-2oz-hi-tattoo-goo-200x200-imaegf2y5u9myqwp.jpeg,Health and Beauty>Makeup>Body>Tattoos,600.0,550.0,550.0,true,TTTEGGFSQSQ9MZDN,TTTEGGFSQSQ9MZDN
Flipkart,,Tattoo Goo Original Ointment Pillow Pack - 4ml,"Tattoo goo Pillow Pack 4mlTattoo Goo Original Pillow packs A unique natural formula based with herbs oils and vitamins. Allows the skin to breathe and helps to ""soothe"" the tattoo as it heals. The Original Tattoo Goo is the Natural Choice for healing your tattoo, based with eight different natural ingredients; the ""Original"" is 99% Natural. Unlike other commercially available products. Tattoo Goo, does not contain Lanolin, Alcohol, or Petroleum, that can actually burn, clog the pours and pull the Ink from the Tattoo and is fragrance free. Tattoo Goo contains no petroleum, no lanolin, Pillow packs come in pack of 2 pcs, Tattoo Goo is the first aftercare that has been clinically and dermatologist tested, not to cause skin irritation or skin allergic reactions. About Tattoo Goo: Tattoo Goo is the first aftercare that has been clinically and dermatologist tested, Cannot give rise to any skin irritation or allergic reactions. A unique natural formula formulated with herbal oils and vitamins. • Pharmacist developed • All natural ingredients • Lanolin and petroleum free • Promotes faster healing time",Tattoo Goo,http://dl.flipkart.com/dl/tattoo-goo-original-ointment-pillow-pack-4ml/p/itmeggfrczf8pmdn?pid=TTTEGGFRAWXYPK4J&affid=siddarthk,http://img.fkcdn.com/image/tattoo/k/4/j/tgopp-4ml-tattoo-goo-200x200-imaebq5hhqnftrmz.jpeg,Health and Beauty>Makeup>Body>Tattoos,350.0,300.0,300.0,true,TTTEGGFRAWXYPK4J,TTTEGGFRAWXYPK4J
Flipkart,,Tattoo Goo Color Guard 30 SPF,"Tattoo color Guard 0.45ozTattoo Goo Color Guard Tattoo Protection with UVA/UVB Sunscreen SPF 30 - .45 oz. (13g). The Tattoo Goo Color Guard tattoo protection stick helps in moisturizing the tattoo while enhancing its color too. It has an SPF 30 rating plus special UV/UVA inhibitors to help protect tattoos from fading. The large stick allows precision application, helps to protect the tattoo while allowing for regular tanning of other skin areas. Basically sun is the enemy of your tattoo. The powerful ultra-violet rays (UVR) of the sun change fade, and destroy all it comes in contact with over a period of time. It takes only 1 hour of direct sunlight to ruin a new unprotected tattoo. Color Guard with its unique formula acts as a shield for your tattoo while it rejuvenates the appearance of your tattoo. Color Guard moisturizes your tattoo while continually enhancing its color applies easily, precisely and clearly until fully absorbed Enriches your skin naturally with extracts of Aloe, plus contain enriched with Vitamin E-Complex Helps fight against premature aging and is a safe hypoallergenic solution to long term skin care. Colour Guard was established to create exclusive skin care products to improve and protect the longevity of tattoos whether you are involved with water sports, sunning, skiing or working outdoors. Like all Lakeview Laboratories products they are not tested on animals. Tattoo Goo is the best product available for the treatment of your new tattoo. Unlike other commercially available products Tattoo Goo actively supports the tattoo community. Allow new tattoos to heal three weeks before using. Tattoo Goo Colour Guard Stick",Tattoo Goo,http://dl.flipkart.com/dl/tattoo-goo-color-guard-30-spf/p/itmeggfspmrvn6pz?pid=TTTEGGFSWSRWNFU3&affid=siddarthk,http://img.fkcdn.com/image/tattoo/f/u/3/tgcg-0-45oz-tattoo-goo-200x200-imaegf2yhyxcdgwn.jpeg,Health and Beauty>Makeup>Body>Tattoos,600.0,550.0,550.0,true,TTTEGGFSWSRWNFU3,TTTEGGFSWSRWNFU3
Flipkart,,Tattoo Goo Original Ointment 9.3gm & Free Heal It,"Tattoo Goo is a healing balm to be applied after you get a tattoo: It is meant to preserve and enhance the colors of the tattoo, moisturize to avoid scarring or discoloration, and also promote healing. It is available as a balm, a salve, a gel, and a lotion. It contains ""vitamins, herbs, and other ingredients"" that were chosen specifically to help heal and preserve tattoos; it notes that other protective products, ones not specifically created for tattoos, contain lanolin, waxes, and other substances that can interfere with healing and maintenance. Tattoo Goo is the first aftercare that has been clinically and dermatologist tested to not cause skin irritation or skin allergic reactions! Heal It - An effective detergent-cleaner for removal of dried blood and protein soils from skin, scalp, steel tips & equipments.",Tattoo Goo,http://dl.flipkart.com/dl/tattoo-goo-original-ointment-9-3gm-free-heal/p/itmeggfpzh2jgxvq?pid=TTTEGGFPFYSEG8XU&affid=siddarthk,http://img.fkcdn.com/image/tattoo/8/x/u/tago9-3-hi-tattoo-goo-200x200-imaebq5gyg5uyna2.jpeg,Health and Beauty>Makeup>Body>Tattoos,600.0,449.0,449.0,true,TTTEGGFPFYSEG8XU,TTTEGGFPFYSEG8XU
Flipkart,,Tattoo Goo Original Ointment 21gm & Free Heal It(No Design),"Tattoo Goo is a healing balm to be applied after you get a tattoo: It is meant to preserve and enhance the colors of the tattoo, moisturize to avoid scarring or discoloration, and also promote healing. It is available as a balm, a salve, a gel, and a lotion. It contains ""vitamins, herbs, and other ingredients"" that were chosen specifically to help heal and preserve tattoos; it notes that other protective products, ones not specifically created for tattoos, contain lanolin, waxes, and other substances that can interfere with healing and maintenance. Tattoo Goo is the first aftercare that has been clinically and dermatologist tested to not cause skin irritation or skin allergic reactions! Heal It - An effective detergent-cleaner for removal of dried blood and protein soils from skin, scalp, steel tips & equipments.",Tattoo Goo,http://dl.flipkart.com/dl/tattoo-goo-original-ointment-21gm-free-heal/p/itmeggfpdzaaeza4?pid=TTTEGGFPBWFYFEBY&affid=siddarthk,http://img.fkcdn.com/image/tattoo/e/b/y/tago21-hi-tattoo-goo-200x200-imaebq5gqkn4hj59.jpeg,Health and Beauty>Makeup>Body>Tattoos,650.0,549.0,549.0,true,TTTEGGFPBWFYFEBY,TTTEGGFPBWFYFEBY
Flipkart,,Tattoo Goo Original Ointment 21gm each (Pack of 24),"Tattoo Goo aftercare products are a combination of vitamins, herbs, and other ingredients developed especially to aid your body in the healing and protection of a new tattoo. The majority of products currently used for the aftercare of new tattoos were designed to prevent infection in cuts, burns, and scrapes - not for healing and aftercare of new tattoos. Tattoo Goo aftercare products are gentle enough for everyday use will not clog the pores of your skin that can retards the natural healing process. Tattoo Goo contains natural moisturizers to enhance the colors and protect your tattoo for the LIFE of your tattoo.The Original Tattoo Goo in ointment form is the Natural Choice for healing your tattoo. Based with eight different natural ingredients, the ""Original"" is 99% Natural.",Tattoo Goo,http://dl.flipkart.com/dl/tattoo-goo-original-ointment-21gm-each-pack-24/p/itmeggfqruthkuth?pid=TTTEGGFQMGXUYUVM&affid=siddarthk,http://img.fkcdn.com/image/tattoo/u/v/m/tagobox21-tattoo-goo-200x200-imaebq5gmwfn96hb.jpeg,Health and Beauty>Makeup>Body>Tattoos,7000.0,6500.0,6500.0,true,TTTEGGFQMGXUYUVM,TTTEGGFQMGXUYUVM
Flipkart,,Tattoo Goo Aftercare Kit & Free Heal It,"Tattoo goo Aftercare Kit + 5 Dermalize cut sheets Free!Aftercare Kit 4-in-1 The gentle salve is the original ""Goo"", produced by Tattoo Goo, and a thin layer of Goo gives your new tattoo the protection it needs and required. It heals the tattoo skin gently, while keeping the ink in place. The lotion also will not clog pores allow to breath them and helps the skin to heal faster than without it , while also enhancing the color of existing tattoos. The lotion is water based formula and provides long lasting protection against dryness. Keep your tattoo or piercing clean with Deep Cleansing Soap with its Antibacterial, Antimicrobial and pH balanced formulation. Don't let the sun's harmful rays fade your tattoo use Color Guard Stick with SPF 30 to directly cover the tattoo. The color guard protection stick contains UVA/UVB inhibitors with precision application on your tattoos. Tattoo Goo is the original pharmacist developed Body Art Aftercare product line. How to apply: Clean your tattoo twice a day with tattoo goo soap, apply the lotion in the night and cream in the day, while moving out use colour guard to save tattoo from sun's harmful rays. Dermalize Aftercare Tattoo bandage It is a protective Tattoo film, the all-in-one tattoo aftercare solution for the initial healing stage of a tattoo. A thin self-adhesive film that provides a moist healing environment during the initial and most critical healing stage of a tattoo wound. It protects the new tattoo from friction and provides a Waterproof & Antibacterial - Barrier that prevents pathogens and external contaminants from entering the wound. The film is Breathable, letting oxygen in and allowing excess moisture vapor to be released from the wound. It’s light to wear. Flexible and stretchable, which allows it to be placed anywhere on the body and will stay put up there for several days. It reduces scabbing and the risk of infection. Do not rub with clothes or other external factors that will damage the tattoo. Get beautifully healed tattoos like you intended too.",Tattoo Goo,http://dl.flipkart.com/dl/tattoo-goo-aftercare-kit-free-heal/p/itmeggfs8wynd83e?pid=TTTEGGFS2GMSESKM&affid=siddarthk,http://img.fkcdn.com/image/tattoo/s/k/m/tac-kit-dm-tattoo-goo-200x200-imaebq5gzf7twmkb.jpeg,Health and Beauty>Makeup>Body>Tattoos,1550.0,1450.0,1450.0,true,TTTEGGFS2GMSESKM,TTTEGGFS2GMSESKM
Flipkart,,Tattoo Goo Ointment Mini Salve 9.3gm each (Pack of 36 Tins),"Tattoo Goo aftercare products are a combination of vitamins, herbs, and other ingredients developed especially to aid your body in the healing and protection of a new tattoo. The majority of products currently used for the aftercare of new tattoos were designed to prevent infection in cuts, burns, and scrapes - not for healing and aftercare of new tattoos. Tattoo Goo aftercare products are gentle enough for everyday use will not clog the pores of your skin that can retards the natural healing process. Tattoo Goo contains natural moisturizers to enhance the colors and protect your tattoo for the LIFE of your tattoo.The Original Tattoo Goo in ointment form is the Natural Choice for healing your tattoo. Based with eight different natural ingredients, the ""Original"" is 99% Natural.",Tattoo Goo,http://dl.flipkart.com/dl/tattoo-goo-ointment-mini-salve-9-3gm-each-pack-36-tins/p/itmeggfqyhg54vnq?pid=TTTEGGFQ4XMB4X4X&affid=siddarthk,http://img.fkcdn.com/image/tattoo/x/4/x/tagobox9-3-tattoo-goo-200x200-imaebq5hza7e8ztg.jpeg,Health and Beauty>Makeup>Body>Tattoos,7000.0,6500.0,6500.0,true,TTTEGGFQ4XMB4X4X,TTTEGGFQ4XMB4X4X
Flipkart,,Tattoo Goo Healix Gold Lotion Pillow Pack - 4ml,"Tattoo Goo healix lotion 4mlAn aftercare lotion with unique natural formula based with herbs oils and vitamins. Allows the skin to breathe and helps to ""soothe"" the tattoo as it heals. Tattoo Goo Lotion (Healix Gold) Pillow Packs is all natural. Best product in the market now has re-sealable tops. Small packs of Tattoo Goo Lotion is easy to hand out to your customers as an aftercare product. Tattoo Goo is the first aftercare that has been clinically and dermatologist tested to not cause skin irritation or skin allergic reactions. A Leading brand in industry, Pharmacist developed having no Lanolin and petroleum, it promotes faster healing time.",Tattoo Goo,http://dl.flipkart.com/dl/tattoo-goo-healix-gold-lotion-pillow-pack-4ml/p/itmeggfrkwxjhegm?pid=TTTEGGFR936RTFJU&affid=siddarthk,http://img.fkcdn.com/image/tattoo/f/j/u/tghlpp-4ml-tattoo-goo-200x200-imaebq5hydqz5phh.jpeg,Health and Beauty>Makeup>Body>Tattoos,350.0,300.0,300.0,true,TTTEGGFR936RTFJU,TTTEGGFR936RTFJU
Flipkart,,CAM Original Tatwax Soothing Balm 1oz & Free Heal It(No Design),"Tatwax Original soothing balm And Heal It is natural science at it's best! Enriched with essential vitamins and soothing aloe vera, this product will aid in the sucessful healing of your new tattoo. Tatwax soothing balm if free of lanolin, alcohol and petrolium. And Heal It is an effective detergent - cleaner for removal of dried blood and protein soils from skin, scalp, steel tips & equipments Tatwax Sold As 1 (1oz) TIN Heal iT Sold As 1 (2.4oz) Bottle Tatwax Original and Heal it does not't clog pores and will allow your skin to breath, while reducing irritation and promoting proper healing of your new tattoo. Current tattoo aftercare products are designed to be used in the prevention of irritation and infection in cuts burns and scrapes. Such products generally contain ingredients that may clog pores, draw ink out, and cause allergic reactions which ruin your new tattoo. However, TAT WAX and Heal It aftercare product is specifically designed to aid in the healing of the skin while maximizing the look of your new tattoo, unlike common drug store ointments that are not specifically designed for tattoo aftercare.",CAM,http://dl.flipkart.com/dl/cam-original-tatwax-soothing-balm-1oz-free-heal/p/itmeggfpjbpuept3?pid=TTTEGGFPAZMTJ3G7&affid=siddarthk,http://img.fkcdn.com/image/tattoo/3/g/7/tatwx-hi-cam-200x200-imaebq5gwgtjudn9.jpeg,Health and Beauty>Makeup>Body>Tattoos,550.0,349.0,349.0,true,TTTEGGFPAZMTJ3G7,TTTEGGFPAZMTJ3G7
Flipkart,,Essence Soft Touch Mousse Make-up Matt Foundation,,Essence,http://dl.flipkart.com/dl/essence-soft-touch-mousse-make-up-matt-foundation/p/itme8bxatnbzatzg?pid=FNDE8BZKYUFQJ9MM&affid=siddarthk,http://img.fkcdn.com/image/foundation/9/m/m/essence-soft-touch-mousse-make-up-matt-200x200-imae8bsgc4qhhfrb.jpeg,Health and Beauty>Makeup>Face>Foundations,499.0,499.0,499.0,false,FNDE8BZKYUFQJ9MM,FNDE8BZKYUFQJ9MM
Flipkart,,Essence All About Matt Oil-Free Make-Up Foundation,,Essence,http://dl.flipkart.com/dl/essence-all-matt-oil-free-make-up-foundation/p/itme68myefgzcyc3?pid=FNDE6ACGQQFFYFHJ&affid=siddarthk,http://img.fkcdn.com/image/foundation/f/h/j/essence-all-about-matt-oil-free-make-up-200x200-imae69h7nbbuyp9e.jpeg,Health and Beauty>Makeup>Face>Foundations,399.0,399.0,399.0,false,FNDE6ACGQQFFYFHJ,FNDE6ACGQQFFYFHJ
Flipkart,,Essence All About Matt! Oil-Free Make-Up Foundation,,Essence,http://dl.flipkart.com/dl/essence-all-matt-oil-free-make-up-foundation/p/itme68myefgzcyc3?pid=FNDE68MY9486K8RQ&affid=siddarthk,http://img.fkcdn.com/image/foundation/8/r/q/essence-all-about-matt-oil-free-make-up-200x200-imae68eeqkzrqrta.jpeg,Health and Beauty>Makeup>Face>Foundations,399.0,399.0,399.0,false,FNDE68MY9486K8RQ,FNDE68MY9486K8RQ
Flipkart,,Bodyography  Oil Free Finish 125 Foundation,Provides medium to full buildable coverageRemains weightless on the skinOil – free formula is safe for all skin types and allows your skin to breatheLong lasting formula keeps your makeup on all day,Bodyography ,http://dl.flipkart.com/dl/bodyography-oil-free-finish-125-foundation/p/itme5354fesh3b3y?pid=FNDE5354GYWP5NZU&affid=siddarthk,http://img.fkcdn.com/image/foundation/n/z/u/bodyography-oil-free-finish-125-200x200-imae5fx5dq2z8vpa.jpeg,Health and Beauty>Makeup>Face>Foundations,1875.0,1875.0,1875.0,false,FNDE5354GYWP5NZU,FNDE5354GYWP5NZU
Flipkart,,Essence Stay All Day 16h Long Lasting Make-up Foundation,"this long-lasting foundation ensures a smooth and silky complexion all day long. its delicate texture allows a simple and even application. thanks to the high-quality pump dispenser, it's easy to find the perfect dosage for an indescribably beautiful look. dermatologically tested.",Essence,http://dl.flipkart.com/dl/essence-stay-all-day-16h-long-lasting-make-up-foundation/p/itme2vagu8nhptcg?pid=FNDE2VAGZHRZG2YW&affid=siddarthk,http://img.fkcdn.com/image/foundation/2/y/w/essence-stay-all-day-16h-long-lasting-make-up-200x200-imaeeqxnr9wt6tjg.jpeg,Health and Beauty>Makeup>Face>Foundations,499.0,499.0,499.0,false,FNDE2VAGZHRZG2YW,FNDE2VAGZHRZG2YW
Flipkart,,Bodyography  Oil Free Finish 220 Foundation,Provides medium to full buildable coverageRemains weightless on the skinOil – free formula is safe for all skin types and allows your skin to breatheLong lasting formula keeps your makeup on all day,Bodyography ,http://dl.flipkart.com/dl/bodyography-oil-free-finish-220-foundation/p/itme5354tfzpfm3k?pid=FNDE5354ENXPGY6V&affid=siddarthk,http://img.fkcdn.com/image/foundation/y/6/v/bodyography-oil-free-finish-220-200x200-imae5fxaf5zztgxf.jpeg,Health and Beauty>Makeup>Face>Foundations,1875.0,1875.0,1875.0,false,FNDE5354ENXPGY6V,FNDE5354ENXPGY6V
Flipkart,,Bodyography  Sun Defence Tinted Moisturizer Foundation,"Mineral protection from the sun?s harmful raysMineral trace complex allows vitamins and minerals to penetrate your skins surface, revealing healthy glowing skinNatural dewy finishProfessional grade brush top applicator for flawless application",Bodyography ,http://dl.flipkart.com/dl/bodyography-sun-defence-tinted-moisturizer-foundation/p/itme2vagtnwjpjws?pid=FNDE2VAGEYZNWYDF&affid=siddarthk,http://img.fkcdn.com/image/foundation/y/d/f/bodyography-sun-defence-tinted-moisturizer-200x200-imae2s83pzhhgst5.jpeg,Health and Beauty>Makeup>Face>Foundations,1475.0,1475.0,1475.0,false,FNDE2VAGEYZNWYDF,FNDE2VAGEYZNWYDF
Flipkart,,Revlon Color Stay Makeup Fresh Spf-20 Foundation(Beige),,Revlon,http://dl.flipkart.com/dl/revlon-color-stay-makeup-fresh-spf-20-foundation/p/itme8mf7mjbzwy7e?pid=FNDE8MF76KGEHEFE&affid=siddarthk,http://img.fkcdn.com/image/foundation/e/f/e/revlon-color-stay-makeup-fresh-spf-20-200x200-imae8hxkz6enfhx3.jpeg,Health and Beauty>Makeup>Face>Foundations,995.0,990.0,990.0,false,FNDE8MF76KGEHEFE,FNDE8MF76KGEHEFE
Flipkart,,Essence All in One BB 02 Natural - 73350 Foundation,,Essence,http://dl.flipkart.com/dl/essence-all-one-bb-02-natural-73350-foundation/p/itmebpx38jcqx6zw?pid=FNDEBPX3BZFPKDZ8&affid=siddarthk,http://img.fkcdn.com/image/foundation/d/z/8/essence-all-in-one-bb-02-natural-73350-200x200-imaebpf76buezn8v.jpeg,Health and Beauty>Makeup>Face>Foundations,449.0,449.0,449.0,true,FNDEBPX3BZFPKDZ8,FNDEBPX3BZFPKDZ8
Flipkart,,Bodyography  Oil Free Finish 130 Foundation,Provides medium to full buildable coverageRemains weightless on the skinOil – free formula is safe for all skin types and allows your skin to breatheLong lasting formula keeps your makeup on all day,Bodyography ,http://dl.flipkart.com/dl/bodyography-oil-free-finish-130-foundation/p/itme5354gj7phhcp?pid=FNDE53547SN8GMKF&affid=siddarthk,http://img.fkcdn.com/image/foundation/m/k/f/bodyography-oil-free-finish-130-200x200-imae5fxhwgebczry.jpeg,Health and Beauty>Makeup>Face>Foundations,1875.0,1875.0,1875.0,false,FNDE53547SN8GMKF,FNDE53547SN8GMKF
Flipkart,,Revlon Colorstay Makeup Normal / Dry Skin Foundation,,Revlon,http://dl.flipkart.com/dl/revlon-colorstay-makeup-normal-dry-skin-foundation/p/itme88gzkhmtpv4b?pid=FNDE88GZZQHTFTHG&affid=siddarthk,http://img.fkcdn.com/image/foundation/t/h/g/revlon-colorstay-makeup-normal-dry-skin-200x200-imae88bmfq6jygre.jpeg,Health and Beauty>Makeup>Face>Foundations,875.0,825.0,825.0,false,FNDE88GZZQHTFTHG,FNDE88GZZQHTFTHG
Flipkart,,"Bodyography  Veil Primer Bronzing, Monaco Foundation","A highly pigmented long-wearing oil-free liquid foundation enriched with licorice extract and vitamin E to revitalize, brighten and hydrate tired skin creating a flawless complexion.",Bodyography ,http://dl.flipkart.com/dl/bodyography-veil-primer-bronzing-monaco-foundation/p/itme5354pjewb9vj?pid=FNDE5354FP36EACK&affid=siddarthk,http://img.fkcdn.com/image/foundation/a/c/k/bodyography-veil-primer-bronzing-monaco-200x200-imae5fzfzxfxrtvd.jpeg,Health and Beauty>Makeup>Face>Foundations,1875.0,1875.0,1875.0,true,FNDE5354FP36EACK,FNDE5354FP36EACK
Flipkart,,Catrice Matt Mousse Make Up - 030 Warm Beige Foundation,,Catrice,http://dl.flipkart.com/dl/catrice-matt-mousse-make-up-030-warm-beige-foundation/p/itmefybyfqzzcgdz?pid=FNDEFYBYMCRVWHAA&affid=siddarthk,http://img.fkcdn.com/image/foundation/h/a/a/catrice-matt-mousse-make-up-030-warm-beige-200x200-imaefvfd3kg3e4th.jpeg,Health and Beauty>Makeup>Face>Foundations,760.0,760.0,760.0,false,FNDEFYBYMCRVWHAA,FNDEFYBYMCRVWHAA
Flipkart,,Essence Soft Touch Mousse Make-Up Matt Foundation,,Essence,http://dl.flipkart.com/dl/essence-soft-touch-mousse-make-up-matt-foundation/p/itme8bxatnbzatzg?pid=FNDE8BZKY8MANHEZ&affid=siddarthk,http://img.fkcdn.com/image/foundation/h/e/z/essence-soft-touch-mousse-make-up-matt-200x200-imae8bsghvgzgfgk.jpeg,Health and Beauty>Makeup>Face>Foundations,499.0,499.0,499.0,false,FNDE8BZKY8MANHEZ,FNDE8BZKY8MANHEZ
Flipkart,,Essence Pure Skin all-in-one BB Cream Light 10-73711 Foundation,,Essence,http://dl.flipkart.com/dl/essence-pure-skin-all-in-one-bb-cream-light-10-73711-foundation/p/itme8qqsq9hw2f3g?pid=FNDE8QQSPJY9RTQQ&affid=siddarthk,http://img.fkcdn.com/image/foundation/t/q/q/essence-pure-skin-all-in-one-bb-cream-light-10-73711-200x200-imae8qdx68hrdyxz.jpeg,Health and Beauty>Makeup>Face>Foundations,499.0,499.0,499.0,false,FNDE8QQSPJY9RTQQ,FNDE8QQSPJY9RTQQ
Flipkart,,Essence Pure Skin All-In-One BB Cream Natural 20-73713 Foundation,,Essence,http://dl.flipkart.com/dl/essence-pure-skin-all-in-one-bb-cream-natural-20-73713-foundation/p/itme8qpzgutmthq8?pid=FNDE8QPZC4DGDWYV&affid=siddarthk,http://img.fkcdn.com/image/foundation/w/y/v/essence-pure-skin-all-in-one-bb-cream-natural-20-73713-200x200-imae8qefz6bxyyfu.jpeg,Health and Beauty>Makeup>Face>Foundations,499.0,499.0,499.0,false,FNDE8QPZC4DGDWYV,FNDE8QPZC4DGDWYV
Flipkart,,Natio Pure Mineral  Foundation,,Natio,http://dl.flipkart.com/dl/natio-pure-mineral-foundation/p/itmecb94jwzyewds?pid=FNDECB9HBXTSK5ZA&affid=siddarthk,http://img.fkcdn.com/image/foundation/z/q/u/natio-pure-mineral-foundation-200x200-imaecb6zfzwwzsau.jpeg,Health and Beauty>Makeup>Face>Foundations,1190.0,1190.0,1190.0,true,FNDECB9HBXTSK5ZA,FNDECB9HBXTSK5ZA
Flipkart,,Bodyography  Veil Primer Shaded Neutral Foundation,,Bodyography ,http://dl.flipkart.com/dl/bodyography-veil-primer-shaded-neutral-foundation/p/itme88gz3vphghbf?pid=FNDE88GZFSNA5RKF&affid=siddarthk,http://img.fkcdn.com/image/foundation/r/k/f/bodyography-veil-primer-shaded-neutral-200x200-imae843j3bzhvfng.jpeg,Health and Beauty>Makeup>Face>Foundations,1875.0,1875.0,1875.0,false,FNDE88GZFSNA5RKF,FNDE88GZFSNA5RKF
Flipkart,,Natio Pure Mineral  Foundation,,Natio,http://dl.flipkart.com/dl/natio-pure-mineral-foundation/p/itmecb94jwzyewds?pid=FNDECHVHQ7YPGGXM&affid=siddarthk,http://img.fkcdn.com/image/foundation/g/x/m/natio-pure-mineral-foundation-200x200-imaecb6jghskmjcb.jpeg,Health and Beauty>Makeup>Face>Foundations,1190.0,1190.0,1190.0,true,FNDECHVHQ7YPGGXM,FNDECHVHQ7YPGGXM
Flipkart,,Natio Pure Mineral  Foundation,,Natio,http://dl.flipkart.com/dl/natio-pure-mineral-foundation/p/itmecb94jwzyewds?pid=FNDECB9MUCFAEQG3&affid=siddarthk,http://img.fkcdn.com/image/foundation/z/q/u/natio-pure-mineral-foundation-200x200-imaecb6zfzwwzsau.jpeg,Health and Beauty>Makeup>Face>Foundations,1190.0,1190.0,1190.0,true,FNDECB9MUCFAEQG3,FNDECB9MUCFAEQG3
Flipkart,,Essence Soft Touch Mousse Make-up Matt Foundation,,Essence,http://dl.flipkart.com/dl/essence-soft-touch-mousse-make-up-matt-foundation/p/itme8bxatnbzatzg?pid=FNDE8BZKYMH5EFM2&affid=siddarthk,http://img.fkcdn.com/image/foundation/f/m/2/essence-soft-touch-mousse-make-up-matt-200x200-imae8bshncz4qnre.jpeg,Health and Beauty>Makeup>Face>Foundations,499.0,499.0,499.0,true,FNDE8BZKYMH5EFM2,FNDE8BZKYMH5EFM2
Flipkart,,Essence Soft Touch Mousse Make-up Matt Foundation,,Essence,http://dl.flipkart.com/dl/essence-soft-touch-mousse-make-up-matt-foundation/p/itme8bxatnbzatzg?pid=FNDE8BXACVTFHN3Q&affid=siddarthk,http://img.fkcdn.com/image/foundation/n/3/q/essence-soft-touch-mousse-make-up-matt-200x200-imae8bspp5azzh95.jpeg,Health and Beauty>Makeup>Face>Foundations,499.0,499.0,499.0,false,FNDE8BXACVTFHN3Q,FNDE8BXACVTFHN3Q
