PartnerName,Id,Title,Description,Brand,Link,ImageLink,CategoryName,Mrp,OfferPrice,EffectivePrice,Availability,PartnerIdFromUrl,PartnerIdFromDb
Flipkart,,Best & Lowest Soft Multicolor Rubber Hair Band - Set Of 21 Pcs. Rubber Band(Multicolor),"Its a great product for you and your princess. Good for use to tie your hair at home anytime, casual parties, special occasions, friends gathering, while going outside like market, coaching, school, playground etc. It gives a fabulous look to your hair. A must have set of rubber hairbands for your hair accessories.",Best & Lowest,http://dl.flipkart.com/dl/best-lowest-soft-multicolor-rubber-hair-band-set-21-pcs/p/itmefrhwp4dhaqw8?pid=HACEFRHWBVYZBT5N&affid=siddarthk,http://img.fkcdn.com/image/hair-accessory/t/5/n/bnl020-21-best-lowest-soft-multicolor-rubber-hair-band-set-of-21-200x200-imaefqkrdtrnsafh.jpeg,Health and Beauty>Hair Care>Hair Care Accessories>Hair Accessories,300.0,219.0,219.0,false,HACEFRHWBVYZBT5N,HACEFRHWBVYZBT5N
Flipkart,,Bellazaara BELLAZAARA Ivory Triple Chiffon Flower Rhinestone Baby Headband Head Band(Beige),BELLAZAARA Ivory Triple Chiffon Flower Rhinestone Baby Headband New design!Material: Cloth ChiffonPearlBand size: approx 0.7 inch 14 inch girthgood elasticityFlower size: 4.33 inch in length and 2.35 inch in widthsuitable for 0~10 years old babyDelicate design! It is the best choice for your lovely baby. So charming!3 different colorsBoutique！！！ perfect for any girl newborn baby toddler or mommy.,Bellazaara,http://dl.flipkart.com/dl/bellazaara-ivory-triple-chiffon-flower-rhinestone-baby-headband-head-band/p/itmefrf2tkexa9wd?pid=HACEFRF2QG4AWVUH&affid=siddarthk,http://img.fkcdn.com/image/hair-accessory/v/u/h/bzha072-1-bellazaara-bellazaara-ivory-triple-chiffon-flower-200x200-imaefn74sy9ay3wh.jpeg,Health and Beauty>Hair Care>Hair Care Accessories>Hair Accessories,345.0,345.0,345.0,true,HACEFRF2QG4AWVUH,HACEFRF2QG4AWVUH
Flipkart,,Lady Heart METALBAND Hair Band(Black),,Lady Heart,http://dl.flipkart.com/dl/lady-heart-metalband-hair-band/p/itmemybywsjemgag?pid=HACEMYBYZ5NAGUEE&affid=siddarthk,http://img.fkcdn.com/image/hair-accessory/u/e/e/mb1-1-lady-heart-metalband-200x200-imaemy7zxwrrhmdd.jpeg,Health and Beauty>Hair Care>Hair Care Accessories>Hair Accessories,300.0,99.0,99.0,false,HACEMYBYZ5NAGUEE,HACEMYBYZ5NAGUEE
Flipkart,,GalexiaR Topsy Tail Braid Ponytail Hair Bun Maker 4pc Hair Accessory Set(Black),"You can make an infinite number of hairstyles for short and long hair, Pull it Gently Not Roughly Be frankly Not for extremely thick and curly hairTopsy Tail Usage Instructions - In DetailsStep 1:Find a hair elastic to put your hair in a low ponytail. Insert the long end of the tool into the top of the ponytail, just above the elastic, so the loop is sticking out of the back of your head. Make sure it's in the middle of the ponytail or the twist will be lopsided.Step 2:Stick your fingers through the loop from the head side and grab the ponytail. Pull it through the loop. The ponytail should be sort of pointing up the back of your head.Step 3: Grab the long end of the tool that is sticking out the bottom of your ponytail, and pull it down and through, bringing the ponytail with it.Step 4: The hair at the base of the ponytail should be sort of twisted over itself, covering the ponytail holder.Step 5: So beautiful hair style have be finished!Usage Instructions - In Details for Bun MakerStep 1:Take Hair StickStep 2:Pull hair through the existing gap of stick and press the intervals for further graspStep 3: Lift both ends of stick upwards until the end of hairStep 4: Hold both ends of stick and roll downwards spontaneouslyStep 5: Hook the two hooks, then finishedStep 6: A beautiful bun is easily finished in seconds.YOU CAN USE BOBBY PINS OR U PINS IF REQUIRED",GalexiaR,http://dl.flipkart.com/dl/galexiar-topsy-tail-braid-ponytail-hair-bun-maker-4pc-accessory-set/p/itmedvr8jkhdkzyh?pid=HACEDVR88VMASCPF&affid=siddarthk,http://img.fkcdn.com/image/hair-accessory/c/p/f/tc-b004-4-galexiar-hair-accessory-set-topsy-tail-braid-ponytail-200x200-imaedtpusyc6rggg.jpeg,Health and Beauty>Hair Care>Hair Care Accessories>Hair Accessories,399.0,169.0,169.0,true,HACEDVR88VMASCPF,HACEDVR88VMASCPF
Flipkart,,RG Bridal Diamond Brooch Hair Accessory Set(Gold),,RG,http://dl.flipkart.com/dl/rg-bridal-diamond-brooch-hair-accessory-set/p/itmeepwmcravunw2?pid=HACEEPWMAQ62PGKZ&affid=siddarthk,http://img.fkcdn.com/image/hair-accessory/g/k/z/rg-l25-1-rg-bridal-diamond-brooch-200x200-imaeengedh2xzmcf.jpeg,Health and Beauty>Hair Care>Hair Care Accessories>Hair Accessories,990.0,360.0,360.0,false,HACEEPWMAQ62PGKZ,HACEEPWMAQ62PGKZ
Flipkart,,Bellazaara BELLAZAARA Vintage Ivory Shabby Flower with Rhinestone Baby Headband Head Band(Beige),BELLAZAARA Vintage Ivory Shabby Flower with Rhinestone Baby Headband Delightful headband designed with a simple yet chic style.Handcrafted with shabby chic chiffon flowers embellished with rhinestones and pearls.Adds the perfect touch to outfits worn for special events and holidays as well as everyday occasions. Fits newborns adults and everyone in between.AVAILABLE IN 4 COLOURS,Bellazaara,http://dl.flipkart.com/dl/bellazaara-vintage-ivory-shabby-flower-rhinestone-baby-headband-head-band/p/itmefrffhe3dxxzc?pid=HACEFRFFHECU7EHW&affid=siddarthk,http://img.fkcdn.com/image/hair-accessory/e/h/w/bzha021-1-bellazaara-bellazaara-vintage-ivory-shabby-flower-with-200x200-imaefn74jgn9ct7z.jpeg,Health and Beauty>Hair Care>Hair Care Accessories>Hair Accessories,225.0,175.0,175.0,true,HACEFRFFHECU7EHW,HACEFRFFHECU7EHW
Flipkart,,"A.T.U.N. Thin Elastics Hair Band(Blue, Blue)",Lt blue- cool blue classic bow hairband,A.T.U.N.,http://dl.flipkart.com/dl/a-t-u-n-thin-elastics-hair-band/p/itme5qjgy4whnshh?pid=HACE5QJGYGGAMANQ&affid=siddarthk,http://img.fkcdn.com/image/hair-accessory/a/n/q/hrb-18-1-a-t-u-n-hair-band-thin-elastics-200x200-imae5pfttxgzvq2j.jpeg,Health and Beauty>Hair Care>Hair Care Accessories>Hair Accessories,75.0,49.0,49.0,false,HACE5QJGYGGAMANQ,HACE5QJGYGGAMANQ
Flipkart,,Apeksha Arts Glass Multi Color Hand Crafted Pearl Cluthcher For Women Hair Claw(Multicolor),,Apeksha Arts,http://dl.flipkart.com/dl/apeksha-arts-glass-multi-color-hand-crafted-pearl-cluthcher-women-hair-claw/p/itme8hnabgdbt7nh?pid=HACE8HNAGJP4AAAJ&affid=siddarthk,http://img.fkcdn.com/image/hair-accessory/9/d/r/aa26-fk-1-apeksha-arts-glass-multi-color-hand-crafted-pearl-200x200-imae6fyj6kmhg5zp.jpeg,Health and Beauty>Hair Care>Hair Care Accessories>Hair Accessories,249.0,218.0,218.0,false,HACE8HNAGJP4AAAJ,HACE8HNAGJP4AAAJ
Flipkart,,RG Bridal Golden Brooch(Pack of 6) Hair Accessory Set(Gold),,RG,http://dl.flipkart.com/dl/rg-bridal-golden-brooch-pack-6-hair-accessory-set/p/itmef59gxuharyzk?pid=HACEF59GQTATBKG4&affid=siddarthk,http://img.fkcdn.com/image/hair-accessory/k/g/4/rg-147gld-6-rg-bridal-golden-brooch-pack-of-6-200x200-imaef573sqxqet7g.jpeg,Health and Beauty>Hair Care>Hair Care Accessories>Hair Accessories,990.0,330.0,330.0,true,HACEF59GQTATBKG4,HACEF59GQTATBKG4
Flipkart,,Bellazaara BELLAZAARA Red Chiffon Silk Flowers Soft Stetch Headband Baby Girl Head Band(Red),"BELLAZAARA Red Chiffon Silk Flowers Soft Stetch Headband Baby Girl ""Flower Size: 10 cmsuitable age:0.5-3 years babyMaterial: Chiffon elastic ribbon Your princess will definitely turn heads with this one of a kind delicate headband.Variety Of Colors To Match Your Outfit;They Will Be Very Great For All Your OccasionsAVAILABLE IN 6 COLOURS """,Bellazaara,http://dl.flipkart.com/dl/bellazaara-red-chiffon-silk-flowers-soft-stetch-headband-baby-girl-head-band/p/itmefrf2hbb8a4qb?pid=HACEFRF22Z8MAWRW&affid=siddarthk,http://img.fkcdn.com/image/hair-accessory/w/r/w/bzha054-1-bellazaara-bellazaara-red-chiffon-silk-flowers-soft-200x200-imaefn74frgx6fph.jpeg,Health and Beauty>Hair Care>Hair Care Accessories>Hair Accessories,200.0,150.0,150.0,true,HACEFRF22Z8MAWRW,HACEFRF22Z8MAWRW
Flipkart,,Coiffure Classy Collection Hair Band(Gold),"Gorgeous Metal Flower Hair Band by Coiffure ChicWise - You can never go wrong with this beautiful dressy piece! Fashionable and classy, this hairband can add glamour to any outfit you put on and is a must have party wear accessory. Chicwise brings to you an extremely tasteful collection of hair accessories for kids, young girls and women. We offer best quality products at reasonable prices.",Coiffure,http://dl.flipkart.com/dl/coiffure-classy-collection-hair-band/p/itmemf7qmppdc4cr?pid=HACEMF7QKKZJNWFJ&affid=siddarthk,http://img.fkcdn.com/image/hair-accessory/w/f/j/hbmetalmultipleflower-1-coiffure-classy-collection-200x200-imaehzz8y22nc7md.jpeg,Health and Beauty>Hair Care>Hair Care Accessories>Hair Accessories,750.0,350.0,350.0,true,HACEMF7QKKZJNWFJ,HACEMF7QKKZJNWFJ
Flipkart,,moKanc Hair Accessory Tic Tac Clip(Red),"Beautiful Handmade Crochet Motif over the Tic-Tac Clip. Colorful Appearance, very attractive. Specially available only from moKanc",moKanc,http://dl.flipkart.com/dl/mokanc-hair-accessory-tic-tac-clip/p/itmeea7hrnye7pmn?pid=HACEEA7HSFHHJFVZ&affid=siddarthk,http://img.fkcdn.com/image/hair-accessory/f/v/z/ha-bg01d-1-mokanc-hair-accessory-200x200-imaee9cuhwwwmpsk.jpeg,Health and Beauty>Hair Care>Hair Care Accessories>Hair Accessories,295.0,220.0,220.0,true,HACEEA7HSFHHJFVZ,HACEEA7HSFHHJFVZ
Flipkart,,FNB BEAUTIFUL Banana Clip(Multicolor),,FNB,http://dl.flipkart.com/dl/fnb-beautiful-banana-clip/p/itmemy2ykcgmxqhj?pid=HACEMY2Y9NFUGCX5&affid=siddarthk,http://img.fkcdn.com/image/hair-accessory/c/x/5/bc2-3-fnb-beautiful-200x200-imaehzq5fsj3m38m.jpeg,Health and Beauty>Hair Care>Hair Care Accessories>Hair Accessories,399.0,275.0,275.0,true,HACEMY2Y9NFUGCX5,HACEMY2Y9NFUGCX5
Flipkart,,Chahat Hot Bun Clip(Black),,Chahat,http://dl.flipkart.com/dl/chahat-hot-bun-clip/p/itmekapewadyuvh5?pid=HACEKAPE9KBGDGNV&affid=siddarthk,http://img.fkcdn.com/image/hair-accessory/g/n/v/hb-01-2-chahat-hot-200x200-imaek9hfjhqngkev.jpeg,Health and Beauty>Hair Care>Hair Care Accessories>Hair Accessories,1000.0,349.0,349.0,true,HACEKAPE9KBGDGNV,HACEKAPE9KBGDGNV
Flipkart,,Sagunya Floral Stone studed Tic Tac Clip(Brown),"Accessorize in style with beautiful hair accessories from the house of SAGUNYA. Stone studded hair pin for women. These hair accessories for women will keep your hairstyle in place, and it will add a pop of cute colour to your look, our range of hair accessories for women will style your hair with simplicity. Using design innovation, the brand continually creates what is aspired and not just what is necessary. All of our products are meant to deliver durability and panache.",Sagunya,http://dl.flipkart.com/dl/sagunya-floral-stone-studed-tic-tac-clip/p/itmef6s5dtjzcgzy?pid=HACEF6S5ZUHTPXHQ&affid=siddarthk,http://img.fkcdn.com/image/hair-accessory/x/h/q/sg130-2-sagunya-floral-stone-studed-200x200-imaef5d2a29ze8hg.jpeg,Health and Beauty>Hair Care>Hair Care Accessories>Hair Accessories,275.0,198.0,198.0,false,HACEF6S5ZUHTPXHQ,HACEF6S5ZUHTPXHQ
Flipkart,,Anokhi Ada Rectangular Stone Studded Jeans Tic Tac Clip(Blue),"Rectangular Blue Tic tac Clip with length 8 cm and width 2.5 cm, studded with sparkling rhinestones, around the rectangular boundary. Printed sky White tiny flowers on the blue background made of jeans.",Anokhi Ada,http://dl.flipkart.com/dl/anokhi-ada-rectangular-stone-studded-jeans-tic-tac-clip/p/itmebwjfzxtbgge8?pid=HACEBWJF4YWRWHNB&affid=siddarthk,http://img.fkcdn.com/image/hair-accessory/h/n/b/hea-0112-2-anokhi-ada-tic-tac-clip-rectangular-stone-studded-200x200-imaebwb3g8rkhhjk.jpeg,Health and Beauty>Hair Care>Hair Care Accessories>Hair Accessories,250.0,249.0,249.0,true,HACEBWJF4YWRWHNB,HACEBWJF4YWRWHNB
Flipkart,,"Anokhi Ada Floral Tic Tac Clip(White, Pink, Black)",A pair of Black and beautiful tic tac clips studded with a White and comparatively smaller Pink flowers.,Anokhi Ada,http://dl.flipkart.com/dl/anokhi-ada-floral-tic-tac-clip/p/itmebwjftr2kt8gk?pid=HACEBWJFVUYTNFFR&affid=siddarthk,http://img.fkcdn.com/image/hair-accessory/f/f/r/hea-0118-2-anokhi-ada-tic-tac-clip-floral-200x200-imaebwb2g4c3k9ew.jpeg,Health and Beauty>Hair Care>Hair Care Accessories>Hair Accessories,250.0,249.0,249.0,false,HACEBWJFVUYTNFFR,HACEBWJFVUYTNFFR
Flipkart,,"Buds N Blossoms Contemporary Hair Accessory Set(Beige, Black)","Comes From The Hub Of Buds N Blossoms, This Beige And Black Colored Set Of Hair Band And Two Tic Tac Clips Is A Great Investment For Your Daughter. This Hair Band Comes With Two Tic Tac Clips. Made With Long Lasting, Soft On Skin And Skin Friendly Material, This Hair Accessory Set Will Be Perfect For Daily Wear Also. Due To Their Intricate Design And Crafting, This Set Of Hair Accessories Will Gift Your Tiny Tots Great Fun And Admiration. In This Festive Season, The Whole Set Can Be A Great Gifting Option Too For Every Little Princesses.",Buds N Blossoms,http://dl.flipkart.com/dl/buds-n-blossoms-contemporary-hair-accessory-set/p/itmed3yqjyhcwcs3?pid=HACED3YQSYU8YXGW&affid=siddarthk,http://img.fkcdn.com/image/hair-accessory/x/g/w/hb10-cm-3-buds-n-blossoms-hair-accessory-set-contemporary-200x200-imaed3y54myjgq2d.jpeg,Health and Beauty>Hair Care>Hair Care Accessories>Hair Accessories,700.0,299.0,299.0,true,HACED3YQSYU8YXGW,HACED3YQSYU8YXGW
Flipkart,,Eternz Clipset Hair Clip(Red),"Beautiful bright hairclip set adorns the cute kid with red colored flower with cute shinny polka dot printed flower in centre, handmade at Eternz with the best of shinny fabric by artisans",Eternz,http://dl.flipkart.com/dl/eternz-clipset-hair-clip/p/itmekc7h5s7qhzhh?pid=HACEKC7HWMTYAEUC&affid=siddarthk,http://img.fkcdn.com/image/hair-accessory/e/u/c/ekhc036-1-eternz-clipset-200x200-imaek6e4f7dxh4yq.jpeg,Health and Beauty>Hair Care>Hair Care Accessories>Hair Accessories,499.0,399.0,399.0,true,HACEKC7HWMTYAEUC,HACEKC7HWMTYAEUC
Flipkart,,Prakruthi Bridal Hair Chain(White),"Feel like a royal, Indian princess with this multicoloured juda pin. Exclusively designed, this juda pin will add grace to your traditional attire. Perfect for those pre-wedding functions, this juda pin will help keep your bun intact, while making you the cynosure of all eyes.",Prakruthi,http://dl.flipkart.com/dl/prakruthi-bridal-hair-chain/p/itmeby8256gzfgrk?pid=HACEBY82BEYZSQNZ&affid=siddarthk,http://img.fkcdn.com/image/hair-accessory/q/n/z/acesfpra1081-1-prakruthi-hair-chain-bridal-200x200-imaebs9tcn4ysnue.jpeg,Health and Beauty>Hair Care>Hair Care Accessories>Hair Accessories,1044.0,770.0,770.0,false,HACEBY82BEYZSQNZ,HACEBY82BEYZSQNZ
Flipkart,,Pink Rose Princess Charm Hair Band(Black),"Beautifully crafted, which combines the attributes of a Pink Rose, which are Passion, Admiration, Grace, elegance, Gratitude and Appreciation. Designed to compliment you…",Pink Rose,http://dl.flipkart.com/dl/pink-rose-princess-charm-hair-band/p/itmejq7hzftkrqsm?pid=HACEJQ7HBH4H4JF8&affid=siddarthk,http://img.fkcdn.com/image/hair-accessory/j/f/8/pinkrose-ha-291-1-pink-rose-princess-charm-200x200-imaejpummzfdz9fa.jpeg,Health and Beauty>Hair Care>Hair Care Accessories>Hair Accessories,1054.0,479.0,479.0,true,HACEJQ7HBH4H4JF8,HACEJQ7HBH4H4JF8
Flipkart,,Viva Fashions Hatstyle Hair Clip(Blue),"Hatstyle Hair Clip With Barrette Closure For Girls . Barrette Closure Helps To Hold Hair In Place.Key Features : Comfortable And Stylish, Perfect For Accessorizing Party Outfits, Ensures Strong And Comfortable Grip, Dimensions : 3.1 Inch diameter.",Viva Fashions,http://dl.flipkart.com/dl/viva-fashions-hatstyle-hair-clip/p/itmeebchgauchswj?pid=HACEEBCHZ9MGRGGK&affid=siddarthk,http://img.fkcdn.com/image/hair-accessory/g/g/k/vf-107-1-viva-fashions-hatstyle-200x200-imaeeb6zfxpwzzzw.jpeg,Health and Beauty>Hair Care>Hair Care Accessories>Hair Accessories,349.0,205.0,205.0,true,HACEEBCHZ9MGRGGK,HACEEBCHZ9MGRGGK
Flipkart,,Ame 69 Tic Tac Clip(Multicolor),,Ame,http://dl.flipkart.com/dl/ame-69-tic-tac-clip/p/itmeb4mh4hcpvzhd?pid=HACEB4MHSHVP4JM8&affid=siddarthk,http://img.fkcdn.com/image/hair-accessory/j/m/8/tictac-20-ame-tic-tac-clip-69-200x200-imaeb3j4ygxhz7jd.jpeg,Health and Beauty>Hair Care>Hair Care Accessories>Hair Accessories,299.0,199.0,199.0,false,HACEB4MHSHVP4JM8,HACEB4MHSHVP4JM8
Flipkart,,"Pink Rose Princess Charm Hair Band(Black, White)","Beautifully crafted, which combines the attributes of a Pink Rose, which are Passion, Admiration, Grace, elegance, Gratitude and Appreciation. Designed to compliment you…",Pink Rose,http://dl.flipkart.com/dl/pink-rose-princess-charm-hair-band/p/itmejq7hghbqhaph?pid=HACEJQ7H9Q2GCWHH&affid=siddarthk,http://img.fkcdn.com/image/hair-accessory/w/h/h/pinkrose-ha-283-1-pink-rose-princess-charm-200x200-imaejpumqqdeagxf.jpeg,Health and Beauty>Hair Care>Hair Care Accessories>Hair Accessories,1098.0,499.0,499.0,true,HACEJQ7H9Q2GCWHH,HACEJQ7H9Q2GCWHH
Flipkart,,Hopscotch V-120124D Hair Clip(Pink),"Pretty, sweet and adorbable hair accessories for little girls, tweens and teens. Hopcotsh brings you the perfect hair embelishment for your daughter and her friends.",Hopscotch,http://dl.flipkart.com/dl/hopscotch-v-120124d-hair-clip/p/itme7cfmtbzjhp8y?pid=HACE7CFMZQAFQHGV&affid=siddarthk,http://img.fkcdn.com/image/hair-accessory/h/g/v/v-120124d-1-hopscotch-hair-clip-v-120124d-200x200-imae7casg6a2dmdz.jpeg,Health and Beauty>Hair Care>Hair Care Accessories>Hair Accessories,150.0,150.0,150.0,false,HACE7CFMZQAFQHGV,HACE7CFMZQAFQHGV
Flipkart,,Chetna Multicolour Diamond Hair Clip(Multicolor),This is a hair clip set of 3 pc,Chetna,http://dl.flipkart.com/dl/chetna-multicolour-diamond-hair-clip/p/itmebgzaqjph328f?pid=HACEBGZABYSYHRQ2&affid=siddarthk,http://img.fkcdn.com/image/hair-accessory/r/q/2/chhc3pc-3-chetna-hair-clip-multicolour-diamond-200x200-imaebg699hz9xggn.jpeg,Health and Beauty>Hair Care>Hair Care Accessories>Hair Accessories,699.0,323.0,323.0,true,HACEBGZABYSYHRQ2,HACEBGZABYSYHRQ2
Flipkart,,Hopscotch Rose With Pearl Hair Band(Pink),"Pretty, sweet and adorbable hair accessories for little girls, tweens and teens. Hopcotsh brings you the perfect hair embelishment for your daughter and her friends.",Hopscotch,http://dl.flipkart.com/dl/hopscotch-rose-pearl-hair-band/p/itme39h94cvfzxkp?pid=HACE39H9VTRYFM4W&affid=siddarthk,http://img.fkcdn.com/image/hair-accessory/m/4/w/an212-td12-1-hopscotch-hair-band-rose-with-pearl-200x200-imae38gcswzsfmhp.jpeg,Health and Beauty>Hair Care>Hair Care Accessories>Hair Accessories,349.0,275.0,275.0,false,HACE39H9VTRYFM4W,HACE39H9VTRYFM4W
Flipkart,,Hopscotch A10-24 Hair Band(Pink),"Pretty, sweet and adorbable hair accessories for little girls, tweens and teens. Hopcotsh brings you the perfect hair embelishment for your daughter and her friends.",Hopscotch,http://dl.flipkart.com/dl/hopscotch-a10-24-hair-band/p/itme7cfmsguphgak?pid=HACE7CFMJKMGNX3Q&affid=siddarthk,http://img.fkcdn.com/image/hair-accessory/x/3/q/a10-24-3-hopscotch-hair-band-a10-24-200x200-imae7cas9wg5vxcf.jpeg,Health and Beauty>Hair Care>Hair Care Accessories>Hair Accessories,250.0,250.0,250.0,false,HACE7CFMJKMGNX3Q,HACE7CFMJKMGNX3Q
Flipkart,,"Hopscotch V-110809C Hair Clip(White, Black, Pink)","Pretty, sweet and adorbable hair accessories for little girls, tweens and teens. Hopcotsh brings you the perfect hair embelishment for your daughter and her friends.",Hopscotch,http://dl.flipkart.com/dl/hopscotch-v-110809c-hair-clip/p/itme7cfmcfngtbfz?pid=HACE7CFMGYEXPVVV&affid=siddarthk,http://img.fkcdn.com/image/hair-accessory/v/v/v/v-110809c-2-hopscotch-hair-clip-v-110809c-200x200-imae7caszqsrtwgn.jpeg,Health and Beauty>Hair Care>Hair Care Accessories>Hair Accessories,175.0,175.0,175.0,false,HACE7CFMGYEXPVVV,HACE7CFMGYEXPVVV
Flipkart,,AkinosKIDS Soft cotton Flower Bunch Head Band(Blue),,AkinosKIDS,http://dl.flipkart.com/dl/akinoskids-soft-cotton-flower-bunch-head-band/p/itmekzch3mqt2ahc?pid=HACEKZCH8YMGWBHY&affid=siddarthk,http://img.fkcdn.com/image/hair-accessory/b/h/y/bzha1083bla-1-akinoskids-soft-cotton-flower-bunch-200x200-imaen56dvuyyff8g.jpeg,Health and Beauty>Hair Care>Hair Care Accessories>Hair Accessories,399.0,399.0,399.0,true,HACEKZCH8YMGWBHY,HACEKZCH8YMGWBHY
Flipkart,,AkinosKIDS Attractive Flower petals Baby Head Band(Purple),,AkinosKIDS,http://dl.flipkart.com/dl/akinoskids-attractive-flower-petals-baby-head-band/p/itmekzdf3sbk4zf4?pid=HACEKZDFKQCAPPT5&affid=siddarthk,http://img.fkcdn.com/image/hair-accessory/p/t/5/bzha1024pwa-1-akinoskids-attractive-flower-petals-baby-200x200-imaen5659z9pj4bh.jpeg,Health and Beauty>Hair Care>Hair Care Accessories>Hair Accessories,229.0,229.0,229.0,true,HACEKZDFKQCAPPT5,HACEKZDFKQCAPPT5
Flipkart,,AkinosKIDS Roses Flower Bunch Crown Head Band(White),,AkinosKIDS,http://dl.flipkart.com/dl/akinoskids-roses-flower-bunch-crown-head-band/p/itmekzdybygtnmky?pid=HACEKZDYJFUVF9F6&affid=siddarthk,http://img.fkcdn.com/image/hair-accessory/9/f/6/bzha1072wha-1-akinoskids-roses-flower-bunch-crown-200x200-imaen56qhmeqezzy.jpeg,Health and Beauty>Hair Care>Hair Care Accessories>Hair Accessories,265.0,265.0,265.0,true,HACEKZDYJFUVF9F6,HACEKZDYJFUVF9F6
Flipkart,,AkinosKIDS Glitter Flower Stamens crochet Girl Baby Head Band(Blue),,AkinosKIDS,http://dl.flipkart.com/dl/akinoskids-glitter-flower-stamens-crochet-girl-baby-head-band/p/itmekzdyzgrvxctw?pid=HACEKZDYPTBMQHUC&affid=siddarthk,http://img.fkcdn.com/image/hair-accessory/h/u/c/bzha1025bla-1-akinoskids-glitter-flower-stamens-crochet-girl-200x200-imaen55guu9gaxpg.jpeg,Health and Beauty>Hair Care>Hair Care Accessories>Hair Accessories,190.0,190.0,190.0,true,HACEKZDYPTBMQHUC,HACEKZDYPTBMQHUC
Flipkart,,AkinosKIDS Center bow roses and Pearl lace Head Band(White),,AkinosKIDS,http://dl.flipkart.com/dl/akinoskids-center-bow-roses-pearl-lace-head-band/p/itmekzdrn5qjgv84?pid=HACEKZDRVEMHSNZT&affid=siddarthk,http://img.fkcdn.com/image/hair-accessory/n/z/t/bzha1053wha-1-akinoskids-center-bow-roses-and-pearl-lace-200x200-imaen56ughepcfz5.jpeg,Health and Beauty>Hair Care>Hair Care Accessories>Hair Accessories,249.0,249.0,249.0,true,HACEKZDRVEMHSNZT,HACEKZDRVEMHSNZT
Flipkart,,AkinosKIDS Polka dot lace Baby Head Band(Blue),,AkinosKIDS,http://dl.flipkart.com/dl/akinoskids-polka-dot-lace-baby-head-band/p/itmekzchfrgcmqfq?pid=HACEKZCHWG4MCNEH&affid=siddarthk,http://img.fkcdn.com/image/hair-accessory/n/e/h/bzha1013lba-1-akinoskids-polka-dot-lace-baby-200x200-imaen55wadhbmnwx.jpeg,Health and Beauty>Hair Care>Hair Care Accessories>Hair Accessories,185.0,185.0,185.0,true,HACEKZCHWG4MCNEH,HACEKZCHWG4MCNEH
Flipkart,,AkinosKIDS Soft Lace Bow Knot Pearl Rossette Flower Head Band(Pink),,AkinosKIDS,http://dl.flipkart.com/dl/akinoskids-soft-lace-bow-knot-pearl-rossette-flower-head-band/p/itmekzdf5hk8gydg?pid=HACEKZDFVSYTHGBP&affid=siddarthk,http://img.fkcdn.com/image/hair-accessory/g/b/p/bzha1036lpa-1-akinoskids-soft-lace-bow-knot-pearl-rossette-200x200-imaen55d99yzwrqv.jpeg,Health and Beauty>Hair Care>Hair Care Accessories>Hair Accessories,245.0,245.0,245.0,true,HACEKZDFVSYTHGBP,HACEKZDFVSYTHGBP
Flipkart,,AkinosKIDS Rosset Diamond pearl embellished Head Band(White),,AkinosKIDS,http://dl.flipkart.com/dl/akinoskids-rosset-diamond-pearl-embellished-head-band/p/itmekzdf3shmeztq?pid=HACEKZDFUDAK3BGD&affid=siddarthk,http://img.fkcdn.com/image/hair-accessory/b/g/d/bzha1089wha-1-akinoskids-rosset-diamond-pearl-embellished-200x200-imaen55ywvrycbxp.jpeg,Health and Beauty>Hair Care>Hair Care Accessories>Hair Accessories,299.0,299.0,299.0,true,HACEKZDFUDAK3BGD,HACEKZDFUDAK3BGD
Flipkart,,Blueberry Round Metal Hair Clip(Gold),,Blueberry,http://dl.flipkart.com/dl/blueberry-round-metal-hair-clip/p/itmeksrgzgdnpzug?pid=HACEKSRGKGECYVMN&affid=siddarthk,http://img.fkcdn.com/image/hair-accessory/v/m/n/h-8327-1-blueberry-round-metal-200x200-imaekqapgtphj6hr.jpeg,Health and Beauty>Hair Care>Hair Care Accessories>Hair Accessories,349.0,349.0,349.0,true,HACEKSRGKGECYVMN,HACEKSRGKGECYVMN
Flipkart,,AkinosKIDS Flower Sun Newborn Soft Baby Head Band(Yellow),,AkinosKIDS,http://dl.flipkart.com/dl/akinoskids-flower-sun-newborn-soft-baby-head-band/p/itmekzdfbtpxzev3?pid=HACEKZDF2YD7Z9JJ&affid=siddarthk,http://img.fkcdn.com/image/hair-accessory/9/j/j/bzha1015yea-1-akinoskids-flower-sun-newborn-soft-baby-200x200-imaen566kvfu5nqg.jpeg,Health and Beauty>Hair Care>Hair Care Accessories>Hair Accessories,345.0,345.0,345.0,true,HACEKZDF2YD7Z9JJ,HACEKZDF2YD7Z9JJ
Flipkart,,Blueberry Princess Elasticated Hair Band(Silver),,Blueberry,http://dl.flipkart.com/dl/blueberry-princess-elasticated-hair-band/p/itmefnfhzsw2ygab?pid=HACEFNFHNUM4VTY6&affid=siddarthk,http://img.fkcdn.com/image/hair-accessory/t/y/6/h-8174-1-blueberry-princess-elasticated-200x200-imaefn7ndufzgyzd.jpeg,Health and Beauty>Hair Care>Hair Care Accessories>Hair Accessories,599.0,599.0,599.0,true,HACEFNFHNUM4VTY6,HACEFNFHNUM4VTY6
Flipkart,,AkinosKIDS Soft Elastic Lace Flower Baby Head Band(Blue),,AkinosKIDS,http://dl.flipkart.com/dl/akinoskids-soft-elastic-lace-flower-baby-head-band/p/itmekzch5zkyexpw?pid=HACEKZCH9TNUDF4R&affid=siddarthk,http://img.fkcdn.com/image/hair-accessory/f/4/r/bzha1029bla-1-akinoskids-soft-elastic-lace-flower-baby-200x200-imaen569qtqncrnh.jpeg,Health and Beauty>Hair Care>Hair Care Accessories>Hair Accessories,235.0,235.0,235.0,true,HACEKZCH9TNUDF4R,HACEKZCH9TNUDF4R
Flipkart,,"ShrustiTextile ST443 Hair Clip(Purple, Blue, Yellow)",,ShrustiTextile,http://dl.flipkart.com/dl/shrustitextile-st443-hair-clip/p/itmekx4hkgyvrvvz?pid=HACEKX4HMZQZUEWY&affid=siddarthk,http://img.fkcdn.com/image/hair-accessory/e/w/y/st443-3-shrustitextile-st443-200x200-imaekw38tqytjgpk.jpeg,Health and Beauty>Hair Care>Hair Care Accessories>Hair Accessories,999.0,539.0,599.0,false,HACEKX4HMZQZUEWY,HACEKX4HMZQZUEWY
Flipkart,,AkinosKIDS Chiffon Flower Pearl Diamond Embellished Head Band(Black),,AkinosKIDS,http://dl.flipkart.com/dl/akinoskids-chiffon-flower-pearl-diamond-embellished-head-band/p/itmekzdxbkavw64n?pid=HACEKZDX8BJHNEMU&affid=siddarthk,http://img.fkcdn.com/image/hair-accessory/e/m/u/bzha1032bka-1-akinoskids-chiffon-flower-pearl-diamond-200x200-imaefkg2mhwrtvsh.jpeg,Health and Beauty>Hair Care>Hair Care Accessories>Hair Accessories,355.0,355.0,355.0,true,HACEKZDX8BJHNEMU,HACEKZDX8BJHNEMU
