PartnerName,Id,Title,Description,Brand,Link,ImageLink,CategoryName,Mrp,OfferPrice,EffectivePrice,Availability,PartnerIdFromUrl,PartnerIdFromDb
Flipkart,,Multiline Company Claws Hair Accessory Set(Multicolor),,Multiline Company,http://dl.flipkart.com/dl/multiline-company-claws-hair-accessory-set/p/itmebpynf2vpjcmd?pid=HACEBPYNY5FKAYKG&affid=siddarthk,http://img.fkcdn.com/image/hair-accessory/y/k/g/psst1-9-multiline-company-hair-accessory-set-claws-200x200-imaebnuhdthskvsa.jpeg,Health and Beauty>Hair Care>Hair Care Accessories>Hair Accessories,1300.0,1200.0,1200.0,true,HACEBPYNY5FKAYKG,HACEBPYNY5FKAYKG
Flipkart,,Multiline Company Traditional Hair Accessory Set(Black),Its A Hair With Jadai. Easy To Use.,Multiline Company,http://dl.flipkart.com/dl/multiline-company-traditional-hair-accessory-set/p/itme93j3dm7tphfq?pid=HACE93J3DC3VGMF3&affid=siddarthk,http://img.fkcdn.com/image/hair-accessory/m/f/3/ljh01-1-multiline-company-hair-accessory-set-traditional-200x200-imae8p9a8rwpzmpc.jpeg,Health and Beauty>Hair Care>Hair Care Accessories>Hair Accessories,1890.0,349.0,349.0,true,HACE93J3DC3VGMF3,HACE93J3DC3VGMF3
Flipkart,,"20Dresses Hidden in Chains Hair Band(Pink, Gold)",A simple hairband that would go with anything and everything . Accessorize with: Any pastel coloured dresses strappy flats and an envelope sling to complete the look. Ribbon encased metal with metal chain hidden beneath the ribbon detailing. .,20Dresses,http://dl.flipkart.com/dl/20dresses-hidden-chains-hair-band/p/itme4qfk9xrkkfkb?pid=HACE4QFKVTH5NZDD&affid=siddarthk,http://img.fkcdn.com/image/hair-accessory/z/d/d/ha0363-1-20dresses-hair-band-hidden-in-chains-200x200-imae4q6j3wndnrye.jpeg,Health and Beauty>Hair Care>Hair Care Accessories>Hair Accessories,245.0,245.0,245.0,true,HACE4QFKVTH5NZDD,HACE4QFKVTH5NZDD
Flipkart,,trendeela.com Feriha-Hiral Hair Pin(Beige),Trendeela.com brings to your little girl's wardrobe a stylish pair of Bow Hair Clips in glittery fabric with crystal stones studded on it,trendeela.com,http://dl.flipkart.com/dl/trendeela-com-feriha-hiral-hair-pin/p/itmek6vgfpfd4eps?pid=HACEK6VGHXBHAH7B&affid=siddarthk,http://img.fkcdn.com/image/hair-accessory/h/7/b/swfer149-2-trendeela-com-feriha-hiral-200x200-imaek5c9wnrvs8ja.jpeg,Health and Beauty>Hair Care>Hair Care Accessories>Hair Accessories,300.0,145.0,145.0,false,HACEK6VGHXBHAH7B,HACEK6VGHXBHAH7B
Flipkart,,"E'Shop Hairagami Hair Bun Bun(Black, Brown)","Create Perfect Buns, Classic Ponies, Bun Tail & European Buns Get That Perfect Hairstyle In Under 5 Steps Quick And Easy Hairstyles Perfect Hairstyles For Weddings, The Office And Working Out.",E'Shop,http://dl.flipkart.com/dl/e-shop-hairagami-hair-bun/p/itmeehp7s5yqeprv?pid=HACEEHP7XGAGZC26&affid=siddarthk,http://img.fkcdn.com/image/hair-accessory/c/2/6/es199-2-e-shop-hairagami-hair-bun-200x200-imaeek35zd4d5dfk.jpeg,Health and Beauty>Hair Care>Hair Care Accessories>Hair Accessories,299.0,249.0,249.0,true,HACEEHP7XGAGZC26,HACEEHP7XGAGZC26
Flipkart,,trendeela.com Hiral Hair Band(Red),"Elegantly crafted and easy to use, thia hair band will enhance your little girl's beauty. A cute top or a pretty dress will look incomplete without this lovely hair band. The lovely hair band will definitely add a great touch to your angel's beautiful look.",trendeela.com,http://dl.flipkart.com/dl/trendeela-com-hiral-hair-band/p/itmek6k92afsd4a9?pid=HACEK6K98H5GGAQY&affid=siddarthk,http://img.fkcdn.com/image/hair-accessory/a/q/y/swfer180-1-trendeela-com-hiral-200x200-imaek5gfcsjauufd.jpeg,Health and Beauty>Hair Care>Hair Care Accessories>Hair Accessories,400.0,199.0,199.0,false,HACEK6K98H5GGAQY,HACEK6K98H5GGAQY
Flipkart,,trendeela.com Feriha Bun Clip(White),,trendeela.com,http://dl.flipkart.com/dl/trendeela-com-feriha-bun-clip/p/itmem2gaexndgtwz?pid=HACEM2GAYKYFV5CY&affid=siddarthk,http://img.fkcdn.com/image/hair-accessory/5/c/y/swfer190-a-1-trendeela-com-feriha-200x200-imaem2dpygujxbrg.jpeg,Health and Beauty>Hair Care>Hair Care Accessories>Hair Accessories,300.0,145.0,145.0,true,HACEM2GAYKYFV5CY,HACEM2GAYKYFV5CY
Flipkart,,"Juhi Creations Hcmcombo 4 Hair Claw(Pink, Blue, Green)",,Juhi Creations,http://dl.flipkart.com/dl/juhi-creations-hcmcombo-4-hair-claw/p/itmec8asfp4zdmxn?pid=HACEC8ASMTJBZTZG&affid=siddarthk,http://img.fkcdn.com/image/hair-accessory/t/z/g/hcmcombo-4-3-juhi-creations-hair-claw-hcmcombo-4-200x200-imaec4wtxugeq6m3.jpeg,Health and Beauty>Hair Care>Hair Care Accessories>Hair Accessories,240.0,199.0,199.0,true,HACEC8ASMTJBZTZG,HACEC8ASMTJBZTZG
Flipkart,,Samyak Rose Pearl Hair Accessory Set(Pink),"You would not want to miss out on this dark pink rose pearl hair band which comes from the house of Samyak. Samyak is proud to present it to all the valuable consumers out there. It is absolutely comfortable to wear and is light in weight as well. With minimal maintenance issues, it is totally worth the cost. This product is going to look good with any western or traditional attire. Always keep your little princess at her best fashion by buying this before someone grabs it.",Samyak,http://dl.flipkart.com/dl/samyak-rose-pearl-hair-accessory-set/p/itmefnchjn2ntzby?pid=HACEFNCHZBNZFFAG&affid=siddarthk,http://img.fkcdn.com/image/hair-accessory/f/a/g/pa-119-1-samyak-rose-pearl-200x200-imaefwzztyhvthws.jpeg,Health and Beauty>Hair Care>Hair Care Accessories>Hair Accessories,799.0,406.0,406.0,false,HACEFNCHZBNZFFAG,HACEFNCHZBNZFFAG
Flipkart,,trendeela.com Feriha-Hiral Head Band(Yellow),Give your little princess's hair a cute touch with this trendy head band . A classic design and a classy colour make this headband a must-have in your little ones accessory collection.,trendeela.com,http://dl.flipkart.com/dl/trendeela-com-feriha-hiral-head-band/p/itmek43xnhxhgv5q?pid=HACEK43X9HS8UUP8&affid=siddarthk,http://img.fkcdn.com/image/hair-accessory/u/p/8/swfer129-a-1-trendeela-com-feriha-hiral-200x200-imaek2fnydvhfac9.jpeg,Health and Beauty>Hair Care>Hair Care Accessories>Hair Accessories,1099.0,245.0,245.0,false,HACEK43X9HS8UUP8,HACEK43X9HS8UUP8
Flipkart,,trendeela.com Feriha-Hiral Hair Pin(White),Trendeela.com brings to your little girl's wardrobe a stylish pair of Floral Hair Clips in satin fabric with crystal stones studded on it,trendeela.com,http://dl.flipkart.com/dl/trendeela-com-feriha-hiral-hair-pin/p/itmek6vjuz8vqwuk?pid=HACEK6VJGMZDNAWC&affid=siddarthk,http://img.fkcdn.com/image/hair-accessory/a/w/c/swfer165-2-trendeela-com-feriha-hiral-200x200-imaek5c9pgwcufvu.jpeg,Health and Beauty>Hair Care>Hair Care Accessories>Hair Accessories,300.0,145.0,145.0,false,HACEK6VJGMZDNAWC,HACEK6VJGMZDNAWC
Flipkart,,trendeela.com Feriha-Hiral Hair Pin(Red),Trendeela.com brings to your little girl's wardrobe a stylish pair of Bow Hair Clips in Fur-feather fabric with crystal stones studded on it,trendeela.com,http://dl.flipkart.com/dl/trendeela-com-feriha-hiral-hair-pin/p/itmek6vge4v644fk?pid=HACEK6VGA3C4HJBY&affid=siddarthk,http://img.fkcdn.com/image/hair-accessory/j/b/y/swfer160-2-trendeela-com-feriha-hiral-200x200-imaek5c8ngfhcfpp.jpeg,Health and Beauty>Hair Care>Hair Care Accessories>Hair Accessories,400.0,199.0,199.0,false,HACEK6VGA3C4HJBY,HACEK6VGA3C4HJBY
Flipkart,,trendeela.com Feriha-Hiral Hair Pin(Pink),Trendeela.com brings to your little girl's wardrobe a stylish pair of Floral Hair Clips in satin fabric with crystal stones studded on it,trendeela.com,http://dl.flipkart.com/dl/trendeela-com-feriha-hiral-hair-pin/p/itmek6vgm5tzkqgj?pid=HACEK6VGNHCGUBTN&affid=siddarthk,http://img.fkcdn.com/image/hair-accessory/b/t/n/swfer168-2-trendeela-com-feriha-hiral-200x200-imaek5c8tgvqdggw.jpeg,Health and Beauty>Hair Care>Hair Care Accessories>Hair Accessories,300.0,145.0,145.0,false,HACEK6VGNHCGUBTN,HACEK6VGNHCGUBTN
Flipkart,,trendeela.com Feriha Banana Clip(Brown),"This Banana Clip is 3.5 Inches Long:: These Clips Prevent Your Hair From Marks and Damage That Pony Holders Would Make:: Strong Plastic, Excellent Quality That Will Hold Your Hair Together:: Great Style for Children, Teens and Ladies",trendeela.com,http://dl.flipkart.com/dl/trendeela-com-feriha-banana-clip/p/itmem2mrczhphz2n?pid=HACEM2MRJKDRMWTJ&affid=siddarthk,http://img.fkcdn.com/image/hair-accessory/w/t/j/swfer177-a-1-trendeela-com-feriha-200x200-imaem2hvkhhu4tmq.jpeg,Health and Beauty>Hair Care>Hair Care Accessories>Hair Accessories,600.0,225.0,225.0,false,HACEM2MRJKDRMWTJ,HACEM2MRJKDRMWTJ
Flipkart,,"trendeela.com Feriha Hair Band(White, Black, Brown)",Give yourself a stylish look by trendeels.com's Feriha collection with leopard print printed cloth plastic hair band which is perfect for teens girls,trendeela.com,http://dl.flipkart.com/dl/trendeela-com-feriha-hair-band/p/itmek7heqeeeh43m?pid=HACEK7HEJZAHT8Y4&affid=siddarthk,http://img.fkcdn.com/image/hair-accessory/8/y/4/swfer184-1-trendeela-com-feriha-200x200-imaek6cuq2srmbsf.jpeg,Health and Beauty>Hair Care>Hair Care Accessories>Hair Accessories,350.0,165.0,165.0,false,HACEK7HEJZAHT8Y4,HACEK7HEJZAHT8Y4
Flipkart,,trendeela.com Feriha-Hiral Hair Pin(Blue),Trendeela.com brings to your little girl's wardrobe a stylish pair of Floral Hair Clips in satin fabric with crystal stones studded on it,trendeela.com,http://dl.flipkart.com/dl/trendeela-com-feriha-hiral-hair-pin/p/itmek6vgaerpugzq?pid=HACEK6VGHG3F3YGW&affid=siddarthk,http://img.fkcdn.com/image/hair-accessory/y/g/w/swfer175-2-trendeela-com-feriha-hiral-200x200-imaek5c9msgfzq4e.jpeg,Health and Beauty>Hair Care>Hair Care Accessories>Hair Accessories,300.0,145.0,145.0,false,HACEK6VGHG3F3YGW,HACEK6VGHG3F3YGW
Flipkart,,"trendeela.com Feriha Hair Band(White, Black, Brown)",Give yourself a stylish look by trendeels.com's Feriha collection with leopard print printed cloth plastic hair band which is perfect for teens girls,trendeela.com,http://dl.flipkart.com/dl/trendeela-com-feriha-hair-band/p/itmek7hegz92gycg?pid=HACEK7HEGTFAXPUM&affid=siddarthk,http://img.fkcdn.com/image/hair-accessory/p/u/m/swfer183-1-trendeela-com-feriha-200x200-imaek6cuxyvuzmhk.jpeg,Health and Beauty>Hair Care>Hair Care Accessories>Hair Accessories,350.0,165.0,165.0,false,HACEK7HEGTFAXPUM,HACEK7HEGTFAXPUM
Flipkart,,trendeela.com Feriha-Hiral Hair Pin(White),Trendeela.com brings to your little girl's wardrobe a stylish pair of Bow Hair Clips in Fur-feather fabric with crystal stones studded on it,trendeela.com,http://dl.flipkart.com/dl/trendeela-com-feriha-hiral-hair-pin/p/itmek6vgvxxyzshc?pid=HACEK6VGHE5D5Z6V&affid=siddarthk,http://img.fkcdn.com/image/hair-accessory/z/6/v/swfer164-2-trendeela-com-feriha-hiral-200x200-imaek5c8t2wyazja.jpeg,Health and Beauty>Hair Care>Hair Care Accessories>Hair Accessories,400.0,199.0,199.0,false,HACEK6VGHE5D5Z6V,HACEK6VGHE5D5Z6V
Flipkart,,trendeela.com Feriha-Hiral Hair Pin(Pink),Trendeela.com brings to your little girl's wardrobe a stylish pair of Floral Hair Clips in satin fabric with crystal stones studded on it,trendeela.com,http://dl.flipkart.com/dl/trendeela-com-feriha-hiral-hair-pin/p/itmek6vgd9fbjnte?pid=HACEK6VGGJN6CEG4&affid=siddarthk,http://img.fkcdn.com/image/hair-accessory/e/g/4/swfer167-2-trendeela-com-feriha-hiral-200x200-imaek5c8zaayaujh.jpeg,Health and Beauty>Hair Care>Hair Care Accessories>Hair Accessories,300.0,145.0,145.0,false,HACEK6VGGJN6CEG4,HACEK6VGGJN6CEG4
Flipkart,,trendeela.com Feriha-Hiral Hair Pin(Pink),Trendeela.com brings to your little girl's wardrobe a stylish pair of Floral Hair Clips in satin fabric with crystal stones studded on it,trendeela.com,http://dl.flipkart.com/dl/trendeela-com-feriha-hiral-hair-pin/p/itmek6vgfffjd2ar?pid=HACEK6VGEFM56TGE&affid=siddarthk,http://img.fkcdn.com/image/hair-accessory/t/g/e/swfer176-2-trendeela-com-feriha-hiral-200x200-imaek5c8mwhs79ez.jpeg,Health and Beauty>Hair Care>Hair Care Accessories>Hair Accessories,300.0,145.0,145.0,false,HACEK6VGEFM56TGE,HACEK6VGEFM56TGE
Flipkart,,trendeela.com Feriha Head Band(Red),Give your little princess's hair a cute touch with this trendy head band . A classic design and a classy colour make this headband a must-have in your little ones accessory collection.,trendeela.com,http://dl.flipkart.com/dl/trendeela-com-feriha-head-band/p/itmem2mrebhhpeyu?pid=HACEM2MR4QVYDE7R&affid=siddarthk,http://img.fkcdn.com/image/hair-accessory/e/7/r/swfer128-a-1-trendeela-com-feriha-200x200-imaek2fnnagjfzgp.jpeg,Health and Beauty>Hair Care>Hair Care Accessories>Hair Accessories,650.0,265.0,265.0,false,HACEM2MR4QVYDE7R,HACEM2MR4QVYDE7R
Flipkart,,trendeela.com Feriha-Hiral Hair Pin(Beige),Trendeela.com brings to your little girl's wardrobe a stylish pair of Floral Hair Clips in satin fabric with crystal stones studded on it,trendeela.com,http://dl.flipkart.com/dl/trendeela-com-feriha-hiral-hair-pin/p/itmek6vgj9kgzbgp?pid=HACEK6VGGEXSKGMG&affid=siddarthk,http://img.fkcdn.com/image/hair-accessory/g/m/g/swfer173-2-trendeela-com-feriha-hiral-200x200-imaek5c92zgqpqug.jpeg,Health and Beauty>Hair Care>Hair Care Accessories>Hair Accessories,300.0,145.0,145.0,false,HACEK6VGGEXSKGMG,HACEK6VGGEXSKGMG
Flipkart,,trendeela.com Feriha Head Band(Pink),Give your little princess's hair a cute touch with this trendy head band . A classic design and a classy colour make this headband a must-have in your little ones accessory collection.,trendeela.com,http://dl.flipkart.com/dl/trendeela-com-feriha-head-band/p/itmem2mrx9yry77k?pid=HACEM2MRSYV2HTMS&affid=siddarthk,http://img.fkcdn.com/image/hair-accessory/t/m/s/swfer142-a-1-trendeela-com-feriha-200x200-imaek2fn6pahuhsg.jpeg,Health and Beauty>Hair Care>Hair Care Accessories>Hair Accessories,650.0,225.0,225.0,true,HACEM2MRSYV2HTMS,HACEM2MRSYV2HTMS
Flipkart,,trendeela.com Feriha-Hiral Hair Pin(Red),Trendeela.com brings to your little girl's wardrobe a stylish pair of Bow Hair Clips in glittery fabric with crystal stones studded on it,trendeela.com,http://dl.flipkart.com/dl/trendeela-com-feriha-hiral-hair-pin/p/itmek6vgzvm2h2jp?pid=HACEK6VGUWH9U97X&affid=siddarthk,http://img.fkcdn.com/image/hair-accessory/9/7/x/swfer154-2-trendeela-com-feriha-hiral-200x200-imaek5c8k9vg3sjr.jpeg,Health and Beauty>Hair Care>Hair Care Accessories>Hair Accessories,300.0,145.0,145.0,false,HACEK6VGUWH9U97X,HACEK6VGUWH9U97X
Flipkart,,trendeela.com Feriha-Hiral Hair Pin(Blue),Trendeela.com brings to your little girl's wardrobe a stylish pair of Bow Hair Clips in glittery fabric with crystal stones studded on it,trendeela.com,http://dl.flipkart.com/dl/trendeela-com-feriha-hiral-hair-pin/p/itmek6vggyhv2qtw?pid=HACEK6VGG5VKEY3Z&affid=siddarthk,http://img.fkcdn.com/image/hair-accessory/y/3/z/swfer151-2-trendeela-com-feriha-hiral-200x200-imaek5c8g949b9ce.jpeg,Health and Beauty>Hair Care>Hair Care Accessories>Hair Accessories,300.0,145.0,145.0,false,HACEK6VGG5VKEY3Z,HACEK6VGG5VKEY3Z
Flipkart,,trendeela.com Feriha-Hiral Hair Pin(Blue),Trendeela.com brings to your little girl's wardrobe a stylish pair of Bow Hair Clips in Fur-feather fabric with crystal stones studded on it,trendeela.com,http://dl.flipkart.com/dl/trendeela-com-feriha-hiral-hair-pin/p/itmek6vgkmguqczq?pid=HACEK6VG9REXYAUA&affid=siddarthk,http://img.fkcdn.com/image/hair-accessory/a/u/a/swfer162-2-trendeela-com-feriha-hiral-200x200-imaek5c898jzwjhp.jpeg,Health and Beauty>Hair Care>Hair Care Accessories>Hair Accessories,400.0,199.0,199.0,false,HACEK6VG9REXYAUA,HACEK6VG9REXYAUA
Flipkart,,Samyak Soft Printed Rubber Band(Multicolor),,Samyak,http://dl.flipkart.com/dl/samyak-soft-printed-rubber-band/p/itmemnqggma9xreg?pid=HACEMNQGZANXGXZH&affid=siddarthk,http://img.fkcdn.com/image/hair-accessory/x/z/h/pa-0068-30-samyak-soft-printed-200x200-imaemnp52jkvvr9x.jpeg,Health and Beauty>Hair Care>Hair Care Accessories>Hair Accessories,599.0,299.0,299.0,true,HACEMNQGZANXGXZH,HACEMNQGZANXGXZH
Flipkart,,Samyak Printed 02 Rubber Band(Multicolor),"PARUL CREATIONS is an Attempt to create beautiful Accessories for all princess and Queens everywhere in the country. The brand is reckon within fashion Accessories in INDIA. PARUL CREATIONS has a winsome collection of organic, vintage and floral collection which is worth a second glance. All product line are inspired from nature. The product range by PARUL CREATIONS is different. Different Colour for Different dresses.Combo of 30 hair rubbers",Samyak,http://dl.flipkart.com/dl/samyak-printed-02-rubber-band/p/itmefhw3s8kxg9zm?pid=HACEFHW3MCFNGRBR&affid=siddarthk,http://img.fkcdn.com/image/hair-accessory/r/b/r/pa-0076-30-samyak-printed-02-200x200-imaefhujzx8xhmw8.jpeg,Health and Beauty>Hair Care>Hair Care Accessories>Hair Accessories,598.0,299.0,299.0,false,HACEFHW3MCFNGRBR,HACEFHW3MCFNGRBR
Flipkart,,Samyak Artificial Juda Bun(Brown),Pack of 1 Stylish Artificial Juda Bun to style your Hair.,Samyak,http://dl.flipkart.com/dl/samyak-artificial-juda-bun/p/itmem9vaekahh8g3?pid=HACEM9V9ZDHDCJSG&affid=siddarthk,http://img.fkcdn.com/image/hair-accessory/j/s/g/pa-00192-1-samyak-artificial-juda-200x200-imaem9u6qgsdkaju.jpeg,Health and Beauty>Hair Care>Hair Care Accessories>Hair Accessories,699.0,299.0,299.0,true,HACEM9V9ZDHDCJSG,HACEM9V9ZDHDCJSG
Flipkart,,Samyak Navratri Rubber Band(Red),Pack of 50 Hair rubbers.,Samyak,http://dl.flipkart.com/dl/samyak-navratri-rubber-band/p/itmemtv8ruqermrm?pid=HACEMTV7T5SQHEGF&affid=siddarthk,http://img.fkcdn.com/image/hair-accessory/e/g/f/pa-00195-50-samyak-navratri-200x200-imaemttshreztb3j.jpeg,Health and Beauty>Hair Care>Hair Care Accessories>Hair Accessories,499.0,299.0,299.0,true,HACEMTV7T5SQHEGF,HACEMTV7T5SQHEGF
Flipkart,,Samyak Plastic Hair Accessory Set(Multicolor),,Samyak,http://dl.flipkart.com/dl/samyak-plastic-hair-accessory-set/p/itmemz7hgzgqfgnh?pid=HACEMZ7HD9K27PVA&affid=siddarthk,http://img.fkcdn.com/image/hair-accessory/p/v/a/pa-0072-15-samyak-plastic-200x200-imaemnzhctbuv9ac.jpeg,Health and Beauty>Hair Care>Hair Care Accessories>Hair Accessories,599.0,349.0,349.0,true,HACEMZ7HD9K27PVA,HACEMZ7HD9K27PVA
Flipkart,,Samyak Colourful And Soft Rubber Band(Multicolor),Pack Of 21 Colourful And Soft Hair Rubbers.Their Products Are Eco-Friendly And Re- Usable Product Creative And Colourful Impressive Design Long Lasting Elasticity At Affordable Price Parul Creations Is An Attempt To Create Beautiful Accessories For All Princess And Queens Everywhere In The Country.,Samyak,http://dl.flipkart.com/dl/samyak-colourful-soft-rubber-band/p/itmedzcfhzwh8s8g?pid=HACEDZCFQGG864EJ&affid=siddarthk,http://img.fkcdn.com/image/hair-accessory/4/e/j/pa-033-21-samyak-rubber-band-colourful-and-soft-200x200-imaedz9hw62vmcrm.jpeg,Health and Beauty>Hair Care>Hair Care Accessories>Hair Accessories,599.0,300.0,300.0,false,HACEDZCFQGG864EJ,HACEDZCFQGG864EJ
Flipkart,,Samyak Funky Style Bun(Multicolor),,Samyak,http://dl.flipkart.com/dl/samyak-funky-style-bun/p/itmemzfdffjcp4a2?pid=HACEMZFDBJEP5H9E&affid=siddarthk,http://img.fkcdn.com/image/hair-accessory/h/9/e/pa-0079-4-samyak-funky-style-200x200-imaemz9anq8yccmf.jpeg,Health and Beauty>Hair Care>Hair Care Accessories>Hair Accessories,599.0,369.0,369.0,true,HACEMZFDBJEP5H9E,HACEMZFDBJEP5H9E
Flipkart,,Samyak Velvet 02 Hair Band(Multicolor),Pack of 12 velvet hair bands,Samyak,http://dl.flipkart.com/dl/samyak-velvet-02-hair-band/p/itmedz9eyahnfcz8?pid=HACEDZ9ES3U6ZRJS&affid=siddarthk,http://img.fkcdn.com/image/hair-accessory/r/j/s/pa-042-12-samyak-hair-band-velvet-02-200x200-imaedyb5ttywgqhw.jpeg,Health and Beauty>Hair Care>Hair Care Accessories>Hair Accessories,650.0,365.0,365.0,false,HACEDZ9ES3U6ZRJS,HACEDZ9ES3U6ZRJS
Flipkart,,"Samyak Velvet COMBO Rubber Band, Hair Band(Multicolor)",,Samyak,http://dl.flipkart.com/dl/samyak-velvet-combo-rubber-band-hair-band/p/itmemz7myrf3mgfw?pid=HACEMZ7HXUJHUBGN&affid=siddarthk,http://img.fkcdn.com/image/hair-accessory/b/g/n/pa-0078-12-samyak-velvet-combo-200x200-imaemnp9mahq7upp.jpeg,Health and Beauty>Hair Care>Hair Care Accessories>Hair Accessories,496.0,299.0,299.0,true,HACEMZ7HXUJHUBGN,HACEMZ7HXUJHUBGN
Flipkart,,Samyak Baby Doll Floral Hair Band(Blue),"pack of 1 blue floral hair band. PARUL CREATIONS is an Attempt to create beautiful Accessories for all princess and Queens everywhere in the country. The brand is reckon within fashion Accessories in INDIA. PARUL CREATIONS has a winsome collection of organic, vintage and floral collection which is worth a second glance. All product line are inspired from nature. The product range by PARUL CREATIONS is different.",Samyak,http://dl.flipkart.com/dl/samyak-baby-doll-floral-hair-band/p/itmefkwzuf4rcfuz?pid=HACEFKWZH6SYPKFQ&affid=siddarthk,http://img.fkcdn.com/image/hair-accessory/k/f/q/pa-0071-1-samyak-baby-doll-floral-200x200-imaeffefpvzmethu.jpeg,Health and Beauty>Hair Care>Hair Care Accessories>Hair Accessories,645.0,299.0,299.0,false,HACEFKWZH6SYPKFQ,HACEFKWZH6SYPKFQ
Flipkart,,Samyak Star Shapped Rubber Band(Multicolor),Metallic Colorful Hair RubbersEasy To UseReusable ProductLong Lasting,Samyak,http://dl.flipkart.com/dl/samyak-star-shapped-rubber-band/p/itmebzy2kx4pfspb?pid=HACEBZY2JP2B4QCZ&affid=siddarthk,http://img.fkcdn.com/image/hair-accessory/q/c/z/pa0020-12-samyak-rubber-band-star-shapped-200x200-imaebyw29eydfqnq.jpeg,Health and Beauty>Hair Care>Hair Care Accessories>Hair Accessories,449.0,275.0,275.0,true,HACEBZY2JP2B4QCZ,HACEBZY2JP2B4QCZ
Flipkart,,Samyak Colourful Design Rubber Band(Multicolor),Pack Of 12 Soft Hair Rubbers.Their Products Are Eco-Friendly And Re- Usable Product Creative And Colourful Impressive Design Long Lasting Elasticity At Affordable Price Parul Creations Is An Attempt To Create Beautiful Accessories For All Princess And Queens Everywhere In The Country.,Samyak,http://dl.flipkart.com/dl/samyak-colourful-design-rubber-band/p/itmedzcfdfn2rj65?pid=HACEDZCFYAYUJZGG&affid=siddarthk,http://img.fkcdn.com/image/hair-accessory/z/g/g/pa-034-12-samyak-rubber-band-colourful-design-200x200-imaedz9hc7e3gpfw.jpeg,Health and Beauty>Hair Care>Hair Care Accessories>Hair Accessories,599.0,245.0,245.0,true,HACEDZCFYAYUJZGG,HACEDZCFYAYUJZGG
Flipkart,,Samyak Stone Floral Hair Accessory Set(Multicolor),Pack of 5 designer studded hair rubbers,Samyak,http://dl.flipkart.com/dl/samyak-stone-floral-hair-accessory-set/p/itmefhytsyxvmfrz?pid=HACEFHYTCDFYTZBE&affid=siddarthk,http://img.fkcdn.com/image/hair-accessory/z/b/e/pa-0075-5-samyak-stone-floral-200x200-imaefgbadbverwfb.jpeg,Health and Beauty>Hair Care>Hair Care Accessories>Hair Accessories,675.0,325.0,325.0,false,HACEFHYTCDFYTZBE,HACEFHYTCDFYTZBE
Flipkart,,Samyak Studded 01 Hair Band(Black),"a studded stones hair band. Pack of 1 . soft and easy to wear.Beautifully designed..PARUL CREATIONS is an Attempt to create beautiful Accessories for all princess and Queens everywhere in the country. The brand is reckon within fashion Accessories in INDIA. PARUL CREATIONS has a winsome collection of organic, vintage and floral collection which is worth a second glance. All product line are inspired from nature. The product range by PARUL CREATIONS is different.",Samyak,http://dl.flipkart.com/dl/samyak-studded-01-hair-band/p/itmefkrhygdhvdef?pid=HACEFKRHS94FFSSA&affid=siddarthk,http://img.fkcdn.com/image/hair-accessory/s/s/a/pa-0069-1-samyak-studded-01-200x200-imaeffd5zqaghztb.jpeg,Health and Beauty>Hair Care>Hair Care Accessories>Hair Accessories,645.0,379.0,379.0,true,HACEFKRHS94FFSSA,HACEFKRHS94FFSSA
Flipkart,,Samyak Velvet 01 Rubber Band(Multicolor),"12 pieces of Velvet printed hair rubbers . 06 pieces plain black 06 pieces printed Eco-friendly and Re- usable ProductCreative and colorfulImpressive Design Samyak is an Attempt to create beautiful Accessories for all princess and Queens everywhere in the country.. The brand is reckon within fashion Accessories in INDIA .Samyak has a winsome collection of organic, vintage and floral collection which is worth a second glance. All product line are inspired from nature. The product range by Samyak is different. Different Color for Different dresses. Insight is an Attempt to create beautiful Accessories for all princess and Queens everywhere in the country. Different designs with different colors pack of 120hair rubbers. Soft and easy to use",Samyak,http://dl.flipkart.com/dl/samyak-velvet-01-rubber-band/p/itmec9fkgbq3zjqs?pid=HACEC9FKCHSXZHZB&affid=siddarthk,http://img.fkcdn.com/image/hair-accessory/h/z/b/pa-016-12-samyak-rubber-band-velvet-01-200x200-imaedp4egsfcdgx8.jpeg,Health and Beauty>Hair Care>Hair Care Accessories>Hair Accessories,675.0,319.0,319.0,true,HACEC9FKCHSXZHZB,HACEC9FKCHSXZHZB
Flipkart,,Samyak Velvet 03 Rubber Band(Black),Combo of 12 velvet rubber bands,Samyak,http://dl.flipkart.com/dl/samyak-velvet-03-rubber-band/p/itmedz9eceyhwtzu?pid=HACEDZ9EKH5HDEYZ&affid=siddarthk,http://img.fkcdn.com/image/hair-accessory/e/y/z/pa-044-12-samyak-rubber-band-velvet-03-200x200-imaedybk8hgpuhyq.jpeg,Health and Beauty>Hair Care>Hair Care Accessories>Hair Accessories,599.0,320.0,320.0,true,HACEDZ9EKH5HDEYZ,HACEDZ9EKH5HDEYZ
Flipkart,,Samyak Printed Soft Rubber Band(Multicolor),"Pack Of 21 Hair Rubbers With Different Design With Different Colours.Samyak Has A Winsome Collection Of Organic, Vintage And Floral Collection Which Is Worth A Second Glance. All Product Line Are Inspired From Nature. The Product Range By Samyak Is Different. Different Color For Different Dresses.",Samyak,http://dl.flipkart.com/dl/samyak-printed-soft-rubber-band/p/itmec9zyh7mvgfnx?pid=HACEC9ZYPTXGNUHT&affid=siddarthk,http://img.fkcdn.com/image/hair-accessory/u/h/t/pa-023-21-samyak-rubber-band-printed-soft-200x200-imaedzwadddghzu7.jpeg,Health and Beauty>Hair Care>Hair Care Accessories>Hair Accessories,580.0,300.0,300.0,false,HACEC9ZYPTXGNUHT,HACEC9ZYPTXGNUHT
Flipkart,,Samyak Rabbit Ear Hair Band(Multicolor),,Samyak,http://dl.flipkart.com/dl/samyak-rabbit-ear-hair-band/p/itmemnetfxzyzfmu?pid=HACEMNETDXUSUJUZ&affid=siddarthk,http://img.fkcdn.com/image/hair-accessory/j/u/z/pa-0071-3-samyak-rabbit-ear-200x200-imaemke3grzfgwep.jpeg,Health and Beauty>Hair Care>Hair Care Accessories>Hair Accessories,499.0,275.0,275.0,true,HACEMNETDXUSUJUZ,HACEMNETDXUSUJUZ
