PartnerName,Id,Title,Description,Brand,Link,ImageLink,CategoryName,Mrp,OfferPrice,EffectivePrice,Availability,PartnerIdFromUrl,PartnerIdFromDb
Flipkart,,Ermani Export Silver Metal 2 Rods Bangle Box Makeup Vanity Box(Silver),,Ermani Export,http://dl.flipkart.com/dl/ermani-export-silver-metal-2-rods-bangle-box-makeup-vanity/p/itmeejgdeysybuft?pid=VANEEJGDSYJFFW5C&affid=siddarthk,http://img.fkcdn.com/image/vanity-box/g/k/6/vb037-ermani-export-traditional-royal-silver-metal-2-rods-200x200-imaeegbfjcdnhjxg.jpeg,Home Decor>Home Utilities>Utility Boxes,4199.0,629.0,699.0,true,VANEEJGDSYJFFW5C,VANEEJGDSYJFFW5C
Flipkart,,Ermani Export Makeup And Jewellery Vanity Box Makeup Vanity Box(Silver),,Ermani Export,http://dl.flipkart.com/dl/ermani-export-makeup-jewellery-vanity-box/p/itmeejf5s3qezpds?pid=VANEEJF5DHH9TGYZ&affid=siddarthk,http://img.fkcdn.com/image/vanity-box/j/c/h/vb062-ermani-export-traditional-super-silver-case-200x200-imaeeh8fyzjat8rv.jpeg,Health and Beauty>Makeup>Vanity Boxes,4999.0,1881.0,2090.0,true,VANEEJF5DHH9TGYZ,VANEEJF5DHH9TGYZ
Flipkart,,Lalas Neem And Tulsi Shampoo(200 ml),"Internationally Proven Formula, With A One Application Cure All Formulation. Now Designed To Give Your Hairs Complete Protection From Afflictions Like, Dandruff And Infestations, Balancing The Cleansing Process Of Your Hairs. Neem With Its Antiseptic Nature Cures The Scalp Of Skin Disorders, Rashes, Heat Boils, And Macro Wounds. Neem Is A Natural Astringent. Tulsi The Natural Adaptive, Cleanses, And Balances The Hair Nourishment. Leaving You With Envious Gasps From Your Admirers.",Lalas,http://dl.flipkart.com/dl/lalas-neem-tulsi-shampoo/p/itmee39ybnpgkzuu?pid=SMPEE39ZZQKHDGBT&affid=siddarthk,http://img.fkcdn.com/image/shampoo/g/b/t/lalas-200-neem-and-tulsi-shampoo-200x200-imaee2cbffk5dhgt.jpeg,Health and Beauty>Hair Care>Shampoos,95.0,90.0,90.0,true,SMPEE39ZZQKHDGBT,SMPEE39ZZQKHDGBT
Flipkart,,Modicare Salon Anti Dandruff Shampoo with Silk Protein(200 ml),"A Premium Quality Dandruff Control Shampoo With Zpto, Silk Protein And Ceramide To Strengthen, Moisturise And Revive Your Hair",Modicare,http://dl.flipkart.com/dl/modicare-salon-anti-dandruff-shampoo-silk-protein/p/itmed96tsznhjewf?pid=SMPED96TPZHEYHHZ&affid=siddarthk,http://img.fkcdn.com/image/shampoo/h/h/z/modicare-200-salon-anti-dandruff-shampoo-with-silk-protein-200x200-imaed8tx6tevvx9k.jpeg,Health and Beauty>Hair Care>Shampoos,234.0,228.0,228.0,true,SMPED96TPZHEYHHZ,SMPED96TPZHEYHHZ
Flipkart,,Anokhi Ada Dolphin Hair Clip(Black),Pair of 10 cm long Black Banana Clips with Diving dolphin like structure.,Anokhi Ada,http://dl.flipkart.com/dl/anokhi-ada-dolphin-hair-clip/p/itmedshwt6g6zahh?pid=HACEDSHWYEZ59CZ9&affid=siddarthk,http://img.fkcdn.com/image/hair-accessory/c/z/9/hja-0008-2-anokhi-ada-hair-clip-dolphin-200x200-imaedsk3r68g2fzz.jpeg,Health and Beauty>Hair Care>Hair Care Accessories>Hair Accessories,250.0,230.0,230.0,false,HACEDSHWYEZ59CZ9,HACEDSHWYEZ59CZ9
Flipkart,,Aaishwarya Pink Metal Bow Fashion Hair tie Rubber Band(Pink),"This pink metal Bow Fashion Hairband, will make you look adorable.",Aaishwarya,http://dl.flipkart.com/dl/aaishwarya-pink-metal-bow-fashion-hair-tie-rubber-band/p/itmeepzrdfq9tgqy?pid=HACEEPZRQGYKGFJY&affid=siddarthk,http://img.fkcdn.com/image/hair-accessory/f/j/y/ag1115ha13p-1-aaishwarya-pink-metal-bow-fashion-hair-tie-200x200-imaeezshwupjaq7f.jpeg,Health and Beauty>Hair Care>Hair Care Accessories>Hair Accessories,950.0,296.0,329.0,true,HACEEPZRQGYKGFJY,HACEEPZRQGYKGFJY
Flipkart,,Pink Rose Pearl Princess Charm Juda Cover Hair Claw,"Beautifully crafted, which combines the attributes of a Pink Rose, which are Passion, Admiration, Grace, elegance, Gratitude and Appreciation. Designed to compliment you…",Pink Rose,http://dl.flipkart.com/dl/pink-rose-pearl-princess-charm-juda-cover-hair-claw/p/itmeef3qpahxqrgj?pid=HACEEF3Q2H525HCH&affid=siddarthk,http://img.fkcdn.com/image/hair-accessory/h/c/h/pinkrose-ha-113-1-pink-rose-hair-claw-pearl-princess-charm-juda-200x200-imaedwuvzfhuxkmg.jpeg,Health and Beauty>Hair Care>Hair Care Accessories>Hair Accessories,3078.0,1259.0,1399.0,true,HACEEF3Q2H525HCH,HACEEF3Q2H525HCH
Flipkart,,"SadiGali Flower Look Bun Collection Hair Clip Hair Claw(Red, Gold, White, Orange, Silver, Black)",,SadiGali,http://dl.flipkart.com/dl/sadigali-flower-look-bun-collection-hair-clip-claw/p/itmeerhyq4tj3vtv?pid=HACEERHYFVHNZGCG&affid=siddarthk,http://img.fkcdn.com/image/hair-accessory/g/c/g/hc40-2-sadigali-flower-look-bun-collection-hair-clip-200x200-imaeerft6rd9avxj.jpeg,Health and Beauty>Hair Care>Hair Care Accessories>Hair Accessories,499.0,199.0,199.0,false,HACEERHYFVHNZGCG,HACEERHYFVHNZGCG
Flipkart,,F&C Monofilament Regular For Man'S Hair Extension,Specification of monofilament Men’s Toupee100% Tangle free hair Color Natural Black hair length 6 inch hair Toupee,F&C,http://dl.flipkart.com/dl/f-c-monofilament-regular-man-s-hair-extension/p/itmeenuwdwzkcfhj?pid=HAEEENUWJJVFJWZG&affid=siddarthk,http://img.fkcdn.com/image/hair-extension/w/d/t/reg-008-1-f-c-hair-wig-s-monofilament-regular-for-mens-200x200-imaeb2jrqaqtpsyv.jpeg,Health and Beauty>Hair Care>Hair Care Accessories>Hair Extensions,5500.0,4020.0,4020.0,true,HAEEENUWJJVFJWZG,HAEEENUWJJVFJWZG
Flipkart,,Divine Collection Bag Electric 1000 ml Hot Water Bag(Red),"Quickly And Easily Keep Yourself Warm And Alleviate Your Aches And Pains With This Astounding New Generation Electric Hot Water Bottle. This Amazing Item Can Be Ready In Just Minutes After Your Pain Strikes So Theres No Extended Suffering Through Waiting. Just Plug In The New Generation Electric Hot Water Bottle For 15 Minutes And The Warmth And Relief Will Last From 1 - 3 Hours. There Is No Need To Fill The New Generation Electric Hot Water Bottle With Water And The Soft, Warm Relief It Offers Will Have You Feeling Better In No Time.",Divine Collection,http://dl.flipkart.com/dl/divine-collection-bag-electric-1000-ml-hot-water/p/itmee3ngpfqmfzbk?pid=HWBEE3MZHMTEMJFK&affid=siddarthk,http://img.fkcdn.com/image/hot-water-bag/j/f/k/dchwb1-1000-divine-collection-electrical-bag-200x200-imaeefnyhs2dhspg.jpeg,Health and Beauty>Health Care>Medicines & Treatment,800.0,260.0,260.0,true,HWBEE3MZHMTEMJFK,HWBEE3MZHMTEMJFK
Flipkart,,"Aryan 2 Tone Aqua Blue Yearly Contact Lens By Visions India Yearly Contact Lens(-1.25, Aqua Blue, Pack of 1)","Aryan two tone cosmetic lenses are developed and designed by the best in the business to match with the characteristics of the cornea and are intended to make one’s eyes more beautiful and more natural. Due consideration is given to the colour and size of the pupil and the health of the eye. These lenses are available in six colours – sky blue, hazel, aqua blue, brown, grey and green along with the contact lens solution.",Aryan,http://dl.flipkart.com/dl/aryan-2-tone-aqua-blue-yearly-contact-lens-visions-india/p/itmee6x2nbtham5w?pid=CTLEE6X2XVNJ5GAY&affid=siddarthk,http://img.fkcdn.com/image/contact-lens-new/d/5/n/aryan-1-colored-disposable-1-200x200-imaegcvebhsfqz2q.jpeg,Health and Beauty>Eye Care>Contact Lenses,1125.0,799.0,799.0,true,CTLEE6X2XVNJ5GAY,CTLEE6X2XVNJ5GAY
Flipkart,,"Bausch & Lomb Natural Look Monthly Contact Lens(-5, Violet, Pack of 1)",These Colour Lenses From Bausch And Lomb Are Comfortable To Wear And Will Lend A Stylish Touch To Your Overall Look. Manufacturing Process-Reverse Process Iv (12 Colors Range). Quaterly Disposable Lens,Bausch & Lomb,http://dl.flipkart.com/dl/bausch-lomb-natural-look-monthly-contact-lens/p/itmeef7fz3zy9mbn?pid=CTLEEF7FQ6Z7MMGK&affid=siddarthk,http://img.fkcdn.com/image/contact-lens-new/z/5/e/bausch-lomb-2-natural-look-1-200x200-imaeeybt4ksmkzd6.jpeg,Health and Beauty>Eye Care>Contact Lenses,1190.0,820.0,820.0,true,CTLEEF7FQ6Z7MMGK,CTLEEF7FQ6Z7MMGK
Flipkart,,"Aryan 2 Tone Aqua Blue Yearly Contact Lens By Visions India Yearly Contact Lens(-0.50, Aqua Blue, Pack of 1)","Aryan two tone cosmetic lenses are developed and designed by the best in the business to match with the characteristics of the cornea and are intended to make one’s eyes more beautiful and more natural. Due consideration is given to the colour and size of the pupil and the health of the eye. These lenses are available in six colours – sky blue, hazel, aqua blue, brown, grey and green along with the contact lens solution.",Aryan,http://dl.flipkart.com/dl/aryan-2-tone-aqua-blue-yearly-contact-lens-visions-india/p/itmee6x2kur4qafd?pid=CTLEE6X2XA3ZUEDT&affid=siddarthk,http://img.fkcdn.com/image/contact-lens-new/d/5/n/aryan-1-colored-disposable-1-200x200-imaegcvebhsfqz2q.jpeg,Health and Beauty>Eye Care>Contact Lenses,1150.0,780.0,780.0,true,CTLEE6X2XA3ZUEDT,CTLEE6X2XA3ZUEDT
Flipkart,,"Aryan 2 Tone Aqua Blue Yearly Contact Lens By Visions India Yearly Contact Lens(-1.00, Aqua Blue, Pack of 1)","Aryan two tone cosmetic lenses are developed and designed by the best in the business to match with the characteristics of the cornea and are intended to make one’s eyes more beautiful and more natural. Due consideration is given to the colour and size of the pupil and the health of the eye. These lenses are available in six colours – sky blue, hazel, aqua blue, brown, grey and green along with the contact lens solution.",Aryan,http://dl.flipkart.com/dl/aryan-2-tone-aqua-blue-yearly-contact-lens-visions-india/p/itmee6x2z62jg4nd?pid=CTLEE6XFCZXXWYNA&affid=siddarthk,http://img.fkcdn.com/image/contact-lens-new/d/5/n/aryan-1-colored-disposable-1-200x200-imaegcvebhsfqz2q.jpeg,Health and Beauty>Eye Care>Contact Lenses,1125.0,799.0,799.0,true,CTLEE6XFCZXXWYNA,CTLEE6XFCZXXWYNA
Flipkart,,"Bausch & Lomb LACELLE CLASSIC Monthly Contact Lens(-6.5, Brown, Pack of 2)",These Colour Lenses from Bausch and Lomb are comfortable to wear and will lend a stylish touch to your overall look. These premium grade coloured lenses for women are suitable for those who have an active lifestyle. The monthly disposable lenses can be worn on daily basis. You can wear them for long hours without any irritation. These beautiful lenses are made from hefilcon A.,Bausch & Lomb,http://dl.flipkart.com/dl/bausch-lomb-lacelle-classic-monthly-contact-lens/p/itmee4fj7ppzrxcn?pid=CTLEE4FJQFCFZWMY&affid=siddarthk,http://img.fkcdn.com/image/contact-lens-new/w/p/h/bausch-lomb-2-lacelle-classic-5-200x200-imaeeycafy5dfatp.jpeg,Health and Beauty>Eye Care>Contact Lenses,1000.0,699.0,699.0,true,CTLEE4FJQFCFZWMY,CTLEE4FJQFCFZWMY
Flipkart,,"Bausch & Lomb LACELLE CLASSIC Monthly Contact Lens(-1, Brown, Pack of 2)",These Colour Lenses from Bausch and Lomb are comfortable to wear and will lend a stylish touch to your overall look. These premium grade coloured lenses for women are suitable for those who have an active lifestyle. The monthly disposable lenses can be worn on daily basis. You can wear them for long hours without any irritation. These beautiful lenses are made from hefilcon A.,Bausch & Lomb,http://dl.flipkart.com/dl/bausch-lomb-lacelle-classic-monthly-contact-lens/p/itmee4fkcgyg3ez7?pid=CTLEE4FKZQK9H46M&affid=siddarthk,http://img.fkcdn.com/image/contact-lens-new/w/p/h/bausch-lomb-2-lacelle-classic-5-200x200-imaeeycafy5dfatp.jpeg,Health and Beauty>Eye Care>Contact Lenses,1000.0,699.0,699.0,true,CTLEE4FKZQK9H46M,CTLEE4FKZQK9H46M
Flipkart,,"Bausch & Lomb LACELLE CLASSIC Monthly Contact Lens(-5.5, Brown, Pack of 2)",These Colour Lenses from Bausch and Lomb are comfortable to wear and will lend a stylish touch to your overall look. These premium grade coloured lenses for women are suitable for those who have an active lifestyle. The monthly disposable lenses can be worn on daily basis. You can wear them for long hours without any irritation. These beautiful lenses are made from hefilcon A.,Bausch & Lomb,http://dl.flipkart.com/dl/bausch-lomb-lacelle-classic-monthly-contact-lens/p/itmee4fgvafspwbd?pid=CTLEE4FGHBRHJZBR&affid=siddarthk,http://img.fkcdn.com/image/contact-lens-new/w/p/h/bausch-lomb-2-lacelle-classic-5-200x200-imaeeycafy5dfatp.jpeg,Health and Beauty>Eye Care>Contact Lenses,1000.0,699.0,699.0,true,CTLEE4FGHBRHJZBR,CTLEE4FGHBRHJZBR
Flipkart,,Endorse Anti Pimple Cream(50 g),"Get your Dream Clear & Glowing Skin with Endorse Anti Pimple Cream. Its powerful herbal ingredients control acne & pimples along with fading away spots & blemishes on skin while making it beautiful, supple and healthy in a natural way. It doesn’t contain any Parabens and Paraffin.",Endorse,http://dl.flipkart.com/dl/endorse-anti-pimple-cream/p/itmedr6hzdzswf6a?pid=FCTEDR6HDVRFBGMV&affid=siddarthk,http://img.fkcdn.com/image/face-treatment/g/m/v/endorse-50-anti-pimple-cream-200x200-imaedqcayupf7qz3.jpeg,Health and Beauty>Body and Skin Care>Face Care>Face Treatments,190.0,171.0,171.0,true,FCTEDR6HDVRFBGMV,FCTEDR6HDVRFBGMV
Flipkart,,Littmann Cardiology lll 3131 Acoustic Stethoscope,The 3M™ Littmann® Cardiology III™ Stethoscope combines outstanding acoustic performance with exceptional versatility. Its innovative design offers a patented tunable diaphragm on each side of the chestpiece.,Littmann,http://dl.flipkart.com/dl/littmann-cardiology-lll-3131-acoustic-stethoscope/p/itmeenzmgvpy5fqg?pid=STHEENZMHQUFZRNZ&affid=siddarthk,http://img.fkcdn.com/image/stethoscope/r/n/z/dual-sided-3m-littmann-acoustic-cardiology-lll-3131-200x200-imaeengbatym4dwb.jpeg,Health and Beauty>Health Care>Health Care Devices>Stethoscopes,17500.0,15500.0,15500.0,false,STHEENZMHQUFZRNZ,STHEENZMHQUFZRNZ
Flipkart,,Littmann Cardiology lll 3127 Acoustic Stethoscope(Black),The 3m™ Littmann® Cardiology Iii™ Stethoscope Combines Outstanding Acoustic Performance With Exceptional Versatility. Its Innovative Design Offers A Patented Tunable Diaphragm On Each Side Of The Chestpiece.,Littmann,http://dl.flipkart.com/dl/littmann-cardiology-lll-3127-acoustic-stethoscope/p/itmeezkhrznyu5yz?pid=STHEEZKHKPEY7HVH&affid=siddarthk,http://img.fkcdn.com/image/stethoscope/h/v/h/dual-sided-3m-littmann-acoustic-cardiology-lll-3127-200x200-imaeezghhjkdcvfh.jpeg,Health and Beauty>Health Care>Health Care Devices>Stethoscopes,18590.0,16500.0,16500.0,true,STHEEZKHKPEY7HVH,STHEEZKHKPEY7HVH
Flipkart,,One Personal Care Girly Blue Manicure Set,"Revitalize your beauty routine with the most gorgeous nail grooming collection. This Manicure Set has stainless steel nail care essentials, just pluck from your pocket or purse anytime your nails hit a snag and require a quick fix. The petite, travel friendly set includes Nail Clipper, Nail File, Cuticle scissor, Tweezer & Cuticle Pusher / Nail Cleaner and much more for complete nail care.",One Personal Care,http://dl.flipkart.com/dl/one-personal-care-girly-blue-manicure-set/p/itmedjhqhrwhbg6c?pid=MNKEDJHQF68KGDZW&affid=siddarthk,http://img.fkcdn.com/image/manicure-kit/d/z/w/opc-8-girly-blue-manicure-set-200x200-imaed4rxq5ffqgcf.jpeg,Health and Beauty>Body and Skin Care>Hand Care>Manicure and Kits,395.0,178.0,178.0,false,MNKEDJHQF68KGDZW,MNKEDJHQF68KGDZW
Flipkart,,Vichy Ideal White Meta Whitening Essence 30ml & Cleasner 100ml Combo Offer (Promotion Discount)(30.100 ml),"Vichy brings you this meta whitening essence which will boost your skin’s metabolism and provide you with flawless, radiant and translucent skin.One Essence, Many BenefitsUse this meta whitening complex and correct 7 pigmentation disorders. This essence will diminish dark spots, illuminate your skin tone, reveals skin translucency, reduces yellowness, improves skin evenness, boosts rosy glow and hydrates your skin all day long.Smooth and Glossy SkinThis essence is easy and pleasant to apply and will give your skin a matt and non-sticky finish. Enriched with titanium dioxide and pink pearlescent agent, this essence will provide immediate whitening effect and give it a natural pearl finish.Vichy Ideal White Whitening Foam Cleanser (100 ml)Start your day with a boost of freshness. Use this Vichy Ideal White meta whitening foam face wash and cleanse your face. This foam face wash will ensure that your skin stays hydrated all day long and will give it instant fairness.Soft, Refreshed and Perfect SkinThis foam face wash works wonders on your skin and will give you soft, refreshed and luminous skin. The foam will gently remove impurities or other residues and will illuminate your skin.No More Dry SkinUse this face wash twice a day and enjoy having highly moisturized skin.",Vichy,http://dl.flipkart.com/dl/vichy-ideal-white-meta-whitening-essence-30ml-cleasner-100ml-combo-offer-promotion-discount/p/itmeenuyrmzhx9cb?pid=BSTEENUYH2RQAWPU&affid=siddarthk,http://img.fkcdn.com/image/body-skin-treatment/w/p/u/vichy-30-100-ideal-white-meta-whitening-essence-30ml-cleasner-200x200-imaeenhqpeu99fft.jpeg,Health and Beauty>Body and Skin Care>Body and Skin Treatments,4000.0,3977.0,3977.0,true,BSTEENUYH2RQAWPU,BSTEENUYH2RQAWPU
Flipkart,,BeSure Super Clean & Dry XXL Sanitary Pad(Pack of 1),,BeSure,http://dl.flipkart.com/dl/besure-super-clean-dry-xxl-sanitary-pad/p/itmee3yz37tam2ax?pid=SPPEE3YZYMBMARUB&affid=siddarthk,http://img.fkcdn.com/image/sanitary-pad-pantyliner/r/u/b/bsn-2-1-besure-sanitary-pad-super-clean-dry-xxl-200x200-imaeey3yezkgzh8s.jpeg,Health and Beauty>Women's Hygiene>Sanitary Pads,85.0,60.0,60.0,false,SPPEE3YZYMBMARUB,SPPEE3YZYMBMARUB
Flipkart,,"BalRama PH Meter with Care Box LCD Display Thermometer(Red, Yellow)",,BalRama,http://dl.flipkart.com/dl/balrama-ph-meter-care-box-lcd-display-thermometer/p/itmees7dr88yfryd?pid=DTHEES7DGWDJ8BDF&affid=siddarthk,http://img.fkcdn.com/image/baby-thermometer/j/m/h/ro-service-digital-push-buttons-with-pocket-sized-pen-type-ph-200x200-imaeh8agt6dhshzs.jpeg,Electronics>Health and Personal Care>Health Care>Digital Thermometers,2000.0,799.0,799.0,true,DTHEES7DGWDJ8BDF,DTHEES7DGWDJ8BDF
Flipkart,,NYX Soft Matte,,NYX,http://dl.flipkart.com/dl/nyx-soft-matte/p/itme9hbga7986unq?pid=LCMEE4HMFAM9UJUZ&affid=siddarthk,http://img.fkcdn.com/image/lip-cream/j/u/z/nyx-soft-matte-200x200-imaee3kptbyakxc3.jpeg,Health and Beauty>Body and Skin Care>Lip Care>Lip Creams,1400.0,669.0,669.0,true,LCMEE4HMFAM9UJUZ,LCMEE4HMFAM9UJUZ
Flipkart,,Fashion Bar Neon Nail Polish Combo 08 60 ml(Multicolor),"For smooth and beauty nails, that is brought up by Fashion Bar. Get a total beauty makeover with these nail paints that offer the most intricate blend of ingredients to weave a top of the shelf beauty and promise nothing but quality effects. It is equipped with glittery, shimmery and smooth matte colors that will ensure you stand out no matter where.",Fashion Bar,http://dl.flipkart.com/dl/fashion-bar-neon-nail-polish-combo-08-60-ml/p/itmee7zdd7fq4vyh?pid=NLPEE7ZDWCKYAZYA&affid=siddarthk,http://img.fkcdn.com/image/nail-polish/z/y/a/fashion-bar-60-neon-nail-polish-combo-08-200x200-imaee79uhwdh6hbn.jpeg,Health and Beauty>Makeup>Nails>Nail Polishes,900.0,318.0,354.0,true,NLPEE7ZDWCKYAZYA,NLPEE7ZDWCKYAZYA
Flipkart,,Fashion Bar Nail Polish Neon Combo Pink 20 ml,,Fashion Bar,http://dl.flipkart.com/dl/fashion-bar-nail-polish-neon-combo-pink-20-ml/p/itmee6r8fcadgwza?pid=NLPEE6R82DAAQ9HZ&affid=siddarthk,http://img.fkcdn.com/image/nail-polish/9/h/z/fashion-bar-20-nail-polish-neon-combo-pink-200x200-imaee5ussg3zsvw5.jpeg,Health and Beauty>Makeup>Nails>Nail Polishes,300.0,161.0,161.0,true,NLPEE6R82DAAQ9HZ,NLPEE6R82DAAQ9HZ
Flipkart,,Fashion Bar Silver Cap Nail Polish New 8 47.5 ml(Multicolor),,Fashion Bar,http://dl.flipkart.com/dl/fashion-bar-silver-cap-nail-polish-new-8-47-5-ml/p/itmeejgeh7ddd6fz?pid=NLPEEJGESRUZYKT3&affid=siddarthk,http://img.fkcdn.com/image/nail-polish/k/t/3/fashion-bar-47-5-silver-cap-nail-polish-new-8-200x200-imaeegcnhqec2n8h.jpeg,Health and Beauty>Makeup>Nails>Nail Polishes,500.0,225.0,225.0,true,NLPEEJGESRUZYKT3,NLPEEJGESRUZYKT3
Flipkart,,Fashion Bar Nail Polish Neon Combo Pink Peach 20 ml,,Fashion Bar,http://dl.flipkart.com/dl/fashion-bar-nail-polish-neon-combo-pink-peach-20-ml/p/itmee6r7nwvfxjtw?pid=NLPEE6R7FNYPDAGH&affid=siddarthk,http://img.fkcdn.com/image/nail-polish/a/g/h/fashion-bar-20-nail-polish-neon-combo-pink-peach-200x200-imaee5utq2f8vm9y.jpeg,Health and Beauty>Makeup>Nails>Nail Polishes,300.0,152.0,160.0,true,NLPEE6R7FNYPDAGH,NLPEE6R7FNYPDAGH
Flipkart,,Fashion Bar Silver Cap Nail Polish New 4 47.5 ml,,Fashion Bar,http://dl.flipkart.com/dl/fashion-bar-silver-cap-nail-polish-new-4-47-5-ml/p/itmeejgevgjsnjue?pid=NLPEEJGEYZKZD9FG&affid=siddarthk,http://img.fkcdn.com/image/nail-polish/9/f/g/fashion-bar-47-5-silver-cap-nail-polish-new-4-200x200-imaeegcz4ghqzjyd.jpeg,Health and Beauty>Makeup>Nails>Nail Polishes,500.0,226.0,226.0,true,NLPEEJGEYZKZD9FG,NLPEEJGEYZKZD9FG
Flipkart,,Fashion Bar Silver Cap Nail Polish New 5 47.5 ml,,Fashion Bar,http://dl.flipkart.com/dl/fashion-bar-silver-cap-nail-polish-new-5-47-5-ml/p/itmeejgehcfdah9z?pid=NLPEEJGEH6KMBEGB&affid=siddarthk,http://img.fkcdn.com/image/nail-polish/e/g/b/fashion-bar-47-5-silver-cap-nail-polish-new-5-200x200-imaeegcnktymgttr.jpeg,Health and Beauty>Makeup>Nails>Nail Polishes,500.0,200.0,200.0,true,NLPEEJGEH6KMBEGB,NLPEEJGEH6KMBEGB
Flipkart,,Vaseline Blue Seal Cocoa Butter(250 ml),Vaseline Cocoa butter 250 ml(Imported)Rich Conditioning Jellycocoa butter,Vaseline,http://dl.flipkart.com/dl/vaseline-blue-seal-cocoa-butter/p/itmeejvmc3fhhxra?pid=MSCEEJVMKTDQAQUN&affid=siddarthk,http://img.fkcdn.com/image/moisturizer-cream/q/u/n/vaseline-250-blue-seal-cocoa-butter-200x200-imaeej3xbq6epgq5.jpeg,Health and Beauty>Mens Grooming>Body and Skin Care>Moisturizers and Creams,695.0,650.0,650.0,true,MSCEEJVMKTDQAQUN,MSCEEJVMKTDQAQUN
Flipkart,,Naturence Harbal Laq Anti Tan,"This tan remover cream from the named and famed house of Naturence Harbal is fortified with the benefits of milk and kesar for a clear and glowing skin. It helps to remove light pigmented marks and fade blemishes. It also protects the skin from UV rays. As milk and kesar is known for its fairness properties, this anti tan cream is a perfect solution to get rid of tanning and unwanted blemishes.",Naturence Harbal,http://dl.flipkart.com/dl/naturence-harbal-laq-anti-tan/p/itmee3yyzezgenpg?pid=FRNEE3YY2BCXEPGN&affid=siddarthk,http://img.fkcdn.com/image/fairness/p/g/n/naturence-harbal-40-laq-anti-tan-200x200-imaee5qjr2ctzttz.jpeg,Health and Beauty>Body and Skin Care>Face Care,495.0,395.0,439.0,true,FRNEE3YY2BCXEPGN,FRNEE3YY2BCXEPGN
Flipkart,,MUA MAKEUP ACADEMY PALETTE 13.6 g,,MUA MAKEUP ACADEMY,http://dl.flipkart.com/dl/mua-makeup-academy-palette-13-6-g/p/itmeebefcvghkf53?pid=ESDEEBEFKXYBQFSJ&affid=siddarthk,http://img.fkcdn.com/image/eye-shadow/f/s/j/mua-makeup-academy-13-6-palette-200x200-imaeebagpznnf2ff.jpeg,Health and Beauty>Makeup>Eyes>Eye Shadows,1350.0,1000.0,1000.0,true,ESDEEBEFKXYBQFSJ,ESDEEBEFKXYBQFSJ
Flipkart,,AB ABH Cucumber Facial Gel,,AB,http://dl.flipkart.com/dl/ab-abh-cucumber-facial-gel/p/itmeek4hqpcdykuk?pid=ATAEEK4HR6UZZKM8&affid=siddarthk,http://img.fkcdn.com/image/anti-ageing/k/m/8/ab-500-abh-cucumber-facial-gel-200x200-imaeejh2zrrvkr5n.jpeg,Health and Beauty>Body and Skin Care>Face Care>Anti Ageing,365.0,265.0,265.0,true,ATAEEK4HR6UZZKM8,ATAEEK4HR6UZZKM8
Flipkart,,NYN Compact Powder 5in1 LPC Compact  - 70 g(Natural),"NYN Compact Pressed powder reduce the facial oil glossy Smooth and thin powder make the foundation nature and barely make-up The light colour is suitable for redness, acne and so on The medium colour is perfect for dark shadows in the under-eye area The dark colour provides exceptional camouflage and adheres well to the skin",NYN,http://dl.flipkart.com/dl/nyn-compact-powder-5in1-lpc-70-g/p/itmeenuy2a5hghgj?pid=CMPEENUY87PUAEZT&affid=siddarthk,http://img.fkcdn.com/image/compact/5/f/z/nyn-70-5in1-cnp-200x200-imaeendzkf5mhzza.jpeg,Health and Beauty>Makeup>Face>Compacts,601.0,249.0,249.0,true,CMPEENUY87PUAEZT,CMPEENUY87PUAEZT
Flipkart,,Magideal Crystals Tips Nail Art(Multicolor),"Description 12 Mixed colors glitter nail crystals are storaged in wheel Perfect for decorating you nails, cellphone, handicrafts, clothing, shoes and other DIY Craft Crystal Diameter: approx. 2mm Wheel Diameter: approx. 2.36 inch / 6 cm Material: Acrylic Color: 12 Different colors Package Includes: Approx. 800Pcs Nail Crystals",Magideal,http://dl.flipkart.com/dl/magideal-crystals-tips-nail-art/p/itmeezrvffh3h5n9?pid=NLAEEZRVYTFYJ7HG&affid=siddarthk,http://img.fkcdn.com/image/nail-art/x/n/d/phenovo-multicolor-nail-art-gliter-200x200-imaeezm7e2byywtg.jpeg,Health and Beauty>Makeup>Nails>Nail Arts,1060.0,499.0,499.0,false,NLAEEZRVYTFYJ7HG,NLAEEZRVYTFYJ7HG
Flipkart,,Avenue Hair Brush Collection,"Ideal for daily styling for styles that require body and volume. These brushes are designed to smooth, shape and polish all hair lengths and texture. Ball tips nylon bristle gently massage the scalp and helps in detangling and add root lift. Suitable for all hair lengths.",Avenue,http://dl.flipkart.com/dl/avenue-hair-brush-collection/p/itmeebyvgcjkdgkd?pid=HRBEEBYVFUKMJRXC&affid=siddarthk,http://img.fkcdn.com/image/hair-brush/g/h/u/hair01brush-zeva-zevahairbrush-200x200-imaeb3mred93hssp.jpeg,Baby Care>Grooming>Hair Brushes,999.0,270.0,338.0,true,HRBEEBYVFUKMJRXC,HRBEEBYVFUKMJRXC
Flipkart,,"Aarogya Mandir Mp-2251 Double Head Massage Hammer Massager(Drak Grey, Light Grey)","Two National Patents,No exposed hole,long handle Streamline Design2)Easy to use comfortable technology that imitates the technique of a professional Masseur3)palm area size massage with hot therapy4)addition with two removable massage heads Kneading massager, pushing massager, stroking,vibrating,pressing,tapping all in one massager through this device.excellent quality product and packagingideal product for all homes and your Spa, beauty parlor or salonDont miss chance to impress your customers with this device",Aarogya Mandir,http://dl.flipkart.com/dl/aarogya-mandir-mp-2251-double-head-massage-hammer-massager/p/itmees7e3xpmh994?pid=MASEES7EYKEP9XMA&affid=siddarthk,http://img.fkcdn.com/image/massager/x/m/a/aarogya-mandir-double-head-massage-hammer-mp-2251-200x200-imaee3pte6sbmvgy.jpeg,Electronics>Health and Personal Care>Health Care>Massagers,3500.0,1399.0,1399.0,true,MASEES7EYKEP9XMA,MASEES7EYKEP9XMA
