PartnerName,Id,Title,Description,Brand,Link,ImageLink,CategoryName,Mrp,OfferPrice,EffectivePrice,Availability,PartnerIdFromUrl,PartnerIdFromDb
Flipkart,,Hollister Malaia Eau De Parfum Spray Eau de Parfum  -  60 ml,"A floral fruity fragrance for young women Soft, fresh, sweet, sparkling & enlivening Contains notes of floral petals, exotic fruits & woodsy accords Suitable for spring or summer wear",Hollister,http://dl.flipkart.com/dl/hollister-malaia-eau-de-parfum-spray-60-ml/p/itmeh6fz2gk8afqh?pid=PEREH6FZHYGZYEF3&affid=siddarthk,http://img.fkcdn.com/image/perfume/e/f/3/eau-de-parfum-hollister-60-malaia-eau-de-parfum-spray-200x200-imaekz4ggxumgzz7.jpeg,Health and Beauty>Fragrances>Perfumes>Eaux De Parfum,6290.0,6290.0,6290.0,true,PEREH6FZHYGZYEF3,PEREH6FZHYGZYEF3
Flipkart,,Salvador Dali Little Kiss Me Eau De Toilette Spray Eau de Toilette  -  50 ml,Little Kiss Me Eau De Toilette Spray,Salvador Dali,http://dl.flipkart.com/dl/salvador-dali-little-kiss-me-eau-de-toilette-spray-50-ml/p/itmeh6fzuzamf7xf?pid=PEREH6FZEJAS55XF&affid=siddarthk,http://img.fkcdn.com/image/perfume/5/x/f/eau-de-toilette-salvador-dali-50-little-kiss-me-eau-de-toilette-200x200-imaekz4grhecfd6y.jpeg,Health and Beauty>Fragrances>Perfumes>Eaux De Toilette,4406.0,1020.0,1020.0,true,PEREH6FZEJAS55XF,PEREH6FZEJAS55XF
Flipkart,,Floris Soulle Ambar Eau De Toilette Spray Eau de Toilette  -  100 ml,"An oriental floral fragrance for modern women Fresh, spicy, sweet, creamy, warm & seductive Top notes of bergamot, galbanum, pineapple & lentisque Heart notes of pink peppercorn, geranium, jasmine & melilot Base notes of amber, vanilla & musk Launched in 2013 Perfect for all occasions",Floris,http://dl.flipkart.com/dl/floris-soulle-ambar-eau-de-toilette-spray-100-ml/p/itmeh6fqhrndt9pk?pid=PEREH6FQDXET3QFV&affid=siddarthk,http://img.fkcdn.com/image/perfume/q/f/v/eau-de-toilette-floris-100-soulle-ambar-eau-de-toilette-spray-200x200-imaekz4gkufghm25.jpeg,Health and Beauty>Fragrances>Perfumes>Eaux De Toilette,12393.0,8415.0,8415.0,true,PEREH6FQDXET3QFV,PEREH6FQDXET3QFV
Flipkart,,Brooks Brothers Black Fleece White Cologne Splash Eau de Cologne  -  90 ml,"A citrus woody fragrance for men & women Fresh, clean, sensual & captivating Contains notes of citruses, thyme, lavender, cedar & vetiver Launched in 2010 Perfect for all occasions",Brooks Brothers,http://dl.flipkart.com/dl/brooks-brothers-black-fleece-white-cologne-splash-eau-de-90-ml/p/itmeh6fpgvphsr2p?pid=PEREH6FP9V5MWGXV&affid=siddarthk,http://img.fkcdn.com/image/perfume/g/x/v/eau-de-cologne-brooks-brothers-90-black-fleece-white-cologne-200x200-imaekz4h96mf8vnm.jpeg,Health and Beauty>Fragrances>Perfumes>Eaux De Cologne,7803.0,5015.0,5015.0,true,PEREH6FP9V5MWGXV,PEREH6FP9V5MWGXV
Flipkart,,S-Perfume S-ex Eau De Parfum Spray Eau de Parfum  -  50 ml,"An extraordinary unisex fragrance Touches skin with a passionate & warm sensation Contains notes of oxygen, salt, camellia, willow, white leather & skin musk Blended with notes of strawberry, baroque musk, black leather & malt Instills a wide appeal",S-Perfume,http://dl.flipkart.com/dl/s-perfume-s-ex-eau-de-parfum-spray-50-ml/p/itmeh6fzfzgftkmw?pid=PEREH6FZVWTCFKNZ&affid=siddarthk,http://img.fkcdn.com/image/perfume/k/n/z/eau-de-parfum-s-perfume-50-s-ex-eau-de-parfum-spray-200x200-imaekz4gtgbv3vjq.jpeg,Health and Beauty>Fragrances>Perfumes>Eaux De Parfum,14229.0,10455.0,10455.0,true,PEREH6FZVWTCFKNZ,PEREH6FZVWTCFKNZ
Flipkart,,Bebe Nouveau Eau De Parfum Spray Eau de Parfum  -  100 ml,"A citrus floral fragrance for sexy, sophisticated women Crisp, creamy, vibrant, feminine & vivacious Top notes of grapefruit, quince & citron Heart note of jasmine, black orchid & frangipani Base note of amber, vanilla, woods & musk Launched in 2013 Perfect for all occasions",Bebe,http://dl.flipkart.com/dl/bebe-nouveau-eau-de-parfum-spray-100-ml/p/itmeh6fztfcaxy2h?pid=PEREH6FZQYJHJYNY&affid=siddarthk,http://img.fkcdn.com/image/perfume/y/n/y/eau-de-parfum-bebe-100-nouveau-eau-de-parfum-spray-200x200-imaekz4hsfdyzyug.jpeg,Health and Beauty>Fragrances>Perfumes>Eaux De Parfum,5967.0,4038.0,4038.0,true,PEREH6FZQYJHJYNY,PEREH6FZQYJHJYNY
Flipkart,,Demeter Raspberry Jam Cologne Spray Eau de Cologne  -  120 ml,"A fruity gourmand fragrance for contemporary women Sweet, succulent & mouthwatering Contains notes of raspberry & marmalade Recommended for day or warmer seasons wear",Demeter,http://dl.flipkart.com/dl/demeter-raspberry-jam-cologne-spray-eau-de-120-ml/p/itmeh6fzmgkchqwh?pid=PEREH6FZQA37DGV3&affid=siddarthk,http://img.fkcdn.com/image/perfume/g/v/3/eau-de-cologne-demeter-120-raspberry-jam-cologne-spray-200x200-imaekz4gmmpk4nju.jpeg,Health and Beauty>Fragrances>Perfumes>Eaux De Cologne,3672.0,2125.0,2125.0,false,PEREH6FZQA37DGV3,PEREH6FZQA37DGV3
Flipkart,,Atelier Cologne Silver Iris Cologne Absolue Spray Eau de Cologne  -  100 ml,"An oriental floral fragrance for women & men Sweet, green, powdery, warm & captivating Top notes are tangerine, pink pepper & blackcurrant Middle notes are mimose, violet leaf & iris Base notes are patchouli, white amber & musk Launched in 2013 Perfect for all occasions",Atelier Cologne,http://dl.flipkart.com/dl/atelier-cologne-silver-iris-absolue-spray-eau-de-100-ml/p/itmeh6fzfavbgxgm?pid=PEREH6FPR3TZHGHH&affid=siddarthk,http://img.fkcdn.com/image/perfume/g/h/h/eau-de-cologne-atelier-cologne-100-silver-iris-cologne-absolue-200x200-imaekz4hykgvndhn.jpeg,Health and Beauty>Fragrances>Perfumes>Eaux De Cologne,16065.0,15088.0,15088.0,true,PEREH6FPR3TZHGHH,PEREH6FPR3TZHGHH
Flipkart,,Yves Saint Laurent LHomme Libre Eau De Toilette Spray (Edition Art) Eau de Toilette  -  100 ml,"A woody spicy fragrance for men Light, classic, balanced, refreshing & masculine Top notes of Calabrian bergamot, violet leaves & basil Heart notes of star anise, nutmeg & pink pepper Base notes of patchouli, vetiver & warm leather Perfect for all occasions",Yves Saint Laurent,http://dl.flipkart.com/dl/yves-saint-laurent-lhomme-libre-eau-de-toilette-spray-edition-art-100-ml/p/itmeh6fqxusdpvhu?pid=PEREH6FQCUMEVY43&affid=siddarthk,http://img.fkcdn.com/image/perfume/y/4/3/eau-de-toilette-yves-saint-laurent-100-lhomme-libre-eau-de-200x200-imaekz4gxbyrhtjj.jpeg,Health and Beauty>Fragrances>Perfumes>Eaux De Toilette,7987.0,5950.0,5950.0,true,PEREH6FQCUMEVY43,PEREH6FQCUMEVY43
Flipkart,,Boadicea The Victorious Notting Hill Eau De Parfum Spray Eau de Parfum  -  100 ml,"A luxurious fragrance for urban women with active life Dynamic, passionate, dazzling & mysterious Scent opens with note of pink pepper Continues with heart notes of Turkish Rose & heady cardamom Dries down to note of spicy incense Suitable for all occasions",Boadicea The Victorious,http://dl.flipkart.com/dl/boadicea-victorious-notting-hill-eau-de-parfum-spray-100-ml/p/itmeh6fpqmzxvxgb?pid=PEREH6FPFMWUYYWS&affid=siddarthk,http://img.fkcdn.com/image/perfume/y/w/s/eau-de-parfum-boadicea-the-victorious-100-notting-hill-eau-de-200x200-imaekz4hnbvtgrr8.jpeg,Health and Beauty>Fragrances>Perfumes>Eaux De Parfum,38556.0,24990.0,24990.0,true,PEREH6FPFMWUYYWS,PEREH6FPFMWUYYWS
Flipkart,,Christian Dior JAdore Eau De Parfum Spray Eau de Parfum  -  100 ml,"A floral fragrance for contemporary women Crisp, sweet, feminine, sensual & seductive Top note of ylang ylang from the Comoro Islands Heart note of Damask rose Base note of Sambac jasmine absolute Perfect for all occasions",Christian Dior,http://dl.flipkart.com/dl/christian-dior-jadore-eau-de-parfum-spray-100-ml/p/itmeh6fz862r9arc?pid=PEREH6FZMGPNAH9S&affid=siddarthk,http://img.fkcdn.com/image/perfume/h/9/s/eau-de-parfum-christian-dior-100-jadore-eau-de-parfum-spray-200x200-imaekz4hjtssap5c.jpeg,Health and Beauty>Fragrances>Perfumes>Eaux De Parfum,11383.0,10668.0,10668.0,true,PEREH6FZMGPNAH9S,PEREH6FZMGPNAH9S
Flipkart,,Etro Ambra Eau De Toilette Spray Eau de Toilette  -  100 ml,"A sensual fragrance for gentlemen Elegant, refined & alluring Top note revolves around clary sage Heart notes are vetiver, cedar Base note is dominated by tobacco",Etro,http://dl.flipkart.com/dl/etro-ambra-eau-de-toilette-spray-100-ml/p/itmeh6fzgrgths2e?pid=PEREH6FP6QE73F3Y&affid=siddarthk,http://img.fkcdn.com/image/perfume/f/3/y/eau-de-toilette-etro-100-ambra-eau-de-toilette-spray-200x200-imaekz4gfsfemgng.jpeg,Health and Beauty>Fragrances>Perfumes>Eaux De Toilette,14137.0,9308.0,9308.0,true,PEREH6FP6QE73F3Y,PEREH6FP6QE73F3Y
Flipkart,,Estee Lauder Modern Muse Chic Eau De Parfum Spray Eau de Parfum  -  100 ml(For Women),"A floral woody musk fragrance for modern women Fresh, spicy, creamy, warm & voluptuous Top notes are plum & artemisia Middle notes are jasmine sambac, tuberose & lily Base notes are cashmere wood, agarwood, labdanum, patchouli, ebony tree, musk, Madagascar vanilla & suede Launched in 2014 Recommended for evening or colder seasons wear",Estee Lauder,http://dl.flipkart.com/dl/estee-lauder-modern-muse-chic-eau-de-parfum-spray-100-ml/p/itmeh6fzbpupkqhf?pid=PEREH6FZYBFZHMCP&affid=siddarthk,http://img.fkcdn.com/image/perfume/m/c/p/eau-de-parfum-estee-lauder-100-modern-muse-chic-eau-de-parfum-200x200-imaekz4gy5xwuqzh.jpeg,Health and Beauty>Fragrances>Perfumes>Eaux De Parfum,10000.0,9450.0,9450.0,true,PEREH6FZYBFZHMCP,PEREH6FZYBFZHMCP
Flipkart,,Paul Smith Optimistic Eau De Toilette Spray Eau de Toilette  -  30 ml,"A floral fruity fragrance for modern women Crisp, sweet, juicy, tasty & enlivening Top notes of pink grapefruit, raspberry & litchi Heart notes of pink sweet peas, mandarin orange, cranberry & macaroons Base notes of iris & patchouli Launched in 2011 Suitable for spring or summer wear",Paul Smith,http://dl.flipkart.com/dl/paul-smith-optimistic-eau-de-toilette-spray-30-ml/p/itmeh6fzvsu2tg3b?pid=PEREH6FPQWHETFCH&affid=siddarthk,http://img.fkcdn.com/image/perfume/f/c/h/eau-de-toilette-paul-smith-30-optimistic-eau-de-toilette-spray-200x200-imaekz4gkfbpmh8x.jpeg,Health and Beauty>Fragrances>Perfumes>Eaux De Toilette,4131.0,1573.0,1573.0,true,PEREH6FPQWHETFCH,PEREH6FPQWHETFCH
Flipkart,,Lagerfeld Karl Lagerfeld Eau De Parfum Spray Eau de Parfum  -  85 ml,"A floral fruity fragrance for modern women Fresh, juicy, smooth, elegant, feminine & intoxicating Top notes of lemon & peach Heart notes of magnolia, rose & frangipani Base notes of amber wood & musk Launched in 2014 Suitable for spring or summer wear",Lagerfeld,http://dl.flipkart.com/dl/lagerfeld-karl-eau-de-parfum-spray-85-ml/p/itmeh6fzn32qtvbe?pid=PEREH6FPFZNSGQ2P&affid=siddarthk,http://img.fkcdn.com/image/perfume/q/2/p/eau-de-parfum-lagerfeld-85-karl-lagerfeld-eau-de-parfum-spray-200x200-imaekz4gkuz2gagk.jpeg,Health and Beauty>Fragrances>Perfumes>Eaux De Parfum,7803.0,3358.0,3358.0,false,PEREH6FPFZNSGQ2P,PEREH6FPFZNSGQ2P
Flipkart,,Max Azria BCBGMaxAzria Eau De Parfum Spray Eau de Parfum  -  100 ml,"A floral fruity fragrance for young women Light, sweet, delectable, creamy & tantalizing Top notes of wild strawberry, black cherry & French Kir Royal cocktail Heart notes of jasmine, lily of the valley, rose & violet Base notes of iris root, sandalwood & musk Launched in 2011 Perfect for all occasions",Max Azria,http://dl.flipkart.com/dl/max-azria-bcbgmaxazria-eau-de-parfum-spray-100-ml/p/itmeh6fzkgk5cq4r?pid=PEREH6FPVDVXZ7ZY&affid=siddarthk,http://img.fkcdn.com/image/perfume/7/z/y/eau-de-parfum-max-azria-100-bcbgmaxazria-eau-de-parfum-spray-200x200-imaekz4gvvqk2nrw.jpeg,Health and Beauty>Fragrances>Perfumes>Eaux De Parfum,6885.0,2508.0,2508.0,true,PEREH6FPVDVXZ7ZY,PEREH6FPVDVXZ7ZY
Flipkart,,John Richmond X Eau De Toilette Spray Eau de Toilette  -  40 ml,"An aromatic fougere fragrance for modern men Fresh, spicy, luminous, warm & intriguing Top notes of lemon, bergamot, black pepper & violet leaf Heart notes of lavender, pineapple & cashmere Base notes of patchouli, tonka bean, cedar & cypriol Launched in 2014 Perfect for all occasions",John Richmond,http://dl.flipkart.com/dl/john-richmond-x-eau-de-toilette-spray-40-ml/p/itmeh6fpuuhqsawv?pid=PEREH6FPT3K2JYQZ&affid=siddarthk,http://img.fkcdn.com/image/perfume/y/q/z/eau-de-toilette-john-richmond-40-x-eau-de-toilette-spray-200x200-imaekz4gpccs9uud.jpeg,Health and Beauty>Fragrances>Perfumes>Eaux De Toilette,4131.0,3188.0,3188.0,true,PEREH6FPT3K2JYQZ,PEREH6FPT3K2JYQZ
Flipkart,,Reminiscence Rem Eau De Toilette Spray Eau de Toilette  -  50 ml,"A floral aquatic fragrance for men & women Sweet, fresh, warm, marine & inviting Top notes of rose, lilac, jasmine & sea water Middle note of patchouli & fenugreek Base notes of musk, tonka bean & vanilla Perfect for all occasions",Reminiscence,http://dl.flipkart.com/dl/reminiscence-rem-eau-de-toilette-spray-50-ml/p/itmeh6fpszewbpjn?pid=PEREH6FPQX3ZSJVC&affid=siddarthk,http://img.fkcdn.com/image/perfume/j/v/c/eau-de-toilette-reminiscence-50-rem-eau-de-toilette-spray-200x200-imaekz4gzrdfm49z.jpeg,Health and Beauty>Fragrances>Perfumes>Eaux De Toilette,6426.0,3103.0,3103.0,false,PEREH6FPQX3ZSJVC,PEREH6FPQX3ZSJVC
Flipkart,,Gilles Cantuel Flowers Purple Eau De Toilette Spray Eau de Toilette  -  100 ml,"A floral fruity fragrance for contemporary women Crisp, elegant, feminine & bewitching Contains notes of citruses, violets, lavender, hyacinths, wisteria & woody accords Perfect for all occasions",Gilles Cantuel,http://dl.flipkart.com/dl/gilles-cantuel-flowers-purple-eau-de-toilette-spray-100-ml/p/itmeh6fzz2sbasef?pid=PEREH6FZS5HAPWSV&affid=siddarthk,http://img.fkcdn.com/image/perfume/w/s/v/eau-de-toilette-gilles-cantuel-100-flowers-purple-eau-de-200x200-imaekz4ghcnfzbgm.jpeg,Health and Beauty>Fragrances>Perfumes>Eaux De Toilette,5049.0,3528.0,3528.0,false,PEREH6FZS5HAPWSV,PEREH6FZS5HAPWSV
Flipkart,,Comme des Garcons Floriental Eau de Parfum Spray Eau de Parfum  -  50 ml,"A woody spicy fragrance for women & men Sharp, sweet, resinous, warm & intriguing Contains notes of pink pepper, plum, incense, labdanum, sandalwood & vetiver Launched in 2015 Suitable for fall or winter wear",Comme des Garcons,http://dl.flipkart.com/dl/comme-des-garcons-floriental-eau-de-parfum-spray-50-ml/p/itmeh6fpcqejhv4t?pid=PEREH6FP9XHT5SET&affid=siddarthk,http://img.fkcdn.com/image/perfume/s/e/t/eau-de-parfum-comme-des-garcons-50-floriental-eau-de-parfum-200x200-imaekz4hfx6qmzfa.jpeg,Health and Beauty>Fragrances>Perfumes>Eaux De Parfum,9455.0,7693.0,7693.0,true,PEREH6FP9XHT5SET,PEREH6FP9XHT5SET
Flipkart,,Demeter Steam Room Cologne Spray Eau de Cologne  -  30 ml,"An ozone fragrance for men & women Fresh, warm, tranquil & relaxing Contains a note of eucalyptus Recommended for day or casual wear",Demeter,http://dl.flipkart.com/dl/demeter-steam-room-cologne-spray-eau-de-30-ml/p/itmeh6fpgf2gzmhw?pid=PEREH6FPRKYBCY6U&affid=siddarthk,http://img.fkcdn.com/image/perfume/y/6/u/eau-de-cologne-demeter-30-steam-room-cologne-spray-200x200-imaekz4h5nfggw5a.jpeg,Health and Beauty>Fragrances>Perfumes>Eaux De Cologne,1836.0,1063.0,1063.0,true,PEREH6FPRKYBCY6U,PEREH6FPRKYBCY6U
Flipkart,,Floris Madonna Of The Almonds Eau De Parfum Spray Eau de Parfum  -  100 ml,"A fruity gourmand fragrance for modern women Crisp, spicy, zesty, sweet, savory & inviting Top notes of apricot, bergamot, lemon & bitter almond Heart notes of almond blossom, jasmine & soft spices Base notes of incense, musk & vanilla Launched in 2009 Perfect for all occasions",Floris,http://dl.flipkart.com/dl/floris-madonna-almonds-eau-de-parfum-spray-100-ml/p/itmeh6fzdracrv4r?pid=PEREH6FZYVBAXAGZ&affid=siddarthk,http://img.fkcdn.com/image/perfume/a/g/z/eau-de-parfum-floris-100-madonna-of-the-almonds-eau-de-parfum-200x200-imaekz4gdvzhy8ec.jpeg,Health and Beauty>Fragrances>Perfumes>Eaux De Parfum,14688.0,11645.0,11645.0,true,PEREH6FZYVBAXAGZ,PEREH6FZYVBAXAGZ
Flipkart,,Gabriele Strehle Strenesse Eau De Parfum Spray Eau de Parfum  -  50 ml,"A refreshing, crisp, floral fragrance Romantic, elegant & sensual Unfolds notes of soft flowers, amber, peach & vanilla Perfect for daily wear",Gabriele Strehle,http://dl.flipkart.com/dl/gabriele-strehle-strenesse-eau-de-parfum-spray-50-ml/p/itmeh6fpfzfxtmaq?pid=PEREH6FPPE2GJAHB&affid=siddarthk,http://img.fkcdn.com/image/perfume/a/h/b/eau-de-parfum-gabriele-strehle-50-strenesse-eau-de-parfum-spray-200x200-imaekz4g8tsekyds.jpeg,Health and Beauty>Fragrances>Perfumes>Eaux De Parfum,5508.0,2593.0,2593.0,true,PEREH6FPPE2GJAHB,PEREH6FPPE2GJAHB
Flipkart,,Evody Fleur DOranger Eau De Parfum Spray Eau de Parfum  -  50 ml,"A citrus floral fragrance for modern women Crisp, sweet, smooth, elegant & uplifting Top notes of bergamot & tangerine Heart notes of jasmine, orange blossom & neroli Base notes of musk & woods Launched in 2008 Suitable for spring or summer wear",Evody,http://dl.flipkart.com/dl/evody-fleur-doranger-eau-de-parfum-spray-50-ml/p/itmeh6fzxyx3hbew?pid=PEREH6FZRX7FHY9E&affid=siddarthk,http://img.fkcdn.com/image/perfume/y/9/e/eau-de-parfum-evody-50-fleur-doranger-eau-de-parfum-spray-200x200-imaekz4g7hwvaskv.jpeg,Health and Beauty>Fragrances>Perfumes>Eaux De Parfum,9180.0,7778.0,7778.0,true,PEREH6FZRX7FHY9E,PEREH6FZRX7FHY9E
Flipkart,,Serge Lutens Jeux De Peau Eau De Parfum Spray Eau de Parfum  -  50 ml,"A rich, lingering fragrance for gentlemen Conveys a touch of elegance, masculinity & sensuality Top note is dominated by milky aroma Middle notes contain coconut & licorice Base notes unfold osmanthus & apricot",Serge Lutens,http://dl.flipkart.com/dl/serge-lutens-jeux-de-peau-eau-parfum-spray-50-ml/p/itmeh6fpp5weh3es?pid=PEREH6FPXYEYGV9E&affid=siddarthk,http://img.fkcdn.com/image/perfume/v/9/e/eau-de-parfum-serge-lutens-50-jeux-de-peau-eau-de-parfum-spray-200x200-imaekz4g3vb9wby8.jpeg,Health and Beauty>Fragrances>Perfumes>Eaux De Parfum,11934.0,8203.0,8203.0,true,PEREH6FPXYEYGV9E,PEREH6FPXYEYGV9E
Flipkart,,Serge Lutens L Eau Froide Eau De Parfum Spray Eau de Parfum  -  50 ml,"An oriental woody fragrance for women & men Fresh, clean, exquisite, smooth & invigorating Contains notes of olibanum, sea water, musk, vetiver, mint, incense, pepper & ginger Launched in 2011 Recommended for spring or summer wear",Serge Lutens,http://dl.flipkart.com/dl/serge-lutens-l-eau-froide-de-parfum-spray-50-ml/p/itmeh6fqhq8kzhya?pid=PEREH6FQGCZY6VDF&affid=siddarthk,http://img.fkcdn.com/image/perfume/v/d/f/eau-de-parfum-serge-lutens-50-l-eau-froide-eau-de-parfum-spray-200x200-imaekz4gezugajkw.jpeg,Health and Beauty>Fragrances>Perfumes>Eaux De Parfum,10098.0,6970.0,6970.0,true,PEREH6FQGCZY6VDF,PEREH6FQGCZY6VDF
Flipkart,,L'Artisan Parfumeur Piment Brulant Eau De Toilette Spray Eau de Toilette  -  100 ml,"An oriental spicy fragrance for men & women Fresh, spicy, green, warm, sophisticated & invigorating Contains notes of amber, cinnamon, musk, poppy, vanilla, dark chocolate, cacao, clove & chili pepper Launched in 2002 Perfect for all occasions",L'Artisan Parfumeur,http://dl.flipkart.com/dl/l-artisan-parfumeur-piment-brulant-eau-de-toilette-spray-100-ml/p/itmeh6fpyvsnjtjb?pid=PEREH6FP3Z5GGTFZ&affid=siddarthk,http://img.fkcdn.com/image/perfume/t/f/z/eau-de-toilette-l-artisan-parfumeur-100-piment-brulant-eau-de-200x200-imaekz4gn9ybxx2f.jpeg,Health and Beauty>Fragrances>Perfumes>Eaux De Toilette,13311.0,7820.0,7820.0,true,PEREH6FP3Z5GGTFZ,PEREH6FP3Z5GGTFZ
Flipkart,,Atelier Cologne Vetiver Fatal Cologne Absolue Spray Eau de Cologne  -  30 ml,"A citrus woody fragrance for men & women Fresh, spicy, sweet, earthy & inviting Contains notes of Calabrian bergamot, Sicilian lemon, bitter orange, Tunisian orange blossom, violet leaf, plum, Haitian vetiver, cedar & agarwood (oud) Launched in 2012",Atelier Cologne,http://dl.flipkart.com/dl/atelier-cologne-vetiver-fatal-absolue-spray-eau-de-30-ml/p/itmeh6fnzfsvkshk?pid=PEREH6FZ3GRBXRR8&affid=siddarthk,http://img.fkcdn.com/image/perfume/r/r/8/eau-de-cologne-atelier-cologne-30-vetiver-fatal-cologne-absolue-200x200-imaekz4hwgjef7ym.jpeg,Health and Beauty>Fragrances>Perfumes>Eaux De Cologne,6885.0,6460.0,6460.0,true,PEREH6FZ3GRBXRR8,PEREH6FZ3GRBXRR8
Flipkart,,Mercedes-Benz Sport Eau De Toilette Spray Eau de Toilette  -  75 ml,"A citrus woody fragrance for sporty men Crisp, clean, elegant, dynamic & uplifting Top notes are mandarin orange, bergamot, galbanum & neroli Middle notes are nutmeg, violet & black pepper Base notes are cedar & patchouli Launched in 2014 Recommended for day or warmer seasons wear",Mercedes-Benz,http://dl.flipkart.com/dl/mercedes-benz-sport-eau-de-toilette-spray-75-ml/p/itmeh6fzfeeqvyhg?pid=PEREH6FZVDWSFHDW&affid=siddarthk,http://img.fkcdn.com/image/perfume/h/d/w/eau-de-toilette-mercedes-benz-75-sport-eau-de-toilette-spray-200x200-imaekz4gyhrjpr9n.jpeg,Health and Beauty>Fragrances>Perfumes>Eaux De Toilette,5967.0,5015.0,5015.0,true,PEREH6FZVDWSFHDW,PEREH6FZVDWSFHDW
Flipkart,,Demeter Lavender Martini Cologne Spray Eau de Cologne  -  120 ml,"A floral gourmand fragrance for modern women Fresh, sweet, tasty, feminine & inviting Contains notes of lavender, martini, fresh orange, Cointreau, sweet & sour accord, honey, sugar & vodka Suitable for day time or warmer seasons wear",Demeter,http://dl.flipkart.com/dl/demeter-lavender-martini-cologne-spray-eau-de-120-ml/p/itmeh6fpzgky4sxc?pid=PEREH6FPRFXVH3P2&affid=siddarthk,http://img.fkcdn.com/image/perfume/3/p/2/eau-de-cologne-demeter-120-lavender-martini-cologne-spray-200x200-imaekz4haufm2npy.jpeg,Health and Beauty>Fragrances>Perfumes>Eaux De Cologne,3672.0,2125.0,2125.0,true,PEREH6FPRFXVH3P2,PEREH6FPRFXVH3P2
Flipkart,,By Terry Parti Pris Eau De Parfum Spray Eau de Parfum  -  50 ml,"A chic, luxurious & feminine fragrance Sweet, fresh, elegant & sensual Opens with sparkling mandarin essence The heart unfolds Turkish tuberose softened by ylang ylang & rose essence Dries down to smoked vetiver, sandalwood, vanilla & Tolu balm Launched in 2012",By Terry,http://dl.flipkart.com/dl/terry-parti-pris-eau-de-parfum-spray-50-ml/p/itmeh6fztzgshfhe?pid=PEREH6FZMGTRFYZH&affid=siddarthk,http://img.fkcdn.com/image/perfume/y/z/h/eau-de-parfum-by-terry-50-parti-pris-eau-de-parfum-spray-200x200-imaekz4hbfmaybnf.jpeg,Health and Beauty>Fragrances>Perfumes>Eaux De Parfum,11934.0,9520.0,9520.0,true,PEREH6FZMGTRFYZH,PEREH6FZMGTRFYZH
Flipkart,,Christina Aguilera Red Sin Eau De Parfum Spray Eau de Parfum  -  30 ml,"A floral fruity fragrance for modern women Sweet, exotic, warm, tasty & inviting Top notes of red apple & cinnamon Heart notes of cyclamen Base notes of red ginger, musk & sandalwood Launched in 2012 Suitable for fall or winter wear",Christina Aguilera,http://dl.flipkart.com/dl/christina-aguilera-red-sin-eau-de-parfum-spray-30-ml/p/itmeh6fnjrrpwamh?pid=PEREH6FZPTBFD9FE&affid=siddarthk,http://img.fkcdn.com/image/perfume/9/f/e/eau-de-parfum-christina-aguilera-30-red-sin-eau-de-parfum-spray-200x200-imaekz4hhcc82mqf.jpeg,Health and Beauty>Fragrances>Perfumes>Eaux De Parfum,3397.0,2423.0,2423.0,true,PEREH6FZPTBFD9FE,PEREH6FZPTBFD9FE
Flipkart,,Agent Provocateur Maitresse Eau De Parfum Spray Eau de Parfum  -  30 ml,"A sweet, sexy, addictive essence based on an aldehydes accord Drives men wild with desire & irresistible to a woman's charms Scent starts with ylang ylang, lotus blossom & violet leaves The heart unveils osmanthus, jasmine & rose absolute Closing combines iris, white suede with musk, amber & patchouli",Agent Provocateur,http://dl.flipkart.com/dl/agent-provocateur-maitresse-eau-de-parfum-spray-30-ml/p/itmeh6fne7kycqnq?pid=PEREH6FZWHFGGG9S&affid=siddarthk,http://img.fkcdn.com/image/perfume/g/9/s/eau-de-parfum-agent-provocateur-30-maitresse-eau-de-parfum-spray-200x200-imaekz4hgz3dzfxq.jpeg,Health and Beauty>Fragrances>Perfumes>Eaux De Parfum,5324.0,3145.0,3145.0,true,PEREH6FZWHFGGG9S,PEREH6FZWHFGGG9S
Flipkart,,Demeter Peony Cologne Spray Eau de Cologne  -  120 ml,"A floral fragrance for contemporary women Light, sharp, fresh & enchanting Contains a note of peony Recommended for spring & summer wear",Demeter,http://dl.flipkart.com/dl/demeter-peony-cologne-spray-eau-de-120-ml/p/itmeh6fpf2tpyzax?pid=PEREH6FPWRGJNNG5&affid=siddarthk,http://img.fkcdn.com/image/perfume/n/g/5/eau-de-cologne-demeter-120-peony-cologne-spray-200x200-imaekz4hbrycfyns.jpeg,Health and Beauty>Fragrances>Perfumes>Eaux De Cologne,3672.0,2125.0,2125.0,true,PEREH6FPWRGJNNG5,PEREH6FPWRGJNNG5
Flipkart,,Cafe Cafe Cafe South Beach Eau De Toilette Spray Eau de Toilette  -  90 ml,"A floral fruity fragrance for modern women Indulges senses with sweet, sunny summer pleasure Opens with cocktail of passion fruit, pineapple, orange & grapefruit The heart reveals floral notes of magnolia, peony, violet, raspberry & Tiare flowe Dry down unfolds warm notes of sandalwood, vanilla, myrrh",Cafe Cafe,http://dl.flipkart.com/dl/cafe-south-beach-eau-de-toilette-spray-90-ml/p/itmeh6fzxzbrkkde?pid=PEREH6FZYP2MG8TW&affid=siddarthk,http://img.fkcdn.com/image/perfume/8/t/w/eau-de-toilette-cafe-cafe-90-cafe-south-beach-eau-de-toilette-200x200-imaekz4hscbcrhne.jpeg,Health and Beauty>Fragrances>Perfumes>Eaux De Toilette,3213.0,1318.0,1318.0,true,PEREH6FZYP2MG8TW,PEREH6FZYP2MG8TW
Flipkart,,Hilfiger Eau De Prep Tommy Girl Eau De Toilette Spray Eau de Toilette  -  50 ml,"A floral fruity fragrance for contemporary women Sweet, fresh, smooth, sporty yet elegant Top notes of pink peppercorn, green apple & pear Heart notes of white roses, violet & hawthorn Base notes of sandalwood, patchouli & musk Launched in 2011 Perfect for all occasions",Hilfiger,http://dl.flipkart.com/dl/hilfiger-eau-de-prep-tommy-girl-toilette-spray-50-ml/p/itmeh6fzmjyscmkx?pid=PEREH6FZZEFHFZFZ&affid=siddarthk,http://img.fkcdn.com/image/perfume/z/f/z/eau-de-toilette-hilfiger-50-eau-de-prep-tommy-girl-eau-de-200x200-imaekz4ggpdrngb4.jpeg,Health and Beauty>Fragrances>Perfumes>Eaux De Toilette,5508.0,2720.0,2720.0,true,PEREH6FZZEFHFZFZ,PEREH6FZZEFHFZFZ
