PartnerName,Id,Title,Description,Brand,Link,ImageLink,CategoryName,Mrp,OfferPrice,EffectivePrice,Availability,PartnerIdFromUrl,PartnerIdFromDb
Flipkart,,T.S. Pink Garnet SoapRocks - Soap that looks like a Rock ~ Gem Rocks Birthstone Jabn Gemstone(180 ml),"Garnet Scent: (Almandine) Crimson Cranberry (6 .) SoapRocks® are an affordable� and unique gift that anyone will enjoy! SoapRocks are handcrafted bars.� They resemble quartz and other� stones such as, Opals, Amethyst, Turquoise, and Citrine, Tigers Eye, Jade, Emerald,� Marble and many other precious gems. SoapRocks are very mild and extra long lasting. As they gently cleanse, soap will slowly weather away like a stream stone in geologic time, exposing the beauty locked away within. Since nature cleanses best the manufacturer of SoapRocks uses unique blends of whole herb extracts, vitamins and minerals, from aquatic and botanical sources. All ingredients come together in the biodegradable bases of SoapRocks. Ingredients may include, aloe, calendula, chamomile, comfrey, lavender, vitamin E, vegetable glycerin, chlorophyll, almond oil, jojoba oil, olive oil, essential oils, mineral earth, kaolin clay, and glycerin dewTM. Each soap is unique because they are handmade, they will vary in size, shape and color.� � Each piece of soap is individually wrapped with a tag.� Made in the USA! A unique birthday gift! Instead of getting someone an actual birthstone, get them their birthstone in a SoapRock!",T.S. Pink,http://dl.flipkart.com/dl/t-s-pink-garnet-soaprocks-soap-looks-like-rock-gem-rocks-birthstone-jabn-gemstone/p/itmeezsvayj7ptkt?pid=SOPEEZSVE6SKBAT5&affid=siddarthk,http://img.fkcdn.com/image/soap/a/t/5/t-s-pink-190-garnet-soaprocks-soap-that-looks-like-a-rock-gem-200x200-imaeezuvvqtwfp6q.jpeg,Health and Beauty>Bath and Spa>Soaps,3398.0,2879.0,3199.0,true,SOPEEZSVE6SKBAT5,SOPEEZSVE6SKBAT5
Flipkart,,Milliard All Natural Maca Soap Bar(120 ml),"Peru has harbored a 3000 year-old secret to wellness in the tops of its Andes Mountains, and that secret is Peruvian Ginseng - also known as Maca Root. The benefits of Maca Root are still being explored, but many clinical researchers have linked Maca to enhancement of mood and stamina, as well as athletic and mental performance and most of all: romantic desire. MILLIARD All-Natural Maca Soap uses genuine Maca Root extract to utilize the benefits of this amazing plant and its natural butterscotch and cinnamon aroma. The result is an organic topical cleanser that can relieve stress, leave your skin smooth, and your body irresistible. All MILLIARD products are made from materials of the highest quality and we are glad to make our consumers' satisfaction our #1 goal.",Milliard,http://dl.flipkart.com/dl/milliard-all-natural-maca-soap-bar/p/itmeezswt2demcfh?pid=SOPEEZSWB5GGKENK&affid=siddarthk,http://img.fkcdn.com/image/soap/e/n/k/milliard-210-all-natural-maca-soap-bar-200x200-imaeezuzazjyhaxq.jpeg,Health and Beauty>Bath and Spa>Soaps,2369.0,974.0,1083.0,true,SOPEEZSWB5GGKENK,SOPEEZSWB5GGKENK
Flipkart,,Fresh Sugar Soap With Brown Sugar & Shea Butter - Lychee(210 ml),"SUGAR LYCHEE SOAP is a vegetable-based soap enriched with nourishing brown sugar and moisturizing shea butter. It is infused with a sparkling scent of juicy lychee, bright grapefruit, and transparent lotus flower.",Fresh,http://dl.flipkart.com/dl/fresh-sugar-soap-brown-shea-butter-lychee/p/itmeezsv4sqhhnkt?pid=SOPEEZSVAGXQGYWF&affid=siddarthk,http://img.fkcdn.com/image/soap/y/w/f/fresh-10-sugar-soap-with-brown-sugar-shea-butter-lychee-200x200-imaeezuvnzzs558r.jpeg,Health and Beauty>Bath and Spa>Soaps,2917.0,2625.0,2917.0,true,SOPEEZSVAGXQGYWF,SOPEEZSVAGXQGYWF
Flipkart,,Poggesi Vegetable Soap Lot of 12 Each Bath Bars Total of 24(56 g),Poggesi Vegetable soap,Poggesi,http://dl.flipkart.com/dl/poggesi-vegetable-soap-lot-12-each-bath-bars-total-24/p/itmeezswnkfddgma?pid=SOPEEZSWPKZ6H5RT&affid=siddarthk,http://img.fkcdn.com/image/soap/5/r/t/poggesi-50-vegetable-soap-lot-of-12-each-bath-bars-total-of-24-200x200-imaeezuxvpp6gsyz.jpeg,Health and Beauty>Bath and Spa>Soaps,4731.0,4257.0,4731.0,true,SOPEEZSWPKZ6H5RT,SOPEEZSWPKZ6H5RT
Flipkart,,C.O. Bigelow Mentha Body Exfoliating Bar Soap(198 g),Buy C.O. Bigelow Bath Soaps - C.O. Bigelow Mentha Body Exfoliating Bar Soap 7.0,C.O. Bigelow,http://dl.flipkart.com/dl/c-o-bigelow-mentha-body-exfoliating-bar-soap/p/itmeezswpf9udhhx?pid=SOPEEZSWPE6SWPNU&affid=siddarthk,http://img.fkcdn.com/image/soap/p/n/u/c-o-bigelow-250-mentha-body-exfoliating-bar-soap-200x200-imaeezuxp67ynvdx.jpeg,Health and Beauty>Bath and Spa>Soaps,2764.0,2487.0,2764.0,true,SOPEEZSWPE6SWPNU,SOPEEZSWPE6SWPNU
Flipkart,,Bee & Flower Soap 12 Bars(60 g),"Bee & Flower Soap - Sandalwood is a gentle soap from Shanghai, China that is hand-milled for long soap life. It contains no artificial fragrances and is highly effective in preserving moisture and making you feel smooth and comfortable after use. WIth delightful and lasting fragrance.",Bee & Flower,http://dl.flipkart.com/dl/bee-flower-soap-12-bars/p/itmeezsvr9azqhfe?pid=SOPEEZSVMFMFXCBR&affid=siddarthk,http://img.fkcdn.com/image/soap/j/k/s/bee-flower-70-sandal-wood-soap-12-bars-200x200-imaeezuw66fytchz.jpeg,Health and Beauty>Bath and Spa>Soaps,3522.0,3169.0,3522.0,true,SOPEEZSVMFMFXCBR,SOPEEZSVMFMFXCBR
Flipkart,,Dettol Anti-Bacterial Hand and Body Bar Soap Active (Pack of 12)(110 g),"Dettol is the trade name for a line of hygiene products manufactured by Reckitt Benckiser. It has been in use since before the 1950s. Washing away germs and impurities everyday is crucial in maintaining good health and hygiene; taking a good bath with an effective soap is thus very important. Dettol as a brand has been synonymous with superior hygiene and protection; this Dettol Skincare Soap gives you protection from bacteria and germs quite efficiently. More reasons for you to like this soap are that this soap not only keeps you germ free but also gives you the benefits of a beauty bathing bar; the soap is also very gentle on the skin. If you like fragrance and a luxe feel in your bathing soap but you also want to ensure that the bath does away with all the impurities and germs, then this Dettol Active Soap suits your needs perfectly. You are sure to enjoy a great bathing experience that ensures maximum hygiene, freshness and soft skin, As this soap is gentle on your skin, you do not have to worry about dryness and roughness. The benefits of this Dettol Skincare soap can be enjoyed by your entire family, both men and women. It is certainly worth bringing home this pack Dettol active soaps as you get to ensure that your family enjoys good health and freshness.",Dettol,http://dl.flipkart.com/dl/dettol-anti-bacterial-hand-body-bar-soap-active-pack-12/p/itmeezswqcgcuakh?pid=SOPEEZSW5G5GHRYS&affid=siddarthk,http://img.fkcdn.com/image/soap/r/y/s/dettol-90-anti-bacterial-hand-and-body-bar-soap-active-pack-of-200x200-imaeezuy7yqcmr5h.jpeg,Health and Beauty>Bath and Spa>Soaps,4165.0,2883.0,3204.0,true,SOPEEZSW5G5GHRYS,SOPEEZSW5G5GHRYS
Flipkart,,Welcome to the Islands Island Bath & Body Coconut Vanilla French Milled Soap(156 ml),"Milled five times to create a smooth and creamy lather, our Island Bath & Body Coconut Vanilla French-Milled Soap is an exotic sensation of silk on your skin, bursting with the essence of the Hawaii. This fragrant soap is wrapped in elegant Hawaiian designed paper making it a beautiful gift. 150 grams.",Welcome to the Islands,http://dl.flipkart.com/dl/welcome-islands-island-bath-body-coconut-vanilla-french-milled-soap/p/itmeezsvxgym2tqt?pid=SOPEEZSVJ4CYTHCR&affid=siddarthk,http://img.fkcdn.com/image/soap/h/c/r/welcome-to-the-islands-140-island-bath-body-coconut-vanilla-200x200-imaeezuwhxtskjzp.jpeg,Health and Beauty>Bath and Spa>Soaps,2094.0,1884.0,2094.0,true,SOPEEZSVJ4CYTHCR,SOPEEZSVJ4CYTHCR
Flipkart,,Claus Porto Cerina Brise Marine Bath Soap(370 g),Fresh Ocean Scent Made from Natural Shea Butter 100% Natural 12.3 Bar,Claus Porto,http://dl.flipkart.com/dl/claus-porto-cerina-brise-marine-bath-soap/p/itmeezsvpfvdw452?pid=SOPEEZSVMNVHG3DG&affid=siddarthk,http://img.fkcdn.com/image/soap/3/d/g/claus-porto-370-cerina-brise-marine-bath-soap-200x200-imaeezuwmfsgwaag.jpeg,Health and Beauty>Bath and Spa>Soaps,4185.0,3766.0,4185.0,true,SOPEEZSVMNVHG3DG,SOPEEZSVMNVHG3DG
Flipkart,,Dana English Leather Soap On A Rope for Men(170 g),A hard milled soap with the traditional scent of English Leather. Full-length rope fits conveniently around faucet or showerhead. Eliminate messy soap trays. Soap dries faster and lasts longer.,Dana,http://dl.flipkart.com/dl/dana-english-leather-soap-rope-men/p/itmeezsvpff9dugk?pid=SOPEEZSVRDUC7DSP&affid=siddarthk,http://img.fkcdn.com/image/soap/d/s/p/dana-210-english-leather-soap-on-a-rope-for-men-200x200-imaeezuxaqsmxzzb.jpeg,Health and Beauty>Bath and Spa>Soaps,2886.0,2597.0,2886.0,true,SOPEEZSVRDUC7DSP,SOPEEZSVRDUC7DSP
Flipkart,,Plantlife Apricot Oatmeal Skin Bar(200 g),"The Apricot Oatmeal Skin Bar combines finely ground oatmeal to exfoliate and sooth problem skin with Apricot Kernal oil that is rich in essential vitamins, fatty acids and natural antioxidants to improve overall complexion, restore a normal pH balance, and promote cell regeneration. For an added boost, we've infused this Skin Bar with carrot oil (which is full of antioxidants and vitamins) to aid in removing toxins, sooth dry and problem skin, protect against free radicals, and help skin look refreshed! A light aroma and a creamy lather make this a powerful soap for any skin!",Plantlife,http://dl.flipkart.com/dl/plantlife-apricot-oatmeal-skin-bar/p/itmeezswsgqav6zr?pid=SOPEEZSWPMYAHCGT&affid=siddarthk,http://img.fkcdn.com/image/soap/c/g/t/plantlife-200-apricot-oatmeal-skin-bar-200x200-imaeezux2cazpzyc.jpeg,Health and Beauty>Bath and Spa>Soaps,2360.0,2124.0,2360.0,true,SOPEEZSWPMYAHCGT,SOPEEZSWPMYAHCGT
Flipkart,,Veda Essence Coffee Coco Butter Ylang Ylang Soap(300 g),"Experience a luxurious bathing experience that is chemical free and loaded with essential and skin nourishing oils blended with our unique combinations of Oils, Butters and Herbs.Blemish Free Even Skin Tone with regular usage. Ylang Ylang soothes sensitive skin, coffee beans gently exfoliate preserving the natural skin balance , Cocoa butter keeps the skin soft preventing signs of ageing.Net Weight : 125 gm. Why Use Me? 100% Chemical Free, No Artifical Colorants, No Sodium Laureth Sulfate , No Parabens, PH Balanced.",Veda Essence,http://dl.flipkart.com/dl/veda-essence-coffee-coco-butter-ylang-soap/p/itmezfzz84ughgxz?pid=SOPEZFZZTPMJRG99&affid=siddarthk,http://img.fkcdn.com/image/soap/g/9/9/veda-essence-300-coffee-coco-butter-ylang-ylang-soap-200x200-imaezgzajpdmuxvt.jpeg,Health and Beauty>Bath and Spa>Soaps,210.0,180.0,180.0,true,SOPEZFZZTPMJRG99,SOPEZFZZTPMJRG99
Flipkart,,Veda Essence Almond Rose Jojoba(300 g),"Experience a luxurious bathing experience that is chemical free and loaded with essential and skin nourishing oils blended with our unique combinations of Oils, Butters and Herbs. Soft and Youthful Skin with regular usage. Rose Essential Oil heals dry,flaky and ageing skin , Vit E in Almond Oil is natural moisturizer for smooth skin, Jojoba and Olive Oil gently cleanse the skin with gentle exfoliation by crushed Rose petals.Net Weight : 125 gm. Why Use Me? 100% Chemical Free, No Artifical Colorants, No Sodium Laureth Sulfate , No Parabens, PH Balanced.",Veda Essence,http://dl.flipkart.com/dl/veda-essence-almond-rose-jojoba/p/itmezfzzyux8py8b?pid=SOPEZFZZCGYXAQ6F&affid=siddarthk,http://img.fkcdn.com/image/soap/q/6/f/veda-essence-300-almond-rose-jojoba-200x200-imaezgzamfxdh6fx.jpeg,Health and Beauty>Bath and Spa>Soaps,210.0,180.0,180.0,true,SOPEZFZZCGYXAQ6F,SOPEZFZZCGYXAQ6F
Flipkart,,Khadi Herbal Watermelon With Patchouli & Calandula Handmade Soap (100gm x 3)(300 ml),,Khadi Herbal,http://dl.flipkart.com/dl/khadi-herbal-watermelon-patchouli-calandula-handmade-soap-100gm-x-3/p/itmezg9c7grv5zvz?pid=SOPEZG9CHGHMQNQA&affid=siddarthk,http://img.fkcdn.com/image/soap/n/q/a/khadi-herbal-300-watermelon-with-patchouli-calandula-handmade-original-imaezeh4df4x5kh5.jpeg,Health and Beauty>Bath and Spa>Soaps,240.0,228.0,228.0,true,SOPEZG9CHGHMQNQA,SOPEZG9CHGHMQNQA
Flipkart,,Olivella Soap Bar Fragrance Free (Case of 6)(100 g),Olivella Soap Bar 3.52 . Fragrance Free (Case of 6),Olivella,http://dl.flipkart.com/dl/olivella-soap-bar-fragrance-free-case-6/p/itmeezsvtga8bbyc?pid=SOPEEZSVBNKFZGQB&affid=siddarthk,http://img.fkcdn.com/image/soap/g/q/b/olivella-40-soap-bar-fragrance-free-case-of-6-200x200-imaeezuvhwcrcxek.jpeg,Health and Beauty>Bath and Spa>Soaps,3873.0,3477.0,3864.0,true,SOPEEZSVBNKFZGQB,SOPEEZSVBNKFZGQB
Flipkart,,Soapwalla - Activated Soap Bar(140 g),,Soapwalla,http://dl.flipkart.com/dl/soapwalla-activated-soap-bar/p/itmeezswnastbpgz?pid=SOPEEZSWFGHS4SGY&affid=siddarthk,http://img.fkcdn.com/image/soap/s/g/y/soapwalla-140-activated-soap-bar-200x200-imaeezuvzyya6at8.jpeg,Health and Beauty>Bath and Spa>Soaps,3692.0,3322.0,3692.0,true,SOPEEZSWFGHS4SGY,SOPEEZSWFGHS4SGY
Flipkart,,The Beer Soap Company Aquadementia Beer Soap Made with Blue Moon Belgian White Ale(120 g),"Notes of Patchouli, litsea cubeba, orange, tart lime, pink grapefruit, neroli, rose, and white musk. Our special blend is perfect for both men and women.",The Beer Soap Company,http://dl.flipkart.com/dl/beer-soap-company-aquadementia-made-blue-moon-belgian-white-ale/p/itmeezsvvzh9j8x7?pid=SOPEEZSVG4YCJEYK&affid=siddarthk,http://img.fkcdn.com/image/soap/e/y/k/the-beer-soap-company-120-aquadementia-beer-soap-made-with-blue-200x200-imaeezuwna5auxbv.jpeg,Health and Beauty>Bath and Spa>Soaps,2752.0,2476.0,2752.0,true,SOPEEZSVG4YCJEYK,SOPEEZSVG4YCJEYK
Flipkart,,Wright's Coal Tar Soap 8 Pack(125 g),Wrights Coal Tar Soap 125g 8 Pack,Wright's,http://dl.flipkart.com/dl/wright-s-coal-tar-soap-8-pack/p/itmeezswwbpvna4z?pid=SOPEEZSWPNFDUFFD&affid=siddarthk,http://img.fkcdn.com/image/soap/f/f/d/wright-s-70-coal-tar-soap-8-pack-200x200-imaeezux3yfndgwf.jpeg,Health and Beauty>Bath and Spa>Soaps,6286.0,5518.0,6132.0,true,SOPEEZSWPNFDUFFD,SOPEEZSWPNFDUFFD
Flipkart,,Tierra Mia Organics Almond Coffee Exfoliating Body Bar Soap(114 ml),"This bar is our exfoliating ""BODY BAR"". We add ARABICA coffee finely ground to make this bar a great body scrub bar. Why Arabica? Because Arabica coffee bean is the richest, the most aromatic coffee bean and the most potent in its benefits to the skin. Coffee will stimulate circulation and help fight off cellulite. Men and women LOVE this bar. Enjoy.",Tierra Mia Organics,http://dl.flipkart.com/dl/tierra-mia-organics-almond-coffee-exfoliating-body-bar-soap/p/itmeezsvsxfxbpu6?pid=SOPEEZSVMZCPZ8JJ&affid=siddarthk,http://img.fkcdn.com/image/soap/8/j/j/tierra-mia-organics-120-almond-coffee-exfoliating-body-bar-soap-200x200-imaeezuwh4auy2gy.jpeg,Health and Beauty>Bath and Spa>Soaps,1675.0,1476.0,1641.0,true,SOPEEZSVMZCPZ8JJ,SOPEEZSVMZCPZ8JJ
Flipkart,,Veda Essence Wheat Germ Orange vit E Soap(300 g),"Experience a luxurious bathing experience that is chemical free and loaded with essential and skin nourishing oils blended with our unique combinations of Oils, Butters and Herbs.Benefits: Softer Smoother Skin with regular usage. Orange Essential Oil nourishes dry, irritated skin, lightens and brightens skin , Vit E slows down ageing, lightens dark spots, Wheatgerm oil acts as anti-oxidant , hydrates and rejuvenates skinNet Weight : 125 gm. Why Use Me? 100% Chemical Free, No Artifical Colorants, No Sodium Laureth Sulfate , No Parabens, PH Balanced.",Veda Essence,http://dl.flipkart.com/dl/veda-essence-wheat-germ-orange-vit-e-soap/p/itmezfzzx6gq7pcv?pid=SOPEZFZZ8TJTGW58&affid=siddarthk,http://img.fkcdn.com/image/soap/w/5/8/veda-essence-300-wheat-germ-orange-vit-e-soap-200x200-imaezb8fx4zg47xp.jpeg,Health and Beauty>Bath and Spa>Soaps,210.0,180.0,180.0,true,SOPEZFZZ8TJTGW58,SOPEZFZZ8TJTGW58
Flipkart,,Liril 2000 With Tea Tree oil(375 g),,Liril 2000,http://dl.flipkart.com/dl/liril-2000-tea-tree-oil/p/itmezfxrydyfjnky?pid=SOPEZFXRTZBYXH44&affid=siddarthk,http://img.fkcdn.com/image/soap/h/4/4/liril-2000-375-with-tea-tree-oil-200x200-imaezdf3smexfyfc.jpeg,Health and Beauty>Bath and Spa>Soaps,150.0,150.0,150.0,true,SOPEZFXRTZBYXH44,SOPEZFXRTZBYXH44
Flipkart,,"Manforce Chocolate, BlackGrape, BlackGrape Condom(Set of 3, 30S)","Chocolate Condom Pack of 10's, BlackGrape Condom Pack of 10's, BlackGrape Condom Pack of 10's",Manforce,http://dl.flipkart.com/dl/manforce-chocolate-blackgrape-blackgrape-condom/p/itme9ptdazgeswdk?pid=CDME9PTDGCMBFXUS&affid=siddarthk,http://img.fkcdn.com/image/condom/x/u/s/3-30-manforce-chocolate-blackgrape-blackgrape-200x200-imae9ryeb2hx5t9g.jpeg,Health and Beauty>Sexual Wellness>Condoms>For Him,240.0,199.0,199.0,true,CDME9PTDGCMBFXUS,CDME9PTDGCMBFXUS
Flipkart,,"Manforce Strawberry Condom(Set of 2, 40S)",Manforce  Flavoured Condoms are made of best quality latex rubber and give natural feel. It is flavored to flare imagination of you & your partner to make it more enjoyable & safe.,Manforce,http://dl.flipkart.com/dl/manforce-strawberry-condom/p/itmemwsmqpmzmhnm?pid=CDMEMWSMHXGYKYC6&affid=siddarthk,http://img.fkcdn.com/image/condom/y/c/6/2-40-manforce-strawberry-200x200-imaen85a6znhnswj.jpeg,Health and Beauty>Sexual Wellness>Condoms>For Him,300.0,275.0,275.0,true,CDMEMWSMHXGYKYC6,CDMEMWSMHXGYKYC6
Flipkart,,"Manforce Chocolate, Jamin, Chocolate Condom(Set of 3, 30S)","Chocolate Condom Pack of 10's, Jamin Condom Pack of 10's, Chocolate Condom Pack of 10's",Manforce,http://dl.flipkart.com/dl/manforce-chocolate-jamin-chocolate-condom/p/itme9ptesfbcfqez?pid=CDME9PTEQCAPCQGD&affid=siddarthk,http://img.fkcdn.com/image/condom/q/g/d/3-30-manforce-chocolate-jamin-chocolate-200x200-imae9t8szphkugx7.jpeg,Health and Beauty>Sexual Wellness>Condoms>For Him,240.0,190.0,190.0,true,CDME9PTEQCAPCQGD,CDME9PTEQCAPCQGD
Flipkart,,"Moods All night 48pc (12X4) Condom(Set of 4, 48S)",Moods All night condom 48pc,Moods,http://dl.flipkart.com/dl/moods-all-night-48pc-12x4-condom/p/itmehkk5zrtcfbga?pid=CDMEHKK5QEE8UXBA&affid=siddarthk,http://img.fkcdn.com/image/condom/x/b/a/4-48-moods-all-night-48pc-12x4-800x800-imaehhwufajvhez9.jpeg,Health and Beauty>Sexual Wellness>Condoms>For Him,400.0,260.0,260.0,true,CDMEHKK5QEE8UXBA,CDMEHKK5QEE8UXBA
Flipkart,,"Kamasutra Intensity, Ribbed, Longlast - UPFK200393 Condom(Set of 9, 108S)","3 x Intensity Condoms, Pack of 12's, 3 x Ribbed Condoms, Pack of 12's, 3 x Longlast Condoms, Pack of 12's",Kamasutra,http://dl.flipkart.com/dl/kamasutra-intensity-ribbed-longlast-upfk200393-condom/p/itmead32g2hhhxje?pid=CDMEAD32GH32QAGS&affid=siddarthk,http://img.fkcdn.com/image/condom/h/q/8/9-108-kamasutra-intensity-longlast-ribbed-upfk200383-200x200-imaeaacytyb3j34w.jpeg,Health and Beauty>Sexual Wellness>Condoms>For Him,960.0,950.0,950.0,true,CDMEAD32GH32QAGS,CDMEAD32GH32QAGS
Flipkart,,"Moods Primium Combo 48 Pcs- Melange, Absolute, Blaze, 1500 Dots, 100% Privacy Condom(Set of 4, 48S)","We ship the product in Concealed shipping, 100% Privacy",Moods,http://dl.flipkart.com/dl/moods-primium-combo-48-pcs-melange-absolute-blaze-1500-dots-100-privacy-condom/p/itmegzc4gxg3xkj8?pid=CDMEGZC4XBRFGGGQ&affid=siddarthk,http://img.fkcdn.com/image/condom/g/g/q/4-48-moods-primium-combo-48-pcs-melange-absolute-blaze-1500-dots-200x200-imaegzf7zsgf52z3.jpeg,Health and Beauty>Sexual Wellness>Condoms>For Him,420.0,270.0,270.0,true,CDMEGZC4XBRFGGGQ,CDMEGZC4XBRFGGGQ
Flipkart,,"Manforce Butterscotch, BlackGrape , BlackGrape Condom(Set of 3, 30S)","Butterscotch Condom Pack of 10's, BlackGrape Condom Pack of 10's, BlackGrape Condom Pack of 10's",Manforce,http://dl.flipkart.com/dl/manforce-butterscotch-blackgrape-condom/p/itme9ptd4gkgx9mv?pid=CDME9PTDWQWCYTD7&affid=siddarthk,http://img.fkcdn.com/image/condom/t/d/7/3-30-manforce-butterscotch-blackgrape-blackgrape-200x200-imae9t8ngftnfjkc.jpeg,Health and Beauty>Sexual Wellness>Condoms>For Him,240.0,190.0,190.0,true,CDME9PTDWQWCYTD7,CDME9PTDWQWCYTD7
Flipkart,,"Moods Ribbed, dotted, ultrathin,allnight mix 96pc Condom(Set of 8, 96S)","Moods ribbed, dotted , strawberry , and ultrathin mix condoms 96pc",Moods,http://dl.flipkart.com/dl/moods-ribbed-dotted-ultrathin-allnight-mix-96pc-condom/p/itmehkk5vesya3ad?pid=CDMEHKK5JTH8M957&affid=siddarthk,http://img.fkcdn.com/image/condom/9/5/7/8-96-moods-ribbed-dotted-ultrathin-allnight-mix-96pc-200x200-imaehhxdd2czajgf.jpeg,Health and Beauty>Sexual Wellness>Condoms>For Him,800.0,498.0,498.0,true,CDMEHKK5JTH8M957,CDMEHKK5JTH8M957
Flipkart,,"Manforce Butterscotch, BlackGrape, BlackGrape Condom(Set of 3, 30S)","Butterscotch Condom Pack of 10's, BlackGrape Condom Pack of 10's, BlackGrape Condom Pack of 10's",Manforce,http://dl.flipkart.com/dl/manforce-butterscotch-blackgrape-blackgrape-condom/p/itme9ptd4jphqpat?pid=CDME9PTDWM4NABZC&affid=siddarthk,http://img.fkcdn.com/image/condom/b/z/c/3-30-manforce-butterscotch-blackgrape-blackgrape-200x200-imae9s5z4zrxzbka.jpeg,Health and Beauty>Sexual Wellness>Condoms>For Him,240.0,201.0,224.0,true,CDME9PTDWM4NABZC,CDME9PTDWM4NABZC
Flipkart,,"Moods 1500 Dotts Condom(Set of 5, 60S)",Create the magical friction to tantalize your senses. Get it on the dot with Moods 1500 dots condoms.,Moods,http://dl.flipkart.com/dl/moods-1500-dotts-condom/p/itmefe7qxhbf89mm?pid=CDMEFE7QXHWGWBHH&affid=siddarthk,http://img.fkcdn.com/image/condom/b/h/h/5-60-moods-1500-dotts-200x200-imaef8m37zzaqqqk.jpeg,Health and Beauty>Sexual Wellness>Condoms>For Him,600.0,400.0,400.0,true,CDMEFE7QXHWGWBHH,CDMEFE7QXHWGWBHH
Flipkart,,"Kamasutra Double Whammy Bi- Flavoured Strawberry- Blueberry - Pack of 12 x 5 Condom(Set of 5, 60S)",HERE COMES THE DOUBLE WHAMMY BI FLAVOURED CONDOMS TO DOUBLE THE LOVE MAKING.BI - FLAVOURED CONDOMS - A MIX OF STRAWBERRY AND BLUEBERY.,Kamasutra,http://dl.flipkart.com/dl/kamasutra-double-whammy-bi-flavoured-strawberry-blueberry-pack-12-x-5-condom/p/itmefjpzphzkyc56?pid=CDMEFJPZ3RNFYNQM&affid=siddarthk,http://img.fkcdn.com/image/condom/n/q/m/5-60-kamasutra-double-whammy-bi-flavoured-strawberry-blueberry-200x200-imaefjkckfmwxx4n.jpeg,Health and Beauty>Sexual Wellness>Condoms>For Him,500.0,370.0,370.0,true,CDMEFJPZ3RNFYNQM,CDMEFJPZ3RNFYNQM
Flipkart,,"Okamoto Skinless Skin Ultra Thin Condom(Set of 5, 10S)","This Ultra thin condoms will bring you same feeling as if ""Not to Wear Anything"". It is imported and high quality premium condoms. It allows one to bring greater stimulation during intercourse and a warming sensation. These condoms are made of Sheerlon Material, and each condom is tested against electrostatic technology.",Okamoto,http://dl.flipkart.com/dl/okamoto-skinless-skin-ultra-thin-condom/p/itme999skfstrkwp?pid=CDME999SZXQBZ3GH&affid=siddarthk,http://img.fkcdn.com/image/condom/3/g/h/5-10-okamoto-skinless-skin-ultra-thin-200x200-imae993e3tgwtczx.jpeg,Health and Beauty>Sexual Wellness>Condoms>For Him,620.0,558.0,620.0,true,CDME999SZXQBZ3GH,CDME999SZXQBZ3GH
Flipkart,,"OKAMOTO STRAWBERRY Condom(Set of 5, 10S)","Manufactured using revolutionary Japanese technology, which enables Skinless Skin condoms to be much thinner than ordinary condoms – giving them a more natural silkier feel, much like skin itself; while maintaining the highest standards of strength and durability",OKAMOTO,http://dl.flipkart.com/dl/okamoto-strawberry-condom/p/itmenfh26rkkykqy?pid=CDMENFH2NDJW36C3&affid=siddarthk,http://img.fkcdn.com/image/condom/6/c/3/5-10-okamoto-strawberry-200x200-imaenfft4znznwvr.jpeg,Health and Beauty>Sexual Wellness>Condoms>For Him,650.0,498.0,498.0,true,CDMENFH2NDJW36C3,CDMENFH2NDJW36C3
Flipkart,,"Skore Cool-10-s Condom(Set of 4, 40S)","Skore Cool condom comes with a special cooling lubricant which will provide an unique Cooling sensation for both the partners. The Cooling Lubricant added in the condom is kept at an acceptable level to add excitement and make love making more fun and intimate. Skore Cool Condom has been tested with Consumers and all those used had no problem of erection. Infact, they have liked it and enjoyed the cooling sensation. The Cooling lubricant used in the Cool Condom gives out an unique tingling sensation for extra pleasure and excitement which can be used for all seasons.",Skore,http://dl.flipkart.com/dl/skore-cool-10-s-condom/p/itmeh8rjwvtpghmm?pid=CDMEH8RJVDGHJBZN&affid=siddarthk,http://img.fkcdn.com/image/condom/b/z/n/4-40-skore-cool-10-s-200x200-imaeh4wqfccrjh9j.jpeg,Health and Beauty>Sexual Wellness>Condoms>For Him,320.0,288.0,288.0,true,CDMEH8RJVDGHJBZN,CDMEH8RJVDGHJBZN
Flipkart,,"Kamasutra Longlast, Wet n Wild, Intensity - UPFK200147 Condom(Set of 6, 72S)","2 x Longlast Condoms, Pack of 12's, 2 x Wet n Wild Condoms, Pack of 12's, 2 x Intensity Condoms, Pack of 12's",Kamasutra,http://dl.flipkart.com/dl/kamasutra-longlast-wet-n-wild-intensity-upfk200147-condom/p/itmead329ujapfue?pid=CDMEAD32AGJB52CC&affid=siddarthk,http://img.fkcdn.com/image/condom/2/c/c/6-72-kamasutra-longlast-wet-n-wild-intensity-upfk200147-200x200-imaeaacy95wnauhg.jpeg,Health and Beauty>Sexual Wellness>Condoms>For Him,660.0,567.0,630.0,true,CDMEAD32AGJB52CC,CDMEAD32AGJB52CC
Flipkart,,"Skore Shades-10-s Condom(Set of 4, 40S)","Play your game of passion with Skore shades. Condoms that come to you in an assortment of colors and are dotted to add greater sensation to lovemaking. So,choose your favorite color and drive her wild with dotted pleasure.",Skore,http://dl.flipkart.com/dl/skore-shades-10-s-condom/p/itmeh8rgcuugtfuk?pid=CDMEH8RGK2GZ3A3R&affid=siddarthk,http://img.fkcdn.com/image/condom/a/3/r/4-40-skore-shades-10-s-200x200-imaeh4wqz2j7pmbg.jpeg,Health and Beauty>Sexual Wellness>Condoms>For Him,320.0,249.0,249.0,true,CDMEH8RGK2GZ3A3R,CDMEH8RGK2GZ3A3R
