PartnerName,Id,Title,Description,Brand,Link,ImageLink,CategoryName,Mrp,OfferPrice,EffectivePrice,Availability,PartnerIdFromUrl,PartnerIdFromDb
Flipkart,,"Bausch & Lomb Purevision 2 with Lens Care Kit By Visions India Monthly Contact Lens(-4.75, Clear, Pack of 6)","New Bausch + Lomb PureVision®2 HD contact lenses feature HD Optics are designed to reduce halos and glare and deliver the clear, crisp vision that you should demand. Plus, this monthly replacement lens offers design advances for outstanding comfort and breath-ability.",Bausch & Lomb,http://dl.flipkart.com/dl/bausch-lomb-purevision-2-lens-care-kit-visions-india-monthly-contact/p/itmef3fp3qrr8ped?pid=CTLEF3FPHJW35HKS&affid=siddarthk,http://img.fkcdn.com/image/contact-lens-new/f/x/k/bausch-lomb-6-purevision-2-with-lens-care-kit-by-visions-india-2-200x200-imaemgyya66zjfue.jpeg,Health and Beauty>Eye Care>Contact Lenses,2100.0,1699.0,1699.0,true,CTLEF3FPHJW35HKS,CTLEF3FPHJW35HKS
Flipkart,,"Ciba Vision Freshlook Colorblends Monthly Contact Lens(-3.00, Brown, Pack of 2)","Freshlook Colorblends in affordable opaque colors with maximum possible lens concentration blends 3 colours into one to create the subtle, natural depth of your eyes. Replace it frequently to enjoy a comfortable wear.",Ciba Vision,http://dl.flipkart.com/dl/ciba-vision-freshlook-colorblends-monthly-contact-lens/p/itmearzfgzzxrkgj?pid=CTLEARZFFHGYYV9V&affid=siddarthk,http://img.fkcdn.com/image/contact-lens-new/v/w/c/ciba-vision-2-freshlook-colorblends-brown-by-vision-india-4-50-200x200-imaearhx6fhtgpq5.jpeg,Health and Beauty>Eye Care>Contact Lenses,995.0,699.0,699.0,true,CTLEARZFFHGYYV9V,CTLEARZFFHGYYV9V
Flipkart,,"Aryan Tri Tone Hazel By Visions India Yearly Contact Lens(-3.25, Hazel, Pack of 2)","Aryan tri tone cosmetic lenses are developed and designed by the best in the business to match with the characteristics of the cornea and are intended to make one’s eyes more beautiful and more natural. Due consideration is given to the colour and size of the pupil and the health of the eye. These lenses are available in six colours – Sky Blue, Aqua Blue, Green , Hazel, Grey and Brown.",Aryan,http://dl.flipkart.com/dl/aryan-tri-tone-hazel-visions-india-yearly-contact-lens/p/itmegys9wkkwmh4h?pid=CTLEH5SZZJS4Q8ZQ&affid=siddarthk,http://img.fkcdn.com/image/contact-lens-new/4/s/h/aryan-2-tri-tone-hazel-by-visions-india-9-00-200x200-imaeh5he6nxncbxx.jpeg,Health and Beauty>Eye Care>Contact Lenses,2600.0,1599.0,1599.0,true,CTLEH5SZZJS4Q8ZQ,CTLEH5SZZJS4Q8ZQ
Flipkart,,"Aquasoft Visiblu With Contact Lens Case by Visions India Yearly Contact Lens(-4.75, Clear, Pack of 2)","A truly World class, value-for-money, soft lens. Manufactured in the Netherlands at an ISO 9001, EN46001 and CE certified facility using the latest and most sophisticated lathe cutting technology.offerings the ultimate in wearing comfort and clarify of vision. One more step forward in Aquasoft’s mission to bring you world class eye care at an affordable price.",Aquasoft,http://dl.flipkart.com/dl/aquasoft-visiblu-contact-lens-case-visions-india-yearly/p/itmef36ggxhctygf?pid=CTLEF36GQZBZHGRH&affid=siddarthk,http://img.fkcdn.com/image/contact-lens-new/h/r/n/aquasoft-2-visiblu-with-contact-lens-case-by-visions-india-4-50-200x200-imaeexnffzmcaujy.jpeg,Health and Beauty>Eye Care>Contact Lenses,1800.0,1369.0,1369.0,true,CTLEF36GQZBZHGRH,CTLEF36GQZBZHGRH
Flipkart,,Glamour Eye Sweet Honey By Visions India Monthly Contact Lens,India's Best Selling Cosmetic Contact Lenses Manufactured In Korea,Glamour Eye,http://dl.flipkart.com/dl/glamour-eye-sweet-honey-visions-india-monthly-contact-lens/p/itmeghwvmgwv3wec?pid=CTLEGHWVUBHRPZHV&affid=siddarthk,http://img.fkcdn.com/image/contact-lens-new/m/2/r/glamour-eye-2-charming-hazel-by-visions-india-12-50-200x200-imaegjh57djgrcfy.jpeg,Health and Beauty>Eye Care>Contact Lenses,995.0,625.0,625.0,true,CTLEGHWVUBHRPZHV,CTLEGHWVUBHRPZHV
Flipkart,,"Optokart Two Tone Color Made In U S A By Visions India Yearly Contact Lens(-0.50, Turquoise, Pack of 2)",Very Attractive Colors Made In U. S. A.,Optokart,http://dl.flipkart.com/dl/optokart-two-tone-color-made-u-s-visions-india-yearly-contact-lens/p/itmeh4cgvbbt847f?pid=CTLEH4CGHHVXYJD6&affid=siddarthk,http://img.fkcdn.com/image/contact-lens-new/2/q/n/optokart-2-two-tone-color-made-in-u-s-a-by-visions-india-6-00-200x200-imaeh2f3g6enugqz.jpeg,Health and Beauty>Eye Care>Contact Lenses,2300.0,599.0,599.0,true,CTLEH4CGHHVXYJD6,CTLEH4CGHHVXYJD6
Flipkart,,Glamour Eye Midnight Blue By Visions India Monthly Contact Lens,India's Best Selling Cosmetic Contact Lenses Manufactured In Korea,Glamour Eye,http://dl.flipkart.com/dl/glamour-eye-midnight-blue-visions-india-monthly-contact-lens/p/itmeghuasdz9whhx?pid=CTLEGHUAZKQMZYTA&affid=siddarthk,http://img.fkcdn.com/image/contact-lens-new/g/u/y/glamour-eye-2-midnight-blue-by-visions-india-14-00-200x200-imaegeyyq95tehgs.jpeg,Health and Beauty>Eye Care>Contact Lenses,995.0,625.0,625.0,true,CTLEGHUAZKQMZYTA,CTLEGHUAZKQMZYTA
Flipkart,,"Ciba Vision Freshlook Colorblends Amethyst By Visions India Monthly Contact Lens(-5.50, Amethyst, Pack of 2)","Freshlook Colorblends in affordable opaque colors with maximum possible lens concentration blends 3 colours into one to create the subtle, natural depth of your eyes. Replace it frequently to enjoy a comfortable wear.",Ciba Vision,http://dl.flipkart.com/dl/ciba-vision-freshlook-colorblends-amethyst-visions-india-monthly-contact-lens/p/itmedmyzfvdhzf6c?pid=CTLEDMYZY4K8VJQ6&affid=siddarthk,http://img.fkcdn.com/image/contact-lens-new/g/p/x/ciba-vision-2-freshlook-colorblends-amethyst-by-visions-india-4-200x200-imaeaz3ead6drfzq.jpeg,Health and Beauty>Eye Care>Contact Lenses,995.0,699.0,699.0,true,CTLEDMYZY4K8VJQ6,CTLEDMYZY4K8VJQ6
Flipkart,,Optokart Two Tone Color With Kit Made In USA By Visions India Yearly Contact Lens,"These have been specially designed keeping the youth in mind. Most Attractive Colors These easy to handle and comfortable to use lenses come in Yearly disposable modality and hence are hygienic. Grey,Green,Turquoise,Brown.",Optokart,http://dl.flipkart.com/dl/optokart-two-tone-color-kit-made-usa-visions-india-yearly-contact-lens/p/itmehfq9rqzcsjwe?pid=CTLEHFQ9EVYDEYYH&affid=siddarthk,http://img.fkcdn.com/image/contact-lens-new/q/q/y/optokart-2-two-tone-color-with-kit-made-in-usa-by-visions-india-200x200-imaehejfqsnkq9vz.jpeg,Health and Beauty>Eye Care>Contact Lenses,2300.0,699.0,699.0,true,CTLEHFQ9EVYDEYYH,CTLEHFQ9EVYDEYYH
Flipkart,,"Bausch & Lomb Lacelle Blue Monthly Contact Lens with Biotrue 60ml Solution by Visions India Monthly Contact Lens(-3.25, Blue, Pack of 2)",,Bausch & Lomb,http://dl.flipkart.com/dl/bausch-lomb-lacelle-blue-monthly-contact-lens-biotrue-60ml-solution-visions-india/p/itmeemcdurzqjp9f?pid=CTLEEMCDWQYMTWKG&affid=siddarthk,http://img.fkcdn.com/image/contact-lens-new/t/b/e/bausch-lomb-2-lacelle-blue-monthly-contact-lens-with-biotrue-200x200-imaeek8pwhmcrknq.jpeg,Health and Beauty>Eye Care>Contact Lenses,1000.0,789.0,789.0,true,CTLEEMCDWQYMTWKG,CTLEEMCDWQYMTWKG
Flipkart,,"Optokart Two Tone Color Made In U S A By Visions India Yearly Contact Lens(-0.75, Turquoise, Pack of 2)",Very Attractive Colors Made In U. S. A.,Optokart,http://dl.flipkart.com/dl/optokart-two-tone-color-made-u-s-visions-india-yearly-contact-lens/p/itmeh4cgyw5re7jg?pid=CTLEH4CGVUEWNMJ3&affid=siddarthk,http://img.fkcdn.com/image/contact-lens-new/2/q/n/optokart-2-two-tone-color-made-in-u-s-a-by-visions-india-6-00-200x200-imaeh2f3g6enugqz.jpeg,Health and Beauty>Eye Care>Contact Lenses,2300.0,599.0,599.0,true,CTLEH4CGVUEWNMJ3,CTLEH4CGVUEWNMJ3
Flipkart,,Bausch & Lomb Optima 38 with Biotrue 60ml Solution by Visions India Yearly Contact Lens,"Bausch & Lomb's Optima38 are Yearly disposable contact lenses. These are colorless contact lenses, with recommended usage of around 12-14 hours every day. The lenses are highly durable and with crystal clear vision. Enhanced lens design for excellent comfort. RPIII technology to ensure easy handling for new users.",Bausch & Lomb,http://dl.flipkart.com/dl/bausch-lomb-optima-38-biotrue-60ml-solution-visions-india-yearly-contact-lens/p/itmef3fpfhustxgz?pid=CTLEF3FPAHEJFZGE&affid=siddarthk,http://img.fkcdn.com/image/contact-lens-new/p/r/c/bausch-lomb-1-optima-38-with-biotrue-60ml-solution-by-visions-200x200-imaeetbyr7ze62sz.jpeg,Health and Beauty>Eye Care>Contact Lenses,1065.0,814.0,814.0,true,CTLEF3FPAHEJFZGE,CTLEF3FPAHEJFZGE
Flipkart,,Aryan Tri Tone Dark Grey By Visions India Yearly Contact Lens,"Aryan tri tone cosmetic lenses are developed and designed by the best in the business to match with the characteristics of the cornea and are intended to make one’s eyes more beautiful and more natural. Due consideration is given to the colour and size of the pupil and the health of the eye. These lenses are available in six colours – Sky Blue, Aqua Blue, Green , Hazel, Grey and Brown.",Aryan,http://dl.flipkart.com/dl/aryan-tri-tone-dark-grey-visions-india-yearly-contact-lens/p/itmegysek8b4sphg?pid=CTLEH86ZSJ2K6V3F&affid=siddarthk,http://img.fkcdn.com/image/contact-lens-new/6/r/h/aryan-2-tri-tone-dark-grey-by-visions-india-8-50-200x200-imaeh5pfa9xryt7z.jpeg,Health and Beauty>Eye Care>Contact Lenses,2600.0,1599.0,1599.0,false,CTLEH86ZSJ2K6V3F,CTLEH86ZSJ2K6V3F
Flipkart,,Sparkle Tri Tone By Visions India Yearly Contact Lens,Premium Color Yearly Contact Lens,Sparkle,http://dl.flipkart.com/dl/sparkle-tri-tone-visions-india-yearly-contact-lens/p/itmehrh6rsdmvgsg?pid=CTLEHRH6DXXUHCXP&affid=siddarthk,http://img.fkcdn.com/image/contact-lens-new/v/t/h/sparkle-2-tri-tone-by-visions-india-4-75-200x200-imaehpwsxy7ugmbc.jpeg,Health and Beauty>Eye Care>Contact Lenses,1500.0,999.0,999.0,true,CTLEHRH6DXXUHCXP,CTLEHRH6DXXUHCXP
Flipkart,,"Glamour Eye Soft Hazel By Visions India Monthly Contact Lens(-2.75, Soft Hazel, Pack of 2)",India's Best Selling Cosmetic Contact Lenses Manufactured In Korea,Glamour Eye,http://dl.flipkart.com/dl/glamour-eye-soft-hazel-visions-india-monthly-contact-lens/p/itmeght3cwn2xhgh?pid=CTLEGHT34YFF7GD6&affid=siddarthk,http://img.fkcdn.com/image/contact-lens-new/9/m/8/glamour-eye-2-soft-hazel-by-visions-india-11-00-200x200-imaegeyzjshdkgyy.jpeg,Health and Beauty>Eye Care>Contact Lenses,995.0,625.0,625.0,true,CTLEGHT34YFF7GD6,CTLEGHT34YFF7GD6
Flipkart,,Optokart Two Tone Color Made In U S A By Visions India Yearly Contact Lens,Very Attractive Colors Made In U. S. A.,Optokart,http://dl.flipkart.com/dl/optokart-two-tone-color-made-u-s-visions-india-yearly-contact-lens/p/itmeh4chvg3vgzzc?pid=CTLEH4CHDRTHCNEQ&affid=siddarthk,http://img.fkcdn.com/image/contact-lens-new/2/q/n/optokart-2-two-tone-color-made-in-u-s-a-by-visions-india-6-00-200x200-imaeh2f3g6enugqz.jpeg,Health and Beauty>Eye Care>Contact Lenses,2300.0,599.0,599.0,true,CTLEH4CHDRTHCNEQ,CTLEH4CHDRTHCNEQ
Flipkart,,"Ciba Vision Freshlook Colorblends Pure Hazel By Visions India Monthly Contact Lens(-5.75, Pure Hazel, Pack of 2)","Freshlook Colorblends in affordable opaque colors with maximum possible lens concentration blends 3 colours into one to create the subtle, natural depth of your eyes. Replace it frequently to enjoy a comfortable wear.",Ciba Vision,http://dl.flipkart.com/dl/ciba-vision-freshlook-colorblends-pure-hazel-visions-india-monthly-contact-lens/p/itmedmq8vc7f5dhv?pid=CTLEDMQ8ZAHYRWXD&affid=siddarthk,http://img.fkcdn.com/image/contact-lens-new/h/n/t/ciba-vision-2-freshlook-colorblends-pure-hazel-by-visions-india-200x200-imaeargbjjfcj9ur.jpeg,Health and Beauty>Eye Care>Contact Lenses,995.0,699.0,699.0,true,CTLEDMQ8ZAHYRWXD,CTLEDMQ8ZAHYRWXD
Flipkart,,Optokart Two Tone Color With Kit Made In USA By Visions India Yearly Contact Lens,"These have been specially designed keeping the youth in mind. Most Attractive Colors These easy to handle and comfortable to use lenses come in Yearly disposable modality and hence are hygienic. Grey,Green,Turquoise,Brown.",Optokart,http://dl.flipkart.com/dl/optokart-two-tone-color-kit-made-usa-visions-india-yearly-contact-lens/p/itmehghyuhxqazeh?pid=CTLEHGHYFZYH5S6S&affid=siddarthk,http://img.fkcdn.com/image/contact-lens-new/h/b/g/optokart-2-two-tone-color-with-kit-made-in-usa-by-visions-india-200x200-imaehej7urze8uwp.jpeg,Health and Beauty>Eye Care>Contact Lenses,2300.0,699.0,699.0,true,CTLEHGHYFZYH5S6S,CTLEHGHYFZYH5S6S
Flipkart,,Sparkle Tri Tone By Visions India Yearly Contact Lens,Premium Color Yearly Contact Lens,Sparkle,http://dl.flipkart.com/dl/sparkle-tri-tone-visions-india-yearly-contact-lens/p/itmehrh5t9yqsqmm?pid=CTLEHRH5WZYSXYYS&affid=siddarthk,http://img.fkcdn.com/image/contact-lens-new/v/t/h/sparkle-2-tri-tone-by-visions-india-4-75-200x200-imaehpwsxy7ugmbc.jpeg,Health and Beauty>Eye Care>Contact Lenses,1500.0,999.0,999.0,true,CTLEHRH5WZYSXYYS,CTLEHRH5WZYSXYYS
Flipkart,,"Ciba Vision Freshlook Colours Monthly Contact Lens(-1.75, Green, Pack of 2)","Freshlook Colors in affordable opaque colors with maximum possible lens concentration blends natural colours into one to create the subtle, natural depth of your eyes. Replace it frequently to enjoy a comfortable wear.",Ciba Vision,http://dl.flipkart.com/dl/ciba-vision-freshlook-colours-monthly-contact-lens/p/itmedhdmpeuehr53?pid=CTLEDHDHF3Q4GS8Q&affid=siddarthk,http://img.fkcdn.com/image/contact-lens-new/d/q/w/ciba-vision-2-freshlook-colours-1-5-original-imaedfff9x6kgamm.jpeg,Health and Beauty>Eye Care>Contact Lenses,995.0,699.0,699.0,true,CTLEDHDHF3Q4GS8Q,CTLEDHDHF3Q4GS8Q
Flipkart,,Optokart Two Tone Color With Kit Made In USA By Visions India Yearly Contact Lens,"These have been specially designed keeping the youth in mind. Most Attractive Colors These easy to handle and comfortable to use lenses come in Yearly disposable modality and hence are hygienic. Grey,Green,Turquoise,Brown.",Optokart,http://dl.flipkart.com/dl/optokart-two-tone-color-kit-made-usa-visions-india-yearly-contact-lens/p/itmehfqbrwq7zg7p?pid=CTLEHFQBXHYRVGJG&affid=siddarthk,http://img.fkcdn.com/image/contact-lens-new/7/e/w/optokart-2-two-tone-color-with-kit-made-in-usa-by-visions-india-200x200-imaehekybqmvuvg8.jpeg,Health and Beauty>Eye Care>Contact Lenses,2300.0,699.0,699.0,true,CTLEHFQBXHYRVGJG,CTLEHFQBXHYRVGJG
Flipkart,,"Optokart Two Tone Color Made In U S A By Visions India Yearly Contact Lens(-4.00, Grey, Pack of 2)",Very Attractive Colors Made In U. S. A.,Optokart,http://dl.flipkart.com/dl/optokart-two-tone-color-made-u-s-visions-india-yearly-contact-lens/p/itmeh4cd3fbztykx?pid=CTLEH4CDRR5ZWUJY&affid=siddarthk,http://img.fkcdn.com/image/contact-lens-new/2/q/n/optokart-2-two-tone-color-made-in-u-s-a-by-visions-india-6-00-200x200-imaeh2f3g6enugqz.jpeg,Health and Beauty>Eye Care>Contact Lenses,2300.0,599.0,599.0,true,CTLEH4CDRR5ZWUJY,CTLEH4CDRR5ZWUJY
Flipkart,,"Glamour Eye Warm Brown By Visions India Monthly Contact Lens(-14.50, Warm Brown, Pack of 2)",India's Best Selling Cosmetic Contact Lenses Manufactured In Korea,Glamour Eye,http://dl.flipkart.com/dl/glamour-eye-warm-brown-visions-india-monthly-contact-lens/p/itmeghwxkavyyuks?pid=CTLEGHWX4ZBE6F8U&affid=siddarthk,http://img.fkcdn.com/image/contact-lens-new/m/2/r/glamour-eye-2-charming-hazel-by-visions-india-12-50-200x200-imaegjh57djgrcfy.jpeg,Health and Beauty>Eye Care>Contact Lenses,995.0,625.0,625.0,true,CTLEGHWX4ZBE6F8U,CTLEGHWX4ZBE6F8U
Flipkart,,"Aryan 2 Tone Green By Visions India Yearly Contact Lens(-0.50, Green, Pack of 2)","Aryan two tone cosmetic lenses are developed and designed by the best in the business to match with the characteristics of the cornea and are intended to make one’s eyes more beautiful and more natural. Due consideration is given to the colour and size of the pupil and the health of the eye. These lenses are available in six colours – sky blue, hazel, Green, brown, grey and green along with the contact lens solution.",Aryan,http://dl.flipkart.com/dl/aryan-2-tone-green-visions-india-yearly-contact-lens/p/itmees7fjmkzpvgy?pid=CTLEES7FJ6QZZZVV&affid=siddarthk,http://img.fkcdn.com/image/contact-lens-new/7/b/f/aryan-2-2-tone-green-by-visions-india-4-25-200x200-imaee7uhc2tfupta.jpeg,Health and Beauty>Eye Care>Contact Lenses,2300.0,1599.0,1599.0,true,CTLEES7FJ6QZZZVV,CTLEES7FJ6QZZZVV
Flipkart,,Glamour Eye Soft Hazel By Visions India Monthly Contact Lens,India's Best Selling Cosmetic Contact Lenses Manufactured In Korea,Glamour Eye,http://dl.flipkart.com/dl/glamour-eye-soft-hazel-visions-india-monthly-contact-lens/p/itmeght3khyp8uwu?pid=CTLEGHT3ZF5GX9FY&affid=siddarthk,http://img.fkcdn.com/image/contact-lens-new/9/m/8/glamour-eye-2-soft-hazel-by-visions-india-11-00-200x200-imaegeyzjshdkgyy.jpeg,Health and Beauty>Eye Care>Contact Lenses,995.0,625.0,625.0,true,CTLEGHT3ZF5GX9FY,CTLEGHT3ZF5GX9FY
Flipkart,,"Bausch & Lomb Biotrue 1 Day with Biotrue 60ml Solution Kit By Visions India Daily Contact Lens(-8.50, Clear, Pack of 30)","Biotrue ONEday contact lenses are inspired by the biology of your eyes. While other lenses dry out as the day passes, Biotrue ONEday contacts retain moisture naturally produced by the eye. The result is consistently clear vision and comfort until the moment you take them out. With added High Definition Optics, Biotrue lenses help reduce halos and glare in low light situations. Try Biotrue ONEday daily disposables and see how naturally good your eyes can feel in contact lenses. Note: All items have latest expiry. Minimum expiry on any product will be not less than 2 years. 100% authentic item. Opened boxes cannot be replaced under any circumstance. We advise to check the product before opening them.",Bausch & Lomb,http://dl.flipkart.com/dl/bausch-lomb-biotrue-1-day-60ml-solution-kit-visions-india-daily-contact-lens/p/itmef6g5c9gkzrgy?pid=CTLEF6G5TT4TZPKK&affid=siddarthk,http://img.fkcdn.com/image/contact-lens-new/z/k/r/bausch-lomb-30-biotrue-1-day-with-biotrue-60ml-solution-kit-by-200x200-imaef42vfmtzvuuk.jpeg,Health and Beauty>Eye Care>Contact Lenses,2500.0,1799.0,1799.0,true,CTLEF6G5TT4TZPKK,CTLEF6G5TT4TZPKK
Flipkart,,Aryan 2 Tone Hazel By Visions India Yearly Contact Lens,"Aryan two tone cosmetic lenses are developed and designed by the best in the business to match with the characteristics of the cornea and are intended to make one’s eyes more beautiful and more natural. Due consideration is given to the colour and size of the pupil and the health of the eye. These lenses are available in six colours – sky blue, hazel, Hazel, brown, Hazel and Hazel along with the contact lens solution.",Aryan,http://dl.flipkart.com/dl/aryan-2-tone-hazel-visions-india-yearly-contact-lens/p/itmees7f3pg6jhny?pid=CTLEES7FWNAHHSUG&affid=siddarthk,http://img.fkcdn.com/image/contact-lens-new/h/g/a/aryan-2-2-tone-hazel-by-visions-india-4-50-200x200-imaee87dwwbgxufj.jpeg,Health and Beauty>Eye Care>Contact Lenses,2300.0,1599.0,1599.0,true,CTLEES7FWNAHHSUG,CTLEES7FWNAHHSUG
Flipkart,,"Glamour Eye Warm Brown By Visions India Monthly Contact Lens(-3.00, Warm Brown, Pack of 2)",India's Best Selling Cosmetic Contact Lenses Manufactured In Korea,Glamour Eye,http://dl.flipkart.com/dl/glamour-eye-warm-brown-visions-india-monthly-contact-lens/p/itmeghwxafm6gjba?pid=CTLEGHWXYYMHVGUD&affid=siddarthk,http://img.fkcdn.com/image/contact-lens-new/m/2/r/glamour-eye-2-charming-hazel-by-visions-india-12-50-200x200-imaegjh57djgrcfy.jpeg,Health and Beauty>Eye Care>Contact Lenses,995.0,625.0,625.0,true,CTLEGHWXYYMHVGUD,CTLEGHWXYYMHVGUD
Flipkart,,Alcon O2 Optix Silicone Hydrogel With Lens Care Kit By Visions India Monthly Contact Lens,O2 Optix Aqua Contact Lens Are Designed Using Silicone Hydrogel Technology That Provides Comfort To Your Eyes In 3 Different Ways. Breathability Of The Lens Lets It Come In Contact With Oxygen And Gives Your Eyes A Healthy Look And Feel. The Lens Is Made From High Quality Patented Materials That Help It To Retain Moisture. The Lens Also Prevents Pathogenic Materials From Getting Deposited On Your Eyes. O2 Optix Aqua Features A Unique Moisture Agent That Helps To Lubricate The Lens And Provides Initial Comfort. The Lens Provides All Day Comfort To Your Eyes By Minimizing The Rate Of Lens Dehydration. The Smooth Surface Of The Lens Has High Wettability That Provides Deposit Resistance.,Alcon,http://dl.flipkart.com/dl/alcon-o2-optix-silicone-hydrogel-lens-care-kit-visions-india-monthly-contact/p/itmehv7tkd5wuawm?pid=CTLEHV7SGB3SSHEG&affid=siddarthk,http://img.fkcdn.com/image/contact-lens-new/f/g/a/alcon-6-o2-optix-silicone-hydrogel-with-lens-care-kit-by-visions-200x200-imaehqfa6rfxjjgp.jpeg,Health and Beauty>Eye Care>Contact Lenses,1195.0,899.0,899.0,true,CTLEHV7SGB3SSHEG,CTLEHV7SGB3SSHEG
Flipkart,,Aryan Tri Tone Aqua Blue By Visions India Yearly Contact Lens,"Aryan tri tone cosmetic lenses are developed and designed by the best in the business to match with the characteristics of the cornea and are intended to make one’s eyes more beautiful and more natural. Due consideration is given to the colour and size of the pupil and the health of the eye. These lenses are available in six colours – Sky Blue, Aqua Blue, Green , Hazel, Grey and Brown.",Aryan,http://dl.flipkart.com/dl/aryan-tri-tone-aqua-blue-visions-india-yearly-contact-lens/p/itmegyrqhtj42dhk?pid=CTLEH86TGYPF3JJC&affid=siddarthk,http://img.fkcdn.com/image/contact-lens-new/n/9/d/aryan-2-tri-tone-aqua-blue-by-visions-india-5-50-200x200-imaeguhxuxqmv4db.jpeg,Health and Beauty>Eye Care>Contact Lenses,2600.0,1599.0,1599.0,true,CTLEH86TGYPF3JJC,CTLEH86TGYPF3JJC
Flipkart,,Alcon O2 Optix Silicone Hydrogel With Lens Care Kit By Visions India Monthly Contact Lens,O2 Optix Aqua Contact Lens Are Designed Using Silicone Hydrogel Technology That Provides Comfort To Your Eyes In 3 Different Ways. Breathability Of The Lens Lets It Come In Contact With Oxygen And Gives Your Eyes A Healthy Look And Feel. The Lens Is Made From High Quality Patented Materials That Help It To Retain Moisture. The Lens Also Prevents Pathogenic Materials From Getting Deposited On Your Eyes. O2 Optix Aqua Features A Unique Moisture Agent That Helps To Lubricate The Lens And Provides Initial Comfort. The Lens Provides All Day Comfort To Your Eyes By Minimizing The Rate Of Lens Dehydration. The Smooth Surface Of The Lens Has High Wettability That Provides Deposit Resistance.,Alcon,http://dl.flipkart.com/dl/alcon-o2-optix-silicone-hydrogel-lens-care-kit-visions-india-monthly-contact/p/itmehv7qyjnwsx3t?pid=CTLEHV7QHTQYA8GG&affid=siddarthk,http://img.fkcdn.com/image/contact-lens-new/f/g/a/alcon-6-o2-optix-silicone-hydrogel-with-lens-care-kit-by-visions-200x200-imaehqfa6rfxjjgp.jpeg,Health and Beauty>Eye Care>Contact Lenses,1195.0,899.0,899.0,true,CTLEHV7QHTQYA8GG,CTLEHV7QHTQYA8GG
Flipkart,,Alcon O2 Optix Silicone Hydrogel With Lens Care Kit By Visions India Monthly Contact Lens,O2 Optix Aqua Contact Lens Are Designed Using Silicone Hydrogel Technology That Provides Comfort To Your Eyes In 3 Different Ways. Breathability Of The Lens Lets It Come In Contact With Oxygen And Gives Your Eyes A Healthy Look And Feel. The Lens Is Made From High Quality Patented Materials That Help It To Retain Moisture. The Lens Also Prevents Pathogenic Materials From Getting Deposited On Your Eyes. O2 Optix Aqua Features A Unique Moisture Agent That Helps To Lubricate The Lens And Provides Initial Comfort. The Lens Provides All Day Comfort To Your Eyes By Minimizing The Rate Of Lens Dehydration. The Smooth Surface Of The Lens Has High Wettability That Provides Deposit Resistance.,Alcon,http://dl.flipkart.com/dl/alcon-o2-optix-silicone-hydrogel-lens-care-kit-visions-india-monthly-contact/p/itmehv7zebg7zv9v?pid=CTLEHV7N27JWHVRP&affid=siddarthk,http://img.fkcdn.com/image/contact-lens-new/f/g/a/alcon-6-o2-optix-silicone-hydrogel-with-lens-care-kit-by-visions-200x200-imaehqfa6rfxjjgp.jpeg,Health and Beauty>Eye Care>Contact Lenses,1195.0,899.0,899.0,true,CTLEHV7N27JWHVRP,CTLEHV7N27JWHVRP
Flipkart,,"Ciba Vision Freshlook Colorblends Pure Hazel By Visions India Monthly Contact Lens(-4.75, Pure Hazel, Pack of 2)","Freshlook Colorblends in affordable opaque colors with maximum possible lens concentration blends 3 colours into one to create the subtle, natural depth of your eyes. Replace it frequently to enjoy a comfortable wear.",Ciba Vision,http://dl.flipkart.com/dl/ciba-vision-freshlook-colorblends-pure-hazel-visions-india-monthly-contact-lens/p/itmedmq8f58zgz4m?pid=CTLEDMQ8S9VUVWF2&affid=siddarthk,http://img.fkcdn.com/image/contact-lens-new/h/n/t/ciba-vision-2-freshlook-colorblends-pure-hazel-by-visions-india-200x200-imaeargbjjfcj9ur.jpeg,Health and Beauty>Eye Care>Contact Lenses,995.0,699.0,699.0,true,CTLEDMQ8S9VUVWF2,CTLEDMQ8S9VUVWF2
Flipkart,,Aryan Tri Tone Sky Blue By Visions India Yearly Contact Lens,"Aryan tri tone cosmetic lenses are developed and designed by the best in the business to match with the characteristics of the cornea and are intended to make one’s eyes more beautiful and more natural. Due consideration is given to the colour and size of the pupil and the health of the eye. These lenses are available in six colours – Sky Blue, Aqua Blue, Green , Hazel, Grey and Brown.",Aryan,http://dl.flipkart.com/dl/aryan-tri-tone-sky-blue-visions-india-yearly-contact-lens/p/itmegysfwvyqqmbv?pid=CTLEH5SS2B6CJVQA&affid=siddarthk,http://img.fkcdn.com/image/contact-lens-new/e/a/v/aryan-2-tri-tone-sky-blue-by-visions-india-4-00-200x200-imaeh5zrygjpz9kp.jpeg,Health and Beauty>Eye Care>Contact Lenses,2600.0,1599.0,1599.0,true,CTLEH5SS2B6CJVQA,CTLEH5SS2B6CJVQA
