PartnerName,Id,Title,Description,Brand,Link,ImageLink,CategoryName,Mrp,OfferPrice,EffectivePrice,Availability,PartnerIdFromUrl,PartnerIdFromDb
Flipkart,,Passion Indulge Traviflora Energizing Body Wash,,Passion Indulge,http://dl.flipkart.com/dl/passion-indulge-traviflora-energizing-body-wash/p/itme2swe4pgkcngt?pid=BWSE2SWEV2FABDZ8&affid=siddarthk,http://img.fkcdn.com/image/body-wash/d/z/8/passion-indulge-200-traviflora-energizing-body-wash-200x200-imae2rxzkgs9vbpf.jpeg,Health and Beauty>Bath and Spa>Body Wash,380.0,360.0,360.0,false,BWSE2SWEV2FABDZ8,BWSE2SWEV2FABDZ8
Flipkart,,Puro Body & Soul Lemongrass Body Wash,Hydrating body wash to cleanse and soften skin. SLS free body wash that ensures skin is gently cleansed without stripping away natural body oils.,Puro Body & Soul,http://dl.flipkart.com/dl/puro-body-soul-lemongrass-wash/p/itmdyz9vchwxhd66?pid=BWSDYZ9VQHPUDDDZ&affid=siddarthk,http://img.fkcdn.com/image/body-wash/d/d/z/puro-body-soul-200-lemongrass-body-wash-200x200-imadzf22rxcwnevd.jpeg,Health and Beauty>Bath and Spa>Body Wash,310.0,215.0,215.0,false,BWSDYZ9VQHPUDDDZ,BWSDYZ9VQHPUDDDZ
Flipkart,,Skin Cottage Himalaya Green Tea Shower Gel (Made In Malaysia)(400 ml),,Skin Cottage,http://dl.flipkart.com/dl/skin-cottage-himalaya-green-tea-shower-gel-made-malaysia/p/itme5qmzhg7wpcfq?pid=BWSE5QMZTGTFCZVV&affid=siddarthk,http://img.fkcdn.com/image/body-wash/z/v/v/sk001-skin-cottage-400-himalaya-green-tea-shower-gel-made-in-200x200-imae5pzcbgskwagm.jpeg,Health and Beauty>Bath and Spa>Body Wash,450.0,340.0,340.0,true,BWSE5QMZTGTFCZVV,BWSE5QMZTGTFCZVV
Flipkart,,Bath & Body Works Sun Golden Magnolia,"Pink Magnolia, Golden Apricot & Peony with a touch of Vanilla And Cassis",Bath & Body Works,http://dl.flipkart.com/dl/bath-body-works-sun-golden-magnolia/p/itme3jjgymrychhf?pid=BWSEFR6JTPFZPQXN&affid=siddarthk,http://img.fkcdn.com/image/moisturizer-cream/d/9/f/bath-body-works-236-sun-golden-magnolia-shea-vitamin-e-body-200x200-imaefrfyywxgvyec.jpeg,Health and Beauty>Bath and Spa>Body Wash,999.0,650.0,650.0,false,BWSEFR6JTPFZPQXN,BWSEFR6JTPFZPQXN
Flipkart,,Auravedic Aloe Avocado Body Wash,"This Body Wash allows you to indulge and pamper your skin with hydrating oils to leave skin clean, nourished and radiant.",Auravedic,http://dl.flipkart.com/dl/auravedic-aloe-avocado-body-wash/p/itme4vqhmzbzdzhb?pid=BWSE4VQH9HUPFHWZ&affid=siddarthk,http://img.fkcdn.com/image/body-wash/h/w/z/n082-auravedic-250-aloe-avocado-body-wash-200x200-imae4wdsapjpzcvh.jpeg,Health and Beauty>Bath and Spa>Body Wash,150.0,135.0,150.0,false,BWSE4VQH9HUPFHWZ,BWSE4VQH9HUPFHWZ
Flipkart,,Auravedic Neem Lemongrass Body Wash,"This Body Wash allows you to indulge and pamper your skin with hydrating oils to leave skin clean, nourished and radiant.",Auravedic,http://dl.flipkart.com/dl/auravedic-neem-lemongrass-body-wash/p/itme4vqhkgh9sywm?pid=BWSE4VQHGVNC8HDD&affid=siddarthk,http://img.fkcdn.com/image/body-wash/h/d/d/n081-auravedic-250-neem-lemongrass-body-wash-200x200-imae4w6yhn5dywu8.jpeg,Health and Beauty>Bath and Spa>Body Wash,150.0,135.0,150.0,false,BWSE4VQHGVNC8HDD,BWSE4VQHGVNC8HDD
Flipkart,,Auravedic Coconut Milk Almond Body Wash,"This Body Wash allows you to indulge and pamper your skin with hydrating oils to leave skin clean, nourished and radiant.",Auravedic,http://dl.flipkart.com/dl/auravedic-coconut-milk-almond-body-wash/p/itme4vqhj9cwzqts?pid=BWSE4VQHGZXYHZBF&affid=siddarthk,http://img.fkcdn.com/image/body-wash/z/b/f/n080-auravedic-250-coconut-milk-almond-body-wash-200x200-imae4w6ywrwchgdv.jpeg,Health and Beauty>Bath and Spa>Body Wash,150.0,135.0,150.0,false,BWSE4VQHGZXYHZBF,BWSE4VQHGZXYHZBF
Flipkart,,Auravedic Pomegranate Berry Body Wash,"This Body Wash allows you to indulge and pamper your skin with hydrating oils to leave skin clean, nourished and radiant.",Auravedic,http://dl.flipkart.com/dl/auravedic-pomegranate-berry-body-wash/p/itme4vqhghd8rkgw?pid=BWSE4VQHHQJBGABK&affid=siddarthk,http://img.fkcdn.com/image/body-wash/a/b/k/n083-auravedic-250-pomegranate-berry-body-wash-200x200-imae4w6ygs5vdbzg.jpeg,Health and Beauty>Bath and Spa>Body Wash,150.0,135.0,150.0,false,BWSE4VQHHQJBGABK,BWSE4VQHHQJBGABK
Flipkart,,Auravedic Vanilla Honey Almond Body Wash,"This Body Wash allows you to indulge and pamper your skin with hydrating oils to leave skin clean, nourished and radiant.",Auravedic,http://dl.flipkart.com/dl/auravedic-vanilla-honey-almond-body-wash/p/itme4vqhjkf7zqmv?pid=BWSE4VQHV9GZDPDA&affid=siddarthk,http://img.fkcdn.com/image/body-wash/p/d/a/n079-auravedic-250-vanilla-honey-almond-body-wash-200x200-imae4w6yznawgdtt.jpeg,Health and Beauty>Bath and Spa>Body Wash,150.0,135.0,150.0,false,BWSE4VQHV9GZDPDA,BWSE4VQHV9GZDPDA
Flipkart,,Ferrari Uomo(250 ml),,Ferrari,http://dl.flipkart.com/dl/ferrari-uomo/p/itme8sczgrbfz7cv?pid=BWSE8SCZF7CQX7YR&affid=siddarthk,http://img.fkcdn.com/image/body-wash/e/y/f/ab-128-ferrari-250-uomo-200x200-imae8rg4kaggzdvk.jpeg,Health and Beauty>Bath and Spa>Body Wash,2500.0,889.0,889.0,false,BWSE8SCZF7CQX7YR,BWSE8SCZF7CQX7YR
Flipkart,,Bath & Body Works Fresh Picked Honey Crisp Apple(473 ml),"Wash Your Way To Softer, Cleaner Skin With A Rich, Bubbly Lather Bursting With Fragrance.",Bath & Body Works,http://dl.flipkart.com/dl/bath-body-works-fresh-picked-honey-crisp-apple/p/itmefzvdfdh4e3e6?pid=BWSEFZVDGSHZAFFH&affid=siddarthk,http://img.fkcdn.com/image/body-wash/f/f/h/fresh-picked-honey-crisp-apple-bath-body-works-473-fresh-picked-200x200-imaefzrshekdzykh.jpeg,Health and Beauty>Bath and Spa>Body Wash,1499.0,949.0,949.0,false,BWSEFZVDGSHZAFFH,BWSEFZVDGSHZAFFH
Flipkart,,The Body Shop Raspberry Ripple Bath & Shower Gel(250 ml),,The Body Shop,http://dl.flipkart.com/dl/body-shop-raspberry-ripple-bath-shower-gel/p/itmdtjrfkewhx33g?pid=BWSDTJPZRDVSP59V&affid=siddarthk,http://img.fkcdn.com/image/body-wash/5/9/v/the-body-shop-250-raspberry-ripple-bath-shower-gel-200x200-imadu8y4h2j5hcvf.jpeg,Health and Beauty>Bath and Spa>Body Wash,395.0,395.0,395.0,false,BWSDTJPZRDVSP59V,BWSDTJPZRDVSP59V
Flipkart,,Victoria's Secret Lost in Fantasy Daily Body Wash(250 ml),Enter a world with mesmerising unicorns and enchanting fireflies dotting the velvety night sky with this special creation by Victoria’s Secret. The Victoria's Secret Lost in Fantasy Daily Body Wash is made especially to fulfil every man and woman’s deepest fantasy. This organic Lost in Fantasy Daily Body Wash has delicate notes of Brazilian orchid interwoven with luscious kiwis for a thoroughly exotic bathing experience. Gently cleanse your skin in the cool waters of a secluded lagoon while the natural Aloe Vera in this Victoria’s Secret Body Wash soothes your skin and the antioxidant Vitamin E heals skin that has been exposed to the sweet sun rays for too long. Step out with satiny smooth skin that is irresistible to touch and delight your senses. So slip the Victoria's Secret Lost in Fantasy Body Wash into your travel bag and look dazzling on that tropical vacation. Directions for Use Pour the required amount of this Daily Body Wash on a wet loofah and lather well. Gently apply all over the body. Rinse off.,Victoria's Secret,http://dl.flipkart.com/dl/victoria-s-secret-lost-fantasy-daily-body-wash/p/itmd9zfrddwfnpyh?pid=BWSD9ZFQQYGNPHGF&affid=siddarthk,http://img.fkcdn.com/image/body-wash/h/g/f/victoria-s-secret-250-lost-in-fantasy-daily-body-wash-200x200-imad9z2yqnghmfbe.jpeg,Health and Beauty>Bath and Spa>Body Wash,1099.0,1099.0,1099.0,false,BWSD9ZFQQYGNPHGF,BWSD9ZFQQYGNPHGF
Flipkart,,Victoria's Secret Violet & Jasmine Softening Body Wash(200 ml),,Victoria's Secret,http://dl.flipkart.com/dl/victoria-s-secret-violet-jasmine-softening-body-wash/p/itmdwcuwpggjntke?pid=BWSDWCTVSDWZGKQG&affid=siddarthk,http://img.fkcdn.com/image/body-wash/k/q/g/victoria-s-secret-200-violet-jasmine-softening-body-wash-200x200-imadwetygye3ghc8.jpeg,Health and Beauty>Bath and Spa>Body Wash,1099.0,1099.0,1099.0,false,BWSDWCTVSDWZGKQG,BWSDWCTVSDWZGKQG
Flipkart,,Bath & Body Works Fresh Picked Heirloom Cranberries(473 ml),"Fresh, Juicy Heirloom Cranberries Harvested At The Peak Of Ripeness",Bath & Body Works,http://dl.flipkart.com/dl/bath-body-works-fresh-picked-heirloom-cranberries/p/itmefkn7qvgg5gvs?pid=BWSEFKN7DWJYNXGG&affid=siddarthk,http://img.fkcdn.com/image/body-wash/x/g/g/cranberries-bath-body-works-473-fresh-picked-heirloom-200x200-imaefjhp3vnbnjbq.jpeg,Health and Beauty>Bath and Spa>Body Wash,1499.0,949.0,949.0,false,BWSEFKN7DWJYNXGG,BWSEFKN7DWJYNXGG
Flipkart,,Victoria's Secret Secret Charm Daily Body Wash(250 ml),,Victoria's Secret,http://dl.flipkart.com/dl/victoria-s-secret-charm-daily-body-wash/p/itme2njv6ntpwtyk?pid=BWSE2NJVAMZPHGCU&affid=siddarthk,http://img.fkcdn.com/image/body-wash/g/c/u/victoria-s-secret-250-secret-charm-daily-body-wash-200x200-imae2nn4urhdvyrx.jpeg,Health and Beauty>Bath and Spa>Body Wash,1500.0,899.0,899.0,true,BWSE2NJVAMZPHGCU,BWSE2NJVAMZPHGCU
Flipkart,,Victoria's Secret Beauty Rush Grapesicle Body Glimmer Wash(250 ml),,Victoria's Secret,http://dl.flipkart.com/dl/victoria-s-secret-beauty-rush-grapesicle-body-glimmer-wash/p/itmey8thz7hache9?pid=BWSEY8TG3YA4SQVA&affid=siddarthk,http://img.fkcdn.com/image/body-wash/q/v/a/victoria-s-secret-250-beauty-rush-grapesicle-body-glimmer-wash-200x200-imaeybffjcgecpp7.jpeg,Health and Beauty>Bath and Spa>Body Wash,1299.0,1299.0,1299.0,false,BWSEY8TG3YA4SQVA,BWSEY8TG3YA4SQVA
Flipkart,,Adidas Intense Touch Shower Gel(250 ml),Walk out of the shower with a freshness that you have never experienced before with the Intense Touch Shower Gel from Adidas. Enriched with Marine Salts The gel has been infused with salts straight from the ocean to capture the freshness straight from the source itself. Unique Invigorating Fragrance A strong yet soothing fragrance the perks your senses up comes with the shower gel. Textured Grip The bottle comes with a grip that is textured to ensure that it does not slip from your grip when you’re in the shower. Developed with Athletes The formulation has been developed in coalition with athletes to ensure the highest range of freshness and body odor coverage possible.,Adidas,http://dl.flipkart.com/dl/adidas-intense-touch-shower-gel/p/itmdbz3ttpuesssv?pid=BWSDBZ3ND6ASSBND&affid=siddarthk,http://img.fkcdn.com/image/body-wash/b/n/d/adidas-250-intense-touch-shower-gel-200x200-imadgyhv9spekfex.jpeg,Health and Beauty>Bath and Spa>Body Wash,175.0,175.0,175.0,false,BWSDBZ3ND6ASSBND,BWSDBZ3ND6ASSBND
Flipkart,,Olay Daily Moisture Quench Body Wash(400 ml),"Treat yourself to a nice foamy bath and moisturise your body with the Olay Body wash-Quench. Provides 24-hour Moisturization The Quench Body wash is based on the ribbon technology that cleanses and provides 24-hour moisturization leaving your body feeling soft and smooth. Cleanses Skin of Dirt, Oil and Impurities The body wash cleanses the dirt, impurities and removes excess oil from the skin to give a healthy and soft skin that irresistible to touch. Quenchs dry skin The Olay’s Quench Body Wash gives a luxury rich lather that nourishes your skin and quenches dry and stretchy skin. 2 times Combined Cleansers The body wash contains a dual cleansing effect that deep cleanses and retains the natural moisture of the skin.",Olay,http://dl.flipkart.com/dl/olay-daily-moisture-quench-body-wash/p/itmdaa9u8y68hszf?pid=BWSDAA9PC8TGXA5R&affid=siddarthk,http://img.fkcdn.com/image/body-wash/a/5/r/olay-354-body-wash-quench-200x200-imaey7gb6tva89u9.jpeg,Health and Beauty>Bath and Spa>Body Wash,269.0,269.0,269.0,false,BWSDAA9PC8TGXA5R,BWSDAA9PC8TGXA5R
Flipkart,,Vedic Line Lime Shower Gel,,Vedic Line,http://dl.flipkart.com/dl/vedic-line-lime-shower-gel/p/itmdapzftnvkkfse?pid=BWSDAPMHYGJYNPSC&affid=siddarthk,http://img.fkcdn.com/image/body-wash/p/s/c/vedic-line-500-lime-shower-gel-200x200-imadaps4ppcxbqs6.jpeg,Health and Beauty>Bath and Spa>Body Wash,425.0,425.0,425.0,false,BWSDAPMHYGJYNPSC,BWSDAPMHYGJYNPSC
Flipkart,,Molton Brown Blissful Templetree Moisture Bath & Shower Gel(300 ml),,Molton Brown,http://dl.flipkart.com/dl/molton-brown-blissful-templetree-moisture-bath-shower-gel/p/itmdshzpzwzvxexh?pid=BWSDRG2B3GJFWNVU&affid=siddarthk,http://img.fkcdn.com/image/body-wash/n/v/u/lb024-molton-brown-300-blissful-templetree-moisture-bath-shower-200x200-imadsm24ghdhggfr.jpeg,Health and Beauty>Bath and Spa>Body Wash,1860.0,1860.0,1860.0,false,BWSDRG2B3GJFWNVU,BWSDRG2B3GJFWNVU
Flipkart,,Victoria's Secret Mango Temptation Daily Body Wash(250 ml),"Pure delight to the senses, this Mango Temptation Body Wash is a fruity tease! Luscious and exotic, this Victoria's Secret Body Wash makes your skin soft and you sexy! Tempting, Fruity Fragrance Redolent of a tropical vacation, this body wash has the delicious fragrance of exotic mango nectar and hibiscus. Refreshing Cleansing The rich lather gently cleanses your skin of impurities and makes you feel invigorated. Skin Feels Soft, Smooth and Touchable The formula is enriched with soothing aloe vera and vitamin E that condition your skin making it feel touchably smooth and soft after a shower.",Victoria's Secret,http://dl.flipkart.com/dl/victoria-s-secret-mango-temptation-daily-body-wash/p/itmd9zfrrcevpdd6?pid=BWSD9ZFQRABZFZNM&affid=siddarthk,http://img.fkcdn.com/image/body-wash/z/n/m/victoria-s-secret-250-mango-temptation-daily-body-wash-200x200-imad9z2y3snjqp28.jpeg,Health and Beauty>Bath and Spa>Body Wash,1250.0,999.0,999.0,true,BWSD9ZFQRABZFZNM,BWSD9ZFQRABZFZNM
Flipkart,,Organic Surge Tropical Bergamot Shower Gel(250 ml),,Organic Surge,http://dl.flipkart.com/dl/organic-surge-tropical-bergamot-shower-gel/p/itmd9asqdne3znas?pid=BWSD93WKJHZVWYKM&affid=siddarthk,http://img.fkcdn.com/image/body-wash/y/k/m/organic-surge-250-tropical-bergamot-shower-gel-200x200-imaey7gznqqt2xfv.jpeg,Health and Beauty>Bath and Spa>Body Wash,535.0,535.0,535.0,false,BWSD93WKJHZVWYKM,BWSD93WKJHZVWYKM
Flipkart,,Wiz Premium Bodywash Paradise Apple,"Wiz Body Wash is the first step in skin care forsoft, smooth and refreshed skin. It?s uniquefragrances leave your skin feeling fresh longer. Itis a premium rich lathering Body Wash withmild, yet effective skin cleaners, conditionersand moisturizing agents which smoothen andprotect skin and help maintain its natural pHbalance.",Wiz,http://dl.flipkart.com/dl/wiz-premium-bodywash-paradise-apple/p/itmefdzgfttjdbqs?pid=BWSEFDZGYJBZQHMG&affid=siddarthk,http://img.fkcdn.com/image/body-wash/h/m/g/wiz-450-premium-bodywash-paradise-apple-200x200-imaefczwnhumqwg6.jpeg,Health and Beauty>Bath and Spa>Body Wash,325.0,300.0,300.0,false,BWSEFDZGYJBZQHMG,BWSEFDZGYJBZQHMG
Flipkart,,Olay Body Wash - Ultra Moisture,"Olay Body Wash is formulated to keep your skin soft and supple. With regular use, this Body wash improves the conditon of skin over time and repairs it. This body wash provides an all day moisturization to the skin and deeply nourishes it. Features--Comes from the house of OlaySoft on SkinCompletely Safe for skinUltra Moisture - Body Wash -Ultra Moisture",Olay,http://dl.flipkart.com/dl/olay-body-wash-ultra-moisture/p/itmey7ma86b3ydsj?pid=BWSEY7MAKJE3GHY5&affid=siddarthk,http://img.fkcdn.com/image/body-wash/h/y/5/olay-400-body-wash-ultra-moisture-200x200-imaey7cz5fbwmypq.jpeg,Health and Beauty>Bath and Spa>Body Wash,269.0,269.0,269.0,false,BWSEY7MAKJE3GHY5,BWSEY7MAKJE3GHY5
Flipkart,,Baylis & Harding Wild Rose & Raspberry Body Wash in Sequin Bag,"Sometimes it is worth going that extra mile to give yourself the treat that you deserve. So discover a luxury and refreshing bath every day with this body wash from Baylis & Harding. Feel fresh and clean all day with this body wash. It is must-have for anyone with a sense of class and style. Fruity and Floral Fragrance With fruity and floral fragrance, this body wash keeps you fresh and refreshing all day. With a blend of wild rose and raspberry, the smell of this body wash makes you feel good. It pampers your skin with its moisturizing contents. Sequined Bottle Bag This body wash is wrapped in a sequined bottle bag and could be a great gifting option too. With an attractive sequin bag, it can be a great addition to any bathroom.",Baylis & Harding,http://dl.flipkart.com/dl/baylis-harding-wild-rose-raspberry-body-wash-sequin-bag/p/itmdjbhwa89hyhh6?pid=BWSDJBHVZKNYHYEV&affid=siddarthk,http://img.fkcdn.com/image/body-wash/y/e/v/baylis-harding-750-wild-rose-raspberry-body-wash-in-sequin-bag-200x200-imadjbqeu8bgzxgm.jpeg,Health and Beauty>Bath and Spa>Body Wash,649.0,649.0,649.0,false,BWSDJBHVZKNYHYEV,BWSDJBHVZKNYHYEV
Flipkart,,Original Source Black Mint Shower Gel(250 ml),"Sometimes Nothing Will Work To Wake You, And You Need The Most Potent Shower Gel We Possess. Black Mint Shower Gel Has Enough Tingle To Take Out A Rugby Team, So Take Care To Use When Your Body Needs Super Hardcore Natural Stimulation. Employ The Black Magic Of The Black Mint With Caution.",Original Source,http://dl.flipkart.com/dl/original-source-black-mint-shower-gel/p/itme8f5rg6pasmsj?pid=BWSE8F5RRFTCNBDU&affid=siddarthk,http://img.fkcdn.com/image/body-wash/b/d/u/ols007-original-source-250-black-mint-shower-gel-1100x1100-imae8yuvhhwzthr7.jpeg,Health and Beauty>Bath and Spa>Body Wash,225.0,225.0,225.0,false,BWSE8F5RRFTCNBDU,BWSE8F5RRFTCNBDU
Flipkart,,Olay Ultra Moisture Moisturizing Body Wash With Shea Butter(400 ml),,Olay,http://dl.flipkart.com/dl/olay-ultra-moisture-moisturizing-body-wash-shea-butter/p/itme3kvtnhxwg2xr?pid=BWSE3KVTHYPHBUFX&affid=siddarthk,http://img.fkcdn.com/image/body-wash/u/f/x/olay-400-ultra-moisture-moisturizing-body-wash-with-shea-butter-200x200-imae3kmbhyxmsv4v.jpeg,Health and Beauty>Bath and Spa>Body Wash,269.0,269.0,269.0,false,BWSE3KVTHYPHBUFX,BWSE3KVTHYPHBUFX
Flipkart,,Olay Ultra Moisture Body Wash with Shea Butter,"Ultra Moisture Moisturize even the driest skin with continued use of Olay reg Ultra Moisture Body Wash. Olay Ultra Moisture Body Wash leaves your skin feeling soft and smooth after every shower. And thanks to a jar of Olay moisturizers in every bottle the condition of your skin will visibly improve over time. One bottle even moisturizes better than 7 bottles of the leading body wash. Soothe your dry dull skin with moisturizing Olay Ultra Moisture Body Wash- All-day moisture for soft healthy-looking skin. Product Features Cleanses skin gently and moisturizes to help keep skin nourished Moisturizes better than 7 bottles of the leading body wash Great for dry or extra-dry skin dull skin rough knees and elbows After 1 Use- Cleans and visibly conditions skin 1 Week- Moisturizes skin to be lush and nourished 1 Bottle- Makes skin healthy-looking and provides long-lasting moistureOlay Ultra Moisture Moisturizing Body WashTwo Ways to Love This Olay-Body Wash - Rich lather for a gentle clean Moisturizing Bar Soap - For a deep cleanse in every shower Find Your Favorite Olay Moisturizing Body Wash-Ultra Moisture - Moisturizes better than 7 bottles of the leading body wash Age Defying - Younger-looking skin after just one use Daily Moisture Quench - Visibly replenishes skin s moisture after just one use. What Are You Looking for From Your Body Wash Scent- Try Olay Cleansing body washes. Moisture- Try Olay Moisture body washes. Extra Moisture- Try Olay 2-in-1 Advanced Ribbons body washes. Moisture amp Scent- Try Olay 2-in-1 Essential Oils body washes. Did You Know Dry Skin Remedies in Your Shower. Experiencing dry itchy skin The cause could be lurking right in your own bathroom. P amp G reg beauty scientists conducted a survey and found that taking frequent hot showers and baths is one of the leading factors of dry skin. So what is a dry-skin remedy in the shower Reach for moisture-enriched body washes and beauty bars which have more moisture than regular soap. These can help you battle dry skin as you cleanse. Olay Product and Ingredient Safety PromiseOlay is committed to providing safe products to our consumers. Ensuring the safety of our products is a responsibility that Olay takes very seriously. In Fact-Each year Olay conducts over 400000 safety and quality tests to ensure an excellent experience for women around the world. All Olay ingredients must be substantiated for safety over a lifetime of intended use prior to manufacturing. As an example we conducted over 250 separate safety evaluations for new Olay product formulations in the last year alone. More than 1000 Procter amp Gamble employees globally work full-time to ensure the safety and regulatory compliance of our products and operations including more than 500 employees who work directly on product safety. Water Petrolatum Sodium Trideceth Sulfate Sodium Lauryl Sulfate Sodium Chloride Sodium Lauroamphoacetate Trideceth-3 Fragrance Citric Acid Guar Hydroxypropyltrimonium Chloride Acrylonitrile Methacrylonitrile Methyl Methacrylate Copolymer Mineral Oil Xanthan Gum Sodium Benzoate PEG-90M Disodium EDTA Sodium Hydroxide Isopentane Butyrospermum Parkii (Shea Butter), Glycerin Tocopheryl Acetate Panthenol Methylchloroisothiazolinone Methylisothiazolinone, Specification - In the box - 13. 5 fl oz (400 ml), Title - Olay Ultra Moisture Body Wash with Shea Butter 13. 5 fl oz (400 ml).",Olay,http://dl.flipkart.com/dl/olay-ultra-moisture-body-wash-shea-butter/p/itmdnfbxvgzhjr7f?pid=BWSDNFBW5TU76YFP&affid=siddarthk,http://img.fkcdn.com/image/body-wash/y/f/p/olay-400-ultra-moisture-body-wash-with-shea-butter-200x200-imadqsq2fhwsyhxp.jpeg,Health and Beauty>Bath and Spa>Body Wash,269.0,269.0,269.0,false,BWSDNFBW5TU76YFP,BWSDNFBW5TU76YFP
Flipkart,,Bath & Body Works Warm Vanilla Sugar(88 ml),,Bath & Body Works,http://dl.flipkart.com/dl/bath-body-works-warm-vanilla-sugar/p/itme4nptufe7xagb?pid=BWSE4NPTCGCCUZHZ&affid=siddarthk,http://img.fkcdn.com/image/body-wash/z/h/z/1-bath-body-works-88-warm-vanilla-sugar-200x200-imae4mqhuugyh7ey.jpeg,Health and Beauty>Bath and Spa>Body Wash,1399.0,848.0,943.0,false,BWSE4NPTCGCCUZHZ,BWSE4NPTCGCCUZHZ
Flipkart,,Plum Green Tea Renewal Shower Gel(200 ml),,Plum,http://dl.flipkart.com/dl/plum-green-tea-renewal-shower-gel/p/itme2fk9btfzvnh9?pid=BWSE2FK9YTGK8GYH&affid=siddarthk,http://img.fkcdn.com/image/body-wash/g/y/h/gt-rsg-plum-200-green-tea-renewal-shower-gel-200x200-imae2ex5vwgggeje.jpeg,Health and Beauty>Bath and Spa>Body Wash,370.0,370.0,370.0,true,BWSE2FK9YTGK8GYH,BWSE2FK9YTGK8GYH
Flipkart,,Baylis & Harding Jojoba Silk & Almond Oil Sensuous Bath Foam,"Bubbly treat for bathers in a generous bottle. Relax and rehydrate at the end of a hectic day with the sensuous scents contained in our generous 750ml Bath Foam. Immerse yourself in a bath full of bountiful bubbles, which will pop to release the sweet, nutty scent of Jojoba and Almond. The essential oils of these plants and the addition of Silk to the mix, will soothe and caress even the most exhausted body to banish stresses and strains. An indulgent treat.",Baylis & Harding,http://dl.flipkart.com/dl/baylis-harding-jojoba-silk-almond-oil-sensuous-bath-foam/p/itmdzd3agrxn2jvk?pid=BWSDZD388BRRGPHE&affid=siddarthk,http://img.fkcdn.com/image/body-wash/p/h/e/baylis-harding-750-jojoba-silk-almond-oil-sensuous-bath-foam-200x200-imadzdppcxuzg49t.jpeg,Health and Beauty>Bath and Spa>Body Wash,699.0,699.0,699.0,false,BWSDZD388BRRGPHE,BWSDZD388BRRGPHE
Flipkart,,Baylis & Harding Jojoba Silk & Almond Oil Luxurious Shower Creme,"Sophisticated Hand Wash with added moisturisers. Bring a touch of luxury to your daily hand washing routine with this lightly perfumed and classy 500ml Hand Wash. The natural essential oils of Almond and Jojoba combine with Silk and added moisturisers to create a creamy consistency, leaving hands silky smooth and beautifully scented. The pretty, pearlised bottle makes this a must have no self respecting sink should be without it.",Baylis & Harding,http://dl.flipkart.com/dl/baylis-harding-jojoba-silk-almond-oil-luxurious-shower-creme/p/itmdzd3a5g8uxjqa?pid=BWSDZD38PZHUXGWW&affid=siddarthk,http://img.fkcdn.com/image/body-wash/g/w/w/baylis-harding-750-jojoba-silk-almond-oil-luxurious-shower-creme-200x200-imadzdppzwg6xhxn.jpeg,Health and Beauty>Bath and Spa>Body Wash,699.0,699.0,699.0,false,BWSDZD38PZHUXGWW,BWSDZD38PZHUXGWW
Flipkart,,Fiama Di Wills Men Aqua Sport Revitalizing Shower Gel(200 ml),,Fiama Di Wills,http://dl.flipkart.com/dl/fiama-di-wills-men-aqua-sport-revitalizing-shower-gel/p/itmey9t4hpm4cqag?pid=BWSEY9T2N6VSSYXG&affid=siddarthk,http://img.fkcdn.com/image/body-wash/y/x/g/fiama-di-wills-200-men-aqua-sport-revitalizing-shower-gel-200x200-imaeyf6pagmycfze.jpeg,Health and Beauty>Bath and Spa>Body Wash,160.0,160.0,160.0,false,BWSEY9T2N6VSSYXG,BWSEY9T2N6VSSYXG
