PartnerName,Id,Title,Description,Brand,Link,ImageLink,CategoryName,Mrp,OfferPrice,EffectivePrice,Availability,PartnerIdFromUrl,PartnerIdFromDb
Flipkart,,PRETTY KRAFTS Red Color Rexine Makeup cum Vanity Box(Red),"Now carry your charm wherever you go and look sassy while doing so! PrettyKrafts brings a red colored foldable makeup box which is designed for keeping all your needful items well organized and handy. When unrolled, this fold up makeup box reveals multiple compartments and zipper pockets that provide ample space for all your cosmetics and stuff. Crafted from Rexinee, it is durable with smooth finish and has good quality plastic with a Velcro closure that keeps everything safe. Furthermore, the polka dots all over add to its appeal. The versatile size of this hangable box is just perfect for extended vacations or for a quick weekend getaway. Product Dimention (LXBXH) in cm 23X7X47 PROBS WHICH ARE USED IN IMAGE ARE NOT INCLUDED WITH PRODUCT/SALES PACKAGE.",PRETTY KRAFTS,http://dl.flipkart.com/dl/pretty-krafts-red-color-rexine-makeup-cum-vanity-box/p/itmejpz28xv5ehaf?pid=VANEJPZ2HUEPKZQX&affid=siddarthk,http://img.fkcdn.com/image/vanity-box/z/q/x/p130-prettykrafts-red-color-rexine-200x200-imaejzt7pxa84me3.jpeg,Health and Beauty>Makeup>Vanity Boxes,398.0,349.0,349.0,true,VANEJPZ2HUEPKZQX,VANEJPZ2HUEPKZQX
Flipkart,,PRETTY KRAFTS Cosmetic box Makeup Vanity Box(Brown),"This Vanity Kit From Pretty Krafts Comes With Bangle Cups Beautifully Designed. Ideal For Storage Of Bangles.It Can Be Used For Gift. Its Handy Product, Good Storage,Light Weight, Are Key Factors Of This Product. It Is Very Usefull While Travelling To Keep Your Makeup Material And Bangles, It Has Saparate Space For Clutches Clips Etc.",PRETTY KRAFTS,http://dl.flipkart.com/dl/pretty-krafts-cosmetic-box-makeup-vanity/p/itme8ttdgcmfvfr6?pid=VANE8TTDZZWXP2FR&affid=siddarthk,http://img.fkcdn.com/image/vanity-box/2/f/r/p116-pretty-krafts-cosmetic-box-200x200-imae8gdny8hkwqry.jpeg,Health and Beauty>Makeup>Vanity Boxes,498.0,449.0,449.0,false,VANE8TTDZZWXP2FR,VANE8TTDZZWXP2FR
Flipkart,,PRETTY KRAFTS Cosmetic Kit Makeup Vanity Box(Blue),Top Zipped For Easy Access. Full Transparent For Clear View. Useful In Carrying A Lot Of Vanities In One Go.,PRETTY KRAFTS,http://dl.flipkart.com/dl/pretty-krafts-cosmetic-kit-makeup-vanity-box/p/itmeenkm7ukfgzhg?pid=VANE8TTECBTPFCNG&affid=siddarthk,http://img.fkcdn.com/image/vanity-box/c/n/g/2814-pretty-krafts-cosmetic-kit-200x200-imae8tyebazfsxf3.jpeg,Health and Beauty>Makeup>Vanity Boxes,399.0,324.0,324.0,false,VANE8TTECBTPFCNG,VANE8TTECBTPFCNG
Flipkart,,PRETTY KRAFTS B1109 Jewellery Kit Vanity Box(Blue),,PRETTY KRAFTS,http://dl.flipkart.com/dl/pretty-krafts-b1109-jewellery-kit-vanity-box/p/itmeggejwak8ext3?pid=VANEGGEJHYDYVTKM&affid=siddarthk,http://img.fkcdn.com/image/vanity-box/t/k/m/b1109-blue-prettykrafts-b1109-200x200-imaef37b7y4przuk.jpeg,Home Decor>Home Utilities>Utility Boxes,300.0,239.0,239.0,true,VANEGGEJHYDYVTKM,VANEGGEJHYDYVTKM
Flipkart,,Pretty Krafts 2 Piece Travel Case Maroon Bangles Organiser Vanity Box(Maroon),"PrettyKrafts Bangle Box 1 Roll (2 piece), Travel Bangle case, Bangles Organiser_Maroon",Pretty Krafts,http://dl.flipkart.com/dl/pretty-krafts-2-piece-travel-case-maroon-bangles-organiser-vanity-box/p/itmez2hfrwpjfwrw?pid=VANENWH2W2SZZYUN&affid=siddarthk,http://img.fkcdn.com/image/vanity-box/y/u/n/n1166-na-2-piece-travel-case-maroon-200x200-imaemyg5a9nqcdcy.jpeg,Health and Beauty>Makeup>Vanity Boxes,398.0,250.0,250.0,false,VANENWH2W2SZZYUN,VANENWH2W2SZZYUN
Flipkart,,PRETTY KRAFTS Three Roll blue Storage Makeup Vanity Box(Blue),"Tired Of Finding Ways Of Keeping Bangles Safe During Traveling? Does Your Bangles Steal A Lot Of Space From Your Dressing Table? Prettykrafts'S Range Of Bangle Boxes Provides Safe And Value For Money Solution To Such Problems. We Offer An Ingenious Way To Keep Your Bangles Organised, This Bangle Box With 3 Rolls Shall Help You Find Extra Space On Your Dressing Table And Save You Some Precious Time You Would Otherwise Waste Sorting Through Your Precious Lot Of Bangles. And While On Travel This Box Shall Be Simple Indispensable.",PRETTY KRAFTS,http://dl.flipkart.com/dl/pretty-krafts-three-roll-blue-storage-makeup-vanity-box/p/itme8ncejxujv4b7?pid=VANE8NCEKM8FT5ZM&affid=siddarthk,http://img.fkcdn.com/image/vanity-box/5/z/m/2649-pretty-krafts-three-roll-blue-storage-200x200-imae8zyhz2yzntcg.jpeg,Home Decor>Home Utilities>Utility Boxes,399.0,358.0,358.0,true,VANE8NCEKM8FT5ZM,VANE8NCEKM8FT5ZM
Flipkart,,PRETTY KRAFTS Cosmetic Kit Makeup Vanity Box(Maroon),Maintain Your Precious Makeup Products In An Organised Manner With The Help Of This Three In One Vanity Bags Set. Golden Outline Throughout The Transparent Bag Looks So Amazing. So Grab This Creative Set Of Vanity Bags That Will Give You Full Comfort By Organising Your Makeup Products Properly.,PRETTY KRAFTS,http://dl.flipkart.com/dl/pretty-krafts-cosmetic-kit-makeup-vanity-box/p/itmeenkn2fyysjfq?pid=VANE8TTEVNVZG5NH&affid=siddarthk,http://img.fkcdn.com/image/vanity-box/5/n/h/3117-pretty-krafts-cosmetic-kit-200x200-imae8tyembdec9rf.jpeg,Health and Beauty>Makeup>Vanity Boxes,449.0,449.0,449.0,true,VANE8TTEVNVZG5NH,VANE8TTEVNVZG5NH
Flipkart,,Pretty Krafts Complete Satin 14 Pcs Marriage Bridal Gift Set Pink Gift set Vanity Box(Pink),"PrettyKrafts Complete Bridal Set Satin, 14 pcs Marriage set_Bridal Gift Set_Pink",Pretty Krafts,http://dl.flipkart.com/dl/pretty-krafts-complete-satin-14-pcs-marriage-bridal-gift-set-pink-vanity-box/p/itmez2m5yfm9gwcv?pid=VANENWKYMQYHRYR5&affid=siddarthk,http://img.fkcdn.com/image/vanity-box/y/r/5/p1163-na-complete-satin-14-pcs-marriage-bridal-gift-set-pink-200x200-imaemyg5tuehhdwn.jpeg,Health and Beauty>Makeup>Vanity Boxes,2549.0,1700.0,1700.0,true,VANENWKYMQYHRYR5,VANENWKYMQYHRYR5
Flipkart,,PRETTY KRAFTS Three Roll golden Storage Makeup Vanity Box(Golden),"Tired Of Finding Ways Of Keeping Bangles Safe During Traveling? Does Your Bangles Steal A Lot Of Space From Your Dressing Table? Prettykrafts'S Range Of Bangle Boxes Provides Safe And Value For Money Solution To Such Problems. We Offer An Ingenious Way To Keep Your Bangles Organised, This Bangle Box With 3 Rolls Shall Help You Find Extra Space On Your Dressing Table And Save You Some Precious Time You Would Otherwise Waste Sorting Through Your Precious Lot Of Bangles. And While On Travel This Box Shall Be Simple Indispensable.",PRETTY KRAFTS,http://dl.flipkart.com/dl/pretty-krafts-three-roll-golden-storage-makeup-vanity-box/p/itme8ncedya6zjun?pid=VANE8NCEH9833HRM&affid=siddarthk,http://img.fkcdn.com/image/vanity-box/h/r/m/2649-pretty-krafts-three-roll-golden-storage-200x200-imae8qffkwjbyhfn.jpeg,Home Decor>Home Utilities>Utility Boxes,399.0,357.0,357.0,true,VANE8NCEH9833HRM,VANE8NCEH9833HRM
Flipkart,,PRETTY KRAFTS Cosmetic Box Makeup Vanity Box(Maroon),"A Unique Trendy And Compact Make Up Kit With Traditional Ethnic Prints On The Exterior And Layered With Plastic, That Make Cleaning This Bag Extremely Easy. A Beautiful Space Saving Option, That Helps You Eliminate The Clutter On Your Dressing Table And Shall Prove To Be Extremely Worthwhile During Travel.",PRETTY KRAFTS,http://dl.flipkart.com/dl/pretty-krafts-cosmetic-box-makeup-vanity/p/itmeenkmndqzzjf9?pid=VANE8TTDEBRZDQTW&affid=siddarthk,http://img.fkcdn.com/image/vanity-box/q/t/w/7662-pretty-krafts-cosmetic-box-200x200-imae8tyedzh4fygw.jpeg,Health and Beauty>Makeup>Vanity Boxes,349.0,275.0,275.0,true,VANE8TTDEBRZDQTW,VANE8TTDEBRZDQTW
Flipkart,,"Mpkart Double Line Premium Care, Carry, Jewellery Vanity Box(Maroon)",,Mpkart,http://dl.flipkart.com/dl/mpkart-double-line-premium-care-carry-jewellery-vanity-box/p/itmechzyzqysehjp?pid=VANECHZYWAGAGMWG&affid=siddarthk,http://img.fkcdn.com/image/vanity-box/m/w/g/cm21-mpkart-double-line-premium-200x200-imaech2hn2yggswf.jpeg,Home Decor>Home Utilities>Utility Boxes>Jewellery Boxes,399.0,249.0,249.0,false,VANECHZYWAGAGMWG,VANECHZYWAGAGMWG
Flipkart,,"Mpkart Double line Care, Carry, Jewellery Vanity Box(Maroon)",,Mpkart,http://dl.flipkart.com/dl/mpkart-double-line-care-carry-jewellery-vanity-box/p/itmechzyfgjgezsc?pid=VANECHZYETKEBY9Z&affid=siddarthk,http://img.fkcdn.com/image/vanity-box/w/g/7/cm16-mpkart-two-line-200x200-imaech2ktyrvx2xj.jpeg,Home Decor>Home Utilities>Utility Boxes>Jewellery Boxes,499.0,349.0,349.0,false,VANECHZYETKEBY9Z,VANECHZYETKEBY9Z
Flipkart,,"Mpkart Softy Care, Carry, Jewellery Vanity Box(Maroon)",,Mpkart,http://dl.flipkart.com/dl/mpkart-softy-care-carry-jewellery-vanity-box/p/itmechzy8vp7ghag?pid=VANECHZYMZPUJUWH&affid=siddarthk,http://img.fkcdn.com/image/vanity-box/u/w/h/cm32-mpkart-softy-200x200-imaech2khugjep6w.jpeg,Health and Beauty>Makeup>Vanity Boxes,529.0,329.0,329.0,true,VANECHZYMZPUJUWH,VANECHZYMZPUJUWH
Flipkart,,"Mpkart Four Line Premium Care, Carry, Jewellery Vanity Box(Maroon)",,Mpkart,http://dl.flipkart.com/dl/mpkart-four-line-premium-care-carry-jewellery-vanity-box/p/itmechzycv4hn47t?pid=VANECHZY9REFMPGT&affid=siddarthk,http://img.fkcdn.com/image/vanity-box/p/g/t/cm22-mpkart-four-line-premium-200x200-imaech2ktzjtfutd.jpeg,Home Decor>Home Utilities>Utility Boxes>Jewellery Boxes,529.0,359.0,359.0,false,VANECHZY9REFMPGT,VANECHZY9REFMPGT
Flipkart,,Riddhi Siddhi Exclusive Organizer Vanity Box(Clear),,Riddhi Siddhi,http://dl.flipkart.com/dl/riddhi-siddhi-exclusive-organizer-vanity-box/p/itmek6b6kgmgpxca?pid=VANEK6B6ABZGFVNK&affid=siddarthk,http://img.fkcdn.com/image/vanity-box/v/n/k/transparent-1-riddhi-siddhi-exclusive-200x200-imaejvhwk5herdab.jpeg,Health and Beauty>Makeup>Vanity Boxes,999.0,749.0,749.0,true,VANEK6B6ABZGFVNK,VANEK6B6ABZGFVNK
Flipkart,,Fashion Envoy Beautiful Love Drawer Box Makeup Vanity Box(Multicolor),,Fashion Envoy,http://dl.flipkart.com/dl/fashion-envoy-beautiful-love-drawer-box-makeup-vanity/p/itme5pp642hk4hs3?pid=VANE5PP63BAQMHFQ&affid=siddarthk,http://img.fkcdn.com/image/vanity-box/h/f/q/beautiful-love-drawer-box-03-fashion-envoy-beautiful-love-drawer-200x200-imae5m2wzvmzwzgj.jpeg,Health and Beauty>Makeup>Vanity Boxes,1079.0,849.0,849.0,false,VANE5PP63BAQMHFQ,VANE5PP63BAQMHFQ
Flipkart,,"Mpkart Softy Care, Carry, Jewellery Vanity Box(Red)",,Mpkart,http://dl.flipkart.com/dl/mpkart-softy-care-carry-jewellery-vanity-box/p/itmechzfepq9cdcd?pid=VANECHZYNNFEZ4GH&affid=siddarthk,http://img.fkcdn.com/image/vanity-box/4/g/h/cm33-mpkart-softy-200x200-imaech2kb8vhsdf4.jpeg,Health and Beauty>Makeup>Vanity Boxes,339.0,299.0,299.0,true,VANECHZYNNFEZ4GH,VANECHZYNNFEZ4GH
Flipkart,,"Mpkart Single Line Care, Carry, Jewellery Vanity Box(Maroon)",,Mpkart,http://dl.flipkart.com/dl/mpkart-single-line-care-carry-jewellery-vanity-box/p/itmechzyhugykvh7?pid=VANECHZYX647AR7Z&affid=siddarthk,http://img.fkcdn.com/image/vanity-box/r/7/z/cm15-mpkart-single-line-200x200-imaech2k9hg58ykb.jpeg,Home Decor>Home Utilities>Utility Boxes>Jewellery Boxes,299.0,199.0,199.0,false,VANECHZYX647AR7Z,VANECHZYX647AR7Z
Flipkart,,Fashion Envoy Two Tier Make up Box for Women Makeup Vanity Box(Multicolor),,Fashion Envoy,http://dl.flipkart.com/dl/fashion-envoy-two-tier-make-up-box-women-makeup-vanity/p/itme5pp6m64hhtzq?pid=VANE5PP69ANFFQEW&affid=siddarthk,http://img.fkcdn.com/image/vanity-box/q/e/w/two-tier-make-up-box-for-women-01-fashion-envoy-two-tier-make-up-200x200-imae5m2whspnbvfj.jpeg,Health and Beauty>Makeup>Vanity Boxes,944.0,699.0,699.0,false,VANE5PP69ANFFQEW,VANE5PP69ANFFQEW
Flipkart,,Hastkala Bastar art Multi purpose Vanity Box(Brown),'Hastkala' presents a multi purpose box with the Bastar Art theme. With 16 cms of length & breadth this box is a multi purpose one.Utility + decorative are its features while anti termite proof & durability are its USP's.The box has the Bastar art in brass fitted on the top.The walls of the box are done is fine self square brown finish.,Hastkala,http://dl.flipkart.com/dl/hastkala-bastar-art-multi-purpose-vanity-box/p/itmezgtb2zmgajby?pid=VANEZGTB7GZPAYYH&affid=siddarthk,http://img.fkcdn.com/image/vanity-box/y/y/h/027-hastkala-bastar-art-200x200-imaezfvfjtgjzunq.jpeg,Health and Beauty>Makeup>Vanity Boxes,1150.0,1050.0,1050.0,true,VANEZGTB7GZPAYYH,VANEZGTB7GZPAYYH
Flipkart,,Inventure Retail 360 Degrees Rotating Makeup Organizer Vanity Box(White),,Inventure Retail,http://dl.flipkart.com/dl/inventure-retail-360-degrees-rotating-makeup-organizer-vanity-box/p/itmezgr5gdzhz7jn?pid=VANEZGR5BZKZR3YG&affid=siddarthk,http://img.fkcdn.com/image/vanity-box/3/y/g/360dmo-inventure-retail-360-degrees-rotating-200x200-imaezeskzkab6yyq.jpeg,Health and Beauty>Makeup>Vanity Boxes,2899.0,899.0,899.0,true,VANEZGR5BZKZR3YG,VANEZGR5BZKZR3YG
Flipkart,,Cartoonpur Drawer Spice Jewellery Box Cabinet storage Vanity Box(Brown),,Cartoonpur,http://dl.flipkart.com/dl/cartoonpur-drawer-spice-jewellery-box-cabinet-storage-vanity/p/itmefe7pz4wvgf8u?pid=VANEFE7PQ3K765YC&affid=siddarthk,http://img.fkcdn.com/image/vanity-box/5/y/c/211s2-cartoonpur-drawer-spice-jewellery-box-cabinet-200x200-imaefnes3ufgfqgf.jpeg,Health and Beauty>Makeup>Vanity Boxes,1599.0,849.0,849.0,false,VANEFE7PQ3K765YC,VANEFE7PQ3K765YC
Flipkart,,Ermani Export Silver Metal 4 Rods Bangle Box Makeup Vanity Box(Silver),,Ermani Export,http://dl.flipkart.com/dl/ermani-export-silver-metal-4-rods-bangle-box-makeup-vanity/p/itmeejgd5wn47eyz?pid=VANEEJGDVDGZGACA&affid=siddarthk,http://img.fkcdn.com/image/vanity-box/a/c/a/v27-ermani-export-silver-metal-4-rods-bangle-box-200x200-imaeegbjqnfy5tqv.jpeg,Home Decor>Home Utilities>Utility Boxes,4499.0,1034.0,1149.0,true,VANEEJGDVDGZGACA,VANEEJGDVDGZGACA
Flipkart,,Ermani Export 3 Row Gold Bangle Box m Vanity Box(Gold),,Ermani Export,http://dl.flipkart.com/dl/ermani-export-3-row-gold-bangle-box-m-vanity/p/itmeejf5b94cdyrw?pid=VANEEJF5BGKHGTRW&affid=siddarthk,http://img.fkcdn.com/image/vanity-box/h/r/f/vb090-ermani-export-traditional-soft-satin-keeper-box-bag-3-rows-200x200-imaeeh8kzyskfyrp.jpeg,Home Decor>Home Utilities>Utility Boxes,3999.0,674.0,749.0,true,VANEEJF5BGKHGTRW,VANEEJF5BGKHGTRW
Flipkart,,Cartoonpur Ceramic Drawer Spice Jewellery Box Cabinet storage Vanity Box(Multicolor),,Cartoonpur,http://dl.flipkart.com/dl/cartoonpur-ceramic-drawer-spice-jewellery-box-cabinet-storage-vanity/p/itmefjkmb8yzkcz2?pid=VANEFJKMGGZ2ZUDD&affid=siddarthk,http://img.fkcdn.com/image/vanity-box/u/d/d/211s8-cartoonpur-ceramic-drawer-spice-jewellery-box-cabinet-200x200-imaefgtnt8yk5ccy.jpeg,Health and Beauty>Makeup>Vanity Boxes,599.0,249.0,249.0,false,VANEFJKMGGZ2ZUDD,VANEFJKMGGZ2ZUDD
Flipkart,,Cartoonpur Ceramic Drawer Spice Jewellery Box Cabinet storage Vanity Box(Multicolor),,Cartoonpur,http://dl.flipkart.com/dl/cartoonpur-ceramic-drawer-spice-jewellery-box-cabinet-storage-vanity/p/itmefjkmvbj8zsfm?pid=VANEFJKMNEGWMV6Z&affid=siddarthk,http://img.fkcdn.com/image/vanity-box/v/6/z/211s11-cartoonpur-ceramic-drawer-spice-jewellery-box-cabinet-200x200-imaefnsj9uewj9un.jpeg,Health and Beauty>Makeup>Vanity Boxes,499.0,250.0,250.0,false,VANEFJKMNEGWMV6Z,VANEFJKMNEGWMV6Z
Flipkart,,Nonch Le Embroided Jewellery Vanity Box(Green),The designer of our brand design this jewellery box which is made up of zari work on cloth crafted by hand artisan.Usage: - You can keep your precious item in the glorious and gaudy box. This can be used as a gift item.Disclaimer: - Product colour may slightly vary due to photographic lighting sources or your monitor settings.Fabric Content: - Zari work on cloth,Nonch Le,http://dl.flipkart.com/dl/nonch-le-embroided-jewellery-vanity-box/p/itmdygeg5xvtfcxw?pid=VANDYGEGSHPJPJHZ&affid=siddarthk,http://img.fkcdn.com/image/vanity-box/j/h/z/ncl001-nonch-le-embroided-200x200-imadyz6cby5y6spk.jpeg,Health and Beauty>Makeup>Vanity Boxes,699.0,296.0,329.0,false,VANDYGEGSHPJPJHZ,VANDYGEGSHPJPJHZ
Flipkart,,Nonch Le Designers Jewellery Vanity Box(Navy Blue),The designer of our brand design this jewellery box which is made up of zari work on cloth crafted by hand artisan.Usage: - You can keep your precious item in the glorious and gaudy box. This can be used as a gift item.Disclaimer: - Product colour may slightly vary due to photographic lighting sources or your monitor settings.Fabric Content: - Zari work on cloth,Nonch Le,http://dl.flipkart.com/dl/nonch-le-designers-jewellery-vanity-box/p/itme3uuhzzqz2x68?pid=VANE3UUHNTMYQDA4&affid=siddarthk,http://img.fkcdn.com/image/vanity-box/d/a/4/26jb-nonch-le-designers-200x200-imae3sdnuhy5hh3a.jpeg,Home Decor>Home Utilities>Utility Boxes>Jewellery Boxes,699.0,296.0,329.0,false,VANE3UUHNTMYQDA4,VANE3UUHNTMYQDA4
Flipkart,,Ermani Export Traditional 2 Rods Bangle Travel Case Designer Jewellery Boxe Bangle Care Vanity Box(Red),Exclusive 2 rod bangle Box In brocade with Heavy Transparent & hard board which helps to keep safe all your bangles. This product looks stylis.Ermani Export brings products for every woman who dreams of being unique and stylish. It offers incredible range of handbags and jewellery boxes for women. Their products are incomparable in terms of quality.,Ermani Export,http://dl.flipkart.com/dl/ermani-export-traditional2-rods-bangle-travel-case-designer-jewellery-boxe-care-vanity-box/p/itmehdhrhy7wmg4n?pid=VANEHDHRZGKANR9F&affid=siddarthk,http://img.fkcdn.com/image/vanity-box/v/u/p/bangle-box-111-krg-enterprises-2-rod-in-maroon-brocade-200x200-imaeg888y5rggsqd.jpeg,Health and Beauty>Makeup>Vanity Boxes,1599.0,349.0,349.0,true,VANEHDHRZGKANR9F,VANEHDHRZGKANR9F
Flipkart,,KRG ENTERPRISES Red Designer Bangle Box Vanity Box(Multicolor),Exclusive 2 bangle Box In brocade with Heavy Transparent & hard board which helps to keep safe all your bangles. This product looks stylish. Errmani Export brings products for every woman who dreams of being unique and stylish. It offers incredible range of handbags and jewellery boxes for women. Their products are incomparable in terms of quality.,KRG ENTERPRISES,http://dl.flipkart.com/dl/krg-enterprises-red-designer-bangle-box-vanity/p/itmegmfxfhqzxftu?pid=VANEGMFXYHQ4WMFG&affid=siddarthk,http://img.fkcdn.com/image/vanity-box/d/2/e/oc-3333-ocean-enterprises-quality-red-designer-bangle-box-200x200-imaeg883t9y2weeh.jpeg,Health and Beauty>Makeup>Vanity Boxes,1099.0,249.0,249.0,true,VANEGMFXYHQ4WMFG,VANEGMFXYHQ4WMFG
Flipkart,,KRG ENTERPRISES  Handmade Designer Of 4 Row Bangle Box Vanity Box(Multicolor),Exclusive 2 bangle Box In brocade with Heavy Transparent & hard board which helps to keep safe all your bangles. This product looks stylish. Errmani Export brings products for every woman who dreams of being unique and stylish. It offers incredible range of handbags and jewellery boxes for women. Their products are incomparable in terms of quality.,KRG ENTERPRISES,http://dl.flipkart.com/dl/krg-enterprises-handmade-designer-4-row-bangle-box-vanity/p/itmegmfxcgsfjhwv?pid=VANEGMFXZJFZW2KY&affid=siddarthk,http://img.fkcdn.com/image/vanity-box/t/m/n/krgjj1-khushienterprises-5-rod-in-maroon-brocade-200x200-imaeg87zymyzf6px.jpeg,Health and Beauty>Makeup>Vanity Boxes,1099.0,440.0,440.0,true,VANEGMFXZJFZW2KY,VANEGMFXZJFZW2KY
Flipkart,,KRG ENTERPRISES  Handmade Designer Of 3 Row Bangle Box Vanity Box(Multicolor),Exclusive 2 bangle Box In brocade with Heavy Transparent & hard board which helps to keep safe all your bangles. This product looks stylish. Errmani Export brings products for every woman who dreams of being unique and stylish. It offers incredible range of handbags and jewellery boxes for women. Their products are incomparable in terms of quality.,KRG ENTERPRISES,http://dl.flipkart.com/dl/krg-enterprises-handmade-designer-3-row-bangle-box-vanity/p/itmegmfxywwv6tzf?pid=VANEGMFXGZGZR5FH&affid=siddarthk,http://img.fkcdn.com/image/vanity-box/4/j/m/krgjj3-khushienterprises-3-rod-in-maroon-bangle-box-200x200-imaeg88fm6ffsrdx.jpeg,Health and Beauty>Makeup>Vanity Boxes,1099.0,349.0,349.0,true,VANEGMFXGZGZR5FH,VANEGMFXGZGZR5FH
Flipkart,,Crafts'man Handmade Wooden Jewellery Vanity Box(Brown),"Decorative jewellery box Material: Wood Size: Length - 8 inches, Width - 5 inches, Height - 3 inches Weight: 0.70 KgProtect and preserve your valuables with this handcrafted wooden jewelry box. You always want to keep your best valuables precious jewelry safely. This wooden jewelry box is ideal for organizing your jewellery collection. This classical wooden jewelry storage case has been built from real wood and polished gold hardware. A stylish way to keep your jewelry organized. This wooden jewelry box has a curved, traditional design, rich brown finish.",Crafts'man,http://dl.flipkart.com/dl/crafts-man-handmade-wooden-jewellery-vanity-box/p/itme3n3ywbzr63y3?pid=VANE3N3YXBWCZWUZ&affid=siddarthk,http://img.fkcdn.com/image/vanity-box/w/u/z/191-crafts-man-handmade-wooden-200x200-imae3ny5232gawvv.jpeg,Health and Beauty>Makeup>Vanity Boxes,1380.0,738.0,738.0,false,VANE3N3YXBWCZWUZ,VANE3N3YXBWCZWUZ
Flipkart,,KRG ENTERPRISES Maroon Transparent Cover Bangle Box Vanity Box(Multicolor),Exclusive 2 bangle Box In brocade with Heavy Transparent & hard board which helps to keep safe all your bangles. This product looks stylish. Errmani Export brings products for every woman who dreams of being unique and stylish. It offers incredible range of handbags and jewellery boxes for women. Their products are incomparable in terms of quality.,KRG ENTERPRISES,http://dl.flipkart.com/dl/krg-enterprises-maroon-transparent-cover-bangle-box-vanity/p/itmegmfxwfcgxy3j?pid=VANEGMFXXKSYFJGH&affid=siddarthk,http://img.fkcdn.com/image/vanity-box/6/r/2/b183-ermani-export-traditional-traditional-maroon-transparent-200x200-imaeg887rhhthz5q.jpeg,Health and Beauty>Makeup>Vanity Boxes,1099.0,399.0,399.0,true,VANEGMFXXKSYFJGH,VANEGMFXXKSYFJGH
Flipkart,,Crafts'man Handmade Decorative Wooden Jewellery Vanity Box(Brown),"Decorative wooden jewelry box Material: Wood Size: Length - 2.75 inches, Width - 2 inches, Height - 1.75 inches Weight: 80 gramsProtect and preserve your valuables with this handcrafted wooden jewelry box. You always want to keep your best valuables precious jewelry safely. This wooden jewelry box is ideal for organizing your jewellery collection. This classical wooden jewelry storage case has been built from real wood and polished gold hardware. A stylish way to keep your jewelry organized. This wooden jewelry box has a curved, traditional design, rich brown finish.",Crafts'man,http://dl.flipkart.com/dl/crafts-man-handmade-decorative-wooden-jewellery-vanity-box/p/itme3n3yzhkzwcqt?pid=VANE3N3YM448HPR9&affid=siddarthk,http://img.fkcdn.com/image/vanity-box/p/r/9/302-crafts-man-handmade-decorative-wooden-200x200-imae3ny5agvcdtx6.jpeg,Health and Beauty>Makeup>Vanity Boxes,360.0,216.0,216.0,false,VANE3N3YM448HPR9,VANE3N3YM448HPR9
Flipkart,,Skyhawk Designer Jewellery Makeup Vanity Box(Mehroon),"Beautifully Designed Jewelry Box Is A Perfect Utility Item For Keeping Your Expensive And Precious Jewelry Intact. With Its Separate Partitions For Necklace, Bracelets And Bangles, You Can Organize Your Entire Jewelry Neatly; It Has A Pattern Lock That Ensures The Safety Of Your Exclusive Jewelries. It Is A Unique Way Of Complimenting Gifting The Bride During Wedding Seasons And A Perfect Gift For Someone You Love.",Skyhawk,http://dl.flipkart.com/dl/skyhawk-designer-jewellery-makeup-vanity-box/p/itmeenz5anzcfxec?pid=VANEENZ5FMZGNYMT&affid=siddarthk,http://img.fkcdn.com/image/vanity-box/y/m/t/sky-mhplki-skyhawk-designer-jewellery-200x200-imaeenn68ftrujzz.jpeg,Health and Beauty>Makeup>Vanity Boxes,1499.0,690.0,690.0,true,VANEENZ5FMZGNYMT,VANEENZ5FMZGNYMT
Flipkart,,KRG ENTERPRISES  Royal Jewellery Case With Elephant Design Bangle Box Vanity Box(Multicolor),Exclusive 2 bangle Box In brocade with Heavy Transparent & hard board which helps to keep safe all your bangles. This product looks stylish. Errmani Export brings products for every woman who dreams of being unique and stylish. It offers incredible range of handbags and jewellery boxes for women. Their products are incomparable in terms of quality.,KRG ENTERPRISES,http://dl.flipkart.com/dl/krg-enterprises-royal-jewellery-case-elephant-design-bangle-box-vanity/p/itmegmfy9enr6vrj?pid=VANEGMFYFZDHHTRH&affid=siddarthk,http://img.fkcdn.com/image/vanity-box/s/g/f/bangle-box-113-krg-enterprises-3-rods-200x200-imaeg889zjeebgh8.jpeg,Health and Beauty>Makeup>Vanity Boxes,1099.0,298.0,298.0,true,VANEGMFYFZDHHTRH,VANEGMFYFZDHHTRH
Flipkart,,KRG ENTERPRISES 5 Rod In Maroon Brocade Bangle Box Vanity Box(Multicolor),Exclusive 2 bangle Box In brocade with Heavy Transparent & hard board which helps to keep safe all your bangles. This product looks stylish. Errmani Export brings products for every woman who dreams of being unique and stylish. It offers incredible range of handbags and jewellery boxes for women. Their products are incomparable in terms of quality.,KRG ENTERPRISES,http://dl.flipkart.com/dl/krg-enterprises-5-rod-maroon-brocade-bangle-box-vanity/p/itmegmfxnecufjzw?pid=VANEGMFXPJV6GB3Z&affid=siddarthk,http://img.fkcdn.com/image/vanity-box/e/9/s/krgjj9-khushienterprises-5-rod-maroon-transparent-cover-200x200-imaeg885zjmtuaps.jpeg,Health and Beauty>Makeup>Vanity Boxes,1099.0,440.0,440.0,true,VANEGMFXPJV6GB3Z,VANEGMFXPJV6GB3Z
