PartnerName,Id,Title,Description,Brand,Link,ImageLink,CategoryName,Mrp,OfferPrice,EffectivePrice,Availability,PartnerIdFromUrl,PartnerIdFromDb
Flipkart,,Rusk Str8 Anti-Frizz and Anti-Curl,"Transform frizzy, curly or unruly hair and tame it into smooth, straight, obedient style with this light, greaseless styling lotion. RUSK Str8 Anti-Frizz and Anti-Curl Lotion temporarily removes curl, eliminates frizz, blocks humidity for up to 24 hours and becomes invisible in the hair.",Rusk,http://dl.flipkart.com/dl/rusk-str8-anti-frizz-anti-curl/p/itmee3jmeqerzfhk?pid=HTTEE3JMDUGDM6KV&affid=siddarthk,http://img.fkcdn.com/image/hair-treatment/6/k/v/rusk-150-str8-anti-frizz-and-anti-curl-200x200-imaee2k9zz9ugnz7.jpeg,Health and Beauty>Hair Care>Hair Treatments,1500.0,1250.0,1250.0,false,HTTEE3JMDUGDM6KV,HTTEE3JMDUGDM6KV
Flipkart,,Rusk Being Sexy,"This highly concentrated alcohol-free mousse is light and foamy and delivers maximum volume, body and control. A firm-hold mousse, it’s ideal for blow-drying and curl separation. Hydrolyzed silk and honey help smooth, strengthen and moisturize hair. Add volume, body and shine with Rusk Being Sexy Mousse.",Rusk,http://dl.flipkart.com/dl/rusk-being-sexy/p/itmee3jmyaaegnnf?pid=HTTEE3JMZXCVZHJD&affid=siddarthk,http://img.fkcdn.com/image/hair-treatment/h/j/d/rusk-260-being-sexy-200x200-imaee2k7racaumny.jpeg,Health and Beauty>Hair Care>Hair Treatments,3249.0,2999.0,2999.0,false,HTTEE3JMZXCVZHJD,HTTEE3JMZXCVZHJD
Flipkart,,Rusk Being Warped,"This medium-hold thickening hair wax instantly creates chunky texture with incredible shine, edgy definition, and clear separation. For body, volume, and perfect styling control, use humidity-resistant RUSK Being Warped Wax.",Rusk,http://dl.flipkart.com/dl/rusk-being-warped/p/itmee3jmx3wb6qyz?pid=HTTEE3JMNYR4JQZZ&affid=siddarthk,http://img.fkcdn.com/image/hair-treatment/q/z/z/rusk-51-being-warped-200x200-imaee2k7g2xnetby.jpeg,Health and Beauty>Hair Care>Hair Treatments,3249.0,2999.0,2999.0,false,HTTEE3JMNYR4JQZZ,HTTEE3JMNYR4JQZZ
Flipkart,,Rusk Sensories Moist Sunflower and Apricot Hydrating,"Rusk Sensories Moist Sunflower and Apricot Hydrating Treatment awakens the senses and counteracts the harsh effects of styling routines and daily assaults on the hair from the environment. Specially formulated with sunflower extract to condition and apricot extract to moisturize the hair. Moist Treatment contains protective sunscreens, antistatic agents, strengthening proteins, honey and bodifying vitamins.",Rusk,http://dl.flipkart.com/dl/rusk-sensories-moist-sunflower-apricot-hydrating/p/itmee3jmcdtqbrmr?pid=HTTEE3JMJDHFRCV9&affid=siddarthk,http://img.fkcdn.com/image/hair-treatment/c/v/9/rusk-222-sensories-moist-sunflower-and-apricot-hydrating-200x200-imaee2k92vjggmru.jpeg,Health and Beauty>Hair Care>Hair Treatments,1500.0,1250.0,1250.0,false,HTTEE3JMJDHFRCV9,HTTEE3JMJDHFRCV9
Flipkart,,Rusk Shining Sheen and Movement,"Mist hair with RUSK Shining Sheen and Movement Myst for a natural-looking sheen. When activated with the heat of a blow-dryer, each hair fiber becomes sheathed in a micro-thin layer of protective ingredients to add brilliance, softness, and build an invisible protective shield.",Rusk,http://dl.flipkart.com/dl/rusk-shining-sheen-movement/p/itmee3jmfnyvcaap?pid=HTTEE3JMMZHWTBSG&affid=siddarthk,http://img.fkcdn.com/image/hair-treatment/b/s/g/rusk-150-shining-sheen-and-movement-200x200-imaee2k8vsspuzzb.jpeg,Health and Beauty>Hair Care>Hair Treatments,1750.0,1500.0,1500.0,false,HTTEE3JMMZHWTBSG,HTTEE3JMMZHWTBSG
Flipkart,,Rusk Jel Fx Firm Hold Styling,"Finally, a hair gel that delivers full-bodied, touchable hold and incredible style! Non-greasy and flake-free, RUSK Jel Fx Firm Hold Styling Gel brushes through easily and creates beautiful, bouncy hair. Jel Fx is formulated with hydrolyzed silk and naturally derived ingredients for molding and smoothing.",Rusk,http://dl.flipkart.com/dl/rusk-jel-fx-firm-hold-styling/p/itmee3jm7ngwxdxn?pid=HTTEE3JMTMQGHBST&affid=siddarthk,http://img.fkcdn.com/image/hair-treatment/b/s/t/rusk-150-jel-fx-firm-hold-styling-200x200-imaee2k8eyhdpvch.jpeg,Health and Beauty>Hair Care>Hair Treatments,1500.0,1250.0,1250.0,false,HTTEE3JMTMQGHBST,HTTEE3JMTMQGHBST
Flipkart,,Rusk Thermal Shiny Str8,"This formaldehyde-free permanent straightener adds shine, eliminates frizz and deeply conditions and strengthens hair with keratin. Designed for use with the RUSK Professional Str8 Iron Series to prepare hair for superior straightening results, RUSK® Thermal Shiny Str8 comes in two formulas – normal/tinted and resistant/uncolored.",Rusk,http://dl.flipkart.com/dl/rusk-thermal-shiny-str8/p/itmee3jmhkx2wxxm?pid=HTTEE3JMR4CKQWFX&affid=siddarthk,http://img.fkcdn.com/image/hair-treatment/w/f/x/rusk-260-thermal-shiny-str8-200x200-imaee2k9fegdjfv3.jpeg,Health and Beauty>Hair Care>Hair Treatments,3249.0,2999.0,2999.0,false,HTTEE3JMR4CKQWFX,HTTEE3JMR4CKQWFX
Flipkart,,Rusk Sensories Full Green Tea and Alfalfa Bodifying,"Fine, lazy, limp hair needs invigoration from a volumizing conditioner, not heavy moisturizers to weigh it down. Our weightless conditioning formula gently detangles and adds volume – just two amazing bodifying benefits you’ll get from RUSK Sensories Full Green Tea and Alfalfa Bodifying Conditioner.",Rusk,http://dl.flipkart.com/dl/rusk-sensories-full-green-tea-alfalfa-bodifying/p/itmee3jmt678auft?pid=HTTEE3JMHAH3VGXJ&affid=siddarthk,http://img.fkcdn.com/image/hair-treatment/g/x/j/rusk-400-sensories-full-green-tea-and-alfalfa-bodifying-200x200-imaee2k8wrprxuaz.jpeg,Health and Beauty>Hair Care>Hair Treatments,1500.0,1250.0,1250.0,false,HTTEE3JMHAH3VGXJ,HTTEE3JMHAH3VGXJ
Flipkart,,Rusk Deepshine Color Repair Sulfate-Free,"This RUSK repair shampoo provides vital nourishment to help strengthen and restore damaged, weak hair. Nourishing marine botanicals and a patented UV-absorbing technology with antioxidant-rich vitamin E acetate help shield haircolor from damaging sun-generated free radicals, a leading cause of accelerated fading in haircolor. Protect and rejuvenate hair with RUSK Deepshine Color Repair Sulfate-Free Shampoo.",Rusk,http://dl.flipkart.com/dl/rusk-deepshine-color-repair-sulfate-free/p/itmee3jmmgtxznpu?pid=HTTEE3JMY8BZDFHF&affid=siddarthk,http://img.fkcdn.com/image/hair-treatment/f/h/f/rusk-250-deepshine-color-repair-sulfate-free-200x200-imaee2k9dg3ktw3b.jpeg,Health and Beauty>Hair Care>Hair Treatments,2050.0,1800.0,1800.0,false,HTTEE3JMY8BZDFHF,HTTEE3JMY8BZDFHF
Flipkart,,Rusk Sensories Brilliance Grapefruit and Honey Color Protecting Leave-In,"Rusk Sensories Brilliance Grapefruit and Honey Color Protecting Leave-In Conditioner. This conditioner for color-treated hair puts moisture-rich cream right where it’s needed. Its grapefruit and sunflower extracts, honey and panthenol are exactly what fragile, color-treated hair is thirsty for. Put RUSK Sensories Brilliance Grapefruit and Honey Color Protecting Leave-in Cream Conditioner to work for fragile hair, all day long.",Rusk,http://dl.flipkart.com/dl/rusk-sensories-brilliance-grapefruit-honey-color-protecting-leave-in/p/itmee3jmqt4kzneq?pid=HTTEE3JMVGNZSNK6&affid=siddarthk,http://img.fkcdn.com/image/hair-treatment/n/k/6/rusk-250-sensories-brilliance-grapefruit-and-honey-color-200x200-imaee2k8yu76erv6.jpeg,Health and Beauty>Hair Care>Hair Treatments,1500.0,1250.0,1250.0,false,HTTEE3JMVGNZSNK6,HTTEE3JMVGNZSNK6
Flipkart,,Rusk Deepshine Curl,"Unique formulation for all hair types, creates exceptional firmer, natural looking bouncing curls with a glamorous deep shine. pH = 6.9",Rusk,http://dl.flipkart.com/dl/rusk-deepshine-curl/p/itmee3jm9yjggc9a?pid=HTTEE3JMYFDKMF2D&affid=siddarthk,http://img.fkcdn.com/image/hair-treatment/f/2/d/rusk-30-deepshine-curl-200x200-imaee2k9h4gghmkd.jpeg,Health and Beauty>Hair Care>Hair Treatments,3249.0,2999.0,2999.0,false,HTTEE3JMYFDKMF2D,HTTEE3JMYFDKMF2D
Flipkart,,Rusk Sensories Moist Sunflower and Apricot Hydrating,"Sunflower and apricot extracts make this shampoo for dry hair exceptionally lubricating for anyone whose hair is thirsty for moisture. It’s specially formulated to gently cleanse and revive. Caution: RUSK Sensories Moist Sunflower and Apricot Shampoo is a luxurious, rich solution that can be addicting!",Rusk,http://dl.flipkart.com/dl/rusk-sensories-moist-sunflower-apricot-hydrating/p/itmee3jmcdtqbrmr?pid=HTTEE3JMZHVQHNEN&affid=siddarthk,http://img.fkcdn.com/image/hair-treatment/n/e/n/rusk-400-sensories-moist-sunflower-and-apricot-hydrating-200x200-imaee2k8vehxdkdy.jpeg,Health and Beauty>Hair Care>Hair Treatments,1500.0,1250.0,1250.0,false,HTTEE3JMZHVQHNEN,HTTEE3JMZHVQHNEN
Flipkart,,Rusk Sensories Clarify Rosemary and Quillaja Detoxifying,"Hair that’s bored, tired and stressed needs a dose of shock therapy from our deep-cleansing shampoo. Specially formulated with rosemary and quillaja bark, a natural surfactant, it gently but deeply cleans hair naturally. Immediately get rid of styling product buildup and residue with RUSK Sensories Clarify Rosemary and Quillaja Shampoo.",Rusk,http://dl.flipkart.com/dl/rusk-sensories-clarify-rosemary-quillaja-detoxifying/p/itmee3jmfunnj9vt?pid=HTTEE3JMX6YKSVY2&affid=siddarthk,http://img.fkcdn.com/image/hair-treatment/v/y/2/rusk-400-sensories-clarify-rosemary-and-quillaja-detoxifying-200x200-imaee2k8chhkmnfv.jpeg,Health and Beauty>Hair Care>Hair Treatments,1500.0,1250.0,1250.0,false,HTTEE3JMX6YKSVY2,HTTEE3JMX6YKSVY2
Flipkart,,Rusk Deepshine Shine Enhancing,"For use with all RUSK color and lightening products, this collection of four hair care developers and balancing lotion ensures reliable, consistent results. For optimal, predictable color and maximum gray coverage, top stylists work with RUSK Deepshine Shine Enhancing Cream Developer.",Rusk,http://dl.flipkart.com/dl/rusk-deepshine-shine-enhancing/p/itmee3jmdvprawk6?pid=HTTEE3JMQZECWYSX&affid=siddarthk,http://img.fkcdn.com/image/hair-treatment/y/s/x/rusk-975-deepshine-shine-enhancing-200x200-imaee2k9yhbgfg7w.jpeg,Health and Beauty>Hair Care>Hair Treatments,3249.0,2999.0,2999.0,false,HTTEE3JMQZECWYSX,HTTEE3JMQZECWYSX
Flipkart,,Bblunt Total Control,"This multi-talented fibre paste gives you maximum hold, control and shine. With a bit of water, you can re-style and refresh your look. Go from work to play and back. - See more at: http://bblunt.com/products/156/total-control-maximum-hold-fibre-paste-2#sthash.wMvSWvO3.dpuf",Bblunt,http://dl.flipkart.com/dl/bblunt-total-control/p/itmedy674ryuehap?pid=HTTEDY672K8YEHD8&affid=siddarthk,http://img.fkcdn.com/image/hair-treatment/h/d/8/bblunt-100-total-control-200x200-imaedxqh4rfswut7.jpeg,Health and Beauty>Hair Care>Hair Treatments,575.0,575.0,575.0,false,HTTEDY672K8YEHD8,HTTEDY672K8YEHD8
Flipkart,,Bblunt Spotlight Hair Polish(150 ml),"This lightweight heavyweight gives even the dullest hair a glossy, smooth finish. It’s about maximum shine with minimum fuss. Step into the spotlight. - See more at: http://bblunt.com/products/146/spotlight-hair-polish-for-instant-shine-1#sthash.JbqfhWT9.dpuf",Bblunt,http://dl.flipkart.com/dl/bblunt-spotlight-hair-polish/p/itmedy67amtqzzse?pid=HTTEDY67Z4DKTJVH&affid=siddarthk,http://img.fkcdn.com/image/hair-treatment/j/v/h/bblunt-150-spotlight-hair-polish-200x200-imaedxqhfm68wqdh.jpeg,Health and Beauty>Hair Care>Hair Treatments,550.0,550.0,550.0,true,HTTEDY67Z4DKTJVH,HTTEDY67Z4DKTJVH
Flipkart,,Rusk Thickr Thickening,"Get incredible body, volume and added texture, while protecting against sun damage. RUSK® Thickr® Thickening Myst contains hydrolyzed wheat protein and conditioning agents to moisturize and repair the condition of fine, limp or lazy hair.",Rusk,http://dl.flipkart.com/dl/rusk-thickr-thickening/p/itmee3jmrbgtuag5?pid=HTTEE3JM7DTKGR9D&affid=siddarthk,http://img.fkcdn.com/image/hair-treatment/r/9/d/rusk-150-thickr-thickening-200x200-imaee2k8dpkvejfk.jpeg,Health and Beauty>Hair Care>Hair Treatments,1750.0,1500.0,1500.0,false,HTTEE3JM7DTKGR9D,HTTEE3JM7DTKGR9D
Flipkart,,Bblunt Climate Control Anti-Frizz,"This versatile cream ensures your hair looks great, however hot,dry or humid it gets out there. It enhances natural movement,smoothens and leaves you in charge, whatever the weather - See more at: http://bblunt.com/products/148/climate-control-anti-frizz-leave-in-cream-1#sthash.FB4ejsCB.dpuf",Bblunt,http://dl.flipkart.com/dl/bblunt-climate-control-anti-frizz/p/itmedy67dzqrczkw?pid=HTTEDY67SDUBG58Z&affid=siddarthk,http://img.fkcdn.com/image/hair-treatment/5/8/z/bblunt-150-climate-control-anti-frizz-200x200-imaedxqhswgqffyv.jpeg,Health and Beauty>Hair Care>Hair Treatments,575.0,575.0,575.0,false,HTTEDY67SDUBG58Z,HTTEDY67SDUBG58Z
Flipkart,,Rusk Deepshine Oil Moisturizing,"This color-safe conditioner is enriched with pure argan oil to hydrate and transform dry, dull hair. Impart brilliant shine and leave hair soft, silky and manageable while protecting it from damage by chemicals, thermal styling and environmental factors with exceptional RUSK Deepshine Oil Moisturizing Conditioner.",Rusk,http://dl.flipkart.com/dl/rusk-deepshine-oil-moisturizing/p/itmee3jm4zgavqgt?pid=HTTEE3JMFYJUHXDT&affid=siddarthk,http://img.fkcdn.com/image/hair-treatment/x/d/t/rusk-250-deepshine-oil-moisturizing-200x200-imaee2k9ngsjpjpr.jpeg,Health and Beauty>Hair Care>Hair Treatments,2249.0,1999.0,1999.0,false,HTTEE3JMFYJUHXDT,HTTEE3JMFYJUHXDT
Flipkart,,Bblunt Curl Defining,"Curls need definition and this hassle-free cream makes it easy. It enhances curls & waves and also tames frizz. Go ahead, show your curls some love. - See more at: http://bblunt.com/products/183/high-definition-curl-curl-defining-leave-in-cream-1#sthash.p9KWCXED.dpuf",Bblunt,http://dl.flipkart.com/dl/bblunt-curl-defining/p/itmedy67zbmhhhae?pid=HTTEDY67MAGY6ZH5&affid=siddarthk,http://img.fkcdn.com/image/hair-treatment/z/h/5/bblunt-150-curl-defining-200x200-imaedxqhdtjzuwgm.jpeg,Health and Beauty>Hair Care>Hair Treatments,699.0,699.0,699.0,false,HTTEDY67MAGY6ZH5,HTTEDY67MAGY6ZH5
Flipkart,,Rusk Deepshine Oil Protective Oil,"This marine mineral-enriched argan oil treatment eliminates frizz, improves elasticity, and leaves hair soft, silky, and manageable. The lightweight alchohol-free formula imparts brilliant shine, while marine therapy conditions hair. Use for styling or finishing, and prevent color fading while protecting against damage with RUSK Deepshine Oil Protective Oil Treatment.",Rusk,http://dl.flipkart.com/dl/rusk-deepshine-oil-protective/p/itmee3jmqegy5gft?pid=HTTEE3JMGVN6SK5J&affid=siddarthk,http://img.fkcdn.com/image/hair-treatment/k/5/j/rusk-60-deepshine-oil-protective-oil-200x200-imaee2k9mxgs4kqq.jpeg,Health and Beauty>Hair Care>Hair Treatments,2249.0,1999.0,1999.0,false,HTTEE3JMGVN6SK5J,HTTEE3JMGVN6SK5J
Flipkart,,Rusk Deepshine Demi Ammonia-Free Tone-on-Tone,"RUSK Deepshine Demi Cream Color is perfect to enhance or subtly change the natural tone, use as a pull-thru on mid-shaft and ends, tone highlighted or double processed hair or blend a small percent of gray. Like our permanent collection, Deepshine Demi is also formulated with Micro Pure Pigment Technology and Advanced Marine Therapy, leaving hair healthy, soft and shiny. This semi-permanent haircolor is a great solution for clients who do not want the commitment of permanent haircolor.",Rusk,http://dl.flipkart.com/dl/rusk-deepshine-demi-ammonia-free-tone-on-tone/p/itmee3jmgdtmxres?pid=HTTEE3JMGGWG3YES&affid=siddarthk,http://img.fkcdn.com/image/hair-treatment/y/e/s/rusk-100-deepshine-demi-ammonia-free-tone-on-tone-200x200-imaee2kacft6xvqj.jpeg,Health and Beauty>Hair Care>Hair Treatments,3249.0,2999.0,2999.0,false,HTTEE3JMGGWG3YES,HTTEE3JMGGWG3YES
Flipkart,,Rusk Deepshine Oil Volumizing,"Ideal for fine, dull hair, this gentle sulfate-free shampoo weightlessly cleanses hair while enhancing body and manageability. Pure argan oil imparts brilliant shine. Protect natural or chemical haircolor with RUSK Deepshine Oil Volumizing Shampoo.",Rusk,http://dl.flipkart.com/dl/rusk-deepshine-oil-volumizing/p/itmee3jmwgzeygk4?pid=HTTEE3JMH8AZ6VMS&affid=siddarthk,http://img.fkcdn.com/image/hair-treatment/v/m/s/rusk-250-deepshine-oil-volumizing-200x200-imaee2k9jfquydgj.jpeg,Health and Beauty>Hair Care>Hair Treatments,2249.0,1999.0,1999.0,false,HTTEE3JMH8AZ6VMS,HTTEE3JMH8AZ6VMS
Flipkart,,Rusk Being Undressed,"The ultimate cross-dresser, this versatile hair styling product is a pomade, a wax and a conditioning treatment all in one that leaves hair feeling miraculously product free. Add incredible shine and texture, while giving hair humidity-resistant hold and UV protection, with RUSK Being Undressed Gloss.",Rusk,http://dl.flipkart.com/dl/rusk-being-undressed/p/itmee3jm2mpvxcf6?pid=HTTEE3JMRHMZP7XX&affid=siddarthk,http://img.fkcdn.com/image/hair-treatment/7/x/x/rusk-51-being-undressed-200x200-imaee2k9nh6upscc.jpeg,Health and Beauty>Hair Care>Hair Treatments,3249.0,2999.0,2999.0,false,HTTEE3JMRHMZP7XX,HTTEE3JMRHMZP7XX
Flipkart,,Rusk Deepshine Color Hydrate,"This hydrating conditioner for colored hair gently detangles hair while replenishing moisture. Nourishing marine botanicals, a patented UV-absorbing technology, and antioxidant pro-vitamin B5 help shield haircolor from damaging sun-generated free radicals, a leading cause of accelerated hair color fading. Protect and revitalize colored hair with RUSK Deepshine Color Hydrate Conditioner.",Rusk,http://dl.flipkart.com/dl/rusk-deepshine-color-hydrate/p/itmee3jmruy4tnes?pid=HTTEE3JM7SGGFBFR&affid=siddarthk,http://img.fkcdn.com/image/hair-treatment/b/f/r/rusk-250-deepshine-color-hydrate-200x200-imaee2ka8ehwxmqq.jpeg,Health and Beauty>Hair Care>Hair Treatments,2249.0,1999.0,1999.0,false,HTTEE3JM7SGGFBFR,HTTEE3JM7SGGFBFR
Flipkart,,Rusk Deepshine Color Repair,"This conditioner for colored hair gently detangles hair while restoring strength and improving condition. Nourishing marine botanicals and a patented UV-absorbing technology help shield color from damaging sun-generated free radicals, a leading cause of accelerated fading in haircolor. Leave hair soft and nourished with healthy shine by using RUSK Deepshine Color Repair Conditioner.",Rusk,http://dl.flipkart.com/dl/rusk-deepshine-color-repair/p/itmee3jmssnw7hhc?pid=HTTEE3JMGNGYZUT7&affid=siddarthk,http://img.fkcdn.com/image/hair-treatment/u/t/7/rusk-250-deepshine-color-repair-200x200-imaee2k9px7gkgph.jpeg,Health and Beauty>Hair Care>Hair Treatments,2050.0,1800.0,1800.0,false,HTTEE3JMGNGYZUT7,HTTEE3JMGNGYZUT7
Flipkart,,Rusk Deepshine Smooth Keratin Care Deep-Penetrating,"An intensive deep-conditioning treatment for chemically and color-treated hair, this hair-strengthening formula contains natural keratin, vitamins, and nourishing marine botanicals. Leave hair smooth, shiny and in luxurious condition with RUSK Deepshine Smooth Keratin Care Deep-Penetrating Treatment.",Rusk,http://dl.flipkart.com/dl/rusk-deepshine-smooth-keratin-care-deep-penetrating/p/itmee3jmbrkx2mfd?pid=HTTEE3JM96ZUHHCK&affid=siddarthk,http://img.fkcdn.com/image/hair-treatment/h/c/k/rusk-207-deepshine-smooth-keratin-care-deep-penetrating-200x200-imaee2k8m9rfuz9a.jpeg,Health and Beauty>Hair Care>Hair Treatments,1275.0,1275.0,1275.0,true,HTTEE3JM96ZUHHCK,HTTEE3JM96ZUHHCK
Flipkart,,Rusk Thick Body and Texture,"Get incredible body and volume, and add texture from the inside out, with RUSK® Thick Body and Texture Amplifier. Transform fine, limp, lazy hair into big, beautiful styles. Thick Body and Texture Amplifier contains Thermplex to boost body and volume from inside out, and wheat protein to add strength and moisture.",Rusk,http://dl.flipkart.com/dl/rusk-thick-body-texture/p/itmee3jmqx6wjuzq?pid=HTTEE3JMDHTW2PGN&affid=siddarthk,http://img.fkcdn.com/image/hair-treatment/p/g/n/rusk-150-thick-body-and-texture-200x200-imaee2k859rggvdd.jpeg,Health and Beauty>Hair Care>Hair Treatments,1775.0,1525.0,1525.0,false,HTTEE3JMDHTW2PGN,HTTEE3JMDHTW2PGN
Flipkart,,Rusk Deepshine Color Smooth,"This daily conditioner gently detangles hair, making it manageable and leaving it feeling smooth and soft. Nourishing marine botanicals and a patented UV-absorbing technology with antioxidant-rich pro-vitamin B5 help shield haircolor from damaging sun-generated free radicals, a leading cause of accelerated fading in haircolor. Prolong color vibrancy with RUSK Deepshine Color Smooth Conditioner.",Rusk,http://dl.flipkart.com/dl/rusk-deepshine-color-smooth/p/itmee3jmqctxz8ks?pid=HTTEE3JMHZFH4Z6F&affid=siddarthk,http://img.fkcdn.com/image/hair-treatment/z/6/f/rusk-250-deepshine-color-smooth-200x200-imaee2k9rwt4zz5z.jpeg,Health and Beauty>Hair Care>Hair Treatments,2700.0,2450.0,2450.0,false,HTTEE3JMHZFH4Z6F,HTTEE3JMHZFH4Z6F
Flipkart,,Rusk Thickr Thickening,"Anyone with fine, limp or lazy hair will love this daily-use thickening conditioner that strengthens and repairs while significantly increasing the quality and texture of hair. RUSK Thickr Thickening Conditioner prevents dry, brittle hair and provides thermal protection.",Rusk,http://dl.flipkart.com/dl/rusk-thickr-thickening/p/itmee3jmrbgtuag5?pid=HTTEE3JMDXHWRAG5&affid=siddarthk,http://img.fkcdn.com/image/hair-treatment/a/g/5/rusk-400-thickr-thickening-200x200-imaee2k7uxrsmbka.jpeg,Health and Beauty>Hair Care>Hair Treatments,1480.0,975.0,975.0,true,HTTEE3JMDXHWRAG5,HTTEE3JMDXHWRAG5
Flipkart,,Rusk W8less Plus Extra Strong Hold Shaping and Control,"Get texture, natural shine and all-day touchable style with RUSK W8less Plus Extra Strong Hold Shaping and Control Hairspray. Mist on wet hair during styling for added hold and support and blow-dry to infuse hair with texture and body. Contains Thermplex, a unique combination of ingredients that activates with the heat of a blow-dryer to provide shine, control and condition from the inside out.",Rusk,http://dl.flipkart.com/dl/rusk-w8less-plus-extra-strong-hold-shaping-control/p/itmee3jm7nxhvazp?pid=HTTEE3JMPTZENAJG&affid=siddarthk,http://img.fkcdn.com/image/hair-treatment/a/j/g/rusk-350-w8less-plus-extra-strong-hold-shaping-and-control-200x200-imaee2k7tgr9yfvr.jpeg,Health and Beauty>Hair Care>Hair Treatments,1750.0,1500.0,1500.0,false,HTTEE3JMPTZENAJG,HTTEE3JMPTZENAJG
Flipkart,,Rusk Sensories Smoother Passionflower and Aloe Smoothing,"When hair gets out of line, this shampoo for unruly hair is specially formulated to keep it in check. Aloe helps soothe while emollients restore moisture balance. RUSK Sensorie Smoother Passionflower and Aloe Smoothing Shampoo gently removes unwanted mineral salts and styling product buildup.",Rusk,http://dl.flipkart.com/dl/rusk-sensories-smoother-passionflower-aloe-smoothing/p/itmee3jm3yefnyd6?pid=HTTEE3JMG5YNTXRH&affid=siddarthk,http://img.fkcdn.com/image/hair-treatment/x/r/h/rusk-400-sensories-smoother-passionflower-and-aloe-smoothing-200x200-imaee2karkwrseaf.jpeg,Health and Beauty>Hair Care>Hair Treatments,1500.0,1250.0,1250.0,false,HTTEE3JMG5YNTXRH,HTTEE3JMG5YNTXRH
Flipkart,,Rusk Sensories Pure Mandarin and Jasmine Vibrant Color,"Color can lose its vibrancy over time, but our color-protecting conditioner can help preserve its original richness. A scientifically balanced mixture of silicone conditioners adds deep shine. Herbal extracts act in unison to promote manageability. Additionally, RUSK Sensories Pure Mandarin and Jasmine Vibrant Color Conditioner has an enchanting aroma you’ll love.",Rusk,http://dl.flipkart.com/dl/rusk-sensories-pure-mandarin-jasmine-vibrant-color/p/itmee3jmkuqanx5h?pid=HTTEE3JMJT9VHMH8&affid=siddarthk,http://img.fkcdn.com/image/hair-treatment/m/h/8/rusk-400-sensories-pure-mandarin-and-jasmine-vibrant-color-200x200-imaee2k7zjgg5ut6.jpeg,Health and Beauty>Hair Care>Hair Treatments,1500.0,1250.0,1250.0,false,HTTEE3JMJT9VHMH8,HTTEE3JMJT9VHMH8
Flipkart,,Rusk W8less Strong Hold Shaping and Control,"RUSK W8less Strong Hold Shaping and Control Hairspray is a versatile design tool that provides texture, natural shine and long-lasting, touchable support. It contains Thermplex, a unique combination of ingredients that activates with the heat of a blow-dryer to provide shine, control and condition from the inside out.",Rusk,http://dl.flipkart.com/dl/rusk-w8less-strong-hold-shaping-control/p/itmee3jmmbp5hnbj?pid=HTTEE3JMDHGDZQNY&affid=siddarthk,http://img.fkcdn.com/image/hair-treatment/q/n/y/rusk-250-w8less-strong-hold-shaping-and-control-200x200-imaee2k7st6unypv.jpeg,Health and Beauty>Hair Care>Hair Treatments,1750.0,1500.0,1500.0,false,HTTEE3JMDHGDZQNY,HTTEE3JMDHGDZQNY
Flipkart,,Rusk Being Sexy,"This shine-enhancing hairspray locks in style with extra-firm control. Use it to create texture, build volume, and give hair long-lasting touchable hold and support. Bring strength to any ‘do – and leave hair feeling natural – with Rusk Being Sexy Hairspray.",Rusk,http://dl.flipkart.com/dl/rusk-being-sexy/p/itmee3jmyaaegnnf?pid=HTTEE3JMQXVMBYXM&affid=siddarthk,http://img.fkcdn.com/image/hair-treatment/y/x/m/rusk-345-being-sexy-200x200-imaee2k82ahyyujg.jpeg,Health and Beauty>Hair Care>Hair Treatments,3249.0,2999.0,2999.0,false,HTTEE3JMQXVMBYXM,HTTEE3JMQXVMBYXM
Flipkart,,Rusk Deepshine Smooth Keratin Care Smoothing,"A gentle formula for chemically and color-treated hair, this strengthening shampoo contains natural keratin, vitamins, and nourishing marine botanicals. Keep hair smooth and shiny, and protect it during thermal styling, with RUSK Deepshine Smooth Keratin Care Smoothing Shampoo.",Rusk,http://dl.flipkart.com/dl/rusk-deepshine-smooth-keratin-care-smoothing/p/itmee3jmkjarutqp?pid=HTTEE3JMSDVEHKFW&affid=siddarthk,http://img.fkcdn.com/image/hair-treatment/k/f/w/rusk-355-deepshine-smooth-keratin-care-smoothing-200x200-imaee2k9twnatyhf.jpeg,Health and Beauty>Hair Care>Hair Treatments,1750.0,1500.0,1500.0,false,HTTEE3JMSDVEHKFW,HTTEE3JMSDVEHKFW
