PartnerName,Id,Title,Description,Brand,Link,ImageLink,CategoryName,Mrp,OfferPrice,EffectivePrice,Availability,PartnerIdFromUrl,PartnerIdFromDb
Flipkart,,Babo Botanicals Smoothing Conditioner (For Tangly or Unruly Hair)(180 ml),"A smoothing & detangling conditioner for frizzy or unruly hair Features a plant-based formula to detangle hair Contains Evening Primrose Oil & Babassu Oil to moisturize hair Blended with Vitamin B5 for strengthening effect Eliminates frizz, calms flyaways & prevents static Infused with a crisp, clean berry scent Hair appears softer, smoother, shinier & more manageable",Babo Botanicals,http://dl.flipkart.com/dl/babo-botanicals-smoothing-conditioner-for-tangly-unruly-hair/p/itmenq3h9zfw5rzx?pid=CNDENQ3HGYEPKRRJ&affid=siddarthk,http://img.fkcdn.com/image/conditioner/r/r/j/babo-botanicals-180-smoothing-conditioner-for-tangly-or-unruly-200x200-imaez5h5by4cddmz.jpeg,Health and Beauty>Hair Care>Conditioners,9999.0,9999.0,9999.0,false,CNDENQ3HGYEPKRRJ,CNDENQ3HGYEPKRRJ
Flipkart,,Carol's Daughter Monoi Repairing Conditioner(226 ml),"A lightweight reparative & intensely hydrating conditioner Contains Monoi Oil derived from Tahitian Tiare Gardenia Flower Helps repair & condition fine, delicate or chemically-treated hair Formulated with Bamboo water, the strongest plant to strengthen hair's structure Blended with Pro-vitamin B5 to re-construct hair cuticle Effectively combats & prevents hair breakage Hair appears suppler, smoother, shiner, stronger & healthier looking Free of parabens, petroleum, mineral oil & artificial colors",Carol's Daughter,http://dl.flipkart.com/dl/carol-s-daughter-monoi-repairing-conditioner/p/itmey46mjtgwr2d2?pid=CNDENQ3HFBCGN27X&affid=siddarthk,http://img.fkcdn.com/image/conditioner/2/7/x/carol-s-daughter-226-monoi-repairing-conditioner-200x200-imaez5h5sz63g6bq.jpeg,Health and Beauty>Hair Care>Conditioners,2125.0,2125.0,2125.0,true,CNDENQ3HFBCGN27X,CNDENQ3HFBCGN27X
Flipkart,,Rene Furterer Carthame No-Rinse Day Time Moisturizing Conditioner (For Dry Hair)(75 ml),"A leave-in conditioner to deeply hydrate dry hair Features a lightweight texture that adds no heaviness to hair Contains carthame oil & cimentrio Delivers moisture & nutrients to hair Reveals softer, more lustrous & manageable hair To use: After shampooing, apply a small amount on towel-dried or dry hair with fingers. Distribute evenly throughout hair from mid-length to end. No need to rinse",Rene Furterer,http://dl.flipkart.com/dl/rene-furterer-carthame-no-rinse-day-time-moisturizing-conditioner-for-dry-hair/p/itmenq3hag8yznz4?pid=CNDENQ3HF5AFNUJX&affid=siddarthk,http://img.fkcdn.com/image/conditioner/u/j/x/rene-furterer-75-carthame-no-rinse-day-time-moisturizing-200x200-imaez5h5jzqbjk3p.jpeg,Health and Beauty>Hair Care>Conditioners,2475.0,1700.0,1700.0,true,CNDENQ3HF5AFNUJX,CNDENQ3HF5AFNUJX
Flipkart,,Schwarzkopf BC Oil Miracle Liquid Oil Conditioner (For Fine to Normal Hair)(150 ml),"A weightless 2-phase liquid oil conditioner Combines an oil phase that provides shine with a clear caring phase for conditioning & detangling effects Developed with advanced R&D technology that distributes the precious oil gently & evenly around hair Seals hair surface to lock moisture in for a polished look Hair appears suppler, bouncier, more manageable & healthier looking Perfect for all hair types To use: Shake well to mix the two phases. Spray into towel-dried hair in short bursts, leave in & no need to rinse",Schwarzkopf,http://dl.flipkart.com/dl/schwarzkopf-bc-oil-miracle-liquid-conditioner-for-fine-normal-hair/p/itmenq3hzvzsc7me?pid=CNDENQ3HFW48RFPY&affid=siddarthk,http://img.fkcdn.com/image/conditioner/f/p/y/schwarzkopf-150-bc-oil-miracle-liquid-oil-conditioner-for-fine-200x200-imaez5h5gbwz39nv.jpeg,Health and Beauty>Hair Care>Conditioners,2829.0,1615.0,1615.0,true,CNDENQ3HFW48RFPY,CNDENQ3HFW48RFPY
Flipkart,,Pureology Hydrate Hydra Whip Optimum Moisture Hair Masque (For Dry Colour-Treated Hair)(150 ml),"A lavish, concentrated hydrating mask Contains an exclusive AntiFadeComplex that maximizes color retention Delivers intense moisture & deeply replenishes parched strands without weighing hair down Provides concentrated natural conditioning Instantly detangles hair while improving movement & manageability Infused with a refreshing fragrance that awakens the senses Hair appears suppler, sleeker & shiner in vibrant color Perfect for dry color-treated hair",Pureology,http://dl.flipkart.com/dl/pureology-hydrate-hydra-whip-optimum-moisture-hair-masque-for-dry-colour-treated-hair/p/itmenq3hrahamqzh?pid=CNDENQ3HDYZQHFRW&affid=siddarthk,http://img.fkcdn.com/image/conditioner/f/r/w/pureology-150-hydrate-hydra-whip-optimum-moisture-hair-masque-200x200-imaez5h5kzghpjnz.jpeg,Health and Beauty>Hair Care>Conditioners,4293.0,4208.0,4208.0,false,CNDENQ3HDYZQHFRW,CNDENQ3HDYZQHFRW
Flipkart,,Rusk Deepshine Color Smooth Conditioner(250 ml),"A color-preserving conditioner for chemically or color-treated hair Helps mildly detangle hair & replenish moisture levels Prevents all three fade factors: UV rays, harsh cleansers & heat styling Contains nourishing bio-marine botanicals that provide essential nutrients, proteins & trace minerals Helps protect hair during thermal styling Blended with Quaternium-95 & Propanediol to shield hair from UV damage Offers long-lasting frizz control Hair appears suppler, sleeker, more lustrous & manageable with brilliant color",Rusk,http://dl.flipkart.com/dl/rusk-deepshine-color-smooth-conditioner/p/itmenq3hfefzxhan?pid=CNDENQ3HDKFPFWDG&affid=siddarthk,http://img.fkcdn.com/image/conditioner/w/d/g/rusk-250-deepshine-color-smooth-conditioner-200x200-imaez5h5dt9gp4g2.jpeg,Health and Beauty>Hair Care>Conditioners,1445.0,1445.0,1445.0,true,CNDENQ3HDKFPFWDG,CNDENQ3HDKFPFWDG
Flipkart,,Kanebo Sensai Intensive Hair Mask(200 ml),"A rich, intensely hydrating hair mask for severely damaged hair Contains ten oriental herbal extracts for hydrating & repairing benefits Blended with precious silk & pearl to combat signs of hair damage Loaded with Japanese Pearl Essence to repair, strengthen & smooth the cuticle Infused with an elegant, fresh floral fragrance Hair appears sleeker, shinier & healthier looking To use: Apply to wet hair after shampoo. Rinse thoroughly. Use 1-2 times a week",Kanebo,http://dl.flipkart.com/dl/kanebo-sensai-intensive-hair-mask/p/itmenq3h45gf5gya?pid=CNDENQ3HGVVRJGZZ&affid=siddarthk,http://img.fkcdn.com/image/conditioner/g/z/z/kanebo-200-sensai-intensive-hair-mask-200x200-imaez5h5nxzj4cmb.jpeg,Health and Beauty>Hair Care>Conditioners,5039.0,4803.0,4803.0,false,CNDENQ3HGVVRJGZZ,CNDENQ3HGVVRJGZZ
Flipkart,,Aesop Colour Protection Conditioner (For Coloured Hair)(200 ml),"A lightweight intensely hydrating conditioner for colored hair Contains UV protective Sunflower Seed to prolong color retention Enriched with Hydrolyzed Oats & carefully selected botanicals that deeply moisturize & shield hair Infused with refreshing mint, herbaceous & nutty aromas Hair appears suppler & more lustrous in vibrant color",Aesop,http://dl.flipkart.com/dl/aesop-colour-protection-conditioner-for-coloured-hair/p/itmenq3h9uqc8wjr?pid=CNDENQ3HGQVHZPGC&affid=siddarthk,http://img.fkcdn.com/image/conditioner/p/g/c/aesop-200-colour-protection-conditioner-for-coloured-hair-200x200-imaez5h5qyvefggz.jpeg,Health and Beauty>Hair Care>Conditioners,2890.0,2890.0,2890.0,true,CNDENQ3HGQVHZPGC,CNDENQ3HGQVHZPGC
Flipkart,,Lanza Healing Colorcare Color-Preserving Conditioner(250 ml),"An effective color-shielding conditioner Contains soothing emollients, advanced Healing Actives & anti-fade compounds from flowers Offers full spectrum color protection that guard all hair colors from the environment Loaded with triple UV color protectors that prevent damage & fading Clinically proven to extend the life of hair color while detangling hair Infused with a refreshing floral fragrance Hair appears suppler, sleeker & shiner in brilliant color",Lanza,http://dl.flipkart.com/dl/lanza-healing-colorcare-color-preserving-conditioner/p/itmenq3hh7mheg49?pid=CNDENQ3HFZXGNME7&affid=siddarthk,http://img.fkcdn.com/image/conditioner/m/e/7/lanza-250-healing-colorcare-color-preserving-conditioner-200x200-imaez5h5xzg9caub.jpeg,Health and Beauty>Hair Care>Conditioners,2475.0,1955.0,1955.0,true,CNDENQ3HFZXGNME7,CNDENQ3HFZXGNME7
Flipkart,,"Tigi Bed Head Catwalk Your Highness Elevating Conditioner (For Fine, Lifeless Hair)(250 ml)","A volume-boosting conditioner Helps mildly relieve & hydrate hair Contains lavender, wisteria, jasmine & violet Imparts weightless moisture & sheen to hair Blended with cashmere, vanilla & sandalwood fragrance Hair appears suppler, plumper & more touchable Perfect for fine, lifeless hair To use: Apply from mid-lengths to ends of damp hair. Focus on dry areas. Rinse thoroughly",Tigi Bed Head,http://dl.flipkart.com/dl/tigi-bed-head-catwalk-your-highness-elevating-conditioner-for-fine-lifeless-hair/p/itmezg2znpzyfzjs?pid=CNDENQ3HFZUW2HU9&affid=siddarthk,http://img.fkcdn.com/image/conditioner/h/u/9/tigi-250-catwalk-your-highness-elevating-conditioner-for-fine-200x200-imaez5h5uuycbwy9.jpeg,Health and Beauty>Hair Care>Conditioners,1680.0,1318.0,1318.0,true,CNDENQ3HFZUW2HU9,CNDENQ3HFZUW2HU9
Flipkart,,"Rahua Conditioner (For Healthy, Lustrous Hair)(946 ml)","A wholly natural, organic conditioner for all hair types Contains thick, ultra rich formula to nourish & smooth out hair Doubles as a styling cream as well to give medium hold Formulated with coconut oil that preserves color for color-treated hair Other ingredient, Rahua oil helps strengthen weakened hair & regenerate the scalp Leaves hair looking soft, manageable & healthy",Rahua,http://dl.flipkart.com/dl/rahua-conditioner-for-healthy-lustrous-hair/p/itmenq3hh3ra9thh?pid=CNDENQ3HFYVRGUKN&affid=siddarthk,http://img.fkcdn.com/image/conditioner/u/k/n/rahua-946-conditioner-for-healthy-lustrous-hair-200x200-imaez5h5qudcbzmr.jpeg,Health and Beauty>Hair Care>Conditioners,9999.0,9999.0,9999.0,false,CNDENQ3HFYVRGUKN,CNDENQ3HFYVRGUKN
Flipkart,,"Macadamia Deep Repair Masque (For Dry, Damaged Hair)(500 ml)","A regenerating hair re-builder for dry, damaged hair Formulated with macadamia oil & argan oil Blended with tea tree oil, chamomile oil, aloe & algae extracts Helps revitalize & reconstruct hair Gives persistent conditioning benefits Unveils bouncier, intensely hydrated & more lustrous hair",Macadamia,http://dl.flipkart.com/dl/macadamia-deep-repair-masque-for-dry-damaged-hair/p/itmezg2zravzw4ef?pid=CNDENQ3HFVJPWGZV&affid=siddarthk,http://img.fkcdn.com/image/conditioner/g/z/v/macadamia-natural-oil-500-deep-repair-masque-for-dry-damaged-200x200-imaez5h56azupxsu.jpeg,Health and Beauty>Hair Care>Conditioners,9999.0,9999.0,9999.0,false,CNDENQ3HFVJPWGZV,CNDENQ3HFVJPWGZV
Flipkart,,Goldwell Dual Senses Green True Color Conditioner (For Color-Treated Hair)(200 ml),"An effective color preserving conditioner Enriched with 100% organic Argan Oil & Sea Buckthorn Extract Provides moisture to seal the cuticle & improve combability Hair appears suppler, more lustrous & manageable with vibrant color Ideal for color-treated hair Free of sulfates, artificial fragrances, dyes, silicones, mineral oils & parabens",Goldwell,http://dl.flipkart.com/dl/goldwell-dual-senses-green-true-color-conditioner-for-color-treated-hair/p/itmenq3hydm5tshj?pid=CNDENQ3HGKWE3H3S&affid=siddarthk,http://img.fkcdn.com/image/conditioner/h/3/s/goldwell-200-dual-senses-green-true-color-conditioner-for-color-200x200-imaez5h5vhhpts83.jpeg,Health and Beauty>Hair Care>Conditioners,1148.0,1148.0,1148.0,true,CNDENQ3HGKWE3H3S,CNDENQ3HGKWE3H3S
Flipkart,,Schwarzkopf BC Repair Rescue Spray Conditioner (For Damaged Hair)(400 ml),A lightweight spray conditioner for damaged hair Gives immediate care without weighing hair down Contains innovative Biomimetic Repair Technology Increases the strength & elasticity of weakened hair Helps detangle hair to boost manageability,Schwarzkopf,http://dl.flipkart.com/dl/schwarzkopf-bc-repair-rescue-spray-conditioner-for-damaged-hair/p/itmenq3hbxhhygkh?pid=CNDENQ3HGQZMWAVV&affid=siddarthk,http://img.fkcdn.com/image/conditioner/a/v/v/schwarzkopf-400-bc-repair-rescue-spray-conditioner-for-damaged-200x200-imaez5h5rrxgtpza.jpeg,Health and Beauty>Hair Care>Conditioners,3448.0,1743.0,1743.0,true,CNDENQ3HGQZMWAVV,CNDENQ3HGQZMWAVV
Flipkart,,Jurlique Lavender Conditioner(300 ml),"Helps detangle hair for better manageability Leaves hair silky smooth & healthy Hypo-allergenic, pH balanced & 100% bio-degradable No chemicals, artificial colors or fragrance Perfect for normal hair",Jurlique,http://dl.flipkart.com/dl/jurlique-lavender-conditioner/p/itmenq3h7szra6fz?pid=CNDENQ3HFXFCZZSM&affid=siddarthk,http://img.fkcdn.com/image/conditioner/z/s/m/jurlique-300-lavender-conditioner-200x200-imaez5h5ysb9xksq.jpeg,Health and Beauty>Hair Care>Conditioners,1998.0,1998.0,1998.0,true,CNDENQ3HFXFCZZSM,CNDENQ3HFXFCZZSM
Flipkart,,"Tigi Bed Head Bed Head Superfuel Recharge High-Octane Shine Conditioner (For Dull, Lifeless Hair)(200 ml)","A fragranced, antioxidant-rich conditioner Helps thoroughly remove pollutants, sweat & build-up from hair Contains Acai Fruit Extract, Panthenol & Sunflower Seed Oil Blended with UV protectants & vitamins Infused with a delicate enlivening scent Hair appears softer, fresher & purified with super-reflective shine Perfect for dull, lifeless hair",Tigi Bed Head,http://dl.flipkart.com/dl/tigi-bed-head-superfuel-recharge-high-octane-shine-conditioner-for-dull-lifeless-hair/p/itmezg2zkt5xapcg?pid=CNDENQ3HFBHZMZHV&affid=siddarthk,http://img.fkcdn.com/image/conditioner/z/h/v/tigi-200-bed-head-superfuel-recharge-high-octane-shine-200x200-imaez5h5jqqtwcn4.jpeg,Health and Beauty>Hair Care>Conditioners,1414.0,1148.0,1148.0,true,CNDENQ3HFBHZMZHV,CNDENQ3HFBHZMZHV
Flipkart,,Tigi Bed Head Catwalk Headshot Reconstructive Intense Conditioner (For Chemically Treated Hair)(750 ml),"A reconstructive conditioner enriched with Aloe Helps impart intense moisture & thicken hair shaft Loaded with Rose Hip & Ginseng extracts Helps sleek hair cuticle, control frizz & de-tangle hair Shields hair from daily breakage Unveils softer, smoother & more manageable hair Perfect for all hair types Can be applied as a hair mask, leave on for 5 � 10 minutes, rinse off",Tigi Bed Head,http://dl.flipkart.com/dl/tigi-bed-head-catwalk-headshot-reconstructive-intense-conditioner-for-chemically-treated-hair/p/itmezg2zpya8dqpj?pid=CNDENQ3HFBUHYEBY&affid=siddarthk,http://img.fkcdn.com/image/conditioner/e/b/y/tigi-750-catwalk-headshot-reconstructive-intense-conditioner-for-200x200-imaez5h5fhdarefv.jpeg,Health and Beauty>Hair Care>Conditioners,3182.0,2338.0,2338.0,true,CNDENQ3HFBUHYEBY,CNDENQ3HFBUHYEBY
Flipkart,,Alterna Stylist 2 Minute Root Touch-Up Temporary Root Concealer - # Dark Brown(30 ml),"A hair concealer that helps erase roots & blend away greys Features a mineral-rich formula that dries quickly Provides a temporary solution between colorings that washes out with one shampoo Does not flake or rub off once dry Suitable for light to medium blonde hair with natural, single-processed or highlighted caramel tones Free of ammonia, peroxide & synthetic color Safe for color treated hair",Alterna,http://dl.flipkart.com/dl/alterna-stylist-2-minute-root-touch-up-temporary-concealer-dark-brown/p/itmenq3hnvbchzgz?pid=CNDENQ3HGXGF9GYR&affid=siddarthk,http://img.fkcdn.com/image/conditioner/g/y/r/alterna-30-stylist-2-minute-root-touch-up-temporary-root-200x200-imaez5h545saghbm.jpeg,Health and Beauty>Hair Care>Conditioners,2380.0,2380.0,2380.0,true,CNDENQ3HGXGF9GYR,CNDENQ3HGXGF9GYR
Flipkart,,Lanza Healing Moisture Noni Fruit Leave-In Conditioner(250 ml),"A weightless hydrating leave-in conditioner Contains a soothing blend of Hawaiian Noni Fruit & Polynesian Botanicals Corrects combability & delivers optimal hydration without overloading hair Developed with Keratin Healing System that retains moisture Thoroughly dissolves into hair & immediately detangles it Loaded with Color-Preservers that ensure rich, vibrant & long-lasting color Provides UVA/UVB/UVC Protection Hair appears sleeker, shiner & more manageable",Lanza,http://dl.flipkart.com/dl/lanza-healing-moisture-noni-fruit-leave-in-conditioner/p/itmenq3h57dzxfkq?pid=CNDENQ3HFDDTC4JW&affid=siddarthk,http://img.fkcdn.com/image/conditioner/4/j/w/lanza-250-healing-moisture-noni-fruit-leave-in-conditioner-200x200-imaez5h5ns2qdjkc.jpeg,Health and Beauty>Hair Care>Conditioners,2475.0,2168.0,2168.0,true,CNDENQ3HFDDTC4JW,CNDENQ3HFDDTC4JW
Flipkart,,Rene Furterer Lissea Smoothing Conditioner - For Unruly Hair (Salon Product)(250 ml),"A smoothing conditioner for unruly hair Contains natural Alkekenge extract to smooth hair while controlling frizz & volume Blended with omega-rich avocado oil to nourish hair Infused with thermal protecting complex to protect hair from the damage of heat styling tools Loaded with cationic polymers for detangling action Scented with uplifting notes of bergamot, ginger, cardamom & jasmine Hair appears suppler, shinier & more manageable",Rene Furterer,http://dl.flipkart.com/dl/rene-furterer-lissea-smoothing-conditioner-unruly-hair-salon-product/p/itmenq3hhj6hqggv?pid=CNDENQ3HF5RJBC5X&affid=siddarthk,http://img.fkcdn.com/image/conditioner/c/5/x/rene-furterer-250-lissea-smoothing-conditioner-for-unruly-hair-200x200-imaez5h5v6fhzg8r.jpeg,Health and Beauty>Hair Care>Conditioners,3978.0,3315.0,3315.0,true,CNDENQ3HF5RJBC5X,CNDENQ3HF5RJBC5X
Flipkart,,"Kevin Murphy Luxury.Rinse (Ultra Rich Conditioner - For Thick, Coarse or Curly Hair)(250 ml)","A specialized conditioner for thick, coarse or curly hair Contains silk proteins & amino acids to strengthen hair Enriched with peach kernel oil & extracts of Peruvian bark for hydration Boosts softness & adds shine Leaves hair manageable & healthy-looking",Kevin Murphy,http://dl.flipkart.com/dl/kevin-murphy-luxury-rinse-ultra-rich-conditioner-thick-coarse-curly-hair/p/itmenq3h9fxcvqbm?pid=CNDENQ3HEAHMPQVB&affid=siddarthk,http://img.fkcdn.com/image/conditioner/q/v/b/kevin-murphy-250-luxury-rinse-ultra-rich-conditioner-for-thick-200x200-imaez5h57pwxr6sb.jpeg,Health and Beauty>Hair Care>Conditioners,9999.0,9999.0,9999.0,false,CNDENQ3HEAHMPQVB,CNDENQ3HEAHMPQVB
Flipkart,,"Sexy Hair Concepts Big Sexy Hair Color Safe Weightless Moisture Volumizing Conditioner (For Flat, Fine, Thick Hair)(1000 ml)","A volume boosting conditioner safe for colored hair Contains Botanical Extracts, Vitamin B3 & Lemon Grass Adds weightless moisture & texture to hair Instantly detangles hair & provides extra luster Hair appears fuller, smoother & more manageable Ideal for flat, fine or thick hair",Sexy Hair Concepts,http://dl.flipkart.com/dl/sexy-hair-concepts-big-color-safe-weightless-moisture-volumizing-conditioner-for-flat-fine-thick-hair/p/itmenq3hkvgkztwy?pid=CNDENQ3HFWH9ZUZZ&affid=siddarthk,http://img.fkcdn.com/image/conditioner/u/z/z/sexy-hair-concepts-1000-big-sexy-hair-color-safe-weightless-200x200-imaez5h5chmdxjgm.jpeg,Health and Beauty>Hair Care>Conditioners,9999.0,9999.0,9999.0,false,CNDENQ3HFWH9ZUZZ,CNDENQ3HFWH9ZUZZ
Flipkart,,KMS California Curl Up Conditioner (Curl Support &amp; Hydration)(250 ml),"A nourishing conditioner specially for naturally curly hair Helps intensify curls & pacify scalp Formulated with natural ingredients including orange & mint Provides daily protection against damaging UV rays Developed with Inside Out Perfecting System technology, an advanced nutrient delivery system Delivers reconstructive & conditioning agents deeply into hair Reveals healthier, more vigorous & flexible curls",KMS California,http://dl.flipkart.com/dl/kms-california-curl-up-conditioner-curl-support-amp-hydration/p/itmenq3hhvuj9gug?pid=CNDENQ3HGVZUKW9J&affid=siddarthk,http://img.fkcdn.com/image/conditioner/w/9/j/kms-california-250-curl-up-conditioner-curl-support-amp-200x200-imaez5h5yyt4emgu.jpeg,Health and Beauty>Hair Care>Conditioners,1635.0,1403.0,1403.0,true,CNDENQ3HGVZUKW9J,CNDENQ3HGVZUKW9J
Flipkart,,"Rene Furterer Tonucia Toning and Densifying Conditioner (For Aging, Weakened Hair)(200 ml)","A toning conditioner for devitalized, weakened hair Helps invigorate scalp & reinforce hair Formulated with active biospheres that restore resistance & body to hair Loaded with stimulating essential oils of orange & lavender Helps tone scalp & consolidate hair roots Fortified with cimentrio to retain moisture & repair hair from within Plus wheat micro-proteins to cover hair shafts for improved texture Hair appears fuller, thicker, stronger & more flexible",Rene Furterer,http://dl.flipkart.com/dl/rene-furterer-tonucia-toning-densifying-conditioner-for-aging-weakened-hair/p/itmenq3hygbfphjb?pid=CNDENQ3HDXRYGM8G&affid=siddarthk,http://img.fkcdn.com/image/conditioner/m/8/g/rene-furterer-200-tonucia-toning-and-densifying-conditioner-for-200x200-imaez5h5nywjzkbh.jpeg,Health and Beauty>Hair Care>Conditioners,3536.0,3060.0,3060.0,true,CNDENQ3HDXRYGM8G,CNDENQ3HDXRYGM8G
Flipkart,,Sexy Hair Concepts Healthy Sexy Hair Sulfate-Free Soy Moisturizing Conditioner(1000 ml),"A hydrating conditioner for color treated hair Contains a blend of soy proteins to strengthen, moisturize & protect hair Blended with cocoa extract for deep conditioning properties Loaded with Pro-Vitamin B5 to add shine & body Hair appears softer, smoother, stronger & more manageable Free of sulfate, parabens & gluten",Sexy Hair Concepts,http://dl.flipkart.com/dl/sexy-hair-concepts-healthy-sulfate-free-soy-moisturizing-conditioner/p/itmenq3hbkcttmjm?pid=CNDENQ3HF7WKMRUD&affid=siddarthk,http://img.fkcdn.com/image/conditioner/r/u/d/sexy-hair-concepts-1000-healthy-sexy-hair-sulfate-free-soy-200x200-imaez5h5sjyr5yxd.jpeg,Health and Beauty>Hair Care>Conditioners,2475.0,2168.0,2168.0,true,CNDENQ3HF7WKMRUD,CNDENQ3HF7WKMRUD
Flipkart,,BioSilk Color Therapy Conditioner(1006 ml),A therapeutic conditioner for color treated hair Contains bamboo & gooseberry extract for hydration & color protection Blended with VibraRiche to enhance vibrancy & color shine Infused with UV absorbers that shield hair from harmful radicals to prevent color loss Loaded with silk proteins to strengthen hair Hair appears softer & healthier looking with unparalleled reflection Perfect for all hair types & hair colors Paraben-free,BioSilk,http://dl.flipkart.com/dl/biosilk-color-therapy-conditioner/p/itmenq3hbzzyjwan?pid=CNDENQ3HF9XWRH4Y&affid=siddarthk,http://img.fkcdn.com/image/conditioner/h/4/y/biosilk-1006-color-therapy-conditioner-200x200-imaez5h5eqwuurda.jpeg,Health and Beauty>Hair Care>Conditioners,4633.0,4633.0,4633.0,true,CNDENQ3HF9XWRH4Y,CNDENQ3HF9XWRH4Y
Flipkart,,Philip B Russian Amber Imperial Conditioning Creme (For Normal to Color-Treated Hair)(178 ml),"A rich, intensely hydrating conditioner Provides strengthening, shielding & repairing actions Formulated with healing L-Amino Acids & pure plant botanicals Infused with a tantalizing touch of Amber Oil Reveals more resilient, radiant & healthier hair Great for normal, color-treated or damaged hair",Philip B,http://dl.flipkart.com/dl/philip-b-russian-amber-imperial-conditioning-creme-for-normal-color-treated-hair/p/itmenq3hcmeftfyv?pid=CNDENQ3HG5T6GWH2&affid=siddarthk,http://img.fkcdn.com/image/conditioner/w/h/2/philip-b-178-russian-amber-imperial-conditioning-creme-for-200x200-imaez5h5rskzpzbz.jpeg,Health and Beauty>Hair Care>Conditioners,14674.0,10200.0,10200.0,true,CNDENQ3HG5T6GWH2,CNDENQ3HG5T6GWH2
Flipkart,,"Alterna Bamboo Color Hold+ Color Protection Vibrant Color Conditioner (For Strong, Vibrant, Color-Protected Hair)(250 ml)",A color preserving conditioner Contains strengthening Organic Bamboo Extract & color locking Organic Kalahari Melon Developed with wash-resistant Color Hold UV+ technology for the highest level of color protection Replenishes hair with essential moisture & vital nutrients Hair appears stronger & healthier with vibrant color Sulfate- & sodium chloride-free,Alterna,http://dl.flipkart.com/dl/alterna-bamboo-color-hold-protection-vibrant-conditioner-for-strong-vibrant-color-protected-hair/p/itmenq3hhf5zveu6?pid=CNDENQ3HH9W8KKXF&affid=siddarthk,http://img.fkcdn.com/image/conditioner/k/x/f/alterna-250-bamboo-color-hold-color-protection-vibrant-color-200x200-imaez5h5jqxwedxw.jpeg,Health and Beauty>Hair Care>Conditioners,1945.0,1828.0,1828.0,true,CNDENQ3HH9W8KKXF,CNDENQ3HH9W8KKXF
Flipkart,,Moroccanoil Hydrating Conditioner (For All Hair Types)(250 ml),"A gentle hydrating conditioner Formulated with replenishing nutrients & antioxidant argan oil, red algae & vitamin A Helps fight against free radicals & postpone effects of hair aging Hair appears dewier, more lustrous, manageable & healthier looking",Moroccanoil,http://dl.flipkart.com/dl/moroccanoil-hydrating-conditioner-for-all-hair-types/p/itmenq3heffbrgbn?pid=CNDENQ3HG99H7FFZ&affid=siddarthk,http://img.fkcdn.com/image/conditioner/f/f/z/moroccanoil-250-hydrating-conditioner-for-all-hair-types-200x200-imaez5h5tqrgmfbf.jpeg,Health and Beauty>Hair Care>Conditioners,2652.0,2550.0,2550.0,true,CNDENQ3HG99H7FFZ,CNDENQ3HG99H7FFZ
Flipkart,,Cheeky Loving Your Locks Conditioner(200 ml),An ultimate conditioner for all hair types Formulated with a unique ingredient - Natural Betaine Gives exceptional conditioning & softening effect Imparts super shine for a glorious gleam Leaves hair smooth & manageable Perfect for daily use,Cheeky,http://dl.flipkart.com/dl/cheeky-loving-your-locks-conditioner/p/itmenq3h9xqe8sgx?pid=CNDENQ3HHDFVRW9V&affid=siddarthk,http://img.fkcdn.com/image/conditioner/w/9/v/cheeky-200-loving-your-locks-conditioner-200x200-imaez5h5shdftgys.jpeg,Health and Beauty>Hair Care>Conditioners,972.0,808.0,808.0,true,CNDENQ3HHDFVRW9V,CNDENQ3HHDFVRW9V
