PartnerName,Id,Title,Description,Brand,Link,ImageLink,CategoryName,Mrp,OfferPrice,EffectivePrice,Availability,PartnerIdFromUrl,PartnerIdFromDb
Flipkart,,Nature's Thearpy Mint(375 g),"Mint nectarous & neoteric fragrance wash away your lethargy and weariness as you let yourself be captured by the tingling exhilaration of peppermint. Enjoy the ride. Ingredients peppermint (essential oil), glycerine, castor oil rose water, soap base (vegetable oils).",Nature's Thearpy,http://dl.flipkart.com/dl/nature-s-thearpy-mint/p/itmedvzngzd2d5zw?pid=SOPEDVZNZG3TP73J&affid=siddarthk,http://img.fkcdn.com/image/soap/7/3/j/nature-s-thearpy-375-mint-200x200-imaedvsupgspbh9z.jpeg,Health and Beauty>Bath and Spa>Soaps,360.0,350.0,350.0,true,SOPEDVZNZG3TP73J,SOPEDVZNZG3TP73J
Flipkart,,Greenviv Natural Glow Bath Soap Combo,Natural Moisturizer high in Vitamins and Nutrients to deeply nourishes skin and gives natural glow with refreshing Bathing Experience.,Greenviv,http://dl.flipkart.com/dl/greenviv-natural-glow-bath-soap-combo/p/itmegdv8my3g5qdb?pid=SOPEGDV8SQGBSXZT&affid=siddarthk,http://img.fkcdn.com/image/soap/x/z/t/greenviv-200-natural-glow-bath-soap-combo-200x200-imaegbyhvcg3dgnf.jpeg,Health and Beauty>Bath and Spa>Soaps,380.0,104.0,149.0,true,SOPEGDV8SQGBSXZT,SOPEGDV8SQGBSXZT
Flipkart,,Vrikshali Rm 163 Ja,,Vrikshali,http://dl.flipkart.com/dl/vrikshali-rm-163-ja/p/itmec89687dqz7ev?pid=SOPEC896HHBSCHVX&affid=siddarthk,http://img.fkcdn.com/image/soap/h/v/x/vrikshali-150-rm-163-ja-200x200-imaec4auhwhfruhm.jpeg,Health and Beauty>Bath and Spa>Soaps,199.0,199.0,199.0,true,SOPEC896HHBSCHVX,SOPEC896HHBSCHVX
Flipkart,,Mxofere Natural Handmade mixfruit orange jasmine rose almond honey soap Kit(pack of 5),Our natural soaps are handmade in the old world tradition with pure essential oils^ wild and organic herbs. What we put on our skin matters. What we dump on our earth matters. What we leave behind for our children and grandchildren...matters. In addition to leaving your skin feeling perfectly cleansed and ultra moisturized^ our handmade natural soap leaves you with a clear conscience too. Sure^ you can find cheaper handmade soap^ even prettier soap^ but our discriminating customers tell us they haven't found any better natural soap.,Mxofere,http://dl.flipkart.com/dl/mxofere-natural-handmade-mixfruit-orange-jasmine-rose-almond-honey-soap-kit-pack-5/p/itmej54hggs6w68p?pid=SOPEJ54HPZQWE2YU&affid=siddarthk,http://img.fkcdn.com/image/soap/2/y/u/mxofere-375-natural-handmade-mixfruit-orange-jasmine-rose-almond-200x200-imaebqgymwhjppur.jpeg,Health and Beauty>Bath and Spa>Soaps,256.0,,219.0,false,SOPEJ54HPZQWE2YU,SOPEJ54HPZQWE2YU
Flipkart,,Mxofere Natural Handmade almond honey mixfruit neem tulsi scrub orange soap Kit(pack of 5),Our natural soaps are handmade in the old world tradition with pure essential oils^ wild and organic herbs. What we put on our skin matters. What we dump on our earth matters. What we leave behind for our children and grandchildren...matters. In addition to leaving your skin feeling perfectly cleansed and ultra moisturized^ our handmade natural soap leaves you with a clear conscience too. Sure^ you can find cheaper handmade soap^ even prettier soap^ but our discriminating customers tell us they haven't found any better natural soap.,Mxofere,http://dl.flipkart.com/dl/mxofere-natural-handmade-almond-honey-mixfruit-neem-tulsi-scrub-orange-soap-kit-pack-5/p/itmej54ksafzc5ut?pid=SOPEJ54KFHPQFGRV&affid=siddarthk,http://img.fkcdn.com/image/soap/g/r/v/mxofere-375-natural-handmade-almond-honey-mixfruit-neem-tulsi-200x200-imaebqgyt3rm3cmx.jpeg,Health and Beauty>Bath and Spa>Soaps,271.0,219.0,219.0,false,SOPEJ54KFHPQFGRV,SOPEJ54KFHPQFGRV
Flipkart,,Blackseed Wellness Jasmin with Aloevera,"Handcrafted with love and care by Blackseed Wellness– aimed at empowering women in villages and producing Natural Handmade Soaps and Herbal Cosmetics using age old traditional wisdom providing you Skincare range of best quality and being true to Mother Earth. All our soaps are Natural Oil based and we dip ourselves in the world of oils to benefit you with great skincare. So you Use Fresh, High Quality, Specialty Ingredients for your skin. Oil being a combination of fats and glycerin – which is natural humectants - helps to attract and retain moisture. This controls the ageing process of skin and leaves a Youthful Appearance and Glow. We do not add any harsh chemicals or fillers in our products to increase weight which reduces any harmful waste that contaminates Mother Earth….This way, we Believe in Purity and Preserve Environment and Provide Green Legacy to your Children…. With an aim to empower women, we train and help them to open a Self-Help Cottage Industry thus encouraging them to work in a safe and secure environment. This way, we can Boost Indian Economy by Supporting Local Businesses and Women in Villages for Social Development.",Blackseed Wellness,http://dl.flipkart.com/dl/blackseed-wellness-jasmin-aloevera/p/itmeha5kbezp38gt?pid=SOPEHA5KGMC54BW3&affid=siddarthk,http://img.fkcdn.com/image/soap/b/w/3/blackseed-wellness-100-jasmin-with-aloevera-200x200-imaeh9tegsgg2ad4.jpeg,Health and Beauty>Bath and Spa>Soaps,270.0,162.0,162.0,true,SOPEHA5KGMC54BW3,SOPEHA5KGMC54BW3
Flipkart,,Blackseed Wellness Mandarin,"Handcrafted with love and care by Blackseed Wellness– aimed at empowering women in villages and producing Natural Handmade Soaps and Herbal Cosmetics using age old traditional wisdom providing you Skincare range of best quality and being true to Mother Earth. All our soaps are Natural Oil based and we dip ourselves in the world of oils to benefit you with great skincare. So you Use Fresh, High Quality, Specialty Ingredients for your skin. Oil being a combination of fats and glycerin – which is natural humectants - helps to attract and retain moisture. This controls the ageing process of skin and leaves a Youthful Appearance and Glow. We do not add any harsh chemicals or fillers in our products to increase weight which reduces any harmful waste that contaminates Mother Earth….This way, we Believe in Purity and Preserve Environment and Provide Green Legacy to your Children…. With an aim to empower women, we train and help them to open a Self-Help Cottage Industry thus encouraging them to work in a safe and secure environment. This way, we can Boost Indian Economy by Supporting Local Businesses and Women in Villages for Social Development.",Blackseed Wellness,http://dl.flipkart.com/dl/blackseed-wellness-mandarin/p/itmeha5kkprqaxry?pid=SOPEHA5KYPVYPHUQ&affid=siddarthk,http://img.fkcdn.com/image/soap/h/u/q/blackseed-wellness-100-mandarin-200x200-imaeh9tedbcukuqx.jpeg,Health and Beauty>Bath and Spa>Soaps,270.0,162.0,162.0,true,SOPEHA5KYPVYPHUQ,SOPEHA5KYPVYPHUQ
Flipkart,,Roselyn Milk and Almond Soap,"The milk & Almond Soap is specially formulated from the extract of milk & almond oil, specially for the dry skin. Milks natural essence and the oil extract from the almond will keep your skin nourished, moistened,soft,smooth & lively",Roselyn,http://dl.flipkart.com/dl/roselyn-milk-almond-soap/p/itmeyefurf6drmjc?pid=SOPEYEFUZYGKZHHH&affid=siddarthk,http://img.fkcdn.com/image/soap/h/h/h/roselyn-100-milk-and-almond-soap-200x200-imaeypfrzzueawe2.jpeg,Health and Beauty>Bath and Spa>Soaps,150.0,150.0,150.0,false,SOPEYEFUZYGKZHHH,SOPEYEFUZYGKZHHH
Flipkart,,SaND for Soapaholics Mochaccino Bath Soap(500 g),"The strong scent of coffee and chocolate will refresh our minds and make us feel relaxed. And so will this Mochaccino soap bar. Indulge in a luxurious bath and cleanse your body and give it a salon-like glow with this soap bar from SaND for Soapaholics. For Beautiful Skin Not only does coffee and chocolate taste delicious, but they also make you look gorgeous. Infused with coffee beans and cocoa butter, this soap will make your skin soft, smooth and supple. Nourished and Moisturized Skin To give your skin that extra moisture, this soap is also enriched with olive oil and mango butter. These ingredients will make your skin glow and will provide it with all the nourishment and moisturization.",SaND for Soapaholics,http://dl.flipkart.com/dl/sand-soapaholics-mochaccino-bath-soap/p/itme9zufdhfcngd8?pid=SOPE9ZUTMJDFK2MU&affid=siddarthk,http://img.fkcdn.com/image/soap/2/m/u/sand-for-soapaholics-500-mochaccino-bath-soap-200x200-imaeaymzzhtqyugk.jpeg,Health and Beauty>Bath and Spa>Soaps,2425.0,2425.0,2425.0,true,SOPE9ZUTMJDFK2MU,SOPE9ZUTMJDFK2MU
Flipkart,,SaND for Soapaholics Grasses and Fruits Bath Soap,This beautiful bath soap from SaND for Soapaholics is luscious and full of vitamins and will give you that pristine glow. This soap bar is enriched with wheatgrass and grapefruit which will wash away all the toxins and give your skin a new radiance. Fresh and Beautiful Skin This soap bar is all you will need to feel refreshed whether at the start of the day or at the end. Generously apply this sweet-scented soap bar and you will not want to get out of your bathroom.,SaND for Soapaholics,http://dl.flipkart.com/dl/sand-soapaholics-grasses-fruits-bath-soap/p/itme9zs7vjhg5njt?pid=SOPE9ZS7CBSZZTRE&affid=siddarthk,http://img.fkcdn.com/image/soap/t/r/e/sand-for-soapaholics-200-grasses-and-fruits-bath-soap-200x200-imae9zsrsp6kjfrn.jpeg,Health and Beauty>Bath and Spa>Soaps,840.0,840.0,840.0,true,SOPE9ZS7CBSZZTRE,SOPE9ZS7CBSZZTRE
Flipkart,,Dr. Morepen Skinfine Acne Soap,"Wipe out excessive oil, clear acne blemishes, black heads and white heads without irritation with this skin fine acne soap proffered by Dr. Morepen. This soap is mild enough to be used on the most sensitive of the skin and can safely be used on face and all over body. Its vitamin E deep cleansing astringent effect and tea tree oil further leaves the skin healthy and fairer. Moreover, it is especially effective on blemishes and mild form of acne.",Dr. Morepen,http://dl.flipkart.com/dl/dr-morepen-skinfine-acne-soap/p/itme39chdfajuayp?pid=SOPE39CHFJH67ZV6&affid=siddarthk,http://img.fkcdn.com/image/soap/z/v/6/dr-morepen-75-clean-and-clear-skin-200x200-imae38knama8p68v.jpeg,Health and Beauty>Bath and Spa>Soaps,87.0,87.0,87.0,false,SOPE39CHFJH67ZV6,SOPE39CHFJH67ZV6
Flipkart,,Sattvik Orange Scrub Soap Pack Of 5,"Orange Scrub:This exfoliating herbal soap is blessed with orange, oatmeal & almond extracts. Made in the traditional Indian methods, passed over from generations, this gentle scrub soap, effectively removes dead skin cells and black heads to give you a soft polished feel.",Sattvik,http://dl.flipkart.com/dl/sattvik-orange-scrub-soap-pack-5/p/itme2cbnuyv5ksbb?pid=SOPE2CBNFT8A9RHH&affid=siddarthk,http://img.fkcdn.com/image/soap/r/h/h/sattvik-organics-20-orange-scrub-soap-pack-of-5-200x200-imae2cgubdkw7f29.jpeg,Health and Beauty>Bath and Spa>Soaps,245.0,233.0,233.0,true,SOPE2CBNFT8A9RHH,SOPE2CBNFT8A9RHH
Flipkart,,Lively Bamboo Leaf Soap Orange Blossom(150 g),"Bamboo orange blossom soap, All Natural Antibacterial- Detoxifying Sustainable and Hand Made with Love in Auroville. 100% pure cold processed vegetable glycerine blended with natural essential oils and activated bamboo charcoal. Activated charcoal mildly exfoliates, removes impurities and detoxifies, it can relieve acne, eczema, cracked and dry skin. It is a natural antibacterial, deodouriser and is suitable for all skin types",Lively Bamboo,http://dl.flipkart.com/dl/lively-bamboo-leaf-soap-orange-blossom/p/itmdm4pmnygbmqwc?pid=SOPDNBDZEYKFHHAP&affid=siddarthk,http://img.fkcdn.com/image/soap/h/a/p/lively-bamboo-150-leaf-soap-orange-blossom-200x200-imadnbejesyjgrww.jpeg,Health and Beauty>Bath and Spa>Soaps,120.0,101.0,101.0,false,SOPDNBDZEYKFHHAP,SOPDNBDZEYKFHHAP
Flipkart,,Lively Bamboo Leaf Soap Coconut Milk(150 g),"Bamboo coconut milk soap, All Natural Antibacterial- Detoxifying Sustainable and Hand Made with Love in Auroville. 100% Pure cold processed vegetable glycerine blended with natural essential oils and activated bamboo charcoal. Activated charcoal mildly exfoliates, removes impurities and detoxifies, it can relieve acne, eczema, cracked and dry skin, it is a natural antibacterial, deodouriser and is suitable for all skin types",Lively Bamboo,http://dl.flipkart.com/dl/lively-bamboo-leaf-soap-coconut-milk/p/itmdm4pmt7jgpkhj?pid=SOPDNBDZ7Y3FZ5HX&affid=siddarthk,http://img.fkcdn.com/image/soap/5/h/x/lively-bamboo-150-leaf-soap-coconut-milk-200x200-imadnbejfc9qnjqj.jpeg,Health and Beauty>Bath and Spa>Soaps,120.0,101.0,101.0,false,SOPDNBDZ7Y3FZ5HX,SOPDNBDZ7Y3FZ5HX
Flipkart,,Lively Bamboo Leaf Soap Turmeric(150 g),"Bamboo Turmeric soap, All Natural Antibacterial- Detoxifying Sustainable and Hand Made with Love in Auroville. 100% pure cold processed vegetable glycerine blended with natural essential oils and activated bamboo charcoal. Activated charcoal mildly exfoliates, removes impurities and detoxifies, it can relieve acne, eczema, cracked and dry skin. It is a natural antibacterial, deodouriser and is suitable for all skin types",Lively Bamboo,http://dl.flipkart.com/dl/lively-bamboo-leaf-soap-turmeric/p/itmdm4pms3azxzz3?pid=SOPDNBDZ3Z2HRPKK&affid=siddarthk,http://img.fkcdn.com/image/soap/p/k/k/lively-bamboo-150-leaf-soap-turmeric-200x200-imadnbejm3dakx3v.jpeg,Health and Beauty>Bath and Spa>Soaps,120.0,101.0,101.0,false,SOPDNBDZ3Z2HRPKK,SOPDNBDZ3Z2HRPKK
Flipkart,,Patanjali Ojas Mint - Tulsi Body Cleanser(75 g),"It is Useful for oily skin. Keep the skin free from pimples and refresh and cool. The anti-bacterial properties of neem deeply cleanse your skin, preventing it from any kind of infection and skin disease.",Patanjali,http://dl.flipkart.com/dl/patanjali-ojas-mint-tulsi-body-cleanser/p/itmdyyzfgjcwdrzs?pid=SOPDMT5F5DKET4M8&affid=siddarthk,http://img.fkcdn.com/image/soap/4/m/8/patanjali-75-ojas-mint-tulsi-body-cleanser-200x200-imadmuagzew84ane.jpeg,Health and Beauty>Bath and Spa>Soaps,24.0,20.0,20.0,false,SOPDMT5F5DKET4M8,SOPDMT5F5DKET4M8
Flipkart,,Khadi Herbal Handmade Pure Neem Soap - Pack of 3(375 g),"Moisturising, Enriched with essential oils, Revitalising. Wheat germ oil, one of the most nourishing ingredients that fight ageing, skin issues and ensure you are left with beautiful skin is here with this soap. The combination of the essential oils leave your skin feeling better and your nerve endings and senses soothed. Replenishing the natural oils your skin loses with every bath, the soap ensures your skins hydration is taken ideal care of so you are left with well moisturized skin. Almond oil douses your skin with nutrition to keep your skin feeling better and looking beautiful because the soap revitalizes ageing skin to look more youthful.",Khadi Herbal,http://dl.flipkart.com/dl/khadi-herbal-handmade-pure-neem-soap-pack-3/p/itmdxh8bh9qgxjsg?pid=SOPDXH8BXRNDN7KN&affid=siddarthk,http://img.fkcdn.com/image/soap/7/k/n/khadi-375-handmade-pure-neem-soap-pack-of-3-200x200-imadxhdp3fbuf43k.jpeg,Health and Beauty>Bath and Spa>Soaps,180.0,159.0,159.0,true,SOPDXH8BXRNDN7KN,SOPDXH8BXRNDN7KN
Flipkart,,Pitrashish Beauty Soap with Rose Petal Extracts (Set of 2)(150 g),"Suitable for all skin types, but especially good for dry, sensitive or ageing skins. It has a tonic and astringent effect on the capillaries just below the skin surface, which makes the skin toned and fair. A good bath with Pitashish Beauty Bar can relax tensed nerves. It can also improve your internal health.",Pitrashish,http://dl.flipkart.com/dl/pitrashish-beauty-soap-rose-petal-extracts-set-2/p/itmehxwqfrhqw66f?pid=SOPEHXWQ9HE9YSQM&affid=siddarthk,http://img.fkcdn.com/image/soap/s/q/m/pitrashish-150-beauty-soap-with-rose-petal-extracts-set-of-2-200x200-imaehxhgpuhpnv3h.jpeg,Health and Beauty>Bath and Spa>Soaps,170.0,165.0,165.0,true,SOPEHXWQ9HE9YSQM,SOPEHXWQ9HE9YSQM
Flipkart,,Diana Skin Whitening Soap(125 g),"Diana Skin Whitening Soap-125gm:Whitening SoapIngredients: Sodium Palmitate, Sodium Cocoate, Aqua, Sodium Hydroxide, Sodium Chloride, Glycyrrhiza Glabra (Licorice) Root Extract, EDTA, Etidronic Acid, Parfum, Colorants.Indications: A specially formulated soap to lighten skin color.Directions: Recommended for use twice a day",Diana,http://dl.flipkart.com/dl/diana-skin-whitening-soap/p/itmegykxyyhzsmmy?pid=SOPEGYKXWPNZ5SZX&affid=siddarthk,http://img.fkcdn.com/image/soap/s/z/x/diana-125-skin-whitening-soap-200x200-imaegya8zjkahhsz.jpeg,Health and Beauty>Bath and Spa>Soaps,1200.0,749.0,749.0,true,SOPEGYKXWPNZ5SZX,SOPEGYKXWPNZ5SZX
Flipkart,,Fuschia Shea Butter,"Formulated with a 100% vegetable base and enriched with nourishing Shea Butter; this soap is an ideal balm for dry and dehydrated skin. Its nourishing and protective properties are well known. It boosts cell renewal and helps in maintaining softer, more elastic and comfortable skin. It acts like a barrier for the skin and limits water loss, thus maintaining an optimal level of moisture. It is Non-irritating and is suitable for men, women and children.",Fuschia,http://dl.flipkart.com/dl/fuschia-shea-butter/p/itmeawe9ep5emdhw?pid=SOPEAWE9MMNSPTNM&affid=siddarthk,http://img.fkcdn.com/image/soap/t/n/m/fuschia-100-shea-butter-200x200-imaeaw4zrcqrkryn.jpeg,Health and Beauty>Bath and Spa>Soaps,225.0,157.0,225.0,true,SOPEAWE9MMNSPTNM,SOPEAWE9MMNSPTNM
Flipkart,,Natures Therapy LSA,"(1 : Lemongrass healing & blooming fragrance as an ancient ayurvedic stock herb, lemon grass is naturally peerless as a skin and muscle toner. Also endows your skin with a palpable freshness. Ingredients lemongrass (essential oil), sweet honey, glycerine, castor oil, rose water, soap base (vegetable oils).) (2 : Scottish floral healing & blooming fragrance capturing the fragrance of sweet magnolia flowers, these luxurious soap bars have been triple milled to make them creamier and longer lasting. Enriched with glycerine to help skin maintain its natural moisture balance. Ingredients floral (essential oil), glycerine, castor oil, rose water, soap base (vegetable oils).) (3 : Aloe vera cherishing & renovate fragrance feel the healing touch of one of the oldest known medicinal herbs. With aloe vera, miracles happen everyday. Ingredients aloe vera (essential oil), jojoba oil, aloe vera gel, glycerin, castor oil, rose water, soap base vegetable oils).)",Natures Therapy,http://dl.flipkart.com/dl/natures-therapy-lsa/p/itmeduqngsb5ghtz?pid=SOPEDUQNMTGAEWHZ&affid=siddarthk,http://img.fkcdn.com/image/soap/w/h/z/natures-therapy-375-lsa-200x200-imaedtpvj234vwry.jpeg,Health and Beauty>Bath and Spa>Soaps,360.0,350.0,350.0,true,SOPEDUQNMTGAEWHZ,SOPEDUQNMTGAEWHZ
Flipkart,,Aster Luxury Neem Tulsi Bathing Bar 125g - Pack Of 6(750 g),"Natural Neem Tulsi Soap Aster Luxury Neem Tulsi Soap is blended with anti bacterial and antiseptics properties of Neem and Tulsi. This regular bathing bar controls excess oil, acne, itching and irritation. This soap cleanses the skin deep and combat infections. This soap keep skin free of germs, infections and dirt. It contains natural extracts of holy basil which makes skin smooth, supple and gentle.Benefits of Neem Tulsi SoapMake skin soft & smooth.Prevent acne and skin itchiness. Keep skin clean and germ free.Usage: Firmly hold the aster handmade bathing bar and run all over the wet body. This soap gives good lather that will clean your whole body. Apply lather all over body before showering off.Size: 125 g (4.4 Oz)Ingredients: Coconut Oil, Sorbitol, Castor Oil, Myristic Acid, Stearic Acid, Cocoamido Propyl Betaine, Glycerin, Propylene Glycol, Neem-Tulsi Fragrance OilNo Paraben. No Phthalates. No Animal Testing. No Animal Ingredients. Vegetarian Soap",Aster Luxury,http://dl.flipkart.com/dl/aster-luxury-neem-tulsi-bathing-bar-125g-pack-6/p/itme9hct4rnnsd3s?pid=SOPE9HCTH69SZZGA&affid=siddarthk,http://img.fkcdn.com/image/soap/z/g/a/aster-luxury-750-neem-tulsi-bathing-bar-125g-pack-of-6-200x200-imae9hfjdarx4mdt.jpeg,Health and Beauty>Bath and Spa>Soaps,900.0,450.0,450.0,true,SOPE9HCTH69SZZGA,SOPE9HCTH69SZZGA
Flipkart,,Aster Luxury Avocado Bathing Bar 125g - Pack Of 6(750 g),"Natural Avocado Soap Aster Luxury Avocado gently exfoliates dead skin from the body. This soap contains avocado extracts which helps to improve the skin condition. This soap moisturises and nourishes the skin and softens dry tight skin. It maintains the elasticity of skin and makes skin glowing, soft & healthy.Benefits of Avocado SoapExfoliate dead skin.Moisturise the skin.Best for sensitive & dry skin.Usage: Firmly hold the aster handmade bathing bar and run all over the wet body. This soap gives good lather that will clean your whole body. Apply lather all over body before showering off.Size: 125 g (4.4 Oz)Ingredients: Coconut Oil, Sorbitol, Castor Oil, Myristic Acid, Stearic Acid, Cocoamido Propyl Betaine, Glycerin, Propylene Glycol, Avacado Fragrance OilNo Paraben. No Phthalates. No Animal Testing. No Animal Ingredients. Vegetarian Soap",Aster Luxury,http://dl.flipkart.com/dl/aster-luxury-avocado-bathing-bar-125g-pack-6/p/itme9hctzcgbupvx?pid=SOPE9HCT9G4CKWUS&affid=siddarthk,http://img.fkcdn.com/image/soap/8/s/9/aster-luxury-750-handmade-avocado-soap-125g-pack-of-6-200x200-imae9hfjac3gescq.jpeg,Health and Beauty>Bath and Spa>Soaps,900.0,550.0,550.0,true,SOPE9HCT9G4CKWUS,SOPE9HCT9G4CKWUS
Flipkart,,Aster Luxury Papaya Bathing Soap(125 g),"Natural Papaya SoapEnriched with goodness of Papaya that helps removes dead skin cells and pamper your skin for a smooth, fairer younger looking skin. This soap removes dark spots and blemishes and brings out fresh and brighter skin. It helps removing dead skin cells and eliminates acne. Using it regularly improves skin tone & complexion.Benefits of Papaya Soap:Lighten Pigmentation.Removes Dark Spots.Make Skin Fairer and acne free. Exfoliate dead skin cells.Improve Skin complexion.Usage: Firmly hold the aster luxury handmade bathing bar and run all over the wet body. This soap gives good lather that will clean your whole body. Apply lather all over body before showering off.Size: 125 g (4.4 Oz)Ingredients: Coconut Oil, Castor Oil, Plam Fatty Acid, Rice Bran Fatty Acid, Utylated Hydroxy Toluene, Titanium Di Oxide, Glycerin, Papaya Fragrance OilNo Paraben. No Phthalates. No Animal Testing. No Animal Ingredients. Vegetarian Soap",Aster Luxury,http://dl.flipkart.com/dl/aster-luxury-papaya-bathing-soap/p/itmeaghgd8ydhhcu?pid=SOPEAGHGHTU6J7WG&affid=siddarthk,http://img.fkcdn.com/image/soap/7/w/g/aster-luxury-125-papaya-bathing-soap-200x200-imaeagaqg4hfyags.jpeg,Health and Beauty>Bath and Spa>Soaps,150.0,125.0,125.0,true,SOPEAGHGHTU6J7WG,SOPEAGHGHTU6J7WG
Flipkart,,Aster Luxury Avocado Bathing Bar 125g - Pack Of 4(500 g),"Natural Avocado Soap Aster Luxury Avocado gently exfoliates dead skin from the body. This soap contains avocado extracts which helps to improve the skin condition. This soap moisturises and nourishes the skin and softens dry tight skin. It maintains the elasticity of skin and makes skin glowing, soft & healthy.Benefits of Avocado SoapExfoliate dead skin.Moisturise the skin.Best for sensitive & dry skin.Usage: Firmly hold the aster handmade bathing bar and run all over the wet body. This soap gives good lather that will clean your whole body. Apply lather all over body before showering off.Size: 125 g (4.4 Oz)Ingredients: Coconut Oil, Sorbitol, Castor Oil, Myristic Acid, Stearic Acid, Cocoamido Propyl Betaine, Glycerin, Propylene Glycol, Avacado Fragrance OilNo Paraben. No Phthalates. No Animal Testing. No Animal Ingredients. Vegetarian Soap",Aster Luxury,http://dl.flipkart.com/dl/aster-luxury-avocado-bathing-bar-125g-pack-4/p/itme9hctx9bxxn6y?pid=SOPE9HCT72QZHS66&affid=siddarthk,http://img.fkcdn.com/image/soap/x/v/z/aster-luxury-500-handmade-avocado-soap-125g-pack-of-4-200x200-imae9hfjjbmvs99m.jpeg,Health and Beauty>Bath and Spa>Soaps,600.0,400.0,400.0,true,SOPE9HCT72QZHS66,SOPE9HCT72QZHS66
Flipkart,,Aster Luxury Neem Tulsi Bathing Bar 125g - Pack Of 3(375 g),"Natural Neem Tulsi Soap Aster Luxury Neem Tulsi Soap is blended with anti bacterial and antiseptics properties of Neem and Tulsi. This regular bathing bar controls excess oil, acne, itching and irritation. This soap cleanses the skin deep and combat infections. This soap keep skin free of germs, infections and dirt. It contains natural extracts of holy basil which makes skin smooth, supple and gentle.Benefits of Neem Tulsi SoapMake skin soft & smooth.Prevent acne and skin itchiness. Keep skin clean and germ free.Usage: Firmly hold the aster handmade bathing bar and run all over the wet body. This soap gives good lather that will clean your whole body. Apply lather all over body before showering off.Size: 125 g (4.4 Oz)Ingredients: Coconut Oil, Sorbitol, Castor Oil, Myristic Acid, Stearic Acid, Cocoamido Propyl Betaine, Glycerin, Propylene Glycol, Neem-Tulsi Fragrance OilNo Paraben. No Phthalates. No Animal Testing. No Animal Ingredients. Vegetarian Soap",Aster Luxury,http://dl.flipkart.com/dl/aster-luxury-neem-tulsi-bathing-bar-125g-pack-3/p/itme9hctdszqdejs?pid=SOPE9HCT2W4ZGCYT&affid=siddarthk,http://img.fkcdn.com/image/soap/c/y/t/aster-luxury-375-neem-tulsi-bathing-bar-125g-pack-of-3-200x200-imae9hfjezfycrnq.jpeg,Health and Beauty>Bath and Spa>Soaps,450.0,300.0,300.0,true,SOPE9HCT2W4ZGCYT,SOPE9HCT2W4ZGCYT
