PartnerName,Id,Title,Description,Brand,Link,ImageLink,CategoryName,Mrp,OfferPrice,EffectivePrice,Availability,PartnerIdFromUrl,PartnerIdFromDb
Flipkart,,Drcool 2 Cold Compression Pack,Dr. Cool is the ONLY product to combine ice and compression in one flexible wrap.,Drcool,http://dl.flipkart.com/dl/drcool-2-cold-compression-pack/p/itme4ypqxygtb4pd?pid=HCPE4YPQZQYQVUCA&affid=siddarthk,http://img.fkcdn.com/image/hot-cold-pack/u/c/a/3-drcool-large-200x200-imae4g2xfwebegbr.jpeg,Health and Beauty>Health Care>Medicines & Treatment,2550.0,2250.0,2250.0,true,HCPE4YPQZQYQVUCA,HCPE4YPQZQYQVUCA
Flipkart,,Drcool 1 Cold Compression Pack,Dr. Cool is the ONLY product to combine ice and compression in one flexible wrap.,Drcool,http://dl.flipkart.com/dl/drcool-1-cold-compression-pack/p/itme4ypqvsf7g3xg?pid=HCPE4YPQ7H9XCPCH&affid=siddarthk,http://img.fkcdn.com/image/hot-cold-pack/6/y/c/3-drcool-large-200x200-imae4g2ubyjxufgq.jpeg,Health and Beauty>Health Care>Medicines & Treatment,2150.0,1850.0,1850.0,true,HCPE4YPQ7H9XCPCH,HCPE4YPQ7H9XCPCH
Flipkart,,ActiveCool H1035 Cold Pack(Black),,ActiveCool,http://dl.flipkart.com/dl/activecool-h1035-cold-pack/p/itme6he2adagcqcg?pid=HCPE6HE2MUZJBGRY&affid=siddarthk,http://img.fkcdn.com/image/hot-cold-pack/g/r/y/h1035-activecool-open-re-freezable-cold-pack-200x200-imae6drfgkyppwzb.jpeg,Health and Beauty>Health Care>Medicines & Treatment,315.0,299.0,299.0,true,HCPE6HE2MUZJBGRY,HCPE6HE2MUZJBGRY
Flipkart,,Drcool 1 Cold Compression Pack,Dr. Cool is the ONLY product to combine ice and compression in one flexible wrap.,Drcool,http://dl.flipkart.com/dl/drcool-1-cold-compression-pack/p/itme4ypqvsf7g3xg?pid=HCPE4YPQPWH5XHZB&affid=siddarthk,http://img.fkcdn.com/image/hot-cold-pack/s/g/f/3-drcool-large-200x200-imae4g2t6tkakqwj.jpeg,Health and Beauty>Health Care>Medicines & Treatment,2150.0,1850.0,1850.0,true,HCPE4YPQPWH5XHZB,HCPE4YPQPWH5XHZB
Flipkart,,Drcool 2 Cold Compression Pack,Dr. Cool is the ONLY product to combine ice and compression in one flexible wrap.,Drcool,http://dl.flipkart.com/dl/drcool-2-cold-compression-pack/p/itme4ypqxygtb4pd?pid=HCPE4YPQUQBHDAGV&affid=siddarthk,http://img.fkcdn.com/image/hot-cold-pack/s/g/f/3-drcool-large-200x200-imae4g2t6tkakqwj.jpeg,Health and Beauty>Health Care>Medicines & Treatment,2550.0,2250.0,2250.0,true,HCPE4YPQUQBHDAGV,HCPE4YPQUQBHDAGV
Flipkart,,Healthgenie IB-13599 Cold Pack,"Healthgenie ice bag is an easy resort when encountered a sprain or muscle pull or hamstring. It provides instant relief from the excruciating pain with easy application. All one needs to do is to fill the ice bag with some ice and directly dab or rotate the ice bag on the surface of the pain. The part of the body from where the pain emanates can directly be dealt with easy application of this icebag. Healthgenie icebag comes handy with a 9 inch body that has space for good amount of ice to store. It reaches to any contours of body,economical, light-weight, reusable and children-friendly.This ice bag is also comfortable to use and comprises of water repellent body. It has plastic neck fitting,Ready-to-use anywhere you go. It is largely recommended by doctors and physio therapists,and reduces body temperature during high fever. Suitable in high Fever, muscular Injuries, sprains, relieve pain and swelling from bruises, It is widely used by sports personalitites.",Healthgenie,http://dl.flipkart.com/dl/healthgenie-ib-13599-cold-pack/p/itme68h4tjwtfgy5?pid=HCPE68H4U6GYEUNN&affid=siddarthk,http://img.fkcdn.com/image/hot-cold-pack/u/n/n/ib-13599-healthgenie-ice-bag-200x200-imae689ctxkasnnf.jpeg,Health and Beauty>Health Care>Medicines & Treatment,499.0,409.0,409.0,false,HCPE68H4U6GYEUNN,HCPE68H4U6GYEUNN
Flipkart,,Vaseline Rosy Lips Lip Therapy(4 g),"Your lips are one of the most delicate areas of your skin and due to this they are prone to get dried easily. Moisturize your lips with Vaseline Rosy Lips Lip Therapy. This Vaseline Lip Therapy is formulated with sweet almond oil to nourish and a hint of rose oil for a mild floral scent. This Rosy Lips Lip Therapy adds a natural pinkish hue to your lips. The pro-Vitamin E in this hydrating lip balm stick protects your lips from free radicals keeping them looking young and supple. Suitable for use by everyone, this lip balm can be carried along with you and used any time of the day. Smooth this Vaseline Rosy Lips on and reveal healthy lips with a natural glow.",Vaseline,http://dl.flipkart.com/dl/vaseline-rosy-lips-lip-therapy/p/itmd9arr4csqzcpb?pid=LPBD9YW5TAWCRRHH&affid=siddarthk,http://img.fkcdn.com/image/lip-balm/r/h/h/vaseline-4-rosy-lips-lip-therapy-200x200-imad9e53vszh7hdv.jpeg,Health and Beauty>Body and Skin Care>Lip Care>Lip Balms,150.0,150.0,150.0,false,LPBD9YW5TAWCRRHH,LPBD9YW5TAWCRRHH
Flipkart,,Manufaktura Balzam Na RTY Lip Balm,"Keeping your lips moisturised and soft is essential as chapped lips can cause problems. Get your hands on the Manufaktura Balzam Na RTY Lip Balm which will leave your lips soft and supple. Softening, Moisturising and Nourishing Lip Balm This lip balm will not only soften and moisturise your lips but also nourish them, thus making sure you have healthy lips. Contains Valuable Natural Ingredients As this lip balm contains valuable natural ingredients, it is sure to replenish your lips with moisture. Has Fresh Wine-fruit Scent The fresh wine-fruit scent of this lip balm makes it more desirable and leaves a sweet aroma on your lips.",Manufaktura,http://dl.flipkart.com/dl/manufaktura-balzam-na-rty-lip-balm/p/itmdhebqywzuagjw?pid=LPBDH72HFTRAEBPM&affid=siddarthk,http://img.fkcdn.com/image/lip-balm/b/p/m/manufaktura-15-sensuous-wine-lip-balm-200x200-imadh76awa7zdsrh.jpeg,Health and Beauty>Body and Skin Care>Lip Care>Lip Balms,900.0,900.0,900.0,false,LPBDH72HFTRAEBPM,LPBDH72HFTRAEBPM
Flipkart,,Manufaktura Beer Lip Balm,"Containing traditional Czech beer, the Manufaktura Beer Lip Balm is a luxurious petroleum-free lip balm that moisturises your lips and keeps them feeling kissably soft. Softening Lip Balm The rich emollients in this lip balm provide relief to chapped lips and keep them feeling soft and moisturised even during the cold winter months. Contains Valuable Natural Ingredients The formula contains precious natural ingredients like hop extract, grape oil, shea butter, beeswax and Vitamin E that nourish your lips and make them healthy. Petroleum-free and Preservatives-free The formula is completely free from chemicals and preservatives and is gentle on your skin. So even if you get tempted by the beer flavour and accidentally lick your lips, you wouldn’t ingest chemicals! Has Delicate Bitter-sweet Flavor This Manufaktura Lip Balm has a delicious bitter-sweet flavour that makes you want to apply it over and over again.",Manufaktura,http://dl.flipkart.com/dl/manufaktura-beer-lip-balm/p/itmdh75uzhxpztgb?pid=LPBDH72HHSZCBZ5N&affid=siddarthk,http://img.fkcdn.com/image/lip-balm/z/5/n/manufaktura-15-beer-lip-balm-original-imaeyy8x4gcccjah.jpeg,Health and Beauty>Body and Skin Care>Lip Care>Lip Balms,1200.0,1200.0,1200.0,false,LPBDH72HHSZCBZ5N,LPBDH72HHSZCBZ5N
Flipkart,,"Spirited Soaps Lip Balm Laphroaig, Honey","Keep your lips healthy with this lip balm from Spirited Soaps that nourishes your lips and protects them from drying. This lip balm hydrates your lips and keeps them smooth. Softening Lips Enriched with honey and laphroaig, this lip balm prevents chapping and gives you soft and supple lips. Long-lasting The long-lasting formula of the lip balm stays on for hours and endows you with a healthy pout. This lip balm makes sure that you do not require frequent touch ups. ",Spirited Soaps,http://dl.flipkart.com/dl/spirited-soaps-lip-balm-laphroaig-honey/p/itmdh75ugtz6pxhj?pid=LPBDH72HNQQU7HZE&affid=siddarthk,http://img.fkcdn.com/image/lip-balm/h/z/e/spirited-soaps-10-lip-balm-200x200-imaduzjyrwtggppt.jpeg,Health and Beauty>Body and Skin Care>Lip Care>Lip Balms,999.0,999.0,999.0,false,LPBDH72HNQQU7HZE,LPBDH72HNQQU7HZE
Flipkart,,Maybelline Baby Lips Color New Bright Collection - Neon Rose(4.5 g),,Maybelline,http://dl.flipkart.com/dl/maybelline-baby-lips-color-new-bright-collection-neon-rose/p/itmdqbyuzbmzztbp?pid=LPBDQBYURWSYCWEM&affid=siddarthk,http://img.fkcdn.com/image/lip-balm/w/e/m/maybelline-4-5-baby-lips-color-new-bright-collection-neon-rose-200x200-imadyz6aezbhc694.jpeg,Health and Beauty>Body and Skin Care>Lip Care>Lip Balms,150.0,150.0,150.0,false,LPBDQBYURWSYCWEM,LPBDQBYURWSYCWEM
Flipkart,,Wild Ferns New Zealand Manuka Honey Protective SPF 15 Lip Care,,Wild Ferns,http://dl.flipkart.com/dl/wild-ferns-new-zealand-manuka-honey-protective-spf-15-lip-care/p/itmdjktdm9z2ebhj?pid=LPBDJKRXFGNGJZZZ&affid=siddarthk,http://img.fkcdn.com/image/lip-balm/z/z/z/wild-ferns-12-new-zealand-manuka-honey-protective-spf-15-lip-care-200x200-imadjhg7bp9ryka7.jpeg,Health and Beauty>Body and Skin Care>Lip Care>Lip Balms,1200.0,1200.0,1200.0,false,LPBDJKRXFGNGJZZZ,LPBDJKRXFGNGJZZZ
Flipkart,,Revlon Just Bitten Kissable Balm Stain Rose,,Revlon,http://dl.flipkart.com/dl/revlon-just-bitten-kissable-balm-stain-rose/p/itmdtyr3bnshzmyg?pid=LPBE3HGSTCH4UZKJ&affid=siddarthk,http://img.fkcdn.com/image/lip-balm/z/k/j/revlon-2-7-just-bitten-kissable-balm-stain-200x200-imae3hjkuqkznhrw.jpeg,Health and Beauty>Body and Skin Care>Lip Care>Lip Balms,700.0,700.0,700.0,false,LPBE3HGSTCH4UZKJ,LPBE3HGSTCH4UZKJ
Flipkart,,Eos Limited Edition Lip Balm Berry,"EOS Limited Edition Wildberry Single Blister Lip Balm. A brand new color and flavor of this organic lip balm, with a special design element inspired by sunsets and travel. A perfect gift!Features & BenefitsEach sphere features Rachel Roy's signature wing design to distinguish this special collection100% Natural, USDA-Certified Organic formulaPacked with natural lip conditioning oils and shea butter for soft, smooth lipsPetrolatum-free, paraben-free, gluten-freeSmooth Sphere designed for precise, hygienic application",Eos,http://dl.flipkart.com/dl/eos-limited-lip-balm-berry/p/itme38byyhzghzwg?pid=LPBE38BYGTTYBJGQ&affid=siddarthk,http://img.fkcdn.com/image/lip-balm/j/g/q/eos-7-limited-edition-lip-balm-200x200-imae37g3sn39r7ha.jpeg,Health and Beauty>Body and Skin Care>Lip Care>Lip Balms,999.0,509.0,509.0,false,LPBE38BYGTTYBJGQ,LPBE38BYGTTYBJGQ
Flipkart,,Nivea Fruity Shine Watermelon Lip Balm with Offer,"Essential for everyday care, this Nivea Fruity Shine Watermelon Lip Balm will prevent your lips from getting chapped. It is easy to use, and glides smoothly on your lips while maintaining their delicacy and keeping them nourished. Long-lasting Moisturization The unique Hydra IQ formula nourishes your lips with a long-lasting and intense moisturization and keeps your lips soft and supple. Fruity and Glossy Enriched with watermelon flavor, this lip balm has a mild, fruity taste. The chosen pigments also beautify your lips with a sheer, glossy glow.  ",Nivea,http://dl.flipkart.com/dl/nivea-fruity-shine-watermelon-lip-balm-offer/p/itmdzqz9g5yvnfhx?pid=LPBDZQZ92GTHFB7N&affid=siddarthk,http://img.fkcdn.com/image/lip-balm/b/7/n/nivea-4-8-fruity-shine-lip-balm-with-offer-200x200-imadzs26c5v64ezy.jpeg,Health and Beauty>Body and Skin Care>Lip Care>Lip Balms,140.0,140.0,140.0,false,LPBDZQZ92GTHFB7N,LPBDZQZ92GTHFB7N
Flipkart,,L 'Oreal Paris Dermo Expertise Hydrafresh Lip Balm,"Whether its freezing temperatures outside or your in bed sick to your last bone; your lips are likely to look under nourished and like they need some reviving. Now bring back the life into your lips through any weather condition with this Loreal Paris Dermo Expertise Hydrafresh Lip Balm. Loreal Paris is known to serve its customers with true to the heart ingredients and products. Your lips maybe the smallest part of your body but it needs much nutrition to look its best. Protect your lips with this Hydrafresh formula which will keep your skin shielded from cold temperatures and dehydration. Boost the water content of your lips by regularly applying this Dermo Expertise Lip Balm, the unique formula of the blending ingredients seeps through the top layer of skin and ensures that hydration is supplied enough to keep your lips looking luscious and moisturized. Keeping in mind that your lips do not have a strong protection of hair follicles like the rest of your body, the balm ensures that it maintains the health of your lips through all weather changes and bodily factors. Chapped lips and dry skin do not choose a man or woman, these skin conditions are common to everyone and this balm is composed to nourish. Loreal Paris’ expert and professional care can now be in your hands and take care of your gentle lips so they stay beautiful always.",L 'Oreal Paris,http://dl.flipkart.com/dl/l-oreal-paris-dermo-expertise-hydrafresh-lip-balm/p/itmd9n6ckxsdhnta?pid=LPBD9N6Y3TQGJVPG&affid=siddarthk,http://img.fkcdn.com/image/lip-balm/v/p/g/loreal-paris-10-dermo-expertise-hydrafresh-lip-balm-200x200-imad9pfv3g3f2bv2.jpeg,Health and Beauty>Body and Skin Care>Lip Care>Lip Balms,299.0,299.0,299.0,false,LPBD9N6Y3TQGJVPG,LPBD9N6Y3TQGJVPG
Flipkart,,Nivea Men Active Care Natural,,Nivea,http://dl.flipkart.com/dl/nivea-men-active-care-natural/p/itme3hgsmeftfs4e?pid=LPBE3HGSGSFQUE4M&affid=siddarthk,http://img.fkcdn.com/image/lip-balm/e/4/m/nivea-4-8-men-active-care-200x200-imae3hjkuhzurmug.jpeg,Health and Beauty>Body and Skin Care>Lip Care>Lip Balms,100.0,95.0,95.0,false,LPBE3HGSGSFQUE4M,LPBE3HGSGSFQUE4M
Flipkart,,Avon Simply Pretty Mania Dew Kiss Lip Balm Mango,"This lip balm is non sticky, gives moisturization and little color tint to lips .It is non medicated and non menthol content too",Avon,http://dl.flipkart.com/dl/avon-simply-pretty-mania-dew-kiss-lip-balm-mango/p/itme8ezhysq7aaxu?pid=LPBE8EZHVFAJMVHD&affid=siddarthk,http://img.fkcdn.com/image/lip-balm/v/h/d/avon-4-simply-pretty-mania-dew-kiss-lip-balm-200x200-imae8exh57jfrzrq.jpeg,Health and Beauty>Body and Skin Care>Lip Care>Lip Balms,199.0,135.0,135.0,false,LPBE8EZHVFAJMVHD,LPBE8EZHVFAJMVHD
Flipkart,,Natio Tinted Lip Balm - Spirit,,Natio,http://dl.flipkart.com/dl/natio-tinted-lip-balm-spirit/p/itmefdzrejprx6kq?pid=LPBEFDZRKQMZSC8G&affid=siddarthk,http://img.fkcdn.com/image/lip-balm/c/8/g/natio-4-tinted-lip-balm-spirit-200x200-imaefcsbkqmfxngh.jpeg,Health and Beauty>Body and Skin Care>Lip Care>Lip Balms,295.0,295.0,295.0,false,LPBEFDZRKQMZSC8G,LPBEFDZRKQMZSC8G
Flipkart,,Natio Tinted Lip Balm - Giggle,"Lips are the softest and most tender part of your skin, which is why they can get easily affected by the harsh climatic conditions and environment. Maintain the softness of your lips by applying this Natio Tinted lip balm and add a hint of sheer colour to your natural look. Heal the Cracks with Jojoba and Shea Butter This lightly tinted giggle lip balm is formulated from the essence of shea butter, jojoba, aloe vera, Vitamin A and E. Its creamy texture conditions the dry lips and protects it from pollution. It can nourish your lips from the inside and soften it up to give a sumptuous look.      ",Natio,http://dl.flipkart.com/dl/natio-tinted-lip-balm-giggle/p/itmefdzrstqynpqv?pid=LPBEFDZRE6XCARVE&affid=siddarthk,http://img.fkcdn.com/image/lip-balm/r/v/e/natio-4-tinted-lip-balm-giggle-200x200-imaefcsbnz5efgg3.jpeg,Health and Beauty>Body and Skin Care>Lip Care>Lip Balms,295.0,295.0,295.0,false,LPBEFDZRE6XCARVE,LPBEFDZRE6XCARVE
Flipkart,,Ayur Lip Balm Pack of 12 Strawberry,"Pamper your lips with fresh, fruity flavours, a burst of shine and the smooth feel of a lip balm! Easy to carry small jar has a great conditioning formula, with natural ingredients like beeswax, glycerin and natural fruit extracts, helps to improve lip condition over time and lock in moisture for hours.",Ayur,http://dl.flipkart.com/dl/ayur-lip-balm-pack-12-strawberry/p/itmefs5emhxdkdg8?pid=LPBEFS5EHJH5JUYD&affid=siddarthk,http://img.fkcdn.com/image/lip-balm/u/y/d/ayur-72-lip-balm-pack-of-12-200x200-imaefqgmqv7khuew.jpeg,Health and Beauty>Body and Skin Care>Lip Care>Lip Balms,120.0,120.0,120.0,false,LPBEFS5EHJH5JUYD,LPBEFS5EHJH5JUYD
Flipkart,,Natio Tinted Lip Balm - Smile,"Smear your lips with the colour of your natural blush by using this Tinted Lip Balm from Natio. Designed and available in a stick, this happy-go-lucky shade can be dabbed on every day and carried on most of the occasions. Contains Natural Emollients Enriched with creamy shea butter, jojoba, aloe vera, Vitamin A and E, the lip balm deeply moisturises your soft lips and prevents cracking or chapping of your lip. Easy-to-apply The easy-to-apply stick allows you to spread the balm all over your lips which conditions your lip and smoothens the lines. Hint of Sheer This creamy lip balm has a slightly tinted sheer shade that brings out the natural colour of your lips.",Natio,http://dl.flipkart.com/dl/natio-tinted-lip-balm-smile/p/itmefdzru6w9zver?pid=LPBEFDZRKGCTZCF7&affid=siddarthk,http://img.fkcdn.com/image/lip-balm/c/f/7/natio-4-tinted-lip-balm-smile-200x200-imaefcsb26dmapyk.jpeg,Health and Beauty>Body and Skin Care>Lip Care>Lip Balms,295.0,295.0,295.0,false,LPBEFDZRKGCTZCF7,LPBEFDZRKGCTZCF7
Flipkart,,Natio Tinted Lip Balm - Charm,"Natio presents this tinted lip balm, that covers your lips with a natural sheen and a sweet smell while protecting them from drying or chapping. Small and sleek, it fits well even in the small pocket of your sling bag and can be easily carried along at all times. Moisturizing This lip balm conditions your lips with rich ingredients like shea butter and Vitamins A and E. Natural emollients like aloe and jojoba help prevent darkening of your lips while also keeping them soft and supple. Easy Application Glide it on your lips for a natural sheen and roll it over them again, to build the scarlet shade on your lips.",Natio,http://dl.flipkart.com/dl/natio-tinted-lip-balm-charm/p/itmefdzrwv9zhwms?pid=LPBEFDZRAJHSZF5Z&affid=siddarthk,http://img.fkcdn.com/image/lip-balm/f/5/z/natio-4-tinted-lip-balm-charm-200x200-imaefcsb3hu77fgx.jpeg,Health and Beauty>Body and Skin Care>Lip Care>Lip Balms,295.0,295.0,295.0,false,LPBEFDZRAJHSZF5Z,LPBEFDZRAJHSZF5Z
Flipkart,,Burt's Bees Rejuvenating Lip Balm Acai Berry(4.25 gm),"Super fruit meet stunning lips. We tapped the power-packed A?a? berry for a healthy infusion of Vitamins A, C, D, and E, antioxidants and moisturizing Omega Oils. A 100% natural lip balm born to beautify and revitalize your lovely lips.? Provides a healthy infusion of Vitamins A, C, D, and E, antioxidants and Omega Oils.? Sweet tropical flavor",Burt's Bees,http://dl.flipkart.com/dl/burt-s-bees-rejuvenating-lip-balm-acai-berry/p/itmeyrjnq2uhue4d?pid=LPBEYRJNJCVG3JRQ&affid=siddarthk,http://img.fkcdn.com/image/lip-balm/b/p/2/burt-s-bee-4-25-beeswax-lip-balm-vitamine-peppermint-200x200-imaeyut5bvjjkmzf.jpeg,Health and Beauty>Body and Skin Care>Lip Care>Lip Balms,599.0,499.0,499.0,false,LPBEYRJNJCVG3JRQ,LPBEYRJNJCVG3JRQ
Flipkart,,Revlon Color Burst Matte Balm Rose,,Revlon,http://dl.flipkart.com/dl/revlon-color-burst-matte-balm-rose/p/itme3wr8hq4hhxjk?pid=LPBE3WR87ZGJBXHE&affid=siddarthk,http://img.fkcdn.com/image/lip-balm/x/h/e/revlon-2-7-color-burst-matte-balm-200x200-imae3vy2dzrtysys.jpeg,Health and Beauty>Body and Skin Care>Lip Care>Lip Balms,800.0,800.0,800.0,false,LPBE3WR87ZGJBXHE,LPBE3WR87ZGJBXHE
Flipkart,,Vaseline Lip Therapy Aloe Vera - SPF 15 Aloe Vera,"Protecting your lips from the elements is a task indeed and you should trust a brand who has perfected the function for decades. The Vaseline Pinkish Boost Lip Care Aloe Vera is a special formulation to fight damage and also to soothe your skin so you can flaunt lips that are healthy and look luscious always. Ideal for men and women, this lip balm comes in a handy stick design so application is mess free and your lips - damage free. The composition of this soothing lip balm includes aloe vera, cucumber extract and multivitamins that will enrich your skin and leave you with lips that look flawlessly pink and are perfectly healthy. Ideal for chapped lips, the balm comes with a dermatologically tested composition to keep your skin shielded and beautiful at the same time. Moisturizing your lips as many times as you desire, the chapstick effectively protects your skin against free radicals so you enjoy skin that is lighter and more pink.",Vaseline,http://dl.flipkart.com/dl/vaseline-lip-therapy-aloe-vera-spf-15/p/itmd9arrs6k9x6en?pid=LPBD9YW5KB7AH8CG&affid=siddarthk,http://img.fkcdn.com/image/lip-balm/8/c/g/vaseline-4-lip-therapy-aloe-vera-spf-15-200x200-imae75h3ydmazdzg.jpeg,Health and Beauty>Body and Skin Care>Lip Care>Lip Balms,109.0,109.0,109.0,false,LPBD9YW5KB7AH8CG,LPBD9YW5KB7AH8CG
Flipkart,,Neutrogena Naturals Lip Blam Cocoa Butter(4 g),"Neutrogena Naturals Lip Balm moisturizes and soothes lips. The long lasting formula with Vitamin E bionutrients heals dry skin and keeps lips healthy looking.Protects with Essential MoistureVitamin E bionutrient balm nourishes & soothesNo harsh chemical sulfates, parabens, petrolatum, dyes, phthalates",Neutrogena,http://dl.flipkart.com/dl/neutrogena-naturals-lip-blam-cocoa-butter/p/itme6vtpc4z8yahc?pid=LPBE6VTPYQKDAGS6&affid=siddarthk,http://img.fkcdn.com/image/lip-balm/g/s/6/neutrogena-4-naturals-lip-blam-200x200-imae6vzhpdsdjwtu.jpeg,Health and Beauty>Body and Skin Care>Lip Care>Lip Balms,500.0,495.0,495.0,false,LPBE6VTPYQKDAGS6,LPBE6VTPYQKDAGS6
Flipkart,,Rustic Art Lip Moisturiser Strawberry,"Keep your lips well nourished and hydrated with any of these naturally flavored organic lip moisturizers Say hello to smooth and soft lips as you wave a goodbye to chapped and rough lips. Only natural fragrances of essentials oils and certified organic ingredients used in their making.Ingredients: Bee Wax, Fractionated Coconut Oil, Almond Oil, Carrot Seed Oil, Aloevera, Vit - E Oil, Glycerine, Honey, Shea Butter, Strawberry Essential Oil.Each of Rustic Art creations is untouched by chemicals, machines, animal testing, animal fat and even artificial fragrances colors. Rustic Art, is sensitive to the environment, and live a life full of passion for the nature and are here to share our passion with you.",Rustic Art,http://dl.flipkart.com/dl/rustic-art-lip-moisturiser-strawberry/p/itme6hzqy2nzmh38?pid=LPBE6HZQZSH6CZKG&affid=siddarthk,http://img.fkcdn.com/image/lip-balm/z/k/g/rustic-art-8-lip-moisturiser-200x200-imae6jf9shdfcyfv.jpeg,Health and Beauty>Body and Skin Care>Lip Care>Lip Balms,320.0,320.0,320.0,false,LPBE6HZQZSH6CZKG,LPBE6HZQZSH6CZKG
Flipkart,,Rustic Art Lip Moisturiser Mint,"Keep your lips well nourished and hydrated with any of these naturally flavored organic lip moisturizers Say hello to smooth and soft lips as you wave a goodbye to chapped and rough lips. Only natural fragrances of essentials oils and certified organic ingredients used in their making.Ingredients: Bee Wax, Olive Oil, Jojoba Oil, Coco Butter, Vit - E Oil, Glycerine, Honey, Cherry Oil, Organic Mint Essential Oil, Menthol Crystals.Each of Rustic Art creations is untouched by chemicals, machines, animal testing, animal fat and even artificial fragrances colors. Rustic Art, is sensitive to the environment, and live a life full of passion for the nature and are here to share our passion with you.",Rustic Art,http://dl.flipkart.com/dl/rustic-art-lip-moisturiser-mint/p/itme6hzqy2nzmh38?pid=LPBE6HZQFYDFCDJV&affid=siddarthk,http://img.fkcdn.com/image/lip-balm/d/j/v/rustic-art-8-lip-moisturiser-200x200-imae6jf9awrpkxr2.jpeg,Health and Beauty>Body and Skin Care>Lip Care>Lip Balms,320.0,320.0,320.0,false,LPBE6HZQFYDFCDJV,LPBE6HZQFYDFCDJV
Flipkart,,Nivea Soft Rose Lip Care with Offer(4.8 g),,Nivea,http://dl.flipkart.com/dl/nivea-soft-rose-lip-care-offer/p/itmdzqz9z53fvez9?pid=LPBDZQZ9NHZMSHVS&affid=siddarthk,http://img.fkcdn.com/image/lip-balm/h/v/s/nivea-4-8-lip-care-with-offer-200x200-imadzs26wfu4yxjp.jpeg,Health and Beauty>Body and Skin Care>Lip Care>Lip Balms,135.0,135.0,135.0,false,LPBDZQZ9NHZMSHVS,LPBDZQZ9NHZMSHVS
Flipkart,,Nivea Med Protection Lip Care(4.8 g),"Lips have a very delicate skin; your extremely stressful lifestyle and the harsh weather conditions affect your lips making them dry and pale. The good news is that you can undo all the damage done to your lips and nourish them adequately with this Nivea Med Protection Lip Care. SPF 15 This Nivea Med Protection Lip Care also has SPF 15 to protect your lips from the harmful UVA and UVB rays when you go out in the sun. Vitamin E Vitamin E adds the desired amount of moisture, making your lips soft and supple. Protect Lip Dryness The lip balm gives your lips intense nourishment to keep painful cracks and dryness at bay. Long Lasting moisture The moisture remains for long so that you need not reapply it every time. Provides Extra Care This lip balm is completely safe on your lips and does not contain any harmful preservatives",Nivea,http://dl.flipkart.com/dl/nivea-med-protection-lip-care/p/itmd9arqrhqnzcha?pid=LPBD9YW59Z9XHWQE&affid=siddarthk,http://img.fkcdn.com/image/lip-balm/w/q/e/nivea-4-8-med-protection-lip-care-200x200-imae75h375schuhh.jpeg,Health and Beauty>Body and Skin Care>Lip Care>Lip Balms,145.0,145.0,145.0,false,LPBD9YW59Z9XHWQE,LPBD9YW59Z9XHWQE
Flipkart,,Nivea Fruity Shine Strawaberry SPF 10 Lip Balm(15 ml),"Nivea Fruity Shine Strawaberry SPF 10 lip Balm. NIVEA Lip fruity shine Strawberry Vitamin C & E SPF10. NIVEA - for lips that love to talk, smile , laugh and kiss. 8-hour moisture for long.",Nivea,http://dl.flipkart.com/dl/nivea-fruity-shine-strawaberry-spf-10-lip-balm/p/itmefbhcf3qbhjxw?pid=LPBEFBHC5JFDH4HF&affid=siddarthk,http://img.fkcdn.com/image/lip-balm/4/h/f/nivea-15-fruity-shine-strawaberry-spf-10-lip-balm-200x200-imaef4vgaz6dzdgk.jpeg,Health and Beauty>Body and Skin Care>Lip Care>Lip Balms,165.0,165.0,165.0,false,LPBEFBHC5JFDH4HF,LPBEFBHC5JFDH4HF
