PartnerName,Id,Title,Description,Brand,Link,ImageLink,CategoryName,Mrp,OfferPrice,EffectivePrice,Availability,PartnerIdFromUrl,PartnerIdFromDb
Flipkart,,Nike Extreme Combo Set(Set of 2),"1. Check out this versatile combo of two deodorants for men and women from Nike which will keep you fresh and smelling great all day long. 2. Made using premium quality ingredients, both the fragrances are absolutely safe for your skin. 3. These attractive fragrances are highly long lasting which is a vital feature to keep you on the go in the scorching summer days. 4. Formulated to meet the taste of today's fashion forward people, this combo will be a wonderful gifting option for your loved ones.",Nike,http://dl.flipkart.com/dl/nike-extreme-combo-set/p/itmee97579jcgh4u?pid=CAGEE9758SAJ2G2S&affid=siddarthk,http://img.fkcdn.com/image/combo-gift-set/g/2/s/nike-200x200-imaeekg6umhjbuju.jpeg,Health and Beauty>Fragrances>Deodorants>Combos,500.0,499.0,499.0,true,CAGEE9758SAJ2G2S,CAGEE9758SAJ2G2S
Flipkart,,Evaflor Whisky Combo Set(Set of 3),"Evaflor is a youthful company with modern design. Based on worldwide trends of fashion, it suits Brazilian women's special style. The investment in research guarantee the quality and comfort of pieces specially created to revere feminine silhouette.Whisky Vintage:Wear the timeless style with Whisky Vintage deodorant from Evaflor.The trail blends subtle facets of citrusy accords and spicy aromas for an elegant fragrance.Whiksy Silver:Crafted for the man who knows to balance strength with sensitivity, Evaflor presents Whisky Silver, a perfume that matches his zest with some of its own.Captivating FragranceA wafting scent that will keep you hooked to its lilting notes, the deodorant has a fresh and crisp scent that is reminiscent of marine notes.Blend of Marine and Woody NotesThe fragrance takes the bracing notes of marine origin and mingles it with the deep, dark tones of the woody notes to present an irresistible allure that will not fail you.Bottled in a classy flacon with a silver stopper, the Eau de Toilette is one that will draw attention without you even having to try.Whisky Black:Exude your masculine charm as you step out wearing this Whisky Black deodorant from Evaflor.Long-lastingWrapping you in an oriental aroma, this deodorant leaves you feeling fresh and energetic for long.Seductive InstinctThe enchanting fragrance captures the true masculinity and intriguingly sensuous appeal of the modern man.Mysterious and Fascinating FragranceA blend of tonka bean, blond tobacco, aniseed and citron wraps you in a mysterious and fascinating aroma.",Evaflor,http://dl.flipkart.com/dl/evaflor-whisky-combo-set/p/itmegj7rupqzt2fq?pid=CAGEGJ7RFFJBU75S&affid=siddarthk,http://img.fkcdn.com/image/combo-gift-set/7/5/s/evaflor-200x200-imaeg59m7etf6sv6.jpeg,Health and Beauty>Fragrances>Deodorants>Combos,1049.0,869.0,869.0,true,CAGEGJ7RFFJBU75S,CAGEGJ7RFFJBU75S
Flipkart,,Nike Original Combo Set(Set of 2),"1. Check out this versatile combo of two deodorants for men and women from Nike which will keep you fresh and smelling great all day long. 2. Made using premium quality ingredients, both the fragrances are absolutely safe for your skin. 3. These attractive fragrances are highly long lasting which is a vital feature to keep you on the go in the scorching summer days. 4. Formulated to meet the taste of today's fashion forward people, this combo will be a wonderful gifting option for your loved ones.",Nike,http://dl.flipkart.com/dl/nike-original-combo-set/p/itmee975zrs7pdyw?pid=CAGEE975XMHMBAZU&affid=siddarthk,http://img.fkcdn.com/image/combo-gift-set/a/z/u/nike-200x200-imaeekg6gn9sfbyp.jpeg,Health and Beauty>Fragrances>Deodorants>Combos,498.0,498.0,498.0,true,CAGEE975XMHMBAZU,CAGEE975XMHMBAZU
Flipkart,,Lomani Original & Code Combo Set(Set of 4),"When The Notes Combine And Spread Over Your Skin To Merge With Your Pulse Points, The Fragrance Reaches Its Full Maturity And Leaves You With A Truly Masculine Scent That Creates An Invigorating Aura Around You.",Lomani,http://dl.flipkart.com/dl/lomani-original-code-combo-set/p/itmeehh8rnwjdhm5?pid=CAGEEHH8RXWMHYGG&affid=siddarthk,http://img.fkcdn.com/image/combo-gift-set/y/g/g/lomani-200x200-imaeewg4yvzntwzf.jpeg,Health and Beauty>Fragrances>Deodorants>Combos,900.0,799.0,799.0,true,CAGEEHH8RXWMHYGG,CAGEEHH8RXWMHYGG
Flipkart,,Nature's Essence Oxy-Mystic Moisturizer(200 ml),"Lavish your skin with the intense moisturizing lotion for a more softer, nourished & radiant looking skin. The special oxygen infused micro technology gives skin a flawless texture & makes it more youthful & glowing.",Nature's Essence,http://dl.flipkart.com/dl/nature-s-essence-oxy-mystic-moisturizer/p/itmee2gkctmamsma?pid=MSCEE2GKJARJ3TTB&affid=siddarthk,http://img.fkcdn.com/image/moisturizer-cream/t/t/b/natures-essence-200-oxy-mystic-moisturizer-200x200-imaedhezmzyaheaz.jpeg,Health and Beauty,260.0,260.0,260.0,false,MSCEE2GKJARJ3TTB,MSCEE2GKJARJ3TTB
Flipkart,,Victoria's Secret Pink Wild & Breezy,,Victoria's Secret,http://dl.flipkart.com/dl/victoria-s-secret-pink-wild-breezy/p/itme5rkvtt8qyqdh?pid=MSCE5RKVZWKZJB2M&affid=siddarthk,http://img.fkcdn.com/image/moisturizer-cream/b/2/m/victoria-secret-200-pink-wild-breezy-200x200-imae5rzaszn2kdsk.jpeg,Health and Beauty>Mens Grooming>Body and Skin Care>Moisturizers and Creams,2750.0,1250.0,1250.0,false,MSCE5RKVZWKZJB2M,MSCE5RKVZWKZJB2M
Flipkart,,St. Ives Softening Whipped Silk(59 ml),"Made with an exclusive blend of silk proteins, this unbelievably soft, light-textured cream glides on easily and absorbs quickly for long-lasting moisture. Indulge in St. Ives Softening Whipped Silk Advanced Body Moisturizer daily for skin that looks and feels irresistibly smooth, silky and touchable.��",St. Ives,http://dl.flipkart.com/dl/st-ives-softening-whipped-silk/p/itme529hrfszumnf?pid=MSCE529HBBGVQWZ3&affid=siddarthk,http://img.fkcdn.com/image/moisturizer-cream/w/z/3/st-ives-59-softening-whipped-silk-200x200-imae5fwffyy45vd6.jpeg,Health and Beauty>Mens Grooming>Body and Skin Care>Moisturizers and Creams,170.0,150.0,150.0,true,MSCE529HBBGVQWZ3,MSCE529HBBGVQWZ3
Flipkart,,Victoria's Secret Pure Seduction Body Lotion(60 ml),"Soft skin is sexy skin. We all want soft, beautiful skin, it?s smooth, touchable and nothing short of amazing all over. Make it yours with our ultra-moisturizing lotion. It delivers all-day hydration.Available in a range of scents specifically designed to",Victoria's Secret,http://dl.flipkart.com/dl/victoria-s-secret-pure-seduction-body-lotion/p/itmdugthnkzxz5xq?pid=MSCEFBPRK62KFQXH&affid=siddarthk,http://img.fkcdn.com/image/moisturizer-cream/q/x/h/victoria-s-secret-60-pure-seduction-body-lotion-200x200-imaefamkbukxhhx7.jpeg,Health and Beauty>Mens Grooming>Body and Skin Care>Moisturizers and Creams,800.0,369.0,369.0,false,MSCEFBPRK62KFQXH,MSCEFBPRK62KFQXH
Flipkart,,L'Oreal Paris BB Youth Code Luminizer SPF 15,,L'Oreal Paris,http://dl.flipkart.com/dl/l-oreal-paris-bb-youth-code-luminizer-spf-15/p/itmees7dmcdswpt2?pid=MSCEES7D7DBD6JKY&affid=siddarthk,http://img.fkcdn.com/image/moisturizer-cream/j/k/y/loreal-50-bb-youth-code-luminizer-spf-15-200x200-imae9md2bbgkvhgt.jpeg,Health and Beauty,2250.0,1250.0,1250.0,true,MSCEES7D7DBD6JKY,MSCEES7D7DBD6JKY
Flipkart,,L'Oreal Paris Pore Vanisher Moisturiser,,L'Oreal Paris,http://dl.flipkart.com/dl/l-oreal-paris-pore-vanisher-moisturiser/p/itmedgg3hjctmh58?pid=MSCEDGG3SAC8YGVF&affid=siddarthk,http://img.fkcdn.com/image/moisturizer-cream/g/v/f/loreal-40-pore-vanisher-moisturiser-200x200-imaedgbq2tjwpgky.jpeg,Health and Beauty,1299.0,1290.0,1290.0,false,MSCEDGG3SAC8YGVF,MSCEDGG3SAC8YGVF
Flipkart,,The Body Shop Satsuma Body Butter(200 ml),"The Body Shop difference: Satsuma Body Butter will soften your skin with a refreshing, citrus-scented cream that moisturizes for up to 24 hrs. Community Fair Trade shea butter moisturizes and protects skin with antioxidant Vitamins A, E and F.",The Body Shop,http://dl.flipkart.com/dl/body-shop-satsuma-butter/p/itmdngzgkes8guhk?pid=MSCDMEZUXGHCSUAZ&affid=siddarthk,http://img.fkcdn.com/image/moisturizer-cream/u/a/z/the-body-shop-200-satsuma-body-butter-200x200-imadv7n2gyas3h5u.jpeg,Health and Beauty>Body and Skin Care>Body Care>Moisturizers and Creams,1095.0,1089.0,1089.0,true,MSCDMEZUXGHCSUAZ,MSCDMEZUXGHCSUAZ
Flipkart,,Bags Craze Style Diva Makeup and Jewellery Vanity Box(Beige),"Keep your jewellery safe and secure in this jewellery box that is brought to you by BAGS CRAZE. Constructed out from finest quality material, this jewellery box will surely catch your fancy in just a glance. Moreover, the superior make and the classic finish makes this jewellery box a must have in your collection. In addition, this accessory features a unique shape and comes with easy accessibility for your convenience.",Bags Craze,http://dl.flipkart.com/dl/bags-craze-style-diva-makeup-jewellery-vanity-box/p/itme6kzzy6spz239?pid=VANE6KZZNZ2KYKCJ&affid=siddarthk,http://img.fkcdn.com/image/vanity-box/k/c/j/bc-onlb-809-bags-craze-style-diva-200x200-imae6mh8j3gnncdk.jpeg,Home Decor>Home Utilities>Utility Boxes,5289.0,1659.0,1659.0,false,VANE6KZZNZ2KYKCJ,VANE6KZZNZ2KYKCJ
Flipkart,,"Ecoleatherette Travel Jewellery, Ring, Bangles Vanity Box","This Travel J.box is made from eco-friendly ecoleatheretee which is made from cotton and looks like leather that are available in many colours.Just the right case to hold your clutches, necklace, rings, trinkets, charms and other valuable accessories in a compact case without taking up too much space.This stylish jewellery box is just as luxurious as it looks,This statement jewellery box will look so fab on any women's dressing table!All collections have been exclusively designed and manufactured by our in house team combining rich cultural traditional aesthetics with smart, eye catching designs.",Ecoleatherette,http://dl.flipkart.com/dl/ecoleatherette-travel-jewellery-ring-bangles-vanity-box/p/itme7gw9wm34vqyf?pid=VANE7GW9HXXWRHDG&affid=siddarthk,http://img.fkcdn.com/image/vanity-box/h/d/g/tjb49-lilac-ecoleatherette-travel-200x200-imae7d6ezf6jrsg2.jpeg,Health and Beauty>Makeup>Vanity Boxes,375.0,262.0,375.0,true,VANE7GW9HXXWRHDG,VANE7GW9HXXWRHDG
Flipkart,,Ermani Export Makeup Box Makeup Vanity Box(Silver),,Ermani Export,http://dl.flipkart.com/dl/ermani-export-makeup-box-vanity/p/itmeeksxuv8mgawe?pid=VANEEKSXW9XS7FHN&affid=siddarthk,http://img.fkcdn.com/image/vanity-box/z/4/z/vb050-ermani-export-traditional-jewels-silver-valentine-day-gift-200x200-imaeegcnkhfsnwty.jpeg,Health and Beauty>Makeup>Vanity Boxes,4499.0,899.0,999.0,true,VANEEKSXW9XS7FHN,VANEEKSXW9XS7FHN
Flipkart,,BlushBees Two Layer Leather Jewelry Box Organizer with Lock & Mirror Organiser Vanity Box,"Keep your precious jewelry elegantly organized in this rich leather jewelry case. This Luxurious Jewelry Box features ample storage space to keep your jewelry. Beautiful and Elegant, the box has 2-layer storage with a removable tray divided into slots for keeping jewelry organized. High Quality Faux Leather Exterior and Fiberboard Interior covered with Soft Suede keeps your jewelry dust-free and free from scratches and damage. A lid contains a leather strap inside for earrings and a mirror for makeup. Lid has a handle for easy carrying. Snap Closure with Lock and Key (included) ensures safety and for travel.",BlushBees,http://dl.flipkart.com/dl/blushbees-two-layer-leather-jewelry-box-organizer-lock-mirror-organiser-vanity/p/itmeg8dzvhzfrh5c?pid=VANEG8C2HVSZSA5X&affid=siddarthk,http://img.fkcdn.com/image/vanity-box/a/5/x/and002398-blushbees-two-layer-leather-jewelry-box-organizer-with-200x200-imaeg7fdepbwmhzk.jpeg,Health and Beauty>Makeup>Vanity Boxes,1499.0,1299.0,1299.0,false,VANEG8C2HVSZSA5X,VANEG8C2HVSZSA5X
Flipkart,,Jupiter Gifts And Crafts Bamboo Green Jewellery Vanity Box,Bamboo Made Jewellery Box. Ideal For Bangles And Jewellery. Can Make An Ideal Gift For Your Loved Ones Too.,Jupiter Gifts And Crafts,http://dl.flipkart.com/dl/jupiter-gifts-crafts-bamboo-green-jewellery-vanity-box/p/itme7xf5e2hwhqde?pid=VANE7XF58PYGQHPA&affid=siddarthk,http://img.fkcdn.com/image/vanity-box/h/p/a/bjbg-jupiter-gifts-and-crafts-bamboo-green-200x200-imae7x9nkpkbqxvd.jpeg,Health and Beauty>Makeup>Vanity Boxes,700.0,479.0,479.0,false,VANE7XF58PYGQHPA,VANE7XF58PYGQHPA
Flipkart,,Richpiks Jewellery Accessories Box Jewellery Purpose Vanity Box,,Richpiks,http://dl.flipkart.com/dl/richpiks-jewellery-accessories-box-purpose-vanity/p/itmef3fhtpcd89qc?pid=VANEF3FHK3UWFMFY&affid=siddarthk,http://img.fkcdn.com/image/vanity-box/m/f/y/pi-jb21-richpiks-jewellery-accessories-box-200x200-imaeexhzex7jgpaf.jpeg,Health and Beauty>Makeup>Vanity Boxes,2199.0,1799.0,1799.0,true,VANEF3FHK3UWFMFY,VANEF3FHK3UWFMFY
Flipkart,,Dakshcraft Square Boxes Makeup and Jewellery Vanity Box,"You don't need to keep your jewelry stored in an old shoe box or scattered across the kitchen counter or on your dresser. Jewelry left out in the open can get lost, damaged or dirty and jewelry left in shoe boxes can get tangled or scratched. There are containers that you can use to keep your jewelry stored and organized in a decorative way.",Dakshcraft,http://dl.flipkart.com/dl/dakshcraft-square-boxes-makeup-jewellery-vanity-box/p/itmecpq5vsdydrbd?pid=VANECPQ5VNJJFWZQ&affid=siddarthk,http://img.fkcdn.com/image/vanity-box/w/z/q/bx126-dakshcraft-square-boxes-200x200-imaecpj9jhg95rmg.jpeg,Health and Beauty>Makeup>Vanity Boxes,3060.0,2550.0,2550.0,false,VANECPQ5VNJJFWZQ,VANECPQ5VNJJFWZQ
Flipkart,,Knott Jewellery Makeup Vanity Box,This is an exclusive “Knott” Ornament Box made in a strong mould to provide strength for longevity of the product. It is a perfect utility item for keeping your expensive and precious jewellery intact and also a unique way of complementing/gifting the bride during wedding seasons. A perfect gift for all occasions for someone you love.,Knott,http://dl.flipkart.com/dl/knott-jewellery-makeup-vanity-box/p/itmeasszmzgam7fv?pid=VANEASSZG7YTQJDZ&affid=siddarthk,http://img.fkcdn.com/image/vanity-box/j/h/q/blu-vb-912-knott-blu-vb-912-200x200-imaearnhywejscsn.jpeg,Health and Beauty>Makeup>Vanity Boxes,2199.0,1399.0,1399.0,false,VANEASSZG7YTQJDZ,VANEASSZG7YTQJDZ
Flipkart,,Fuschia Activated Charcoal,Reduce Acne and Improve Skin Health. Activated charcoal removes toxins It helps in reduce the instances of acne and other skin impurities It also works wonders for completely removing makeup.,Fuschia,http://dl.flipkart.com/dl/fuschia-activated-charcoal/p/itmdz3p5zfscacfh?pid=SOPDZ3P5RNGFHG4W&affid=siddarthk,http://img.fkcdn.com/image/soap/g/4/w/fuschia-100-activated-charcoal-200x200-imae76zyunqztqpq.jpeg,Health and Beauty>Bath and Spa>Soaps,225.0,157.0,225.0,false,SOPDZ3P5RNGFHG4W,SOPDZ3P5RNGFHG4W
Flipkart,,Vagad's Khadi Rose & honey Handmade Soap,A unique bathing bar using rose petals water and glycerine. Vagad’s rose soap impart mild antiseptic properties while keeping skin smooth and velvety.,Vagad's,http://dl.flipkart.com/dl/vagad-s-khadi-rose-honey-handmade-soap/p/itmedw6wat3ztcay?pid=SOPEDW6WHYHMMKGR&affid=siddarthk,http://img.fkcdn.com/image/soap/k/g/r/vagad-s-100-khadi-rose-honey-handmade-soap-200x200-imaedukrhg6rwdgm.jpeg,Health and Beauty>Bath and Spa>Soaps,85.0,85.0,85.0,false,SOPEDW6WHYHMMKGR,SOPEDW6WHYHMMKGR
Flipkart,,Aster Luxury Glycerin Bathing Bar - Pack of 3(375 g),"Natural Glycerine SoapOur moisturising glycerine infused natural soap for people having sensitive and oily skin helps keep skin soft and supple. It removes dirt from the skin and maintains balance of oil and moisture to your skin. This soap controls excess oil secretion. This soap refreshes body as well as face and promotes stress relief. Benefits of Glycerine Soap:Contains no harsh chemicals Not tested on animals. Controls excess sebum.Helpful in reducing pimples.Usage:Firmly hold the aster handmade bathing bar and run all over the wet body. This soap gives good lather that will clean your whole body. Apply lather all over body before showering off.Size: 125 g (4.4 Oz) Ingredients:Coconut Oil, Sorbitol, Castor Oil, Myristic Acid, Stearic Acid, Cocoamido Propyl Betaine, Glycerin, Propylene Glycol, Perfume No Paraben. No Phthalates. No Animal Testing. No Animal Ingredients. Vegetarian Soap",Aster Luxury,http://dl.flipkart.com/dl/aster-luxury-glycerin-bathing-bar-pack-3/p/itmebyyzughs7hue?pid=SOPEBYYZTA9YYSVF&affid=siddarthk,http://img.fkcdn.com/image/soap/r/f/7/aster-luxury-125-glycerin-bathing-bar-pack-of-3-200x200-imaebyuasdvqcc5z.jpeg,Health and Beauty>Bath and Spa>Soaps,450.0,300.0,300.0,true,SOPEBYYZTA9YYSVF,SOPEBYYZTA9YYSVF
Flipkart,,Herbs Care HC-8,Perfectly balance of aroma oils and Minerals protects skin from ageing and remove dad skin and impurities from the body and restoes natural glow.,Herbs Care,http://dl.flipkart.com/dl/herbs-care-hc-8/p/itme6fbfh2ajtfue?pid=SOPE6FBFXDGZTQTY&affid=siddarthk,http://img.fkcdn.com/image/soap/q/t/y/herbs-care-400-hc-8-200x200-imae6yq4rtusxbrb.jpeg,Health and Beauty>Bath and Spa>Soaps,500.0,325.0,325.0,false,SOPE6FBFXDGZTQTY,SOPE6FBFXDGZTQTY
Flipkart,,Lively Bamboo Charcoal Soap Musk(75 g),"All Natural Antibacterial- Detoxifying Sustainable & Hand Made with Love in Auroville. 100% Pure cold Processed Vegetable Glycerine blended with Natural essential oils and activated bamboo charcoal. Activated charcoal mildly exfoliates, removes impurities and detoxifies. It can relieve acne, eczema, cracked and dry skin. It is a natural antibacterial, deodouriser and is suitable for all skin types",Lively Bamboo,http://dl.flipkart.com/dl/lively-bamboo-charcoal-soap-musk/p/itmdm4pmczaxpf6a?pid=SOPDM4PHHGCZWAZ9&affid=siddarthk,http://img.fkcdn.com/image/soap/a/z/9/lively-bamboo-75-charcoal-soap-musk-200x200-imadm5yjuj7hbzhc.jpeg,Health and Beauty>Bath and Spa>Soaps,140.0,118.0,118.0,false,SOPDM4PHHGCZWAZ9,SOPDM4PHHGCZWAZ9
Flipkart,,NeeV Herbals Aloe Lavender Soap (Pure)(75 g),,NeeV Herbals,http://dl.flipkart.com/dl/neev-herbals-aloe-lavender-soap-pure/p/itme5pqafsncqbwg?pid=SOPE5PQA46XMZFHF&affid=siddarthk,http://img.fkcdn.com/image/soap/f/h/f/neev-herbals-75-aloe-lavender-soap-pure-200x200-imae5zeyyjmuapxe.jpeg,Health and Beauty>Bath and Spa>Soaps,80.0,80.0,80.0,true,SOPE5PQA46XMZFHF,SOPE5PQA46XMZFHF
Flipkart,,Aster Luxury Chocolate Soap - Pack of 3(375 g),"Natural Chocolate Soap A natural soap enriched with chocolate pampers your skin naturally. This soap deeply cleanses and moisturise the skin and makes it soft, fresh and glowing. It has beautiful essence of chocolate that relives stress. Our natural handmade soaps crafted carefully to cleanse skin impurities. This soap doesn’t contain harsh chemicals like parabens and sulphates that listless the skin. It comes in 125g size.Benefits of Chocolate SoapMake skin soft & smooth.Good for sensitive skin.Fragrance stays last longer.Usage: Firmly hold the aster handmade bathing bar and run all over the wet body. This soap gives good lather that will clean your whole body. Apply lather all over body before showering off.Size: 125 g (4.4 Oz)Ingredients: Coconut Oil, Sorbitol, Castor Oil, Myristic Acid, Stearic Acid, Cocoamido Propyl Betaine, Glycerin, Propylene Glycol, Chocolate Fragrance OilNo Paraben. No Phthalates. No Animal Testing. No Animal Ingredients. Vegetarian Soap",Aster Luxury,http://dl.flipkart.com/dl/aster-luxury-chocolate-soap-pack-3/p/itmeay8nhhtyb59j?pid=SOPEAY8NYWZ5SG7Z&affid=siddarthk,http://img.fkcdn.com/image/soap/g/7/z/aster-luxury-375-chocolate-soap-pack-of-3-200x200-imaeay5pcf2gpyre.jpeg,Health and Beauty>Bath and Spa>Soaps,450.0,300.0,300.0,true,SOPEAY8NYWZ5SG7Z,SOPEAY8NYWZ5SG7Z
Flipkart,,Avera Aromatic Bars Pack,Averas Aromatic Bars Pack is a unisex gift combo which includes - Aloe Bathing Bar (Strawberry) 100 gm & Aloe Bathing Bar (Musk) 100 gm. Strawberry acts as a natural exfoliate with antiseptic and skin lightening properties. Musk lends an intoxicating and long lasting sensual scent that stays on the skin all day long.,Avera,http://dl.flipkart.com/dl/avera-aromatic-bars-pack/p/itmdsmc4fh6sebfg?pid=SOPDSMBUUDTFQHRH&affid=siddarthk,http://img.fkcdn.com/image/soap/h/r/h/avera-100-aromatic-bars-pack-200x200-imadsz72fyhyhhtg.jpeg,Health and Beauty>Bath and Spa>Soaps,275.0,199.0,199.0,true,SOPDSMBUUDTFQHRH,SOPDSMBUUDTFQHRH
Flipkart,,Avera Aloe Bathing Bar (Strawberry),"Aromatic soap enriched with pure herbal extracts and essential oils in soothing flavor of Strawberry & Musk. Strawberry acts as a natural exfoliate with antiseptic and skin lightening properties.Almond, Castor and Coconut oils hydrate and deeply nourish the skin restoring its silky smooth texture and radiant youthful glow. Aloe Vera extracts stimulate healthy cell growth and repair damaged tissues.",Avera,http://dl.flipkart.com/dl/avera-aloe-bathing-bar-strawberry/p/itmdyyz2r5jpkg6f?pid=SOPDRNWW4X5G7WSW&affid=siddarthk,http://img.fkcdn.com/image/soap/w/s/w/avera-100-aloe-bathing-bar-strawberry-200x200-imadrqusvhd7pgej.jpeg,Health and Beauty>Bath and Spa>Soaps,149.0,99.0,99.0,true,SOPDRNWW4X5G7WSW,SOPDRNWW4X5G7WSW
Flipkart,,Avera Aloe Bathing Bar (Musk)(100 g),"Aromatic soap enriched with pure herbal extracts and essential oils in soothing flavor of Strawberry & Musk. Musk lends an intoxicating and long lasting sensual scent that stays on the skin all day long.Almond, Castor and Coconut oils hydrate and deeply nourish the skin restoring its silky smooth texture and radiant youthful glow.Aloe Vera extracts stimulate healthy cell growth and repair damaged tissues.",Avera,http://dl.flipkart.com/dl/avera-aloe-bathing-bar-musk/p/itmdyyzzthhg3fth?pid=SOPDRNWWHQBFAHFU&affid=siddarthk,http://img.fkcdn.com/image/soap/h/f/u/avera-100-aloe-bathing-bar-musk-200x200-imadrqusaqtumtmt.jpeg,Health and Beauty>Bath and Spa>Soaps,149.0,99.0,99.0,true,SOPDRNWWHQBFAHFU,SOPDRNWWHQBFAHFU
Flipkart,,Sebamed Soap(600 g),It comes with a compbo pack which has six soaps and it?s a unique on its way .It can be usedfor both men and women,Sebamed,http://dl.flipkart.com/dl/sebamed-soap/p/itmefmrm9yzjqgej?pid=SOPEFMRMZSTHYG7U&affid=siddarthk,http://img.fkcdn.com/image/soap/g/7/u/sebamed-600-soap-original-imaefnncm8x747qg.jpeg,Health and Beauty>Bath and Spa>Soaps,1590.0,1590.0,1590.0,false,SOPEFMRMZSTHYG7U,SOPEFMRMZSTHYG7U
Flipkart,,Neutrogena Facial Cleansing Bar - 100 gm(100 gm),"Facial Cleansing Bar is pure and gentle cleansing for clean, clear, healthy-looking skin.This glycerin-rich facial bar contains no harsh detergents, dyes or hardeners. It removes excess oil and then rinses clean ?without leaving any pore-clogging residue.Get clean, clear, healthy-looking skin with Neutrogena Facial Cleansing Bar.Available in Original and Fragrance-Free",Neutrogena,http://dl.flipkart.com/dl/neutrogena-facial-cleansing-bar-100-gm/p/itme3tq3wnfx7ghg?pid=SOPE3TQ32NBAKFDV&affid=siddarthk,http://img.fkcdn.com/image/soap/f/d/v/neutrogena-100-facial-cleansing-bar-100-gm-200x200-imae3sceeqdgag47.jpeg,Health and Beauty>Bath and Spa>Soaps,599.0,599.0,599.0,false,SOPE3TQ32NBAKFDV,SOPE3TQ32NBAKFDV
Flipkart,,"Kamasutra Superthin, Wet n Wild, Dotted Condom","Superthin Condom Pack of 12's, Wet n Wild Condom Pack of 12's, Dotted Condom Pack of 12's",Kamasutra,http://dl.flipkart.com/dl/kamasutra-superthin-wet-n-wild-dotted-condom/p/itme9tyaet9eamdv?pid=CDME9TY9YQ3BGDFG&affid=siddarthk,http://img.fkcdn.com/image/condom/d/f/g/3-36-kamasutra-superthin-wet-n-wild-dotted-200x200-imae9tvdkbcp6jvg.jpeg,Health and Beauty>Sexual Wellness>Condoms>For Him,320.0,300.0,300.0,true,CDME9TY9YQ3BGDFG,CDME9TY9YQ3BGDFG
Flipkart,,"Kamasutra Dotted, Wet n Wild, Intensity Condom","Dotted Condom Pack of 12's, Wet n Wild Condom Pack of 12's, Intensity Condom Pack of 12's",Kamasutra,http://dl.flipkart.com/dl/kamasutra-dotted-wet-n-wild-intensity-condom/p/itme9tyakwqazj96?pid=CDME9TY9BB6KSBPX&affid=siddarthk,http://img.fkcdn.com/image/condom/b/p/x/3-36-kamasutra-dotted-wet-n-wild-intensity-200x200-imae9tvda5dc2g5u.jpeg,Health and Beauty>Sexual Wellness>Condoms>For Him,320.0,310.0,310.0,true,CDME9TY9BB6KSBPX,CDME9TY9BB6KSBPX
Flipkart,,Operon Operon-Cuff-01 Bp Monitor Cuff,,Operon,http://dl.flipkart.com/dl/operon-operon-cuff-01-bp-monitor-cuff/p/itmef7nhnvuh3ysw?pid=BMUEF7NH8THHZUB3&affid=siddarthk,http://img.fkcdn.com/image/bp-monitor-cuff/u/b/3/operon-cuff-01-operon-200x200-imaef5b8jatsnhqq.jpeg,Electronics>Health and Personal Care>Health Care>BP Monitor Cuffs,750.0,350.0,350.0,true,BMUEF7NH8THHZUB3,BMUEF7NH8THHZUB3
Flipkart,,EZEE Umbrella Wooden - NA,Complete your tropical party look with wooden Umbrella Toothpick / Paper Parasol Picks. Paper Parasol Picks are perfect as drink umbrellas or cupcake toppers. Paper Parasol Picks are a fun accessory for your luau party or cocktail party. Coordinate with other luau party supplies and decorations from Unique.Features:• Eco-friendly in natureBenefit:• Perfect for creating a tropical atmosphere for any luau party• Use these picks for serving snacks or for crafts• Coordinate with other tropical party supplies and decorations from UniqueSize:Length: 3 Inches Pack:300 Wooden Umbrella Toothpick available in this pack.,EZEE,http://dl.flipkart.com/dl/ezee-umbrella-wooden-na/p/itmef7pfhg8tu38t?pid=DFSEF7PYXXHGFTNS&affid=siddarthk,http://img.fkcdn.com/image/dental-floss-stick/t/n/s/3-ezee-toothpick-umbrella-wooden-200x200-imaedmyekawxyesq.jpeg,Health and Beauty>Body and Skin Care>Oral Care>Dental Flosses & Sticks,855.0,385.0,550.0,true,DFSEF7PYXXHGFTNS,DFSEF7PYXXHGFTNS
Flipkart,,Ezee Wooden Mini Toothpicks 140 sticks - None,,Ezee,http://dl.flipkart.com/dl/ezee-wooden-mini-toothpicks-140-sticks-none/p/itme9a8p5hn9qyjm?pid=DFSE9A8PKXWH7HAA&affid=siddarthk,http://img.fkcdn.com/image/dental-floss-stick/h/a/a/2-ezee-stick-wooden-mini-toothpicks-140-sticks-200x200-imae9a4acezjvnfy.jpeg,Health and Beauty>Body and Skin Care>Oral Care>Dental Flosses & Sticks,690.0,499.0,499.0,true,DFSE9A8PKXWH7HAA,DFSE9A8PKXWH7HAA
