PartnerName,Id,Title,Description,Brand,Link,ImageLink,CategoryName,Mrp,OfferPrice,EffectivePrice,Availability,PartnerIdFromUrl,PartnerIdFromDb
Flipkart,,Bare Essentials Sisal Bath Brush,"Autumn is an elegant time of the year, all the leaves turn from green to shades of gold and bronze, adding soothing hues to nature. However, when the fallen leaves form a thick layer out on your lawn, it is not so picture perfect anymore because grass does not survive under the layer of refuse. This is the exact thing that your skin goes through if you do not remove dead cells with a scrub regularly. This ignorance can choke your skin from clean and fresh oxygen as well as nourishment, resulting in dull looking skin. This Bare Essentials Sisal Bath Brush is your solution to clearer and brighter skin and is ideal for men and women. Made of sisal, a natural fibre, this bath brush has been crafted with grooves that help in massaging your skin as you scrub, this aids in stimulating blood circulation to your skin’s surface. As you clean your body, the brush helps in loosening dead cells that still remain on your skin ensuring that your body feels refreshed and smooth. The unique design of this brush leaves your skin soft after every time you use it to scrub. For best results, after you finish lathering soap or gel on your body, dampen the brush with the same and start to scrub with circular movements and rinse thoroughly. So take your bath brush along for your bath two or three times in a week and be ready to leave your skin supple and glowing.",Bare Essentials,http://dl.flipkart.com/dl/bare-essentials-sisal-bath-brush/p/itmdgauwr7smawvb?pid=BBSD92YVPQZKX9FV&affid=siddarthk,http://img.fkcdn.com/image/bath-brush/9/f/v/bare-essentials-sisal-bath-brush-200x200-imadunhptdhtf5gq.jpeg,Health and Beauty>Beauty Accessories>Bath and Spa Accessories>Bath Brushes,315.0,315.0,315.0,true,BBSD92YVPQZKX9FV,BBSD92YVPQZKX9FV
Flipkart,,Vega Natural Bristle Bath Brush NBA-1-3,"A long rejuvenating bath always is the solution that people love taking when all else fails around them. sometimes fighting against a lot of resistance, whether it is at work or school or home, drains all the energy out of you. Take the easy and soothing way to a healthy body and mind with this Vega Natural Bristle Bath Brush. Exfoliate skin effectively The dirt and grime accumulated in the pores of your skin will lead to your skin looking dull and lifeless, evade this by exfoliating your skin effectively with this bristle brush. Clean and glowing skin You can get that clean and glowing skin with the help of this Bristle Bath Brush. Soft bristles- remove dirt and dead cells The Brush has soft bristles which leaves your skin soft and supple while removing dirt and dead skin cells Long handles- clean areas near shoulders The long handle of this brush will help to easily clean areas near your shoulders, which are otherwise difficult to reach with your hands. Helps in stimulating blood circulation The soft bristles of this brush soothes your skin and stimulates blood circulation.",Vega,http://dl.flipkart.com/dl/vega-natural-bristle-bath-brush-nba-1-3/p/itmd9atccwzvmha8?pid=BBSD92YVBEJJY9JQ&affid=siddarthk,http://img.fkcdn.com/image/bath-brush/9/j/q/nba1-3-vega-natural-bristle-bath-brush-nba1-3-200x200-imadj79qbxzwgjcz.jpeg,Health and Beauty>Beauty Accessories>Bath and Spa Accessories>Bath Brushes,275.0,249.0,249.0,true,BBSD92YVBEJJY9JQ,BBSD92YVBEJJY9JQ
Flipkart,,Vega Luxury Soft Sponge Brush BA-1-5,"Having a beautiful, clean and glowing skin is what everyone desires. Keeping the skin clean, exfoliated and well moisturized, is what is most required to keep it healthy. When it comes to skin exfoliation, no other skin care product is more efficient than this exclusive Luxury Soft Sponge Brush from Vega. This Vega Luxury is crafted for both men and women to keep them clean and have a relaxed shower. The Brush has a super soft mesh sponge which helps in blood circulation. The Vega Luxury Soft Sponge Brush delivers a soothing massaging effect and is an ideal solution to your whole day of tiredness and stress. So, after a long hard day, the thought of using this Luxury Soft Sponge can help ease your tension.",Vega,http://dl.flipkart.com/dl/vega-luxury-soft-sponge-brush-ba-1-5/p/itmdgauqdtbgb7zr?pid=BBSD92YVFDJGC63G&affid=siddarthk,http://img.fkcdn.com/image/bath-brush/6/3/g/ba-1-5-vega-luxury-soft-sponge-brush-200x200-imad9dzyry6vjwhu.jpeg,Health and Beauty>Beauty Accessories>Bath and Spa Accessories>Bath Brushes,190.0,180.0,180.0,true,BBSD92YVFDJGC63G,BBSD92YVFDJGC63G
Flipkart,,elf Studio Eyebrow Kit 3.7 g(Dark-81303),"Create brows that are fuller, thicker, and more defined! The pigmented wax defines and shapes brows and the color complementing setting powder keeps them looking arched and perfected. The doubled sided taklon brush has one side to help arch your brows while the other side aids in filling them in. This duo provides lasting color definition for a naturally beautiful look.",elf,http://dl.flipkart.com/dl/elf-studio-eyebrow-kit-3-7-g/p/itme954fzqhzjhdy?pid=EBEE954FE7KFSQYX&affid=siddarthk,http://img.fkcdn.com/image/eyebrow-enhancer/d/e/s/e-l-f-5-eyebrow-kit-dark-200x200-imae94zsqyhhdzpw.jpeg,Health and Beauty>Makeup>Eyes>Eyebrow Enhancers,1000.0,800.0,800.0,false,EBEE954FE7KFSQYX,EBEE954FE7KFSQYX
Flipkart,,elf Studio Eyebrow Kit 3.7 g(Medium-81302),"Create brows that are fuller, thicker, and more defined! The pigmented wax defines and shapes brows and the color complementing setting powder keeps them looking arched and perfected. The doubled sided taklon brush has one side to help arch your brows while the other side aids in filling them in. This duo provides lasting color definition for a naturally beautiful look.",elf,http://dl.flipkart.com/dl/elf-studio-eyebrow-kit-3-7-g/p/itme954fzqhzjhdy?pid=EBEE954FJDJRRXZA&affid=siddarthk,http://img.fkcdn.com/image/eyebrow-enhancer/x/z/a/elf-3-7-studio-eyebrow-kit-200x200-imae94zsz2cfc6jy.jpeg,Health and Beauty>Makeup>Eyes>Eyebrow Enhancers,1000.0,750.0,750.0,false,EBEE954FJDJRRXZA,EBEE954FJDJRRXZA
Flipkart,,elf Studio Eyebrow Kit 3.7 g(Light-81301),"Create brows that are fuller, thicker, and more defined! The pigmented wax defines and shapes brows and the color complementing setting powder keeps them looking arched and perfected. The doubled sided taklon brush has one side to help arch your brows while the other side aids in filling them in. This duo provides lasting color definition for a naturally beautiful look.",elf,http://dl.flipkart.com/dl/elf-studio-eyebrow-kit-3-7-g/p/itme954fzqhzjhdy?pid=EBEE954FX4WHZVEY&affid=siddarthk,http://img.fkcdn.com/image/eyebrow-enhancer/v/e/y/elf-3-7-studio-eyebrow-kit-200x200-imae94zsutbbhgcz.jpeg,Health and Beauty>Makeup>Eyes>Eyebrow Enhancers,1000.0,750.0,750.0,false,EBEE954FX4WHZVEY,EBEE954FX4WHZVEY
Flipkart,,Ladyshape Heart and Free Gillette Razor for Women Disposable Razor(Pack of 1),"Ladyshape Heart comes with a template to get the exact desired shape. Just shave away the hair around the template for the perfect result every time. Ladyshape provides you perfect shapes and helps in tightening the skin while using it. Its ergonomic handle makes sure that there is no slipping. Ladyshape Brazilian makes you feel neat, sexy and self-assured.",Ladyshape,http://dl.flipkart.com/dl/ladyshape-heart-free-gillette-razor-women-disposable/p/itmdmwnkqkhjebgk?pid=DSRDMWNJWEQ2SF6B&affid=siddarthk,http://img.fkcdn.com/image/disposable-shaving-razor/f/6/b/1-ladyshape-heart-and-free-gillette-razor-for-women-200x200-imadmvb6fbyhmhuv.jpeg,Health and Beauty>Body and Skin Care>Body Care>Hair Removal>Disposable Shaving Razors,1699.0,1699.0,1699.0,false,DSRDMWNJWEQ2SF6B,DSRDMWNJWEQ2SF6B
Flipkart,,Ladyshape Triangle and Free Gillette Razor for Women Disposable Razor(Pack of 1),"Ladyshape Triangle is the hotter, sexier way to shave your pubic hair and adds to your hot quotient. It would surely make your man fall in love with you all over again. It comes with a template to get the exact desired shape. Just shave away the hair around the template for the perfect result every time. Ladyshape provides you perfect shapes, and helps in tightening the skin while using it. Its ergonomic handle makes sure that there is no slipping. Ladyshape Brazilian makes you feel neat, sexy and self-assured",Ladyshape,http://dl.flipkart.com/dl/ladyshape-triangle-free-gillette-razor-women-disposable/p/itmdmwnkbwh7phcy?pid=DSRDMWNJZ9MP4F3G&affid=siddarthk,http://img.fkcdn.com/image/disposable-shaving-razor/f/3/g/1-ladyshape-triangle-and-free-gillette-razor-for-women-200x200-imadmvb6d3wvvjhj.jpeg,Health and Beauty>Body and Skin Care>Body Care>Hair Removal>Disposable Shaving Razors,1699.0,1699.0,1699.0,false,DSRDMWNJZ9MP4F3G,DSRDMWNJZ9MP4F3G
Flipkart,,Ladyshape Brazillian and Gillette Razor for Women Disposable Razor(Pack of 2),"Brazilian bikini shave is hot. It adds to your sex appeal, on the beach and in the bedroom, It comes with a template to get the exact desired shape, Just shave away the hair around the template for the perfect result every time. It provides you perfect shapes, and helps in tightening the skin while using it, Its ergonomic handle makes sure that there is no slipping. It makes you feel neat, sexy and self-assured.",Ladyshape,http://dl.flipkart.com/dl/ladyshape-brazillian-gillette-razor-women-disposable/p/itmdpujmgysznnkj?pid=DSRDPUJMABYCARK7&affid=siddarthk,http://img.fkcdn.com/image/disposable-shaving-razor/r/k/7/2-ladyshape-brazillian-and-gillette-razor-for-women-200x200-imadpv7cyhgsfect.jpeg,Health and Beauty>Body and Skin Care>Body Care>Hair Removal>Disposable Shaving Razors,1699.0,1444.0,1444.0,true,DSRDPUJMABYCARK7,DSRDPUJMABYCARK7
Flipkart,,Schick New Grip 2  Disposable Razor,Best Quality Disposable Razor,Schick,http://dl.flipkart.com/dl/schick-new-grip-2-disposable-razor/p/itme6nsnfbqfchrz?pid=DSRE6NSN7ENPNMGG&affid=siddarthk,http://img.fkcdn.com/image/disposable-shaving-razor/m/g/g/24-schick-new-grip-2-disposable-razor-200x200-imae6jdzmfphzvq4.jpeg,Health and Beauty>Mens Grooming>Razors and Blades>Disposable Shaving Razors,720.0,249.0,249.0,false,DSRE6NSN7ENPNMGG,DSRE6NSN7ENPNMGG
Flipkart,,gillette Venus Oceana Disposable Razor,,gillette,http://dl.flipkart.com/dl/gillette-venus-oceana-disposable-razor/p/itme88w5vvgeyag8?pid=DSRE88W5SSM2S2ZV&affid=siddarthk,http://img.fkcdn.com/image/disposable-shaving-razor/2/z/v/2-gillette-venus-oceana-200x200-imaeh9dg3mznvqcy.jpeg,Health and Beauty>Body and Skin Care>Body Care>Hair Removal>Disposable Shaving Razors,249.0,249.0,249.0,false,DSRE88W5SSM2S2ZV,DSRE88W5SSM2S2ZV
Flipkart,,John Frieda Brilliant Brunette Daily,"For natural, color-treated or highlighted brunettes. Reveals incredible shine, clarity and luminosity while gently cleansing. Brings out the multi-dimensional richness of brown highlights. Low-pH formula with cocoa bean extract and silk protein. Developed exclusively for brown hair, patented brilliant brunettes shampoo exposed the unique richness of brunette. Specially formulated to deliver incredible shine, clarity and luminosity to brown hair, brilliant brunette Shine Release Shampoo reveals and illuminates the rich, multi-dimensional spectrum of brunette tones, without adding or depositing color. Gentle enough for daily use, this silky-lathering formula washes away dulling dirt and oils, while perfecting the condition of your hair to produce breathtaking shine. With regular use, unique brunette tones come alive with vibrancy and incredible luster. Designed specifically to enhance darker shades of brown hair, this low-pH formula features cocoa bean extract and silk protein. Form luminous chestnut to shimmering espresso, it's time for brunettes to shine.",John Frieda,http://dl.flipkart.com/dl/john-frieda-brilliant-brunette-daily/p/itmdxx4nf4gdymwr?pid=SMPDXX4NHHYYBD2G&affid=siddarthk,http://img.fkcdn.com/image/shampoo/d/2/g/john-frieda-250-brilliant-brunette-daily-200x200-imadxx74grkhmnzw.jpeg,Health and Beauty>Hair Care>Shampoos,450.0,450.0,450.0,false,SMPDXX4NHHYYBD2G,SMPDXX4NHHYYBD2G
Flipkart,,Humas Herbals Shampoo,,Humas Herbals,http://dl.flipkart.com/dl/humas-herbals-shampoo/p/itme9gu5rnshuyvj?pid=SMPE9GU4CWB5J3KZ&affid=siddarthk,http://img.fkcdn.com/image/shampoo/3/k/z/humas-herbals-100-shampoo-200x200-imaegxs8fh5epagn.jpeg,Health and Beauty>Hair Care>Shampoos,237.0,237.0,237.0,true,SMPE9GU4CWB5J3KZ,SMPE9GU4CWB5J3KZ
Flipkart,,Karnani Deeva Amla Shikakai Shampoo (Herbal),"This Amla Shikakai Herbal Shampoo controls hair damage, hair fall and repairs split ends.",Karnani Deeva,http://dl.flipkart.com/dl/karnani-deeva-amla-shikakai-shampoo-herbal/p/itme9g6nuffjgmza?pid=SMPE9G6NMFGQRGXC&affid=siddarthk,http://img.fkcdn.com/image/shampoo/g/x/c/karnani-deeva-200-amla-shikakai-shampoo-herbal-200x200-imae9g3udhg7a2va.jpeg,Health and Beauty>Hair Care>Shampoos,160.0,150.0,150.0,true,SMPE9G6NMFGQRGXC,SMPE9G6NMFGQRGXC
Flipkart,,Vega Large Nail Clipper Black(Pack of 2 ),,Vega,http://dl.flipkart.com/dl/vega-large-nail-clipper-black-pack-2/p/itme9hqnhcjhgdeh?pid=NCCE9HQNQKE7VQWH&affid=siddarthk,http://img.fkcdn.com/image/nail-clipper-cutter/q/w/h/lnc-03-vega-large-nail-clipper-black-pack-of-2-200x200-imae6dybyhpy2fdg.jpeg,Health and Beauty>Body and Skin Care>Body and Skin Accessories>Nail Clippers & Cutters,120.0,115.0,115.0,true,NCCE9HQNQKE7VQWH,NCCE9HQNQKE7VQWH
Flipkart,,Paisley Bay Lotus Blingey Sunshine Baby Head Band(Yellow),"3"" flower ; rhinestone accent; 12"" elastic; upto 3 years",Paisley Bay,http://dl.flipkart.com/dl/paisley-bay-lotus-blingey-sunshine-baby-head-band/p/itme9g6c3dfg6zxq?pid=HACE9G6CATVEPQEK&affid=siddarthk,http://img.fkcdn.com/image/hair-accessory/q/e/k/hbf98-1-paisley-bay-head-band-lotus-blingey-sunshine-baby-200x200-imae9gy6zzgv9c6b.jpeg,Health and Beauty>Hair Care>Hair Care Accessories>Hair Accessories,1500.0,299.0,299.0,false,HACE9G6CATVEPQEK,HACE9G6CATVEPQEK
Flipkart,,Paisley Bay Triple Rose Handmade Boquet Baby Head Band(Multicolor),"3"" flower ; rhinestone accent; 12"" elastic; upto 3 years",Paisley Bay,http://dl.flipkart.com/dl/paisley-bay-triple-rose-handmade-boquet-baby-head-band/p/itme9g6bvggay7c3?pid=HACE9G6BBFUFUUWZ&affid=siddarthk,http://img.fkcdn.com/image/hair-accessory/u/w/z/hbf113-1-paisley-bay-head-band-triple-rose-handmade-boquet-baby-200x200-imae9gy6ctqqw93g.jpeg,Health and Beauty>Hair Care>Hair Care Accessories>Hair Accessories,1500.0,289.0,289.0,false,HACE9G6BBFUFUUWZ,HACE9G6BBFUFUUWZ
Flipkart,,Paisley Bay Lotus Blingey Fiery Red Baby Head Band(Red),"3"" flower ; rhinestone accent; 12"" elastic; upto 3 years",Paisley Bay,http://dl.flipkart.com/dl/paisley-bay-lotus-blingey-fiery-red-baby-head-band/p/itme9g6cqtjhby2t?pid=HACE9G6CMCE4HG2G&affid=siddarthk,http://img.fkcdn.com/image/hair-accessory/g/2/g/hbf100-1-paisley-bay-head-band-lotus-blingey-fiery-red-baby-200x200-imae9gy6zjsctvb4.jpeg,Health and Beauty>Hair Care>Hair Care Accessories>Hair Accessories,1500.0,299.0,299.0,false,HACE9G6CMCE4HG2G,HACE9G6CMCE4HG2G
Flipkart,,Paisley Bay Triple Rose Handmade Colourful Baby Head Band(Multicolor),"3"" flower ; rhinestone accent; 12"" elastic; upto 3 years",Paisley Bay,http://dl.flipkart.com/dl/paisley-bay-triple-rose-handmade-colourful-baby-head-band/p/itme9g6bghbawvnd?pid=HACE9G6BFJCME9YF&affid=siddarthk,http://img.fkcdn.com/image/hair-accessory/9/y/f/hbf112-1-paisley-bay-head-band-triple-rose-handmade-colourful-200x200-imae9gy6j2duggyz.jpeg,Health and Beauty>Hair Care>Hair Care Accessories>Hair Accessories,1500.0,299.0,299.0,false,HACE9G6BFJCME9YF,HACE9G6BFJCME9YF
Flipkart,,Paisley Bay Lotus Blingey Awesome Baby Head Band(Pink),"3"" flower ; rhinestone accent; 12"" elastic; upto 3 years",Paisley Bay,http://dl.flipkart.com/dl/paisley-bay-lotus-blingey-awesome-baby-head-band/p/itme9g6cjgtqqtfb?pid=HACE9G6CXZUZKVSG&affid=siddarthk,http://img.fkcdn.com/image/hair-accessory/v/s/g/hbf101-1-paisley-bay-head-band-lotus-blingey-awesome-baby-200x200-imae9gy6rkbgugzp.jpeg,Health and Beauty>Hair Care>Hair Care Accessories>Hair Accessories,1500.0,299.0,299.0,false,HACE9G6CXZUZKVSG,HACE9G6CXZUZKVSG
Flipkart,,Paisley Bay Triple Rose Handmade Sunny Baby Head Band(Yellow),"3"" flower ; rhinestone accent; 12"" elastic; upto 3 years",Paisley Bay,http://dl.flipkart.com/dl/paisley-bay-triple-rose-handmade-sunny-baby-head-band/p/itme9g6bnv6xdhmy?pid=HACE9G6BFTBWMNNM&affid=siddarthk,http://img.fkcdn.com/image/hair-accessory/n/n/m/hbf107-1-paisley-bay-head-band-triple-rose-handmade-sunny-baby-200x200-imae9gy6v8dzxzh4.jpeg,Health and Beauty>Hair Care>Hair Care Accessories>Hair Accessories,1500.0,299.0,299.0,false,HACE9G6BFTBWMNNM,HACE9G6BFTBWMNNM
Flipkart,,Viva Fashions Polka Dots Bow Hair Band(Brown),Stylish and cute Hairband Polka dot Hairband Bow for your little princess.Key Features Comfortable and stylishLight in weight and durable.Bow appliqueEnsures strong gripBow Dimension - 3 inch,Viva Fashions,http://dl.flipkart.com/dl/viva-fashions-polka-dots-bow-hair-band/p/itme9ggghpy6xe6t?pid=HACE9GGHZNMREZVG&affid=siddarthk,http://img.fkcdn.com/image/hair-accessory/z/v/g/vf-36-1-viva-fashions-hair-band-polka-dots-bow-200x200-imae9gdwgfhwahgs.jpeg,Health and Beauty>Hair Care>Hair Care Accessories>Hair Accessories,249.0,160.0,160.0,false,HACE9GGHZNMREZVG,HACE9GGHZNMREZVG
Flipkart,,Paisley Bay Triple Rose Handmade Pretty Head Band(Purple),"3"" flower ; rhinestone accent; 12"" elastic; upto 3 years",Paisley Bay,http://dl.flipkart.com/dl/paisley-bay-triple-rose-handmade-pretty-head-band/p/itme9g6bgyeerwvx?pid=HACE9G6BN2FGYG8D&affid=siddarthk,http://img.fkcdn.com/image/hair-accessory/g/8/d/hbf102-1-paisley-bay-head-band-triple-rose-handmade-pretty-200x200-imae9gy6e4ywahgx.jpeg,Health and Beauty>Hair Care>Hair Care Accessories>Hair Accessories,1500.0,279.0,279.0,false,HACE9G6BN2FGYG8D,HACE9G6BN2FGYG8D
Flipkart,,Paisley Bay Triple Rose Handmade Vibrant Baby Head Band(Green),"3"" flower ; rhinestone accent; 12"" elastic; upto 3 years",Paisley Bay,http://dl.flipkart.com/dl/paisley-bay-triple-rose-handmade-vibrant-baby-head-band/p/itme9g6bgpnxfgga?pid=HACE9G6B2BTUTMKR&affid=siddarthk,http://img.fkcdn.com/image/hair-accessory/m/k/r/hbf109-1-paisley-bay-head-band-triple-rose-handmade-vibrant-baby-200x200-imae9gy6hsug2gah.jpeg,Health and Beauty>Hair Care>Hair Care Accessories>Hair Accessories,1500.0,279.0,279.0,false,HACE9G6B2BTUTMKR,HACE9G6B2BTUTMKR
Flipkart,,Paisley Bay Triple Rose Handmade Playful Baby Head Band(Orange),"3"" flower ; rhinestone accent; 12"" elastic; upto 3 years",Paisley Bay,http://dl.flipkart.com/dl/paisley-bay-triple-rose-handmade-playful-baby-head-band/p/itme9g6bcajxzrze?pid=HACE9G6B6WFXAMPM&affid=siddarthk,http://img.fkcdn.com/image/hair-accessory/m/p/m/hbf111-1-paisley-bay-head-band-triple-rose-handmade-playful-baby-200x200-imae9gy6py2cbgxz.jpeg,Health and Beauty>Hair Care>Hair Care Accessories>Hair Accessories,1500.0,279.0,279.0,false,HACE9G6B6WFXAMPM,HACE9G6B6WFXAMPM
Flipkart,,Paisley Bay Triple Rose Handmade Sky Head Band(Blue),"3"" flower ; rhinestone accent; 12"" elastic; upto 3 years",Paisley Bay,http://dl.flipkart.com/dl/paisley-bay-triple-rose-handmade-sky-head-band/p/itme9g6c4ychdh7f?pid=HACE9G6C9EAMRRZP&affid=siddarthk,http://img.fkcdn.com/image/hair-accessory/r/z/p/hbf103-1-paisley-bay-head-band-triple-rose-handmade-sky-200x200-imae9gy69gnpbuku.jpeg,Health and Beauty>Hair Care>Hair Care Accessories>Hair Accessories,1500.0,279.0,279.0,false,HACE9G6C9EAMRRZP,HACE9G6C9EAMRRZP
Flipkart,,Anmita AT-82241 Rubber Band(Blue),"Beautiful diamond and pearl studded blue peacock rubber band can be use as decoration to ponytail or bun updo, ideal for women.",Anmita,http://dl.flipkart.com/dl/anmita-at-82241-rubber-band/p/itme9g5phpeghn6a?pid=HACE9G5Z9NNNDR7H&affid=siddarthk,http://img.fkcdn.com/image/hair-accessory/r/7/h/at-82241-blue-1-anmita-rubber-band-at-82241-200x200-imae9gqjaztd9nxf.jpeg,Health and Beauty>Hair Care>Hair Care Accessories>Hair Accessories,730.0,300.0,300.0,false,HACE9G5Z9NNNDR7H,HACE9G5Z9NNNDR7H
Flipkart,,Paisley Bay Triple Rose Handmade Darling Baby Head Band(Pink),"3"" flower ; 12"" elastic; upto 3 years",Paisley Bay,http://dl.flipkart.com/dl/paisley-bay-triple-rose-handmade-darling-baby-head-band/p/itme9g6bu7z93ufh?pid=HACE9G6BQ2K7FQJX&affid=siddarthk,http://img.fkcdn.com/image/hair-accessory/q/j/x/hbf108-1-paisley-bay-head-band-triple-rose-handmade-darling-baby-200x200-imae9gy6tyj2etre.jpeg,Health and Beauty>Hair Care>Hair Care Accessories>Hair Accessories,1500.0,269.0,269.0,false,HACE9G6BQ2K7FQJX,HACE9G6BQ2K7FQJX
Flipkart,,Paisley Bay Triple Rose Handmade Adorable Baby Head Band(Pink),"3"" flower ; rhinestone accent; 12"" elastic; upto 3 years",Paisley Bay,http://dl.flipkart.com/dl/paisley-bay-triple-rose-handmade-adorable-baby-head-band/p/itme9g6bzhhzeznq?pid=HACE9G6BUNX3RBMG&affid=siddarthk,http://img.fkcdn.com/image/hair-accessory/b/m/g/hbf115-1-paisley-bay-head-band-triple-rose-handmade-adorable-200x200-imae9gy6q7mngzft.jpeg,Health and Beauty>Hair Care>Hair Care Accessories>Hair Accessories,1500.0,299.0,299.0,false,HACE9G6BUNX3RBMG,HACE9G6BUNX3RBMG
Flipkart,,Paisley Bay Lotus Blingey Eco Baby Head Band(Green),"3"" flower ; rhinestone accent; 12"" elastic; upto 3 years",Paisley Bay,http://dl.flipkart.com/dl/paisley-bay-lotus-blingey-eco-baby-head-band/p/itme9g6cjwzkbyhy?pid=HACE9G6C8UFTTZGA&affid=siddarthk,http://img.fkcdn.com/image/hair-accessory/z/g/a/hbf96-1-paisley-bay-head-band-lotus-blingey-eco-baby-200x200-imae9gy6naxshbxg.jpeg,Health and Beauty>Hair Care>Hair Care Accessories>Hair Accessories,1500.0,279.0,279.0,false,HACE9G6C8UFTTZGA,HACE9G6C8UFTTZGA
Flipkart,,Aster Luxury Neem Tulsi Bathing Bar,"Natural Neem Tulsi Soap Aster Luxury Neem Tulsi Soap is blended with anti bacterial and antiseptics properties of Neem and Tulsi. This regular bathing bar controls excess oil, acne, itching and irritation. This soap cleanses the skin deep and combat infections. This soap keep skin free of germs, infections and dirt. It contains natural extracts of holy basil which makes skin smooth, supple and gentle.Benefits of Neem Tulsi SoapMake skin soft & smooth.Prevent acne and skin itchiness. Keep skin clean and germ free.Usage: Firmly hold the aster handmade bathing bar and run all over the wet body. This soap gives good lather that will clean your whole body. Apply lather all over body before showering off.Size: 125 g (4.4 Oz)Ingredients: Coconut Oil, Sorbitol, Castor Oil, Myristic Acid, Stearic Acid, Cocoamido Propyl Betaine, Glycerin, Propylene Glycol, Neem-Tulsi Fragrance OilNo Paraben. No Phthalates. No Animal Testing. No Animal Ingredients. Vegetarian Soap",Aster Luxury,http://dl.flipkart.com/dl/aster-luxury-neem-tulsi-bathing-bar/p/itme9hctshdhbuzr?pid=SOPE9HCTRDXE4ZUD&affid=siddarthk,http://img.fkcdn.com/image/soap/f/g/y/aster-luxury-125-handmade-neem-tulsi-soap-125g-200x200-imae9hfjfh3bkg5r.jpeg,Health and Beauty>Bath and Spa>Soaps,150.0,125.0,125.0,false,SOPE9HCTRDXE4ZUD,SOPE9HCTRDXE4ZUD
Flipkart,,Aster Luxury Natural Handmade Soap Assortment - Pack Of 9(1125 g),"Natural Handmade Soap Set of NineThis assorted pack of 9 pcs from Aster contains nine assorted natural luxury handmade bar soaps of different flavours. All soaps handcrafted using blend of natural ingredients and high quality essential oils. This soap set includes nine unique fragrances and flavours that will uplift your mood and senses after every bath. Aromatic and skin friendly ingredients beautify not only beautify your skin also makes it healthy, glowing and good looking. This is a perfect value pack for your family. Usage: Firmly hold the aster handmade bathing bar and run all over the wet body. This soap gives good lather that will clean your whole body. Apply lather all over body before showering off.Size: 125 g (4.4 Oz) each",Aster Luxury,http://dl.flipkart.com/dl/aster-luxury-natural-handmade-soap-assortment-pack-9/p/itme9hzxnysqpzy2?pid=SOPE9HZXHGWM5FAY&affid=siddarthk,http://img.fkcdn.com/image/soap/f/a/y/aster-luxury-1125-natural-handmade-soap-assortment-pack-of-9-200x200-imae9hfjgc6n8meb.jpeg,Health and Beauty>Bath and Spa>Soaps,1350.0,850.0,850.0,true,SOPE9HZXHGWM5FAY,SOPE9HZXHGWM5FAY
Flipkart,,Flower of Life Vetivert Scrub Soap,,Flower of Life,http://dl.flipkart.com/dl/flower-life-vetivert-scrub-soap/p/itme9gwtzhqdjnxg?pid=SOPE9GWTQVNJE65R&affid=siddarthk,http://img.fkcdn.com/image/soap/6/5/r/flower-of-life-50-vetivert-scrub-soap-200x200-imae9dfrtf3yvu5j.jpeg,Health and Beauty>Bath and Spa>Soaps,400.0,350.0,350.0,false,SOPE9GWTQVNJE65R,SOPE9GWTQVNJE65R
Flipkart,,Aster Luxury Neem Tulsi Bathing Bar 125g - Pack Of 2,"Natural Neem Tulsi Soap Aster Luxury Neem Tulsi Soap is blended with anti bacterial and antiseptics properties of Neem and Tulsi. This regular bathing bar controls excess oil, acne, itching and irritation. This soap cleanses the skin deep and combat infections. This soap keep skin free of germs, infections and dirt. It contains natural extracts of holy basil which makes skin smooth, supple and gentle.Benefits of Neem Tulsi SoapMake skin soft & smooth.Prevent acne and skin itchiness. Keep skin clean and germ free.Usage: Firmly hold the aster handmade bathing bar and run all over the wet body. This soap gives good lather that will clean your whole body. Apply lather all over body before showering off.Size: 125 g (4.4 Oz)Ingredients: Coconut Oil, Sorbitol, Castor Oil, Myristic Acid, Stearic Acid, Cocoamido Propyl Betaine, Glycerin, Propylene Glycol, Neem-Tulsi Fragrance OilNo Paraben. No Phthalates. No Animal Testing. No Animal Ingredients. Vegetarian Soap",Aster Luxury,http://dl.flipkart.com/dl/aster-luxury-neem-tulsi-bathing-bar-125g-pack-2/p/itme9hct8hpsuxjd?pid=SOPE9HCTZHCNHTTE&affid=siddarthk,http://img.fkcdn.com/image/soap/f/t/z/aster-luxury-250-handmade-neem-tulsi-soap-125g-pack-of-2-200x200-imae9hfjwbxh8hhg.jpeg,Health and Beauty>Bath and Spa>Soaps,300.0,250.0,250.0,false,SOPE9HCTZHCNHTTE,SOPE9HCTZHCNHTTE
