PartnerName,Id,Title,Description,Brand,Link,ImageLink,CategoryName,Mrp,OfferPrice,EffectivePrice,Availability,PartnerIdFromUrl,PartnerIdFromDb
Flipkart,,"EKOZ Optimist Oudh Deodorant Spray  -  For Men, Women(200 ml)",,EKOZ,http://dl.flipkart.com/dl/ekoz-optimist-oudh-deodorant-spray-men-women/p/itmemvn2vzpyzbua?pid=DEOEMVKQYRYSFG5G&affid=siddarthk,http://img.fkcdn.com/image/deodorant/g/5/g/deodorant-spray-ekoz-200-optimist-oudh-200x200-imaemv8jghdbnf42.jpeg,Health and Beauty>Fragrances>Deodorants>Sprays,299.0,299.0,299.0,true,DEOEMVKQYRYSFG5G,DEOEMVKQYRYSFG5G
Flipkart,,"Play Boy London+Hollywood+Newyork Deodorant Spray  -  For Boys, Men(150 ml)",,Play Boy,http://dl.flipkart.com/dl/play-boy-london-hollywood-newyork-deodorant-spray-boys-men/p/itmemtvzmxcuskbh?pid=DEOEMTVZ7JGMUGWD&affid=siddarthk,http://img.fkcdn.com/image/deodorant/y/p/t/deodorant-spray-playboy-150-london-hollywood-newyork-200x200-imaemthm9gsbhea4.jpeg,Health and Beauty>Fragrances>Deodorants>Sprays,597.0,499.0,499.0,true,DEOEMTVZ7JGMUGWD,DEOEMTVZ7JGMUGWD
Flipkart,,"EKOZ Gt-White Deodorant Spray  -  For Men, Women(200 ml)",,EKOZ,http://dl.flipkart.com/dl/ekoz-gt-white-deodorant-spray-men-women/p/itmemvarzphmqhst?pid=DEOEMVARXTWEYAXD&affid=siddarthk,http://img.fkcdn.com/image/deodorant/a/x/d/deodorant-spray-ekoz-200-gt-white-200x200-imaemv8fghqzkqyk.jpeg,Health and Beauty>Fragrances>Deodorants>Sprays,299.0,299.0,299.0,true,DEOEMVARXTWEYAXD,DEOEMVARXTWEYAXD
Flipkart,,Foxmen Tangy Twist-Green Grand Perfume Body Spray  -  For Women(200 ml),"For some of us, the celebration of life has a much deeper meaning and there is nothing more heart warming than losing yourself in the magnanimity of life and taking time to enjoy the beauty of life. For the carefree and easy going woman who takes life at her own pace, comes a long lasting and liberating fragrance that is inspired by calming earthy tones - Green Grand.The modern woman sets her own rules in life and to her the celebration of life manifests in the celebration of her success. For the woman who would have anything except for the ordinary, comes a fragrance with a fruity flowery twist to its personality – The Tangy Twist",Foxmen,http://dl.flipkart.com/dl/foxmen-tangy-twist-green-grand-perfume-body-spray-women/p/itmemws2fxehbxkq?pid=DEOEMWS2BWP6YZFS&affid=siddarthk,http://img.fkcdn.com/image/deodorant/z/f/s/perfume-body-spray-foxmen-200-tangy-twist-green-grand-200x200-imaempu7kumuhdpe.jpeg,Health and Beauty>Fragrances>Deodorants,550.0,523.0,523.0,true,DEOEMWS2BWP6YZFS,DEOEMWS2BWP6YZFS
Flipkart,,Foxmen Excite-Ignite Perfume Body Spray  -  For Men(200 ml),"Today’s man celebrates life by celebrating the spirit of ambition, and to him nothing else but a fragrance that symbolizes his charismatic persona will do. Whatever he does he stands above the others and wherever he owns the day. For each of his different moods, comes a fragrance that is fresh, spicy, warm, and intense – The Foxmen Ignite.For the man who chases his dreams, success is a celebration of life. Trends come and go but a self confident man never goes out of fashion. Taking after this very persona, comes a long lasting and dynamic fragrance – Foxmen Excite.",Foxmen,http://dl.flipkart.com/dl/foxmen-excite-ignite-perfume-body-spray-men/p/itmemws2zggdthcf?pid=DEOEMWS2RFEKH3Z3&affid=siddarthk,http://img.fkcdn.com/image/deodorant/3/z/3/perfume-body-spray-foxmen-200-excite-ignite-200x200-imaemzzvjfhuyp5k.jpeg,Health and Beauty>Fragrances>Deodorants,550.0,523.0,523.0,true,DEOEMWS2RFEKH3Z3,DEOEMWS2RFEKH3Z3
Flipkart,,Foxmen Excite-Impress Perfume Body Spray  -  For Men(200 ml),"The modern man celebrates life by celebrating himself each day. He is the centre of attraction everywhere and whatever he does, he does it in style with Foxmen Impress, a long lasting fragrance that impresses wherever you go.For the man who chases his dreams, success is a celebration of life. Trends come and go but a self confident man never goes out of fashion. Taking after this very persona, comes a long lasting and dynamic fragrance – Foxmen Excite.",Foxmen,http://dl.flipkart.com/dl/foxmen-excite-impress-perfume-body-spray-men/p/itmemws2zppfqbpb?pid=DEOEMWSFKVKU7HUR&affid=siddarthk,http://img.fkcdn.com/image/deodorant/h/u/r/perfume-body-spray-foxmen-200-excite-impress-200x200-imaemzzvzrr7phvf.jpeg,Health and Beauty>Fragrances>Deodorants,550.0,523.0,523.0,true,DEOEMWSFKVKU7HUR,DEOEMWSFKVKU7HUR
Flipkart,,Foxmen Green Grand-Fruity Fame Perfume Body Spray  -  For Women(200 ml),"Some people celebrate life by celebrating each moment as it comes. Be it, with a touch of charm, a measure of sweetness, or a dash of playfulness. And for the woman who believes in celebrating each day of life, comes a long lasting fragrance, the Fruity Fame.For some of us, the celebration of life has a much deeper meaning and there is nothing more heart warming than losing yourself in the magnanimity of life and taking time to enjoy the beauty of life. For the carefree and easy going woman who takes life at her own pace, comes a long lasting and liberating fragrance that is inspired by calming earthy tones - Green Grand.",Foxmen,http://dl.flipkart.com/dl/foxmen-green-grand-fruity-fame-perfume-body-spray-women/p/itmemws2ykcyehyd?pid=DEOEMWS24DGS7GZR&affid=siddarthk,http://img.fkcdn.com/image/deodorant/g/z/r/perfume-body-spray-foxmen-200-green-grand-fruity-fame-200x200-imaempu7prhpexez.jpeg,Health and Beauty>Fragrances>Deodorants,550.0,523.0,523.0,true,DEOEMWS24DGS7GZR,DEOEMWS24DGS7GZR
Flipkart,,Foxmen Impress-Ignite Perfume Body Spray  -  For Men(200 ml),"Today’s man celebrates life by celebrating the spirit of ambition, and to him nothing else but a fragrance that symbolizes his charismatic persona will do. Whatever he does he stands above the others and wherever he owns the day. For each of his different moods, comes a fragrance that is fresh, spicy, warm, and intense – The Foxmen Ignite.The modern man celebrates life by celebrating himself each day. He is the centre of attraction everywhere and whatever he does, he does it in style with Foxmen Impress, a long lasting fragrance that impresses wherever you go.",Foxmen,http://dl.flipkart.com/dl/foxmen-impress-ignite-perfume-body-spray-men/p/itmemws2hufdhzwn?pid=DEOEMWSY7S4ZKAW9&affid=siddarthk,http://img.fkcdn.com/image/deodorant/a/w/9/perfume-body-spray-foxmen-200-impress-ignite-200x200-imaemzzvjfw6a77u.jpeg,Health and Beauty>Fragrances>Deodorants,550.0,523.0,523.0,true,DEOEMWSY7S4ZKAW9,DEOEMWSY7S4ZKAW9
Flipkart,,Integriti KICK DEO Deodorant Spray  -  For Men(65 ml),INTEGRITY KICK DEODORANT FOR MENS,Integriti,http://dl.flipkart.com/dl/integriti-kick-deo-deodorant-spray-men/p/itmefbyfsna9mgwe?pid=DEOEGHSTPNFVAFTF&affid=siddarthk,http://img.fkcdn.com/image/deodorant/f/t/f/deodorant-spray-integriti-65-kick-deo-200x200-imaeghmfchre7ar4.jpeg,Health and Beauty>Fragrances>Deodorants>Sprays,99.0,99.0,99.0,false,DEOEGHSTPNFVAFTF,DEOEGHSTPNFVAFTF
Flipkart,,Lomani Network Deodorant Spray  -  For Women(200 ml),,Lomani,http://dl.flipkart.com/dl/lomani-network-deodorant-spray-women/p/itmemrtfgbgyxdq9?pid=DEOEMRTFHK67ZZYF&affid=siddarthk,http://img.fkcdn.com/image/deodorant/z/y/f/deodorant-spray-lomani-200-network-200x200-imaemrmyya6ahu3f.jpeg,Health and Beauty>Fragrances>Deodorants>Sprays,299.0,245.0,245.0,true,DEOEMRTFHK67ZZYF,DEOEMRTFHK67ZZYF
Flipkart,,"Evaflor 3 Whisky Deo (Black ,Silver & Double Whisky) Deodorant Spray  -  For Boys(150 ml)","Evaflor is a youthful company with modern design. Based on worldwide trends of fashion, it suits Brazilian women's special style. The investment in research guarantee the quality and comfort of pieces specially created to revere feminine silhouette.Whiksy Silver:Crafted for the man who knows to balance strength with sensitivity, Evaflor presents Whisky Silver, a perfume that matches his zest with some of its own.Captivating FragranceA wafting scent that will keep you hooked to its lilting notes, the deodorant has a fresh and crisp scent that is reminiscent of marine notes.Blend of Marine and Woody NotesThe fragrance takes the bracing notes of marine origin and mingles it with the deep, dark tones of the woody notes to present an irresistible allure that will not fail you.Bottled in a classy flacon with a silver stopper, the Eau de Toilette is one that will draw attention without you even having to try.Whisky Black:Exude your masculine charm as you step out wearing this Whisky Black deodorant from Evaflor.Long-lastingWrapping you in an oriental aroma, this deodorant leaves you feeling fresh and energetic for long.Seductive InstinctThe enchanting fragrance captures the true masculinity and intriguingly sensuous appeal of the modern man.Mysterious and Fascinating FragranceA blend of tonka bean, blond tobacco, aniseed and citron wraps you in a mysterious and fascinating aroma.",Evaflor,http://dl.flipkart.com/dl/evaflor-3-whisky-deo-black-silver-double-whisky-deodorant-spray-boys/p/itmehrhg4cyza79b?pid=DEOEHRHGA48H4B5J&affid=siddarthk,http://img.fkcdn.com/image/deodorant/b/5/j/deodorant-spray-evaflor-150-3-whisky-deo-black-silver-double-200x200-imaeg59mxhfmkhec.jpeg,Health and Beauty>Fragrances>Deodorants>Sprays,1197.0,1066.0,1066.0,true,DEOEHRHGA48H4B5J,DEOEHRHGA48H4B5J
Flipkart,,Royal Mirage 3 Royal Mirage (2 Original & 1 Pearl) Deodorant Spray  -  For Boys(150 ml),"Combo of Royal MIrage Deodorant:Each deo consist of 150ml deodorant Spray.Royal MIrage Deo:Just the right blend of the perfect notes for your needs! Brand: Royal MirageType: Deodorant Quantity: 150 ml eachLong lasting fragrance Premium quality product Designed specially forcontemporary needs Recommended for regular use Ideal for gifting purposes Unique aroma,attractive design Comes in a beautifully designed packaging Enhances your personalitySuits all occasions A perfect blend of the perfect notes for your needs",Royal Mirage,http://dl.flipkart.com/dl/royal-mirage-3-2-original-1-pearl-deodorant-spray-boys/p/itmehrhg8qg994ew?pid=DEOEHRHGHQ34ZKHS&affid=siddarthk,http://img.fkcdn.com/image/deodorant/k/h/s/deodorant-spray-royal-mirage-150-3-royal-mirage-2-original-1-1100x1100-imaehqefmdsdpudk.jpeg,Health and Beauty>Fragrances>Deodorants>Sprays,900.0,736.0,736.0,true,DEOEHRHGHQ34ZKHS,DEOEHRHGHQ34ZKHS
Flipkart,,"Play Boy Genration,Wild, Newyork Deodorant Spray  -  For Boys, Men(450 ml)",,Play Boy,http://dl.flipkart.com/dl/play-boy-genration-wild-newyork-deodorant-spray-boys-men/p/itmemxkyks5udvzm?pid=DEOEMXKXGQRGHFMS&affid=siddarthk,http://img.fkcdn.com/image/deodorant/x/a/j/deodorant-spray-play-boy-450-it-wild-genration-newyork-200x200-imaemx8wazhaa7ab.jpeg,Health and Beauty>Fragrances>Deodorants>Sprays,597.0,472.0,472.0,true,DEOEMXKXGQRGHFMS,DEOEMXKXGQRGHFMS
Flipkart,,"Royal Mirage 3 Royal Mirage (Original,Emerald & Sandalwood) Deodorant Spray  -  For Boys(150 ml)","Combo of Royal MIrage Deodorant:Each deo consist of 150ml deodorant Spray.Royal MIrage Deo:Just the right blend of the perfect notes for your needs! Brand: Royal MirageType: Deodorant Quantity: 150 ml eachLong lasting fragrance Premium quality product Designed specially forcontemporary needs Recommended for regular use Ideal for gifting purposes Unique aroma,attractive design Comes in a beautifully designed packaging Enhances your personalitySuits all occasions A perfect blend of the perfect notes for your needs",Royal Mirage,http://dl.flipkart.com/dl/royal-mirage-3-original-emerald-sandalwood-deodorant-spray-boys/p/itmehrhgyerehn2g?pid=DEOEHRHGD3XZW9YF&affid=siddarthk,http://img.fkcdn.com/image/deodorant/9/y/f/deodorant-spray-royal-mirage-150-3-royal-mirage-original-emerald-1100x1100-imaeg59mke4yrfnn.jpeg,Health and Beauty>Fragrances>Deodorants>Sprays,900.0,846.0,846.0,true,DEOEHRHGD3XZW9YF,DEOEHRHGD3XZW9YF
Flipkart,,"Play Boy it Wild +Genration + Newyork Deodorant Spray  -  For Boys, Men(450 ml)",,Play Boy,http://dl.flipkart.com/dl/play-boy-wild-genration-newyork-deodorant-spray-boys-men/p/itmemxp2uhgzbzuv?pid=DEOEMXP27RK6CXAJ&affid=siddarthk,http://img.fkcdn.com/image/deodorant/x/a/j/deodorant-spray-play-boy-450-it-wild-genration-newyork-200x200-imaemx8wazhaa7ab.jpeg,Health and Beauty>Fragrances>Deodorants>Sprays,597.0,499.0,499.0,true,DEOEMXP27RK6CXAJ,DEOEMXP27RK6CXAJ
Flipkart,,Foxmen Tangy Twist-Fruity Fame Perfume Body Spray  -  For Women(200 ml),"The modern woman sets her own rules in life and to her the celebration of life manifests in the celebration of her success. For the woman who would have anything except for the ordinary, comes a fragrance with a fruity flowery twist to its personality – The Tangy TwistSome people celebrate life by celebrating each moment as it comes. Be it, with a touch of charm, a measure of sweetness, or a dash of playfulness. And for the woman who believes in celebrating each day of life, comes a long lasting fragrance, the Fruity Fame.",Foxmen,http://dl.flipkart.com/dl/foxmen-tangy-twist-fruity-fame-perfume-body-spray-women/p/itmemwd3wgczzv5t?pid=DEOEMWD2H6PC7CCG&affid=siddarthk,http://img.fkcdn.com/image/deodorant/c/c/g/perfume-body-spray-foxmen-200-tangy-twist-fruity-fame-200x200-imaempu7unqfbumg.jpeg,Health and Beauty>Fragrances>Deodorants,550.0,523.0,523.0,true,DEOEMWD2H6PC7CCG,DEOEMWD2H6PC7CCG
Flipkart,,"Park Avenue Good Morning 100g + 35g Deodorant Spray  -  For Boys, Men(135 g)","Park Avenue DeodorantNew and improved Park Avenue freshness deodorant, comes with a freshness lock technology, that overpowers the body odour so that freshness is locked and fragrance last long for at least 8 hours.",Park Avenue,http://dl.flipkart.com/dl/park-avenue-good-morning-100g-35g-deodorant-spray-boys-men/p/itmemwacgr5dfg7z?pid=DEOEMWACMHKHNJND&affid=siddarthk,http://img.fkcdn.com/image/deodorant/j/n/d/deodorant-spray-park-avenue-135-good-morning-100g-35g-200x200-imaemw4r9xguppvc.jpeg,Health and Beauty>Fragrances>Deodorants>Sprays,259.0,259.0,259.0,true,DEOEMWACMHKHNJND,DEOEMWACMHKHNJND
Flipkart,,Bath & Body Works Balck Raspberry Vanilla Body Mist  -  For Women(236 ml),"Lavishly splash or lightly spritz your favorite fragrance, either way you'll fall in love at first mist! Our carefully crafted bottle and sophisticated pump delivers great coverage while conditioning aloe mist nourishes skin for the lightest, most refreshing way to fragrance! Spritz over skin for a scent-sational way to fragrance all day !",Bath & Body Works,http://dl.flipkart.com/dl/bath-body-works-balck-raspberry-vanilla-mist-women/p/itmecs3edhzh5bkk?pid=DEOECS3EYGKPMFZG&affid=siddarthk,http://img.fkcdn.com/image/deodorant/f/z/g/body-mist-bath-body-works-236-balck-raspberry-vanilla-original-imaecqtkw7x3836n.jpeg,Health and Beauty>Fragrances>Deodorants,1299.0,930.0,930.0,false,DEOECS3EYGKPMFZG,DEOECS3EYGKPMFZG
Flipkart,,Slazenger Slazenger 2 Deodorant Spray  -(75 ml),"Slazenger spa sports invigorate and vitalize deodorant for women,from the sports lifestyle toiletry range for women, contains - deodorant 75 ml",Slazenger,http://dl.flipkart.com/dl/slazenger-2-deodorant-spray/p/itmdrczmewwfm2dh?pid=DEODRCZMTM5XRYSB&affid=siddarthk,http://img.fkcdn.com/image/deodorant/y/s/b/deodorant-spray-slazenger-75-slazenger-2-200x200-imadrcejnrrhzfd3.jpeg,Health and Beauty>Fragrances>Deodorants>Sprays,199.0,199.0,199.0,false,DEODRCZMTM5XRYSB,DEODRCZMTM5XRYSB
Flipkart,,"FA Spicy Black Deodorant Spray  -  For Women, Men(125 ml)",Experience the woody spicy fragrance of Fa Spicy Black Deodorant that keeps you under the appealing smell the whole day. It offers 24h reliable protection against body odour and long-lasting freshness.,FA,http://dl.flipkart.com/dl/fa-spicy-black-deodorant-spray-women-men/p/itmdvrfqbayz8hg4?pid=DEODVRFQHFRYVDNG&affid=siddarthk,http://img.fkcdn.com/image/deodorant/d/n/g/deodorant-spray-fa-125-spicy-black-200x200-imadvuhwzzumxyqa.jpeg,Health and Beauty>Fragrances>Deodorants>Sprays,135.0,135.0,135.0,false,DEODVRFQHFRYVDNG,DEODVRFQHFRYVDNG
Flipkart,,FA Pink Passion Deodorant Spray  -  For Women(125 ml),Indulge your senses with Fa pink passion Deodorant with its fresh-floral fragrance. The double-active-formula with protectiva offers 24h reliable protection against body and long-lasting freshness. Long-lasting freshness. fresh-floral fragrance. Skin-friendly.,FA,http://dl.flipkart.com/dl/fa-pink-passion-deodorant-spray-women/p/itmdvrfqdhyyfgkb?pid=DEODVRFQYFXDVGMZ&affid=siddarthk,http://img.fkcdn.com/image/deodorant/g/m/z/deodorant-spray-fa-125-pink-passion-200x200-imadvuhwtyagxfzg.jpeg,Health and Beauty>Fragrances>Deodorants>Sprays,135.0,130.0,130.0,false,DEODVRFQYFXDVGMZ,DEODVRFQYFXDVGMZ
Flipkart,,"Park Avenue Good Morning 167gm+100gm+35gm Deodorant Spray  -  For Boys, Men(302 g)","Park Avenue DeodorantNew and improved Park Avenue freshness deodorant, comes with a freshness lock technology, that overpowers the body odour so that freshness is locked and fragrance last long for at least 8 hours.",Park Avenue,http://dl.flipkart.com/dl/park-avenue-good-morning-167gm-100gm-35gm-deodorant-spray-boys-men/p/itmemwamgpwgveun?pid=DEOEMWAMKGX2UZHU&affid=siddarthk,http://img.fkcdn.com/image/deodorant/z/h/u/deodorant-spray-park-avenue-302-good-morning-167gm-100gm-35gm-200x200-imaemw5fkzpztghz.jpeg,Health and Beauty>Fragrances>Deodorants>Sprays,516.0,516.0,516.0,true,DEOEMWAMKGX2UZHU,DEOEMWAMKGX2UZHU
Flipkart,,Reebok Reefuse Deodorant Spray  -(175 ml),"Light the fuse and watch as the fire burns down and bursts in an explosion of freshness deep within you with Reefuse Deo Spray, a fresh fragrance from Reebok?s range of perfumes. Made for the man who can blend in with the crown and yet retain his individuality that makes him unique, hold conversations with the brilliant minds and paupers alike and treats everyone with the courtesy that is due. Make the most of this deodorant spray which is perfect for everyday use and lasts for a long time as you seek out adventures to light your life up. Embrace the invigorating notes of Reebok Reefuse Deo Spray that spreads its chilly fingers right into your heart to make you shiver with its refreshing notes.",Reebok,http://dl.flipkart.com/dl/reebok-reefuse-deodorant-spray/p/itmdqsxgnuyqtzgn?pid=DEODQSXHTU5TGPH4&affid=siddarthk,http://img.fkcdn.com/image/deodorant/p/h/4/deodorant-spray-reebok-175-reefuse-200x200-imadqrvhzxtbxg8z.jpeg,Health and Beauty>Fragrances>Deodorants>Sprays,180.0,175.0,175.0,false,DEODQSXHTU5TGPH4,DEODQSXHTU5TGPH4
Flipkart,,Jacqui & David Flower Power Body Mist  -  For Girls(200 ml),"An oriental floral fragrance opening with edible fruit floral accord, supported by rich floral powdery body and leading to a lingering woody amber and powdery base.Top: Red Fruits, Lemon, Bergamot, Geranium, Clary, SageMid: Jasmine, Ylang Ylang, Rose, Violet Base: Sandalwood, Vanilla, Patchouli, Amber, Musk",Jacqui & David,http://dl.flipkart.com/dl/jacqui-david-flower-power-body-mist-girls/p/itmee968ewzggags?pid=DEOEE9678HDRVY8Q&affid=siddarthk,http://img.fkcdn.com/image/deodorant/y/8/q/body-mist-jacqui-and-david-200-flower-power-200x200-imaeekg5khr5mrte.jpeg,Health and Beauty>Fragrances>Deodorants,475.0,465.0,465.0,false,DEOEE9678HDRVY8Q,DEOEE9678HDRVY8Q
Flipkart,,Jacqui And David Pure Pear Body Mist  -  For Women(200 ml),"A light and refreshing, non-greasy body spray that leaves the skin subtly scented with the classic soft and floral fragrance. Ideal for use all over the body as part of a layering regime and can be used throughout the day to refresh the body with the fragrance.",Jacqui And David,http://dl.flipkart.com/dl/jacqui-david-pure-pear-body-mist-women/p/itmdu85n8z3kmbtk?pid=DEODU85N8Z3KMBTK&affid=siddarthk,http://img.fkcdn.com/image/deodorant/b/t/k/body-mist-jacquis-passion-200-pure-pear-200x200-imadu88yz5qanfnv.jpeg,Health and Beauty>Fragrances>Deodorants,475.0,465.0,465.0,true,DEODU85N8Z3KMBTK,DEODU85N8Z3KMBTK
Flipkart,,"Arabian Nights Mamlaka Al Hub Men Deo Deodorant Spray  -  For Men, Boys(200 ml)","A Sturdy Look That Denotes Its Position. A Strong Masculine Fragrance, Mamlaka Al Hub Opens Up With Musky Top Note And Enters A Woody-Aqua Middle Note, It Completes With Masculine Note.",Arabian Nights,http://dl.flipkart.com/dl/arabian-nights-mamlaka-al-hub-men-deo-deodorant-spray-men-boys/p/itmeb467sgafm6xw?pid=DEOEB467X8PNMZGU&affid=siddarthk,http://img.fkcdn.com/image/deodorant/z/g/u/deodorant-spray-arabian-nights-200-mamlaka-al-hub-men-deo-200x200-imaeb3vjphh2v8s7.jpeg,Health and Beauty>Fragrances>Deodorants>Sprays,299.0,299.0,299.0,false,DEOEB467X8PNMZGU,DEOEB467X8PNMZGU
Flipkart,,"Arabian Nights Exposed Women Deo Deodorant Spray  -  For Women, Girls(200 ml)",It Just Simply Follows The Trend. Floral-Musky Odor Which Attracts Every Passerby.,Arabian Nights,http://dl.flipkart.com/dl/arabian-nights-exposed-women-deo-deodorant-spray-women-girls/p/itmeb467duysrrq7?pid=DEOEB4673RP45N2K&affid=siddarthk,http://img.fkcdn.com/image/deodorant/n/2/k/deodorant-spray-arabian-nights-200-exposed-women-deo-200x200-imaeb3vjcffbaecm.jpeg,Health and Beauty>Fragrances>Deodorants>Sprays,299.0,299.0,299.0,false,DEOEB4673RP45N2K,DEOEB4673RP45N2K
Flipkart,,Dunhill Desire Red Body Spray  -  For Men(195 ml),Dunhill Desire Red Deodorant of 195 ml,Dunhill,http://dl.flipkart.com/dl/dunhill-desire-red-body-spray-men/p/itmemhbxa9n3n44v?pid=DEOEMHBXTDMPGMJH&affid=siddarthk,http://img.fkcdn.com/image/deodorant/m/j/h/body-spray-dunhill-195-desire-red-200x200-imaemh5tpmg3u2pe.jpeg,Health and Beauty>Fragrances>Deodorants>Sprays,1500.0,1399.0,1399.0,true,DEOEMHBXTDMPGMJH,DEOEMHBXTDMPGMJH
Flipkart,,"Arabian Nights Fakhar Al Jamal Deo Deodorant Spray  -  For Men, Women, Boys, Girls(200 ml)","Proud Of Its Beauty. Beauty Of Its Inner Self. A Fragrance That Will Be Loved Instantly. Overall A Fruity Flavor To The Fragrance, Fakhar Al Jamaal Opens Up With Fruity Top Note And Enters A Fruit Woody Middle Not. Fakhar Al Jamaal Completes With Musky Woody Note.",Arabian Nights,http://dl.flipkart.com/dl/arabian-nights-fakhar-al-jamal-deo-deodorant-spray-men-women-boys-girls/p/itmeb467z59qh5xe?pid=DEOEB467AKV7VXF7&affid=siddarthk,http://img.fkcdn.com/image/deodorant/x/f/7/deodorant-spray-arabian-nights-200-fakhar-al-jamal-deo-200x200-imaeb3vjfp65zkrz.jpeg,Health and Beauty>Fragrances>Deodorants>Sprays,299.0,299.0,299.0,false,DEOEB467AKV7VXF7,DEOEB467AKV7VXF7
Flipkart,,Jacqui & David Peach Papaya Body Mist  -  For Girls(200 ml),"Vibrant and dewy peach, infused with a hint of tropical papaya is accented with fresh fruity notes and delicate white blossoms. A soft base of white musk rounds out the accord.Top: Papaya, Mango, Kumquat, White PeachMid: Strawberry leaves, Cyclamen Nectar, White Mimosa Base: White Musk",Jacqui & David,http://dl.flipkart.com/dl/jacqui-david-peach-papaya-body-mist-girls/p/itmee968r2v7mbrt?pid=DEOEE968FHYFRAJH&affid=siddarthk,http://img.fkcdn.com/image/deodorant/a/j/h/body-mist-jacqui-and-david-200-peach-papaya-200x200-imaeekg5sffgh8mf.jpeg,Health and Beauty>Fragrances>Deodorants,475.0,465.0,465.0,true,DEOEE968FHYFRAJH,DEOEE968FHYFRAJH
Flipkart,,Dunhill Desire Black Body Spray  -  For Men(195 ml),Dunhill desire Black deodorant of 195 ml,Dunhill,http://dl.flipkart.com/dl/dunhill-desire-black-body-spray-men/p/itmemhbwfbtyaauf?pid=DEOEMHBWC4FRBRVJ&affid=siddarthk,http://img.fkcdn.com/image/deodorant/r/v/j/body-spray-dunhill-195-desire-black-200x200-imaemh5nvpn28mzp.jpeg,Health and Beauty>Fragrances>Deodorants>Sprays,1500.0,1399.0,1399.0,true,DEOEMHBWC4FRBRVJ,DEOEMHBWC4FRBRVJ
Flipkart,,Dunhill Desire Blue Body Spray  -  For Men(195 ml),Dunhill desire Blue deodorant of 195 ml,Dunhill,http://dl.flipkart.com/dl/dunhill-desire-blue-body-spray-men/p/itmemhfzhftg3pvd?pid=DEOEMHFZ44VVQXEH&affid=siddarthk,http://img.fkcdn.com/image/deodorant/x/e/h/body-spray-dunhill-195-desire-blue-200x200-imaemh5wfhyfugb2.jpeg,Health and Beauty>Fragrances>Deodorants>Sprays,1500.0,1399.0,1399.0,true,DEOEMHFZ44VVQXEH,DEOEMHFZ44VVQXEH
Flipkart,,EKOZ Deodorant DFCOMBO-3 Perfume Body Spray  -  For Women(200 ml),"An exciting range of high quality fragrances with all the subtle magic of many of the world's most exclusive fragrances. This fabulous fragrance GT Rose is a combination of floral, , aquatic and sweet spicy notes & Fashion is a combination of Sweet , Floral and notes.",EKOZ,http://dl.flipkart.com/dl/ekoz-deodorant-dfcombo-3-perfume-body-spray-women/p/itmehx2927qbvyua?pid=DEOEHX2968YHYYFQ&affid=siddarthk,http://img.fkcdn.com/image/deodorant/y/f/q/perfume-body-spray-ekoz-200-deodorant-dfcombo-3-200x200-imaek5hm6j2uumhx.jpeg,Health and Beauty>Fragrances>Deodorants,598.0,598.0,598.0,false,DEOEHX2968YHYYFQ,DEOEHX2968YHYYFQ
Flipkart,,"Arabian Nights Arjowaan Deo Deodorant Spray  -  For Men, Women, Boys, Girls(200 ml)","Endowed With Fresh Musky Notes To Fascinatingly Elevate Your Mood, This Charming Companion Will Make The Moment Worthwhile For You.",Arabian Nights,http://dl.flipkart.com/dl/arabian-nights-arjowaan-deo-deodorant-spray-men-women-boys-girls/p/itmeb467psaqawjf?pid=DEOEB467YPBJWYYY&affid=siddarthk,http://img.fkcdn.com/image/deodorant/y/y/y/deodorant-spray-arabian-nights-200-arjowaan-deo-200x200-imaeb3vjycshu7y3.jpeg,Health and Beauty>Fragrances>Deodorants>Sprays,299.0,299.0,299.0,false,DEOEB467YPBJWYYY,DEOEB467YPBJWYYY
Flipkart,,"Play Boy Play It Wild Deodorant Spray  -  For Boys, Men(150 ml)",,Play Boy,http://dl.flipkart.com/dl/play-boy-wild-deodorant-spray-boys-men/p/itmemxkwduue6qhr?pid=DEOEMXKWSZ2UHEYW&affid=siddarthk,http://img.fkcdn.com/image/deodorant/e/y/w/deodorant-spray-play-boy-150-play-it-wild-200x200-imaemx9bzrbvj2sp.jpeg,Health and Beauty>Fragrances>Deodorants>Sprays,597.0,498.0,498.0,true,DEOEMXKWSZ2UHEYW,DEOEMXKWSZ2UHEYW
