PartnerName,Id,Title,Description,Brand,Link,ImageLink,CategoryName,Mrp,OfferPrice,EffectivePrice,Availability,PartnerIdFromUrl,PartnerIdFromDb
Flipkart,,Himalaya Natural Moisturizing Lip Butter Cocoa Butter(10 g),"Provide hydrating care to your lips with this lip butter. An indulgent blend of different natural butters, this Himalaya Moisturizing lip care gently conditions and moisturizes your lips. Made using Cocoa butter, Sal butter and Kokum butter, the Himalaya lip butter soothes and softens your lips to leave them feeling smooth and supple. Mango butter in the lip balm invigorates your lips and reduces the appearance of wrinkles. The lip butter has a subtle cocoa butter flavour and can be used by women as well as men. Keep your lips hydrated, nourished and looking healthy all day long with Himalaya Natural Moisturizing Lip Butter. Directions for Use ·         Apply an even coat of Himalaya Cocoa lip butter over your lips. ·         Reapply whenever needed.",Himalaya,http://dl.flipkart.com/dl/himalaya-natural-moisturizing-lip-butter-cocoa/p/itmd9arqhxthqreg?pid=LPBD9YW5WGKZPNB4&affid=siddarthk,http://img.fkcdn.com/image/lip-balm/n/b/4/himalaya-10-natural-moisturizing-lip-butter-200x200-imad9e53zwpwfquz.jpeg,Health and Beauty>Body and Skin Care>Lip Care>Lip Balms,125.0,105.0,105.0,false,LPBD9YW5WGKZPNB4,LPBD9YW5WGKZPNB4
Flipkart,,Biotique Bio Nourishing Lip Balm Aloe Vera(16 g),"We apply sunscreen for the face and other exposed areas of our body. But most of us the forget about the tender skin on the lips that is more prone to sun damage. Protect your lips from the sun’s UVA and UVB rays with this ayurvedic Biotique Bio Nourishing Lip Balm Aloe Vera. The protective lip balm can be used by anyone looking for a nourishing lip balm with SPF. Formulated with a blend of potent organic ingredients, this Biotique Aloe Vera Lip Balm heals sunburnt lips that are chapped or cracked. The non intrusive aloe vera flavour is ideal for use anytime of the day. A few of the organic extracts in the Lip Balm are Aloevera Barbednsis, Honey, Mulethi and Badam to nourish and moisturize your lips leaving it soft and supple. Containing SPF 30, the Nourishing Lip Balm prevents your skin from getting tanned by the sun rays. Touch up your lips with this protective lip balm for complete sun protection. Directions for Use Apply over your lips by itself or under lipstick. Ideally use a few minutes before sun exposure for complete sun protection.",Biotique,http://dl.flipkart.com/dl/biotique-bio-nourishing-lip-balm-aloe-vera/p/itmd9arqj6pxw2gj?pid=LPBD9YW5FKPGYAGR&affid=siddarthk,http://img.fkcdn.com/image/lip-balm/a/g/r/biotique-16-bio-nourishing-lip-balm-200x200-imadjjb7pd65fdca.jpeg,Health and Beauty>Body and Skin Care>Lip Care>Lip Balms,99.0,79.0,79.0,false,LPBD9YW5FKPGYAGR,LPBD9YW5FKPGYAGR
Flipkart,,Biotique Bio Berry Plumping Lip Balm - Smoothes& Swells Lips 12 g,"You can find peppermint to be a base ingredient in many beauty care products ranging from skincare to hair care. Peppermint has proved to be a beneficial property for long lasting beauty for eons. From royals to cultures across the world, people have sort the curative qualities of peppermint to soothe many skin problems. You can enjoy the cooling effects of peppermint on your lips with the Biotique Bio Fresh Kiss Lip Balm Peppermint. Recommended for dry and flaky skin, this special ingredient comes as a blessing nourishment to chapped lips. You can soothe irritated or dry skin and ensure that you are left with beautiful and kissable lips. Composed of arjun, lodhra, badam, erandi and kusumbhi this lip balm will help in softening your lips so they feel supple and look gorgeous all the time. Badam infused in this lip balm is a great moisturizer and ensures that the layers of your skin will be provided enough hydration. Your lips do not have the ability to hydrate themselves and thus the onus is on you to keep your lips looking soft and supple all the time. Transform the texture of your lips from rough and dry to graceful by just supplying some of this minty refreshing. The deep and fresh fragrance of peppermint allows you to always be confident as your breath will also smell refreshing and cool. Ideal for men and women, this lip balm will be a winner because of the special minty freshness and the ayurvedic composition. Give your lips some organic love and you will be rewarded many folds.",Biotique,http://dl.flipkart.com/dl/biotique-bio-berry-plumping-lip-balm-smoothes-swells-lips-12-g/p/itmehgj9dkt9w7vd?pid=LPBD9YW5FFZRVYUH&affid=siddarthk,http://img.fkcdn.com/image/lip-balm/y/u/h/biotique-16-bio-fresh-kiss-lip-balm-200x200-imadd3g8szkfv6ss.jpeg,Health and Beauty>Body and Skin Care>Lip Care,99.0,99.0,99.0,false,LPBD9YW5FFZRVYUH,LPBD9YW5FFZRVYUH
Flipkart,,Lotus Lip Balm Raspberry(5 g),"Cold winds or harsh sun can make your lips feel dry and damaged. Beat the elements and protect your lips with Lotus Herbals Lip Balm Raspberry. Made using herbal ingredients, this Lotus Herbals Lip Balm is suitable for use on all skin types. Designed for use by anyone who craves a deliciously moisturising lip care, Lotus Herbals Lip Balm Raspberry is a blend of sweet honey, jojoba oil and almond oil. Honey is a perfect skin moisturizer and is used in skin care for its antimicrobial properties while jojoba oil and almond oil are both excellent in nourishing and hydrating the delicate skin over your lips. Treat your chapped lips to a burst of raspberry and keep them feeling soft and supple with Lotus Herbals Raspberry Lip Balm. Directions for Use Apply an even coat of this Raspberry Lip Balm to lips as and when necessary. Use a minimum of two times daily for best results.",Lotus,http://dl.flipkart.com/dl/lotus-lip-balm-raspberry/p/itmehzx9mzsyh66c?pid=LPBD9YW5ZZ67ST5N&affid=siddarthk,http://img.fkcdn.com/image/lip-balm/t/5/n/lotus-herbals-5-lip-balm-200x200-imad9e52gaugdctj.jpeg,Health and Beauty>Body and Skin Care>Lip Care>Lip Balms,135.0,125.0,125.0,true,LPBD9YW5ZZ67ST5N,LPBD9YW5ZZ67ST5N
Flipkart,,Lakme 9 to 5 Crease-less Lip Balm - Rose Affair(7 ml),,Lakme,http://dl.flipkart.com/dl/lakme-9-5-crease-less-lip-balm-rose-affair/p/itmdv3betgjbhjr9?pid=LPBDV36RGWAT3JHW&affid=siddarthk,http://img.fkcdn.com/image/lip-balm/j/h/w/lakme-7-9-to-5-crease-less-lip-balm-rose-affair-200x200-imadvhc82hftazfc.jpeg,Health and Beauty>Body and Skin Care>Lip Care>Lip Balms,400.0,400.0,400.0,false,LPBDV36RGWAT3JHW,LPBDV36RGWAT3JHW
Flipkart,,Forever Living Aloe Lips(4.25 gm),"The soothing properties of aloe Vera are ideally suited to care for your lips. Aloe, jojoba and beeswax combine to create the finest all-season lip product on the market today. Aloe Lips soothes smoothes and moisturizes chapped and dry lips.Whether you are skiing, sunbathing, or enjoying the outdoors, its compact size makes it convenient to keep on hand. If your lips could talk, they?d ask for Aloe Lips!? Moisturizing Aloe-based formula? Gives your lips gloss? Great for year-round use",Forever Living,http://dl.flipkart.com/dl/forever-living-aloe-lips/p/itmeycgbrckzvpzf?pid=LPBEYCGBC2UYJAW5&affid=siddarthk,http://img.fkcdn.com/image/lip-balm/a/w/5/forever-living-products-4-25-aloe-lips-200x200-imaeyefzunafpang.jpeg,Health and Beauty>Body and Skin Care>Lip Care>Lip Balms,183.0,175.0,175.0,false,LPBEYCGBC2UYJAW5,LPBEYCGBC2UYJAW5
Flipkart,,Lakme 9 to 5 Crease-less Lip Balm - Peach Energy(7 ml),"Let your lips shin in all their glory and caress them with a rosy tinge with this lip balm from Lakme. A classy yet playful shade of peach can go with your office look as well as a party animal look. Crease-less This lip balm does not allow creases for as long as 8 hours, so you can rest assured of touching up from time to time. Creamy Texture The ultra-creamy texture of this lip balm glides smoothly on your lips and makes it look luscious and fuller. Vitamin E, Olive Oil and Jojoba Oil With a rich blend of vitamin E, olive oil and jojoba oil, this lip balm ensures that your lips are nourished and healthy at all times. SPF 15 Formulated with SPF 15, this lip balm protects your lips from sun damage and retains their softness.",Lakme,http://dl.flipkart.com/dl/lakme-9-5-crease-less-lip-balm-peach-energy/p/itmdv3beapxjf4yd?pid=LPBDV36RGWVHKZ3G&affid=siddarthk,http://img.fkcdn.com/image/lip-balm/z/3/g/lakme-7-9-to-5-crease-less-lip-balm-peach-energy-200x200-imadvhc84zd3kg3u.jpeg,Health and Beauty>Body and Skin Care>Lip Care>Lip Balms,400.0,400.0,400.0,false,LPBDV36RGWVHKZ3G,LPBDV36RGWVHKZ3G
Flipkart,,Lakme 9 to 5 Crease-less Lip Balm - Caramel Review(7 ml),,Lakme,http://dl.flipkart.com/dl/lakme-9-5-crease-less-lip-balm-caramel-review/p/itmdv3behxaezzn5?pid=LPBDV36RD6TDYNGT&affid=siddarthk,http://img.fkcdn.com/image/lip-balm/n/g/t/lakme-7-9-to-5-crease-less-lip-balm-caramel-review-200x200-imadvhc8nqmkhbth.jpeg,Health and Beauty>Body and Skin Care>Lip Care>Lip Balms,400.0,400.0,400.0,false,LPBDV36RD6TDYNGT,LPBDV36RD6TDYNGT
Flipkart,,Lakme 9 to 5 Crease-less Lip Balm - Pink Impression(7 ml),,Lakme,http://dl.flipkart.com/dl/lakme-9-5-crease-less-lip-balm-pink-impression/p/itmdv3behzzkmzbu?pid=LPBDV36RAZF8Z6ZB&affid=siddarthk,http://img.fkcdn.com/image/lip-balm/6/z/b/lakme-7-9-to-5-crease-less-lip-balm-pink-impression-200x200-imadvhc8ykenyga8.jpeg,Health and Beauty>Body and Skin Care>Lip Care>Lip Balms,400.0,400.0,400.0,false,LPBDV36RAZF8Z6ZB,LPBDV36RAZF8Z6ZB
Flipkart,,Lakme 9 to 5 Crease-less Lip Balm - Coral Charm(7 ml),,Lakme,http://dl.flipkart.com/dl/lakme-9-5-crease-less-lip-balm-coral-charm/p/itmdv3befu7czcme?pid=LPBDV36RQRJGBY5Q&affid=siddarthk,http://img.fkcdn.com/image/lip-balm/y/5/q/lakme-7-9-to-5-crease-less-lip-balm-coral-charm-200x200-imadvhc8zdqurhgx.jpeg,Health and Beauty>Body and Skin Care>Lip Care>Lip Balms,400.0,400.0,400.0,false,LPBDV36RQRJGBY5Q,LPBDV36RQRJGBY5Q
Flipkart,,Elf Lip Exfoliator Mint(4.4 g),"Gently exfoliate lips to remove dry, chapped skin with our Lip Exfoliator! A sweet sugar and smoothing sensation, infused with Vitamin E, Shea Butter, Avocado, Grape and Jojoba Oils to nourish and protect. This Lip Exfoliator treats and smoothes lips for a conditioned and revitalized feel.",Elf,http://dl.flipkart.com/dl/elf-lip-exfoliator-mint/p/itme9fxr7pawfxm8?pid=LPBE9FXQZPWMZB3C&affid=siddarthk,http://img.fkcdn.com/image/lip-balm/b/3/c/elf-4-4-lip-exfoliator-200x200-imae94zswascgrgn.jpeg,Health and Beauty>Body and Skin Care>Lip Care>Lip Balms,1200.0,899.0,899.0,false,LPBE9FXQZPWMZB3C,LPBE9FXQZPWMZB3C
Flipkart,,Eos Lip Balm Trio Rachel Roy Edition Natural,"Inspired by travel and the warm sun, this limited edition eos Smooth Sphere lip balm flavor trio was inspired by fashion designer Rachel Roy. Each pack includes brand-new, limited edition flavors Indian Summer, Orange Blossom, Aloha Hawaii Strawberry Kiwi, and St. Barth's Sunrise Pink Grapefruit.",Eos,http://dl.flipkart.com/dl/eos-lip-balm-trio-rachel-roy-natural/p/itme3rfehzpmjtwj?pid=LPBE3RFEXETGUPDG&affid=siddarthk,http://img.fkcdn.com/image/lip-balm/p/d/g/eos-21-lip-balm-trio-rachel-roy-edition-200x200-imae3jghcdzpyzgg.jpeg,Health and Beauty>Body and Skin Care>Lip Care>Lip Balms,600.0,470.0,470.0,false,LPBE3RFEXETGUPDG,LPBE3RFEXETGUPDG
Flipkart,,Eos Medicated Tangerine Natural flavour(7 GM),"eos lip balm in Medicated Tangerine is 95% natural and packed with antioxidant-rich vitamin E, soothing shea butter and jojoba oil to keep your lips moisturized and protected.Immediately soothes and restores moistureAnti-bacterial protection95% naturalVitamins, zinc and shea butterSmoothes on clear",Eos,http://dl.flipkart.com/dl/eos-medicated-tangerine-natural-flavour/p/itmeym7b3yzzhh2d?pid=LPBEYM7BDGH6ZBFN&affid=siddarthk,http://img.fkcdn.com/image/lip-balm/b/f/n/eos-7-medicated-tangerine-200x200-imaeyqayk6egjzjv.jpeg,Health and Beauty>Body and Skin Care>Lip Care>Lip Balms,799.0,499.0,499.0,true,LPBEYM7BDGH6ZBFN,LPBEYM7BDGH6ZBFN
Flipkart,,"Evolution of Smooth Vanilla Mint Vanilla, Mint(7 g)","eos Visibly Soft(TM) Lip Balm, enriched with natural conditioning oils, moisturizing shea butter and antioxidant vitamins C & E, nourishes for immediately softer, more beautiful lips.",Evolution of Smooth,http://dl.flipkart.com/dl/evolution-smooth-vanilla-mint-vanilla/p/itmdzdezgmghw7th?pid=LPBDZDEZZZ3MXKJF&affid=siddarthk,http://img.fkcdn.com/image/lip-balm/k/j/f/evolution-of-smooth-7-vanilla-mint-200x200-imadzeekc6ef3zbu.jpeg,Health and Beauty>Body and Skin Care>Lip Care>Lip Balms,699.0,540.0,540.0,true,LPBDZDEZZZ3MXKJF,LPBDZDEZZZ3MXKJF
Flipkart,,"Eos Pack of 2 Sweetmint, honeysuckle(14 g)",,Eos,http://dl.flipkart.com/dl/eos-pack-2-sweetmint-honeysuckle/p/itme4vg7asjmjppq?pid=LPBE4VG7ZSRDCEGS&affid=siddarthk,http://img.fkcdn.com/image/lip-balm/e/g/s/eos-14-pack-of-2-200x200-imae4u7cwdn9r2ge.jpeg,Health and Beauty>Body and Skin Care>Lip Care>Lip Balms,1600.0,1200.0,1200.0,false,LPBE4VG7ZSRDCEGS,LPBE4VG7ZSRDCEGS
Flipkart,,Eos Strawberry Sorbet Lip Blam Fruity-Flavour(7 g),"From the house of Evolution of Smooth (EOS) comes this Smooth Sphere Lip Balm in the fruity and cool flavour of Strawberry Sorbet. For the desired pair of lips that are as irresistible as strawberry ice-cream, this lip balm should be used every day to ensure the delectable effect. Includes Shea Butter and Vitamin E 95% organic and 100% natural, this lip balm is pure and glides on lips with ease, while they are moisturised with the shea butter and vitamin E ingredients. It is also safe to use as it is gluten, paraben, petrolatum and phthalate free. Well-designed Container It has a uniquely shaped spherical container with an easy twist-off top, so that you have an easy handle when the lip balm smoothly slides across your lips.",Eos,http://dl.flipkart.com/dl/eos-strawberry-sorbet-lip-blam-fruity-flavour/p/itmdv9whh74rwqvx?pid=LPBDV9WHW743N7PY&affid=siddarthk,http://img.fkcdn.com/image/lip-balm/7/p/y/eos-7-strawberry-sorbet-lip-blam-200x200-imadvctzqyjtfyuv.jpeg,Health and Beauty>Body and Skin Care>Lip Care>Lip Balms,999.0,525.0,525.0,true,LPBDV9WHW743N7PY,LPBDV9WHW743N7PY
Flipkart,,Revlon Just Bitten Kissable Balm Stain - Honey(2.7 g),,Revlon,http://dl.flipkart.com/dl/revlon-just-bitten-kissable-balm-stain-honey/p/itmdqghzy793ezwn?pid=LPBDQGHZYGRV2S8C&affid=siddarthk,http://img.fkcdn.com/image/lip-balm/s/8/c/revlon-2-7-just-bitten-kissable-balm-stain-honey-200x200-imadqgm5zk964wga.jpeg,Health and Beauty>Body and Skin Care>Lip Care>Lip Balms,700.0,700.0,700.0,false,LPBDQGHZYGRV2S8C,LPBDQGHZYGRV2S8C
Flipkart,,LipIce Micro Shine With UV Shield Flirt Mauve Natural(2.3 g),,LipIce,http://dl.flipkart.com/dl/lipice-micro-shine-uv-shield-flirt-mauve-natural/p/itme53fs4bvwpbxg?pid=LPBE53FSPYQMKN6H&affid=siddarthk,http://img.fkcdn.com/image/lip-balm/n/6/h/lipice-2-3-micro-shine-with-uv-shield-flirt-mauve-200x200-imae538hzgg3g3sa.jpeg,Health and Beauty>Body and Skin Care>Lip Care>Lip Balms,600.0,420.0,420.0,true,LPBE53FSPYQMKN6H,LPBE53FSPYQMKN6H
Flipkart,,Vaadi Herbals Super Value Pack of 8 Lip Balm - Mint,"Nourish and moisturize your lips with these lip balms from Vaadi that come in a pack of 8 and ensure your lips are not chapped. Composition Enriched with natural emollients like mint, honey, almond oil and vitamin E, these lip balms soften and brighten your lips and help in renewing the cells. These ingredients also nourish your lips and keep them healthy. Sun Protection Use the lip balm religiously before stepping out in the sun to protect your lips from the harmful rays and also to prevent them from darkening.",Vaadi Herbals,http://dl.flipkart.com/dl/vaadi-herbals-super-value-pack-8-lip-balm-mint/p/itmdvgy67cvrpern?pid=LPBDVGTSZQCHBGPN&affid=siddarthk,http://img.fkcdn.com/image/lip-balm/g/p/n/vaadi-super-value-pack-of-8-lip-balm-mint-200x200-imadvjwxhkgpchrj.jpeg,Health and Beauty>Body and Skin Care>Lip Care>Lip Balms,280.0,240.0,240.0,true,LPBDVGTSZQCHBGPN,LPBDVGTSZQCHBGPN
Flipkart,,Forest Essentials Kokum Butter & Honey Lip Balm,"Enriched with the goodness of kokum butter and honey, this Forest Essentials Lip Balm moisturises and replenishes dry, chapped lips to make them feel dewy and kissably soft. 100% Natural The ayurvedic formula contains 100% natural ingredients that are very emollient to make your lips feel soft. No Petroleum is Used The rich emollient base is free from petroleum jelly and has beeswax and cocoa butter that deeply moisturise and soothe dry lips. Oils are Cold Pressed by Hand The natural oils used in the formula are cold pressed by hand to help retain the minerals and vitamins so your lips get wholesome nourishment and care.",Forest Essentials,http://dl.flipkart.com/dl/forest-essentials-kokum-butter-honey-lip-balm/p/itmdwyutqpuhhcfm?pid=LPBDWYUTYNYCAQMM&affid=siddarthk,http://img.fkcdn.com/image/lip-balm/q/m/m/forest-essentials-5-kokum-butter-honey-lip-balm-200x200-imaefebfdqzjheyd.jpeg,Health and Beauty>Body and Skin Care>Lip Care>Lip Balms,595.0,595.0,595.0,false,LPBDWYUTYNYCAQMM,LPBDWYUTYNYCAQMM
Flipkart,,Burt's Bees Beeswax Lip Balm Tin Baume Pour Les Levres(8.5 g),"Burt’s Bees Beeswax Lip Balm is the original, 100% natural lip conditioner that has been soothing dry, lips since 1991. Beeswax and antioxidant vitamin E condition skin, for a soothing lip treatment. A final hint of peppermint oil provides a refreshing tingle. The result is a smooth, supple smile everyone will be buzzing about. This lip balm tin fits in your purse or pocket for dry lip therapy anytime, anyplace. Spread on a little TLC with Burt’s Bees moisturizing lip balm.",Burt's Bees,http://dl.flipkart.com/dl/burt-s-bees-beeswax-lip-balm-tin-baume-pour-les-levres/p/itme482zetes4rj6?pid=LPBE482ZZ5ERUMGK&affid=siddarthk,http://img.fkcdn.com/image/lip-balm/m/g/k/burt-s-bee-8-5-beeswax-lip-balm-tin-baume-pour-les-levres-200x200-imae45wkhbwxcwhb.jpeg,Health and Beauty>Body and Skin Care>Lip Care>Lip Balms,799.0,499.0,499.0,false,LPBE482ZZ5ERUMGK,LPBE482ZZ5ERUMGK
Flipkart,,Revlon Just Bitten Kissable Balm Stain - Romantic(2.7 g),,Revlon,http://dl.flipkart.com/dl/revlon-just-bitten-kissable-balm-stain-romantic/p/itmdj6bhexrdfmsc?pid=LPBDJ6BKUTKXEH3X&affid=siddarthk,http://img.fkcdn.com/image/lip-balm/h/3/x/revlon-2-7-just-bitten-kissable-balm-stain-romantic-200x200-imadj6chqhyghzfn.jpeg,Health and Beauty>Body and Skin Care>Lip Care>Lip Balms,700.0,700.0,700.0,false,LPBDJ6BKUTKXEH3X,LPBDJ6BKUTKXEH3X
Flipkart,,Revlon Color Burst Matte Balm Standout(2.7 g),"This innovative Chubby lip pencil takes your look from day to night with this velvety matte finish, infused with Balm like moisture. This on trend finish take your look from soft and pretty to bold and glamorous.",Revlon,http://dl.flipkart.com/dl/revlon-color-burst-matte-balm-standout/p/itme3wr8hq4hhxjk?pid=LPBE8EZGUXHYZPZZ&affid=siddarthk,http://img.fkcdn.com/image/lip-balm/p/z/z/revlon-2-7-color-burst-matte-balm-200x200-imae8ezg4rrnxv6g.jpeg,Health and Beauty>Body and Skin Care>Lip Care>Lip Balms,890.0,801.0,801.0,true,LPBE8EZGUXHYZPZZ,LPBE8EZGUXHYZPZZ
Flipkart,,Revlon Color Burst Lacquer Balm Flirtatious(2.7 g),"This innovative Chubby lip pencil takes your look from day to night with this velvety matte finish, infused with Balm like moisture. This on trend finish take your look from soft and pretty to bold and glamorous.",Revlon,http://dl.flipkart.com/dl/revlon-color-burst-lacquer-balm-flirtatious/p/itme8ezgjhwgnefg?pid=LPBE8EZG7TYZD8TW&affid=siddarthk,http://img.fkcdn.com/image/lip-balm/8/t/w/revlon-2-7-color-burst-lacquer-balm-200x200-imae89j64zr5yztn.jpeg,Health and Beauty>Body and Skin Care>Lip Care>Lip Balms,890.0,801.0,801.0,true,LPBE8EZG7TYZD8TW,LPBE8EZG7TYZD8TW
Flipkart,,Revlon Just Bitten Kissable Balm Stain - Crush(2.7 g),,Revlon,http://dl.flipkart.com/dl/revlon-just-bitten-kissable-balm-stain-crush/p/itmdj6bh4c9yg5vg?pid=LPBDJ6BKS44GJ4J9&affid=siddarthk,http://img.fkcdn.com/image/lip-balm/4/j/9/revlon-2-7-just-bitten-kissable-balm-stain-crush-200x200-imadj6chhqzevbbu.jpeg,Health and Beauty>Body and Skin Care>Lip Care>Lip Balms,700.0,660.0,660.0,false,LPBDJ6BKS44GJ4J9,LPBDJ6BKS44GJ4J9
Flipkart,,Revlon Color Burst Matte Balm Mischievious(2.7 g),,Revlon,http://dl.flipkart.com/dl/revlon-color-burst-matte-balm-mischievious/p/itme3wr8hq4hhxjk?pid=LPBE8EZGPYAHFHYA&affid=siddarthk,http://img.fkcdn.com/image/lip-balm/h/y/a/revlon-2-7-color-burst-matte-balm-200x200-imae89jb5azvaxkk.jpeg,Health and Beauty>Body and Skin Care>Lip Care>Lip Balms,890.0,801.0,801.0,true,LPBE8EZGPYAHFHYA,LPBE8EZGPYAHFHYA
Flipkart,,Revlon Just Bitten Kissable Balm Stain - Lovesick(2.7 g),,Revlon,http://dl.flipkart.com/dl/revlon-just-bitten-kissable-balm-stain-lovesick/p/itmdz52qpxegrkst?pid=LPBDZ52PKDQPTGUZ&affid=siddarthk,http://img.fkcdn.com/image/lip-balm/g/u/z/revlon-2-7-just-bitten-kissable-balm-stain-lovesick-200x200-imadz54gq2hkfrhc.jpeg,Health and Beauty>Body and Skin Care>Lip Care>Lip Balms,899.0,750.0,750.0,true,LPBDZ52PKDQPTGUZ,LPBDZ52PKDQPTGUZ
Flipkart,,Revlon Color Burst Matte Balm Unapologetic,"This innovative Chubby lip pencil takes your look from day to night with this velvety matte finish, infused with Balm like moisture. This on trend finish take your look from soft and pretty to bold and glamorous.",Revlon,http://dl.flipkart.com/dl/revlon-color-burst-matte-balm-unapologetic/p/itme3wr8hq4hhxjk?pid=LPBE6FF2USE8RNSS&affid=siddarthk,http://img.fkcdn.com/image/lip-balm/n/s/s/revlon-5-color-burst-matte-balm-200x200-imae6dtxkqmyz3mv.jpeg,Health and Beauty>Body and Skin Care>Lip Care>Lip Balms,761.0,761.0,761.0,false,LPBE6FF2USE8RNSS,LPBE6FF2USE8RNSS
Flipkart,,Revlon Color Burst Lacquer Balm Coy(2.7 g),,Revlon,http://dl.flipkart.com/dl/revlon-color-burst-lacquer-balm-coy/p/itme8ezgjhwgnefg?pid=LPBE8EZGXHGY3E4P&affid=siddarthk,http://img.fkcdn.com/image/lip-balm/e/4/p/revlon-2-7-color-burst-lacquer-balm-200x200-imae89jbny2szezh.jpeg,Health and Beauty>Body and Skin Care>Lip Care>Lip Balms,890.0,799.0,799.0,true,LPBE8EZGXHGY3E4P,LPBE8EZGXHGY3E4P
Flipkart,,Revlon Just Bitten Kissable Balm Stain - Adore(2.7 g),"Your lips need moisturization all-year-round, and not just during the winter season. Just Bitten Kissable Balm Stain from Revlon will provide that necessary hydration and nourishment to your lips and leave a beautiful tint of colour behind. For Soft and Smooth Lips The gel formula of the lip balm deeply moisturizes your lips to make them smooth and soft. It is lightweight and feels comfortable on your lips. Long Lasting Balm Stain The lip balm stays on your lips for a long time for the lasting protection against any kind of weather. Retractable Chubby Crayon The chubby lip crayon does not need a sharpener and is easy to hold for simple application.",Revlon,http://dl.flipkart.com/dl/revlon-just-bitten-kissable-balm-stain-adore/p/itmdqghzhgyxvfm2?pid=LPBDQGHZN4FVB5FP&affid=siddarthk,http://img.fkcdn.com/image/lip-balm/5/f/p/revlon-2-7-just-bitten-kissable-balm-stain-adore-200x200-imadqgm5fztrskae.jpeg,Health and Beauty>Body and Skin Care>Lip Care>Lip Balms,700.0,700.0,700.0,false,LPBDQGHZN4FVB5FP,LPBDQGHZN4FVB5FP
Flipkart,,Nivea Lip Care Pomegranate(4.8 g),"Give your lips a natural shine and prevent them from chapping or drying by regularly rolling this Nivea lip balm over them. Chic and fruity, this roll-on lip balm has pomegranate extracts which leave a tinge of red color and fruity flavor on your lips. Moisturizes Your Lips Specially formulated with Hydra IQ, almond and jojoba oils, this lip balm moisturizes your lips and leaves them soft and nourished, inside out. Smooth, Shiny The selected fruit pigments add a glossy look and sweet flavor to your lips, leaving them smooth and kissable.",Nivea,http://dl.flipkart.com/dl/nivea-lip-care-pomegranate/p/itmd9arqgmndhahw?pid=LPBD9YW5ZYNHEKZA&affid=siddarthk,http://img.fkcdn.com/image/lip-balm/k/z/a/nivea-4-8-lip-care-200x200-imae75h38ytze8xz.jpeg,Health and Beauty>Body and Skin Care>Lip Care>Lip Balms,135.0,135.0,135.0,false,LPBD9YW5ZYNHEKZA,LPBD9YW5ZYNHEKZA
Flipkart,,Trisa Perfect White Clinical Toothpaste Toothpaste,"Features - Unique micro-crystal formula ensures gentle whitening and effective cleaning, fights plaque and prevents formation of tartar, prevents Dental Carries & Tooth decay, clinically Tested effectiveness, RDA approx 75, fluoride - 0.13 percent. Ingredients - zinc chloride, cetylpyridinium chloride, domiphen bromide, tetrasodium pyrophosphate, disodium pyrophosphate",Trisa,http://dl.flipkart.com/dl/trisa-perfect-white-clinical-toothpaste/p/itmdqd25bvsrtyfg?pid=TPSDQD22FATNXWZC&affid=siddarthk,http://img.fkcdn.com/image/toothpaste/w/z/c/trisa-75-perfect-white-clinical-toothpaste-200x200-imadqg785gv4p5xd.jpeg,Health and Beauty>Body and Skin Care>Oral Care>Toothpastes,299.0,269.0,269.0,false,TPSDQD22FATNXWZC,TPSDQD22FATNXWZC
Flipkart,,Trisa Intensive Care 8-in-1 Clinical Toothpaste Toothpaste,"Features - Provides a comprehensive 8 fold oral care, protection from tooth decay, remineralization of tooth enamel, reduces the formation of plaque, reduces the formation of tartar,strengthens gums, reduces the growth of bacteria, help restore the natural whiteness,fresh breath. Clinically tested effectiveness. RDA approx 50, fluoride - 0.13 percent.Ingredients - Sodium Monofluorophosphate,dicalcium phosphate, cetylpyridinium chloride, domiphen bromide, panthenol (Provitamin B5), tocopheryl acetate (Vitamin E), tetrasodium & Disodium Pyrophosphate.",Trisa,http://dl.flipkart.com/dl/trisa-intensive-care-8-in-1-clinical-toothpaste/p/itmdqd25dqeqvfyw?pid=TPSDQD22WT3GCMBP&affid=siddarthk,http://img.fkcdn.com/image/toothpaste/m/b/p/trisa-75-intensive-care-8-in-1-clinical-toothpaste-200x200-imadqg782fzrupfs.jpeg,Health and Beauty>Body and Skin Care>Oral Care>Toothpastes,325.0,293.0,293.0,false,TPSDQD22WT3GCMBP,TPSDQD22WT3GCMBP
