PartnerName,Id,Title,Description,Brand,Link,ImageLink,CategoryName,Mrp,OfferPrice,EffectivePrice,Availability,PartnerIdFromUrl,PartnerIdFromDb
Flipkart,,VolumOn Professional Hair Building Fibres - Gray M-948 Extreme Hair Volumizer Cotton(28 g),"Volumon Cotton Hair Fibres are an all natural, non toxic, textured solution for thinning and balding hair. It is a cosmetic breakthrough which immediately transforms your appearance, leaving men and women with thicker looking hair in under 30 seconds. The fibres are electro statically charged, creating a magnetic effect, binding them to existing hair cells, thus maximising their holding potential. They product dramatic density with volume and totally undetectable coverage to your thinning and balding areas.The fibres attach to your existing hair, which creates a strong hold which lasts all day.The weight of each eco friendly cotton hair fibre, provides a solid natural layer, preventing the fibres from falling our or smearing. Volumon's cotton hair fibre formula is so effective, that the fibres are resistant to wind, rain and perspiration, yet they easily wash out with shampoo.Volumon cotton hair fibres can be used on all types and shades of hair. Whether it is black, brown or blonde, shorty, curly or long, the results will remain outstanding. Even at close range it is impossible to detect the hair fibres, because they do not spear or stain, but provide a natural, thick and textured appearance.Hairloss can have an enormously negative effect on our self esteem and confidence. Volumon's hair fibres have helped positively change the lives of millions of men and women accross the globe, from those suffering from alopecia, from those experiencing thinning hair, or even drastic baldness.",VolumOn,http://dl.flipkart.com/dl/volumon-professional-hair-building-fibres-gray-m-948-extreme-volumizer-cotton/p/itmed9q29zbcx6zu?pid=HVRED9Q2BJ4U3SKH&affid=siddarthk,http://img.fkcdn.com/image/hair-volumizer/s/k/h/m-948-extreme-volumon-28-cotton-professional-hair-building-200x200-imaed9cbv3rhtanx.jpeg,Health and Beauty>Hair Care>Hair Volumizers,1078.0,970.0,1078.0,true,HVRED9Q2BJ4U3SKH,HVRED9Q2BJ4U3SKH
Flipkart,,The Body Shop Strawberry,,The Body Shop,http://dl.flipkart.com/dl/body-shop-strawberry/p/itmeensjsgxbgvdq?pid=CBKEENSJGWAWNYYS&affid=siddarthk,http://img.fkcdn.com/image/combo-kit/y/y/s/gift-set-the-body-shop-strawberry-200x200-imaeehayhyhjmvxq.jpeg,Health and Beauty>Bath and Spa>Combos & Kits,3400.0,3299.0,3299.0,true,CBKEENSJGWAWNYYS,CBKEENSJGWAWNYYS
Flipkart,,Herbalife Shampoo And Conditioner(Set of 2),"Best Combo Of Hair Accessories Is Here And Best Herbal Product At Amazing Price,",Herbalife,http://dl.flipkart.com/dl/herbalife-shampoo-conditioner/p/itmedmyzunuc9stx?pid=CBKEDMYZCTXGY4S7&affid=siddarthk,http://img.fkcdn.com/image/combo-kit/4/s/7/hb-00-herbalife-shampoo-and-conditioner-200x200-imaedfzdayzut29d.jpeg,Health and Beauty>Bath and Spa>Combos & Kits,1708.0,1287.0,1287.0,false,CBKEDMYZCTXGY4S7,CBKEDMYZCTXGY4S7
Flipkart,,OGX Moisture+Vitamin B5 Shampoo Conditioner Combo(Set of 2),,OGX,http://dl.flipkart.com/dl/ogx-moisture-vitamin-b5-shampoo-conditioner-combo/p/itmeejxvuyn5wgay?pid=CBKEEJXVGZRR4C9T&affid=siddarthk,http://img.fkcdn.com/image/combo-kit/c/9/t/ogx-combo-12-ogx-moisture-vitamin-b5-shampoo-conditioner-combo-200x200-imaeej4ggypgarkk.jpeg,Health and Beauty>Combos and Kits,1450.0,1430.0,1430.0,true,CBKEEJXVGZRR4C9T,CBKEEJXVGZRR4C9T
Flipkart,,Glamcom 24 Colors Eye Shadow Palette 04 20 g(24 Multi Color Eye Shadow Palette 04),A trendy Eye Shadow,Glamcom,http://dl.flipkart.com/dl/glamcom-24-colors-eye-shadow-palette-04-20-g/p/itmeenhfwpxmwdep?pid=ESDEENHFQWRPKK4G&affid=siddarthk,http://img.fkcdn.com/image/eye-shadow/k/4/g/glamcom-20-24-colors-eye-shadow-palette-04-200x200-imaeedhcnequgxmh.jpeg,Health and Beauty>Makeup>Eyes>Eye Shadows,1499.0,989.0,989.0,false,ESDEENHFQWRPKK4G,ESDEENHFQWRPKK4G
Flipkart,,sharp n style Eye Shadow Kit 48 color 10 g(Multicolor),,sharp n style,http://dl.flipkart.com/dl/sharp-n-style-eye-shadow-kit-48-color-10-g/p/itmeejg8qdewuzps?pid=ESDEEJG8TNAQ94MG&affid=siddarthk,http://img.fkcdn.com/image/eye-shadow/4/m/g/sharp-n-style-10-eye-shadow-kit-48-color-200x200-imaeeg6hn2vzexbs.jpeg,Health and Beauty>Makeup>Eyes>Eye Shadows,999.0,423.0,470.0,false,ESDEEJG8TNAQ94MG,ESDEEJG8TNAQ94MG
Flipkart,,7 Heaven's Photogenic Chubby Lip Crayon 3 g(Broker Hearted-511),"Full of honey, nector for creamy and wax free shine. Pure liquid pigments for vibrant colours. Easy to apply. Recommended for daily use. Does not harm skin. Stays on for long hours.",7 Heaven's,http://dl.flipkart.com/dl/7-heaven-s-photogenic-chubby-lip-crayon-3-g/p/itmekcdjeyg6uhqm?pid=LSKEC8A4ZZH4XDRG&affid=siddarthk,http://img.fkcdn.com/image/lipstick/d/r/g/7heaven-s-3-photogenic-chubby-lip-crayon-200x200-imaebxt5jjxnxfax.jpeg,Health and Beauty>Makeup>Lips>Lipsticks,540.0,160.0,160.0,true,LSKEC8A4ZZH4XDRG,LSKEC8A4ZZH4XDRG
Flipkart,,Colorbar Kiss Proof Lip Stain 6.5 ml(006 Mauve Dusk),,Colorbar,http://dl.flipkart.com/dl/colorbar-kiss-proof-lip-stain-6-5-ml/p/itme8n76agvrhngp?pid=LSKEEDNTTDRHUNDX&affid=siddarthk,http://img.fkcdn.com/image/lipstick/n/d/x/colorbar-6-5-kiss-proof-lip-stain-200x200-imaeecdjrsjqy2mf.jpeg,Health and Beauty>Makeup>Lips>Lipsticks,900.0,900.0,900.0,true,LSKEEDNTTDRHUNDX,LSKEEDNTTDRHUNDX
Flipkart,,Biotique Bio Dandelion Ageless Lightening Serum (For Every Skin Regime Every Day )-40 Ml(40 ml),"This lightening serum is a rare combination of pure dandelion, rich in Vitamin E and minerals, blended with nutmeg oil. Used regularly, it helps brighten skin, fade dark spots and ease away wrinkles for a flawless complexion.",Biotique,http://dl.flipkart.com/dl/biotique-bio-dandelion-ageless-lightening-serum-for-every-skin-regime-day-40-ml/p/itmeenjgfy7ykdny?pid=ATAEENJGZFMZTTHM&affid=siddarthk,http://img.fkcdn.com/image/anti-ageing/t/h/m/biotique-35-bio-dandelion-ageless-lightening-serum-for-every-200x200-imaem8qv4tvbcqcg.jpeg,Health and Beauty>Body and Skin Care>Face Care>Anti Ageing,230.0,215.0,215.0,true,ATAEENJGZFMZTTHM,ATAEENJGZFMZTTHM
Flipkart,,Biotique Bio Wheatgerm (Youthful Nourishing Night Cream)175 Gm(175 g),"This rich-feeling, firming cream is blended with pure wheat germ, sunflower and almond oils, vitamins A, B, C, D, E and extracts of carrot and galangal to moisturize and strengthen skin for a more vital, resilient, younger appearance.",Biotique,http://dl.flipkart.com/dl/biotique-bio-wheatgerm-youthful-nourishing-night-cream-175-gm/p/itmeenjgvb8d2hj5?pid=ATAEENJGSZZZ4D6P&affid=siddarthk,http://img.fkcdn.com/image/anti-ageing/d/6/p/biotique-175-bio-wheatgerm-youthful-nourishing-night-cream-175-200x200-imaeedhdwwj4cth9.jpeg,Health and Beauty>Body and Skin Care>Face Care>Anti Ageing,480.0,460.0,460.0,true,ATAEENJGSZZZ4D6P,ATAEENJGSZZZ4D6P
Flipkart,,Avon Nutraeffects Ageless Multi-Action Day Cream SPF 20 (50 g) + Night Cream (50 g)(100 g),"Nutraeffects Ageless Multi-Action Cream SPF20:• With SPF 20 & Broad Spectrum UVA/ UVB, protects skin from Sun damage• Provides up to 48 hours of hydration and restores skin’s youthful fullness.Nutraeffects Ageless Multi-Action Night Cream:• Boosts collagen production for firmer skin overnight • Skin feels replenished with reduced line & wrinkles in 2 weeks.",Avon,http://dl.flipkart.com/dl/avon-nutraeffects-ageless-multi-action-day-cream-spf-20-50-g-night/p/itmeezgaamgahrdy?pid=ATAEEZGAZPYRVPRG&affid=siddarthk,http://img.fkcdn.com/image/anti-ageing/p/r/g/avon-100-nutraeffects-ageless-multi-action-day-cream-spf-20-50-g-200x200-imaeezbnmqseayg8.jpeg,Health and Beauty>Body and Skin Care>Face Care>Anti Ageing,1258.0,990.0,990.0,true,ATAEEZGAZPYRVPRG,ATAEEZGAZPYRVPRG
Flipkart,,Optimals Oxygen Boost Face Blotting(Pack of 50),"Oil absorbent paper easy to use and convenient to carry, quick to help remove grease on the skin and removing the makeup , you are always confident and clear skin and fresh all day long. 50 sheets / box.",Optimals,http://dl.flipkart.com/dl/optimals-oxygen-boost-face-blotting/p/itmecaf53hzg3b4v?pid=FLTECAF5ZZUZPDNW&affid=siddarthk,http://img.fkcdn.com/image/facial-tissue/d/n/w/50-27670-optimals-oxygen-boost-face-blotting-200x200-imaeezqgr5ufcp9u.jpeg,Health and Beauty>Makeup>Makeup Accessories>Facial Tissues,199.0,195.0,195.0,true,FLTECAF5ZZUZPDNW,FLTECAF5ZZUZPDNW
Flipkart,,L'Oreal Paris Everpure Colour Care Shine Serum(50 ml),"L'OREAL PARIS COLOURED & FRIZZY HAIR, Especially designed for the most delicate hair.Respects the hair fibre.Especially designed for coloured hair frizzy hair, the EverPure Colour Care Shine Serum offers protection for coloured hair while helping to control frizz.Cared for and frizz-free, your coloured hair reveals its lustrous shine and feels satin soft.Indulge in the EverPure Experience: After using EverPure Colour Care Shampoo and Conditioner, spread one or two hazlenut sized amounts carefully through dry hair,focusing on lenghts and end.Don't rinse out. In case of contact with eyes, rinse them immediatley.",L'Oreal Paris,http://dl.flipkart.com/dl/l-oreal-paris-everpure-colour-care-shine-serum/p/itmeemj9qrhuwqqv?pid=HSMEEMJ9XPZ8FN8J&affid=siddarthk,http://img.fkcdn.com/image/hair-serum/n/8/j/loreal-paris-50-everpure-colour-care-shine-serum-200x200-imaeemeh8ab7kmz6.jpeg,Health and Beauty>Hair Care>Hair Serums,1799.0,724.0,724.0,true,HSMEEMJ9XPZ8FN8J,HSMEEMJ9XPZ8FN8J
Flipkart,,Beauty Of Life 15 Pieces Pink Nail Art Brushes and Dotting tools set,Easy DIY 15 Pieces Pink Nail Art Brushes and Dotting tool kit,Beauty Of Life,http://dl.flipkart.com/dl/beauty-life-15-pieces-pink-nail-art-brushes-dotting-tools-set/p/itmeezyhmm66fsar?pid=NLAEEZYHFUPDMHA8&affid=siddarthk,http://img.fkcdn.com/image/nail-art/h/a/8/beauty-of-life-pink-15-pieces-pink-nail-art-brushes-and-dotting-200x200-imaeenst8g7czsdr.jpeg,Health and Beauty>Makeup>Nails>Nail Arts,1700.0,296.0,296.0,false,NLAEEZYHFUPDMHA8,NLAEEZYHFUPDMHA8
Flipkart,,Maybelline Fit Me Blusher(Medium Coral),With Fit Me! Blush You'Ll Get A Lovely Pink Or Rose Flush That Lets The Real You Shine Through.,Maybelline,http://dl.flipkart.com/dl/maybelline-fit-me-blusher/p/itmeh4aympfkbrgc?pid=BLUEEMNAHKGVFTB7&affid=siddarthk,http://img.fkcdn.com/image/blush/t/b/7/maybelline-fit-me-blusher-200x200-imaeemkyhg9szahm.jpeg,Health and Beauty>Makeup>Face>Blushes,500.0,400.0,400.0,true,BLUEEMNAHKGVFTB7,BLUEEMNAHKGVFTB7
Flipkart,,Gatsby Set & Keep Spray Super Hard Hair Styler,Fine Mist for stylish and lasting hairstyle. No visible residue left on hair. Non-sticky shine effect. Helps protect from UV rays. Natural and refreshing citrus scent.,Gatsby,http://dl.flipkart.com/dl/gatsby-set-keep-spray-super-hard-hair-styler/p/itmeezpwzm2c5724?pid=HSYEEZPWEZTKZBF9&affid=siddarthk,http://img.fkcdn.com/image/hair-styling/b/f/9/gatsby-250-set-keep-spray-super-hard-200x200-imaeezh9qb4uyczs.jpeg,Health and Beauty>Hair Care>Hair Styling,200.0,195.0,195.0,true,HSYEEZPWEZTKZBF9,HSYEEZPWEZTKZBF9
Flipkart,,Bonjour Paris Neon Lipstick Combo 64 67 06 12 g,,Bonjour Paris,http://dl.flipkart.com/dl/bonjour-paris-neon-lipstick-combo-64-67-06-12-g/p/itmeehnfqyqh5pph?pid=LSKEEHNFZKWPTPG8&affid=siddarthk,http://img.fkcdn.com/image/lipstick/p/g/8/bonjour-paris-12-neon-lipstick-combo-64-67-06-200x200-imaeef9tndyyrebj.jpeg,Health and Beauty>Makeup>Lips>Lipsticks,900.0,547.0,547.0,true,LSKEEHNFZKWPTPG8,LSKEEHNFZKWPTPG8
Flipkart,,"Revlon Super Lustrous Lipstick, Sunset 4.2 g(Brown)",,Revlon,http://dl.flipkart.com/dl/revlon-super-lustrous-lipstick-sunset-4-2-g/p/itmee4h63ucgvjee?pid=LSKEE4H6FNACTYRN&affid=siddarthk,http://img.fkcdn.com/image/lipstick/y/r/n/revlon-4-2-super-lustrous-lipstick-sunset-200x200-imaee3zummj5z7qw.jpeg,Health and Beauty>Makeup>Lips>Lipsticks,599.0,590.0,590.0,true,LSKEE4H6FNACTYRN,LSKEE4H6FNACTYRN
Flipkart,,"Bonjour Paris Pink Lipstick Combo 62 55 48 12 g(Multicolor,)",,Bonjour Paris,http://dl.flipkart.com/dl/bonjour-paris-pink-lipstick-combo-62-55-48-12-g/p/itmeehnfs8arwtqm?pid=LSKEEHNF3DSXMTEC&affid=siddarthk,http://img.fkcdn.com/image/lipstick/t/e/c/bonjour-paris-12-pink-lipstick-combo-62-55-48-200x200-imaeef9trkfczqm6.jpeg,Health and Beauty>Makeup>Lips>Lipsticks,900.0,546.0,546.0,true,LSKEEHNF3DSXMTEC,LSKEEHNF3DSXMTEC
Flipkart,,Bonjour Paris Orange Lipstick Combo 67 63 61 12 g,,Bonjour Paris,http://dl.flipkart.com/dl/bonjour-paris-orange-lipstick-combo-67-63-61-12-g/p/itmeehnfeznvyxnm?pid=LSKEEHNFCN4TMNJV&affid=siddarthk,http://img.fkcdn.com/image/lipstick/n/j/v/bonjour-paris-12-orange-lipstick-combo-67-63-61-200x200-imaeef9t5jpj4syh.jpeg,Health and Beauty>Makeup>Lips>Lipsticks,900.0,,499.0,true,LSKEEHNFCN4TMNJV,LSKEEHNFCN4TMNJV
Flipkart,,7 Heaven's Hydrating/Moisture Max Lipstick 4 g(Rusty Rose),"Get a Soft Satin Finish With 7 Heavens Exclusive ""PhotoGenic"" Range of Cosmetics. It is Non Drying, Moisturising / Hydrating Lipstick. All Colors are Highly Pigmented & Opaque. Bees Wax Gives Extra Hydration for a Longer Period of Time.",7 Heaven's,http://dl.flipkart.com/dl/7-heaven-s-hydrating-moisture-max-lipstick-4-g/p/itmeduuaa9vueaqu?pid=LSKEDUUBDGB7NGBZ&affid=siddarthk,http://img.fkcdn.com/image/lipstick/g/b/z/7-heavens-4-hydrating-moisture-max-lipstick-200x200-imaedu4ygpukhyha.jpeg,Health and Beauty>Makeup>Lips>Lipsticks,1150.0,342.0,381.0,true,LSKEDUUBDGB7NGBZ,LSKEDUUBDGB7NGBZ
Flipkart,,7 Heaven's Hydrating/Moisture Max Lipstick 4 g(Apricot),"Get a Soft Satin Finish With 7 Heavens Exclusive ""PhotoGenic"" Range of Cosmetics. It is Non Drying, Moisturising / Hydrating Lipstick. All Colors are Highly Pigmented & Opaque. Bees Wax Gives Extra Hydration for a Longer Period of Time.",7 Heaven's,http://dl.flipkart.com/dl/7-heaven-s-hydrating-moisture-max-lipstick-4-g/p/itmeduuaa9vueaqu?pid=LSKEDUUAYZGSRHFY&affid=siddarthk,http://img.fkcdn.com/image/lipstick/h/f/y/7-heavens-4-hydrating-moisture-max-lipstick-200x200-imaedu4ykvmvyj8k.jpeg,Health and Beauty>Makeup>Lips>Lipsticks,1150.0,396.0,440.0,true,LSKEDUUAYZGSRHFY,LSKEDUUAYZGSRHFY
Flipkart,,ADS Concealer-01 Concealer(MultiColor),,ADS,http://dl.flipkart.com/dl/ads-concealer-01-concealer/p/itmecyz5r5hpz4wv?pid=CLREE73F2YWKSWCZ&affid=siddarthk,http://img.fkcdn.com/image/concealer/w/c/z/ads-concealer-01-200x200-imaee6ykhh6tyzbw.jpeg,Health and Beauty>Makeup>Face>Concealers,708.0,171.0,171.0,true,CLREE73F2YWKSWCZ,CLREE73F2YWKSWCZ
Flipkart,,Naturmed'S Yastimadhu Powder(100 g),"Amritha - naturmed's herbal products are made from herbs sourced from forest. All the herbs we manufacture are used in ayurveda which is a alternative way of treatment. Ayurveda medicine evolved in india and is considered to be the world oldest healthcare system. It is named from sanskrit word ""Ayurveda""Meaning ""Science of Life""",Naturmed'S,http://dl.flipkart.com/dl/naturmed-s-yastimadhu-powder/p/itmee9h2ezmtqr5g?pid=TLCEE9H2GNYV8MHJ&affid=siddarthk,http://img.fkcdn.com/image/talc/m/h/j/naturmed-s-100-yastimadhu-powder-200x200-imaee4gj8andz9xw.jpeg,Health and Beauty>Body and Skin Care>Body Care>Talcs,80.0,80.0,80.0,true,TLCEE9H2GNYV8MHJ,TLCEE9H2GNYV8MHJ
Flipkart,,Naturmed'S Ashwagandha Powder(100 g),"Amritha - Naturmed'S Herbal Products Are Made From Herbs Sourced From Forest. All The Herbs We Manufacture Are Used In Ayurveda Which Is A Alternative Way Of Treatment. Ayurveda Medicine Evolved In India And Is Considered To Be The World Oldest Healthcare System. It Is Named From Sanskrit Word ""Ayurveda""Meaning ""Science Of Life""",Naturmed'S,http://dl.flipkart.com/dl/naturmed-s-ashwagandha-powder/p/itmee9h22rj9m4sy?pid=TLCEE9H2WU3QDHYS&affid=siddarthk,http://img.fkcdn.com/image/talc/h/y/s/naturmed-s-100-ashwagandha-powder-200x200-imaee4hf2ucxgszz.jpeg,Health and Beauty>Body and Skin Care>Body Care>Talcs,100.0,100.0,100.0,true,TLCEE9H2WU3QDHYS,TLCEE9H2WU3QDHYS
Flipkart,,Miss rose Non Transfer & Super Shine Extender 10 g,,Miss rose,http://dl.flipkart.com/dl/miss-rose-non-transfer-super-shine-extender-10-g/p/itmeemnbjzy6ywth?pid=LGSEEMNBPKFFNT2W&affid=siddarthk,http://img.fkcdn.com/image/lip-gloss/t/2/w/miss-rose-10-non-transfer-super-shine-extender-200x200-imaeehe4uscq2j3z.jpeg,Health and Beauty>Makeup>Lips>Lip Glosses,1500.0,850.0,850.0,true,LGSEEMNBPKFFNT2W,LGSEEMNBPKFFNT2W
Flipkart,,Arezia Matte Me 6 ml(Autumn Orange),Ultra Smooth Matte Lipstick,Arezia,http://dl.flipkart.com/dl/arezia-matte-me-6-ml/p/itmedkgxyumgjwq4?pid=LGSEDHKXNFYU8SHB&affid=siddarthk,http://img.fkcdn.com/image/lip-gloss/s/h/b/arezia-6-matte-me-200x200-imaedhjbtggdkdqz.jpeg,Health and Beauty>Makeup>Lips>Lip Glosses,449.0,299.0,299.0,true,LGSEDHKXNFYU8SHB,LGSEDHKXNFYU8SHB
Flipkart,,Rosebud Perfume Co. Smith'S Lip Balm Strawberry(22 g),This Aromatic Lip Balm With Natural Beeswax And A Trade Secret Blend Of Strawberry Flavor Is A Favorite Of Both Celebrities And Athletes. Strawberry Lip Balm Is As Scintillating As Strawberry Shortcake.,Rosebud Perfume Co.,http://dl.flipkart.com/dl/rosebud-perfume-co-smith-s-lip-balm-strawberry/p/itmeb46nazjrzunj?pid=LPBEB46NTDZ33KTH&affid=siddarthk,http://img.fkcdn.com/image/lip-balm/k/t/h/rosebud-perfume-co-22-smith-s-lip-balm-200x200-imaeb3vk5yqqgvuj.jpeg,Health and Beauty>Body and Skin Care>Lip Care>Lip Balms,950.0,799.0,799.0,false,LPBEB46NTDZ33KTH,LPBEB46NTDZ33KTH
Flipkart,,Anokhi Ada Infinity Hair Clip(Black),Pair of 10 cm long Black Banana Clips with infinity like structure.,Anokhi Ada,http://dl.flipkart.com/dl/anokhi-ada-infinity-hair-clip/p/itmedshwkudpyrmb?pid=HACEDSHWPHZKMWFX&affid=siddarthk,http://img.fkcdn.com/image/hair-accessory/w/f/x/hja-0009-2-anokhi-ada-hair-clip-infinity-200x200-imaedsk372fhmjdu.jpeg,Health and Beauty>Hair Care>Hair Care Accessories>Hair Accessories,250.0,179.0,179.0,false,HACEDSHWPHZKMWFX,HACEDSHWPHZKMWFX
Flipkart,,ADS ADS-Perfect-Waterproof-Eyeliner-Black1-1Packof-12pcs 2.5 g(Black),,ADS,http://dl.flipkart.com/dl/ads-ads-perfect-waterproof-eyeliner-black1-1packof-12pcs-2-5-g/p/itmeeh82yemkh2wg?pid=ELREEH82G7QWGFAP&affid=siddarthk,http://img.fkcdn.com/image/eye-liner/4/h/m/ads-3-5-black-eyeliner-packof-12-200x200-imaeeeqqdyb9f4ev.jpeg,Health and Beauty>Makeup>Eyes>Eye Liners,508.0,179.0,179.0,true,ELREEH82G7QWGFAP,ELREEH82G7QWGFAP
Flipkart,,Besure Neem Transparent Soap Pack Of 4 100g,BeSure Transparent Soap With Glycerine is one of the best soap to give your skin a complete nourisThis soap is non-colorant and transparent and is enriched with the goodness of glycerin and natural oils.hment with glowing felling.,Besure,http://dl.flipkart.com/dl/besure-neem-transparent-soap-pack-4-100g/p/itmeez4p2ge6cg3v?pid=SOPEEZ4P2Y5NZH2S&affid=siddarthk,http://img.fkcdn.com/image/soap/h/2/s/besure-100-neem-transparent-soap-pack-of-4-100g-200x200-imaeenhntv6spt8u.jpeg,Health and Beauty>Bath and Spa>Soaps,400.0,152.0,152.0,false,SOPEEZ4P2Y5NZH2S,SOPEEZ4P2Y5NZH2S
Flipkart,,Besure Lemon Transparent Soap Pack Of 1 100g,BeSure Transparent Soap With Glycerine is one of the best soap to give your skin a complete nourisThis soap is non-colorant and transparent and is enriched with the goodness of glycerin and natural oils.hment with glowing felling.,Besure,http://dl.flipkart.com/dl/besure-lemon-transparent-soap-pack-1-100g/p/itmeez4pspnzksyc?pid=SOPEEZ4PUFYCSRFS&affid=siddarthk,http://img.fkcdn.com/image/soap/r/f/s/besure-100-lemon-transparent-soap-pack-of-1-100g-200x200-imaeenhm3gengkv3.jpeg,Health and Beauty>Bath and Spa>Soaps,60.0,21.0,21.0,false,SOPEEZ4PUFYCSRFS,SOPEEZ4PUFYCSRFS
Flipkart,,Besure Gentle Care Transparent Soap Pack Of 4 100g,BeSure Transparent Soap With Glycerine is one of the best soap to give your skin a complete nourisThis soap is non-colorant and transparent and is enriched with the goodness of glycerin and natural oils.hment with glowing felling.,Besure,http://dl.flipkart.com/dl/besure-gentle-care-transparent-soap-pack-4-100g/p/itmeez4pwmhtnpxc?pid=SOPEEZ4PUEUGPDYP&affid=siddarthk,http://img.fkcdn.com/image/soap/d/y/p/besure-100-gentle-care-transparent-soap-pack-of-4-100g-200x200-imaeenhmgggxvyas.jpeg,Health and Beauty>Bath and Spa>Soaps,240.0,84.0,84.0,false,SOPEEZ4PUEUGPDYP,SOPEEZ4PUEUGPDYP
Flipkart,,Khadi Herbal NaturalRose Water Soap - Pack of 3(270 g),Surround yourself with the tantalising scent of jasmine known to boost your self-confidence by adding an element of lush sensuality and increasing your overall sense of well-being.,Khadi Herbal,http://dl.flipkart.com/dl/khadi-herbal-naturalrose-water-soap-pack-3/p/itmedz2eywmj3xsd?pid=SOPEDZ2EFHKDYQMD&affid=siddarthk,http://img.fkcdn.com/image/soap/q/m/d/khadi-herbal-270-rose-water-soap-pack-of-3-200x200-imaednzggqf4dayp.jpeg,Health and Beauty>Bath and Spa>Soaps,210.0,171.0,190.0,true,SOPEDZ2EFHKDYQMD,SOPEDZ2EFHKDYQMD
Flipkart,,Likas Papaya Soap Papaya Skin Whitening Soap(135 g),Likas papaya skin whitening soap With Herbal Soap,Likas Papaya Soap,http://dl.flipkart.com/dl/likas-papaya-soap-skin-whitening/p/itmeeqb8vg8n6ghr?pid=SOPEEZYGKFGGGQP8&affid=siddarthk,http://img.fkcdn.com/image/soap/q/p/8/likas-135-papaya-skin-whitening-soap-200x200-imaeeh9fha9arjpc.jpeg,Health and Beauty>Bath and Spa>Soaps,1500.0,275.0,275.0,true,SOPEEZYGKFGGGQP8,SOPEEZYGKFGGGQP8
Flipkart,,Sirona SIRSP24 Sweat Pads,"""SIRONA's Premium Under Arm Sweat Pads : ‘ANTI STAIN: SWEAT PADS’ We all sweat. However, for those who sweat excessively, you now have Sirona’s ‘Anti Stain : Sweat Pads’ to become your new best friend. With our easy to use, disposable pads you don’t need to worry about stains & embarrassment. Just put Sirona’s ‘Anti Stain: Sweat Pads’ on the inside of garment and forget sweat stains. These are simple to use garment liners and come with a self adhesive glue. These are suitable for all garments & can be used by both males & females. HOW TO USE :1: Peel off the sticker sheet from each pad.2: Inverse your top wear & paste the pad on the area where the sleeve is attached to the shoulder. (The area that covers your under-arm).3: Enjoy a stain & odor free day.DISCLAIMER :Our pads have good sweat holding capacity; however in case of excessive sweat please change the pad twice or as per need or discontinue. Though the glue/adhesive goes away after wash, we shall not be liable for any residual/subsequent damage.""",Sirona,http://dl.flipkart.com/dl/sirona-sirsp24-sweat-pads/p/itmeekdbznmnv9cj?pid=SWEEEKDBZHVKJFAP&affid=siddarthk,http://img.fkcdn.com/image/sweat-pad/f/a/p/sirsp24-sirona-200x200-imaeegvpkz5puzbg.jpeg,Health and Beauty>Body and Skin Care>Body Care>Sweat Pads,445.0,311.0,445.0,true,SWEEEKDBZHVKJFAP,SWEEEKDBZHVKJFAP
Flipkart,,Natures Essence AHA Serum(125 ml),The specially developed Alpha Hydroxy Acid serum; Lightens the dark marks and spots on the skin. The acidic nature peel the epidermal layer of its dead cells.,Natures Essence,http://dl.flipkart.com/dl/natures-essence-aha-serum/p/itmee2gjxjhsgek8?pid=FCTEE2GJZPMKKVTG&affid=siddarthk,http://img.fkcdn.com/image/face-treatment/v/t/g/natures-essence-125-aha-serum-200x200-imaedkhd2njt6k8y.jpeg,Health and Beauty>Body and Skin Care>Face Care>Face Treatments,150.0,150.0,150.0,false,FCTEE2GJZPMKKVTG,FCTEE2GJZPMKKVTG
Flipkart,,Avon Nutraeffects Hydration Daily Cream SPF 15 (50g) + Gel Light Cream (50g)(100 g),"Nutraeffects Hydration Daily Cream SPF15 :• Deep skin hydration and nourishment all day instantly• In 1 week leaves skin looking & feeling plump and bouncy Nutraeffects Hydration Gel Light Cream :• Skin instantly feels replenished, supple and smooth • Lightweight, gives healthy glowing complexion without greasy, shiny look",Avon,http://dl.flipkart.com/dl/avon-nutraeffects-hydration-daily-cream-spf-15-50g-gel-light/p/itmeezppm5wdnaqr?pid=MSCEEZPPCUFUA32Y&affid=siddarthk,http://img.fkcdn.com/image/moisturizer-cream/3/2/y/avon-100-nutraeffects-hydration-daily-cream-spf-15-50g-gel-light-200x200-imaeezdc9r42hkfj.jpeg,Health and Beauty>Mens Grooming>Body and Skin Care>Moisturizers and Creams,1058.0,890.0,890.0,true,MSCEEZPPCUFUA32Y,MSCEEZPPCUFUA32Y
Flipkart,,Lomani Fancy Eau de Toilette  -  100 ml(For Women),"""A cheerful and impetuous fragrance which opens on fruity notes associated with an iris agreement.The heart, itself builds around iris notes, reveals trail of jasmine, orange blossom and the so precious Centifolia rose.Finally, the oriental dry out notes is widely dominated by greedy notes created with vanilla, the Tonka bean and the patchouli.""",Lomani,http://dl.flipkart.com/dl/lomani-fancy-eau-de-toilette-100-ml/p/itmee3xeenadzjxm?pid=PEREE3XEMFBZYVWU&affid=siddarthk,http://img.fkcdn.com/image/perfume/v/w/u/eau-de-toilette-lomani-100-fancy-200x200-imaedwy7hubgxtkj.jpeg,Health and Beauty>Fragrances>Perfumes>Eaux De Toilette,1450.0,1050.0,1050.0,false,PEREE3XEMFBZYVWU,PEREE3XEMFBZYVWU
