PartnerName,Id,Title,Description,Brand,Link,ImageLink,CategoryName,Mrp,OfferPrice,EffectivePrice,Availability,PartnerIdFromUrl,PartnerIdFromDb
Flipkart,,Schwarzkopf Professional Taft Hairstyling Gel Foam Ultra Strong Hair Styler,Taft Gelfoam has ultra strong effect for visibly fuller hair. The Power Foam has the hold of a gel and the texture of a mousse. It is easy to apply and is not sticky for a smooth and natural result.,Schwarzkopf Professional,http://dl.flipkart.com/dl/schwarzkopf-professional-taft-hairstyling-gel-foam-ultra-strong-hair-styler/p/itme89d9qghzmfsk?pid=HSYEYFCYZKYNZAG4&affid=siddarthk,http://img.fkcdn.com/image/hair-styling/a/g/4/schwarzkopf-150-taft-hairstyling-gel-foam-ultra-strong-200x200-imaeyfrdeefarfuc.jpeg,Health and Beauty>Hair Care>Hair Styling,899.0,395.0,395.0,true,HSYEYFCYZKYNZAG4,HSYEYFCYZKYNZAG4
Flipkart,,L'Oreal Paris Studio Line Pure Wet Gel 6 Hair Styler,"Your Style, Your Studio Line has defined a generation of hairstyles, the product range designed like a tool box which allows everyone to become their very own stylist.Sculpting, modeling, designing and structuring your hair. Directions1. Take a large dollop of gel and spread through your hands. Apply to damp hair.2. For an overall sleek wet mirrored effect, distribute the gel evenly using the palms of your hands.3. You can also brush your hair forwards with your fingers, concentrating on selected strands.4. For an intense wet effect leave your hair to dry naturally",L'Oreal Paris,http://dl.flipkart.com/dl/l-oreal-paris-studio-line-pure-wet-gel-6-hair-styler/p/itmenh7mfguedpwv?pid=HSYENH7M8CVK6ZPN&affid=siddarthk,http://img.fkcdn.com/image/hair-styling/z/p/n/l-oreal-paris-150-studio-line-pure-wet-gel-6-200x200-imaenggncsnmhjz8.jpeg,Health and Beauty>Hair Care>Hair Styling,1000.0,950.0,950.0,true,HSYENH7M8CVK6ZPN,HSYENH7M8CVK6ZPN
Flipkart,,L'Oreal Paris Studio Line Fix & Style Gel Hair Styler,PRODUCT BENEFITS Lasting invisible hold without stickiness Fix & Style Design Gel is enriched with multi-vitamins that strengthen and add shine to hair. The alcohol-free formula will not dry out hair. INNOVATIONS & INGREDIENTS Enriched with multi-vitamins that strengthen hair. Alcohol-Free • Lasting invisible hold without stickiness • Enriched with multi-vitamins • Strengthen and add shine to hair Lasting invisible hold without stickiness Fix & Style Design Gel is enriched with multi-vitamins that strengthen and add shine to hair. The alcohol-free formula will not dry out hair. • Alcohol-free formula will not dry out hair,L'Oreal Paris,http://dl.flipkart.com/dl/l-oreal-paris-studio-line-fix-style-gel-hair-styler/p/itmenh7mnszm9y8s?pid=HSYENH7M5DDA3WA9&affid=siddarthk,http://img.fkcdn.com/image/hair-styling/w/a/9/l-oreal-paris-150-studio-line-fix-style-gel-200x200-imaenggnqjgdswa7.jpeg,Health and Beauty>Hair Care>Hair Styling,1000.0,850.0,850.0,true,HSYENH7M5DDA3WA9,HSYENH7M5DDA3WA9
Flipkart,,L'Oreal Paris Tecnl ART Metallic Gloss Shine and Definition Wax Hair Styler,,L'Oreal Paris,http://dl.flipkart.com/dl/l-oreal-paris-tecnl-art-metallic-gloss-shine-definition-wax-hair-styler/p/itmek22cxhudcszg?pid=HSYEK22CHHGTNKR5&affid=siddarthk,http://img.fkcdn.com/image/hair-styling/k/r/5/l-oreal-50-tecnl-art-metallic-gloss-shine-and-definition-wax-200x200-imaejs45zxng2zyg.jpeg,Health and Beauty>Hair Care>Hair Styling,575.0,575.0,575.0,true,HSYEK22CHHGTNKR5,HSYEK22CHHGTNKR5
Flipkart,,Nature'S Stylon Extra Hard Gel Hair Styler,"It's your girlfriend's birthday and you were wondering what to do for her to make her birthday memorable. You thought you will throw a party for her at her favourite resort. Everything was all set, now you had to look stunning as you will be noticed as well. To sport a cool image you styled your hair with this Extra Hard Gel Hair Styler from Nature's Essence. Suitable for men, this Nature's Essence Stylon Extra Hard Gel Hair Styler is enriched with aloe vera extracts and neem. Also, aloe vera extracts will add the accurate amount of moisture to your hair. Neem will condition your hair and thoroughly nourish your hair. Besides styling your hair, this natural Nature's Essence Stylon Hair Styler will give you that perfect shine. This Hair styling gel will give you that desired hair do and will hold your hair firm for long. With the presence of the unique formulation in this Extra Hard Gel Hair Styler, you can ensure your hair to be hydrated. You can now get the perfect hairdo with this Gel Hair Styler from Nature's Essence. Directions for Use Take an adequate amount of this Hair Styler onto your palm. Gently apply on your hair and style.",Nature'S,http://dl.flipkart.com/dl/nature-s-stylon-extra-hard-gel-hair-styler/p/itmdatanyuty58vj?pid=HSYDATANRTFUJPJW&affid=siddarthk,http://img.fkcdn.com/image/hair-styling/p/j/w/nature-s-essence-150-stylon-extra-hard-gel-200x200-imadataq2tmyrb3n.jpeg,Health and Beauty>Hair Care>Hair Styling,75.0,75.0,75.0,false,HSYDATANRTFUJPJW,HSYDATANRTFUJPJW
Flipkart,,Schwarzkopf Professional OSiS+ Style Shifters Medium Control for Short to Medium Hair Hair Styler,Wish to have sophisticated poker straight hair or beautiful curly hair? This hair styling spray from Schwarzkopf Professional understands your various moods and allows you to experiment with different hairstyles. Provides Strong Texture This hair styling spray strengthens and uplifts your hair from the root without destroying its structure. It defines your hair to give it a natural feel. Can be Remoulded This hair spray allows you to remould your hair in any form of your choice and it is bound to stay for long. For Men and Women This hair styling spray can be used by both men and women to try out various hairstyles.,Schwarzkopf Professional,http://dl.flipkart.com/dl/schwarzkopf-professional-osis-style-shifters-medium-control-short-hair-styler/p/itmdv8wgujhudghp?pid=HSYDV8T9Z2NAXM9M&affid=siddarthk,http://img.fkcdn.com/image/hair-styling/m/9/m/schwarzkopf-professional-75-osis-style-shifters-medium-control-200x200-imadvggnwzdyzkks.jpeg,Health and Beauty>Hair Care>Hair Styling,950.0,899.0,899.0,false,HSYDV8T9Z2NAXM9M,HSYDV8T9Z2NAXM9M
Flipkart,,Bed Head Matte Separation Wax New Hair Styler,To Make This Product More Pliable In Longer Hair Use The Heat From The Hairdryer To Melt The Surface Of The Wax. Rub Through Hands And Then Dress Through Hair.,Bed Head,http://dl.flipkart.com/dl/bed-head-matte-separation-wax-new-hair-styler/p/itmeejg66jkvbsrk?pid=HSYEEJG6E3XJDGRQ&affid=siddarthk,http://img.fkcdn.com/image/hair-styling/g/r/q/bed-head-86-matte-separation-wax-new-200x200-imaeeg6hcrztbwec.jpeg,Health and Beauty>Hair Care>Hair Styling,1200.0,1049.0,1049.0,true,HSYEEJG6E3XJDGRQ,HSYEEJG6E3XJDGRQ
Flipkart,,Nova Extra Hold Hair Styler,,Nova,http://dl.flipkart.com/dl/nova-extra-hold-hair-styler/p/itmecf9myt4jsrcz?pid=HSYEHHPGEVPZJWYS&affid=siddarthk,http://img.fkcdn.com/image/hair-styling/w/y/s/nova-450-extra-hold-200x200-imaehaghthneqx7y.jpeg,Health and Beauty>Hair Care>Hair Styling,699.0,495.0,495.0,true,HSYEHHPGEVPZJWYS,HSYEHHPGEVPZJWYS
Flipkart,,L'Oreal Paris Elnett Satin Fissaggio Forte Hair Styler,"Elnett Satin hairspray is preferred by hairdressers and is irreplaceable. Fix your hairstyle and protects it from humidity. Straight, curly or volumized, your hair stays in shape by maintaining their natural appearance.",L'Oreal Paris,http://dl.flipkart.com/dl/l-oreal-paris-elnett-satin-fissaggio-forte-hair-styler/p/itmennxe6ghzgv6r?pid=HSYENNXEY7KHX4FQ&affid=siddarthk,http://img.fkcdn.com/image/hair-styling/4/f/q/l-oreal-paris-250-elnett-satin-fissaggio-forte-200x200-imaenmsbkqrq2rgc.jpeg,Health and Beauty>Hair Care>Hair Styling,1000.0,795.0,795.0,true,HSYENNXEY7KHX4FQ,HSYENNXEY7KHX4FQ
Flipkart,,L'Oreal Paris Elnett Satin Liscio Perfetto Hair Spary Hair Styler,"Elnett Satin hairspray is preferred by hairdressers, for a really professional resultFormat: 250 mlFixed hairstyle and protects it from humidity, without pasting or stiffen the hairHair remains fit and retain their natural lookDispenser with micro speakerIt can be removed using a brush strokeIt leaves no residueultra quick drying",L'Oreal Paris,http://dl.flipkart.com/dl/l-oreal-paris-elnett-satin-liscio-perfetto-hair-spary-styler/p/itmenrr68bqvqwgb?pid=HSYENRR6E7BRRP7Y&affid=siddarthk,http://img.fkcdn.com/image/hair-styling/p/7/y/l-oreal-paris-250-elnett-satin-liscio-perfetto-hair-spary-200x200-imaenmsby6t6gphs.jpeg,Health and Beauty>Hair Care>Hair Styling,1000.0,789.0,789.0,true,HSYENRR6E7BRRP7Y,HSYENRR6E7BRRP7Y
Flipkart,,Nova Salon Tested Ultra Hold Styling Mousse Hair Styler,,Nova,http://dl.flipkart.com/dl/nova-salon-tested-ultra-hold-styling-mousse-hair-styler/p/itmehaukp2guravj?pid=HSYEHAUKZRMMBGTF&affid=siddarthk,http://img.fkcdn.com/image/hair-styling/g/t/f/nova-200-salon-tested-ultra-hold-styling-mousse-200x200-imaehaj6ybvaagmf.jpeg,Health and Beauty>Hair Care>Hair Styling,599.0,445.0,445.0,true,HSYEHAUKZRMMBGTF,HSYEHAUKZRMMBGTF
Flipkart,,Schwarzkopf Gliss with Liquid Keratin Ultimate color Conditioner(400 ml),,Schwarzkopf,http://dl.flipkart.com/dl/schwarzkopf-gliss-liquid-keratin-ultimate-color-conditioner/p/itmek3djwxqaxgzf?pid=CNDEK3DJBUMGGR7V&affid=siddarthk,http://img.fkcdn.com/image/conditioner/r/7/v/schwarzkopf-400-gliss-with-liquid-keratin-ultimate-color-200x200-imaek268anq6uncu.jpeg,Health and Beauty>Hair Care>Conditioners,360.0,359.0,359.0,true,CNDEK3DJBUMGGR7V,CNDEK3DJBUMGGR7V
Flipkart,,Schwarzkopf Gliss with Liquid Keratin ultimate repair conditioner(400 ml),"The conditioner makes the hair smooth and shiny, allowing you to brush and style it quite easily.",Schwarzkopf,http://dl.flipkart.com/dl/schwarzkopf-gliss-liquid-keratin-ultimate-repair-conditioner/p/itmek3dgc5fhzfye?pid=CNDEK3DGEQHSUTVG&affid=siddarthk,http://img.fkcdn.com/image/conditioner/t/v/g/schwarzkopf-400-gliss-with-liquid-keratin-ultimate-repair-200x200-imaek25phmyerfgf.jpeg,Health and Beauty>Hair Care>Conditioners,360.0,359.0,359.0,true,CNDEK3DGEQHSUTVG,CNDEK3DGEQHSUTVG
Flipkart,,Goldwell 15804800944 Dual Senses Color Extra Rich Detangling(762 ml),-A superb-rich detangling & color preserving conditioner. -Developed with an innovative Fade Stop Formula & Color Chroma Complex. -Rich in Raspberry Seed Oil to reduce color fading. -Boosts color brilliance & delivers optimal moisture. -Hair appears softer smoother & more manageable. -Perfect for thick to coarse color-treated hair. Product Line: Goldwell - Dual Senses. Product Size: 750ml/25.4oz,Goldwell,http://dl.flipkart.com/dl/goldwell-15804800944-dual-senses-color-extra-rich-detangling/p/itmee2m3eb4a24mw?pid=CNDEE2M3EMMHGSFM&affid=siddarthk,http://img.fkcdn.com/image/conditioner/v/z/q/goldwell-762-15804800944-dual-senses-color-extra-rich-detangling-200x200-imaeebckhs8ychmw.jpeg,Health and Beauty>Hair Care>Conditioners,4014.0,3612.0,4014.0,true,CNDEE2M3EMMHGSFM,CNDEE2M3EMMHGSFM
Flipkart,,Hair One Cleanser and Conditioner With Olive Oil(355 ml),This conditioner cleans with astringent and antibacterial properties. It has no damaging detergents or harsh chemicals. It is formulated with natural herbs and oils. It is sulfate free.,Hair One,http://dl.flipkart.com/dl/hair-one-cleanser-conditioner-olive-oil/p/itmey46myme6hckg?pid=CNDEY46MQUXGH5CX&affid=siddarthk,http://img.fkcdn.com/image/conditioner/5/c/x/hair-one-355-cleanser-and-conditioner-with-olive-oil-200x200-imaey6czyeugsgzw.jpeg,Health and Beauty>Hair Care>Conditioners,2103.0,1797.0,1997.0,true,CNDEY46MQUXGH5CX,CNDEY46MQUXGH5CX
Flipkart,,Klorane Brightening Cream Conditioner(154.8 ml),,Klorane,http://dl.flipkart.com/dl/klorane-brightening-cream-conditioner/p/itmey46nr8agzg9f?pid=CNDEY46NUUEG6XYZ&affid=siddarthk,http://img.fkcdn.com/image/conditioner/x/y/z/klorane-150-brightening-cream-conditioner-200x200-imaey6cz9j5ahztr.jpeg,Health and Beauty>Hair Care>Conditioners,2808.0,1964.0,2183.0,true,CNDEY46NUUEG6XYZ,CNDEY46NUUEG6XYZ
Flipkart,,Fekkai Frederic Hair Technician Color Care (236ml)(240 ml),,Fekkai,http://dl.flipkart.com/dl/fekkai-frederic-hair-technician-color-care-236ml/p/itmee2m3zup7yx6k?pid=CNDEE2M3VNGFDFGF&affid=siddarthk,http://img.fkcdn.com/image/conditioner/f/g/f/fekkai-240-frederic-hair-technician-color-care-236ml-200x200-imaeebcnkg3mghqg.jpeg,Health and Beauty>Hair Care>Conditioners,5013.0,4511.0,5013.0,true,CNDEE2M3VNGFDFGF,CNDEE2M3VNGFDFGF
Flipkart,,Pantene ProV Minute Moisture Masque(302 ml),Pantene's rich 2-Minute Moisture Masque has a specially designed formula that penetrates hair and helps leave hair feeling moisturized for up to 24 hours and protects against styling and heat damage by mimicking hair's natural lipid layer.,Pantene,http://dl.flipkart.com/dl/pantene-prov-minute-moisture-masque/p/itmee2m3gscyzx4n?pid=CNDEE2M3ZXZZR2N6&affid=siddarthk,http://img.fkcdn.com/image/conditioner/g/t/g/pantene-60-prov-minute-moisture-masque-deep-10-200x200-imaeeba7t2utzhwg.jpeg,Health and Beauty>Hair Care>Conditioners,1753.0,1577.0,1753.0,true,CNDEE2M3ZXZZR2N6,CNDEE2M3ZXZZR2N6
Flipkart,,Matrix Fortifying Unisex(125 ml),,Matrix,http://dl.flipkart.com/dl/matrix-fortifying-unisex/p/itmee2m3zsf4qf38?pid=CNDEE2M3GCFAHYM3&affid=siddarthk,http://img.fkcdn.com/image/conditioner/y/m/3/matrix-126-fortifying-unisex-200x200-imaeebchwh52sz7u.jpeg,Health and Beauty>Hair Care>Conditioners,1671.0,1600.0,1600.0,true,CNDEE2M3GCFAHYM3,CNDEE2M3GCFAHYM3
Flipkart,,Nexxus Phyto Organics Enphuse Intensive Reconstructor(1000 ml),,Nexxus,http://dl.flipkart.com/dl/nexxus-phyto-organics-enphuse-intensive-reconstructor/p/itmey27bhzkhydyg?pid=CNDEY27BBZQZT73C&affid=siddarthk,http://img.fkcdn.com/image/conditioner/7/3/c/nexxus-1000-phyto-organics-enphuse-intensive-reconstructor-200x200-imaey2x34t2f92bz.jpeg,Health and Beauty>Hair Care>Conditioners,8467.0,5661.0,6291.0,true,CNDEY27BBZQZT73C,CNDEY27BBZQZT73C
Flipkart,,Aunt Jackie's knot on my watch Instant(180 ml),"Aunt Jackie's Knot On My Watch Instant Detangling Therapy 6oz Have no fear! Your hair has its own personal Super Hero, guarding against tangles, knots and unruly, tresses! With the power of its ""silky slip,"" Knot On My Watch helps the comb glide through hard-to-manage hair, leaving it tangle-free and protected from breakage, while restoring a healthy moisture balance. Use as often as needed on wet or dry hair. Great detangling solution for all hair types and textures. Use it: Apply a generous amount throughout hair, concentrating on areas that are more prone to tangles and knots. Comb through with a wide-tooth comb. Do not pull tangles. Apply more to difficult areas and gently comb in small sections, starting from the bottom of strands, moving upward, until comb glides through hair from roots to ends. Follow with CURL LA LA Defining Curl Custard. INGREDIENTS: Aqua (Water), Propylene Glycol, Butyrospermum Parkii (Shea Butter) Fruit, PEG-150 Distearate, Cetyl Alcohol, Glycine Soja (Soybean) Oil, Glycerin, Parfum (Fragrance), Olea Europaea (Olive) Fruit Oil, PPG-1 Trideceth-6, Cyclopentasiloxane, Phenyl Trimethicone, Lanolin Oil, Polyquaternium-37, Propylene Glycol Dicaprylate/Dicaprate, Acrylamidopropyltrimonium Chloride/Acrylamide Copolymer, Glyceryl Stearate, PEG-100 Stearate, Stearalkonium Chloride, Theobroma Cacao (Cocoa) Seed Butter, Hydrogenated Vegetable Oil, d-Limonene, Hexyl cinnamic aldehyde, Linalool, Amyl cinnamic aldehyde, Lilial,Benzyl alcohol, Citronellol, Hydroxycitronellal, Cinnamic alcohol, 5-chloro-2-methyl-4-isothiazolin-3-one, 2-Methyl-4-isothiazolin-3-one, CI 17200 (Red 33), CI 19140 (Yellow)",Aunt Jackie's,http://dl.flipkart.com/dl/aunt-jackie-s-knot-my-watch-instant/p/itmee2m3fnywmba8?pid=CNDEE2M3WF5G7MFH&affid=siddarthk,http://img.fkcdn.com/image/conditioner/a/g/a/aunt-jackie-s-180-knot-on-my-watch-instant-detangling-therapy-200x200-imaeeba6eshvazqz.jpeg,Health and Beauty>Hair Care>Conditioners,2436.0,2034.0,2261.0,true,CNDEE2M3WF5G7MFH,CNDEE2M3WF5G7MFH
Flipkart,,Rene Furterer Karite Intense Nourishing Conditioning Cream(100 ml),,Rene Furterer,http://dl.flipkart.com/dl/rene-furterer-karite-intense-nourishing-conditioning-cream/p/itmdbgkmehtgw8gk?pid=CNDDBGKMGYN3YSXA&affid=siddarthk,http://img.fkcdn.com/image/conditioner/s/x/a/rene-furterer-100-karite-intense-nourishing-conditioning-cream-200x200-imadbgkzhh9gy2en.jpeg,Health and Beauty>Hair Care>Conditioners,5634.0,2100.0,2100.0,true,CNDDBGKMGYN3YSXA,CNDDBGKMGYN3YSXA
Flipkart,,Kiss My Face Whenever Organic Conditioner-Pack of 3(325 ml),,Kiss My Face,http://dl.flipkart.com/dl/kiss-my-face-whenever-organic-conditioner-pack-3/p/itmey46n4nn7jmhk?pid=CNDEY46NWDFFV6DU&affid=siddarthk,http://img.fkcdn.com/image/conditioner/6/d/u/kiss-my-face-325-whenever-organic-conditioner-pack-of-3-200x200-imaey6czwkxae2fm.jpeg,Health and Beauty>Hair Care>Conditioners,3743.0,3279.0,3644.0,true,CNDEY46NWDFFV6DU,CNDEY46NWDFFV6DU
Flipkart,,Black Earth Taliah Waajid Protective Mist Bodifier ../237 ml.(240 ml),,Black Earth,http://dl.flipkart.com/dl/black-earth-taliah-waajid-protective-mist-bodifier-237-ml/p/itmee2m3sab6crdz?pid=CNDEE2M3TZZJHN3K&affid=siddarthk,http://img.fkcdn.com/image/conditioner/n/3/k/black-earth-240-taliah-waajid-protective-mist-bodifier-237-ml-200x200-imaeebcnwqxtwzdx.jpeg,Health and Beauty>Hair Care>Conditioners,2059.0,1853.0,2059.0,true,CNDEE2M3TZZJHN3K,CNDEE2M3TZZJHN3K
Flipkart,,Suave Professionals Body Sea Mineral Infusion Moisturizing(840 ml),,Suave,http://dl.flipkart.com/dl/suave-professionals-body-sea-mineral-infusion-moisturizing/p/itmee2m3nkhakhwr?pid=CNDEE2M3ZH9KFTRN&affid=siddarthk,http://img.fkcdn.com/image/conditioner/t/r/n/suave-840-professionals-body-sea-mineral-infusion-moisturizing-200x200-imaeebcz7zvjsg8s.jpeg,Health and Beauty>Hair Care>Conditioners,2558.0,2302.0,2558.0,true,CNDEE2M3ZH9KFTRN,CNDEE2M3ZH9KFTRN
Flipkart,,Organix Renewing Moroccan Argan Oil Salon Size (Pack of 4)(762 ml),,Organix,http://dl.flipkart.com/dl/organix-renewing-moroccan-argan-oil-salon-size-pack-4/p/itmee2m3mebpzkgx?pid=CNDEE2M3VYZGM9M4&affid=siddarthk,http://img.fkcdn.com/image/conditioner/9/m/4/organix-762-renewing-moroccan-argan-oil-salon-size-pack-of-4-200x200-imaeeba6wzhjmzep.jpeg,Health and Beauty>Hair Care>Conditioners,11221.0,10098.0,11221.0,true,CNDEE2M3VYZGM9M4,CNDEE2M3VYZGM9M4
Flipkart,,Pantene ProV Expert Collection Fade Defy Vibrant Color(250 ml),,Pantene,http://dl.flipkart.com/dl/pantene-prov-expert-collection-fade-defy-vibrant-color/p/itmee2m3rn5fjs98?pid=CNDEE2M3AYGZXVH3&affid=siddarthk,http://img.fkcdn.com/image/conditioner/v/h/3/pantene-252-prov-expert-collection-fade-defy-vibrant-color-200x200-imaeeba4a8xemrcm.jpeg,Health and Beauty>Hair Care>Conditioners,1397.0,1084.0,1205.0,true,CNDEE2M3AYGZXVH3,CNDEE2M3AYGZXVH3
Flipkart,,Schwarzkopf Professional Blond Me Crystal Developer 9%(1000 ml),What is this product? You must use both the CRYSTAL Bleach and Developer in order to achieve a transparent formula which makes the bleaching process directly visible for absolute convenience and control - For Supreme Blonde Hair Quality. What else you need to know: Crystal clear formula with a gel-like consistency.,Schwarzkopf Professional,http://dl.flipkart.com/dl/schwarzkopf-professional-blond-me-crystal-developer-9/p/itmeg9fpbeyhyykp?pid=CNDEG9FPZV88UV3R&affid=siddarthk,http://img.fkcdn.com/image/conditioner/v/3/r/schwarzkopf-professional-1000-blond-me-crystal-developer-9-200x200-imaegac8em3y7jan.jpeg,Health and Beauty>Hair Care>Conditioners,3762.0,3385.0,3762.0,true,CNDEG9FPZV88UV3R,CNDEG9FPZV88UV3R
Flipkart,,L'anza Lanza Healing Remedy Scalp Balancing(250 ml),,L'anza,http://dl.flipkart.com/dl/l-anza-lanza-healing-remedy-scalp-balancing/p/itmee2m3wkeycgak?pid=CNDEE2M3EQAPCEX9&affid=siddarthk,http://img.fkcdn.com/image/conditioner/e/x/9/l-anza-255-lanza-healing-remedy-scalp-balancing-200x200-imaeeba4hzf7f6eg.jpeg,Health and Beauty>Hair Care>Conditioners,3790.0,3411.0,3790.0,true,CNDEE2M3EQAPCEX9,CNDEE2M3EQAPCEX9
Flipkart,,Monkey Business Monkey Brains Super Softy(340 ml),,Monkey Business,http://dl.flipkart.com/dl/monkey-business-brains-super-softy/p/itmee2m3pduwdm6e?pid=CNDEE2M3HJ2CXEM9&affid=siddarthk,http://img.fkcdn.com/image/conditioner/e/m/9/monkey-business-345-monkey-brains-super-softy-200x200-imaeebch2mnqwn7f.jpeg,Health and Beauty>Hair Care>Conditioners,2457.0,2211.0,2457.0,true,CNDEE2M3HJ2CXEM9,CNDEE2M3HJ2CXEM9
Flipkart,,Jane Cosmetics Jane Carter Nutrient Replenishing(360 ml),,Jane Cosmetics,http://dl.flipkart.com/dl/jane-cosmetics-carter-nutrient-replenishing/p/itmee2m38prvz5js?pid=CNDEE2M3ADUSEQ6C&affid=siddarthk,http://img.fkcdn.com/image/conditioner/q/6/c/jane-cosmetics-360-jane-carter-nutrient-replenishing-200x200-imaeeba4bxks9szn.jpeg,Health and Beauty>Hair Care>Conditioners,3795.0,3415.0,3795.0,true,CNDEE2M3ADUSEQ6C,CNDEE2M3ADUSEQ6C
Flipkart,,Suave Infusion Deep Conditioning Shine Mask(240 ml),"Suave Professionals Moroccan Infusion Deep Conditioning Shine Mask, infused with authentic Moroccan argan oil, helps improve your hair's texture, intensely moisturizing your hair to make it both soft to the touch and noticeably shiny. Suave Professionals Moroccan Infusion Deep Conditioning Shine Hair Mask is proven to add shine to your hair as well as a salon brand, leaving your hair touchably soft with enviable shine.",Suave,http://dl.flipkart.com/dl/suave-infusion-deep-conditioning-shine-mask/p/itmee2m36b2t4qmt?pid=CNDEE2M3EZZYHGGV&affid=siddarthk,http://img.fkcdn.com/image/conditioner/7/h/j/suave-240-professionals-moroccan-infusion-deep-conditioning-200x200-imaeeba4zfq7bc89.jpeg,Health and Beauty>Hair Care>Conditioners,1783.0,1399.0,1555.0,true,CNDEE2M3EZZYHGGV,CNDEE2M3EZZYHGGV
Flipkart,,Paul Mitchell Color Protect Conditioner(1000 ml),It detangles and repairs instantly detangles and smoothes while vegetable proteins amino acids and panthenol strengthen and moisturize colour treated hair. Sunflower extract protects the structure of the hair provides uva and uvb protection and helps prevent hair color fade. Moisturizes and adds shine a powerful combination of conditioning agents and extracts provides ample moisture and intensified shine.,Paul Mitchell,http://dl.flipkart.com/dl/paul-mitchell-color-protect-conditioner/p/itmey8s3jhezapyu?pid=CNDEY8S3BM6VBZNC&affid=siddarthk,http://img.fkcdn.com/image/conditioner/z/n/c/paul-mitchell-1-color-protect-conditioner-200x200-imaeyam93gdfzuqy.jpeg,Health and Beauty>Hair Care>Conditioners,2901.0,2610.0,2901.0,true,CNDEY8S3BM6VBZNC,CNDEY8S3BM6VBZNC
Flipkart,,Pantene ProV Damage Detox Rebuilding (Product Size May Vary)(720 ml),,Pantene,http://dl.flipkart.com/dl/pantene-prov-damage-detox-rebuilding-product-size-may-vary/p/itmee2m3smmfeaey?pid=CNDEE2M3EGNEAEHJ&affid=siddarthk,http://img.fkcdn.com/image/conditioner/e/h/j/pantene-720-prov-damage-detox-rebuilding-product-size-may-vary-200x200-imaeeba4zgmvzthz.jpeg,Health and Beauty>Hair Care>Conditioners,1470.0,1323.0,1470.0,true,CNDEE2M3EGNEAEHJ,CNDEE2M3EGNEAEHJ
Flipkart,,Gloessentials glo.essentials Intense Replenish HydroNourish(150 ml),,Gloessentials,http://dl.flipkart.com/dl/gloessentials-glo-essentials-intense-replenish-hydronourish/p/itmee2m3mtavjxxb?pid=CNDEE2M3H9YVB9EU&affid=siddarthk,http://img.fkcdn.com/image/conditioner/9/e/u/gloessentials-150-glo-essentials-intense-replenish-hydronourish-200x200-imaeeba5zpjcn3ne.jpeg,Health and Beauty>Hair Care>Conditioners,4796.0,3016.0,3352.0,true,CNDEE2M3H9YVB9EU,CNDEE2M3H9YVB9EU
Flipkart,,Abba Gentle Conditioner(1000 ml),This is a gentle conditioner was launched by the design house of ABBA. It is recommended for normal hair. This contains aloe vera to smooth and heal. Passion Flower provides a balancing aroma therapeut.,Abba,http://dl.flipkart.com/dl/abba-gentle-conditioner/p/itmey46mxkyfghqf?pid=CNDEY46MG8ZXKQFY&affid=siddarthk,http://img.fkcdn.com/image/conditioner/q/f/y/abba-1-gentle-conditioner-200x200-imaey6czsdqb5tnp.jpeg,Health and Beauty>Hair Care>Conditioners,5809.0,4317.0,4797.0,true,CNDEY46MG8ZXKQFY,CNDEY46MG8ZXKQFY
Flipkart,,Abba Recovery Intense(1000 ml),"An intense treatment conditioner to repair weak, fragile hair Formulated with Lavender & Mint to relieve & condition hair Offers pacifying aroma-therapeutic benefit Unveils stronger & healthier hair Free of sulfate, DEA & synthetic dyes To use: Apply evenly from scalp to hair ends. Leave on for 2 - 5 minutes, rinse well. Recommended to use bi-weekly or more constant for best results",Abba,http://dl.flipkart.com/dl/abba-recovery-intense/p/itmee2m36zzzhz3y?pid=CNDEE2M3MPFSZ8W7&affid=siddarthk,http://img.fkcdn.com/image/conditioner/f/y/x/abba-1014-recovery-intense-treatment-for-weak-or-damaged-hair-200x200-imaeeba5fugzrhaz.jpeg,Health and Beauty>Hair Care>Conditioners,4441.0,3996.0,4441.0,true,CNDEE2M3MPFSZ8W7,CNDEE2M3MPFSZ8W7
Flipkart,,Vidal Sassoon Colorfinity Cleansing(500 ml),,Vidal Sassoon,http://dl.flipkart.com/dl/vidal-sassoon-colorfinity-cleansing/p/itmee2m36zzvxvux?pid=CNDEE2M3GE669HGQ&affid=siddarthk,http://img.fkcdn.com/image/conditioner/h/g/q/vidal-sassoon-507-colorfinity-cleansing-200x200-imaeebchb2xg2gfw.jpeg,Health and Beauty>Hair Care>Conditioners,1961.0,1764.0,1961.0,true,CNDEE2M3GE669HGQ,CNDEE2M3GE669HGQ
Flipkart,,Sudzz FX Reconstruct For Severely Damaged Hair(1000 ml),"MoxeeTM Reconstructing Conditioner provides nourishment and restore weak, lifeless, critically damaged hair. It rebuilds, revitalizes and restores offering instantaneously renewed, stronger hair.",Sudzz FX,http://dl.flipkart.com/dl/sudzz-fx-reconstruct-severely-damaged-hair/p/itmee2m3qnjdz2yq?pid=CNDEE2M3GWEWJHHF&affid=siddarthk,http://img.fkcdn.com/image/conditioner/3/m/e/sudzz-fx-1014-sudzz-fx-moxee-reconstruct-for-severely-damaged-200x200-imaeeba5jkm4jgnb.jpeg,Health and Beauty>Hair Care>Conditioners,7652.0,6800.0,7556.0,true,CNDEE2M3GWEWJHHF,CNDEE2M3GWEWJHHF
