PartnerName,Id,Title,Description,Brand,Link,ImageLink,CategoryName,Mrp,OfferPrice,EffectivePrice,Availability,PartnerIdFromUrl,PartnerIdFromDb
Flipkart,,St.ives Replenishing Mineral Therapy body lotion(621 ml),St.ives Replenishing Mineral Therapy body lotion 621 mL Replenishes nutrients and delivers maximum moisture,St.ives,http://dl.flipkart.com/dl/st-ives-replenishing-mineral-therapy-body-lotion/p/itmegg74yxcfmvfy?pid=MSCEGG74QHYAGS68&affid=siddarthk,http://img.fkcdn.com/image/moisturizer-cream/q/d/h/st-ives-621-replenishing-mineral-therapy-body-lotion-pack-of-2-200x200-imaegbgygpqw2bvy.jpeg,Health and Beauty>Mens Grooming>Body and Skin Care>Moisturizers and Creams,2590.0,899.0,899.0,true,MSCEGG74QHYAGS68,MSCEGG74QHYAGS68
Flipkart,,Xtreme Brite White Rediance,"Xtreme Brite Brightening Gel 1ozImportant InformationIngredientsGel- Water, Propylene Glycol, Licorice Extract, Salicylic Acid, Glycyrrhetinic Acid, Arbutus Unedo Extract, Ailanthus Altissima Extract, Carbomer, Triethanolamine, Titanium Dioxide, Retinyl Propionate,M Niacinamide, Glycolic Acid, Allantoin Ascorbic Acid, Citric Acid, Dmdm Hydantoin, Methylparaben, Fragrance. Soap- Sodium Tallowate, Sodium Cocoate, Water, Fragrance, Glycerin, Polyethylene, Wheat Bran, Benzalkonium Chloride, Sodium Chloride, Sodium Hydroxide, Tetrasodium Editronat, Tetrasodium Edta, O-Tolyl Biguanide, Titanium Dioxide, Red No 33",Xtreme Brite,http://dl.flipkart.com/dl/xtreme-brite-white-rediance/p/itme7aygp3cwjygj?pid=MSCE7AYGPYFWXHAP&affid=siddarthk,http://img.fkcdn.com/image/moisturizer-cream/h/a/p/xtreme-brite-30-white-rediance-200x200-imae77kmymad9yhj.jpeg,Health and Beauty,3676.0,2999.0,2999.0,true,MSCE7AYGPYFWXHAP,MSCE7AYGPYFWXHAP
Flipkart,,Neutrogena Healthy Skin Anti-Wrinkle Cream With Sunscreen Spf 15(40 g),"Neutrogena Healthy Skin Anti-Wrinkle Cream SPF 15 is the dermatologist recommended Retinol anti-wrinkle cream. It's clinically proven to both treat and help prevent fine lines, wrinkles and other signs of aging. This patented formula contains Retinol, Vitamin A in its purest form, to work deep within skin's surface where wrinkles develop. A combination of Pro-Vitamin B5, Vitamin E and special moisturizers work with skin's natural mechanisms to even out skin tone and build moisture levels. SPF 15 sunscreen protects the skin from sun's burning rays. Lightweight and non-greasy, it absorbs quickly into skin.",Neutrogena,http://dl.flipkart.com/dl/neutrogena-healthy-skin-anti-wrinkle-cream-sunscreen-spf-15/p/itme6krtzuqsxxgn?pid=MSCE6KRTURSZRAVF&affid=siddarthk,http://img.fkcdn.com/image/moisturizer-cream/a/v/f/neutrogena-40-healthy-skin-anti-wrinkle-cream-with-sunscreen-spf-200x200-imae6kahyjffjuer.jpeg,Health and Beauty>Body and Skin Care>Face Care>Moisturizers and Creams,2000.0,2000.0,2000.0,true,MSCE6KRTURSZRAVF,MSCE6KRTURSZRAVF
Flipkart,,Neutrogena Men Age Fighter Face Moisturizer(40 g),"This daily moisturizer is formulated with Retinol—a pure form of Vitamin A— well known among dermatologists for its ability to help diminish the look if lines and wrinkles. This formula contains a boost of conditioning Multi-Vitamins and non-greasy moisturizers that immediately smooth rough, dry skin. SPF 15 sunscreen helps prevent sunburn.",Neutrogena,http://dl.flipkart.com/dl/neutrogena-men-age-fighter-face-moisturizer/p/itme7fryyj57qvzh?pid=MSCE7FRYVCGGX9KN&affid=siddarthk,http://img.fkcdn.com/image/moisturizer-cream/9/k/n/neutrogena-40-men-age-fighter-face-moisturizer-200x200-imae7fgstsqyzxfz.jpeg,Health and Beauty>Mens Grooming>Body and Skin Care>Moisturizers and Creams,2338.0,1999.0,1999.0,true,MSCE7FRYVCGGX9KN,MSCE7FRYVCGGX9KN
Flipkart,,Grace Cole Passion Fruit & Guava,"Keep skin soft and velvety smooth with this nourishing lotion. Enriched with a thirst quenching cocktail of fruity actives, it will pamper the body and leave it revived. Delicately scented with an intoxicating blend of exotic fruit that’s complemented with notes of orange, apple and guava. - See more at: https://www.gracecole.co.uk/index.php/bath-body/body-lotions-creams/body-lotion-448.html#sthash.TbVC1Mz5.dpuf",Grace Cole,http://dl.flipkart.com/dl/grace-cole-passion-fruit-guava/p/itme8gdhkfcqffuf?pid=MSCEEGSZDBWZTRQ7&affid=siddarthk,http://img.fkcdn.com/image/moisturizer-cream/r/q/7/grace-cole-500-passion-fruit-guava-200x200-imaeedgfhrpcftgz.jpeg,Health and Beauty,995.0,750.0,750.0,false,MSCEEGSZDBWZTRQ7,MSCEEGSZDBWZTRQ7
Flipkart,,L'Oreal Paris Youth Code Youth Boosting Night Cream,"Mature skin and young skin behave differently when exposed to external aggressions. As you age, skin takes longer to recover and responds more slowly. L'Oreal Paris introduces new Youth Code Night Recovery Cream, inspired by gene science. The luxurious yet easily absorbed texture melts into the skin, and helps recover hydration and leaves skin looking rested. Enriched with patented Pro-Gen® Technology. Applied daily, the moisturising formula helps improve the skin's ability to behave more youthfully.",L'Oreal Paris,http://dl.flipkart.com/dl/l-oreal-paris-youth-code-boosting-night-cream/p/itmee4vvmjs5azev?pid=MSCEE4VVH4N2GNVG&affid=siddarthk,http://img.fkcdn.com/image/moisturizer-cream/n/v/g/l-oreal-50-youth-code-youth-boosting-night-cream-200x200-imaee4g4j7nenbn2.jpeg,Health and Beauty,1350.0,1350.0,1350.0,false,MSCEE4VVH4N2GNVG,MSCEE4VVH4N2GNVG
Flipkart,,Grace Cole Watermelon & Pink Grapefruit(235 g),Natural & CaringMade in England. Paraben free.Content – 250ml Our fabulously fruity Body Butter absorbs quickly without leaving an oily residue. This seriously hydrating cream will leave your skin soft and delicately scented with a sparkling citrus accord of juicy pink grapefruit.,Grace Cole,http://dl.flipkart.com/dl/grace-cole-watermelon-pink-grapefruit/p/itme7veyg96ywzrb?pid=MSCE8GDHKCMGQYF2&affid=siddarthk,http://img.fkcdn.com/image/moisturizer-cream/y/f/2/grace-cole-235-watermelon-pink-grapefruit-200x200-imae5z7ncdakyfga.jpeg,Health and Beauty>Mens Grooming>Body and Skin Care>Moisturizers and Creams,995.0,780.0,780.0,false,MSCE8GDHKCMGQYF2,MSCE8GDHKCMGQYF2
Flipkart,,L'Oreal Paris Paris UV Perfect Aqua Essence City Face Lotion(64 g),"The 1st advanced city face mist from L'Oreal Paris in a refreshing flash dry watery texture. It provides a broader protection from UVB, UVA and harmful long UVA that cause visibile damages. Visible Results: Immediately skin is protected against signs of photo-aging : brown spots, darkening, loss of elasticity, wrinkles and external stress. Day after day, skin stays visibility fair and young. Non sticky, non greasy, easy application, even on top of make-up.",L'Oreal Paris,http://dl.flipkart.com/dl/l-oreal-paris-uv-perfect-aqua-essence-city-face-lotion/p/itmee4vtbebpgzra?pid=MSCEE4VTGBQH2Z7D&affid=siddarthk,http://img.fkcdn.com/image/moisturizer-cream/z/7/d/l-oreal-64-paris-uv-perfect-aqua-essence-city-face-lotion-200x200-imaee4g4fqnwb8cn.jpeg,Health and Beauty>Body and Skin Care>Body Care>Moisturizers and Creams,995.0,869.0,869.0,true,MSCEE4VTGBQH2Z7D,MSCEE4VTGBQH2Z7D
Flipkart,,Johnsons Shea & Cocoa Butter Oil Gel,"Clinically Proven®MildnessLocks in up to 10 times more moistureJohnson's® Baby Oil Gel with Cocoa Butter provides all the benefits of Johnson's® Baby Oil in a concentrated gel form for long-lasting, miniaturization. It contains Cocoa Butter, known for its skin nourishing properties. Johnson's® Baby Oil Gel locks in up to 10 times more moisture on wet skin than an ordinary lotion can on dry skin",Johnsons,http://dl.flipkart.com/dl/johnsons-shea-cocoa-butter-oil-gel/p/itmect3mszgzjdqz?pid=MSCECT3MGSSVZHBY&affid=siddarthk,http://img.fkcdn.com/image/moisturizer-cream/h/b/y/johnson-s-192-shea-cocoa-butter-oil-gel-200x200-imaecszbvg5gqfyq.jpeg,Health and Beauty>Mens Grooming>Body and Skin Care>Moisturizers and Creams,950.0,850.0,850.0,false,MSCECT3MGSSVZHBY,MSCECT3MGSSVZHBY
Flipkart,,L'Oreal Paris Paris UV Perfect Even Complexion Lotion(30 ml),"Every day our skin undergoes many external aggressions like pollution, harmful UV rays, dust, rough weather, salt water, etc, which makes skin dull and dark spots and premature ageing occurs. To fight all problems? there is one great solution that is found by L’Oreal laboratories UV Perfect SPF 50 PA+++ – Even Complexion.",L'Oreal Paris,http://dl.flipkart.com/dl/l-oreal-paris-uv-perfect-even-complexion-lotion/p/itmee4vt8ebz2zhy?pid=MSCEE4VTZ9ZCPEXK&affid=siddarthk,http://img.fkcdn.com/image/moisturizer-cream/e/x/k/l-oreal-30-paris-uv-perfect-even-complexion-lotion-200x200-imaee4g4cwyrvryj.jpeg,Health and Beauty,699.0,699.0,699.0,false,MSCEE4VTZ9ZCPEXK,MSCEE4VTZ9ZCPEXK
Flipkart,,L'Oreal Paris Paris White Perfect Laser Anti-Spot Brightening essence Serum(30 ml),"Its anti-spot brightening essence contains ellagic acid, found naturally occurring in plants which controls melanin production and transfer.",L'Oreal Paris,http://dl.flipkart.com/dl/l-oreal-paris-white-perfect-laser-anti-spot-brightening-essence-serum/p/itmee4vwasrnxkwr?pid=MSCEE4VWHQNE8N2G&affid=siddarthk,http://img.fkcdn.com/image/moisturizer-cream/n/2/g/l-oreal-30-paris-white-perfect-laser-anti-spot-brightening-200x200-imaee4g4csprxzvy.jpeg,Health and Beauty,1800.0,1800.0,1800.0,false,MSCEE4VWHQNE8N2G,MSCEE4VWHQNE8N2G
Flipkart,,L'Oreal Paris Paris Youth Code Eye Cream(15 ml),"Discover an innovation inspired by gene science. The breakthrough GenActiv Technology in this potent daily eye cream boosts skin's natural powers of regeneration so it regains the qualities of young skin - skin looks rested, smoother and youthfully luminous. A unique metal-tip applicator cools as it de-puffs under-eye bags. Light diffusing micro-pearls illuminate dark circles.",L'Oreal Paris,http://dl.flipkart.com/dl/l-oreal-paris-youth-code-eye-cream/p/itmee4vwmghvjprw?pid=MSCEE4VW6AR8CKHC&affid=siddarthk,http://img.fkcdn.com/image/moisturizer-cream/k/h/c/l-oreal-15-paris-youth-code-eye-cream-200x200-imaee4g4eqec23ru.jpeg,Health and Beauty,1250.0,1250.0,1250.0,false,MSCEE4VW6AR8CKHC,MSCEE4VW6AR8CKHC
Flipkart,,L'Oreal Paris Paris White Perfect Night Cream(50 ml),"A perfect solution for softer smoother skin which appears more luminous and rosy with every use. Spots are visibily reduced to reveal glowing brighter skin! - Vitamin E protects against free radicals and reinforces the skin, - Protects and repairs skin during the night leaving it soft, supple and hydrated, - Night after night, skin is visibly fairer, more even and has a healthy glow",L'Oreal Paris,http://dl.flipkart.com/dl/l-oreal-paris-white-perfect-night-cream/p/itmee4vwcuyzvbgt?pid=MSCEE4VWDZRZDTUA&affid=siddarthk,http://img.fkcdn.com/image/moisturizer-cream/t/u/a/l-oreal-50-paris-white-perfect-night-cream-200x200-imaee4g4eqzhs2hf.jpeg,Health and Beauty,899.0,899.0,899.0,false,MSCEE4VWDZRZDTUA,MSCEE4VWDZRZDTUA
Flipkart,,L'Oreal Paris Paris Youth Code Boosting Cream(50 ml),"Youth Code Rejuvenating Anti-Wrinkle Day Cream leaves your skin hydrated, smoother and more radiant. Skin behaves more youthfully luminosity is improved and facial features appear rested. The moisturising formula is enriched with our patented Pro-Gen technology.Enriched with patented Pro-Gen Technology. Applied daily, the moisturising formula helps improve the skin's ability to behave more youthfully.",L'Oreal Paris,http://dl.flipkart.com/dl/l-oreal-paris-youth-code-boosting-cream/p/itmee4vw5ggx6eyf?pid=MSCEE4VWBBZZGYCH&affid=siddarthk,http://img.fkcdn.com/image/moisturizer-cream/y/c/h/l-oreal-50-paris-youth-code-boosting-cream-200x200-imaee4g45tmgtmzg.jpeg,Health and Beauty>Body and Skin Care>Body Care>Moisturizers and Creams,1450.0,1098.0,1098.0,true,MSCEE4VWBBZZGYCH,MSCEE4VWBBZZGYCH
Flipkart,,L'Oreal Paris Paris Revitalift Day Cream(50 ml),"The elastin fibres represent less than 5% of the fibres in the skin, yet they are essential to its elasticity. At 35, the elastin fibres decrease in number and their network fragments. The skin becomes less firm and less elastic, wrinkles begin to mark.",L'Oreal Paris,http://dl.flipkart.com/dl/l-oreal-paris-revitalift-day-cream/p/itmee4vtmgxrcfad?pid=MSCEE4VTCCZCJCGQ&affid=siddarthk,http://img.fkcdn.com/image/moisturizer-cream/c/g/q/l-oreal-50-paris-revitalift-day-cream-200x200-imaee4g4jwyywzkj.jpeg,Health and Beauty,995.0,995.0,995.0,false,MSCEE4VTCCZCJCGQ,MSCEE4VTCCZCJCGQ
Flipkart,,The Body Shop Frosted Cranberry(192 g),,The Body Shop,http://dl.flipkart.com/dl/body-shop-frosted-cranberry/p/itme4g73fg4gypwf?pid=MSCE4G73XHTTCX7K&affid=siddarthk,http://img.fkcdn.com/image/moisturizer-cream/x/7/k/the-body-shop-192-frosted-cranberry-200x200-imae4ghyfsfgqkxd.jpeg,Health and Beauty,1295.0,1295.0,1295.0,false,MSCE4G73XHTTCX7K,MSCE4G73XHTTCX7K
Flipkart,,"Vidya Ventures 3 divide round Bangle Box, Jewellery Box Vanity Box",,Vidya Ventures,http://dl.flipkart.com/dl/vidya-ventures-3-divide-round-bangle-box-jewellery-box-vanity/p/itmefax2ex7ju3ua?pid=VANEFAX248EKMKYZ&affid=siddarthk,http://img.fkcdn.com/image/vanity-box/k/y/z/3-divides-vanity-box-vidya-ventures-3-divide-round-200x200-imaef7v8ah3yyf4k.jpeg,Health and Beauty>Makeup>Vanity Boxes,599.0,349.0,349.0,false,VANEFAX248EKMKYZ,VANEFAX248EKMKYZ
Flipkart,,"Vidya Ventures 3 Rod Bangle Box, Jewellery Box Vanity Box",,Vidya Ventures,http://dl.flipkart.com/dl/vidya-ventures-3-rod-bangle-box-jewellery-box-vanity/p/itmef7hjgznstexm?pid=VANEF7HJGGGQXGZH&affid=siddarthk,http://img.fkcdn.com/image/vanity-box/g/z/h/vanity-3-vidya-ventures-3-rod-200x200-imaef6mvzfghzshy.jpeg,Health and Beauty>Makeup>Vanity Boxes,1299.0,699.0,699.0,false,VANEF7HJGGGQXGZH,VANEF7HJGGGQXGZH
Flipkart,,Gift valley Handicraft Elephant Box Makeup Vanity Box(Multicolor),,Gift valley,http://dl.flipkart.com/dl/gift-valley-handicraft-elephant-box-makeup-vanity/p/itmebbwba5da2knb?pid=VANEBBWBPFBZHMRX&affid=siddarthk,http://img.fkcdn.com/image/vanity-box/m/r/x/m400801-11-b-gift-valley-handicraft-elephant-box-200x200-imaebdk4amjzzhfh.jpeg,Health and Beauty>Makeup>Vanity Boxes,2200.0,1299.0,1299.0,true,VANEBBWBPFBZHMRX,VANEBBWBPFBZHMRX
Flipkart,,"Speak Homes 10 Pouch Locker Kit Organizer Vanity Box(Gold, Yellow)","SPEAK Homes 10 Pouch Jewellery Box / Locker Kit is a very attractive jewelery storage box with 10 pouches that can also be used as standalone. Made form High Quality Materials, Each pouch has a separate compartment for itself. the compartments are separated by transparent high grade plastic.Each pouch has a separate compartment for itself. the compartments are separated by transparent high grade plastic. The design print on the outside may vary. (for example instead of leaves like structure, there may be circles or squares). this product is made with Jamavar and coated from outside with plastic. This ensures durability & makes for a long lasting product. We developed this product as an ideal to use in lockers. Over time, customers have used it for travelling, gifting and other purposes.",Speak Homes,http://dl.flipkart.com/dl/speak-homes-10-pouch-locker-kit-organizer-vanity-box/p/itmeedqx7xgfkkyz?pid=VANEEDQXPFZZCFEU&affid=siddarthk,http://img.fkcdn.com/image/vanity-box/f/e/u/005jc-speak-homes-10-pouch-locker-kit-200x200-imaeeccfgdgwsrmf.jpeg,Home Decor>Home Utilities>Utility Boxes,1500.0,699.0,699.0,true,VANEEDQXPFZZCFEU,VANEEDQXPFZZCFEU
Flipkart,,Goldencollections Surf Jewellery Vanity Box,Surf Jewellery Pouch,Goldencollections,http://dl.flipkart.com/dl/goldencollections-surf-jewellery-vanity-box/p/itmef78fs2zmhspz?pid=VANEF78FPW2RKFFY&affid=siddarthk,http://img.fkcdn.com/image/vanity-box/f/f/y/gc-0546-golden-collections-surf-200x200-imaeyzkz9g84fydf.jpeg,Health and Beauty>Makeup>Vanity Boxes,900.0,499.0,499.0,false,VANEF78FPW2RKFFY,VANEF78FPW2RKFFY
Flipkart,,"Vidya Ventures Designer Bangle Box Bangle Box, Jewellery Box Vanity Box(Golden)",,Vidya Ventures,http://dl.flipkart.com/dl/vidya-ventures-designer-bangle-box-box-jewellery-vanity/p/itmef3fgmhyjdrbw?pid=VANEF3FGSP5TZSZH&affid=siddarthk,http://img.fkcdn.com/image/vanity-box/s/z/h/single-rod-vidya-ventures-designer-bangle-box-200x200-imaeewmhzqf7v3uh.jpeg,Health and Beauty>Makeup>Vanity Boxes,699.0,325.0,325.0,true,VANEF3FGSP5TZSZH,VANEF3FGSP5TZSZH
Flipkart,,"Vidya Ventures 3 divide round Bangle Box, Jewellery Box Vanity Box",,Vidya Ventures,http://dl.flipkart.com/dl/vidya-ventures-3-divide-round-bangle-box-jewellery-box-vanity/p/itmefax2hg2xn5zd?pid=VANEFAX2PQEKENYZ&affid=siddarthk,http://img.fkcdn.com/image/vanity-box/n/y/z/vanity-1-vidya-ventures-3-divide-round-200x200-imaef7v3rgfsqssj.jpeg,Health and Beauty>Makeup>Vanity Boxes,699.0,399.0,399.0,false,VANEFAX2PQEKENYZ,VANEFAX2PQEKENYZ
Flipkart,,IndoArtisan Handcrafted Wooden Box Multi purpose uses Vanity Box(Gold),Completely Hand made - Highly Decorated Wooden Box,IndoArtisan,http://dl.flipkart.com/dl/indoartisan-handcrafted-wooden-box-multi-purpose-uses-vanity/p/itmef6gjqazbbggg?pid=VANEF6GJTU74F9PM&affid=siddarthk,http://img.fkcdn.com/image/vanity-box/9/p/m/ina-wb2-indoartisan-handcrafted-wooden-box-200x200-imaefypqhgb8gykw.jpeg,Health and Beauty>Makeup>Vanity Boxes,1350.0,950.0,950.0,true,VANEF6GJTU74F9PM,VANEF6GJTU74F9PM
Flipkart,,Luv Indiya Handmade Soap : Saffron,"Clears complexion & glows the skin. Good for all skin types.Key Ingredients: Wheatgerm Oil, Glycerine, Vegetable Oil & Extracts of Saffron.",Luv Indiya,http://dl.flipkart.com/dl/luv-indiya-handmade-soap-saffron/p/itmdzztvp5825yf4?pid=SOPDZZTVZTG3CZVU&affid=siddarthk,http://img.fkcdn.com/image/soap/s/a/n/luv-indiya-125-handmade-soap-rose-water-200x200-imaeyymdpzrmegza.jpeg,Health and Beauty>Bath and Spa>Soaps,150.0,150.0,150.0,false,SOPDZZTVZTG3CZVU,SOPDZZTVZTG3CZVU
Flipkart,,"Dalan Glycerine Soap 8 Pack Combo of Olive & Almond Oil, from Turkey","Olive oil soap is considered to be the best remedy for dry skin as it helps to exfoliate dead cells and flaky skin. Its moisturizing properties help to soften the skin texture, leaving you with beautiful glowing skin.Olive oil soap helps in reduction of cell deterioration of the skin.Olive oil soap is a great remedy for those suffering from acne problems as it doesn?t clog your pores unlike other skin moisturizers.Olive oil soap has also proven to treat skin rashes. It can also be used to reduce the side effects from sun burns.Olive oil consists of vitamin E, which acts as a great antioxidant. Unlike regular soaps, you can be sure that after using olive oil soap you would not experience dry itchy skin.*******DALAN Glycerine based transparent soap with Almond Oil, rich in Almond fragrance. Almond oil is known for its high vitamin E content; antioxidants; anti-ageing properties; provides relief from acne, pimples, blackheads and whiteheads; and has excellent skin moisturizing properties when used in a soap.Almond oil soap is good for softening the skin by nourishing it with vitamin E and protects our skin from damaging ultraviolet lights.Almond oil soap is rich with antioxidants that are really essential for a healthy skin and to manage the free radicals. Glycerin soap can be a very good cleanser for your face and can help you get rid of the extra oils and dirt that clogs your skin. It is also effective for acne prone skin and helps keep the acne away.Glycerin is a humectant that is capable of drawing moisture towards itself. When you use glycerin on your face, it attracts moisture towards your skin and locks the water molecules there. This keeps your skin hydrated constantly and gives it a moist feeling.Regular use of glycerin soaps can make your skin softer and suppler.",Dalan,http://dl.flipkart.com/dl/dalan-glycerine-soap-8-pack-combo-olive-almond-oil-turkey/p/itmeytuy3y7kjbby?pid=SOPEYTUY97DCHGRT&affid=siddarthk,http://img.fkcdn.com/image/soap/g/r/t/dalan-800-glycerine-soap-8-pack-combo-of-olive-almond-oil-from-200x200-imaeyv5hnxdyjbte.jpeg,Health and Beauty>Bath and Spa>Soaps,440.0,440.0,440.0,true,SOPEYTUY97DCHGRT,SOPEYTUY97DCHGRT
Flipkart,,Vagad's Neem Skin Protecting Bath Soap - Pack of 12,"Neem : Neem Is A Nutural Anti-Biotic And Full Of Freshness To The Skin, Making The Skin Smooth And Tender Neem Marking Marks In The Ayurvedic And Anti-Biotic Element Rests In The Skin And Provides A Security Cycle.",Vagad's,http://dl.flipkart.com/dl/vagad-s-neem-skin-protecting-bath-soap-pack-12/p/itme82yyzghgk2cd?pid=SOPE82YYC7BGGV72&affid=siddarthk,http://img.fkcdn.com/image/soap/v/7/2/vagad-s-200-neem-skin-protecting-bath-soap-pack-of-12-200x200-imae7rtnkn2qfk7x.jpeg,Health and Beauty>Bath and Spa>Soaps,200.0,200.0,200.0,false,SOPE82YYC7BGGV72,SOPE82YYC7BGGV72
Flipkart,,Nature's Thearpy Lemongrass(375 g),"Lemongrass healing & blooming fragrance as an ancient ayurvedic stock herb, lemon grass is naturally peerless as a skin and muscle toner. Also endows your skin with a palpable freshness. Ingredients lemongrass (essential oil), sweet honey, glycerine, castor oil, rose water, soap base (vegetable oils).",Nature's Thearpy,http://dl.flipkart.com/dl/nature-s-thearpy-lemongrass/p/itmedvznmchrhjfr?pid=SOPEDVZNDGWNF7ZE&affid=siddarthk,http://img.fkcdn.com/image/soap/7/z/e/nature-s-thearpy-375-lemongrass-200x200-imaedvqyspqzy4hr.jpeg,Health and Beauty>Bath and Spa>Soaps,360.0,350.0,350.0,true,SOPEDVZNDGWNF7ZE,SOPEDVZNDGWNF7ZE
Flipkart,,Hibiscusherbals Orange - Soap,,Hibiscusherbals,http://dl.flipkart.com/dl/hibiscusherbals-orange-soap/p/itmecu58tzzhnvvg?pid=SOPECU58HCUDBAPN&affid=siddarthk,http://img.fkcdn.com/image/soap/a/p/n/hibiscusherbals-125-orange-soap-200x200-imaecuydhqdjaq7f.jpeg,Health and Beauty>Bath and Spa>Soaps,105.0,88.0,105.0,true,SOPECU58HCUDBAPN,SOPECU58HCUDBAPN
Flipkart,,Lords Homeopathic Lab Pvt. Ltd Glowskin Moisturizing Soap For Dry Skin,,Lords Homeopathic Lab Pvt. Ltd,http://dl.flipkart.com/dl/lords-homeopathic-lab-pvt-ltd-glowskin-moisturizing-soap-dry-skin/p/itme7fgghynqz8cb?pid=SOPE7FGGGFPUWGHJ&affid=siddarthk,http://img.fkcdn.com/image/soap/g/h/j/lords-homoeopathic-lab-pvt-ltd-75-glowskin-moisturizing-soap-for-200x200-imae72dzpz2yfnv5.jpeg,Health and Beauty>Bath and Spa>Soaps,120.0,120.0,120.0,false,SOPE7FGGGFPUWGHJ,SOPE7FGGGFPUWGHJ
Flipkart,,Aster Luxury Orange Handmade Soap - Set of 12(1500 g),Aster Luxury orange bathing bar soap has a refreshing tangy fragrance which soothes the nerves and helps in deodorising body odour and sweat. It is made from natural extracts using fresh and unique ingredients. This bar soap has exfoliating properties that gently remove dirt from the skin. Does not contain any artificial preservatives and is made from natural ingredients that are safe and effective for all skin types. No Paraben. No Phthalates. No Animal Testing. Vegan Ingredients. Usage: Firmly hold the aster handmade bathing bar and run all over the wet body. This soap gives good lather that will clean your whole body. Apply lather all over body before showering off.,Aster Luxury,http://dl.flipkart.com/dl/aster-luxury-orange-handmade-soap-set-12/p/itme6huqk96bearg?pid=SOPE6HUQAWPCTGYQ&affid=siddarthk,http://img.fkcdn.com/image/soap/z/q/s/aster-luxury-125-handmade-orangesoap-125g-200x200-imae7zfdnshe5nja.jpeg,Health and Beauty>Bath and Spa>Soaps,1800.0,1000.0,1000.0,true,SOPE6HUQAWPCTGYQ,SOPE6HUQAWPCTGYQ
Flipkart,,Olay Ultra Moisture with Shea Butter Beauty Bars - 12 total(1080 g),Olay Ultra Moisture with Shea Butter is specially formulated with creamy Olay lather and Shea Butter. Olay Ultra Moisture with Shea Butter goes beyond cleansing delivering Olay deep moisturizers to the skin while helping to wash away dry surface cells.,Olay,http://dl.flipkart.com/dl/olay-ultra-moisture-shea-butter-beauty-bars-12-total/p/itmeezswjx5hvaqj?pid=SOPEEZSWGHZCXYQN&affid=siddarthk,http://img.fkcdn.com/image/soap/y/q/n/olay-80-ultra-moisture-with-shea-butter-beauty-bars-12-total-200x200-imaeezuwt7datzbb.jpeg,Health and Beauty>Bath and Spa>Soaps,4919.0,4427.0,4919.0,true,SOPEEZSWGHZCXYQN,SOPEEZSWGHZCXYQN
Flipkart,,Fair & White Savon Exclusive Whitenizer,"Removes Grime, Dust & Oily Film From SkinLathers Freely, Cleanses Thoroughly & Rinses Off EasiThe Soap rich in plant extracts gently rub your skin to eliminate impurities and dead cells responsible for unblooming complexions. Thanks to the combined action of apricot kernels (exfoliating and regenerating), almond oil (softening and repairing) and pure shea butter, it cleanses, softens and harmonizes your skin day after day. Your skin is lighter and more radiant. Perfectly cleaning your skin is the first step to a nice complexion. To be used in the morning and/or in the evening on your face and body.",Fair & White,http://dl.flipkart.com/dl/fair-white-savon-exclusive-whitenizer/p/itme8ezg3zgkywga?pid=SOPE8EZGBV6HKRHR&affid=siddarthk,http://img.fkcdn.com/image/soap/r/h/r/fair-white-200-savon-exclusive-whitenizer-200x200-imae8exsgrhh6p7f.jpeg,Health and Beauty>Bath and Spa>Soaps,2338.0,2338.0,2338.0,true,SOPE8EZGBV6HKRHR,SOPE8EZGBV6HKRHR
Flipkart,,Grandpa's Pine Tar Soap,"For generations, whole families have enjoyed the refreshing natural pine tar scent, and the marvelous ""gliding suds"", and the marvelous soap. Grandpa's makes great heaps of snowny white lather in hard or soft water. Use it every day for every bath and toilet purpose. A marvelous shampoo for blondes, redheads, brunettes, and for all textures of hair. An invigorating bath soap for tub or shower. Removes body odors, leaves you feeling wonderfully refreshed.IngredientsCODONOPSIS ROOT: 150mg, Phosphorus: 200mgDirectionsUse daily.Does Not Contain: There are no added colors or fragrances to mask the rich brown color and distinctive scent of natural Pine Tar Oil. Not tested on animals.",Grandpa's,http://dl.flipkart.com/dl/grandpa-s-pine-tar-soap/p/itme7fyhesscdbm4?pid=SOPE7FYHHKFGKNDX&affid=siddarthk,http://img.fkcdn.com/image/soap/g/a/6/grandpa-s-45-soap-pine-tar-200x200-imae7dez5td5xzcp.jpeg,Health and Beauty>Bath and Spa>Soaps,1500.0,1500.0,1500.0,true,SOPE7FYHHKFGKNDX,SOPE7FYHHKFGKNDX
