PartnerName,Id,Title,Description,Brand,Link,ImageLink,CategoryName,Mrp,OfferPrice,EffectivePrice,Availability,PartnerIdFromUrl,PartnerIdFromDb
Flipkart,,"Ciba Vision Freshlook Green One Day Colorblends By Visions India Daily Contact Lens(-2.25, Green, Pack of 10)","Those who want to change their eye colour occasionally or wear clear contact lenses or spectacles, these lenses with options of four opaque colours is an easy add-on. It blends 3 colors into one to create the subtle, natural depth of your eyes with remarkable comfort level.",Ciba Vision,http://dl.flipkart.com/dl/ciba-vision-freshlook-green-one-day-colorblendsby-visions-india-daily-contact-lens/p/itmefqh7xc9t5zkw?pid=CTLEFQH7BE32TEJV&affid=siddarthk,http://img.fkcdn.com/image/contact-lens-new/q/h/r/ciba-vision-10-freshlook-green-one-day-colorblends-by-visions-200x200-imaefgznahtexu4u.jpeg,Health and Beauty>Eye Care>Contact Lenses,995.0,699.0,699.0,true,CTLEFQH7BE32TEJV,CTLEFQH7BE32TEJV
Flipkart,,"Ciba Vision Fresh Look Colorblends Monthly Contact Lens(-8, Brown, Pack of 2)",,Ciba Vision,http://dl.flipkart.com/dl/ciba-vision-fresh-look-colorblends-monthly-contact-lens/p/itmecs6zuhuyjqkg?pid=CTLECS6ZVEBPNZGN&affid=siddarthk,http://img.fkcdn.com/image/contact-lens-new/c/2/t/ciba-vision-2-fresh-look-colorblends-6-200x200-imaecrmhwvr3tfb2.jpeg,Health and Beauty>Eye Care>Contact Lenses,995.0,549.0,549.0,true,CTLECS6ZVEBPNZGN,CTLECS6ZVEBPNZGN
Flipkart,,"Cuteyes Marble Grey Monthly Contact Lens(0, Grey, Pack of 1)","Cuteyes Contact Lens come with a very unique technology that offers 3-in-1 solutions where they blend 3 different colors in to one unique eye lens that offers your eyes extra depth, enhanced beauty and a more natural look. These lenses can be worn for a month before you need to dispose them off. So now, creating your very own style statement! The soft lenses don't hurt the eyes as they provide only a soft covering over the eyes.",Cuteyes,http://dl.flipkart.com/dl/cuteyes-marble-grey-monthly-contact-lens/p/itmec8a5mr53ankp?pid=CTLEC8A5P8ZEQHEY&affid=siddarthk,http://img.fkcdn.com/image/contact-lens-new/h/e/y/cuteyes-1-marble-grey-0-200x200-imaec386ryqf7tpg.jpeg,Health and Beauty>Eye Care>Contact Lenses,599.0,599.0,599.0,false,CTLEC8A5P8ZEQHEY,CTLEC8A5P8ZEQHEY
Flipkart,,"Cooper Vision Proclear Monthly Contact Lens(-1.5, Transparent, Pack of 6)",,Cooper Vision,http://dl.flipkart.com/dl/cooper-vision-proclear-monthly-contact-lens/p/itmecb65rw64jhax?pid=CTLECB65WD3RRVHM&affid=siddarthk,http://img.fkcdn.com/image/contact-lens-new/8/f/h/cooper-vision-6-proclear-16-200x200-imaecy3reaav47f6.jpeg,Health and Beauty>Eye Care>Contact Lenses,1195.0,799.0,799.0,true,CTLECB65WD3RRVHM,CTLECB65WD3RRVHM
Flipkart,,"Ciba Vision O2 Optix Monthly Contact Lens(-6, Transperant, Pack of 6)",,Ciba Vision,http://dl.flipkart.com/dl/ciba-vision-o2-optix-monthly-contact-lens/p/itmecphbtyfwvnze?pid=CTLECPHBFGBFECHT&affid=siddarthk,http://img.fkcdn.com/image/contact-lens-new/v/s/r/ciba-vision-6-o2-optix-1-200x200-imae9yhmfzrbbvqf.jpeg,Health and Beauty>Eye Care>Contact Lenses,1195.0,669.0,669.0,true,CTLECPHBFGBFECHT,CTLECPHBFGBFECHT
Flipkart,,"Bausch & Lomb PureVision2 - HD Monthly Contact Lens(0.75, Transparent, Pack of 6)",,Bausch & Lomb,http://dl.flipkart.com/dl/bausch-lomb-purevision2-hd-monthly-contact-lens/p/itme862fpf6uwgd3?pid=CTLE862FGKVHZZYS&affid=siddarthk,http://img.fkcdn.com/image/contact-lens-new/8/2/c/bausch-lomb-6-purevision2-hd-plus1-dioptres-200x200-imae8futz8yf7z9h.jpeg,Health and Beauty>Eye Care>Contact Lenses,2100.0,1185.0,1185.0,true,CTLE862FGKVHZZYS,CTLE862FGKVHZZYS
Flipkart,,"Bausch & Lomb PureVision2 - HD Monthly Contact Lens(3.25, Transparent, Pack of 6)",,Bausch & Lomb,http://dl.flipkart.com/dl/bausch-lomb-purevision2-hd-monthly-contact-lens/p/itme8fhfh8hnnewn?pid=CTLE8FHFWMAERZBR&affid=siddarthk,http://img.fkcdn.com/image/contact-lens-new/8/2/c/bausch-lomb-6-purevision2-hd-plus1-dioptres-200x200-imae8futz8yf7z9h.jpeg,Health and Beauty>Eye Care>Contact Lenses,2100.0,1290.0,1290.0,true,CTLE8FHFWMAERZBR,CTLE8FHFWMAERZBR
Flipkart,,"Bausch & Lomb SofLens 59 Monthly Contact Lens(-8, Transparent, Pack of 6)",,Bausch & Lomb,http://dl.flipkart.com/dl/bausch-lomb-soflens-59-monthly-contact-lens/p/itme8fzperftxg4z?pid=CTLE8FZPWZQH3GMA&affid=siddarthk,http://img.fkcdn.com/image/contact-lens-new/k/2/m/bausch-lomb-6-soflens-59-3-5-200x200-imae8futeavbzphy.jpeg,Health and Beauty>Eye Care>Contact Lenses,995.0,729.0,729.0,true,CTLE8FZPWZQH3GMA,CTLE8FZPWZQH3GMA
Flipkart,,"Bausch & Lomb SoftLens 59 Monthly Contact Lens(-0.75, Transparent, Pack of 6)","Designed to Help Reduce Spherical Aberration, Deliver the Crisp Clear Vision",Bausch & Lomb,http://dl.flipkart.com/dl/bausch-lomb-softlens-59-monthly-contact-lens/p/itme8zng3pzch99j?pid=CTLE8ZNGETW4MPAB&affid=siddarthk,http://img.fkcdn.com/image/contact-lens-new/g/z/2/bausch-lomb-6-softlens-59-1-200x200-imae8rfhyxpreqyc.jpeg,Health and Beauty>Eye Care>Contact Lenses,995.0,673.0,673.0,true,CTLE8ZNGETW4MPAB,CTLE8ZNGETW4MPAB
Flipkart,,"CooperVision Proclear Monthly Contact Lens(-7, Plano Clear, Pack of 6)",,CooperVision,http://dl.flipkart.com/dl/coopervision-proclear-monthly-contact-lens/p/itme7zcfnkrcfzgg?pid=CTLE7ZCFYGUGWCYT&affid=siddarthk,http://img.fkcdn.com/image/contact-lens-new/j/j/6/coopervision-6-proclear-minus10-5-dioptres-200x200-imae7yjhgj3xzfgp.jpeg,Health and Beauty>Eye Care>Contact Lenses,995.0,749.0,749.0,true,CTLE7ZCFYGUGWCYT,CTLE7ZCFYGUGWCYT
Flipkart,,"Bloomsberry Strengthening Nail Polish Remover for brittle/weak nails, Green apple fragrance",Presenting a unique formulation of nail polish remover specially developed to tackle the problem of nails that chip and break easily. This helps to provide strength to nails that are brittle and leaves a fresh lingering green apple fragrance after wiping off old nail paint. Contains added moisturizers,Bloomsberry,http://dl.flipkart.com/dl/bloomsberry-strengthening-nail-polish-remover-brittle-weak-nails-green-apple-fragrance/p/itme7sspvkurqv8s?pid=NPRE7SSPDETWFZHJ&affid=siddarthk,http://img.fkcdn.com/image/nail-paint-remover/z/h/j/bloomsberry-50-strengthening-nail-polish-remover-for-brittle-200x200-imae7z9zrwnzytke.jpeg,Health and Beauty>Makeup>Nails>Nail Paint Removers,149.0,129.0,129.0,true,NPRE7SSPDETWFZHJ,NPRE7SSPDETWFZHJ
Flipkart,,Bloomsberry Nail Polish Remover With Moisturizers For Natural/Arificial Nails,,Bloomsberry,http://dl.flipkart.com/dl/bloomsberry-nail-polish-remover-moisturizers-natural-arificial-nails/p/itme7zatdghhm8hb?pid=NPRE7ZATJYVVYS2J&affid=siddarthk,http://img.fkcdn.com/image/nail-paint-remover/h/z/p/bloomsberry-50-acetone-free-nail-polish-remover-with-lemon-200x200-imae7z9pd4mjwd2z.jpeg,Health and Beauty>Makeup>Nails>Nail Paint Removers,149.0,99.0,99.0,true,NPRE7ZATJYVVYS2J,NPRE7ZATJYVVYS2J
Flipkart,,Grace Cole Luscious Lip Quenchers Peach & Pear,"Oozing with fruit fabulousness, these luscious lip quenchers are packed with actives to hydrate, soften and soothe dry and sore lips. Lip-smackingly mouth watering it will leave delicate pouts feeling smooth and supple.",Grace Cole,http://dl.flipkart.com/dl/grace-cole-luscious-lip-quenchers-peach-pear/p/itmeehe2kqvzfd8s?pid=LPBEEHE2EJM9FV5N&affid=siddarthk,http://img.fkcdn.com/image/lip-balm/v/5/n/grace-cole-15-luscious-lip-quenchers-200x200-imaeeht4ac6yvzca.jpeg,Health and Beauty>Body and Skin Care>Lip Care>Lip Balms,1250.0,840.0,840.0,false,LPBEEHE2EJM9FV5N,LPBEEHE2EJM9FV5N
Flipkart,,Grace Cole pineapple & pashion Fruit Pineapple & Pashion Fruit,"Oozing with fruit fabulousness, these luscious lip quenchers are packed with actives to hydrate, soften and soothe dry and sore lips. Lip-smackingly mouth watering it will leave delicate pouts feeling smooth and supple.",Grace Cole,http://dl.flipkart.com/dl/grace-cole-pineapple-pashion-fruit/p/itmeejgsfgy8rfbu?pid=LPBEEJGS3PFZHYYF&affid=siddarthk,http://img.fkcdn.com/image/lip-balm/y/y/f/grace-cole-15-pineapple-pashion-fruit-200x200-imaeeht8jqbzdhcr.jpeg,Health and Beauty>Body and Skin Care>Lip Care>Lip Balms,1250.0,840.0,840.0,false,LPBEEJGS3PFZHYYF,LPBEEJGS3PFZHYYF
Flipkart,,Blistex Simple and Sensitive,"Hydrates with Cocoa Butter, Jojoba & Sunflower Seed OilHypo-Allergenic, Non-Irritating FormulaContains Just Six IngredientsNo Flavor, No Fragrance, no ColorPurely Essential Daily Lip CareBlistex Simple and Sensitive contains just six carefully chosen ingredients to moisturize even the most sensitive lips effectively and without irritation...for care your lips will love.Non-IrritatingWith no flavors, fragrances, colors, or unnecessary sensitizing ingredients, Simple and Sensitive's hypo-allergenic formula is rigorously tested and clinically proven to be gentle on lips.Cocoa ButterA lush tropical extract with serious moisturizing properties.Sunflower Seed OilA nutrient-rich oil selected for its comforting qualities.JojobaA naturally-derived emollient that helps smooth and soften lips.Vitamin EA highly beneficial antioxidant.Microcrystalline WaxHelps give the formula an appealing form and feel.PhenoxyethanolA necessary preservative to maintain freshness.",Blistex,http://dl.flipkart.com/dl/blistex-simple-sensitive/p/itme7f3wk7jpgxur?pid=LPBE7F3WMXDGGJB5&affid=siddarthk,http://img.fkcdn.com/image/lip-balm/j/b/5/blistex-4-25-simple-and-sensitive-200x200-imae7yb9gm7btgae.jpeg,Health and Beauty>Body and Skin Care>Lip Care>Lip Balms,345.0,325.0,325.0,false,LPBE7F3WMXDGGJB5,LPBE7F3WMXDGGJB5
Flipkart,,Carmex Jar 15g Original,"Generations have relied on our hardworking original lip balm formula.Soothes dry, chapped lipsCreates a long-lasting water barrier with petrolatum, which acts like a bandage so healing can take placeContains lanolin, which mimics the way your skin naturally retains moistureProvides cooling pain relief with camphor and menthol",Carmex,http://dl.flipkart.com/dl/carmex-jar-15g-original/p/itmebzsjs2jbdfqf?pid=LPBEBZSJNXPZ2CKG&affid=siddarthk,http://img.fkcdn.com/image/lip-balm/c/k/g/carmex-15-jar-15g-200x200-imaebyrnkdhhe3eq.jpeg,Health and Beauty>Body and Skin Care>Lip Care>Lip Balms,750.0,550.0,550.0,false,LPBEBZSJNXPZ2CKG,LPBEBZSJNXPZ2CKG
Flipkart,,BANANA BOAT SPF45 Aloe vera & Vitamin E,"New!Very Water/Sweat ResistantAvoTriplex™ High UVA3-Way Protection™Banana Boat® Aloe Vera and Vitamin E Lip Balm is very water/sweat resistant, helps soothe and keeps your lips soft and supple. This ultra-sheer formula with patented AvoTriplex™ technology protects in 3 ways:Against sunburn with high UVB protection,Against aging and long-term skin damage with high UVA protection, andLasts longer than ordinary sunscreens since it doesn't break down.",BANANA BOAT,http://dl.flipkart.com/dl/banana-boat-spf45-aloe-vera-vitamin-e/p/itme7qzgeghez2wm?pid=LPBE7QZGFGH9D4AP&affid=siddarthk,http://img.fkcdn.com/image/lip-balm/4/a/p/banana-boat-4-25-spf45-200x200-imae7qufbftqcc6h.jpeg,Health and Beauty>Body and Skin Care>Lip Care>Lip Balms,450.0,325.0,325.0,false,LPBE7QZGFGH9D4AP,LPBE7QZGFGH9D4AP
Flipkart,,Carmex Ultra Smooth Pomegranate,,Carmex,http://dl.flipkart.com/dl/carmex-ultra-smooth-pomegranate/p/itme7yqgsa6ruspa?pid=LPBE7YQGYEUVP8WY&affid=siddarthk,http://img.fkcdn.com/image/lip-balm/8/w/y/carmex-4-25-ultra-smooth-200x200-imae7wjfm7ymrxj4.jpeg,Health and Beauty>Body and Skin Care>Lip Care>Lip Balms,600.0,300.0,300.0,false,LPBE7YQGYEUVP8WY,LPBE7YQGYEUVP8WY
Flipkart,,Burt's Bees Soothing Lip Balm with Eucalyptus & Menthol(4.25 g),"Give your chapped lips some love and care with our Soothing Lip Balm. Let the cooling combination of Menthol and Eucalyptus Oil soothe seriously dry lips while Shea Butter helps moisturize them. 100% natural, this balm leaves your lips looking healthy, feeling happy and hopelessly hydrated. Cools severely dry lips with Menthol Soothes with Eucalyptus Oil Moisturizes with Beeswax",Burt's Bees,http://dl.flipkart.com/dl/burt-s-bees-soothing-lip-balm-eucalyptus-menthol/p/itme482zsbqbwyab?pid=LPBE482ZDUFBQMYN&affid=siddarthk,http://img.fkcdn.com/image/lip-balm/m/y/n/burt-s-bee-4-25-soothing-lip-balm-with-eucalyptus-menthol-200x200-imae45wkaptkyx8z.jpeg,Health and Beauty>Body and Skin Care>Lip Care>Lip Balms,599.0,495.0,495.0,false,LPBE482ZDUFBQMYN,LPBE482ZDUFBQMYN
Flipkart,,Chapstick Skin Protectant Medicated,"Skin Protectant/External AnalgesicSoothes, Hydrates & Helps Heal Severely Dry, Chapped LipsHelps Prevent And Temporarily Protects Chafed, Chapped Or Cracked LipsTemporary Relief Of Pain Associated With Fever Blisters And Cold Sores",Chapstick,http://dl.flipkart.com/dl/chapstick-skin-protectant-medicated/p/itme7wq4rkbzussn?pid=LPBECWBFMDBDHMHM&affid=siddarthk,http://img.fkcdn.com/image/lip-balm/m/h/m/chapstick-4-skin-protectant-200x200-imaecvggjhfnhztc.jpeg,Health and Beauty>Body and Skin Care>Lip Care>Lip Balms,500.0,300.0,300.0,false,LPBECWBFMDBDHMHM,LPBECWBFMDBDHMHM
Flipkart,,Carmex Everyday Healing Lip Balm Original,"Not many lip balms have been around 75 years. But then, no other lip balm has Carmex’s time-tested formula. Generations have relied on our iconic white jar with its yellow cap to help moisturization, prevent dry lips and treat cold sore symptoms. No wonder pharmacists have ranked Carmex the #1 recommended lip balm for 14 straight years. Formulas with camphor and menthol soothe severely dry lips and pain from cold sores. We add petrolatum because it creates a long-lasting water barrier, acting like a bandage while healing takes place. Your skin’s lipid bilayer is made up of two layers of fatty acids; its job is to help keep moisture in the skin. Our Original Jar includes lanolin, which replicates the way the lipid bilayer in your skin retains moisture.",Carmex,http://dl.flipkart.com/dl/carmex-everyday-healing-lip-balm-original/p/itme5z6tprgnmwcm?pid=LPBE5Z6TFTW7JZDG&affid=siddarthk,http://img.fkcdn.com/image/lip-balm/z/d/g/carmex-7-5-everyday-healing-lip-balm-200x200-imae5ym5kxwr6uhv.jpeg,Health and Beauty>Body and Skin Care>Lip Care>Lip Balms,400.0,300.0,300.0,false,LPBE5Z6TFTW7JZDG,LPBE5Z6TFTW7JZDG
Flipkart,,Blistex DCT Daily Conditioning Treatment Natural,"Blistex DCT combines moisturizers, vitamins and protectants to provide a daily maintenance regimen for your lips.DCT keeps your lips in perfect condition every day of the year, in all climates, through all activities.Smooth & Supple Lips: DCT nurtures your lips with two proven moisturizers, Aloe and Cocoa Butter, plus Vitamin E. DCT softens and smoothes the surface of lips to help them look and feel young. DCT helps to prevent and replenish moisture-starved cells that can occur from daily exposure to dry air and other environmental conditions.SPF 20 Sun Protection",Blistex,http://dl.flipkart.com/dl/blistex-dct-daily-conditioning-treatment-natural/p/itme7yv6ezma2duv?pid=LPBE7YV6P3X4TUAZ&affid=siddarthk,http://img.fkcdn.com/image/lip-balm/u/a/z/blistex-7-08-dct-daily-conditioning-treatment-200x200-imae7ybwx6amr22u.jpeg,Health and Beauty>Body and Skin Care>Lip Care>Lip Balms,425.0,400.0,400.0,false,LPBE7YV6P3X4TUAZ,LPBE7YV6P3X4TUAZ
Flipkart,,Grace Cole Strawberry & Kiwi Strawberry & Kiwi,"Oozing With Fruit Fabulousness, These Luscious Lip Quenchers Are Packed With Actives To Hydrate, Soften And Soothe Dry And Sore Lips. Lip-Smackingly Mouth Watering It Will Leave Delicate Pouts Feeling Smooth And Supple.",Grace Cole,http://dl.flipkart.com/dl/grace-cole-strawberry-kiwi/p/itmeegf9jzk7mhtg?pid=LPBEEGF9MFWA7JCS&affid=siddarthk,http://img.fkcdn.com/image/lip-balm/j/c/s/grace-cole-15-strawberry-kiwi-200x200-imaeehtg8jbrnj57.jpeg,Health and Beauty>Body and Skin Care>Lip Care>Lip Balms,1250.0,840.0,840.0,false,LPBEEGF9MFWA7JCS,LPBEEGF9MFWA7JCS
Flipkart,,Biotique Advanced Bxl Cellular Lip Repair Balm Natural,"Biotique Advanced This nourishing lip balm, with BXL Complex, soothes and repairs dry lips. Ideal for overnight therapy. BXL Complex is a new power source for intercellular communication. The result of advanced skin research, it is a precise blend of 100% natural botanicals and biologically advanced ingredients essential to healthy skin life. Helps stimulate cell renewal and elevate hydration and nutrition levels from within, producing a youthful environment for stronger, more resilient skin to rise up to the surface each day.",Biotique,http://dl.flipkart.com/dl/biotique-advanced-bxl-cellular-lip-repair-balm-natural/p/itmeegf5fs5etyf5?pid=LPBEEGF57NBA3ZCH&affid=siddarthk,http://img.fkcdn.com/image/lip-balm/z/c/h/biotique-15-advanced-bxl-cellular-lip-repair-balm-200x200-imaeehrwkd3pphkv.jpeg,Health and Beauty>Body and Skin Care>Lip Care>Lip Balms,499.0,499.0,499.0,false,LPBEEGF57NBA3ZCH,LPBEEGF57NBA3ZCH
Flipkart,,Blistex Medicated Lip Ointment Natural,"An Advanced Moisture System® delivers penetrating medication in a unique formula to relieve cold sores & severe lip dryness.Blistex Lip Ointment contains four medications to provide relief from the pain, itching and discomfort of lip sores and blisters.The moisture and emollient base in Blistex Lip Ointment hydrates and softens lip cells to alleviate cracking and seriously dry lips. Blistex Lip Ointment is so effective, it's clinically proven to elevate lip moisture, heal dry, chapped lips, and improve overall condition.Beauty professionals also use it to smooth lip texture before applying color. To use as a lipstick base, apply liberally, leave on for five minutes, then remove excess and apply color.",Blistex,http://dl.flipkart.com/dl/blistex-medicated-lip-ointment-natural/p/itme7ywweujuufzx?pid=LPBE7YWW8VVY5RJY&affid=siddarthk,http://img.fkcdn.com/image/lip-balm/r/j/y/blistex-6-medicated-lip-ointment-200x200-imae7ybrphvrgexn.jpeg,Health and Beauty>Body and Skin Care>Lip Care>Lip Balms,325.0,265.0,265.0,false,LPBE7YWW8VVY5RJY,LPBE7YWW8VVY5RJY
Flipkart,,Blistex Medicated Mint Mint,"Seals in moisture. To soothe & prevent dry lips. Smooth easy-gliding protection. Blistex Mint Lip Balm helps prevent dryness and chapping. Its easy glide formula also soothes irritated lips. Dry, Chapped Lips: Blistex Lip Balm has three long-lasting protectants, and it seals in lip moisture to prevent drying of lip tissue. It glides on comfortably to provide complete coverage and avoid further irritation of chapped lips. Sun Protection: Blistex Lip Balm provides SPF 15 protection. Remember, lips don't tan, but they do burn.",Blistex,http://dl.flipkart.com/dl/blistex-medicated-mint/p/itmebj7v2swafhzd?pid=LPBEBJ7VBUYKYGUH&affid=siddarthk,http://img.fkcdn.com/image/lip-balm/g/u/h/blistex-4-25-medicated-mint-200x200-imaebghyzx6ae7vh.jpeg,Health and Beauty>Body and Skin Care>Lip Care>Lip Balms,450.0,375.0,375.0,false,LPBEBJ7VBUYKYGUH,LPBEBJ7VBUYKYGUH
Flipkart,,Burt's Bees Nourishing Lip Balm with Butter Mango(4.25 gm),"Made with Mango Butter, this nourishing balm smoothes and nourishes for happily hydrated lips. One taste of its fresh, fruity flavor and your lips will love you with a passion.? Nourishes with Mango Butter.? Sweet tropical flavor.",Burt's Bees,http://dl.flipkart.com/dl/burt-s-bees-nourishing-lip-balm-butter-mango/p/itmeyrjn6mxkprsx?pid=LPBEYRJN9JSFTZJS&affid=siddarthk,http://img.fkcdn.com/image/lip-balm/m/h/z/burt-s-bee-4-25-nourishing-lip-balm-mango-butter-200x200-imaeyut5zzzhfnyh.jpeg,Health and Beauty>Body and Skin Care>Lip Care>Lip Balms,550.0,490.0,490.0,false,LPBEYRJN9JSFTZJS,LPBEYRJN9JSFTZJS
Flipkart,,Carmex Cherry Lip Balm Cherry,"The just-right combination of effective lip care and cherry flavor. This soothing version of our classic Carmex formula eases over tender, cracked lips, so you feel instant relief. Best part: it also has broad spectrum (UVA/UVB) sun protection, plus the squeezable tube allows users to control exactly how much of the glossy, smooth formula they apply. A formula with menthol and camphor provides cooling pain relief. Our glide-on balm includes cocoa butter for smooth, velvety feel plus a touch of mineral oil to improve spreadability and help soften and hydrate skin. Your skin’s lipid bilayer is made up of two layers of fatty acids; its job is to help keep moisture in the skin. Our Cherry Tube includes lanolin, which replicates the way the lipid bilayer in your skin retains moisture.",Carmex,http://dl.flipkart.com/dl/carmex-cherry-lip-balm/p/itme5z6tzuvpehgv?pid=LPBE5Z6TYKZM2ZDZ&affid=siddarthk,http://img.fkcdn.com/image/lip-balm/z/d/z/carmex-10-cherry-lip-balm-200x200-imae5z7sgwhpx2uf.jpeg,Health and Beauty>Body and Skin Care>Lip Care>Lip Balms,400.0,340.0,340.0,false,LPBE5Z6TYKZM2ZDZ,LPBE5Z6TYKZM2ZDZ
Flipkart,,Grace Cole Coconut and Lime Coconut & Lime,"Oozing with fruit fabulousness, these luscious lip quenchers are packed with actives to hydrate, soften and soothe dry and sore lips. Lip-smackingly mouth watering it will leave delicate pouts feeling smooth and supple.",Grace Cole,http://dl.flipkart.com/dl/grace-cole-coconut-lime/p/itmeejgscswfxfud?pid=LPBEEJGSGBEWRVMM&affid=siddarthk,http://img.fkcdn.com/image/lip-balm/v/m/m/grace-cole-15-coconut-and-lime-200x200-imaeehtywmhfxg6u.jpeg,Health and Beauty>Body and Skin Care>Lip Care>Lip Balms,1250.0,840.0,840.0,false,LPBEEJGSGBEWRVMM,LPBEEJGSGBEWRVMM
Flipkart,,Blistex Lip Balm Medex,,Blistex,http://dl.flipkart.com/dl/blistex-lip-balm-medex/p/itme7xj67yfjpghy?pid=LPBE7XJ6AECWAFY9&affid=siddarthk,http://img.fkcdn.com/image/lip-balm/f/y/9/blistex-7-lip-balm-200x200-imae7wk8ggmvctp3.jpeg,Health and Beauty>Body and Skin Care>Lip Care>Lip Balms,600.0,595.0,595.0,false,LPBE7XJ6AECWAFY9,LPBE7XJ6AECWAFY9
Flipkart,,Carmex Everyday Ultra Smooth Lip Balm Vanilla,"With a Smooth New FlavorSunscreenDiscover how this new ultra smooth, extra moisturizing formula makes your lips feel incredible. This soft, subtle new flavor is unlike anything you've tried from Carmex® before. We bet it will quickly become your favorite lip balm. For over 70 years the Woelbing family had been making Carmex lip balm.It Soothes. It Heals. It Protects.®Carmex lip balm is tested on family members - not on animals.IndicationsLip moisturizer, sunscreen.",Carmex,http://dl.flipkart.com/dl/carmex-everyday-ultra-smooth-lip-balm-vanilla/p/itme9vrnefyazk4e?pid=LPBE9VRNJHVY58GY&affid=siddarthk,http://img.fkcdn.com/image/lip-balm/8/g/y/carmex-4-25-everyday-ultra-smooth-lip-balm-200x200-imae9vqdqjv2xgzw.jpeg,Health and Beauty>Body and Skin Care>Lip Care>Lip Balms,550.0,300.0,300.0,false,LPBE9VRNJHVY58GY,LPBE9VRNJHVY58GY
Flipkart,,Burt's Bees Replenshing Regenerant Pomegranate Oil,"Replenishing Pomegranate Lip BalmBurt's Bees Replenishing Lip Balm with pomegranate oil moisturizes and soothes your lips. Features sunflower seed oil, coconut oil and rosemary. Not tested on animals",Burt's Bees,http://dl.flipkart.com/dl/burt-s-bees-replenshing-regenerant-pomegranate-oil/p/itme9jz3ct3hfpx9?pid=LPBE9JZ37PUMGGG5&affid=siddarthk,http://img.fkcdn.com/image/lip-balm/g/g/5/burt-s-bees-4-25-replenshing-regenerant-200x200-imae9jeezggqkuhx.jpeg,Health and Beauty>Body and Skin Care>Lip Care>Lip Balms,895.0,595.0,595.0,false,LPBE9JZ37PUMGGG5,LPBE9JZ37PUMGGG5
Flipkart,,Carmex Click-Stick Moisturizing SPF 15 Strawberry,"HeadingIt soothes. It heals. It protects.PurposeLip Moisturizer, SunscreenManufacturerCarma LabsActive IngredientsOctinoxate 6.4%; Oxybenzone 5.4%DirectionsApply liberally and evenly as necessary, and before exposure to sun, wind or cold. Reapply after swimming. Consult a physician for use on children under six months of age.Inactive IngredientsPetrolatum; Lanolin; Meadowfoam Seed Oil; Camphor; Menthol; Phenol; Salicylic Acid; In a Mixture of Waxes and FlavorUsesLip moisturizer and sunscreen. Carmex Lip Balm seals in lip moisture and helps to prevent drying of lip tissue. Carmex Lip Balm provides SPF 15 which is recommended for people who burn and tan minimally",Carmex,http://dl.flipkart.com/dl/carmex-click-stick-moisturizing-spf-15-strawberry/p/itmeb7yhqwy8mhjh?pid=LPBEB7YHHYRMHJW2&affid=siddarthk,http://img.fkcdn.com/image/lip-balm/p/f/e/carmex-4-25-click-stick-moisturizing-spf-15-200x200-imaeb6bty8dmycgg.jpeg,Health and Beauty>Body and Skin Care>Lip Care>Lip Balms,400.0,325.0,325.0,false,LPBEB7YHHYRMHJW2,LPBEB7YHHYRMHJW2
Flipkart,,Burt's Bees Island Lip Balm with Passion Fruit,"Take a mini-vacation with our tropically-inspired lip balm. Infused with Passion Fruit Extract and a touch of Coconut Oil, it's sure to give you beautiful lips on or off the beach.Softens lips with Passion Fruit Extract and Coconut Oil. Sweet Passion Fruit flavor . Medium-weight, creamy formula",Burt's Bees,http://dl.flipkart.com/dl/burt-s-bees-island-lip-balm-passion-fruit/p/itme482zyk2gckrt?pid=LPBE482Z64MGKZZR&affid=siddarthk,http://img.fkcdn.com/image/lip-balm/z/z/r/burt-s-bee-4-25-island-lip-balm-with-passion-fruit-200x200-imae45wkdxyvgtq2.jpeg,Health and Beauty>Body and Skin Care>Lip Care>Lip Balms,599.0,495.0,495.0,false,LPBE482Z64MGKZZR,LPBE482Z64MGKZZR
Flipkart,,Grace Cole Pashion fruit & Guava Pashion fruit & Guava,"Oozing with fruit fabulousness, these luscious lip quenchers are packed with actives to hydrate, soften and soothe dry and sore lips. Lip-smackingly mouth watering it will leave delicate pouts feeling smooth and supple.",Grace Cole,http://dl.flipkart.com/dl/grace-cole-pashion-fruit-guava/p/itmeegf9ycry2xmk?pid=LPBEEGF9ZHCGHWWH&affid=siddarthk,http://img.fkcdn.com/image/lip-balm/w/w/h/grace-cole-15-pashion-fruit-guava-200x200-imaeehtbjzywj25k.jpeg,Health and Beauty>Body and Skin Care>Lip Care>Lip Balms,1250.0,840.0,840.0,false,LPBEEGF9ZHCGHWWH,LPBEEGF9ZHCGHWWH
Flipkart,,Carmex Moisture Plus Limited Edition Adventurous Soft Vanilla,,Carmex,http://dl.flipkart.com/dl/carmex-moisture-plus-limited-adventurous-soft-vanilla/p/itmecgnb3g6gwhzm?pid=LPBECGNBZXE5SGRX&affid=siddarthk,http://img.fkcdn.com/image/lip-balm/g/r/x/carmex-2-moisture-plus-limited-edition-adventurous-200x200-imaecg3pxkhwpmwg.jpeg,Health and Beauty>Body and Skin Care>Lip Care>Lip Balms,750.0,550.0,550.0,false,LPBECGNBZXE5SGRX,LPBECGNBZXE5SGRX
