PartnerName,Id,Title,Description,Brand,Link,ImageLink,CategoryName,Mrp,OfferPrice,EffectivePrice,Availability,PartnerIdFromUrl,PartnerIdFromDb
Flipkart,,20Dresses Entwined Eternally In Diamonds Hair Band(Black),This statement hairband is surely going to make heads turn so be ready for all the attention you're going to get with it!. Accessorize with: A jewel toned skater dress with a pair of heels and a silver watch. Add a silver sling to complete the ready to party look. Ribbon encased metal hairband split in two with a metal cut out leaf stems with zircons attached to it. .,20Dresses,http://dl.flipkart.com/dl/20dresses-entwined-eternally-diamonds-hair-band/p/itme6x3yzy9jr8yp?pid=HACE6X3YPDMWEJ3G&affid=siddarthk,http://img.fkcdn.com/image/hair-accessory/j/3/g/ha0419-1-20dresses-hair-band-entwined-eternally-in-diamonds-200x200-imae6xwzzzejgqnw.jpeg,Health and Beauty>Hair Care>Hair Care Accessories>Hair Accessories,495.0,495.0,495.0,true,HACE6X3YPDMWEJ3G,HACE6X3YPDMWEJ3G
Flipkart,,"20Dresses Navy Blue Love And Peace Rubber Band(Blue, Silver)",Sometimes all you need is cute and a little out of the box looking hairtie and this one fits right in!. Accessorize with: Wear this with all your casuals and strappy flats to get a clean casual look! Set Of Four Elastic Hairties with a metal Love a metal peace sign and metal cutwork detailing brooches attached.,20Dresses,http://dl.flipkart.com/dl/20dresses-navy-blue-love-peace-rubber-band/p/itme6x3yzzdqy3pg?pid=HACE6X3YZ6SYVJHX&affid=siddarthk,http://img.fkcdn.com/image/hair-accessory/j/h/x/ha0442-4-20dresses-rubber-band-navy-blue-love-and-peace-200x200-imae6xfe2cyycyv7.jpeg,Health and Beauty>Hair Care>Hair Care Accessories>Hair Accessories,395.0,395.0,395.0,true,HACE6X3YZ6SYVJHX,HACE6X3YZ6SYVJHX
Flipkart,,20Dresses Stringing The Hair Clip(Gold),The right amount of bling you need to add to complete the outfit and make it shine.. Accessorize with: A full length gown a pair of gold heels and gold clutch. Add a statement neckpiece to complete the look.,20Dresses,http://dl.flipkart.com/dl/20dresses-stringing-hair-clip/p/itme7dfhhmz88uwk?pid=HACE7DFHCZMDKGTK&affid=siddarthk,http://img.fkcdn.com/image/hair-accessory/g/t/k/ha0451-1-20dresses-hair-clip-stringing-the-200x200-imae7djdgchtbdj8.jpeg,Health and Beauty>Hair Care>Hair Care Accessories>Hair Accessories,395.0,395.0,395.0,true,HACE7DFHCZMDKGTK,HACE7DFHCZMDKGTK
Flipkart,,20Dresses White Love And Beyond Rubber Band(Silver),Sometimes all you need is cute and a little out of the box looking hairtie and this one fits right in!. Accessorize with: Wear this with all your casuals and strappy flats to get a clean casual look! Set Of Four Elastic Hairties with a metal Love a metal peace sign and metal cutwork detailing brooches attached.,20Dresses,http://dl.flipkart.com/dl/20dresses-white-love-beyond-rubber-band/p/itme6x3yqzg3fq29?pid=HACE6X3YHZRQNAZG&affid=siddarthk,http://img.fkcdn.com/image/hair-accessory/a/z/g/ha0437-4-20dresses-rubber-band-white-love-and-beyond-200x200-imae6xwp7pkwuh2e.jpeg,Health and Beauty>Hair Care>Hair Care Accessories>Hair Accessories,395.0,395.0,395.0,true,HACE6X3YHZRQNAZG,HACE6X3YHZRQNAZG
Flipkart,,20Dresses Crowning The Pearl Silver Hair Accessory Set(Silver),This Simple elegant hairpin set will go with anything and everything and give you a feminine touch. Accessorize with: A pastel coloured skater dress with silver heels and a cute ear studs will complete this look. Set of Two pairs of Metal Hairpins . Studded with pearls and zircons. Crown and oval pearl detailing on the hairpins.,20Dresses,http://dl.flipkart.com/dl/20dresses-crowning-pearl-silver-hair-accessory-set/p/itme77hwq9nhsxhq?pid=HACE77HWEZUEMZFU&affid=siddarthk,http://img.fkcdn.com/image/hair-accessory/z/f/u/ha0459-4-20dresses-hair-accessory-set-crowning-the-pearl-silver-200x200-imae77gt3zfcxpu9.jpeg,Health and Beauty>Hair Care>Hair Care Accessories>Hair Accessories,445.0,445.0,445.0,false,HACE77HWEZUEMZFU,HACE77HWEZUEMZFU
Flipkart,,"20Dresses Cut In Rubber Band(Gold, Black)",This stunning piece works as a hairtie as well as a clip. It's the right kind of pretty you need to add to your hair. . Accessorize with: A black casual skater dress with a pair of gold strappy sandals will complete this casual look! Elastic Hairtie with a metal cutwork clutcher attached..,20Dresses,http://dl.flipkart.com/dl/20dresses-cut-rubber-band/p/itmec88p93uuhp3c?pid=HACEC88PVNG7PWJN&affid=siddarthk,http://img.fkcdn.com/image/hair-accessory/w/j/n/ha0503-1-20dresses-rubber-band-cut-in-200x200-imae9wdueyqgw3bz.jpeg,Health and Beauty>Hair Care>Hair Care Accessories>Hair Accessories,295.0,295.0,295.0,false,HACEC88PVNG7PWJN,HACEC88PVNG7PWJN
Flipkart,,20Dresses Staring At The Snowflakes Hair Band(Gold),This multiple dainty gold snowflakes hairband is the prettiest thing to have this season.. Accessorize with: A cute summer dress a pair of bellies and a tote bag will complete this look. Metal gold hairband with zircons encased in metal cut out snowflakes..,20Dresses,http://dl.flipkart.com/dl/20dresses-staring-snowflakes-hair-band/p/itme6x3yhge6kzkt?pid=HACE6X3Y23MTHNTY&affid=siddarthk,http://img.fkcdn.com/image/hair-accessory/n/t/y/ha0400-1-20dresses-hair-band-staring-at-the-snowflakes-200x200-imae6xwzuzunwx8j.jpeg,Health and Beauty>Hair Care>Hair Care Accessories>Hair Accessories,395.0,395.0,395.0,true,HACE6X3Y23MTHNTY,HACE6X3Y23MTHNTY
Flipkart,,"20Dresses The Suede Effect Hair Band(Black, White, Brown)",I love this gorgeous hairband that is perfect to style and yet stay sleek throughout the day! Braided suede hairband trio in brown black and white. Elastic at back for ease and fastening.,20Dresses,http://dl.flipkart.com/dl/20dresses-suede-effect-hair-band/p/itmec88pnkhnyzyw?pid=HACEC88PMEFZMDXX&affid=siddarthk,http://img.fkcdn.com/image/hair-accessory/d/x/x/ha0512-3-20dresses-hair-band-the-suede-effect-200x200-imaebzzjhv3nkjpy.jpeg,Health and Beauty>Hair Care>Hair Care Accessories>Hair Accessories,349.0,349.0,349.0,false,HACEC88PMEFZMDXX,HACEC88PMEFZMDXX
Flipkart,,20Dresses Bowing To Fashion Hair Band(Gold),A stunning hair accessory that will complete your night out look without the need to over accessorise.. Accessorize with: A classic little black dress a pair of contrast heels and a statement cuff to complete your night out look. Metal gold hairband split in two with a zircon and zircons encased bows attached alternatively on both sides.,20Dresses,http://dl.flipkart.com/dl/20dresses-bowing-fashion-hair-band/p/itme6x3yyprq9dw6?pid=HACE6X3YHKAWHBCB&affid=siddarthk,http://img.fkcdn.com/image/hair-accessory/b/c/b/ha0402-1-20dresses-hair-band-bowing-to-fashion-200x200-imae6xwzu6yvr5ae.jpeg,Health and Beauty>Hair Care>Hair Care Accessories>Hair Accessories,445.0,445.0,445.0,true,HACE6X3YHKAWHBCB,HACE6X3YHKAWHBCB
Flipkart,,20Dresses Leaping For The Stars Hair Band(Black),Look your charming self with this stunning statement hairband that will make you the centre of attention instantly!. Accessorize with: A white bodycon dress with silver heels and small pearl studs. Add a silver box clutch to complete this adorable look. Ribbon encased metal hairband split in two with zircons encased in metal stars..,20Dresses,http://dl.flipkart.com/dl/20dresses-leaping-stars-hair-band/p/itme6x3yzvrpq294?pid=HACE6X3YQKTEXUEF&affid=siddarthk,http://img.fkcdn.com/image/hair-accessory/u/e/f/ha0422-1-20dresses-hair-band-leaping-for-the-stars-200x200-imae6xwzhuzucsnj.jpeg,Health and Beauty>Hair Care>Hair Care Accessories>Hair Accessories,445.0,445.0,445.0,true,HACE6X3YQKTEXUEF,HACE6X3YQKTEXUEF
Flipkart,,20Dresses Bohemian Babe Hair Clip(Blue),I love these gorgeous feather hair extensions that are great as a vacation accessory!. Accessorize with: A printed maxi with strappy flats and a sling to complete this boho inspired look. Feather attached to metal chain and twisted ribbons hair clip. Detachable clip for easy fastening and removal.,20Dresses,http://dl.flipkart.com/dl/20dresses-bohemian-babe-hair-clip/p/itmec88qrdfffzzz?pid=HACEC88QJRAS2BAH&affid=siddarthk,http://img.fkcdn.com/image/hair-accessory/b/a/h/ha0547-1-20dresses-hair-clip-bohemian-babe-200x200-imaebzzjjzmpeaqv.jpeg,Health and Beauty>Hair Care>Hair Care Accessories>Hair Accessories,299.0,299.0,299.0,false,HACEC88QJRAS2BAH,HACEC88QJRAS2BAH
Flipkart,,20Dresses Lost To The Diamonds Hair Band(Black),The right amount of bling you need to add to complete the outfit and make it shine. . Accessorize with: A black peplum top a pair of black pants with a pair of gold heels will complete this look! Don't forget your red lipstick! Ribbon encased metal hairband with zircons attached to a metal brooch.,20Dresses,http://dl.flipkart.com/dl/20dresses-lost-diamonds-hair-band/p/itme6x3yz2sr7ptg?pid=HACE6X3Y6XWXGSKN&affid=siddarthk,http://img.fkcdn.com/image/hair-accessory/s/k/n/ha0415-1-20dresses-hair-band-lost-to-the-diamonds-200x200-imae6xwppz2zzy36.jpeg,Health and Beauty>Hair Care>Hair Care Accessories>Hair Accessories,395.0,395.0,395.0,true,HACE6X3Y6XWXGSKN,HACE6X3Y6XWXGSKN
Flipkart,,20Dresses Stud me Senseless Hair Band(Gold),Just a little something that will give you a subtle rock chic look by adding this to your outfit. Multiple gold metal studded hairband. Elastic at back for ease of comfort.,20Dresses,http://dl.flipkart.com/dl/20dresses-stud-me-senseless-hair-band/p/itme4qfkm8tgvg75?pid=HACE4QFKCQDHFGUZ&affid=siddarthk,http://img.fkcdn.com/image/hair-accessory/g/u/z/ha0354-1-20dresses-hair-band-stud-me-senseless-200x200-imae4kg5y3zcctpg.jpeg,Health and Beauty>Hair Care>Hair Care Accessories>Hair Accessories,245.0,245.0,245.0,false,HACE4QFKCQDHFGUZ,HACE4QFKCQDHFGUZ
Flipkart,,20Dresses Bohemian Rhapsody Hair Chain(Gold),Head Chains Are New Trend That Has Raptured The Celebs As Well. A Perfect Accessory To Dress Up Your Tresses And Still Keep It Casual And Chic I Highly Recommend This For Your Next Vacation Or Beach Party. Accessorize With: A Printed Maxi Dress With Open Flats And A Bangle Set. Keep The Make Up Subtle And Look Your Boho Best! Flat Round Detailed Head Chain. Elastic At Back For Ease And Fastening.,20Dresses,http://dl.flipkart.com/dl/20dresses-bohemian-rhapsody-hair-chain/p/itme7f79as4uknfx?pid=HACE7F79NYDHHDEH&affid=siddarthk,http://img.fkcdn.com/image/hair-accessory/d/e/h/ha0382-1-20dresses-hair-chain-bohemian-rhapsody-200x200-imae6yymhqdadsjg.jpeg,Health and Beauty>Hair Care>Hair Care Accessories>Hair Accessories,495.0,495.0,495.0,true,HACE7F79NYDHHDEH,HACE7F79NYDHHDEH
Flipkart,,"20Dresses Rivers Of Hair Band(Gold, Black)",The Right Amount Of Bling You Need To Add To Complete The Outfit And Make It Shine. . Accessorize With: A Full Length Gown A Pair Of Gold Heels And Gold Clutch. Add A Statement Neckpiece To Complete The Look. Metal Encased Zircons Hairband . Elastic At Back For Ease Of Comfort.,20Dresses,http://dl.flipkart.com/dl/20dresses-rivers-hair-band/p/itmeafk6bzzskzu7?pid=HACEAFK6MXTTYJWZ&affid=siddarthk,http://img.fkcdn.com/image/hair-accessory/j/w/z/ha0489-1-20dresses-hair-band-rivers-of-200x200-imae9wdtfrfrcm5y.jpeg,Health and Beauty>Hair Care>Hair Care Accessories>Hair Accessories,395.0,395.0,395.0,true,HACEAFK6MXTTYJWZ,HACEAFK6MXTTYJWZ
Flipkart,,"20Dresses Spike me Funky Trio Hair Band(White, Black, Gold)",Add a little bit of funk with this edgy spikey hairband to complete the going to rock concert look. . Accessorize with: A pair of denims plaid shirt with rocker boots and a leather fringe sling. Add a gold chunky cuff to complete this edgy look. Trio of metal stud Hairbands. Elastic at back for ease of comfort.,20Dresses,http://dl.flipkart.com/dl/20dresses-spike-me-funky-trio-hair-band/p/itme4qfkbdd2x34q?pid=HACE4QFKRCYGVZXP&affid=siddarthk,http://img.fkcdn.com/image/hair-accessory/z/x/p/ha0348-3-20dresses-hair-band-spike-me-funky-trio-200x200-imae4pxzuwqmrzye.jpeg,Health and Beauty>Hair Care>Hair Care Accessories>Hair Accessories,395.0,395.0,395.0,false,HACE4QFKRCYGVZXP,HACE4QFKRCYGVZXP
Flipkart,,"20Dresses Looped In Infinity Hair Band(Gold, Black)",The Right Amount Of Bling You Need To Add To Complete The Outfit And Make It Shine. . Accessorize With: A Full Length Gown A Pair Of Gold Heels And Gold Clutch. Add A Statement Neckpiece To Complete The Look. Metal Encased Zircons Hairband . Elastic At Back For Ease Of Comfort.,20Dresses,http://dl.flipkart.com/dl/20dresses-looped-infinity-hair-band/p/itmeafk6zmgkya8t?pid=HACEAFK6HY5TP2HN&affid=siddarthk,http://img.fkcdn.com/image/hair-accessory/2/h/n/ha0490-1-20dresses-hair-band-looped-in-infinity-200x200-imae9wdtrjjpjgyh.jpeg,Health and Beauty>Hair Care>Hair Care Accessories>Hair Accessories,1295.0,1295.0,1295.0,true,HACEAFK6HY5TP2HN,HACEAFK6HY5TP2HN
Flipkart,,20Dresses Teardrop Hair Accessory Set(Silver),When you add a little something blingy to your hair it instantly shines and these hair charms are all you need to add that touch. . Accessorize with: Wear a pastel coloured evening gown with heels and stun the crowd at a cocktail night. Drop Shaped Diamonds Hair Charms. A Pack of Ten Charms .,20Dresses,http://dl.flipkart.com/dl/20dresses-teardrop-hair-accessory-set/p/itme9jerzjftnbfw?pid=HACE9JERSDKRW88K&affid=siddarthk,http://img.fkcdn.com/image/hair-accessory/8/8/k/ha0480-10-20dresses-hair-accessory-set-teardrop-200x200-imae9j6ebavrfhjk.jpeg,Health and Beauty>Hair Care>Hair Care Accessories>Hair Accessories,295.0,295.0,295.0,true,HACE9JERSDKRW88K,HACE9JERSDKRW88K
Flipkart,,20Dresses Snowflakes Falling On Hearts Hair Accessory Set(Gold),Hairpins are the easiest way to accessorise your hair without overdoing it and with cute ones like these you definitely don?t need anything else. . Accessorize with: Any pastel coloured dresses strappy flats and an envelope sling to complete the look. Set of Two pairs of Metal Hairpins . Studded with pearls and zircons. Heart Flower and Snowflake detailing on the hairpins.,20Dresses,http://dl.flipkart.com/dl/20dresses-snowflakes-falling-hearts-hair-accessory-set/p/itme77hwjmwy9vhq?pid=HACE77HWYB4GYQFY&affid=siddarthk,http://img.fkcdn.com/image/hair-accessory/q/f/y/ha0457-4-20dresses-hair-accessory-set-snowflakes-falling-on-200x200-imae77p9asszy5e5.jpeg,Health and Beauty>Hair Care>Hair Care Accessories>Hair Accessories,445.0,445.0,445.0,false,HACE77HWYB4GYQFY,HACE77HWYB4GYQFY
Flipkart,,"20Dresses Black Stoned Beauty Hair Band(Black, Gold)",A fabulous piece of hair accessory that would go on any and every outfit. . Accessorize with: A pair of cigarette pants a sheer nude georgette blouse with black block heels and a classic laptop bag will give you the perfect office chic look. Multiple metal encased black stone hairband. Elastic at back for ease of comfort.,20Dresses,http://dl.flipkart.com/dl/20dresses-black-stoned-beauty-hair-band/p/itme4qfkarprcesy?pid=HACE4QFKAGZWXDGH&affid=siddarthk,http://img.fkcdn.com/image/hair-accessory/d/g/h/ha0355-1-20dresses-hair-band-black-stoned-beauty-200x200-imae4kg5yktn8gqg.jpeg,Health and Beauty>Hair Care>Hair Care Accessories>Hair Accessories,295.0,295.0,295.0,false,HACE4QFKAGZWXDGH,HACE4QFKAGZWXDGH
Flipkart,,20Dresses Blinging Hair Accessory Set(Silver),When you add a little something blingy to your hair it instantly shines and these hair charms are all you need to add that touch. . Accessorize with: Wear a pastel coloured evening gown with heels and stun the crowd at a cocktail night. Oval Shaped Diamonds Hair Charms. A Pack of Ten Charms .,20Dresses,http://dl.flipkart.com/dl/20dresses-blinging-hair-accessory-set/p/itme9jeruvezf7zb?pid=HACE9JER5RKJG4VP&affid=siddarthk,http://img.fkcdn.com/image/hair-accessory/4/v/p/ha0482-10-20dresses-hair-accessory-set-blinging-200x200-imae9j6eh6gykdya.jpeg,Health and Beauty>Hair Care>Hair Care Accessories>Hair Accessories,295.0,295.0,295.0,false,HACE9JER5RKJG4VP,HACE9JER5RKJG4VP
Flipkart,,"20Dresses Pretty In Pink Pearl Bow Hair Band(Pink, White)",I love delicate feminine hairbands that give you a subtle dressy touch to your look . Accessorize with: A floral printed maxi dress pair of strappy flats and a messenger sling. Ribbon encased metal hairband with pearl encased bow detailing on the side. .,20Dresses,http://dl.flipkart.com/dl/20dresses-pretty-pink-pearl-bow-hair-band/p/itme4qfktzfafpzx?pid=HACE4QFKG6QDVZAP&affid=siddarthk,http://img.fkcdn.com/image/hair-accessory/z/a/p/ha0360-1-20dresses-hair-band-pretty-in-pink-pearl-bow-200x200-imae4q6jxuehrfjh.jpeg,Health and Beauty>Hair Care>Hair Care Accessories>Hair Accessories,245.0,245.0,245.0,true,HACE4QFKG6QDVZAP,HACE4QFKG6QDVZAP
Flipkart,,"20Dresses Go Classic Hair Band(Grey, Black, White)",I love this gorgeous hairband that is perfect to style and yet stay sleek throughout the day! Grey pearl hairband. Elastic at back for ease and fastening.,20Dresses,http://dl.flipkart.com/dl/20dresses-go-classic-hair-band/p/itmec88pxh2x7yhp?pid=HACEC88P2ECWWFGM&affid=siddarthk,http://img.fkcdn.com/image/hair-accessory/f/g/m/ha0520-3-20dresses-hair-band-go-classic-200x200-imaebzzj8d2ees42.jpeg,Health and Beauty>Hair Care>Hair Care Accessories>Hair Accessories,399.0,399.0,399.0,false,HACEC88P2ECWWFGM,HACEC88P2ECWWFGM
Flipkart,,20Dresses In a Flash Hair Accessory Set(Gold),I love this stunning hairpin set that is so chic and adorable and instantly adds a feminine touch to your look. . Accessorize with: Tie your hair in a nice low messy bun along with this hairband. Wear a solid coloured skater dress and high heels to complete this gorgeous feminine look. Set of Two pairs of Metal Hairpins . Studded with zircons. Cross and Lightning detailing on the hairpin.,20Dresses,http://dl.flipkart.com/dl/20dresses-flash-hair-accessory-set/p/itme77hwhkkhtbpq?pid=HACE77HWPCVNYEFT&affid=siddarthk,http://img.fkcdn.com/image/hair-accessory/e/f/t/ha0473-4-20dresses-hair-accessory-set-in-a-flash-200x200-imae77gt9wkbeerc.jpeg,Health and Beauty>Hair Care>Hair Care Accessories>Hair Accessories,395.0,395.0,395.0,false,HACE77HWPCVNYEFT,HACE77HWPCVNYEFT
Flipkart,,20Dresses Twinkling Pearls Hair Chain(Gold),Head Chains Are New Trend That Has Raptured The Celebs As Well. A Perfect Accessory To Dress Up Your Tresses And Still Keep It Casual And Chic I Highly Recommend This For Your Next Vacation Or Beach Party. Accessorize With: A Printed Maxi Dress With Open Flats And A Bangle Set. Keep The Make Up Subtle And Look Your Boho Best! Headchain With Flat Round Charms And Pearls. Elastic At Back For Ease And Fastening.,20Dresses,http://dl.flipkart.com/dl/20dresses-twinkling-pearls-hair-chain/p/itme7f79e8cfjcsv?pid=HACE7F79ERSBANXQ&affid=siddarthk,http://img.fkcdn.com/image/hair-accessory/n/x/q/ha0386-1-20dresses-hair-chain-twinkling-pearls-200x200-imae6xfegyh748jj.jpeg,Health and Beauty>Hair Care>Hair Care Accessories>Hair Accessories,595.0,595.0,595.0,true,HACE7F79ERSBANXQ,HACE7F79ERSBANXQ
Flipkart,,"20Dresses Scattered Stars In The Night Hair Band(Gold, Black)",I love girly hairbands that can be worn over any casuals to add a touch of dressy.. Accessorize with: Any printed dress with a pair of strappy sandals and a messenger sling will complete this dressy casual look. Ribbon encased metal hairband with zircons encased in three metal stars. .,20Dresses,http://dl.flipkart.com/dl/20dresses-scattered-stars-night-hair-band/p/itme6x3y2hvnqhcy?pid=HACE6X3YZ68CX2BK&affid=siddarthk,http://img.fkcdn.com/image/hair-accessory/2/b/k/ha0390-1-20dresses-hair-band-scattered-stars-in-the-night-200x200-imae6xwz6y8svjxj.jpeg,Health and Beauty>Hair Care>Hair Care Accessories>Hair Accessories,345.0,345.0,345.0,true,HACE6X3YZ68CX2BK,HACE6X3YZ68CX2BK
Flipkart,,20Dresses The Big Bright Flower Hair Clip(Gold),Look your prettiest with this stunning feminine haircomb which will be all the accessory you need for a brunch date with the girls.. Accessorize with: A Lace maxi dress and a pair of metallic wedges with a bunch of bracelets in your hand and you're ready for a date with your girls.,20Dresses,http://dl.flipkart.com/dl/20dresses-big-bright-flower-hair-clip/p/itme7dfhc76bfuqg?pid=HACE7DFH3BZSY8PK&affid=siddarthk,http://img.fkcdn.com/image/hair-accessory/8/p/k/ha0452-1-20dresses-hair-clip-the-big-bright-flower-200x200-imae7djdatjn8rev.jpeg,Health and Beauty>Hair Care>Hair Care Accessories>Hair Accessories,395.0,395.0,395.0,true,HACE7DFH3BZSY8PK,HACE7DFH3BZSY8PK
Flipkart,,"20Dresses Of The Ocean Hair Chain(Gold, White)",Head chains are new trend that has raptured the celebs as well. A perfect accessory to dress up your tresses and still keep it casual and chic I highly recommend this for your next vacation or beach party. Accessorize with: A floral printed maxi dress with open flats and a bangle set. Keep the make up subtle and look your boho best! Headchain with pearls . Lobster Clamp for fastening .,20Dresses,http://dl.flipkart.com/dl/20dresses-ocean-hair-chain/p/itme9jerxev34szn?pid=HACE9JERZCVMQVVS&affid=siddarthk,http://img.fkcdn.com/image/hair-accessory/v/v/s/ha0476-1-20dresses-hair-chain-of-the-ocean-200x200-imae9j6escygnzag.jpeg,Health and Beauty>Hair Care>Hair Care Accessories>Hair Accessories,395.0,395.0,395.0,false,HACE9JERZCVMQVVS,HACE9JERZCVMQVVS
Flipkart,,"20Dresses Embedded in Stone Hair Band(Gold, Black)",This unique beautiful hairband will stand out with anything you wear. . Accessorize with: A full length solid coloured gown with a pair of gold heels and a shimmer gold clutch will get you ready for a cocktail evening. Metal hairband with zircons and stone encased metal flower detailing. .,20Dresses,http://dl.flipkart.com/dl/20dresses-embedded-stone-hair-band/p/itme4qfkwapyxtz9?pid=HACE4QFKJYC4FZWZ&affid=siddarthk,http://img.fkcdn.com/image/hair-accessory/z/w/z/ha0366-1-20dresses-hair-band-embedded-in-stone-200x200-imae4kg5txh32svv.jpeg,Health and Beauty>Hair Care>Hair Care Accessories>Hair Accessories,345.0,345.0,345.0,true,HACE4QFKJYC4FZWZ,HACE4QFKJYC4FZWZ
Flipkart,,"20Dresses Chained to you Duo Hair Band(Silver, Gold)",A stunning hair accessory that will complete your night out look without the need to over accessorise.. Accessorize with: A jewel toned skater dress with a pair of gold/silver heels and a gold/silver watch. Add a gold/silver sling to complete the ready to party look. Duo of metal beads hidden hairbands. Elastic at back for ease of comfort.,20Dresses,http://dl.flipkart.com/dl/20dresses-chained-you-duo-hair-band/p/itme4qfkskcqve5n?pid=HACE4QFKVV62R7CG&affid=siddarthk,http://img.fkcdn.com/image/hair-accessory/7/c/g/ha0349-1-20dresses-hair-band-chained-to-you-duo-200x200-imae4kg5cmzgyg2z.jpeg,Health and Beauty>Hair Care>Hair Care Accessories>Hair Accessories,295.0,295.0,295.0,false,HACE4QFKVV62R7CG,HACE4QFKVV62R7CG
Flipkart,,20Dresses Blooming in The Snow Hair Accessory Set(Gold),I love this stunning hairpin set that is so chic and adorable and instantly adds a feminine touch to your look. . Accessorize with: Wear this with all your casuals and strappy flats to get a clean casual look! Set of Three pairs of Metal Hairpins . Studded with pearls. Flowers and snowflake detailing on the hairpins.,20Dresses,http://dl.flipkart.com/dl/20dresses-blooming-snow-hair-accessory-set/p/itme77hwdxazm5xs?pid=HACE77HWZXHHMCJY&affid=siddarthk,http://img.fkcdn.com/image/hair-accessory/c/j/y/ha0468-6-20dresses-hair-accessory-set-blooming-in-the-snow-200x200-imae77gtzyzbk4hj.jpeg,Health and Beauty>Hair Care>Hair Care Accessories>Hair Accessories,395.0,395.0,395.0,false,HACE77HWZXHHMCJY,HACE77HWZXHHMCJY
Flipkart,,20Dresses Bohemian Tribes Hair Chain(Silver),Channel the inner boho in you with this gorgeous head chain that is perfect for a beach party! Antique finish silver headchain with charms. Elastic at back for ease and fastening.,20Dresses,http://dl.flipkart.com/dl/20dresses-bohemian-tribes-hair-chain/p/itmec88pemz36kkr?pid=HACEC88PZQJK95FE&affid=siddarthk,http://img.fkcdn.com/image/hair-accessory/5/f/e/ha0507-1-20dresses-hair-chain-bohemian-tribes-200x200-imaebzzjyzsusg2n.jpeg,Health and Beauty>Hair Care>Hair Care Accessories>Hair Accessories,399.0,399.0,399.0,true,HACEC88PZQJK95FE,HACEC88PZQJK95FE
Flipkart,,"20Dresses Braided in Bow Hair Band(Blue, White)",I love girly hairbands that can be worn over any casuals to add a touch of dressy.. Accessorize with: A solid coloured top with a pair of denims and some slip on sneakers. Braided fabric stuck on metal with a big blue bow on the side for detailing. .,20Dresses,http://dl.flipkart.com/dl/20dresses-braided-bow-hair-band/p/itme4qfkenvzwvgg?pid=HACE4QFKHZTU5GHH&affid=siddarthk,http://img.fkcdn.com/image/hair-accessory/g/h/h/ha0367-1-20dresses-hair-band-braided-in-bow-200x200-imae4pxzgxsazytk.jpeg,Health and Beauty>Hair Care>Hair Care Accessories>Hair Accessories,245.0,245.0,245.0,false,HACE4QFKHZTU5GHH,HACE4QFKHZTU5GHH
Flipkart,,20Dresses Delicate Leaves Hair Band(Gold),I love this gorgeous hairband that is perfect to style and yet stay sleek throughout the day! Metal leaf filigree hairband. Elastic at back for ease and fastening.,20Dresses,http://dl.flipkart.com/dl/20dresses-delicate-leaves-hair-band/p/itmec88pd7nfrngt?pid=HACEC88PCCKFUFMC&affid=siddarthk,http://img.fkcdn.com/image/hair-accessory/f/m/c/ha0519-1-20dresses-hair-band-delicate-leaves-200x200-imaebzzj34ggc7cw.jpeg,Health and Beauty>Hair Care>Hair Care Accessories>Hair Accessories,399.0,399.0,399.0,false,HACEC88PCCKFUFMC,HACEC88PCCKFUFMC
Flipkart,,20Dresses Roses Galore Hair Band(Gold),I love this gorgeous hairband that is perfect to style and yet stay sleek throughout the day! Silver rose filigree hairband. Elastic at back for ease and fastening.,20Dresses,http://dl.flipkart.com/dl/20dresses-roses-galore-hair-band/p/itmec88pdz2qcbwj?pid=HACEC88P5FU8XJTZ&affid=siddarthk,http://img.fkcdn.com/image/hair-accessory/j/t/z/ha0523-1-20dresses-hair-band-roses-galore-200x200-imaebzzjf5gfyzdf.jpeg,Health and Beauty>Hair Care>Hair Care Accessories>Hair Accessories,399.0,399.0,399.0,true,HACEC88P5FU8XJTZ,HACEC88P5FU8XJTZ
