PartnerName,Id,Title,Description,Brand,Link,ImageLink,CategoryName,Mrp,OfferPrice,EffectivePrice,Availability,PartnerIdFromUrl,PartnerIdFromDb
Flipkart,,Pramsh Premium Quality Brahmi Powder 400gm(400 g),"Pramsh Brahmi Powder is a traditional remedy that is known to make hair thicker and nourished. Pramsh Brahmi Powder can be used to make nourishing hair packs , general debility(weakness), fever, asthama, bronchitis, skin disease, leprosy, leucoderma, increase memory, insanity, biliousness, neuralgia, epilepsy, amentia, tumours, ulcers, splenomegaly, dyspepsia, flatulence, sterility, elephantiasis, syphilis, hoarseness, strangury, dymenorrhoea etc. Hair CareBoil required quantity of Pramsh Brahmi Powder in water. Let it stand overnight. Strain in morning and use as after wash.",Pramsh,http://dl.flipkart.com/dl/pramsh-premium-quality-brahmi-powder-400gm/p/itmez6ysjs22samz?pid=HTTEZ6YSYAYXSRHC&affid=siddarthk,http://img.fkcdn.com/image/hair-treatment/8/k/z/pramsh-500-premium-quality-brahmi-powder-500gm-200x200-imaez6zhqjtxvxng.jpeg,Health and Beauty>Hair Care>Hair Treatments,1000.0,445.0,495.0,true,HTTEZ6YSYAYXSRHC,HTTEZ6YSYAYXSRHC
Flipkart,,Pramsh Premium Quality Brahmi Powder 700gm(700 g),"Pramsh Brahmi Powder is a traditional remedy that is known to make hair thicker and nourished. Pramsh Brahmi Powder can be used to make nourishing hair packs , general debility(weakness), fever, asthama, bronchitis, skin disease, leprosy, leucoderma, increase memory, insanity, biliousness, neuralgia, epilepsy, amentia, tumours, ulcers, splenomegaly, dyspepsia, flatulence, sterility, elephantiasis, syphilis, hoarseness, strangury, dymenorrhoea etc. Hair CareBoil required quantity of Pramsh Brahmi Powder in water. Let it stand overnight. Strain in morning and use as after wash.",Pramsh,http://dl.flipkart.com/dl/pramsh-premium-quality-brahmi-powder-700gm/p/itmez763rs8zfpgt?pid=HTTEZ763JF7ADVGR&affid=siddarthk,http://img.fkcdn.com/image/hair-treatment/y/9/3/pramsh-900-premium-quality-brahmi-powder-900gm-200x200-imaez6zhqjtxvxng.jpeg,Health and Beauty>Hair Care>Hair Treatments,1400.0,715.0,795.0,true,HTTEZ763JF7ADVGR,HTTEZ763JF7ADVGR
Flipkart,,Pramsh Premium Quality Brahmi Powder 200gm(200 g),"Pramsh Brahmi Powder is a traditional remedy that is known to make hair thicker and nourished. Pramsh Brahmi Powder can be used to make nourishing hair packs , general debility(weakness), fever, asthama, bronchitis, skin disease, leprosy, leucoderma, increase memory, insanity, biliousness, neuralgia, epilepsy, amentia, tumours, ulcers, splenomegaly, dyspepsia, flatulence, sterility, elephantiasis, syphilis, hoarseness, strangury, dymenorrhoea etc. Hair CareBoil required quantity of Pramsh Brahmi Powder in water. Let it stand overnight. Strain in morning and use as after wash.",Pramsh,http://dl.flipkart.com/dl/pramsh-premium-quality-brahmi-powder-200gm/p/itmez6vhxqsrj6h9?pid=HTTEZ6VHVWKH4JHC&affid=siddarthk,http://img.fkcdn.com/image/hair-treatment/y/9/3/pramsh-900-premium-quality-brahmi-powder-900gm-200x200-imaez6zhqjtxvxng.jpeg,Health and Beauty>Hair Care>Hair Treatments,700.0,247.0,275.0,true,HTTEZ6VHVWKH4JHC,HTTEZ6VHVWKH4JHC
Flipkart,,Pramsh Premium Quality Brahmi Powder 800gm(800 g),"Pramsh Brahmi Powder is a traditional remedy that is known to make hair thicker and nourished. Pramsh Brahmi Powder can be used to make nourishing hair packs , general debility(weakness), fever, asthama, bronchitis, skin disease, leprosy, leucoderma, increase memory, insanity, biliousness, neuralgia, epilepsy, amentia, tumours, ulcers, splenomegaly, dyspepsia, flatulence, sterility, elephantiasis, syphilis, hoarseness, strangury, dymenorrhoea etc. Hair CareBoil required quantity of Pramsh Brahmi Powder in water. Let it stand overnight. Strain in morning and use as after wash.",Pramsh,http://dl.flipkart.com/dl/pramsh-premium-quality-brahmi-powder-800gm/p/itmez763h5xgvghy?pid=HTTEZ763D9MFA35D&affid=siddarthk,http://img.fkcdn.com/image/hair-treatment/y/9/3/pramsh-900-premium-quality-brahmi-powder-900gm-200x200-imaez6zhqjtxvxng.jpeg,Health and Beauty>Hair Care>Hair Treatments,1600.0,805.0,895.0,true,HTTEZ763D9MFA35D,HTTEZ763D9MFA35D
Flipkart,,Pramsh Premium Quality Brahmi Powder 900gm(900 g),"Pramsh Brahmi Powder is a traditional remedy that is known to make hair thicker and nourished. Pramsh Brahmi Powder can be used to make nourishing hair packs , general debility(weakness), fever, asthama, bronchitis, skin disease, leprosy, leucoderma, increase memory, insanity, biliousness, neuralgia, epilepsy, amentia, tumours, ulcers, splenomegaly, dyspepsia, flatulence, sterility, elephantiasis, syphilis, hoarseness, strangury, dymenorrhoea etc. Hair CareBoil required quantity of Pramsh Brahmi Powder in water. Let it stand overnight. Strain in morning and use as after wash",Pramsh,http://dl.flipkart.com/dl/pramsh-premium-quality-brahmi-powder-900gm/p/itmez763cpz2qbwf?pid=HTTEZ763FZSGFY93&affid=siddarthk,http://img.fkcdn.com/image/hair-treatment/y/9/3/pramsh-900-premium-quality-brahmi-powder-900gm-200x200-imaez6zhqjtxvxng.jpeg,Health and Beauty>Hair Care>Hair Treatments,2000.0,895.0,995.0,true,HTTEZ763FZSGFY93,HTTEZ763FZSGFY93
Flipkart,,Pramsh Premium Quality Brahmi Powder 500gm(500 g),,Pramsh,http://dl.flipkart.com/dl/pramsh-premium-quality-brahmi-powder-500gm/p/itmez7yeusfkrzgq?pid=HTTEZ7YETRG8B8KZ&affid=siddarthk,http://img.fkcdn.com/image/hair-treatment/8/k/z/pramsh-500-premium-quality-brahmi-powder-500gm-200x200-imaez6zhqjtxvxng.jpeg,Health and Beauty>Hair Care>Hair Treatments,1200.0,535.0,595.0,true,HTTEZ7YETRG8B8KZ,HTTEZ7YETRG8B8KZ
Flipkart,,Pramsh Premium Quality Brahmi Powder 100gm(100 g),"Pramsh Brahmi Powder is a traditional remedy that is known to make hair thicker and nourished. Pramsh Brahmi Powder can be used to make nourishing hair packs , general debility(weakness), fever, asthama, bronchitis, skin disease, leprosy, leucoderma, increase memory, insanity, biliousness, neuralgia, epilepsy, amentia, tumours, ulcers, splenomegaly, dyspepsia, flatulence, sterility, elephantiasis, syphilis, hoarseness, strangury, dymenorrhoea etc. Hair CareBoil required quantity of Pramsh Brahmi Powder in water. Let it stand overnight. Strain in morning and use as after wash.",Pramsh,http://dl.flipkart.com/dl/pramsh-premium-quality-brahmi-powder-100gm/p/itmez6vdzyp4wpyh?pid=HTTEZ6VAKKYFJSX9&affid=siddarthk,http://img.fkcdn.com/image/hair-treatment/8/k/z/pramsh-500-premium-quality-brahmi-powder-500gm-200x200-imaez6zhqjtxvxng.jpeg,Health and Beauty>Hair Care>Hair Treatments,500.0,175.0,195.0,true,HTTEZ6VAKKYFJSX9,HTTEZ6VAKKYFJSX9
Flipkart,,Pramsh Premium Quality Brahmi Powder 300gm(300 g),"Pramsh Brahmi Powder is a traditional remedy that is known to make hair thicker and nourished. Pramsh Brahmi Powder can be used to make nourishing hair packs , general debility(weakness), fever, asthama, bronchitis, skin disease, leprosy, leucoderma, increase memory, insanity, biliousness, neuralgia, epilepsy, amentia, tumours, ulcers, splenomegaly, dyspepsia, flatulence, sterility, elephantiasis, syphilis, hoarseness, strangury, dymenorrhoea etc. Hair CareBoil required quantity of Pramsh Brahmi Powder in water. Let it stand overnight. Strain in morning and use as after wash.",Pramsh,http://dl.flipkart.com/dl/pramsh-premium-quality-brahmi-powder-300gm/p/itmez6yrvkct6sax?pid=HTTEZ6YRZPZFPJFA&affid=siddarthk,http://img.fkcdn.com/image/hair-treatment/8/k/z/pramsh-500-premium-quality-brahmi-powder-500gm-200x200-imaez6zhqjtxvxng.jpeg,Health and Beauty>Hair Care>Hair Treatments,900.0,346.0,385.0,true,HTTEZ6YRZPZFPJFA,HTTEZ6YRZPZFPJFA
Flipkart,,Peter Thomas Roth Hair To Die For Hair Treatment(50 ml),"A powerful, revolutionary & concentrated hair treatment With a lightweight texture that dissolves rapidly into scalp Contains unique Tri-Phase ComplexTM that targets all three stages of the hair growth cycle Helps retain, activate & maintain hair growth cycle Unveils denser, thicker, fuller & stronger hair Great for thinning, lifeless, damaged hair due to age, over-processing, hormonal changes, stress etc",Peter Thomas Roth,http://dl.flipkart.com/dl/peter-thomas-roth-hair-die-treatment/p/itmens7tamenu2eb?pid=HTTENS7TFVKXT9XM&affid=siddarthk,http://img.fkcdn.com/image/hair-treatment/9/x/m/peter-thomas-roth-50-hair-to-die-for-hair-treatment-200x200-imaensb6evpsthjz.jpeg,Health and Beauty>Hair Care>Hair Treatments,5127.0,4548.0,4548.0,true,HTTENS7TFVKXT9XM,HTTENS7TFVKXT9XM
Flipkart,,"Nioxin System 3 Scalp Treatment For Fine Hair, Chemically Treated, Normal to Thin-Looking Hair(100 ml)","A daily leave-in scalp treatment Delivers essential botanical, nutrients, antioxidants & vitamins Safeguards against residues & DHT build up on scalp Creates & maintains a healthy scalp environment Helps improve appearance of thinning hair",Nioxin,http://dl.flipkart.com/dl/nioxin-system-3-scalp-treatment-fine-hair-chemically-treated-normal-thin-looking-hair/p/itmens7tjjjgkqph?pid=HTTENS7QQB5MZSUK&affid=siddarthk,http://img.fkcdn.com/image/hair-treatment/s/u/k/nioxin-100-system-3-scalp-treatment-for-fine-hair-chemically-200x200-imaensb6nejhfqb2.jpeg,Health and Beauty>Hair Care>Hair Treatments,2168.0,2168.0,2168.0,true,HTTENS7QQB5MZSUK,HTTENS7QQB5MZSUK
Flipkart,,Redken Blonde Idol Custom-Tone Adjustable Color-Depositing Daily Treatment (For Warm or Golden Blondes)(196 ml),"A dual-chamber color depositing daily treatment Releases a custom calibrated blend of color-depositing & conditioning formulas Deeply conditions, strengthens & maintains tonality between salon visits Unveils shinier & healthier looking hair with brilliant color Great for warm or golden blondes",Redken,http://dl.flipkart.com/dl/redken-blonde-idol-custom-tone-adjustable-color-depositing-daily-treatment-for-warm-golden-blondes/p/itmens7thhtpvhm8?pid=HTTENS7TBVJCVUZH&affid=siddarthk,http://img.fkcdn.com/image/hair-treatment/u/z/h/redken-196-blonde-idol-custom-tone-adjustable-color-depositing-200x200-imaensb5gkwnhubb.jpeg,Health and Beauty>Hair Care>Hair Treatments,3934.0,3783.0,3783.0,false,HTTENS7TBVJCVUZH,HTTENS7TBVJCVUZH
Flipkart,,"Joico K-Pak Intense Hydrator Treatment - For Dry, Damaged Hair (New Packaging)(250 ml)","Extremely hydrating treatment with pH 3.5 for overly dry, damaged hair Re-structures hair with exclusive Keratin Silicone Complex Penetrates deeply to seal the cuticle Increases elasticity, strength & luminosity Leaves hair silky smooth, manageable & healthy",Joico,http://dl.flipkart.com/dl/joico-k-pak-intense-hydrator-treatment-dry-damaged-hair-new-packaging/p/itmens7tyarsgtmv?pid=HTTENS7TBNGZMK4J&affid=siddarthk,http://img.fkcdn.com/image/hair-treatment/k/4/j/joico-250-k-pak-intense-hydrator-treatment-for-dry-damaged-hair-200x200-imaensb6gwkejj5h.jpeg,Health and Beauty>Hair Care>Hair Treatments,9999.0,9999.0,9999.0,false,HTTENS7TBNGZMK4J,HTTENS7TBNGZMK4J
Flipkart,,Therapy-g Conditioning Treatment Step 3 (For Thinning or Fine Hair)(250 ml),"A lightweight detangling & protecting conditioner Delivers Tryptobond GuardTM to each hair shaft to soothe dryness, flaking & itching Shields hair from sun's UV damage, breakage, color & tonality changes Contains proteins, vitamins & botanical ingredients that deeply hydrate & instantly detangle hair Allows for easier styling of hair Hair appears fuller, thicker, smoother, shiner, more manageable & healthier looking Ideal for fine or thinning hair",Therapy-g,http://dl.flipkart.com/dl/therapy-g-conditioning-treatment-step-3-for-thinning-fine-hair/p/itmens7ttbegavhv?pid=HTTENS7TGENGKYGF&affid=siddarthk,http://img.fkcdn.com/image/hair-treatment/y/g/f/therapy-g-250-conditioning-treatment-step-3-for-thinning-or-fine-200x200-imaensb6hzyhht6f.jpeg,Health and Beauty>Hair Care>Hair Treatments,1635.0,1403.0,1403.0,true,HTTENS7TGENGKYGF,HTTENS7TGENGKYGF
Flipkart,,Schwarzkopf BC Smooth Perfect Treatment (For Unmanageable Hair)(200 ml),"An intensive smoothing & taming treatment for unruly hair Formulated with Cationic Polymers to neutralize the negative charges on hair surface Effectively regulates unruly hair while improving combability Contains Shine Enhancing Components that enable IPS-Complex to deliver high gloss Loaded with Panthenol to provide essential moisture Developed with Amino Cell Rebuild Technology to repair hair's inner cell structure Shields hair from humidity during the smoothing process Hair appears suppler, sleeker, more manageable & healthier looking",Schwarzkopf,http://dl.flipkart.com/dl/schwarzkopf-bc-smooth-perfect-treatment-for-unmanageable-hair/p/itmens7tzm37tpha?pid=HTTENS7QHX7U5CRZ&affid=siddarthk,http://img.fkcdn.com/image/hair-treatment/c/r/z/schwarzkopf-200-bc-smooth-perfect-treatment-for-unmanageable-200x200-imaensb68zk2q3k5.jpeg,Health and Beauty>Hair Care>Hair Treatments,2122.0,1445.0,1445.0,true,HTTENS7QHX7U5CRZ,HTTENS7QHX7U5CRZ
Flipkart,,"Hempz Couture Oil Treatment (For Strong, Smooth, Shiny Hair)(100 ml)","A hydrating & conditioning oil treatment Features an anti-fade, paraben-free, gluten-free, vegan formula Instantly penetrates into hair without leaving an oily residue Contains Pure Natural Hemp Seed Oil to promote keratin formation Improves the health & strength of hair Offers long term conditioning, seals split ends & controls frizz Protects hair against thermal heat damage & UV exposure Scented with exotic Green Tea Leaves hair sleek, moist, lustrous & manageable Perfect for all hair types",Hempz,http://dl.flipkart.com/dl/hempz-couture-oil-treatment-for-strong-smooth-shiny-hair/p/itmens7tzmbbhq6w?pid=HTTENS7TKNZ7ZTAV&affid=siddarthk,http://img.fkcdn.com/image/hair-treatment/t/a/v/hempz-100-couture-oil-treatment-for-strong-smooth-shiny-hair-200x200-imaensb7zwahfee7.jpeg,Health and Beauty>Hair Care>Hair Treatments,3094.0,1785.0,1785.0,true,HTTENS7TKNZ7ZTAV,HTTENS7TKNZ7ZTAV
Flipkart,,"Kerastase Discipline Maskeratine Smooth-in-Motion Masque - High Concentration (For Unruly, Rebellious Hair)(500 ml)","A smoothing mask for unruly, unmanageable hair Developed with Morpho-Keratine Technology that tames frizz & protects against humidity Contains lipid agents to smooth hair & provide frizz protection Loaded with optimized starch for maximum anti-frizz action Facilitates the optimum blow dry & reduces drying time Hair appears softer, nourished, more manageable & free-flowing To use: Apply a moderate amount to wet hair & work through mid-lengths & ends. Massage through. Leave on for 5-10 minutes & rinse thoroughly",Kerastase,http://dl.flipkart.com/dl/kerastase-discipline-maskeratine-smooth-in-motion-masque-high-concentration-for-unruly-rebellious-hair/p/itmens7td6rhhgbr?pid=HTTENS7TYHVFAHKW&affid=siddarthk,http://img.fkcdn.com/image/hair-treatment/h/k/w/kerastase-500-discipline-maskeratine-smooth-in-motion-masque-200x200-imaensb72s5cfdjp.jpeg,Health and Beauty>Hair Care>Hair Treatments,9999.0,9999.0,9999.0,false,HTTENS7TYHVFAHKW,HTTENS7TYHVFAHKW
Flipkart,,Therapy-g Hair Volumizing Treatment (For Thinning or Fine Hair)(500 ml),"An efficacious treatment for thinning or fine hair Developed with a complex of proteins, vitamins & botanicals Imparts Tryptobond Guard to individual shafts of hair Helps shield hair from sun exposure damage including breakage, styling stress & color changes Reinforces & hydrates hair shaft & corrects hair texture Unveils thicker, fuller & more resilient hair To use: Apply onto towel dried hair. Leave on, style as desired",Therapy-g,http://dl.flipkart.com/dl/therapy-g-hair-volumizing-treatment-for-thinning-fine-hair/p/itmens7twhhgha6c?pid=HTTENS7TBGHSG9NR&affid=siddarthk,http://img.fkcdn.com/image/hair-treatment/9/n/r/therapy-g-500-hair-volumizing-treatment-for-thinning-or-fine-200x200-imaensb6ephmawfa.jpeg,Health and Beauty>Hair Care>Hair Treatments,4641.0,3910.0,3910.0,true,HTTENS7TBGHSG9NR,HTTENS7TBGHSG9NR
Flipkart,,"Alterna Bamboo Color Hold+ Color Protection Rehab Deep Hydration Masque (For Strong, Vibrant, Color Protected Hair)(500 ml)",A color preserving treatment mask Contains strengthening Organic Bamboo Extract & color locking Organic Kalahari Melon Developed with wash-resistant Color Hold UV+ technology for the highest level of color protection Replenishes hair with essential moisture & vital nutrients Hair appears stronger & healthier with vibrant color Sulfate- & sodium chloride-free,Alterna,http://dl.flipkart.com/dl/alterna-bamboo-color-hold-protection-rehab-deep-hydration-masque-for-strong-vibrant-protected-hair/p/itmens7txqdvtzux?pid=HTTENS7TWH8FJCMZ&affid=siddarthk,http://img.fkcdn.com/image/hair-treatment/c/m/z/alterna-500-bamboo-color-hold-color-protection-rehab-deep-200x200-imaensb7gprnm5ad.jpeg,Health and Beauty>Hair Care>Hair Treatments,6895.0,6545.0,6545.0,true,HTTENS7TWH8FJCMZ,HTTENS7TWH8FJCMZ
Flipkart,,Rahua Omega 9 Hair Mask(200 ml),"An intensive treatment to revive damaged, dull hair Provides salon type, powerful hair care at home Ungurahua oil, rich in omega-9, penetrates deeply to hair shaft Effectively heals & fortifies weakened hair with moisture Quinoa protein adds strength Lavender & eucalyptus give calming aromatherapy for relaxation Maintains color brilliance & leaves hair sleek, healthy",Rahua,http://dl.flipkart.com/dl/rahua-omega-9-hair-mask/p/itmens7tt5zqac9r?pid=HTTENS7TH8MGJ32J&affid=siddarthk,http://img.fkcdn.com/image/hair-treatment/3/2/j/rahua-200-omega-9-hair-mask-200x200-imaensb6uybxzuhd.jpeg,Health and Beauty>Hair Care>Hair Treatments,4973.0,4973.0,4973.0,true,HTTENS7TH8MGJ32J,HTTENS7TH8MGJ32J
Flipkart,,AlfaParf Lisse Design Keratin Therapy Silver Smoothing Fluid (For Blonde / Highlighted Hair)(500 ml),"A smoothing treatment for blonde/highlighted hair with cold tones & natural gray/white hair Prevents hair from yellowing due to use of high temperature straightening irons Contains Kera-Collagen Complex featuring Hydrolyzed Keratin Complex & quaternized Collagen Helps re-arrange the chains of hair keratin using thermal styling Should be used in step 2 of the Lisse Design Service instead of ""regular"" Smoothing Fluid Hair appears sleeker & more manageable with vibrant color For professional use only",AlfaParf,http://dl.flipkart.com/dl/alfaparf-lisse-design-keratin-therapy-silver-smoothing-fluid-for-blonde-highlighted-hair/p/itmens7tw49jfhvz?pid=HTTENS7QFZU75WCG&affid=siddarthk,http://img.fkcdn.com/image/hair-treatment/w/c/g/alfaparf-500-lisse-design-keratin-therapy-silver-smoothing-fluid-200x200-imaensb6sjckyvcm.jpeg,Health and Beauty>Hair Care>Hair Treatments,23868.0,22228.0,22228.0,true,HTTENS7QFZU75WCG,HTTENS7QFZU75WCG
Flipkart,,"Kerastase Fusio-Dose Booster Reconstruction Reinforcing Booster (Damaged, Over-Processed Hair)(120 ml)","An intensive reinforcing booster for damaged, over-processed hair Boasts a powerful formula isolated in its purest & most concentrated state Contains active ingredients freshly fused to create a customized in-salon treatment Helps instantly repair & reconstruct hair in-depth Delivers visible, instant & lasting transformation in just five minutes Works together with other Concentr�s to create various personalized combinations Hair appears stronger, more vigorous & resistant to breakage",Kerastase,http://dl.flipkart.com/dl/kerastase-fusio-dose-booster-reconstruction-reinforcing-damaged-over-processed-hair/p/itmens7tanpxu9fx?pid=HTTENS7TXRUZBS7F&affid=siddarthk,http://img.fkcdn.com/image/hair-treatment/s/7/f/kerastase-120-fusio-dose-booster-reconstruction-reinforcing-200x200-imaensb7kczfw3yu.jpeg,Health and Beauty>Hair Care>Hair Treatments,5143.0,5143.0,5143.0,false,HTTENS7TXRUZBS7F,HTTENS7TXRUZBS7F
Flipkart,,Dr. Ci:Labo Herbal Treatment(230 ml),"A natural herbal hair treatment Formulated with sixteen natural herbal extracts & three organic natural herbal oils Helps repair damaged hair while boosting the tone & shine of hair Contains hyaluronic acids, collagen & amino acids to hydrate scalp after shampooing Infused with a pleasant, refreshing rose fragrance Hair appears smoother & healthier looking Free of silicone, coloring, mineral oil, paraben, alcohol & petroleum surfactants",Dr. Ci:Labo,http://dl.flipkart.com/dl/dr-ci-labo-herbal-treatment/p/itmens7tfzhvyvde?pid=HTTENS7T64Z7MZSF&affid=siddarthk,http://img.fkcdn.com/image/hair-treatment/z/s/f/dr-ci-labo-230-herbal-treatment-200x200-imaensb6wbp9mzcc.jpeg,Health and Beauty>Hair Care>Hair Treatments,1998.0,1998.0,1998.0,true,HTTENS7T64Z7MZSF,HTTENS7T64Z7MZSF
Flipkart,,Bumble and Bumble Bb. Full Potential Hair Preserving Booster Spray(125 ml),"A treatment spray for fine, thinning & weak hair Infused with unique Hair Preserve Blend to prevent hair loss or breakage Works thoroughly from hair scalp to tip Effectively improves strength & elasticity Leaves hair looking healthier & fuller",Bumble and Bumble,http://dl.flipkart.com/dl/bumble-bb-full-potential-hair-preserving-booster-spray/p/itmens7tzyfgeyzp?pid=HTTENS7TEQKBNBCW&affid=siddarthk,http://img.fkcdn.com/image/hair-treatment/b/c/w/bumble-and-bumble-125-bb-full-potential-hair-preserving-booster-200x200-imaensb6ejmfv7vw.jpeg,Health and Beauty>Hair Care>Hair Treatments,7558.0,7268.0,7268.0,true,HTTENS7TEQKBNBCW,HTTENS7TEQKBNBCW
Flipkart,,DS Laboratories Spectral R.S Breakthrough Treatment For Thinning Hair(60 ml),"An advanced hair care that stops hair from vanishing Formulated with pure, organic plant extracts, vitamins & minerals Nourishes hair & scalp to prevent future hair loss Keeps existing hair & encourage growth of new hair Clinically proven to increase hair density Incredibly combats male pattern baldness & thinning hair To use: spray directly in area of hair loss twice a day & do not rinse out",DS Laboratories,http://dl.flipkart.com/dl/ds-laboratories-spectral-r-s-breakthrough-treatment-thinning-hair/p/itmens7tyuzppune?pid=HTTENS7TPFWYG8FE&affid=siddarthk,http://img.fkcdn.com/image/hair-treatment/8/f/e/ds-laboratories-60-spectral-r-s-breakthrough-treatment-for-200x200-imaensb7dsgvdrks.jpeg,Health and Beauty>Hair Care>Hair Treatments,3359.0,2508.0,2508.0,true,HTTENS7TPFWYG8FE,HTTENS7TPFWYG8FE
Flipkart,,Fudge Make-A-Mends Conditionier (For Dry and Damaged Hair)(1000 ml),"A luxurious conditioner for dry & damaged hair Extra rich & creamy texture Deeply hydrates & nourishes hair Revives dry, coarse hair from excessive styling, chemical works & external factors Leaves hair smooth & healthy",Fudge,http://dl.flipkart.com/dl/fudge-make-a-mends-conditionier-for-dry-damaged-hair/p/itmens7t9ubcgrqg?pid=HTTENS7QGW3EBPHZ&affid=siddarthk,http://img.fkcdn.com/image/hair-treatment/p/h/z/fudge-1000-make-a-mends-conditionier-for-dry-and-damaged-hair-200x200-imaensb6qbkhye7m.jpeg,Health and Beauty>Hair Care>Hair Treatments,4995.0,4803.0,4803.0,true,HTTENS7QGW3EBPHZ,HTTENS7QGW3EBPHZ
Flipkart,,Paul Mitchell Forever Blonde Dramatic Repair (KerActive Damage Recovery)(150 ml),"A powerful repairing hair mist Features a lightweight yet intense, anti-static formula Contains KerActive protein, safflower oleosomes & macadamia nut oil Helps penetrate, repair & moisturize weakened hair Strengthens & replenishes depleted blonde hair Specifically targets the needs of lightened & highlighted hair Leaves hair soft, smooth, frizz-free & manageable To use: Shake well before use. Apply to towel-dried hair & comb through. Style as usual & no need to rinse",Paul Mitchell,http://dl.flipkart.com/dl/paul-mitchell-forever-blonde-dramatic-repair-keractive-damage-recovery/p/itmens7thaz5rc8q?pid=HTTENS7QX3646HTS&affid=siddarthk,http://img.fkcdn.com/image/hair-treatment/h/t/s/paul-mitchell-150-forever-blonde-dramatic-repair-keractive-200x200-imaensb6dx3eartb.jpeg,Health and Beauty>Hair Care>Hair Treatments,2829.0,2720.0,2720.0,true,HTTENS7QX3646HTS,HTTENS7QX3646HTS
Flipkart,,Therapy-g Follicle Stimulator (For Thinning or Fine Hair)(500 ml),"Helps accelerate blood circulation to the scalp even long after rinsing Provides each hair shaft with patented Tryptobond Guard Enhances hair's mechanical vigor & combability for lesser tangling & damage Shields hair from discoloration Its effects linger on each hair shaft & hair follicle To use: Apply to wet hair, massage for 15 seconds & leave on for 1 minute, rinse well",Therapy-g,http://dl.flipkart.com/dl/therapy-g-follicle-stimulator-for-thinning-fine-hair/p/itmens7tgghnhhhq?pid=HTTENS7QVY7N6THJ&affid=siddarthk,http://img.fkcdn.com/image/hair-treatment/t/h/j/therapy-g-500-follicle-stimulator-for-thinning-or-fine-hair-200x200-imaensb6wmbnwp5g.jpeg,Health and Beauty>Hair Care>Hair Treatments,9194.0,6205.0,6205.0,true,HTTENS7QVY7N6THJ,HTTENS7QVY7N6THJ
Flipkart,,"Agadir Argan Oil Hydrates, Conditions, Smoothes, Shine Spray Treatment (For All Hair Types)(150 ml)","A leave-in spray treatment Formulated with 100% pure & certified Argan oil Provides nourishing, sleeking, conditioning & brightening benefits Immediately repairs & boosts flexibility for dry, damaged & frizzy hair Shields hair against thermal appliances & chemical damage Creates healthier & more manageable hair Can be applied with flat irons, blow dryers & other heat appliances Recommended for longer hair for ease in coverage Ideal for all hair types",Agadir Argan Oil,http://dl.flipkart.com/dl/agadir-argan-oil-hydrates-conditions-smoothes-shine-spray-treatment-for-all-hair-types/p/itmens7tfbqh2hga?pid=HTTENS7T7YDJG6FN&affid=siddarthk,http://img.fkcdn.com/image/hair-treatment/6/f/n/agadir-argan-oil-150-hydrates-conditions-smoothes-shine-spray-200x200-imaensb6zc2nqweh.jpeg,Health and Beauty>Hair Care>Hair Treatments,2699.0,1749.0,1749.0,true,HTTENS7T7YDJG6FN,HTTENS7T7YDJG6FN
