PartnerName,Id,Title,Description,Brand,Link,ImageLink,CategoryName,Mrp,OfferPrice,EffectivePrice,Availability,PartnerIdFromUrl,PartnerIdFromDb
Flipkart,,L'Occitane Citrus Verbena Daily Use Conditioner(250 ml),"A superb-weightless detangling conditioner Enriched with organic verbena extract, purifying lemon essential oil & softening linden floral water Infused with a sparkling & uplifting scent of citrus fruits Hair appears fresh, sleek, lustrous & vigorous Perfect for all hair types",L'Occitane,http://dl.flipkart.com/dl/l-occitane-citrus-verbena-daily-use-conditioner/p/itmenq3hkswzfy7y?pid=CNDENQ3GPFVPSGXA&affid=siddarthk,http://img.fkcdn.com/image/conditioner/g/x/a/l-occitane-250-citrus-verbena-daily-use-conditioner-200x200-imaez5h5yjz6sndg.jpeg,Health and Beauty>Hair Care>Conditioners,2343.0,2253.0,2253.0,true,CNDENQ3GPFVPSGXA,CNDENQ3GPFVPSGXA
Flipkart,,Redken Curvaceous Conditioner(1000 ml),"A 2-in-1 formula creamy conditioner for all curl types Quenches dry strands with intense moisture & weightless conditioning Instantly detangles & defines curls Reveals suppler, sleeker, shiner & more elastic curls To use: Apply & spread through shampooed hair. Rinse well. Or leave in hair for more conditioning & curl definition. Also ideal as a finishing lotion to smooth flyaways on dry hair",Redken,http://dl.flipkart.com/dl/redken-curvaceous-conditioner/p/itmenq3hrefpgdsk?pid=CNDENQ3H6FX29HGY&affid=siddarthk,http://img.fkcdn.com/image/conditioner/h/g/y/redken-1000-curvaceous-conditioner-200x200-imaez5h5zhgtgzft.jpeg,Health and Beauty>Hair Care>Conditioners,4287.0,4123.0,4123.0,false,CNDENQ3H6FX29HGY,CNDENQ3H6FX29HGY
Flipkart,,Keratin Complex Blondeshell Debrass &amp; Brighten Conditioner(400 ml),"A nourishing conditioner for all hair types, particularly blonde & highlighted hair Gives extra conditioning plus shine & smoothness Keratin amino acids strengthen fragile, over processed & damaged hair Lavender oil boosts the growth of healthy hair Blended with wheat & oat proteins to increase hair elasticity Protects hair from heat styling, sun damage & harsh external factors",Keratin Complex,http://dl.flipkart.com/dl/keratin-complex-blondeshell-debrass-amp-brighten-conditioner/p/itmenq3htqbcqrkp?pid=CNDENQ3GVJGMZH65&affid=siddarthk,http://img.fkcdn.com/image/conditioner/h/6/5/keratin-complex-400-blondeshell-debrass-amp-brighten-conditioner-200x200-imaez5h5mtgruqqf.jpeg,Health and Beauty>Hair Care>Conditioners,2168.0,2168.0,2168.0,true,CNDENQ3GVJGMZH65,CNDENQ3GVJGMZH65
Flipkart,,Philip Kingsley Re-Moisturizing Conditioner (For Coarse Textured or Very Wavy Curly or Frizzy Hair)(250 ml),"A rich conditioner to smooth out & protect hair Specially formulated to work instantly on hair shaft Contains advanced ingredients to add resilience & seal cuticle Replenishes moisture to maintain balance Leaves hair dewy soft, luminous & manageable Perfect for coarse-textured, very wavy, curly or frizzy hair",Philip Kingsley,http://dl.flipkart.com/dl/philip-kingsley-re-moisturizing-conditioner-for-coarse-textured-very-wavy-curly-frizzy-hair/p/itmenq3hkusshzvu?pid=CNDENQ3H3GAQN4ZY&affid=siddarthk,http://img.fkcdn.com/image/conditioner/4/z/y/philip-kingsley-250-re-moisturizing-conditioner-for-coarse-200x200-imaez5h5y7vwgjhw.jpeg,Health and Beauty>Hair Care>Conditioners,3182.0,2933.0,2933.0,true,CNDENQ3H3GAQN4ZY,CNDENQ3H3GAQN4ZY
Flipkart,,Hempz Couture Color Protect Conditioner(750 ml),"A color protective conditioner for color-treated hair Provides a moisture-balance conditioning Maximizes color retention & seals in color Shields hair against thermal damage & UV exposure Hair appears more lustrous, stronger & healthier in vivid color Anti-fade, paraben-free, gluten-free & 100% vegan To use: Apply on shampooed hair & massage evenly. Leave on for 3 - 5 minutes, rinse well",Hempz,http://dl.flipkart.com/dl/hempz-couture-color-protect-conditioner/p/itmenq3h3pfngebr?pid=CNDENQ3H6AR5NDUU&affid=siddarthk,http://img.fkcdn.com/image/conditioner/d/u/u/hempz-750-couture-color-protect-conditioner-200x200-imaez5h5hwvub5fv.jpeg,Health and Beauty>Hair Care>Conditioners,4685.0,3315.0,3315.0,true,CNDENQ3H6AR5NDUU,CNDENQ3H6AR5NDUU
Flipkart,,Keratin Complex Smoothing Therapy Keratin Care Conditioner (For All Hair Types)(400 ml),"A conditioner enriched with Keratin protein extracts Contains special wheat & soy protein oils Offers durable moisture to hair Shields hair from the heat of all styling tools Loaded with specially chosen nutrient oils & proteins Helps preserve hair's combability Contains low pH-value for daily use Hair appears stronger, smoother & more manageable Sodium Chloride & Formaldehyde free",Keratin Complex,http://dl.flipkart.com/dl/keratin-complex-smoothing-therapy-care-conditioner-for-all-hair-types/p/itmenq3hyfqw7df9?pid=CNDENQ3H4MQPFPVN&affid=siddarthk,http://img.fkcdn.com/image/conditioner/p/v/n/keratin-complex-400-smoothing-therapy-keratin-care-conditioner-200x200-imaez5h5ee3spakp.jpeg,Health and Beauty>Hair Care>Conditioners,1870.0,1870.0,1870.0,true,CNDENQ3H4MQPFPVN,CNDENQ3H4MQPFPVN
Flipkart,,"Ojon Damage Reverse Restorative Conditioner (For Very Dry, Damaged Hair)(250 ml)","A restorative concentrated conditioner for very dry, damaged hair Contains nature's reparative golden elixir, plus Brazilian Buriti Oil, Murumuru Butter & pure OjonTM oil Helps retain vital moisture & form a barrier against daily damage Instantly detangles & revitalizes hair Unveils sleeker, more lustrous & healthier looking hair",Ojon,http://dl.flipkart.com/dl/ojon-damage-reverse-restorative-conditioner-for-very-dry-damaged-hair/p/itmenq3hz2ghhfx5?pid=CNDENQ3GZ3AUZ2YQ&affid=siddarthk,http://img.fkcdn.com/image/conditioner/2/y/q/ojon-250-damage-reverse-restorative-conditioner-for-very-dry-200x200-imaez5h53hdffqff.jpeg,Health and Beauty>Hair Care>Conditioners,2740.0,2635.0,2635.0,true,CNDENQ3GZ3AUZ2YQ,CNDENQ3GZ3AUZ2YQ
Flipkart,,HerCut Curly Light Conditioner(210 ml),"A weightless conditioner to preserve Curly Bob & Curly Long Layers haircuts Developed with Color Tone Protection Technology Helps support the structure of Curly Bob & Curly Long Layers haircuts Maintains the ""first day"" haircut performance by maximizing true-color vibrancy Delivers lightweight moisture to volumize fine curls Banishes frizz to ensure consistent curl formation Unveils sleeker, bouncier & perfectly shaped curls Free of parabens, sulfates, petrochemicals, phthalates, GMOs & triclosan",HerCut,http://dl.flipkart.com/dl/hercut-curly-light-conditioner/p/itmenq3h57zjpgjt?pid=CNDENQ3H3K4SNZZ7&affid=siddarthk,http://img.fkcdn.com/image/conditioner/z/z/7/hercut-210-curly-light-conditioner-200x200-imaez5h59vz9wxcr.jpeg,Health and Beauty>Hair Care>Conditioners,9999.0,9999.0,9999.0,false,CNDENQ3H3K4SNZZ7,CNDENQ3H3K4SNZZ7
Flipkart,,KMS California Moist Repair Conditioner (Conditioning &amp; Repair)(750 ml),"A nourishing, reparative conditioner Formulated with natural ingredients of Aloe & Vanilla for repairing Offers immediate detangling, conditioning & replenishing benefits Recovers moisture & strength to hair Re-structures stressed & brittle hair Unveils bouncier, healthier & more manageable hair Perfect for dry, damaged hair",KMS California,http://dl.flipkart.com/dl/kms-california-moist-repair-conditioner-conditioning-amp-repair/p/itmenq3hjzaym9n5?pid=CNDENQ3GTVHFFGRX&affid=siddarthk,http://img.fkcdn.com/image/conditioner/g/r/x/kms-california-750-moist-repair-conditioner-conditioning-amp-200x200-imaez5h5jcr2nqzy.jpeg,Health and Beauty>Hair Care>Conditioners,3580.0,2805.0,2805.0,true,CNDENQ3GTVHFFGRX,CNDENQ3GTVHFFGRX
Flipkart,,"Frederic Fekkai Full Blown Volume Conditioner (Lightweight Conditioning, Full Volume)(236 ml)","A lightweight gel-textured conditioner Loaded with Baobab Leaf Extract Helps bind & plump each strand of hair Coats each strand with a weightless polymer Increases diameter of hair for a volumized look without weighing it down Offers protection & delivers velvety shine to hair Unveils fuller, thicker & more manageable hair",Frederic Fekkai,http://dl.flipkart.com/dl/frederic-fekkai-full-blown-volume-conditioner-lightweight-conditioning-volume/p/itmenq3hfgn8q4y6?pid=CNDENQ3H6NKBZFNZ&affid=siddarthk,http://img.fkcdn.com/image/conditioner/f/n/z/frederic-fekkai-236-full-blown-volume-conditioner-lightweight-200x200-imaez5h5zyrrgphu.jpeg,Health and Beauty>Hair Care>Conditioners,2210.0,2125.0,2125.0,true,CNDENQ3H6NKBZFNZ,CNDENQ3H6NKBZFNZ
Flipkart,,L'Occitane Olive Tree Conditioner(250 ml),"Enriched with Olive Tree Extracts Helps instantly detangle & sleek hair Blended with white wine vinegar & lemon extract Hair appears lighter, more lustrous & manageable With a silicone-free formula",L'Occitane,http://dl.flipkart.com/dl/l-occitane-olive-tree-conditioner/p/itmenq3hyfjzkgmr?pid=CNDENQ3H755YYZVQ&affid=siddarthk,http://img.fkcdn.com/image/conditioner/z/v/q/l-occitane-250-olive-tree-conditioner-200x200-imaez5h5zkymmgry.jpeg,Health and Beauty>Hair Care>Conditioners,2210.0,2125.0,2125.0,true,CNDENQ3H755YYZVQ,CNDENQ3H755YYZVQ
Flipkart,,Sexy Hair Concepts Healthy Sexy Hair Soy Tri-Wheat Leave In Conditioner(1000 ml),"A leave-in spray conditioner Formulated with Soy & Tri-Wheat proteins Helps restructure, nourish & shield hair from environmental damage Prevents static electricity while detangling hair Hair appears healthier & more manageable Ideal for all hair types To use: Spray over hair & brush through",Sexy Hair Concepts,http://dl.flipkart.com/dl/sexy-hair-concepts-healthy-soy-tri-wheat-leave-conditioner/p/itmenq3h2ghnfhze?pid=CNDENQ3H4NHHZMYS&affid=siddarthk,http://img.fkcdn.com/image/conditioner/m/y/s/sexy-hair-concepts-1000-healthy-sexy-hair-soy-tri-wheat-leave-in-200x200-imaez5h55wkpqwsg.jpeg,Health and Beauty>Hair Care>Conditioners,9999.0,9999.0,9999.0,false,CNDENQ3H4NHHZMYS,CNDENQ3H4NHHZMYS
Flipkart,,Tigi Bed Head Catwalk Fashionista Brunette Conditioner (For Warm Tones)(250 ml),"A color enhancing conditioner for brunettes Helps intensify depth & richness for intense, glossy brunettes Contains horse chestnut extract & rich in warm toners Provides sharp color & exceptional shine Blended with smoothing, shield-forming agents that protect hair against breakage",Tigi Bed Head,http://dl.flipkart.com/dl/tigi-bed-head-catwalk-fashionista-brunette-conditioner-for-warm-tones/p/itmezg3yspnagpun?pid=CNDENQ3GSMYTJTHR&affid=siddarthk,http://img.fkcdn.com/image/conditioner/t/h/r/tigi-250-catwalk-fashionista-brunette-conditioner-for-warm-tones-200x200-imaez5h5cfxenutn.jpeg,Health and Beauty>Hair Care>Conditioners,1768.0,1360.0,1360.0,true,CNDENQ3GSMYTJTHR,CNDENQ3GSMYTJTHR
Flipkart,,Pureology Hydrate Condition (For Dry Colour-Treated Hair) (New Packaging)(1000 ml),"A lavish, concentrated hydrating daily conditioner Contains an exclusive AntiFadeComplex that maximizes color retention Delivers intense moisture without weighing hair down Provides concentrated natural conditioning while reducing static Replenishes parched hair with movement & manageability Infused with a refreshing fragrance that awakens the senses Hair appears suppler, sleeker & shiner in vibrant color Perfect for dry color-treated hair",Pureology,http://dl.flipkart.com/dl/pureology-hydrate-condition-for-dry-colour-treated-hair-new-packaging/p/itmenq3hbyfhcyjc?pid=CNDENQ3GYZRRPDHH&affid=siddarthk,http://img.fkcdn.com/image/conditioner/d/h/h/pureology-1000-hydrate-condition-for-dry-colour-treated-hair-new-200x200-imaez5h5bz3zmq9n.jpeg,Health and Beauty>Hair Care>Conditioners,7647.0,7353.0,7353.0,false,CNDENQ3GYZRRPDHH,CNDENQ3GYZRRPDHH
Flipkart,,Macadamia Professional Nourishing Moisture Conditioner(300 ml),"A moisturizing & repairing conditioner Contains an exclusive Pro Oil Complex of macadamia & argan oils Delivers moisture, strength & damage repair Blended with avocado & hazelnut oils to provide anti-aging benefits Loaded with Vitamins A, C & E for hydrating & replenishing properties Hair appears softer, smoother & healthier looking Ideal for medium to coarse hair textures Free of sulfates, gluten & parabens",Macadamia,http://dl.flipkart.com/dl/macadamia-professional-nourishing-moisture-conditioner/p/itmezg2zehzabdcg?pid=CNDENQ3H3YZPJMDX&affid=siddarthk,http://img.fkcdn.com/image/conditioner/m/d/x/macadamia-natural-oil-300-professional-nourishing-moisture-200x200-imaez5h5uhpkbhxy.jpeg,Health and Beauty>Hair Care>Conditioners,1945.0,1700.0,1700.0,true,CNDENQ3H3YZPJMDX,CNDENQ3H3YZPJMDX
Flipkart,,Dr. Hauschka Nourishing Hair Conditioner(200 ml),"A revitalizing conditioner for all hair types Formulated with potent ingredients to fortify hair & scalp Regenerative plant extracts from marshmallow & oak give moisture & nourishment Wheat & milk proteins provide protection, elasticity & volume Macadamia nut & jojoba oils create shine, vitality & manageability Leaves hair smooth, radiant, healthy & vigorous",Dr. Hauschka,http://dl.flipkart.com/dl/dr-hauschka-nourishing-hair-conditioner/p/itmenq3hutkhsngj?pid=CNDENQ3GTTBNGFPB&affid=siddarthk,http://img.fkcdn.com/image/conditioner/f/p/b/dr-hauschka-200-nourishing-hair-conditioner-200x200-imaez5h5and3phbu.jpeg,Health and Beauty>Hair Care>Conditioners,9999.0,9999.0,9999.0,false,CNDENQ3GTTBNGFPB,CNDENQ3GTTBNGFPB
Flipkart,,Tigi Bed Head Catwalk Your Highness Nourishing Conditioner(250 ml),"A volume-boosting conditioner Helps mildly relieve & hydrate hair Contains lavender, wisteria, jasmine & violet Imparts weightless moisture & sheen to hair Blended with cashmere, vanilla & sandalwood fragrance Wraps hair with a sensual scent Hair appears suppler, plumper & more touchable To use: Apply from mid-lengths to ends of damp hair. Focus on dry areas. Rinse thoroughly",Tigi Bed Head,http://dl.flipkart.com/dl/tigi-bed-head-catwalk-your-highness-nourishing-conditioner/p/itmenq3h2gpqweq3?pid=CNDENQ3GSYFSFCHK&affid=siddarthk,http://img.fkcdn.com/image/conditioner/c/h/k/tigi-250-catwalk-your-highness-nourishing-conditioner-200x200-imaez5h5buu5fwgx.jpeg,Health and Beauty>Hair Care>Conditioners,1503.0,808.0,808.0,false,CNDENQ3GSYFSFCHK,CNDENQ3GSYFSFCHK
Flipkart,,Alterna Stylist 2 Minute Root Touch-Up Temporary Root Concealer - # Black(30 ml),"A hair concealer that helps erase roots & blend away greys Features a mineral-rich formula that dries quickly Provides a temporary solution between colorings that washes out with one shampoo Does not flake or rub off once dry Suitable for light to medium blonde hair with natural, single-processed or highlighted caramel tones Free of ammonia, peroxide & synthetic color Safe for color treated hair",Alterna,http://dl.flipkart.com/dl/alterna-stylist-2-minute-root-touch-up-temporary-concealer-black/p/itmenq3hn9hgwdgs?pid=CNDENQ3GSUDSAM8K&affid=siddarthk,http://img.fkcdn.com/image/conditioner/m/8/k/alterna-30-stylist-2-minute-root-touch-up-temporary-root-200x200-imaez5h5hf66xtd9.jpeg,Health and Beauty>Hair Care>Conditioners,2380.0,2380.0,2380.0,true,CNDENQ3GSUDSAM8K,CNDENQ3GSUDSAM8K
Flipkart,,"Carol's Daughter Tui Color Care Hydrating Leave-In Conditioner (For All Types of Dry, Color-Treated Hair)(236 ml)","A weightless leave-in conditioner for dry, dull, color-treated hair Replenishes natural moisture to restore balance Contains a rich blend of aloe leaf juice, calendula extract & pro-vitamin B5 Effectively strengthens hair to prevent breakage & color fading Leaves hair soft, brilliant, manageable & healthy Suitable for daily use without weighing down hair",Carol's Daughter,http://dl.flipkart.com/dl/carol-s-daughter-tui-color-care-hydrating-leave-in-conditioner-for-all-types-dry-color-treated-hair/p/itmenq3hhnynh5fy?pid=CNDENQ3H4CFBRW8K&affid=siddarthk,http://img.fkcdn.com/image/conditioner/w/8/k/carol-s-daughter-236-tui-color-care-hydrating-leave-in-200x200-imaez5h5p7qcpz9d.jpeg,Health and Beauty>Hair Care>Conditioners,1635.0,1573.0,1573.0,true,CNDENQ3H4CFBRW8K,CNDENQ3H4CFBRW8K
Flipkart,,Philip B Light-Weight Deep Conditioning Creme Rinse (Paraben Free Formula)(947 ml),"A lightweight, deep-conditioning conditioner Enriched with shea butter, wheat germ, soy proteins & essential oils Strengthens & moisturizes even the driest hair Helps detangle hair & impart shine without weighing hair down Repairs & protects hair from the harmful effect of sun Leaves hair silky smooth, lustrous & beautiful",Philip B,http://dl.flipkart.com/dl/philip-b-light-weight-deep-conditioning-creme-rinse-paraben-free-formula/p/itmenq3h7a5qrzrf?pid=CNDENQ3GYAEQPUB8&affid=siddarthk,http://img.fkcdn.com/image/conditioner/u/b/8/philip-b-947-light-weight-deep-conditioning-creme-rinse-paraben-200x200-imaez5h5mhydnn9j.jpeg,Health and Beauty>Hair Care>Conditioners,7956.0,6205.0,6205.0,true,CNDENQ3GYAEQPUB8,CNDENQ3GYAEQPUB8
Flipkart,,CHI Farouk Royal Treatment Intense Moisture Conditioner (For Dry and Color Treated Hair)(473 ml),"An intensely hydrating conditioner Formulated with white truffle & pearl complex for hydrating, replenishing & re-constructing action Protects & preserves hair color Hair appears suppler, sleeker & more lustrous Great for dry, damaged, overworked & color treated hair Paraben-free",CHI,http://dl.flipkart.com/dl/chi-farouk-royal-treatment-intense-moisture-conditioner-for-dry-color-treated-hair/p/itmenq3hemj8mgh5?pid=CNDENQ3H4QNW3ZXW&affid=siddarthk,http://img.fkcdn.com/image/conditioner/z/x/w/chi-473-farouk-royal-treatment-intense-moisture-conditioner-for-200x200-imaez5h5pujtagye.jpeg,Health and Beauty>Hair Care>Conditioners,3783.0,3783.0,3783.0,true,CNDENQ3H4QNW3ZXW,CNDENQ3H4QNW3ZXW
Flipkart,,Lavera Basis Sensitiv Organic Shine &amp; Care Hair Conditioner with Organic Avocado Oil &amp; Almond Milk (For Normal to Dry Hair)(150 ml),"An organic shine-boosting conditioner Contains precious & nourishing plant ingredients including organic avocado & organic almond milk Creates a protective layer around the hair fiber Blended with vegetal keratin that adds shine to hair while improving combability Hair appears softer, smoother & more manageable Ideal for normal to dry hair",Lavera,http://dl.flipkart.com/dl/lavera-basis-sensitiv-organic-shine-amp-care-hair-conditioner-avocado-oil-almond-milk-for-normal-dry-hair/p/itmenq3hbguzhces?pid=CNDENQ3GZTPRVP9Z&affid=siddarthk,http://img.fkcdn.com/image/conditioner/p/9/z/lavera-150-basis-sensitiv-organic-shine-amp-care-hair-200x200-imaez5h57dvnnzcb.jpeg,Health and Beauty>Hair Care>Conditioners,9999.0,9999.0,9999.0,false,CNDENQ3GZTPRVP9Z,CNDENQ3GZTPRVP9Z
Flipkart,,Label.m Organic Moisturising Lemongrass Conditioner (Nourishing Conditioner For All Hair Types)(200 ml),"An all natural nourishing conditioner Enriched with certified organic ingredients including Quince, Oats, Rice Milk Powder & Jojoba Oil Helps naturally hydrate & improve hair condition without build-up Formulated with Lemongrass Oil to protect & reinforce hair Hair appears softer, smoother & healthier looking Perfect for all hair types, especially dry & dehydrated hair Free of sulphate, paraben & sodium chloride",Label.m,http://dl.flipkart.com/dl/label-m-organic-moisturising-lemongrass-conditioner-nourishing-all-hair-types/p/itmenq3hsdkpteg5?pid=CNDENQ3GYTP7UPDN&affid=siddarthk,http://img.fkcdn.com/image/conditioner/p/d/n/label-m-200-organic-moisturising-lemongrass-conditioner-200x200-imaez5h5u98axegf.jpeg,Health and Beauty>Hair Care>Conditioners,2519.0,1700.0,1700.0,true,CNDENQ3GYTP7UPDN,CNDENQ3GYTP7UPDN
Flipkart,,Billy Jealousy Cashmere Coat Hair Strengthening Conditioner (Salon Size)(1000 ml),"An innovative, peppermint-infused conditioner Boasts nourishing, volumizing & consolidating properties Contains DHT blocking agents to combat hair loss at its roots Reveals fuller & stronger hair To use: Apply to shampooed hair, massage into whole scalp. Leave in for 1 � 2 minutes, rinse thoroughly",Billy Jealousy,http://dl.flipkart.com/dl/billy-jealousy-cashmere-coat-hair-strengthening-conditioner-salon-size/p/itmenq3hbnanrcys?pid=CNDENQ3H6WYEBJZX&affid=siddarthk,http://img.fkcdn.com/image/conditioner/j/z/x/billy-jealousy-1000-cashmere-coat-hair-strengthening-conditioner-200x200-imaez5h5zfzwhfyy.jpeg,Health and Beauty>Hair Care>Conditioners,5865.0,5865.0,5865.0,true,CNDENQ3H6WYEBJZX,CNDENQ3H6WYEBJZX
Flipkart,,"Noodle & Boo Conditioning Hair Polish (For Curls, Tangles, Frizzies and Bed Head)(237 ml)","An ultra-light leave-in hair conditioner Contains sunflower seed & green tea extracts to maintain healthy hair Blended with natural antioxidants to protect hair against environmental stress Helps reduce frizz & detangle hair Hair appears smoother, shinier & more manageable Can be used in-between shampoos to refresh hair & eliminate ""bed-head"" Dermatologist & pediatrician tested, hypoallergenic",Noodle & Boo,http://dl.flipkart.com/dl/noodle-boo-conditioning-hair-polish-for-curls-tangles-frizzies-bed-head/p/itmenq3hspbfjtfj?pid=CNDENQ3GXZXVTQSH&affid=siddarthk,http://img.fkcdn.com/image/conditioner/q/s/h/noodle-boo-237-conditioning-hair-polish-for-curls-tangles-200x200-imaez5h5dqrjrwbg.jpeg,Health and Beauty>Hair Care>Conditioners,9999.0,9999.0,9999.0,false,CNDENQ3GXZXVTQSH,CNDENQ3GXZXVTQSH
Flipkart,,AlfaParf Thermae Spa Mineralis De-Stressing Conditioner(1000 ml),"A mineral-rich de-stressing conditioner Formulated with Thermal Water for overall purification & regeneration of hair Contains Acqua Santa from Chianciano Terme, rich in salts that restore vitality to hair Loaded with Sulphur & Magnesium to clarify hair Hair appears softer, smoother, shiner, nourished & healthy looking Great for use at the end of a technical service Free of mineral oils, parabens, paraffins & synthetic dyes To use: Apply to shampooed wet hair & leave in for 3 minutes. Comb through & rinse thoroughly",AlfaParf,http://dl.flipkart.com/dl/alfaparf-thermae-spa-mineralis-de-stressing-conditioner/p/itmenq3hhfhjzgne?pid=CNDENQ3GSNQHRSQH&affid=siddarthk,http://img.fkcdn.com/image/conditioner/s/q/h/alfaparf-1000-thermae-spa-mineralis-de-stressing-conditioner-200x200-imaez5h5aez8phxj.jpeg,Health and Beauty>Hair Care>Conditioners,3230.0,3230.0,3230.0,true,CNDENQ3GSNQHRSQH,CNDENQ3GSNQHRSQH
Flipkart,,"Label.m Therapy Age-Defying Conditioner (Nourish, Detangle and Restore Vibrancy)(150 ml)","A sulphate-free, therapeutic conditioner Formulated with Rejuven-8TM Complex, comprising eight advanced anti-aging ingredients Effectively fights against the visible signs of aging of hair Hair appears shiner, stronger & younger looking Ideal for weak, dull or aged hair",Label.m,http://dl.flipkart.com/dl/label-m-therapy-age-defying-conditioner-nourish-detangle-restore-vibrancy/p/itmenq3hdgxuk8tr?pid=CNDENQ3GZ9MEWSCA&affid=siddarthk,http://img.fkcdn.com/image/conditioner/s/c/a/label-m-150-therapy-age-defying-conditioner-nourish-detangle-and-200x200-imaez5h5qz6bknuc.jpeg,Health and Beauty>Hair Care>Conditioners,2829.0,2423.0,2423.0,true,CNDENQ3GZ9MEWSCA,CNDENQ3GZ9MEWSCA
Flipkart,,Lanza KB2 Bodify Conditioner(300 ml),"A lightweight body boosting conditioner Enriched with volumizing botanicals & nutrient like Nettle Extract Helps restore body & volume to fine & thin hair Contains vitamins & antioxidants including Panthenol, Vitamin B-5 & Vitamin B-12 Helps nurture & protect hair from free radical damage Hair appears fuller, rejuvenated & healthier looking Perfect for fine & thin hair",Lanza,http://dl.flipkart.com/dl/lanza-kb2-bodify-conditioner/p/itme7gfztqhm428n?pid=CNDENQ3H3YRKGX3A&affid=siddarthk,http://img.fkcdn.com/image/conditioner/x/3/a/lanza-300-kb2-bodify-conditioner-200x200-imaez5h5jzmyzzx2.jpeg,Health and Beauty>Hair Care>Conditioners,1488.0,1488.0,1488.0,true,CNDENQ3H3YRKGX3A,CNDENQ3H3YRKGX3A
Flipkart,,Philip B Lovin Leave-In Conditioner(178 ml),"A revitalizing, paraben-free leave-in conditioner Contains restorative Soy & Wheat Proteins & strengthening Amino Acids Blended with nurturing extracts of Aloe, Nettle, Chamomile, Horsetail & Henna Relieves & hydrates dry brittle ends Shields hair color from fading without overloading it Perfect for all hair textures & types Unveils suppler, sleeker & more lustrous hair",Philip B,http://dl.flipkart.com/dl/philip-b-lovin-leave-in-conditioner/p/itmenq3hkdj39qaf?pid=CNDENQ3GSKEH3AEC&affid=siddarthk,http://img.fkcdn.com/image/conditioner/a/e/c/philip-b-178-lovin-leave-in-conditioner-200x200-imaez5h5cudphweq.jpeg,Health and Beauty>Hair Care>Conditioners,9999.0,9999.0,9999.0,false,CNDENQ3GSKEH3AEC,CNDENQ3GSKEH3AEC
Flipkart,,KMS California Free Shape Conditioner (Conditioning &amp; Preparation For Heat Styling)(250 ml),"A revolutionary conditioner for preparing heat styling Contains a Thermopolymer, an advanced heat-activated technology for heat style & creation Formulated with MiruStyle for heat protection while styling Loaded with Rhodiola Watermint for thermal stress protection, cooling & refreshing benefits Enhances pliability & manageability of hair for optimal styling Hair appears sleeker & more conditioned Perfect for fine to normal hair",KMS California,http://dl.flipkart.com/dl/kms-california-free-shape-conditioner-conditioning-amp-preparation-heat-styling/p/itmenq3hhme8n8kz?pid=CNDENQ3GZNDBHVGD&affid=siddarthk,http://img.fkcdn.com/image/conditioner/v/g/d/kms-california-250-free-shape-conditioner-conditioning-amp-200x200-imaez5h5kfwfqdtq.jpeg,Health and Beauty>Hair Care>Conditioners,1615.0,1615.0,1615.0,true,CNDENQ3GZNDBHVGD,CNDENQ3GZNDBHVGD
