PartnerName,Id,Title,Description,Brand,Link,ImageLink,CategoryName,Mrp,OfferPrice,EffectivePrice,Availability,PartnerIdFromUrl,PartnerIdFromDb
Flipkart,,"Color Fever Bomb Matte Lipstick 13-23-1 12 g(Coffee, Ruby, Cherry)","Lip Bomb is the lipstick the world is talking about. Try it and you will know why. The secret to gorgeous lips is secret no more! The refreshingly tingly Lip Bomb comes in 24 captivating shades. Ranging from reds to browns and pinks, Lip Bomb is here to complement and brighten Indian skin tones. Now you really have no excuse to wear the same shade, all day every day. more more close close Lip Bomb is:,Ultra Long Wear Super Smooth & Soft, Not Animal Tested, Has no Animal Ingredients Along with over 25%* increase in plumpness, Lip Bomb does so much more ,Reduces fine lines, Retexturises lips,Provides deeper hydration,Defines the lip contours ��� Protects against UVA & UVB rays. Contains SPF 15",Color Fever,http://dl.flipkart.com/dl/color-fever-bomb-matte-lipstick-13-23-1-12-g/p/itmed3yqf7gfc95y?pid=LSKED3YQWS3BPSHA&affid=siddarthk,http://img.fkcdn.com/image/lipstick/s/h/a/color-fever-12-bomb-matte-lipstick-13-23-1-200x200-imaed2yvdhnz9pfh.jpeg,Health and Beauty>Makeup>Lips>Lipsticks,1197.0,527.0,527.0,true,LSKED3YQWS3BPSHA,LSKED3YQWS3BPSHA
Flipkart,,Estonia White Sparkling Whitening Scrub(130 g),Estonia Whitening Scrub White Sparkling White Skin Glow,Estonia,http://dl.flipkart.com/dl/estonia-white-sparkling-whitening-scrub/p/itmecjvmpamz8tzs?pid=SCBECJVMC9EBY5GS&affid=siddarthk,http://img.fkcdn.com/image/scrub/5/g/s/estonia-130-white-sparkling-whitening-200x200-imaecjtmrjjxyqtm.jpeg,Health and Beauty>Body and Skin Care>Face Care>Scrubs,1000.0,799.0,799.0,false,SCBECJVMC9EBY5GS,SCBECJVMC9EBY5GS
Flipkart,,Planet Ayurveda Green Tea Algae Aloe-vera Gel  Scrub,,Planet Ayurveda,http://dl.flipkart.com/dl/planet-ayurveda-green-tea-algae-aloe-vera-gel-scrub/p/itmee9685jxukpwh?pid=SCBEE968GVFFPRDH&affid=siddarthk,http://img.fkcdn.com/image/scrub/r/d/h/planet-ayurveda-100-green-tea-algae-aloe-vera-gel-scrub-200x200-imaeefdfx8tzqj98.jpeg,Health and Beauty>Body and Skin Care>Face Care>Scrubs,495.0,495.0,495.0,true,SCBEE968GVFFPRDH,SCBEE968GVFFPRDH
Flipkart,,Fuschia Garden Lavender Scrub,,Fuschia,http://dl.flipkart.com/dl/fuschia-garden-lavender-scrub/p/itmeegb2a4ca7zxz?pid=SCBEEGB2CQJEAGNB&affid=siddarthk,http://img.fkcdn.com/image/scrub/g/n/b/fuschia-100-garden-lavender-200x200-imaeefxpdn7yanez.jpeg,Health and Beauty>Body and Skin Care>Body Care>Scrubs,450.0,280.0,400.0,true,SCBEEGB2CQJEAGNB,SCBEEGB2CQJEAGNB
Flipkart,,Oriflame Sweden Essentials Daily Scrub(100 ml),"Scrub To Remove Impurities And Dead Skin ,Revealing Radiance Beneath",Oriflame Sweden,http://dl.flipkart.com/dl/oriflame-sweden-essentials-daily-scrub/p/itmee82huhdaz2ec?pid=SCBEE82HVAMTJMGC&affid=siddarthk,http://img.fkcdn.com/image/scrub/m/g/c/oriflame-sweden-100-essentials-daily-200x200-imae9r6zyp6zze6t.jpeg,Health and Beauty>Body and Skin Care>Face Care>Scrubs,410.0,399.0,399.0,true,SCBEE82HVAMTJMGC,SCBEE82HVAMTJMGC
Flipkart,,Oriflame Sweden Swedish Spa Smoothing Face  Scrub(75 ml),"Reveal beautiful skin. After cleansing, smooth away dead cells with a light circular movement, without rubbing and avoiding the delicate eye area. With exfoliating particles, harmonising malachite and vitamin rich, softening Hydracare+.",Oriflame Sweden,http://dl.flipkart.com/dl/oriflame-sweden-swedish-spa-smoothing-face-scrub/p/itmee82hmj7pyhsh?pid=SCBEE82HHFQPUFHZ&affid=siddarthk,http://img.fkcdn.com/image/scrub/f/h/z/oriflame-sweden-75-swedish-spa-smoothing-face-scrub-200x200-imae76pdmwghvhsg.jpeg,Health and Beauty>Body and Skin Care>Face Care>Scrubs,549.0,404.0,449.0,false,SCBEE82HHFQPUFHZ,SCBEE82HHFQPUFHZ
Flipkart,,Aroma Lemon (Pack of 2) Scrub,,Aroma,http://dl.flipkart.com/dl/aroma-lemon-pack-2-scrub/p/itmeegtkurahkht3?pid=SCBEEGTKFJZ2HEZR&affid=siddarthk,http://img.fkcdn.com/image/scrub/e/z/r/aroma-100-lemon-pack-of-2-200x200-imaeeb97yayhvzer.jpeg,Health and Beauty>Body and Skin Care>Face Care>Scrubs,158.0,157.0,157.0,false,SCBEEGTKFJZ2HEZR,SCBEEGTKFJZ2HEZR
Flipkart,,Freeman Feeling Beautiful Guava Body Salt Scrub With Ayur Soap Scrub(150 ml),"Get velvety soft skin that begs to be touched! Sea Salts scrub away rough, dull skin as tropical Guava and Vitamin C replenish moisture. It's a so-smooth feeling you'll love. Perfect for all skin types. Directions: Gently massage over body using circular motions. Rinse with warm water. Use two times a week or as often as needed.",Freeman,http://dl.flipkart.com/dl/freeman-feeling-beautiful-guava-body-salt-scrub-ayur-soap/p/itmeejg9snqkyxfz?pid=SCBEEJG9FCRCC85G&affid=siddarthk,http://img.fkcdn.com/image/scrub/8/5/g/freeman-150-feeling-beautiful-guava-body-salt-scrub-with-ayur-200x200-imaeehys6dscz8pt.jpeg,Health and Beauty>Body and Skin Care>Face Care>Scrubs,2200.0,534.0,534.0,true,SCBEEJG9FCRCC85G,SCBEEJG9FCRCC85G
Flipkart,,Parampara Keshpurna Hair Spa,"""Indicatition- It Is Enriched With Amlaki, Trisandhya,Nagkeshar, Jatifal , Bhimraj, Kakananti, Keshut Etc. These Ayurvedic Ingredients Replenish, Hydrate & Moisturized Dry & Damage Hair. It Also Protects Your It Also Protects Your Hair From Split Ends. And Makes Your Hair Smooth. & Shiny. Texture Of This Product & Its Spreads On The Hair Very Easily. It Also Controls Frizz To A Great Extent And Makes Hair Manageable.""",Parampara,http://dl.flipkart.com/dl/parampara-keshpurna-hair-spa/p/itmedzzemjwczgfd?pid=CNDEDZZEYMW3YZDV&affid=siddarthk,http://img.fkcdn.com/image/conditioner/s/g/f/parampara-100-kesh-purna-hair-spa-200x200-imaednybfrjxnemz.jpeg,Health and Beauty>Hair Care>Conditioners,348.0,348.0,348.0,true,CNDEDZZEYMW3YZDV,CNDEDZZEYMW3YZDV
Flipkart,,Boots Seaweed(600 ml),,Boots,http://dl.flipkart.com/dl/boots-seaweed/p/itmee3syby7ykqgw?pid=CNDEE3SYYAWXDA9H&affid=siddarthk,http://img.fkcdn.com/image/conditioner/a/9/h/boots-600-seaweed-200x200-imaee2pyhy35tvv6.jpeg,Health and Beauty>Hair Care>Conditioners,850.0,675.0,675.0,true,CNDEE3SYYAWXDA9H,CNDEE3SYYAWXDA9H
Flipkart,,L'Oreal Paris Pure Colour No Sulphates Conditioner(250 ml),,L'Oreal Paris,http://dl.flipkart.com/dl/l-oreal-paris-pure-colour-no-sulphates-conditioner/p/itmeem82z5sygnjr?pid=CNDEEM82YHHQMBHP&affid=siddarthk,http://img.fkcdn.com/image/conditioner/b/h/p/loreal-250-pure-colour-no-sulphates-conditioner-200x200-imaeehgfehwqexgd.jpeg,Health and Beauty>Hair Care>Conditioners,1995.0,870.0,870.0,true,CNDEEM82YHHQMBHP,CNDEEM82YHHQMBHP
Flipkart,,L'Oreal Paris EverStrong Fortifying & Vitality Conditioner(250 ml),Ever Trong is a nourishing series without surfactants sulfattensider which makes the hair more resistant. Ever Trong usually very thin and brittle hair to bring out its natural beauty. Ever Trong makes hair more resistant and protects ...,L'Oreal Paris,http://dl.flipkart.com/dl/l-oreal-paris-everstrong-fortifying-vitality-conditioner/p/itmee4wsfvdhx8aq?pid=CNDEE4WSNAEGXUUG&affid=siddarthk,http://img.fkcdn.com/image/conditioner/u/u/g/loreal-250-everstrong-fortifying-vitality-conditioner-200x200-imaee4ghyfbhchnc.jpeg,Health and Beauty>Hair Care>Conditioners,3000.0,940.0,940.0,true,CNDEE4WSNAEGXUUG,CNDEE4WSNAEGXUUG
Flipkart,,John Frieda Frizz Ease Daily Nourishment Leave - In Conditioner(236 ml),"Nurture your hair and see it shine. Fortifying and conditioning formula instantly detangles and improves manageability while nourishing dry, damaged hair with an infusion of vitamins and nutrients. With a protective blend of vitamins A, E, C and green tea extract, it helps safeguard hair from damage caused by heat-styling and sun exposure. Formula with wheat protein and glycerin helps repair and revitalize. The result: silky-smooth hair with improved strength and a healthy, vibrant shine.",John Frieda,http://dl.flipkart.com/dl/john-frieda-frizz-ease-daily-nourishment-leave-conditioner/p/itmeed95vfegnb3g?pid=CNDEED95FCDNE7DZ&affid=siddarthk,http://img.fkcdn.com/image/conditioner/7/d/z/john-frieda-236-frizz-ease-daily-nourishment-leave-in-200x200-imaeebgfmpzetjdy.jpeg,Health and Beauty>Hair Care>Conditioners,4000.0,995.0,995.0,false,CNDEED95FCDNE7DZ,CNDEED95FCDNE7DZ
Flipkart,,Happy Hair Days Argan Oil Intense Repair Conditioner(300 ml),,Happy Hair Days,http://dl.flipkart.com/dl/happy-hair-days-argan-oil-intense-repair-conditioner/p/itmedpg7kj32hpue?pid=CNDEDPG7UXHDHVQY&affid=siddarthk,http://img.fkcdn.com/image/conditioner/v/q/y/happy-hair-days-300-argan-oil-intense-repair-conditioner-200x200-imaedp9pmzrhnags.jpeg,Health and Beauty>Hair Care>Conditioners,575.0,575.0,575.0,false,CNDEDPG7UXHDHVQY,CNDEDPG7UXHDHVQY
Flipkart,,Balaji Combo of Dudhi Oil Hair Oil(1 l),Dudhi Oil cure damaged and split hair and gives growth and shining,Balaji,http://dl.flipkart.com/dl/balaji-combo-dudhi-oil-hair/p/itmeegarrsvks3vm?pid=HOLEEGARZUPQYKDT&affid=siddarthk,http://img.fkcdn.com/image/hair-oil/k/d/t/balaji-1-combo-of-dudhi-oil-200x200-imaeefqgfphmjjfc.jpeg,Health and Beauty>Hair Care>Hair Oils,810.0,540.0,540.0,true,HOLEEGARZUPQYKDT,HOLEEGARZUPQYKDT
Flipkart,,Okamoto Skinless Skin - Vanilla Dotted Condom,"Manufactured using revolutionary Japanese technology, which enables Skinless Skin condoms to be much thinner than ordinary condoms – giving them a more natural silkier feel, much like skin itself; while maintaining the highest standards of strength and durability. They are world's leader in the production of high quality and dependable condoms - with over 75 years of experience to enhance the ultimate ‘nothing-like’ feelings",Okamoto,http://dl.flipkart.com/dl/okamoto-skinless-skin-vanilla-dotted-condom/p/itmee659szjnh8ch?pid=CDMEE659UFHX8GEG&affid=siddarthk,http://img.fkcdn.com/image/condom/g/e/g/4-40-okamoto-skinless-skin-vanilla-dotted-200x200-imaee5znupjvh83d.jpeg,Health and Beauty>Sexual Wellness>Condoms>For Him,600.0,388.0,485.0,true,CDMEE659UFHX8GEG,CDMEE659UFHX8GEG
Flipkart,,All Nature Neem & Lemon Face Wash,,All Nature,http://dl.flipkart.com/dl/all-nature-neem-lemon-face-wash/p/itmee992fcsptp9x?pid=FCWEE992GGMYW3BW&affid=siddarthk,http://img.fkcdn.com/image/face-wash/3/b/w/all-nature-100-neem-lemon-200x200-imaee92vgygvsk7a.jpeg,Health and Beauty>Body and Skin Care>Face Care>Face Washes,110.0,110.0,110.0,false,FCWEE992GGMYW3BW,FCWEE992GGMYW3BW
Flipkart,,H2O Plus Face Oasis Cc Cream Broad Spectrum Spf 30 Pa+++ Concealer(FAIR/LIGHT),,H2O Plus,http://dl.flipkart.com/dl/h2o-plus-face-oasis-cc-cream-broad-spectrum-spf-30-pa-concealer/p/itmeebbkaz4dq4gw?pid=CLREEBBKHEDZGUBZ&affid=siddarthk,http://img.fkcdn.com/image/concealer/u/b/z/h2o-plus-face-oasis-cc-cream-broad-spectrum-spf-30-pa-200x200-imaeeb5kvg3c9fwj.jpeg,Health and Beauty>Makeup>Face>Concealers,2200.0,1069.0,1069.0,true,CLREEBBKHEDZGUBZ,CLREEBBKHEDZGUBZ
Flipkart,,Sibley Beauty Diamond Crystal Facial Kit 139 g,,Sibley Beauty,http://dl.flipkart.com/dl/sibley-beauty-diamond-crystal-facial-kit-139-g/p/itmed9t4pgbgdygb?pid=FCKED9T4RMVQZWKF&affid=siddarthk,http://img.fkcdn.com/image/facial-kit/w/k/f/1-sibley-beauty-139-diamond-crystal-facial-kit-200x200-imaed9zhmaqmanuh.jpeg,Health and Beauty>Body and Skin Care>Face Care>Facial Kits,300.0,225.0,225.0,true,FCKED9T4RMVQZWKF,FCKED9T4RMVQZWKF
Flipkart,,Naturence Papaya Enzyme Facial Kit 200 g(Set of 1),"Papaya is the best bet when it comes to skin. It is a good source of Vitamin A and Papain. Vitamin A acts as an antiOxidant, while the papain breaks down inactive proteins and removes dead skin. It also contains AHA’ s that have anti-agieng properties. This also means that papaya for skin is one of the best things to happen. Its results are very effective for blemishes and light pigmented scars",Naturence,http://dl.flipkart.com/dl/naturence-papaya-enzyme-facial-kit-200-g/p/itmeenskgzj4eksg?pid=FCKEENSKZKHP9YNG&affid=siddarthk,http://img.fkcdn.com/image/facial-kit/y/n/g/1-naturence-200-papaya-enzyme-facial-kit-200x200-imaeenr4ugzvzqjg.jpeg,Health and Beauty>Body and Skin Care>Face Care>Facial Kits,500.0,450.0,450.0,true,FCKEENSKZKHP9YNG,FCKEENSKZKHP9YNG
Flipkart,,Dianallure Dressing Comb Combo,Dianallure Combs are aesthetically unique infused printed combs. These combs are made of nonstatic material. It can with stand temperature upto 121 degree C making it ideal for daily and professional use,Dianallure,http://dl.flipkart.com/dl/dianallure-dressing-comb-combo/p/itmed8njjz73zdua?pid=HCBED8NJP6KKS2EZ&affid=siddarthk,http://img.fkcdn.com/image/hair-comb/2/e/z/combo-h-dianallure-dressing-comb-combo-200x200-imaed8cbu5rjng8z.jpeg,Health and Beauty>Hair Care>Hair Care Accessories>Hair Combs,600.0,399.0,399.0,true,HCBED8NJP6KKS2EZ,HCBED8NJP6KKS2EZ
Flipkart,,Dianallure Dressing Comb Combo,Dianallure Combs are aesthetically unique infused printed combs. These combs are made of nonstatic material. It can with stand temperature upto 121 degree C making it ideal for daily and professional use,Dianallure,http://dl.flipkart.com/dl/dianallure-dressing-comb-combo/p/itmed8njt6nvyv6u?pid=HCBED8NJN94UGASG&affid=siddarthk,http://img.fkcdn.com/image/hair-comb/a/s/g/combo-f-dianallure-dressing-comb-combo-200x200-imaed8cajrsxmjxg.jpeg,Health and Beauty>Hair Care>Hair Care Accessories>Hair Combs,600.0,399.0,399.0,true,HCBED8NJN94UGASG,HCBED8NJN94UGASG
Flipkart,,Kustody Kustody Deo Body Spray Witchy Wine 150ml Body Spray  -  For Women(150 ml),,Kustody,http://dl.flipkart.com/dl/kustody-deo-body-spray-witchy-wine-150ml-women/p/itmeenqqzvngfbft?pid=DEOEENQQY46ESPDJ&affid=siddarthk,http://img.fkcdn.com/image/deodorant/p/d/j/body-spray-kustody-150-kustody-deo-body-spray-witchy-wine-150ml-200x200-imaeenm9y8dfgfk5.jpeg,Health and Beauty>Fragrances>Deodorants>Sprays,160.0,120.0,120.0,true,DEOEENQQY46ESPDJ,DEOEENQQY46ESPDJ
Flipkart,,Love Nature Lip Balm Raspberry(7 g),,Love Nature,http://dl.flipkart.com/dl/love-nature-lip-balm-raspberry/p/itmed6yfzzghvt7r?pid=LPBED6YGZCFHKW5R&affid=siddarthk,http://img.fkcdn.com/image/lip-balm/j/w/a/oriflame-sweden-7-love-nature-200x200-imaed563zn6wkm3j.jpeg,Health and Beauty>Body and Skin Care>Lip Care>Lip Balms,299.0,247.0,275.0,true,LPBED6YGZCFHKW5R,LPBED6YGZCFHKW5R
Flipkart,,Ermani Export Siver Metal 3 Rods Bangle Box Makeup Vanity Box(Silver),,Ermani Export,http://dl.flipkart.com/dl/ermani-export-siver-metal-3-rods-bangle-box-makeup-vanity/p/itmeejgdh6gaetwn?pid=VANEEJGD2RFMVETZ&affid=siddarthk,http://img.fkcdn.com/image/vanity-box/7/y/a/vb039-ermani-export-traditional-royal-siver-metal-3-rods-200x200-imaeegbnyrrze8rd.jpeg,Home Decor>Home Utilities>Utility Boxes,4299.0,1169.0,1299.0,true,VANEEJGD2RFMVETZ,VANEEJGD2RFMVETZ
Flipkart,,moKanc Hair Accessory Tic Tac Clip(Green),"Beautiful Handmade Crochet Motif over the Tic-Tac Clip. Colorful Appearance, very attractive. Specially available only from moKanc",moKanc,http://dl.flipkart.com/dl/mokanc-hair-accessory-tic-tac-clip/p/itmeea7gyehe7qgk?pid=HACEEA7GMCHQNHHY&affid=siddarthk,http://img.fkcdn.com/image/hair-accessory/h/h/y/ha-bg01b-1-mokanc-hair-accessory-200x200-imaee9cuuzshdczh.jpeg,Health and Beauty>Hair Care>Hair Care Accessories>Hair Accessories,295.0,220.0,220.0,true,HACEEA7GMCHQNHHY,HACEEA7GMCHQNHHY
Flipkart,,Dazzle Collections Floral Funky Hair Pin(Gold),"For Women who love to try different accessory on their hair, Dazzle Collection brings you the latest and beautiful hair accessory. This hair accessory will not only enhance the look of hair but also keep the hair in proper manner.",Dazzle Collections,http://dl.flipkart.com/dl/dazzle-collections-floral-funky-hair-pin/p/itmeemn5cmmszdyx?pid=HACEEMN5JXPAZU5Z&affid=siddarthk,http://img.fkcdn.com/image/hair-accessory/u/5/z/dc-ha-ac-10009-1-dazzle-collections-floral-funky-200x200-imaeemdgtj65brsf.jpeg,Health and Beauty>Hair Care>Hair Care Accessories>Hair Accessories,800.0,417.0,417.0,true,HACEEMN5JXPAZU5Z,HACEEMN5JXPAZU5Z
Flipkart,,Dazzle Collections Floral Funky Hair Pin,"For Women who love to try different accessory on their hair, Dazzle Collection brings you the latest and beautiful hair accessory. This hair accessory will not only enhance the look of hair but also keep the hair in proper manner.",Dazzle Collections,http://dl.flipkart.com/dl/dazzle-collections-floral-funky-hair-pin/p/itmeemn5dy5ax3zd?pid=HACEEMN5W7CKH4QK&affid=siddarthk,http://img.fkcdn.com/image/ring/h/r/y/dc-rng-10013-free-size-prita-ring-200x200-imaeemdgbguzjeeu.jpeg,Health and Beauty>Hair Care>Hair Care Accessories>Hair Accessories,800.0,375.0,417.0,true,HACEEMN5W7CKH4QK,HACEEMN5W7CKH4QK
Flipkart,,"Divine Collection Stylish Hair Clip(Black, White)",Divine Collection stylish clip,Divine Collection,http://dl.flipkart.com/dl/divine-collection-stylish-hair-clip/p/itmee2pnyf85bs2m?pid=HACEE2PN2NXQAUH6&affid=siddarthk,http://img.fkcdn.com/image/hair-accessory/u/h/6/dchb71-2-divine-collection-hair-clip-stylish-200x200-imaeefqzzjr8awyu.jpeg,Health and Beauty>Hair Care>Hair Care Accessories>Hair Accessories,600.0,250.0,250.0,false,HACEE2PN2NXQAUH6,HACEE2PN2NXQAUH6
Flipkart,,Khadi Herbal NaturalSandalwood Soap - pack of 3(270 g),Surround yourself with the tantalising scent of jasmine known to boost your self-confidence by adding an element of lush sensuality and increasing your overall sense of well-being.,Khadi Herbal,http://dl.flipkart.com/dl/khadi-herbal-naturalsandalwood-soap-pack-3/p/itmedz2e7prs8kzr?pid=SOPEDZ2EZEYTRN2J&affid=siddarthk,http://img.fkcdn.com/image/soap/n/2/j/khadi-270-sandalwood-soap-pack-of-3-200x200-imaeg7duv7zxqtu2.jpeg,Health and Beauty>Bath and Spa>Soaps,180.0,175.0,175.0,true,SOPEDZ2EZEYTRN2J,SOPEDZ2EZEYTRN2J
Flipkart,,Littmann Classic III 5840 Acustic Stethoscope(Emerald),"The 3M™ Littmann® Classic III™ Stethoscope is the latest version of the stethoscope that helps millions of medical professionals achieve their best. The Classic III stethoscope offers high acoustic sensitivity for exceptional performance, plus a versatile two-sided chestpiece with tunable diaphragms. The Classic III stethoscope is used by students and medical professionals alike to identify, listen to, and study heart, lung, and other body sounds for physical assessment, patient monitoring, and diagnosis. Tunable diaphragm technology—a 3M invention—lets clinicians hear different frequency sounds by simply adjusting the pressure on the chestpiece. Hold the chestpiece with light pressure to hear low frequency sounds; press a little more to hear higher frequency sounds. This time-saving feature allows the healthcare provider to focus on the patient, while the non-chill diaphragm provides patient comfort. Headset tension is easily adjusted for head size and comfort by squeezing together or pulling apart the eartubes. Snap-tight, soft-sealing eartips conform to individual ears for an excellent acoustic seal and comfortable fit. Eartips snap firmly onto the ends of the eartubes and, for safety, require a significant effort to remove. Resilient next-generation tubing retains its shape and flexibility even after folding tightly into a pocket. It provides longer stethoscope life due to improved resistance to skin oils and alcohol, and is less likely to pick up stains. Next-generation tubing is not made with natural rubber latex, a benefit to sensitive medical professionals and their patients. And, to play its part in the protection of human health and the environment, the next-generation tubing does not contain phthalate plasticizers. The Classic III stethoscope is made in the USA for consistent quality. It comes complete with large and small soft-sealing eartips, non-chill bell sleeve, and instructions.",Littmann,http://dl.flipkart.com/dl/littmann-classic-iii-5840-acustic-stethoscope/p/itmeeh855n7cjdgm?pid=STHEEH85BZ9FYGJK&affid=siddarthk,http://img.fkcdn.com/image/stethoscope/g/j/k/dual-sided-3m-littmann-acustic-classic-iii-5840-200x200-imaeedm3dbdhzuaz.jpeg,Health and Beauty>Health Care>Health Care Devices>Stethoscopes,10450.0,7000.0,7000.0,true,STHEEH85BZ9FYGJK,STHEEH85BZ9FYGJK
Flipkart,,L 'Oreal Paris Inoa Rich Developer 30 Vol 9%(1000 ml),,L 'Oreal Paris,http://dl.flipkart.com/dl/l-oreal-paris-inoa-rich-developer-30-9/p/itmee82hyzyfhgtk?pid=HTTEE82HPKAYGACX&affid=siddarthk,http://img.fkcdn.com/image/hair-treatment/a/c/x/l-oreal-paris-1000-inoa-rich-developer-30-vol-9-200x200-imaee7zhs4xsvvmj.jpeg,Health and Beauty>Hair Care>Hair Treatments,1300.0,999.0,999.0,true,HTTEE82HPKAYGACX,HTTEE82HPKAYGACX
Flipkart,,"Lomani Cigar Eau de Toilette  -  100 ml(For Boys, Men)","""Remy Latour France Cigar EDT - 100 ml (For Men) This innovative masculine aroma exceeds all expectations. Cigar perfume from the house of R?my Latour (launched in 1996) is an intense, powerful and fresh fragrance that begins with notes of bergamot, lemon, pears, prunes and pineapple. The composition is heated by the aromatic notes of flowers such as marigold, geranium, jasmine and bay leaves. Lower notes will afford you the luxury of cedar, patchouli and sandalwood, blended with tobacco and musk.""",Lomani,http://dl.flipkart.com/dl/lomani-cigar-eau-de-toilette-100-ml/p/itmedy67vf5jr4qs?pid=PEREDY67H7E9C86E&affid=siddarthk,http://img.fkcdn.com/image/perfume/n/s/k/eau-de-toilette-lomani-100-cigar-200x200-imaedwxxnzh4ehnv.jpeg,Health and Beauty>Fragrances>Perfumes>Eaux De Toilette,1450.0,940.0,1045.0,true,PEREDY67H7E9C86E,PEREDY67H7E9C86E
Flipkart,,Ramco Dare Perfume Eau de Toilette  -  100 ml(For Men),,Ramco,http://dl.flipkart.com/dl/ramco-dare-perfume-eau-de-toilette-100-ml/p/itmeegygspfujc9h?pid=PEREEGYGMY3FGKKF&affid=siddarthk,http://img.fkcdn.com/image/perfume/k/k/f/eau-de-toilette-ramco-100-dare-perfume-200x200-imaeekhftm4cdexn.jpeg,Health and Beauty>Fragrances>Perfumes>Eaux De Toilette,450.0,350.0,350.0,false,PEREEGYGMY3FGKKF,PEREEGYGMY3FGKKF
Flipkart,,Satchitanand Tea Tree Essential Oil - Twin Pack(20 ml),"Tea tree essential oil speeds up the healing process by stimulating hormone secretions and blood circulation. This oil produces a medicinal aroma that boosts immune system and health along with sanitizing air of your room. Disclaimer: Intended for oil diffuser use, information provided is for education purpose. Consult physician/therapist for other uses. Special Discount Offer Pack.",Satchitanand,http://dl.flipkart.com/dl/satchitanand-tea-tree-essential-oil-twin-pack/p/itmeemqmmgjzfjfz?pid=BEOEEMQMJQDV3TWZ&affid=siddarthk,http://img.fkcdn.com/image/bath-essential-oil/t/w/z/satchitanand-20-tea-tree-essential-oil-twin-pack-200x200-imaeemghrpsvn6kp.jpeg,Health and Beauty>Bath and Spa>Body and Essential Oils,800.0,399.0,399.0,true,BEOEEMQMJQDV3TWZ,BEOEEMQMJQDV3TWZ
Flipkart,,Hibiscus Herbals Herbal Hair Colour Hair Color,,Hibiscus Herbals,http://dl.flipkart.com/dl/hibiscus-herbals-herbal-hair-colour-color/p/itmeehhg8gkzff7x?pid=HRCEEHHGKJBQ7KDY&affid=siddarthk,http://img.fkcdn.com/image/hair-color/k/d/y/hibiscus-herbals-herbal-hair-colour-200x200-imaeeguqggt5e4zd.jpeg,Health and Beauty>Hair Care>Hair Colors,300.0,210.0,300.0,true,HRCEEHHGKJBQ7KDY,HRCEEHHGKJBQ7KDY
Flipkart,,"Vita Glow Skin Whitening, Fairness Night Cream(30 g)","Vita Glow Skin Whitening, Fairness Night Cream – 30gm:Vita Glow Skin Whitening Night Cream For RADIENT BRIGHTENING & BEAUTIFUL SKIN.•Vita Glow Night Cream Removes the layer of the dust and makes your skin look fresh and Healthy.•Vita Glow Night Cream is beneficiary for men and women.•Vita Glow Night Cream is the only cream in the world which in a very short span of time makes you Beautiful while other only provides aspirationBenefits of Vita Glow Night Cream: •Give you fairer skin within 7 days and with SPF curves wrinkles,dark circles, and spots without any side effect. •Vita Glow Night Cream is Equally Best for Normal, Dry and Oily skin. How to Use:•Before sleep wash your face with soap and gently dry. •Apply small amount of Cream and massage gently into skin so that cream could penetrate into the skin. •For 7 days regular use making your skin acne free, fresh and whitening. •keep using cream till achieving the required Goals. •After attaining the required result use twice a week. •So that it could protect Your Skin from the fatigues which may cause by sunlight, pollution & Dust.Ingredients:•Water Germ Oil,•Jojoba Oil•Turmeric,•Sandalwood Oil,•Kumkum,•Neem,•Curcumin,•Avocado,•Vitamin C,•Bee Wax,•Honey.",Vita Glow,http://dl.flipkart.com/dl/vita-glow-skin-whitening-fairness-night-cream/p/itmednfcnpaawxmy?pid=MSCEDNFCMSNTMQDB&affid=siddarthk,http://img.fkcdn.com/image/moisturizer-cream/q/d/b/vita-glow-30-skin-whitening-fairness-night-cream-200x200-imaedmwchgcbzkcm.jpeg,Health and Beauty>Mens Grooming>Body and Skin Care>Moisturizers and Creams,3900.0,2300.0,2300.0,true,MSCEDNFCMSNTMQDB,MSCEDNFCMSNTMQDB
Flipkart,,Oriflame Sweden Optimals White Skin Youth Day Cream Spf 15(50 ml),Helps lighten skin complexion while reducing the visibilty of first lines and enhanged pores with patented antioxidant lngon 50:50. skin lightening complex smoothing microspheres and spf 15. 50 ml.,Oriflame Sweden,http://dl.flipkart.com/dl/oriflame-sweden-optimals-white-skin-youth-day-cream-spf-15/p/itmedthexgjzadb6?pid=MSCEDTHEMAHPXVNC&affid=siddarthk,http://img.fkcdn.com/image/moisturizer-cream/v/n/c/oriflame-sweden-50-optimals-white-skin-youth-day-cream-spf-15-200x200-imaedtdsrkhzeduh.jpeg,Health and Beauty>Body and Skin Care>Body Care>Moisturizers and Creams,1199.0,863.0,863.0,true,MSCEDTHEMAHPXVNC,MSCEDTHEMAHPXVNC
