PartnerName,Id,Title,Description,Brand,Link,ImageLink,CategoryName,Mrp,OfferPrice,EffectivePrice,Availability,PartnerIdFromUrl,PartnerIdFromDb
Flipkart,,Skin Obsession 20% TCA Home Chemical Peel(30 ml),"Smoothes fine lines and wrinklesEvens skin texture by removing age spots and sun damageHelps reduce acne outbreaksGives skin a beautiful glowing tone and textureEasy to use with complete directionsOur Skin Obsession 20% TCA Peel is a powerful and effective tool for resurfacing your damaged skin to yield the younger glowing skin you are looking for and deserve. This light to medium depth peel will improve many of the skin conditions that we all see (and wish we didn't!) when we look in the mirror. After a simple and straightforward process in the privacy of your own home, and the peeling that follows, your skin will be softer, smoother, with improved texture and tone and greatly reduced hyperpigmentation (sun damage). Those are the differences on the surface of your skin. But the real magic is going on under your skin where collagen is being stimulated. This is what plumps up the lines and scars, yielding a smoother, more refined and beautiful complexion. This is one of the most commonly performed chemical peels in medical offices and spas because it is one of the most effective and has fantastic results. With an impressive track record for safety and effectiveness, this peel is one of our best sellers. If you are new to peeling, you may want to try the 15% TCA peel first before moving to this level of peel, though the 20% can be used by first time peelers. This is a very safe peel when used as directed and is suitable for most skin types, however, some darker skin tones, particularly African American run a risk of post peel hypo pigmentation. As with all products, a patch test is recommended for all of our clients to see how your skin reacts. We include a full, easy to understand instruction manual as well as a free sample of our microdermabrasion crystals with each purchase. This 1 fl oz. bottle of peeling solution is enough for approximately 8-10 peels done once every 4-6 weeks.Ingredients: Distilled sterile water, Trichloroacetic acid. By purchasing this product, you assume all risk associated with its use and are responsible for all results either intended or unintended from using this product.From the ManufacturerMadden Girl is a division of Steve Madden -- the footwear fashion mogul of the 21st century who has inserted his company into virtually every aspect of the fashion industry. With his primary success and initial endeavor as a shoe designer, Mr. Madden has maintained the direct day-to-day responsibility for the design and marketing of the company's trend setting shoes for the past two decades.",Skin Obsession,http://dl.flipkart.com/dl/skin-obsession-20-tca-home-chemical-peel/p/itme7fqudnzgrfsg?pid=FCTE7FFMUSZKQT7D&affid=siddarthk,http://img.fkcdn.com/image/face-treatment/t/7/d/skin-obsession-30-20-tca-home-chemical-peel-200x200-imae7e8hvawv75v7.jpeg,Health and Beauty>Body and Skin Care>Face Care>Face Treatments,4938.0,3999.0,3999.0,true,FCTE7FFMUSZKQT7D,FCTE7FFMUSZKQT7D
Flipkart,,Adishi Face Care (Women)(38 g),"Adishi’s Face Care powder is a unique formula of luxuriously, fine-milled natural herbs. The powder is a natural face polisher enriched with antioxidants and exfoliants. Daily usage softens and creates a healthy skin. The powder makes your skin glow, and removes dead cells by minimizing open pores.",Adishi,http://dl.flipkart.com/dl/adishi-face-care-women/p/itme74cqavgg7hea?pid=FCTE74CQGDF8H9FZ&affid=siddarthk,http://img.fkcdn.com/image/face-treatment/9/f/z/adishi-38-face-care-women-200x200-imae749xphwkjcaf.jpeg,Health and Beauty>Body and Skin Care>Face Care>Face Treatments,299.0,299.0,299.0,true,FCTE74CQGDF8H9FZ,FCTE74CQGDF8H9FZ
Flipkart,,Avera Aloe Face Glow Cream(50 g),"Pamper yourself with a nourishing massage using Avera restorative massage cream with certified organic aloe vera. It has therapeutic herbs - winter cherry, acorus calamus, bacopa (Brahmi) and aloe vera that rejuvenate the skin and stimulate cell growth. The goodness of stevia tightens the skin and acts an anti-wrinkle agent. Regular massage improves skin tone and texture.",Avera,http://dl.flipkart.com/dl/avera-aloe-face-glow-cream/p/itmdt76tguf7szjj?pid=FCTDS7ZZ9QYGWFMV&affid=siddarthk,http://img.fkcdn.com/image/face-treatment/f/m/v/avera-essentials-50-aloe-face-glow-cream-200x200-imads7gkcv3fqdhd.jpeg,Health and Beauty>Body and Skin Care>Face Care>Face Treatments,399.0,149.0,149.0,true,FCTDS7ZZ9QYGWFMV,FCTDS7ZZ9QYGWFMV
Flipkart,,Avera Green Herbs Gel(50 g),"Avera Green Herbs Gel is made from fresh certified organic whole leaf ALOE VERA juice. It is thickened naturally with green tea and hibiscus. The gel tightens the skin, improves skin moisture balance, and protects it from drying. It supports the healing process of burned and sun-burned skin. The Gel heals scrape, wound, bite, burn, acne, stretch marks, scars, post-surgical reconstruction, athlete�s foot, psoriasis, eczema, itching skin, sunburned and damaged skin, after shave, and baby rash. No Paraben and chemicals used so it is safe for babies too. Key Ingredients: Aloe barbadensis gel, Propanediol, Sodium magnesium silicate, Glycerin, Licorice Glycyrrhiza glabra extract, Centella asiatica extract, Benzyl Alcohol, Cocamidopropyl Betaine, Hibiscus Extract & Sodium Benzoate How to Use: Cleanse face well. Lightly glide your fingers over the gel and apply a small amount over face and neck, concentrating under the eye area, or the affected area.",Avera,http://dl.flipkart.com/dl/avera-green-herbs-gel/p/itmdt76svqtgbukz?pid=FCTDSFR2VFF2JRGC&affid=siddarthk,http://img.fkcdn.com/image/face-treatment/r/g/c/avera-essentials-50-green-herbs-gel-200x200-imadsgf5xszaahwm.jpeg,Health and Beauty>Body and Skin Care>Face Care>Face Treatments,275.0,99.0,99.0,true,FCTDSFR2VFF2JRGC,FCTDSFR2VFF2JRGC
Flipkart,,O3+ Brighten Up Tonic(120 ml),"Your skin is often exposed to pollutants and harmful rays of the sun that give it a dull and darkened look. O3+ Brighten Up Tonic is an excellent solution that combats skin problems and lends you glowing complexion. Minimizes Skin Discoloration Get an even skin tone by using this tonic that reduces skin discoloration. Increases Skin Clarity Reducing blemishes and dark spots, this tonic increases your skin’s clarity. Reduces Pigmentation Experience bright skin and an improved texture as O3+ Brighten Up Tonic reduces pigmentation. Removes Tan from Skin Retaining the lustre and giving you healthy skin, this tonic removes tan to give you visibly fair complexion.",O3+,http://dl.flipkart.com/dl/o3-brighten-up-tonic/p/itmdvrwkwnhyvmgb?pid=FCTDVRPHFMUGYMC6&affid=siddarthk,http://img.fkcdn.com/image/face-treatment/m/c/6/o3-120-brighten-up-tonic-200x200-imadvvvgsvgmyj8g.jpeg,Health and Beauty>Body and Skin Care>Face Care>Face Treatments,780.0,739.0,739.0,true,FCTDVRPHFMUGYMC6,FCTDVRPHFMUGYMC6
Flipkart,,Belo Herbal Intensive Whitening Face and Neck Cream Kojic and SPF 30(50 g),"A luxurious skin rejuvenating face and neck cream with the powerful combination of kojic acid and Tranexamic Acid that intensively whitens skin.Exude a fairer, youthful glow with the Intensive Whitening Face and Neck Cream from Belo. This cream features a unique combination of two of the most powerful whitening actives, Kojic acid and Tranexamic acid and is expertly formulated to effectively shield the skin from harmful UV rays.Expertly formulated, hypoallergenic and dermatologist testedBenefits:* Lightens/whitens the skin's color.* Improves skin texture and skin tone and gives celebrity Glow to skin* Protects skin from UV-A & UV-B Rays* Corrects skin discolorations* Removes pigmentation and marks effectively* No peeling or skin flaking, No Burning Sensation* Hypoallergenic, dermatologist-tested and approved.* 100% Naturel Ingredients No side EffectsDirections to useUse daily after cleansing and toning. Scoop the desired amount using the spatula and gently massage onto the face and neck. Do not apply in and around the delicate eye area or on irritated skin. For best results, use in the morning and evening. Keep away from direct sunlight and heat. Use with Belo Soap for best results",Belo,http://dl.flipkart.com/dl/belo-herbal-intensive-whitening-face-neck-cream-kojic-spf-30/p/itme7ppzzhs9ejyy?pid=FCTE7PPZM2P35EF4&affid=siddarthk,http://img.fkcdn.com/image/face-treatment/d/z/a/belo-50-intensive-whitening-face-neck-cream-with-kojic-200x200-imae7pfhhyjrtccu.jpeg,Health and Beauty>Body and Skin Care>Face Care>Face Treatments,4000.0,1600.0,1600.0,true,FCTE7PPZM2P35EF4,FCTE7PPZM2P35EF4
Flipkart,,Bakson'S Sunny Papaya (Pack Of 2)(300 g),"Papaya Is Great Skin Firming And Anti Ageing Agent. Enriched With The Goodness Of Aloevera And Jojoba. Papaya Pack Nourishes The Skin, Clenses It, Tightens The Pores And Improves Complexion By Removing Blemishes And Pigmentation Marks. It Is Used For Clear And Young Skin.",Bakson'S Sunny,http://dl.flipkart.com/dl/bakson-s-sunny-papaya-pack-2/p/itme8ucmstyqugqf?pid=FCPE8UCMQXXU4ZXR&affid=siddarthk,http://img.fkcdn.com/image/face-pack/z/x/r/bakson-s-sunny-300-papaya-pack-of-2-200x200-imae7qvs2upwgqg5.jpeg,Health and Beauty>Body and Skin Care>Face Care>Face Packs,300.0,300.0,300.0,false,FCPE8UCMQXXU4ZXR,FCPE8UCMQXXU4ZXR
Flipkart,,Khadi Natural Hill's Queen Rose Face pack(100 g),,Khadi Natural,http://dl.flipkart.com/dl/khadi-natural-hill-s-queen-rose-face-pack/p/itmekcchgfgrxggh?pid=FCPE3F9A57X4AVFK&affid=siddarthk,http://img.fkcdn.com/image/face-pack/v/f/k/khadi-100-hill-s-queen-rose-face-pack-200x200-imae3ff2xjycnqsy.jpeg,Health and Beauty>Body and Skin Care>Face Care>Face Packs,75.0,75.0,75.0,false,FCPE3F9A57X4AVFK,FCPE3F9A57X4AVFK
Flipkart,,Biotique Advanced Bxl Cellular Whitening Pack For All Skin Type(50 g),"Biotique Advanced BXL Cellular Whitening Pack is an intense, depigmentation treatment with hydrating botanicals. Helps reduce the appearance of dark spots, discolorations and uneven tone to improve skin clarity, freshness and radiance. Powered by exclusive BXL Complex for the most energizing, nourishing and strengthening skin effects. BXL Complex is a new power source for intercellular communication. The result of advanced skin research, it is a precise blend of 100% natural botanicals and biologically advanced ingredients essential to healthy skin life. Helps stimulate cell renewal and elevate hydration and nutrition levels from within, producing a youthful environment for stronger, more resilient skin to rise up to the surface each day.",Biotique,http://dl.flipkart.com/dl/biotique-advanced-bxl-cellular-whitening-pack-all-skin-type/p/itmee4wteaztvc4j?pid=FCPEE4WTDUHHNZ8Z&affid=siddarthk,http://img.fkcdn.com/image/face-pack/z/8/z/biotique-50-advanced-bxl-cellular-whitening-pack-for-all-skin-200x200-imaee4j2cbf7f2gy.jpeg,Health and Beauty>Body and Skin Care>Face Care>Face Packs,999.0,999.0,999.0,false,FCPEE4WTDUHHNZ8Z,FCPEE4WTDUHHNZ8Z
Flipkart,,Khadi Natural Hill'S Queen Almond Face Pack(400 g),"Effects: An excellent face pack specially prepared for dry skin. It contains herbal ingredients for skin nourishment and protection. It gives a fairer and soft skin with even toned complexion.Method: Take two spoon of Badam Herbal Ubtan and mix it with fresh milk or water to make a paste. Apply this paste evenly on face, neck and hands. Let it dry for some time. Then wash it off with water.",Khadi Natural,http://dl.flipkart.com/dl/khadi-natural-hill-s-queen-almond-face-pack/p/itmekcchyu6y2pvs?pid=FCPE6FWHHRFYM5AZ&affid=siddarthk,http://img.fkcdn.com/image/face-pack/5/a/z/khadi-400-hill-s-queen-almond-face-pack-200x200-imae62by99zwvtzf.jpeg,Health and Beauty>Body and Skin Care>Face Care>Face Packs,300.0,300.0,300.0,true,FCPE6FWHHRFYM5AZ,FCPE6FWHHRFYM5AZ
Flipkart,,Biotique Advanced Bxl Cellular Nourishing Pack For All Skin Type(50 g),"Biotique Advanced BXL Cellular Nourishing Pack is a nutrient-rich boost for dull, tired skin. This rejuvenating treatment deeply hydrates skin and helps diminish the appearance of fine lines for a smoother, glowing, ageless appearance. Powered by exclusive BXL Complex for the most energizing, nourishing and strengthening skin effects. BXL Complex is a new power source for intercellular communication. The result of advanced skin research, it is a precise blend of 100% natural botanicals and biologically advanced ingredients essential to healthy skin life. Helps stimulate cell renewal and elevate hydration and nutrition levels from within, producing a youthful environment for stronger, more resilient skin to rise up to the surface each day.",Biotique,http://dl.flipkart.com/dl/biotique-advanced-bxl-cellular-nourishing-pack-all-skin-type/p/itmee4wvywtf6ghg?pid=FCPEE4WVW7RWAU69&affid=siddarthk,http://img.fkcdn.com/image/face-pack/u/6/9/biotique-50-advanced-bxl-cellular-nourishing-pack-for-all-skin-200x200-imaee4j2ezvypenx.jpeg,Health and Beauty>Body and Skin Care>Face Care>Face Packs,999.0,999.0,999.0,false,FCPEE4WVW7RWAU69,FCPEE4WVW7RWAU69
Flipkart,,Biotique Advanced Bxl Cellular Anti-Spot Pack For All Skin Type(50 g),"Biotique Advanced BXL Cellular Anti-Spot Pack is a targeted treatment for hyperpigmentation and uneven skin tone. Helps correct and brighten dark spots, revealing a noticeably clearer, fresher, younger-looking complexion with regular use. Powered by exclusive BXL Complex for the most energizing, nourishing and strengthening skin effects. BXL Complex is a new power source for intercellular communication. The result of advanced skin research, it is a precise blend of 100% natural botanicals and biologically advanced ingredients essential to healthy skin life. Helps stimulate cell renewal and elevate hydration and nutrition levels from within, producing a youthful environment for stronger, more resilient skin to rise up to the surface each day.",Biotique,http://dl.flipkart.com/dl/biotique-advanced-bxl-cellular-anti-spot-pack-all-skin-type/p/itmee4wux3qsxhsw?pid=FCPEE4WUNP8RVG7F&affid=siddarthk,http://img.fkcdn.com/image/face-pack/g/7/f/biotique-50-advanced-bxl-cellular-anti-spot-pack-for-all-skin-200x200-imaee4j2a5fgkhhf.jpeg,Health and Beauty>Body and Skin Care>Face Care>Face Packs,999.0,999.0,999.0,false,FCPEE4WUNP8RVG7F,FCPEE4WUNP8RVG7F
Flipkart,,Khadi Natural Hill's Queen Lemon Face pack(100 g),,Khadi Natural,http://dl.flipkart.com/dl/khadi-natural-hill-s-queen-lemon-face-pack/p/itmekcchxfqzvhs2?pid=FCPE3F9AFBR6WATF&affid=siddarthk,http://img.fkcdn.com/image/face-pack/a/t/f/khadi-100-hill-s-queen-lemon-face-pack-200x200-imae3ff2snahh4hd.jpeg,Health and Beauty>Body and Skin Care>Face Care>Face Packs,75.0,75.0,75.0,false,FCPE3F9AFBR6WATF,FCPE3F9AFBR6WATF
Flipkart,,Biotique Advanced Bxl Cellular Firming Pack For All Types Of Skin(50 g),"Biotique Advanced BXL Cellular Firming Pack pampers skin with revitalizing support. Helps lift and tighten skin, reducing the appearance of lines and wrinkles. Skin feels resilient and looks radiantly younger.Powered by exclusive BXL Complex for the most energizing, nourishing and strengthening skin effects. BXL Complex is a new power source for intercellular communication. The result of advanced skin research, it is a precise blend of 100% natural botanicals and biologically advanced ingredients essential to healthy skin life. Helps stimulate cell renewal and elevate hydration and nutrition levels from within, producing a youthful environment for stronger, more resilient skin to rise up to the surface each day.",Biotique,http://dl.flipkart.com/dl/biotique-advanced-bxl-cellular-firming-pack-all-types-skin/p/itmee4wvxatqtes7?pid=FCPEE4WVVVUGMWPU&affid=siddarthk,http://img.fkcdn.com/image/face-pack/w/p/u/biotique-50-advanced-bxl-cellular-firming-pack-for-all-types-of-200x200-imaee4j2b8dyrsfy.jpeg,Health and Beauty>Body and Skin Care>Face Care>Face Packs,999.0,999.0,999.0,true,FCPEE4WVVVUGMWPU,FCPEE4WVVVUGMWPU
Flipkart,,Khadi Natural Hill's Queen Tulsi Face Pack(400 g),"Effects: An excellent face pack for dry and normal skin. It effectively removes dirt, leaves skin feeling refreshed and moisturised. It helps to remove black heads, dry fine lines, wrinkles and reduces occurrence of pimples. It nourishes the skin properly.Method: Take two spoon of Tulsi Herbal Ubtan and mix it with fresh milk or water to make a paste. Apply this paste evenly on face, neck and hands. Let it dry for some time. Then wash it off with water.",Khadi Natural,http://dl.flipkart.com/dl/khadi-natural-hill-s-queen-tulsi-face-pack/p/itmekcchmzzcedzd?pid=FCPE6FWHDKHHKPKB&affid=siddarthk,http://img.fkcdn.com/image/face-pack/p/k/b/khadi-400-hill-s-queen-tulsi-face-pack-200x200-imae62byhhvzgatg.jpeg,Health and Beauty>Body and Skin Care>Face Care>Face Packs,300.0,250.0,250.0,true,FCPE6FWHDKHHKPKB,FCPE6FWHDKHHKPKB
Flipkart,,Khadi Natural Hill's Queen Sandal Face Pack(400 g),"Effects: An excellent face pack for dry and normal skin. It removes dry fine lines, blackheads, dark under eye circles and conditions the dry and under nourished skin. It moisturizes the skin with perfection.Method: Take two spoon of Chandan Herbal Ubtan and mix it with fresh milk or water to make a paste. Apply this paste evenly on face, neck and hands. Let it dry for some time. Then wash it off with water.",Khadi Natural,http://dl.flipkart.com/dl/khadi-natural-hill-s-queen-sandal-face-pack/p/itmekcchdxkbk5ht?pid=FCPE6FWHMRNE3XZW&affid=siddarthk,http://img.fkcdn.com/image/face-pack/x/z/w/khadi-400-hill-s-queen-sandal-face-pack-200x200-imae62bybjuhby2p.jpeg,Health and Beauty>Body and Skin Care>Face Care>Face Packs,300.0,300.0,300.0,true,FCPE6FWHMRNE3XZW,FCPE6FWHMRNE3XZW
Flipkart,,Khadi Natural Hill's Queen Sandal Face pack(100 g),,Khadi Natural,http://dl.flipkart.com/dl/khadi-natural-hill-s-queen-sandal-face-pack/p/itmekcchdxkbk5ht?pid=FCPE3F9AVGHXWE88&affid=siddarthk,http://img.fkcdn.com/image/face-pack/e/8/8/khadi-100-hill-s-queen-sandal-face-pack-200x200-imae3ff23hrwmmmq.jpeg,Health and Beauty>Body and Skin Care>Face Care>Face Packs,75.0,75.0,75.0,false,FCPE3F9AVGHXWE88,FCPE3F9AVGHXWE88
Flipkart,,Qudrat Organic Ashwagandha Powder(100 g),"Qudrat Ashwagandha Root Powder is excellent for skin care and has anti-wrinkle properties. Qudrat Ashwagandha Root Powder is used as an adaptogen to help the body cope with daily stress, and as a general tonic. Mix Qudrat Ashwagandha Root Powder with water to reduce backache.All the products are for personal use and not for resale. The product description has not been evaluated by the food & drug administration(FDA). The product is not intended to diagnose, treat, cure or prevent any diseases. The product should not be used by pregnant ladies, lactating mothers and children below 18 years of age without consultation of a medical practitioner.",Qudrat,http://dl.flipkart.com/dl/qudrat-organic-ashwagandha-powder/p/itmefe7qbaxpuhmh?pid=FCPEFE7Q53HAAMCA&affid=siddarthk,http://img.fkcdn.com/image/face-pack/m/c/a/qudrat-100-organic-ashwagandha-powder-200x200-imaefd4bnfvc4mxg.jpeg,Health and Beauty>Body and Skin Care>Face Care>Face Packs,300.0,250.0,250.0,true,FCPEFE7Q53HAAMCA,FCPEFE7Q53HAAMCA
Flipkart,,"Mohneysaa Magick Belly Beauty Intimate Cream(150 g, Pack of 1)",,Mohneysaa Magick,http://dl.flipkart.com/dl/mohneysaa-magick-belly-beauty-intimate-cream/p/itmeckztyuynefnr?pid=WICECKZTHAEKTZYA&affid=siddarthk,http://img.fkcdn.com/image/women-intimate-care/z/y/a/mohneysaa-magick-150-belly-beauty-200x200-imaeckf32r8yzafh.jpeg,Health and Beauty>Women's Hygiene>Intimate Care,750.0,750.0,750.0,false,WICECKZTHAEKTZYA,WICECKZTHAEKTZYA
Flipkart,,Lotus Natural Kajal (Set of 2) 8 g(Black),"Key Features: Smudge-proof,Eye Relaxation, Botanical Extracts Soothing 100% Natural Kajal, Promote Lash Growth Oil to Pamper Eyes, Long-lasting. Add beauty to your eyes by wearing this kajal that comes to you from the house of Lotus Herbals. Enriched with the richness of herbs, this kajal is 100 per cent natural. Botanical ExtractsThe botanical extracts provide you the necessary nourishment that give you healthy and beautiful eyes. Smudge-Proof Wear this kajal and stay confident the whole day as this kajal is smudge-proof. Oil To Pamper EyesContaining natural oil that pampers your eyes, Natural Kajal (Black) is definitely an essential in your makeup kit. Promote Lash Growth, get those desired, thick lashes as this kajal promotes lash growth.",Lotus,http://dl.flipkart.com/dl/lotus-natural-kajal-set-2-8-g/p/itmdsmgj9avpdgcg?pid=KJLDSMGJGZ8KG9HZ&affid=siddarthk,http://img.fkcdn.com/image/kajal/9/h/z/lotus-8-natural-kajal-set-of-2-200x200-imadsk7aq2q8tfjf.jpeg,Health and Beauty>Makeup>Eyes>Kajal,270.0,270.0,270.0,false,KJLDSMGJGZ8KG9HZ,KJLDSMGJGZ8KG9HZ
Flipkart,,VLCC Kajal with Offer 2.5 g(Black),,VLCC,http://dl.flipkart.com/dl/vlcc-kajal-offer-2-5-g/p/itmdp2bttytcbkfx?pid=KJLDP2BTRVZYHGZE&affid=siddarthk,http://img.fkcdn.com/image/kajal/g/z/e/vlcc-2-5-kajal-with-offer-200x200-imadp2e8hemfhbja.jpeg,Health and Beauty>Makeup>Eyes>Kajal,150.0,138.0,138.0,true,KJLDP2BTRVZYHGZE,KJLDP2BTRVZYHGZE
Flipkart,,Coloressence Kajal Pencil 0.25 g(Black),"Would you believe that just one stroke with this dark kajal pencil has the ability to transform your appearance in just a matter of seconds? Try not to lock just anyone in the sharp gaze of your well-defined eyes, as they simply will not be able to stop staring. Making use of all organic ingredients this remarkable Kajal Pencil will give your alluring eyes just the definition they need to stop anyone cold in their tracks. The Coloressence Kajal Pencil is an easy way to achieve those dark, sultry eyes, you’ve always wanted, with one easy stroke. Give your peepers a mysterious yet mesmerising look, so that your eyes only say what you want them to, by going over your lids with this deep black Kajal Pencil. The black pigment uses a unique ayurvedic formula, to keep your eyes cool and comfortable, while delivering razor-sharp definition, just the way you like. Remember you go over your doe-like eyes with this must-have Kajal Pencil, and pay close attention to the mirror, or you will miss the subtlety with which it transforms your appearance. The instant solution to dark circles thanks to late, overworked nights, one stroke of the easy-to-apply Coloressence Kajal Pencil will bring an instant glow to your face while hiding all the tiredness and fatigue. What’s more the formulation of organic ingredients also helps improve vision and brightens your tired eyes. Women looking for a great choice from all the Kajal pencils and applicators available in the market needn’t look further than this convenient stick type kajal that will make giving your eyes a little definition easier than ever. You needn’t worry about damage to your eyes, as the Coloressence Kajal Pencil has been created to be especially gentle on the eyes and safe to use as and when you like.",Coloressence,http://dl.flipkart.com/dl/coloressence-kajal-pencil-0-25-g/p/itmdawwhytynsnyd?pid=KJLDAWUN54UUHDYG&affid=siddarthk,http://img.fkcdn.com/image/kajal/d/y/g/coloressence-0-25-kajal-pencil-200x200-imadjdy9eg3brfnf.jpeg,Health and Beauty>Makeup>Eyes>Kajal,145.0,140.0,140.0,true,KJLDAWUN54UUHDYG,KJLDAWUN54UUHDYG
Flipkart,,Amura 12 Hrs Professional Herbal Kajal 3.5 g(Black),"Amura Kajal being made from natural ingredients it gives a cooling effect to the eyes, it cleanses the eyes by wiping out the dirt; it also improves vision and strengthens the eyes. Free from Zinc & Lead unlike other commercially available Kajals has no side effects.",Amura,http://dl.flipkart.com/dl/amura-12-hrs-professional-herbal-kajal-3-5-g/p/itme2pj7xjp6cyyf?pid=KJLE2PJ7AHJTHBFS&affid=siddarthk,http://img.fkcdn.com/image/kajal/b/f/s/amura-3-5-12-hrs-professional-herbal-kajal-original-imae2nhf3x6fgmzu.jpeg,Health and Beauty>Makeup>Eyes>Kajal,129.0,116.0,116.0,true,KJLE2PJ7AHJTHBFS,KJLE2PJ7AHJTHBFS
Flipkart,,Amura Loose Face Powder Compact  - 25 g,"A silky, ultra-fine powder specially formulated to lift and disperse oils, and ""blot"" the face without leaving a powder trace. Provides sheer, matte velvety coverage. Long-wearing.",Amura,http://dl.flipkart.com/dl/amura-loose-face-powder-compact-25-g/p/itme2ppvwahevzuy?pid=CMPE2PPVHVVBUZHR&affid=siddarthk,http://img.fkcdn.com/image/compact/z/h/r/amura-25-loose-face-powder-200x200-imae2zdfn4ahdh65.jpeg,Health and Beauty>Makeup>Face>Compacts,324.0,291.0,291.0,true,CMPE2PPVHVVBUZHR,CMPE2PPVHVVBUZHR
Flipkart,,Salus BOUFFANT CAP BLUE Surgical Head Cap,,Salus,http://dl.flipkart.com/dl/salus-bouffant-cap-blue-surgical-head/p/itmefazcwhvkbz5t?pid=SAAEFAZB2GZCW2XM&affid=siddarthk,http://img.fkcdn.com/image/surgical-head-cap/2/x/m/bouffant-cap-blue-salus-200x200-imaeeu5en5ehdyhx.jpeg,Health and Beauty>Health Care>Medical Equipment & Accessories,499.0,250.0,250.0,true,SAAEFAZB2GZCW2XM,SAAEFAZB2GZCW2XM
Flipkart,,Avera Regrowth Hair Oil,"Avera Hair Re-growth Oil is effective in controlling hair loss. It is formulated with natural ingredients like olive oil, sunflower, mustard oil, bhringraj water extract and triphala extract. It fights against all bacteria and fungus that cause damages to your hair. It nourishes your hair from the root and reduces itching and dryness of scalp. The oil is non-sticky and conditions the scalp by improving blood circulation to the hair follicles. This hair regrowth oil strengthens each strand of your hair and leaves you with thick and healthy hair.",Avera,http://dl.flipkart.com/dl/avera-regrowth-hair-oil/p/itmdt76tqtskv57z?pid=HOLDSNC68QCFWJDF&affid=siddarthk,http://img.fkcdn.com/image/hair-oil/j/d/f/avera-essentials-100-regrowth-200x200-imadsz6qfgsurjvf.jpeg,Health and Beauty>Mens Grooming>Hair Care>Hair Oils,299.0,199.0,199.0,true,HOLDSNC68QCFWJDF,HOLDSNC68QCFWJDF
