PartnerName,Id,Title,Description,Brand,Link,ImageLink,CategoryName,Mrp,OfferPrice,EffectivePrice,Availability,PartnerIdFromUrl,PartnerIdFromDb
Flipkart,,Majik Wig tape transparent Small Size Hair Accessory Set(Red),"Red Liner - small Roll - 10mm x 5 meters for Hair Wig/Hair system - 1 Piece Hold Time: 2-3 days This is a very low residue tape, which is popular for use on poly units due to its easy cleanupThis is the most widely used hairpiece tape for permanent attachment. Do not be misled by the name, this tape is definitely clear. It is more water resistant than other tapes and has a strong holding strength.It is popular for use on poly units due to its easy cleanup. So if you need a low residue and easy cleanup daily wear or extended wear tape made for units with polyurethane, this is the tape for you.",Majik,http://dl.flipkart.com/dl/majik-wig-tape-transparent-small-size-hair-accessory-set/p/itmeh9kwy9sufcb4?pid=HACEH9KWA3VTNKHC&affid=siddarthk,http://img.fkcdn.com/image/hair-accessory/k/h/c/108-1-majik-wig-tape-transparent-small-size-200x200-imaekjn5m7htznam.jpeg,Health and Beauty>Hair Care>Hair Care Accessories>Hair Accessories,799.0,404.0,449.0,false,HACEH9KWA3VTNKHC,HACEH9KWA3VTNKHC
Flipkart,,"Young & Forever Stylish Hippie In Me Boho Turqoise Head Band(Silver, Blue)",Explore the Greek goddess in you with this happening headband tiara. This silver plated hair tiara is made up of intricately crafted round shape motifs and turqoise stones along with an adjustable lobster clasp chain band. Store it in a ziplock pouch along with a piece of chalk to retain their shine for long.,Young & Forever,http://dl.flipkart.com/dl/young-forever-stylish-hippie-me-boho-turqoise-head-band/p/itmeh9dcqwndxufj?pid=HACEH9DCZWPNWUV9&affid=siddarthk,http://img.fkcdn.com/image/hair-accessory/u/v/9/ha90173-1-young-forever-stylish-hippie-in-me-boho-turqoise-200x200-imaeh976zvrhz8wu.jpeg,Health and Beauty>Hair Care>Hair Care Accessories>Hair Accessories,1570.0,518.0,740.0,true,HACEH9DCZWPNWUV9,HACEH9DCZWPNWUV9
Flipkart,,"Young & Forever Polka Rabbit Ear Wired Head Band(Red, White)","Savor the flavor of cool summer fashion. A chiffon head wrap brightens your ‘do with a refreshing polka print. Use as a headband, scarf, wrist wrap, ponytail holder or weave into your braid to add dramatic flare to any outfit.",Young & Forever,http://dl.flipkart.com/dl/young-forever-polka-rabbit-ear-wired-head-band/p/itmeh9eqrzn2be9b?pid=HACEH9EQ8U9YN3NQ&affid=siddarthk,http://img.fkcdn.com/image/hair-accessory/3/n/q/ha90179-1-young-forever-polka-rabbit-ear-wired-200x200-imaeh9cvjxbzwxdg.jpeg,Health and Beauty>Hair Care>Hair Care Accessories>Hair Accessories,1370.0,448.0,640.0,true,HACEH9EQ8U9YN3NQ,HACEH9EQ8U9YN3NQ
Flipkart,,Majik Replacement tape for Wigs Hair Accessory Set(Red),"Red Liner - small Roll - 10mm x 5 meters for Hair Wig/Hair system - 1 Piece Hold Time: 2-3 days This is a very low residue tape, which is popular for use on poly units due to its easy cleanupThis is the most widely used hairpiece tape for permanent attachment. Do not be misled by the name, this tape is definitely clear. It is more water resistant than other tapes and has a strong holding strength.It is popular for use on poly units due to its easy cleanup. So if you need a low residue and easy cleanup daily wear or extended wear tape made for units with polyurethane, this is the tape for you.",Majik,http://dl.flipkart.com/dl/majik-replacement-tape-wigs-hair-accessory-set/p/itmeh9kvszerbwuc?pid=HACEH9KVCYHGRZBN&affid=siddarthk,http://img.fkcdn.com/image/hair-accessory/k/h/c/108-1-majik-wig-tape-transparent-small-size-200x200-imaekjn5m7htznam.jpeg,Health and Beauty>Hair Care>Hair Care Accessories>Hair Accessories,999.0,404.0,449.0,false,HACEH9KVCYHGRZBN,HACEH9KVCYHGRZBN
Flipkart,,"Young & Forever Floral Rabbit Ear Wired Head Band(Blue, White)",,Young & Forever,http://dl.flipkart.com/dl/young-forever-floral-rabbit-ear-wired-head-band/p/itmeh9fqxjcghujg?pid=HACEH9FQWZMDBQWZ&affid=siddarthk,http://img.fkcdn.com/image/hair-accessory/q/w/z/ha90178-1-young-forever-floral-rabbit-ear-wired-200x200-imaeh9c755g2n3bb.jpeg,Health and Beauty>Hair Care>Hair Care Accessories>Hair Accessories,1370.0,448.0,640.0,true,HACEH9FQWZMDBQWZ,HACEH9FQWZMDBQWZ
Flipkart,,Majik Replacement tape for wig set of 2 small Hair Accessory Set(Red),"Red Liner - small Roll - 10mm x 5 meters for Hair Wig/Hair system - 1 Piece Hold Time: 2-3 days This is a very low residue tape, which is popular for use on poly units due to its easy cleanupThis is the most widely used hairpiece tape for permanent attachment. Do not be misled by the name, this tape is definitely clear. It is more water resistant than other tapes and has a strong holding strength.It is popular for use on poly units due to its easy cleanup. So if you need a low residue and easy cleanup daily wear or extended wear tape made for units with polyurethane, this is the tape for you.",Majik,http://dl.flipkart.com/dl/majik-replacement-tape-wig-set-2-small-hair-accessory/p/itmeh9h2zegxckdh?pid=HACEH9H2FX9FNBVQ&affid=siddarthk,http://img.fkcdn.com/image/hair-accessory/b/v/q/114-2-majik-replacement-tape-for-wig-set-of-2-small-200x200-imaekjpefk34hhwq.jpeg,Health and Beauty>Hair Care>Hair Care Accessories>Hair Accessories,1200.0,764.0,849.0,false,HACEH9H2FX9FNBVQ,HACEH9H2FX9FNBVQ
Flipkart,,Beeline Pearl Kundan Gold Plated Hair Pin(Gold),"Brides who love Half moon shape beautiful Maharashtrian hair brooch embedded with sparkling finish and kundan is perfect to team with traditional costumes.  It has Golden bead droplet for added attraction.  This metal crafted ambada pin is superior in quality and easy to use. Flower designed this golden finish red green color Maharashtrian hair bun pin is perfect to team with traditional costumes. It is embedded with polki stones and crafted from metal. This traditional ambada pin is easy to use and good in quality as well. Beautiful traditional stone, Ambada designs Head-dress - hair ornament craft from India",Beeline,http://dl.flipkart.com/dl/beeline-pearl-kundan-gold-plated-hair-pin/p/itmejzvryedagzah?pid=HACEJZVRUGKGHHT3&affid=siddarthk,http://img.fkcdn.com/image/hair-accessory/h/t/3/hc5796-1-beeline-pearl-kundan-gold-plated-200x200-imaejwanwkv4rpja.jpeg,Health and Beauty>Hair Care>Hair Care Accessories>Hair Accessories,1399.0,750.0,750.0,false,HACEJZVRUGKGHHT3,HACEJZVRUGKGHHT3
Flipkart,,Young & Forever Floral Rabbit Ear Wired Head Band(Multicolor),"Savor the flavor of cool summer fashion. A chiffon head wrap brightens your ‘do with a refreshing floral print. Use as a headband, scarf, wrist wrap, ponytail holder or weave into your braid to add dramatic flare to any outfit.",Young & Forever,http://dl.flipkart.com/dl/young-forever-floral-rabbit-ear-wired-head-band/p/itmeh9erkhk2gauh?pid=HACEH9ERTKFZBFCJ&affid=siddarthk,http://img.fkcdn.com/image/hair-accessory/f/c/j/ha90180-1-young-forever-floral-rabbit-ear-wired-200x200-imaeh9dkzxq9mgug.jpeg,Health and Beauty>Hair Care>Hair Care Accessories>Hair Accessories,1440.0,472.0,675.0,true,HACEH9ERTKFZBFCJ,HACEH9ERTKFZBFCJ
Flipkart,,Majik Hair Base 2 Pcs with 1 Pcs Braid Tool Hair Accessory Set(Black),"A beautiful french braid will not out of date when you are at meeting, work, wedding,party or dating, it will let you stand out and become the amazing focus in these places.Our french hair braiding tool are made from high quality resin material, long-lasting and flexible, with these braiding tools that help you easy to creat a proffesional french braid2 VOLUME BASE DIY STYLING SOFT VELCRO LADY HAIR STYLE PARTY MAKEUP INSERT TOOL 100% Brand New and High Quality It is very easy to use Not afraid of your Head Type.",Majik,http://dl.flipkart.com/dl/majik-hair-base-2-pcs-1-braid-tool-accessory-set/p/itmeh9gee59gsere?pid=HACEH9GEPQ4UWKX9&affid=siddarthk,http://img.fkcdn.com/image/hair-accessory/b/h/t/236-3-majik-base-2-pcs-with-1-pcs-braid-tool-200x200-imaeh97u8nd9gapa.jpeg,Health and Beauty>Hair Care>Hair Care Accessories>Hair Accessories,399.0,224.0,249.0,true,HACEH9GEPQ4UWKX9,HACEH9GEPQ4UWKX9
Flipkart,,Beeline Designer Kemp Pearl Kundan Wedding Jewellery For Women Hair Pin(Gold),Brides who love Half moon shape beautiful Maharashtrian hair brooch embedded with sparkling finish and kundan is perfect to team with traditional costumes. It has pearl bead droplet for added attraction. This metal crafted ambada pin is superior in quality and easy to use. Creatively designed this golden finish kemp color Maharashtrian hair bun pin is perfect to team with traditional costumes. It is embedded with polki stones and crafted from metal. This traditional ambada pin is easy to use and good in quality as well.,Beeline,http://dl.flipkart.com/dl/beeline-designer-kemp-pearl-kundan-wedding-jewellery-women-hair-pin/p/itmejyg6rrjwz4yd?pid=HACEJYG6EUPZJH6J&affid=siddarthk,http://img.fkcdn.com/image/hair-accessory/h/6/j/hc5818-1-beeline-designer-kemp-pearl-kundan-wedding-jewellery-200x200-imaejw9smgejxwgv.jpeg,Health and Beauty>Hair Care>Hair Care Accessories>Hair Accessories,1499.0,750.0,750.0,false,HACEJYG6EUPZJH6J,HACEJYG6EUPZJH6J
Flipkart,,"Young & Forever Cute Floral bow Collection Head Band(Blue, White, Green)",Add a pop of so-pretty style to your dearest with this adorable headband.,Young & Forever,http://dl.flipkart.com/dl/young-forever-cute-floral-bow-collection-head-band/p/itmeh9g7zrg3urvq?pid=HACEH9G7WEZEGZ7C&affid=siddarthk,http://img.fkcdn.com/image/hair-accessory/z/7/c/ha90167-1-young-forever-cute-floral-bow-collection-200x200-imaeh77egrejgf4y.jpeg,Health and Beauty>Hair Care>Hair Care Accessories>Hair Accessories,1600.0,528.0,755.0,true,HACEH9G7WEZEGZ7C,HACEH9G7WEZEGZ7C
Flipkart,,"Young & Forever Fashionable lucky charm Hair Pin(Silver, Black)","When you are feeling out of this world and want a new fun way to put up your hair, try the newest hair jewelry. These are easy to use and for all hair types.",Young & Forever,http://dl.flipkart.com/dl/young-forever-fashionable-lucky-charm-hair-pin/p/itmeh9fq3fmzpguv?pid=HACEH9FPHFRS9STN&affid=siddarthk,http://img.fkcdn.com/image/hair-accessory/s/t/n/ha90177-1-young-forever-fashionable-lucky-charm-200x200-imaeh9bmmkedgknt.jpeg,Health and Beauty>Hair Care>Hair Care Accessories>Hair Accessories,1440.0,472.0,675.0,true,HACEH9FPHFRS9STN,HACEH9FPHFRS9STN
Flipkart,,"Young & Forever Cute Plum Bow Head Band(Red, Beige)",Add a pop of so-pretty style to your dearest with this adorable headband.,Young & Forever,http://dl.flipkart.com/dl/young-forever-cute-plum-bow-head-band/p/itmeh7ssftwrguxh?pid=HACEH7SSPGHEHFCB&affid=siddarthk,http://img.fkcdn.com/image/hair-accessory/f/c/b/ha90163-1-young-forever-cute-plum-bow-200x200-imaeh74yg6apyy5e.jpeg,Health and Beauty>Hair Care>Hair Care Accessories>Hair Accessories,1540.0,507.0,725.0,true,HACEH7SSPGHEHFCB,HACEH7SSPGHEHFCB
Flipkart,,Fashion Neck Baby Girl Hair Band(Blue),Cloth hair band with ribbon flower on top beautiful for babies& girls of teen age,Fashion Neck,http://dl.flipkart.com/dl/fashion-neck-baby-girl-hair-band/p/itmeh778xzuu48gb?pid=HACEH7786RZ6EBKG&affid=siddarthk,http://img.fkcdn.com/image/hair-accessory/b/k/g/fn-78-1-fashion-neck-baby-girl-200x200-imaeh2r9yptzjfqg.jpeg,Health and Beauty>Hair Care>Hair Care Accessories>Hair Accessories,599.0,299.0,299.0,true,HACEH7786RZ6EBKG,HACEH7786RZ6EBKG
Flipkart,,Fashion Neck Baby Girl Hair Band(Blue),Cloth hair band with red dotted flower on top beautiful for babies& girls of teen age,Fashion Neck,http://dl.flipkart.com/dl/fashion-neck-baby-girl-hair-band/p/itmeh7782ysyskdg?pid=HACEH778ZZQEMAGD&affid=siddarthk,http://img.fkcdn.com/image/hair-accessory/a/g/d/fn-75-1-fashion-neck-baby-girl-200x200-imaeh2r92mzmk7yz.jpeg,Health and Beauty>Hair Care>Hair Care Accessories>Hair Accessories,599.0,299.0,299.0,true,HACEH778ZZQEMAGD,HACEH778ZZQEMAGD
Flipkart,,Fashion Neck Baby Girl Hair Band,Cloth hair band with ribbon flower on top beautiful for babies& girls of teen age,Fashion Neck,http://dl.flipkart.com/dl/fashion-neck-baby-girl-hair-band/p/itmeh778zcvmvek5?pid=HACEH778ZG6FQHHZ&affid=siddarthk,http://img.fkcdn.com/image/hair-accessory/h/h/z/fn-82-1-fashion-neck-baby-girl-200x200-imaeh2r93dvzkzmh.jpeg,Health and Beauty>Hair Care>Hair Care Accessories>Hair Accessories,599.0,299.0,299.0,true,HACEH778ZG6FQHHZ,HACEH778ZG6FQHHZ
Flipkart,,BGS HA-Diva Rubber Band,BGS Beige & Black Rubber Band,BGS,http://dl.flipkart.com/dl/bgs-ha-diva-rubber-band/p/itme64sudtgygph6?pid=HACE64SUKAKQNHJP&affid=siddarthk,http://img.fkcdn.com/image/hair-accessory/h/j/p/rb-072-1-bgs-rubber-band-ha-diva-200x200-imae65z3ez9tjqwk.jpeg,Health and Beauty>Hair Care>Hair Care Accessories>Hair Accessories,799.0,399.0,399.0,true,HACE64SUKAKQNHJP,HACE64SUKAKQNHJP
Flipkart,,Fashion Neck Baby Girl Hair Band(Purple),Cloth hair band with ribbon flower on top beautiful for babies& girls of teen age,Fashion Neck,http://dl.flipkart.com/dl/fashion-neck-baby-girl-hair-band/p/itmeh778ehkvghbg?pid=HACEH778Q77XMKE6&affid=siddarthk,http://img.fkcdn.com/image/hair-accessory/k/e/6/fn-77-1-fashion-neck-baby-girl-200x200-imaeh2r9xttet8te.jpeg,Health and Beauty>Hair Care>Hair Care Accessories>Hair Accessories,599.0,299.0,299.0,true,HACEH778Q77XMKE6,HACEH778Q77XMKE6
Flipkart,,BGS HA-Diva Hair Clip,BGS Black & Beige Hair Clip For Women,BGS,http://dl.flipkart.com/dl/bgs-ha-diva-hair-clip/p/itme64su3jttrrh7?pid=HACE64SUDNSYQUFA&affid=siddarthk,http://img.fkcdn.com/image/hair-accessory/u/f/a/hc-023-1-bgs-hair-clip-ha-diva-200x200-imae65z3gavckhkz.jpeg,Health and Beauty>Hair Care>Hair Care Accessories>Hair Accessories,999.0,499.0,499.0,true,HACE64SUDNSYQUFA,HACE64SUDNSYQUFA
Flipkart,,BGS Alloy With Plastics Hair Claw,BGS Elegance Fashion Clutcher,BGS,http://dl.flipkart.com/dl/bgs-alloy-plastics-hair-claw/p/itme7gnvdeaghxhh?pid=HACE7FFHHYH4NDHM&affid=siddarthk,http://img.fkcdn.com/image/hair-accessory/d/h/m/cl-887-1-bgs-hair-claw-alloy-with-plastics-200x200-imae7grnyxumhb5q.jpeg,Health and Beauty>Hair Care>Hair Care Accessories>Hair Accessories,599.0,299.0,299.0,false,HACE7FFHHYH4NDHM,HACE7FFHHYH4NDHM
Flipkart,,BGS HA-Diva Rubber Band,BGS Beige & Black Rubber Band,BGS,http://dl.flipkart.com/dl/bgs-ha-diva-rubber-band/p/itme64sunhp8kfer?pid=HACE64SUKV2WGTZR&affid=siddarthk,http://img.fkcdn.com/image/hair-accessory/t/z/r/rb-069-1-bgs-rubber-band-ha-diva-200x200-imae65z3sgcja4vs.jpeg,Health and Beauty>Hair Care>Hair Care Accessories>Hair Accessories,799.0,399.0,399.0,true,HACE64SUKV2WGTZR,HACE64SUKV2WGTZR
Flipkart,,Pink Rose Pink Floral Hairband with Rubberband Hair Band(Pink),Goodluck presents a beautiful Combo of Pink Floral Hairbands with matching Rubberbands,Pink Rose,http://dl.flipkart.com/dl/pink-rose-floral-hairband-rubberband-hair-band/p/itmeh7ssk8xqpfs9?pid=HACEH7SSKPJVNB2M&affid=siddarthk,http://img.fkcdn.com/image/hair-accessory/b/2/m/gd0000565-a-5-pink-rose-pink-floral-hairband-with-rubberband-200x200-imaeh7yzg4duvpxy.jpeg,Health and Beauty>Hair Care>Hair Care Accessories>Hair Accessories,1200.0,600.0,600.0,true,HACEH7SSKPJVNB2M,HACEH7SSKPJVNB2M
Flipkart,,Pink Rose Hair and Rubberband Hair Accessory Set(Multicolor),Goodluck presents a beautiful Combo of Pink Floral Hairband with Rubberbands & Bracelet,Pink Rose,http://dl.flipkart.com/dl/pink-rose-hair-rubberband-accessory-set/p/itmeh77dfxfkwpdh?pid=HACEH77DHYY3CZNQ&affid=siddarthk,http://img.fkcdn.com/image/hair-accessory/z/n/q/gd0000563-a-5-pink-rose-hair-and-rubberband-200x200-imaeh7y43zgmgxkv.jpeg,Health and Beauty>Hair Care>Hair Care Accessories>Hair Accessories,1200.0,400.0,400.0,true,HACEH77DHYY3CZNQ,HACEH77DHYY3CZNQ
Flipkart,,Majik Wig attachment tape set of 2 small size Hair Accessory Set(Red),"Red Liner - small Roll - 10mm x 5 meters for Hair Wig/Hair system - 1 Piece Hold Time: 2-3 days This is a very low residue tape, which is popular for use on poly units due to its easy cleanupThis is the most widely used hairpiece tape for permanent attachment. Do not be misled by the name, this tape is definitely clear. It is more water resistant than other tapes and has a strong holding strength.It is popular for use on poly units due to its easy cleanup. So if you need a low residue and easy cleanup daily wear or extended wear tape made for units with polyurethane, this is the tape for you.0",Majik,http://dl.flipkart.com/dl/majik-wig-attachment-tape-set-2-small-size-hair-accessory/p/itmeh7ssyjtbtqra?pid=HACEH7SSKTFCGS7D&affid=siddarthk,http://img.fkcdn.com/image/hair-accessory/b/v/q/114-2-majik-replacement-tape-for-wig-set-of-2-small-200x200-imaekjpefk34hhwq.jpeg,Health and Beauty>Hair Care>Hair Care Accessories>Hair Accessories,1100.0,764.0,849.0,false,HACEH7SSKTFCGS7D,HACEH7SSKTFCGS7D
Flipkart,,Sweet Girl hhbb Hair Band(Multicolor),,Sweet Girl,http://dl.flipkart.com/dl/sweet-girl-hhbb-hair-band/p/itmeh6c7gcjsf8gh?pid=HACEH6C7CMY68P2A&affid=siddarthk,http://img.fkcdn.com/image/hair-accessory/p/2/a/20369-6-sweet-girl-hhbb-200x200-imaeh5ykygffupyc.jpeg,Health and Beauty>Hair Care>Hair Care Accessories>Hair Accessories,999.0,289.0,289.0,true,HACEH6C7CMY68P2A,HACEH6C7CMY68P2A
Flipkart,,"Young & Forever Cute Princess Glitter Crown Hair Band(Silver, Grey, Black)",Add a pop of so-pretty style to your dearest with this adorable headband.,Young & Forever,http://dl.flipkart.com/dl/young-forever-cute-princess-glitter-crown-hair-band/p/itmeh7ssxbhvrusk?pid=HACEH7SSURGEDUTF&affid=siddarthk,http://img.fkcdn.com/image/hair-accessory/u/t/f/ha90169-1-young-forever-cute-princess-glitter-crown-200x200-imaeh785bhjmyefn.jpeg,Health and Beauty>Hair Care>Hair Care Accessories>Hair Accessories,1600.0,528.0,755.0,true,HACEH7SSURGEDUTF,HACEH7SSURGEDUTF
Flipkart,,Sweet Girl vgdfrt Hair Band(Multicolor),,Sweet Girl,http://dl.flipkart.com/dl/sweet-girl-vgdfrt-hair-band/p/itmeh5x4ecnxsq93?pid=HACEH5X4UNCFK4WF&affid=siddarthk,http://img.fkcdn.com/image/hair-accessory/p/2/a/20369-6-sweet-girl-hhbb-200x200-imaeh5ykygffupyc.jpeg,Health and Beauty>Hair Care>Hair Care Accessories>Hair Accessories,999.0,299.0,299.0,true,HACEH5X4UNCFK4WF,HACEH5X4UNCFK4WF
Flipkart,,Sweet Girl elastic HB Hair Band(Black),,Sweet Girl,http://dl.flipkart.com/dl/sweet-girl-elastic-hb-hair-band/p/itmeh5x5wdx8fknc?pid=HACEH5X5J6JBUMG4&affid=siddarthk,http://img.fkcdn.com/image/hair-accessory/m/g/4/7896-1-sweet-girl-elastic-hb-200x200-imaeh5yg7ahaxmtx.jpeg,Health and Beauty>Hair Care>Hair Care Accessories>Hair Accessories,999.0,169.0,169.0,true,HACEH5X5J6JBUMG4,HACEH5X5J6JBUMG4
Flipkart,,"Young & Forever Princess Crystal & Pearl Floral Vine Head Band(Silver, White, Black)","Explore your angelic aura with this Greek Goddess head band made up of silver finished metal. This piece of elasticated hair jewellery is intricately designed & embellished with diamante, clear crystals & Pearls in various shapes and sizes. Store it in separate ziplock pouches in flat position to avoid tangling and damaging.",Young & Forever,http://dl.flipkart.com/dl/young-forever-princess-crystal-pearl-floral-vine-head-band/p/itmeh7ssjbfbknph?pid=HACEH7SSVZ7MWMHM&affid=siddarthk,http://img.fkcdn.com/image/hair-accessory/m/h/m/ha90172-1-young-forever-princess-crystal-pearl-floral-vine-200x200-imaeh7a6yshrk4kp.jpeg,Health and Beauty>Hair Care>Hair Care Accessories>Hair Accessories,1740.0,577.0,825.0,true,HACEH7SSVZ7MWMHM,HACEH7SSVZ7MWMHM
Flipkart,,"Young & Forever Cute Bunny Rabbit Ears Head Band(Gold, Yellow)",Add a pop of so-pretty style to your dearest with this adorable headband.,Young & Forever,http://dl.flipkart.com/dl/young-forever-cute-bunny-rabbit-ears-head-band/p/itmeh7ssvbjv2m2v?pid=HACEH7SSSPJHBCGZ&affid=siddarthk,http://img.fkcdn.com/image/hair-accessory/c/g/z/ha90166-1-young-forever-cute-bunny-rabbit-ears-200x200-imaeh76j8kmh3twr.jpeg,Health and Beauty>Hair Care>Hair Care Accessories>Hair Accessories,1600.0,528.0,755.0,true,HACEH7SSSPJHBCGZ,HACEH7SSSPJHBCGZ
Flipkart,,Chetna 7 PC Hair Accessory Set(Multicolor),Pair of Tic Tac and One Piece Hair Claw,Chetna,http://dl.flipkart.com/dl/chetna-7-pc-hair-accessory-set/p/itmeefczqghauatg?pid=HACEEFCZZG8Z3BF3&affid=siddarthk,http://img.fkcdn.com/image/hair-accessory/b/f/3/chttpm7pc-13-chetna-hair-accessory-set-7-pc-200x200-imaeeydgzygdtrzg.jpeg,Health and Beauty>Hair Care>Hair Care Accessories>Hair Accessories,549.0,323.0,323.0,true,HACEEFCZZG8Z3BF3,HACEEFCZZG8Z3BF3
Flipkart,,Chetna Tic Tac 6Pair Tic Tac Clip(Multicolor),6 Pair Tic Tac,Chetna,http://dl.flipkart.com/dl/chetna-tic-tac-6pair-clip/p/itmeefcydzbvn5fw?pid=HACEEFCYEPXNQZ46&affid=siddarthk,http://img.fkcdn.com/image/hair-accessory/z/4/6/chttpm6pc-12-chetna-tic-tac-clip-tic-tac-6pair-200x200-imaeeydaxhw69qzj.jpeg,Health and Beauty>Hair Care>Hair Care Accessories>Hair Accessories,499.0,323.0,323.0,true,HACEEFCYEPXNQZ46,HACEEFCYEPXNQZ46
Flipkart,,Chetna 6Pair 1 Tic Tac Clip(Multicolor),6 Pairs of Tic Tac,Chetna,http://dl.flipkart.com/dl/chetna-6pair-1-tic-tac-clip/p/itmeefcyqc9brf89?pid=HACEEFCYDUCJJV7Z&affid=siddarthk,http://img.fkcdn.com/image/hair-accessory/v/7/z/chttpm6pc1-12-chetna-tic-tac-clip-6pair-1-200x200-imaeeydf5meu4hsq.jpeg,Health and Beauty>Hair Care>Hair Care Accessories>Hair Accessories,499.0,323.0,323.0,true,HACEEFCYDUCJJV7Z,HACEEFCYDUCJJV7Z
Flipkart,,"Young & Forever Blossom Princess Touch Head Band(White, Yellow, Pink, Orange)",Add a pop of so-pretty style to your dearest with this adorable headband.,Young & Forever,http://dl.flipkart.com/dl/young-forever-blossom-princess-touch-head-band/p/itmeh7ss97ffzwvq?pid=HACEH7SSZM6GGYBZ&affid=siddarthk,http://img.fkcdn.com/image/hair-accessory/y/b/z/ha90159-1-young-forever-blossom-princess-touch-200x200-imaeh72sdeghqaxf.jpeg,Health and Beauty>Hair Care>Hair Care Accessories>Hair Accessories,1500.0,493.0,705.0,true,HACEH7SSZM6GGYBZ,HACEH7SSZM6GGYBZ
Flipkart,,"Young & Forever Cute Princess Glitter Crown Hair Band(Blue, Silver, Black)",Add a pop of so-pretty style to your dearest with this adorable headband.,Young & Forever,http://dl.flipkart.com/dl/young-forever-cute-princess-glitter-crown-hair-band/p/itmeh7ssjgncftky?pid=HACEH7SSVP9HHWYC&affid=siddarthk,http://img.fkcdn.com/image/hair-accessory/w/y/c/ha90170-1-young-forever-cute-princess-glitter-crown-200x200-imaeh78zezdvmsex.jpeg,Health and Beauty>Hair Care>Hair Care Accessories>Hair Accessories,1600.0,528.0,755.0,true,HACEH7SSVP9HHWYC,HACEH7SSVP9HHWYC
Flipkart,,"Young & Forever Cute Bowknot Crochet Lace Bow Head Band(Beige, Blue, Silver)",Add a pop of so-pretty style to your dearest with this adorable headband.,Young & Forever,http://dl.flipkart.com/dl/young-forever-cute-bowknot-crochet-lace-bow-head-band/p/itmeh7dkjufc5gcw?pid=HACEH7DKE6X3YWZG&affid=siddarthk,http://img.fkcdn.com/image/hair-accessory/w/z/g/ha90157-1-young-forever-cute-bowknot-crochet-lace-bow-200x200-imaeh6zyka2efhas.jpeg,Health and Beauty>Hair Care>Hair Care Accessories>Hair Accessories,1540.0,507.0,725.0,true,HACEH7DKE6X3YWZG,HACEH7DKE6X3YWZG
Flipkart,,"Young & Forever Cute Princess Glitter Crown Hair Band(Pink, Silver, Black)",Add a pop of so-pretty style to your dearest with this adorable headband.,Young & Forever,http://dl.flipkart.com/dl/young-forever-cute-princess-glitter-crown-hair-band/p/itmeh7ssqtaspgqu?pid=HACEH7SSZUDXCZFY&affid=siddarthk,http://img.fkcdn.com/image/hair-accessory/z/f/y/ha90171-1-young-forever-cute-princess-glitter-crown-200x200-imaeh79fchf9hqzu.jpeg,Health and Beauty>Hair Care>Hair Care Accessories>Hair Accessories,1600.0,528.0,755.0,true,HACEH7SSZUDXCZFY,HACEH7SSZUDXCZFY
Flipkart,,"Young & Forever Crochet Bow Head Band(Gold, White)",Add a pop of so-pretty style to your dearest with this adorable headband.,Young & Forever,http://dl.flipkart.com/dl/young-forever-crochet-bow-head-band/p/itmeh7ssnarh8aet?pid=HACEH7SSNY6RJFFW&affid=siddarthk,http://img.fkcdn.com/image/hair-accessory/f/f/w/ha90161-1-young-forever-crochet-bow-200x200-imaeh73zjdhzfpjb.jpeg,Health and Beauty>Hair Care>Hair Care Accessories>Hair Accessories,1540.0,507.0,725.0,true,HACEH7SSNY6RJFFW,HACEH7SSNY6RJFFW
Flipkart,,Young & Forever Cute Stars Galaxy Collection Bow Head Band(Yellow),Add a pop of so-pretty style to your dearest with this adorable headband.,Young & Forever,http://dl.flipkart.com/dl/young-forever-cute-stars-galaxy-collection-bow-head-band/p/itmeh7ss4ayrfysh?pid=HACEH7SSMYEEZJYH&affid=siddarthk,http://img.fkcdn.com/image/hair-accessory/j/y/h/ha90165-1-young-forever-cute-stars-galaxy-collection-bow-200x200-imaeh766yznunajs.jpeg,Health and Beauty>Hair Care>Hair Care Accessories>Hair Accessories,1540.0,507.0,725.0,true,HACEH7SSMYEEZJYH,HACEH7SSMYEEZJYH
Flipkart,,FNB MULTI DESIGN HAIR CLUTCHERS SET OF 3 Hair Claw(Multicolor),STYLISH AND BEAUTFULLY TIE YOUR HAIRS FOR OCCASIONS.,FNB,http://dl.flipkart.com/dl/fnb-multi-design-hair-clutchers-set-3-claw/p/itmekthh5k2smdfe?pid=HACEKTHHKYXYFKKP&affid=siddarthk,http://img.fkcdn.com/image/hair-accessory/k/k/p/c10-3-fnb-multi-design-hair-clutchers-set-of-3-200x200-imaekrbgxzax7nsa.jpeg,Health and Beauty>Hair Care>Hair Care Accessories>Hair Accessories,375.0,225.0,225.0,true,HACEKTHHKYXYFKKP,HACEKTHHKYXYFKKP
Flipkart,,FNB MULTICOLOR HAIR CLUTCHERS SET OF 4 Hair Claw(Multicolor),STYLISH AND BEAUTFULLY TIE YOUR HAIRS FOR OCCASIONS.,FNB,http://dl.flipkart.com/dl/fnb-multicolor-hair-clutchers-set-4-claw/p/itmekthgug9r5hch?pid=HACEKTHGUTQEN33A&affid=siddarthk,http://img.fkcdn.com/image/hair-accessory/3/3/a/c5-4-fnb-multicolor-hair-clutchers-set-of-4-200x200-imaekrbcpge5dzgy.jpeg,Health and Beauty>Hair Care>Hair Care Accessories>Hair Accessories,399.0,265.0,265.0,true,HACEKTHGUTQEN33A,HACEKTHGUTQEN33A
Flipkart,,Sanjog White Vintage Rose Flower Women Brooch Pin Hair Clip(White),,Sanjog,http://dl.flipkart.com/dl/sanjog-white-vintage-rose-flower-women-brooch-pin-hair-clip/p/itmeh4pyx95ked2c?pid=HACEH4PYHZY5H8CZ&affid=siddarthk,http://img.fkcdn.com/image/hair-accessory/8/c/z/vs100857-1-sanjog-white-vintage-rose-flower-women-brooch-pin-200x200-imaejzsyhxgkaqmd.jpeg,Health and Beauty>Hair Care>Hair Care Accessories>Hair Accessories,499.0,179.0,199.0,true,HACEH4PYHZY5H8CZ,HACEH4PYHZY5H8CZ
