PartnerName,Id,Title,Description,Brand,Link,ImageLink,CategoryName,Mrp,OfferPrice,EffectivePrice,Availability,PartnerIdFromUrl,PartnerIdFromDb
Flipkart,,Natural Healthplus Care Orange Powder Combo(454 g),Orange peel face packs can be really very beneficial as they eliminate excess oil from your skin without causing any damage to your skin. It is also very beneficial for moisturizing your skin and to make it glow. Vitamin C is present even in the juice from fresh orange and it works really well in improving your skin tone.,Natural Healthplus Care,http://dl.flipkart.com/dl/natural-healthplus-care-orange-powder-combo/p/itmeh7x4h7fexvzc?pid=FCPEH7X4HVJKEGPZ&affid=siddarthk,http://img.fkcdn.com/image/face-pack/g/p/z/natural-healthplus-care-454-orange-powder-combo-200x200-imaegwy94qkfhwmy.jpeg,Health and Beauty>Body and Skin Care>Face Care>Face Packs,398.0,298.0,298.0,true,FCPEH7X4HVJKEGPZ,FCPEH7X4HVJKEGPZ
Flipkart,,Natural Healthplus Care Lemon Powder(227 g),"Lemons are a versatile, natural option for cleaning, beauty, de tan and much more. Not only do they smell great, but they possess antibacterial properties making them perfect for killing germs. Lemon peel may benefit acne. Lemon peel powder removes blackhead, polishes skin, removes sun tan etc.",Natural Healthplus Care,http://dl.flipkart.com/dl/natural-healthplus-care-lemon-powder/p/itmeh7zfxaabzx5z?pid=FCPEH7ZFGRVR59GA&affid=siddarthk,http://img.fkcdn.com/image/face-pack/9/g/a/natural-healthplus-care-227-lemon-powder-200x200-imaeh5vhzcw25tpf.jpeg,Health and Beauty>Body and Skin Care>Face Care>Face Packs,299.0,269.0,269.0,true,FCPEH7ZFGRVR59GA,FCPEH7ZFGRVR59GA
Flipkart,,Natural Healthplus Care Rose Powder Combo(454 g),"Rose is an all rounder for skin. It is used as an oil controller, Skin toner, facial cleanser, Moisturizer and many more. Rose gives that pink glow to the skin for which every woman desires. It makes the skin glow from the inner.",Natural Healthplus Care,http://dl.flipkart.com/dl/natural-healthplus-care-rose-powder-combo/p/itmeh7wvtsgfaukm?pid=FCPEH7WVYECAE4MY&affid=siddarthk,http://img.fkcdn.com/image/face-pack/4/m/y/natural-healthplus-care-454-rose-powder-combo-200x200-imaeh6yfdacratbf.jpeg,Health and Beauty>Body and Skin Care>Face Care>Face Packs,798.0,598.0,598.0,true,FCPEH7WVYECAE4MY,FCPEH7WVYECAE4MY
Flipkart,,Labolia Pimple Clear Face Wash - 1 Nos. - Enriched with Neem - (1 X 65 ML)(65 ml),Labolia Pimple Clear Face Wash - 1 Nos. - Enriched with Neem - (1 X 65 ML),Labolia,http://dl.flipkart.com/dl/labolia-pimple-clear-face-wash-1-nos-enriched-neem-1-x-65-ml/p/itme4wsmyum3nfxy?pid=FCPE4WSMJ8YDBUA3&affid=siddarthk,http://img.fkcdn.com/image/face-pack/b/d/h/labolia-130-pimple-clear-face-wash-2-nos-enriched-with-neem-2-x-200x200-imae4wjgkg7sfubh.jpeg,Health and Beauty>Body and Skin Care>Face Care>Face Packs,70.0,70.0,70.0,false,FCPE4WSMJ8YDBUA3,FCPE4WSMJ8YDBUA3
Flipkart,,Labolia Faireness Face Wash For Women - 3 Nos. - (3 X 70 ML)(210 ml),Labolia Faireness Face Wash For Women - 3 Nos. - (3 X 70 ML),Labolia,http://dl.flipkart.com/dl/labolia-faireness-face-wash-women-3-nos-3-x-70-ml/p/itme4wsm3gztdvzy?pid=FCPE4WSMWQZVKEXN&affid=siddarthk,http://img.fkcdn.com/image/face-pack/e/x/n/labolia-210-faireness-face-wash-for-women-3-nos-3-x-70-ml-200x200-imae4wjghpzmb9c5.jpeg,Health and Beauty>Body and Skin Care>Face Care>Face Packs,210.0,185.0,185.0,false,FCPE4WSMWQZVKEXN,FCPE4WSMWQZVKEXN
Flipkart,,Shills Deep Cleansing Purifying Peel Off Black Mud Facail Face Mask(50 ml),"Shills Deep Cleansing Purifying Peel Off Black Mud Facail Face Mask, Remove Blackhead Facial Mask - 50ml:Ingredients: activated carbon (bamboo charcoal), oat extract, grapefruit, vitamin B5,rosemary extract, calendula extract, vitamin A, vitamin E, citrus peel extract. Usage: Dry the cleansed area and appy the masque on desired area(avoid eybrow,eyes,and lips).Peel it off after 20-30 minutes.To achieve better results,apply toner so as to tighten and cleanse the pores thoroughly. Fit for people: 1. Due in part because skin caused by acne, acne 2. Oily skin strawberry nose 3. Nose large pores blackheads 4. Long-term use of the computer, watching television",Shills,http://dl.flipkart.com/dl/shills-deep-cleansing-purifying-peel-off-black-mud-facail-face-mask/p/itmeh7shmef3yhyb?pid=FCPEH7SHEDPWMDYD&affid=siddarthk,http://img.fkcdn.com/image/face-pack/d/y/d/shills-50-deep-cleansing-purifying-peel-off-black-mud-facail-200x200-imaegh7xxwv9thsu.jpeg,Health and Beauty>Body and Skin Care>Face Care>Face Packs,2000.0,1499.0,1499.0,false,FCPEH7SHEDPWMDYD,FCPEH7SHEDPWMDYD
Flipkart,,Pot Free (10 in 1) Pack of 2 Intimate Wipes(400),,Pot Free,http://dl.flipkart.com/dl/pot-free-10-1-pack-2-intimate-wipes/p/itmecpzkhahzah6q?pid=WICEGVM7VSVWBEK8&affid=siddarthk,http://img.fkcdn.com/image/women-intimate-care/u/u/y/pee-free-420-5-in-1-pack-of-7-200x200-imaegt9wuvkntpsm.jpeg,Health and Beauty>Women's Hygiene>Intimate Care,240.0,240.0,240.0,false,WICEGVM7VSVWBEK8,WICEGVM7VSVWBEK8
Flipkart,,Pee Free (10 in 1) Pack of 4 Intimate Wipes(400),,Pee Free,http://dl.flipkart.com/dl/pee-free-10-1-pack-4-intimate-wipes/p/itmegvm8jxhbnegr?pid=WICEGVM7QMEG2YUG&affid=siddarthk,http://img.fkcdn.com/image/women-intimate-care/y/u/g/pee-free-400-10-in-1-pack-of-4-200x200-imaegt9wjgtgha9k.jpeg,Health and Beauty>Women's Hygiene>Intimate Care,400.0,390.0,390.0,false,WICEGVM7QMEG2YUG,WICEGVM7QMEG2YUG
Flipkart,,Pot Free (5 in 1) Pack of 4 Intimate Wipes(400),,Pot Free,http://dl.flipkart.com/dl/pot-free-5-1-pack-4-intimate-wipes/p/itmegvm8qyrspdrg?pid=WICEGVM8ESUZKURK&affid=siddarthk,http://img.fkcdn.com/image/women-intimate-care/9/x/4/pot-free-100-5-in-1-pack-of-1-200x200-imaecufkwqv3drzy.jpeg,Health and Beauty>Women's Hygiene>Intimate Care,260.0,260.0,260.0,false,WICEGVM8ESUZKURK,WICEGVM8ESUZKURK
Flipkart,,Pot Free (5 in 1) Pack of 1 Intimate Wipes(100 g),,Pot Free,http://dl.flipkart.com/dl/pot-free-5-1-pack-1-intimate-wipes/p/itmegwjxs2tfhgn7?pid=WICEGWJXGG7VV9X4&affid=siddarthk,http://img.fkcdn.com/image/women-intimate-care/9/x/4/pot-free-100-5-in-1-pack-of-1-200x200-imaecufkwqv3drzy.jpeg,Health and Beauty>Women's Hygiene>Intimate Care,65.0,65.0,65.0,false,WICEGWJXGG7VV9X4,WICEGWJXGG7VV9X4
Flipkart,,Pee Free (5 in 1) Pack of 7 Intimate Wipes(420),,Pee Free,http://dl.flipkart.com/dl/pee-free-5-1-pack-7-intimate-wipes/p/itmegvm8gmnfgbbj?pid=WICEGVM8FQPAVUUY&affid=siddarthk,http://img.fkcdn.com/image/women-intimate-care/u/u/y/pee-free-420-5-in-1-pack-of-7-200x200-imaegt9wuvkntpsm.jpeg,Health and Beauty>Women's Hygiene>Intimate Care,385.0,385.0,385.0,false,WICEGVM8FQPAVUUY,WICEGVM8FQPAVUUY
Flipkart,,"Bello Gentle Wash Intimate Wash(100 ml, Pack of 1)","Most of ladies will think that ordinary water and soaps will be sufficient to clean vagina, but generally soaps are in alkaline in nature i.e. pH will be 8 to 10 and water is neutral pH i.e. 7, not helps to clean vagina. Because of this unhygienic intimate area sometimes bad smell will come. As our Bello Gentle Wash pH is between 3.5 to 4.5, which helps to maintain intimate area pH and with its natural disinfectants Neem, Haridra, Tulasi, Vacha and Aloe vera cleans the area perfectly. Bello Gentle Wash is Sulphate free and Parben free. No Colour is added.",Bello,http://dl.flipkart.com/dl/bello-gentle-wash-intimate/p/itmeh7axb59yqeq4?pid=WICEH7AXEZQDJGKN&affid=siddarthk,http://img.fkcdn.com/image/women-intimate-care/g/k/n/bello-100-gentle-wash-200x200-imaejerv7yxzgfm2.jpeg,Health and Beauty>Women's Hygiene>Intimate Care,150.0,125.0,125.0,true,WICEH7AXEZQDJGKN,WICEH7AXEZQDJGKN
Flipkart,,"Bello Gentle Wash pack of 2 Intimate Wash(200 ml, Pack of 2)","Most of ladies will think that ordinary water and soaps will be sufficient to clean vagina, but generally soaps are in alkaline in nature i.e. pH will be 8 to 10 and water is neutral pH i.e. 7, not helps to clean vagina. Because of this unhygienic intimate area sometimes bad smell will come. As our Bello Gentle Wash pH is between 3.5 to 4.5, which helps to maintain intimate area pH and with its natural disinfectants Neem, Haridra, Tulasi, Vacha and Aloe vera cleans the area perfectly. Bello Gentle Wash is Sulphate free and parbens free. No Colour is added.",Bello,http://dl.flipkart.com/dl/bello-gentle-wash-pack-2-intimate/p/itmeh7tba2vfbbgc?pid=WICEH7TBCMFX6CY2&affid=siddarthk,http://img.fkcdn.com/image/women-intimate-care/c/y/2/bello-200-gentle-wash-pack-of-2-200x200-imaejervst7nku2m.jpeg,Health and Beauty>Women's Hygiene>Intimate Care,300.0,180.0,180.0,true,WICEH7TBCMFX6CY2,WICEH7TBCMFX6CY2
Flipkart,,Dead Sea Minerals Delicate Soap For Intimate Washing Intimate Wash(200 ml),"A unique soap to protect the vaginal area and maintain intimate feminine hygiene. Helps to protect the natural environment of the vagina while balancing the pH level. Contains extracts of chamomile, sage and aloe vera to soothe the skin, and lactic acid to balance the pH level. Contains triclosan to sanitize the skin and to prevent unpleasant odors. Enriched with Dead Sea minerals that contribute to the softness of the skin and nurture it.",Dead Sea Minerals,http://dl.flipkart.com/dl/dead-sea-minerals-delicate-soap-intimate-washing-wash/p/itmeh6phbfhtwzf5?pid=WICEH6PHXSZC37DG&affid=siddarthk,http://img.fkcdn.com/image/women-intimate-care/7/d/g/dead-sea-minerals-200-delicate-soap-for-intimate-washing-200x200-imaeh4yarpdahfvu.jpeg,Health and Beauty>Women's Hygiene>Intimate Care,1540.0,1180.0,1180.0,true,WICEH6PHXSZC37DG,WICEH6PHXSZC37DG
Flipkart,,Operon 26G Glucometer Lancets(100),"Blood lancets are generally disposable. Lancets are also used to prick the skin. A blood-sampling device, also known as a lancing device, is a reusable instrument equipped with a lancet. It is also most commonly used by diabetics during blood glucose monitoring.",Operon,http://dl.flipkart.com/dl/operon-26g-glucometer-lancets/p/itmef6jyzfzgdxfs?pid=GLCEF6JYAT8BMMYW&affid=siddarthk,http://img.fkcdn.com/image/glucometer-lancet/m/y/w/26g-operon-200x200-imaef7g7vk73fzhc.jpeg,Electronics>Health and Personal Care>Health Care>Glucometer Lancets,250.0,155.0,155.0,true,GLCEF6JYAT8BMMYW,GLCEF6JYAT8BMMYW
Flipkart,,Cozy Care Comfy Thin Advanced Super Dry Technology Pack Of 48 Sanitary Pad(Pack of 48),"Cozy Care Comfy Thin Advanced Super Dry with Comfort Technology sanitary pads is design to give its user the ultimate dry comfort feeling. With Special Super Soft mesh top sheet with free fall technology enables super fast absorption speed. The Soft gel core with special quality super absorbent gel locks the discharge immediately and gives ultimate dry comfort. Cozy Care Comfy Thin provides the ""Longest Dry Period"" to its users. With Individual pocket wrapper, user can carry single piece easily in the pocket or purse for convenience. One Sanitary pad can be used for long time hygienically. Special Dual protection cover enables the discharge to be locked and complete dry feeling all day.",Cozy Care,http://dl.flipkart.com/dl/cozy-care-comfy-thin-advanced-super-dry-technology-pack-48-sanitary-pad/p/itmeh24vwf8fpezc?pid=SPPEH24VCEZNRHFS&affid=siddarthk,http://img.fkcdn.com/image/sanitary-pad-pantyliner/h/f/s/290mm-48-cozy-care-sanitary-pad-comfy-thin-advanced-super-dry-200x200-imaeh4ayt62wbyhd.jpeg,Health and Beauty>Women's Hygiene>Sanitary Pads,3456.0,2999.0,2999.0,false,SPPEH24VCEZNRHFS,SPPEH24VCEZNRHFS
Flipkart,,Cozy Care Comfy Thin Advanced Super Dry Technology Pack Of 10 Sanitary Pad(Pack of 10),"Cozy Care Comfy Thin Advanced Super Dry with Comfort Technology sanitary pads is design to give its user the ultimate dry comfort feeling. With Special Super Soft mesh top sheet with free fall technology enables super fast absorption speed. The Soft gel core with special quality super absorbent gel locks the discharge immediately and gives ultimate dry comfort. Cozy Care Comfy Thin provides the ""Longest Dry Period"" to its users. With Individual pocket wrapper, user can carry single piece easily in the pocket or purse for convenience. One Sanitary pad can be used for long time hygienically. Special Dual protection cover enables the discharge to be locked and complete dry feeling all day.",Cozy Care,http://dl.flipkart.com/dl/cozy-care-comfy-thin-advanced-super-dry-technology-pack-10-sanitary-pad/p/itmeh24vhvwnceef?pid=SPPEH24V6HHVMAG7&affid=siddarthk,http://img.fkcdn.com/image/sanitary-pad-pantyliner/a/g/7/290mm-10-cozy-care-sanitary-pad-comfy-thin-advanced-super-dry-200x200-imaeh4aftenp9ptg.jpeg,Health and Beauty>Women's Hygiene>Sanitary Pads,720.0,562.0,562.0,true,SPPEH24V6HHVMAG7,SPPEH24V6HHVMAG7
Flipkart,,Cozy Care Premium Grade Sensitive Skin Specialist Pack Of 2 Sanitary Pad(Pack of 2),"Cozy CarePremium Grade Super Soft sanitary pads is the sensitive skin speacialist. It is design to give its user the ultimate dry comfort feeling preventing any muggy feeling. With Special Super Soft non woven top sheet with free fall technology enables super fast absorption speed. The Soft gel core with special quality super absorbent gel locks the discharge immediately and gives ultimate dry comfort. It provides the ""Cool Relaxing Feeling"" to its users. With Individual pocket wrapper, user can carry single piece easily in the pocket or purse for convenience. One Sanitary pad can be used for long time hygienically. Special Dual protection cover enables the discharge to be locked and complete dry feeling all day. Its non woven top sheet has been designed to suit the hot and humid temperature in India.",Cozy Care,http://dl.flipkart.com/dl/cozy-care-premium-grade-sensitive-skin-specialist-pack-2-sanitary-pad/p/itmeh24vjypzzghd?pid=SPPEH24VS5QGMPHV&affid=siddarthk,http://img.fkcdn.com/image/sanitary-pad-pantyliner/p/h/v/280mm-2-cozy-care-sanitary-pad-premium-grade-sensitive-skin-200x200-imaeh4bstsxdefeg.jpeg,Health and Beauty>Women's Hygiene>Sanitary Pads,252.0,214.0,214.0,true,SPPEH24VS5QGMPHV,SPPEH24VS5QGMPHV
Flipkart,,Cozy Care Premium Grade Sensitive Skin Specialist Pack Of 48 Sanitary Pad(Pack of 48),"Cozy CarePremium Grade Super Soft sanitary pads is the sensitive skin speacialist. It is design to give its user the ultimate dry comfort feeling preventing any muggy feeling. With Special Super Soft non woven top sheet with free fall technology enables super fast absorption speed. The Soft gel core with special quality super absorbent gel locks the discharge immediately and gives ultimate dry comfort. It provides the ""Cool Relaxing Feeling"" to its users. With Individual pocket wrapper, user can carry single piece easily in the pocket or purse for convenience. One Sanitary pad can be used for long time hygienically. Special Dual protection cover enables the discharge to be locked and complete dry feeling all day. Its non woven top sheet has been designed to suit the hot and humid temperature in India.",Cozy Care,http://dl.flipkart.com/dl/cozy-care-premium-grade-sensitive-skin-specialist-pack-48-sanitary-pad/p/itmeh24vds7paryj?pid=SPPEH24V9YBZB6RX&affid=siddarthk,http://img.fkcdn.com/image/sanitary-pad-pantyliner/6/r/x/280mm-48-cozy-care-sanitary-pad-premium-grade-sensitive-skin-200x200-imaeh4ayayywbzgz.jpeg,Health and Beauty>Women's Hygiene>Sanitary Pads,6048.0,3750.0,3750.0,false,SPPEH24V9YBZB6RX,SPPEH24V9YBZB6RX
Flipkart,,Cozy Care Feel Soft Super Soft Design Pack Of 5 Sanitary Pad(Pack of 5),"Cozy CareFeel Soft Super Soft sanitary pads is the cost effective sensitive skin speacialist. It is design to give its user the ultimate dry comfort feeling preventing any muggy feeling. With Special Super Soft non woven top sheet with free fall technology enables super fast absorption speed. The Soft gel core with special quality super absorbent gel locks the discharge immediately and gives ultimate dry comfort. It provides the ""Cool Relaxing Feeling"" to its users. With Individual pocket wrapper, user can carry single piece easily in the pocket or purse for convenience. One Sanitary pad can be used for long time hygienically. Special Dual protection cover enables the discharge to be locked and complete dry feeling all day. Its non woven top sheet has been designed to suit the hot and humid temperature in India. It is mostly suited for women with light to medium flow.",Cozy Care,http://dl.flipkart.com/dl/cozy-care-feel-soft-super-design-pack-5-sanitary-pad/p/itmeh24vd9uhgzgw?pid=SPPEH24VY4HGEZGJ&affid=siddarthk,http://img.fkcdn.com/image/sanitary-pad-pantyliner/z/g/j/240mm-5-cozy-care-sanitary-pad-feel-soft-super-soft-design-pack-200x200-imaeh4bsee9vtjej.jpeg,Health and Beauty>Women's Hygiene>Sanitary Pads,175.0,168.0,168.0,true,SPPEH24VY4HGEZGJ,SPPEH24VY4HGEZGJ
Flipkart,,Cozy Care Comfy Thin Advanced Super Dry Technology Pack Of 5 Sanitary Pad(Pack of 5),"Cozy Care Comfy Thin Advanced Super Dry with Comfort Technology sanitary pads is design to give its user the ultimate dry comfort feeling. With Special Super Soft mesh top sheet with free fall technology enables super fast absorption speed. The Soft gel core with special quality super absorbent gel locks the discharge immediately and gives ultimate dry comfort. Cozy Care Comfy Thin provides the ""Longest Dry Period"" to its users. With Individual pocket wrapper, user can carry single piece easily in the pocket or purse for convenience. One Sanitary pad can be used for long time hygienically. Special Dual protection cover enables the discharge to be locked and complete dry feeling all day.",Cozy Care,http://dl.flipkart.com/dl/cozy-care-comfy-thin-advanced-super-dry-technology-pack-5-sanitary-pad/p/itmeh24v222dwgdu?pid=SPPEH24VEDYBBVYQ&affid=siddarthk,http://img.fkcdn.com/image/sanitary-pad-pantyliner/v/y/q/290mm-5-cozy-care-sanitary-pad-comfy-thin-advanced-super-dry-200x200-imaeh4brfuhtgmyk.jpeg,Health and Beauty>Women's Hygiene>Sanitary Pads,360.0,289.0,289.0,true,SPPEH24VEDYBBVYQ,SPPEH24VEDYBBVYQ
Flipkart,,Cozy Care Comfy Thin Advanced Super Dry Technology Pack Of 2 Sanitary Pad(Pack of 2),,Cozy Care,http://dl.flipkart.com/dl/cozy-care-comfy-thin-advanced-super-dry-technology-pack-2-sanitary-pad/p/itmegzadktnvtw4z?pid=SPPEGZADZH8VVYHW&affid=siddarthk,http://img.fkcdn.com/image/sanitary-pad-pantyliner/y/h/w/290mm-2-cozy-care-sanitary-pad-comfy-thin-advanced-super-dry-200x200-imaeh4ayasvghuza.jpeg,Health and Beauty>Women's Hygiene>Sanitary Pads,144.0,129.0,129.0,true,SPPEGZADZH8VVYHW,SPPEGZADZH8VVYHW
Flipkart,,Cozy Care Premium Grade Sensitive Skin Specialist Pack Of 1 Sanitary Pad(Pack of 1),"Cozy CarePremium Grade Super Soft sanitary pads is the sensitive skin speacialist. It is design to give its user the ultimate dry comfort feeling preventing any muggy feeling. With Special Super Soft non woven top sheet with free fall technology enables super fast absorption speed. The Soft gel core with special quality super absorbent gel locks the discharge immediately and gives ultimate dry comfort. It provides the ""Cool Relaxing Feeling"" to its users. With Individual pocket wrapper, user can carry single piece easily in the pocket or purse for convenience. One Sanitary pad can be used for long time hygienically. Special Dual protection cover enables the discharge to be locked and complete dry feeling all day. Its non woven top sheet has been designed to suit the hot and humid temperature in India.",Cozy Care,http://dl.flipkart.com/dl/cozy-care-premium-grade-sensitive-skin-specialist-pack-1-sanitary-pad/p/itmegzadu8feuft3?pid=SPPEGZADBH6FMSYW&affid=siddarthk,http://img.fkcdn.com/image/sanitary-pad-pantyliner/s/y/w/280mm-1-cozy-care-sanitary-pad-premium-grade-sensitive-skin-200x200-imaeh4ay9rynfrny.jpeg,Health and Beauty>Women's Hygiene>Sanitary Pads,126.0,113.0,113.0,true,SPPEGZADBH6FMSYW,SPPEGZADBH6FMSYW
Flipkart,,Cozy Care Premium Grade Sensitive Skin Specialist Pack Of 5 Sanitary Pad(Pack of 5),"Cozy CarePremium Grade Super Soft sanitary pads is the sensitive skin speacialist. It is design to give its user the ultimate dry comfort feeling preventing any muggy feeling. With Special Super Soft non woven top sheet with free fall technology enables super fast absorption speed. The Soft gel core with special quality super absorbent gel locks the discharge immediately and gives ultimate dry comfort. It provides the ""Cool Relaxing Feeling"" to its users. With Individual pocket wrapper, user can carry single piece easily in the pocket or purse for convenience. One Sanitary pad can be used for long time hygienically. Special Dual protection cover enables the discharge to be locked and complete dry feeling all day. Its non woven top sheet has been designed to suit the hot and humid temperature in India.",Cozy Care,http://dl.flipkart.com/dl/cozy-care-premium-grade-sensitive-skin-specialist-pack-5-sanitary-pad/p/itmeh24vhe6zxhky?pid=SPPEH24VYBPHPMZN&affid=siddarthk,http://img.fkcdn.com/image/sanitary-pad-pantyliner/m/z/n/280mm-5-cozy-care-sanitary-pad-premium-grade-sensitive-skin-200x200-imaeh4bsjcumqtnw.jpeg,Health and Beauty>Women's Hygiene>Sanitary Pads,630.0,504.0,504.0,true,SPPEH24VYBPHPMZN,SPPEH24VYBPHPMZN
Flipkart,,Vivanion Anion with Herbal (Day & Night Pad) Sanitary Pad(Pack of 3),,Vivanion,http://dl.flipkart.com/dl/vivanion-anion-herbal-day-night-pad-sanitary-pad/p/itmedhkymp6b8zhe?pid=SPPEDHKYJP8R2FC3&affid=siddarthk,http://img.fkcdn.com/image/sanitary-pad-pantyliner/f/c/3/sn-03-3-vivanion-sanitary-pad-anion-with-herbal-day-night-pad-200x200-imaedhb8fsqvhbfg.jpeg,Health and Beauty>Women's Hygiene>Sanitary Pads,897.0,555.0,555.0,true,SPPEDHKYJP8R2FC3,SPPEDHKYJP8R2FC3
Flipkart,,Vivanion Anion striped Napkin Sanitary Pad(Pack of 8),,Vivanion,http://dl.flipkart.com/dl/vivanion-anion-striped-napkin-sanitary-pad/p/itmeejnyfh9gyhyj?pid=SPPEEJNYDYGWJNUC&affid=siddarthk,http://img.fkcdn.com/image/sanitary-pad-pantyliner/n/u/c/a14-dn-8-vivanion-sanitary-pad-anion-striped-napkin-200x200-imaeejyztuavnebp.jpeg,Health and Beauty>Women's Hygiene>Sanitary Pads,199.0,150.0,150.0,true,SPPEEJNYDYGWJNUC,SPPEEJNYDYGWJNUC
Flipkart,,Drake Casuals dr51(1),,Drake Casuals,http://dl.flipkart.com/dl/drake-casuals-dr51/p/itme956zhawkyyfz?pid=EMKE956ZGEPDEMYX&affid=siddarthk,http://img.fkcdn.com/image/eye-mask/m/y/x/drake-casuals-1-dr51-200x200-imae8wspkgzgwvjs.jpeg,Health and Beauty>Body and Skin Care>Eye Care>Eye Masks,459.0,229.0,229.0,true,EMKE956ZGEPDEMYX,EMKE956ZGEPDEMYX
Flipkart,,Soulflower Sandalwood Essential Oil Candile,,Soulflower,http://dl.flipkart.com/dl/soulflower-sandalwood-essential-oil-candile/p/itmdrugzsufdzuuz?pid=SCLDP9FKGSQJYMCV&affid=siddarthk,http://img.fkcdn.com/image/scented-candle/m/c/v/soulflower-sandalwood-essential-oil-candile-200x200-imae3haq5rt99emg.jpeg,Health and Beauty>Bath and Spa>Bath and Spa Accessories>Scented Candles,150.0,135.0,135.0,false,SCLDP9FKGSQJYMCV,SCLDP9FKGSQJYMCV
Flipkart,,A&T London Grapefruit Luxury Scented Candle With Three Wicks(5),"Candle In Premium Beautiful Clear Jar. Convenient and easy to use, provides 40 hours of true fragrance enjoyment. Juicy zesty grapefruit with sparkling notes of lemon & lime and a hint of exotic physallis. Our wax is 100% natural, made predominantly from soya with vegetable derivatives.Grapefruit ScentedTo uplift or simply add an air of luxuryCandle is Wrapped beautifully with red ribbon and safely packed to ship750G with 90-100 hours of burning timeThree WicksSize: 120 x 120mmHand poured in England",A&T London,http://dl.flipkart.com/dl/a-t-london-grapefruit-luxury-scented-candle-three-wicks/p/itmef6jzykwdyt4q?pid=SCLEF6JZ87WNMFJZ&affid=siddarthk,http://img.fkcdn.com/image/scented-candle/f/j/z/lcgf11-a-t-london-5-grapefruit-luxury-scented-candle-with-three-200x200-imaef5rkcfhshyfc.jpeg,Health and Beauty>Bath and Spa>Bath and Spa Accessories>Scented Candles,5000.0,4400.0,4400.0,true,SCLEF6JZ87WNMFJZ,SCLEF6JZ87WNMFJZ
Flipkart,,A&T London Celebration Scented Candle With One Wick. Hand Poured In England(5),"Candle In Premium Beautiful Clear Jar. Convenient and easy to use, provides 40 hours of true fragrance enjoyment. Sparkling scent inspired by vintage champagne, with notes of strawberries & jasmine on a creamy vanilla & tonka bean base. Our wax is 100% natural, made predominantly from soya with vegetable derivatives.Celebration ScentedTo uplift or simply add an air of luxuryCandle is Wrapped beautifully with red ribbon and safely packed to ship200G with 40 hours of burning time1 WickSize: 85 x 100mmHand poured in England",A&T London,http://dl.flipkart.com/dl/a-t-london-celebration-scented-candle-one-wick-hand-poured-england/p/itmef6jzjnwcfqyh?pid=SCLEF6JZXGETFHBU&affid=siddarthk,http://img.fkcdn.com/image/scented-candle/h/b/u/lcgf14-a-t-london-5-celebration-scented-candle-with-one-wick-200x200-imaef5r9jgdfyqdf.jpeg,Health and Beauty>Bath and Spa>Bath and Spa Accessories>Scented Candles,2600.0,2400.0,2400.0,true,SCLEF6JZXGETFHBU,SCLEF6JZXGETFHBU
Flipkart,,A&T London Lemongrass And Verbena Scented Candle. Hand poured in England.(5),"Candle In Premium Beautiful Clear Jar. Convenient and easy to use, provides 40 hours of true fragrance enjoyment. Fresh, vibrant and uplifting lemongrass scented candle with soft verbena. Blended with notes of melon, lime, rose and jasmine.Our wax is 100% natural, made predominantly from soya with vegetable derivatives.Lemongrass and verbena ScentedTo uplift or simply add an air of luxuryCandle is Wrapped beautifully with red ribbon and safely packed to ship200G with 40 hours of burning time1 WickSize: 85 x 100mmHand poured in England",A&T London,http://dl.flipkart.com/dl/a-t-london-lemongrass-verbena-scented-candle-hand-poured-england/p/itmef6jzmydc7223?pid=SCLEF6JZJHSZMYCN&affid=siddarthk,http://img.fkcdn.com/image/scented-candle/y/c/n/lcgf13-a-t-london-5-lemongrass-and-verbena-scented-candle-hand-200x200-imaef5ruztgamgnq.jpeg,Health and Beauty>Bath and Spa>Bath and Spa Accessories>Scented Candles,2600.0,2400.0,2400.0,true,SCLEF6JZJHSZMYCN,SCLEF6JZJHSZMYCN
