PartnerName,Id,Title,Description,Brand,Link,ImageLink,CategoryName,Mrp,OfferPrice,EffectivePrice,Availability,PartnerIdFromUrl,PartnerIdFromDb
Flipkart,,"Bausch & Lomb Iconnect With Lens Care Kit By Visions India Monthly Contact Lens(-3.00, Clear, Pack of 6)",These have been specially designed keeping the youth in mind. These easy to handle and comfortable to use lenses come in monthly disposable modality and hence are hygienic.,Bausch & Lomb,http://dl.flipkart.com/dl/bausch-lomb-iconnect-lens-care-kit-visions-india-monthly-contact/p/itmegdv9c8vpy9pn?pid=CTLEGDV9QK6BU82F&affid=siddarthk,http://img.fkcdn.com/image/contact-lens-new/j/h/g/bausch-lomb-6-iconnect-with-lens-care-kit-by-visions-india-2-00-200x200-imaegajmkws9cdng.jpeg,Health and Beauty>Eye Care>Contact Lenses,625.0,599.0,599.0,true,CTLEGDV9QK6BU82F,CTLEGDV9QK6BU82F
Flipkart,,"Glamour Eye Wild Violet By Visions India Monthly Contact Lens(-5.75, Wild Violet, Pack of 2)",India's Best Selling Cosmetic Contact Lenses Manufactured In Korea,Glamour Eye,http://dl.flipkart.com/dl/glamour-eye-wild-violet-visions-india-monthly-contact-lens/p/itmeghwxfdhhagqz?pid=CTLEGHWXVCZNVRVY&affid=siddarthk,http://img.fkcdn.com/image/contact-lens-new/m/2/r/glamour-eye-2-charming-hazel-by-visions-india-12-50-200x200-imaegjh57djgrcfy.jpeg,Health and Beauty>Eye Care>Contact Lenses,995.0,625.0,625.0,true,CTLEGHWXVCZNVRVY,CTLEGHWXVCZNVRVY
Flipkart,,"SAUFLON 38 disposable by Visiond India Yearly Contact Lens(-7.00, Transparent, Pack of 2)",,SAUFLON 38,http://dl.flipkart.com/dl/sauflon-38-disposable-visiond-india-yearly-contact-lens/p/itmeeambgvgu4ffg?pid=CTLEEAMB5VFH6UPU&affid=siddarthk,http://img.fkcdn.com/image/contact-lens-new/y/t/3/sauflon-38-2-disposable-by-visiond-india-0-75-200x200-imaeeacezdf5pf2c.jpeg,Health and Beauty>Eye Care>Contact Lenses,1690.0,599.0,599.0,true,CTLEEAMB5VFH6UPU,CTLEEAMB5VFH6UPU
Flipkart,,Optokart Two Tone Color With Kit Made In USA By Visions India Yearly Contact Lens,"These have been specially designed keeping the youth in mind. Most Attractive Colors These easy to handle and comfortable to use lenses come in Yearly disposable modality and hence are hygienic. Grey,Green,Turquoise,Brown.",Optokart,http://dl.flipkart.com/dl/optokart-two-tone-color-kit-made-usa-visions-india-yearly-contact-lens/p/itmehfq9s63nkggz?pid=CTLEHFQ9WGABPVPH&affid=siddarthk,http://img.fkcdn.com/image/contact-lens-new/q/q/y/optokart-2-two-tone-color-with-kit-made-in-usa-by-visions-india-200x200-imaehejfqsnkq9vz.jpeg,Health and Beauty>Eye Care>Contact Lenses,2300.0,699.0,699.0,true,CTLEHFQ9WGABPVPH,CTLEHFQ9WGABPVPH
Flipkart,,Glamour Eye Sweet Honey By Visions India Monthly Contact Lens,India's Best Selling Cosmetic Contact Lenses Manufactured In Korea,Glamour Eye,http://dl.flipkart.com/dl/glamour-eye-sweet-honey-visions-india-monthly-contact-lens/p/itmeghwvgwcdqq3a?pid=CTLEGHWVURECMZZH&affid=siddarthk,http://img.fkcdn.com/image/contact-lens-new/m/2/r/glamour-eye-2-charming-hazel-by-visions-india-12-50-200x200-imaegjh57djgrcfy.jpeg,Health and Beauty>Eye Care>Contact Lenses,995.0,625.0,625.0,true,CTLEGHWVURECMZZH,CTLEGHWVURECMZZH
Flipkart,,"Ciba Vision Freshlook Colours Monthly Contact Lens(-8, Green, Pack of 2)","Freshlook Colors in affordable opaque colors with maximum possible lens concentration blends natural colours into one to create the subtle, natural depth of your eyes. Replace it frequently to enjoy a comfortable wear.",Ciba Vision,http://dl.flipkart.com/dl/ciba-vision-freshlook-colours-monthly-contact-lens/p/itmedhdnp9hf7vnm?pid=CTLEDHDHKGWRTTAF&affid=siddarthk,http://img.fkcdn.com/image/contact-lens-new/d/q/w/ciba-vision-2-freshlook-colours-1-5-original-imaedfff9x6kgamm.jpeg,Health and Beauty>Eye Care>Contact Lenses,995.0,699.0,699.0,true,CTLEDHDHKGWRTTAF,CTLEDHDHKGWRTTAF
Flipkart,,Bausch & Lomb Optima 38 with Biotrue 60ml Solution by Visions India Yearly Contact Lens,"Bausch & Lomb's Optima38 are Yearly disposable contact lenses. These are colorless contact lenses, with recommended usage of around 12-14 hours every day. The lenses are highly durable and with crystal clear vision. Enhanced lens design for excellent comfort. RPIII technology to ensure easy handling for new users.",Bausch & Lomb,http://dl.flipkart.com/dl/bausch-lomb-optima-38-biotrue-60ml-solution-visions-india-yearly-contact-lens/p/itmef36grjvy6kfy?pid=CTLEF36GDNGFFZUR&affid=siddarthk,http://img.fkcdn.com/image/contact-lens-new/p/r/c/bausch-lomb-1-optima-38-with-biotrue-60ml-solution-by-visions-200x200-imaeetbyr7ze62sz.jpeg,Health and Beauty>Eye Care>Contact Lenses,1065.0,814.0,814.0,true,CTLEF36GDNGFFZUR,CTLEF36GDNGFFZUR
Flipkart,,Sparkle Tri Tone By Visions India Yearly Contact Lens,Premium Color Yearly Contact Lens,Sparkle,http://dl.flipkart.com/dl/sparkle-tri-tone-visions-india-yearly-contact-lens/p/itmehrh45ucxzngj?pid=CTLEHRH49G58DHZT&affid=siddarthk,http://img.fkcdn.com/image/contact-lens-new/m/v/8/sparkle-2-tri-tone-by-visions-india-10-00-200x200-imaehpwjvgsj454e.jpeg,Health and Beauty>Eye Care>Contact Lenses,1500.0,999.0,999.0,true,CTLEHRH49G58DHZT,CTLEHRH49G58DHZT
Flipkart,,Glamour Eye Pure Aqua By Visions India Monthly Contact Lens,India's Best Selling Cosmetic Contact Lenses Manufactured In Korea,Glamour Eye,http://dl.flipkart.com/dl/glamour-eye-pure-aqua-visions-india-monthly-contact-lens/p/itmeghw33jvcgn9j?pid=CTLEGHW3XB6A3NQY&affid=siddarthk,http://img.fkcdn.com/image/contact-lens-new/s/g/m/glamour-eye-2-pure-aqua-by-visions-india-14-50-200x200-imaegeyenyukxgus.jpeg,Health and Beauty>Eye Care>Contact Lenses,995.0,625.0,625.0,true,CTLEGHW3XB6A3NQY,CTLEGHW3XB6A3NQY
Flipkart,,"Ciba Vision Freshlook Colorblends True Sapphire By Vision India Monthly Contact Lens(-5.00, True Sapphire, Pack of 2)","Freshlook Colorblends in affordable opaque colors with maximum possible lens concentration blends 3 colours into one to create the subtle, natural depth of your eyes. Replace it frequently to enjoy a comfortable wear.",Ciba Vision,http://dl.flipkart.com/dl/ciba-vision-freshlook-colorblends-true-sapphire-india-monthly-contact-lens/p/itmeduw6ew7gnrzy?pid=CTLEDUW6FHMGXSEJ&affid=siddarthk,http://img.fkcdn.com/image/contact-lens-new/h/g/s/ciba-vision-2-freshlook-colorblends-true-sapphire-by-vision-200x200-imaedtqucgkfntrg.jpeg,Health and Beauty>Eye Care>Contact Lenses,995.0,699.0,699.0,true,CTLEDUW6FHMGXSEJ,CTLEDUW6FHMGXSEJ
Flipkart,,"Ciba Vision Freshlook Colorblends Pure Hazel By Visions India Monthly Contact Lens(-1.50, Pure Hazel, Pack of 2)","Freshlook Colorblends in affordable opaque colors with maximum possible lens concentration blends 3 colours into one to create the subtle, natural depth of your eyes. Replace it frequently to enjoy a comfortable wear.",Ciba Vision,http://dl.flipkart.com/dl/ciba-vision-freshlook-colorblends-pure-hazel-visions-india-monthly-contact-lens/p/itmedmq8294vvyzg?pid=CTLEDMQ8GQYRZG5N&affid=siddarthk,http://img.fkcdn.com/image/contact-lens-new/h/n/t/ciba-vision-2-freshlook-colorblends-pure-hazel-by-visions-india-200x200-imaeargbjjfcj9ur.jpeg,Health and Beauty>Eye Care>Contact Lenses,995.0,699.0,699.0,true,CTLEDMQ8GQYRZG5N,CTLEDMQ8GQYRZG5N
Flipkart,,"Bausch & Lomb Soflens 59 with Lens Case By Visions India Monthly Contact Lens(-1.00, Clear, Pack of 6)","Bausch & Lomb SofLens 59 contact lenses deliver the ultimate clarity in vision with a very comfortable experience throughout the day. These lenses are made from a protein resistant material - Hilafilcon B polymer, which leads to the unique combination of visual acuity, excellent performance and comfort, giving you comfortable daily wear on a monthly replacement basis. Advanced UniFit technology is used for SofLens 59 ensuring precision fit and performance. The unique design makes insertion and removal extremely easy. The prices of our lenses will not burn a hole in your pocket",Bausch & Lomb,http://dl.flipkart.com/dl/bausch-lomb-soflens-59-lens-case-visions-india-monthly-contact/p/itmef3fzh8fx5xyg?pid=CTLEF3FZYEWG7FEE&affid=siddarthk,http://img.fkcdn.com/image/contact-lens-new/w/x/y/bausch-lomb-6-soflens-59-with-lens-case-by-visions-india-6-50-200x200-imaeexrbsq7vp6un.jpeg,Health and Beauty>Eye Care>Contact Lenses,1310.0,799.0,799.0,true,CTLEF3FZYEWG7FEE,CTLEF3FZYEWG7FEE
Flipkart,,Optokart Two Tone Color Made In U S A By Visions India Yearly Contact Lens,Very Attractive Colors Made In U. S. A.,Optokart,http://dl.flipkart.com/dl/optokart-two-tone-color-made-u-s-visions-india-yearly-contact-lens/p/itmeh4bkwxfcz6cp?pid=CTLEH4BKBFTUFVQH&affid=siddarthk,http://img.fkcdn.com/image/contact-lens-new/2/q/n/optokart-2-two-tone-color-made-in-u-s-a-by-visions-india-6-00-200x200-imaeh2f3g6enugqz.jpeg,Health and Beauty>Eye Care>Contact Lenses,2300.0,599.0,599.0,true,CTLEH4BKBFTUFVQH,CTLEH4BKBFTUFVQH
Flipkart,,"Aryan 2 Tone Sky Blue By Visions India Yearly Contact Lens(-9.50, Sky Blue, Pack of 2)","Aryan two tone cosmetic lenses are developed and designed by the best in the business to match with the characteristics of the cornea and are intended to make one’s eyes more beautiful and more natural. Due consideration is given to the colour and size of the pupil and the health of the eye. These lenses are available in six colours – sky blue, Sky Blue, Sky Blue, brown, Sky Blue and Sky Blue along with the contact lens solution.",Aryan,http://dl.flipkart.com/dl/aryan-2-tone-sky-blue-visions-india-yearly-contact-lens/p/itmees7fh5pcqqwg?pid=CTLEES7FNXTWA2NX&affid=siddarthk,http://img.fkcdn.com/image/contact-lens-new/f/u/r/aryan-2-2-tone-sky-blue-by-visions-india-9-00-200x200-imaee9252nrnpdd4.jpeg,Health and Beauty>Eye Care>Contact Lenses,2300.0,1599.0,1599.0,true,CTLEES7FNXTWA2NX,CTLEES7FNXTWA2NX
Flipkart,,Glamour Eye Sapphire Blue By Visions India Monthly Contact Lens,India's Best Selling Cosmetic Contact Lenses Manufactured In Korea,Glamour Eye,http://dl.flipkart.com/dl/glamour-eye-sapphire-blue-visions-india-monthly-contact-lens/p/itmeghw5h6xpnhwx?pid=CTLEGHW5NURCCT8X&affid=siddarthk,http://img.fkcdn.com/image/contact-lens-new/g/n/n/glamour-eye-2-sapphire-blue-by-visions-india-15-00-200x200-imaegexvcgffcqgb.jpeg,Health and Beauty>Eye Care>Contact Lenses,995.0,625.0,625.0,true,CTLEGHW5NURCCT8X,CTLEGHW5NURCCT8X
Flipkart,,"Bausch & Lomb Lacelle Blue Monthly Contact Lens with Biotrue 60ml Solution by Visions India Monthly Contact Lens(-8.00, Blue, Pack of 2)",,Bausch & Lomb,http://dl.flipkart.com/dl/bausch-lomb-lacelle-blue-monthly-contact-lens-biotrue-60ml-solution-visions-india/p/itmeemcd34bshdxc?pid=CTLEEMCCGCXTNTF8&affid=siddarthk,http://img.fkcdn.com/image/contact-lens-new/t/b/e/bausch-lomb-2-lacelle-blue-monthly-contact-lens-with-biotrue-200x200-imaeek8pwhmcrknq.jpeg,Health and Beauty>Eye Care>Contact Lenses,1000.0,789.0,789.0,true,CTLEEMCCGCXTNTF8,CTLEEMCCGCXTNTF8
Flipkart,,Glamour Eye Satin Grey By Visions India Monthly Contact Lens,India's Best Selling Cosmetic Contact Lenses Manufactured In Korea,Glamour Eye,http://dl.flipkart.com/dl/glamour-eye-satin-grey-visions-india-monthly-contact-lens/p/itmeghwudfyzgnvh?pid=CTLEGHWUP8HWHFV3&affid=siddarthk,http://img.fkcdn.com/image/contact-lens-new/v/h/3/glamour-eye-2-satin-grey-by-visions-india-12-50-200x200-imaegezs2azh677s.jpeg,Health and Beauty>Eye Care>Contact Lenses,995.0,625.0,625.0,true,CTLEGHWUP8HWHFV3,CTLEGHWUP8HWHFV3
Flipkart,,"Bausch & Lomb Soflens with Lens Case By Visions India Daily Contact Lens(-5.00, Clear, Pack of 30)",Bausch & Lomb Daily Disposable Contact Lens,Bausch & Lomb,http://dl.flipkart.com/dl/bausch-lomb-soflens-lens-case-visions-india-daily-contact/p/itmef6gkhwnz8bzn?pid=CTLEF6GKG3GZQYPG&affid=siddarthk,http://img.fkcdn.com/image/contact-lens-new/a/r/x/bausch-lomb-30-soflens-with-lens-case-by-visions-india-8-00-200x200-imaef434yjyrsrzv.jpeg,Health and Beauty>Eye Care>Contact Lenses,1800.0,1549.0,1549.0,true,CTLEF6GKG3GZQYPG,CTLEF6GKG3GZQYPG
Flipkart,,"Bausch & Lomb Iconnect By Visions India Monthly Contact Lens(-8.00, Clear, Pack of 3)",These have been specially designed keeping the youth in mind. These easy to handle and comfortable to use lenses come in monthly disposable modality and hence are hygienic.,Bausch & Lomb,http://dl.flipkart.com/dl/bausch-lomb-iconnect-visions-india-monthly-contact-lens/p/itmeghstta3uxhvq?pid=CTLEGHSTK29PJDYT&affid=siddarthk,http://img.fkcdn.com/image/contact-lens-new/d/x/f/bausch-lomb-3-iconnect-with-lens-case-by-visions-india-9-00-200x200-imaegffkmcdcn5cv.jpeg,Health and Beauty>Eye Care>Contact Lenses,299.0,275.0,275.0,true,CTLEGHSTK29PJDYT,CTLEGHSTK29PJDYT
Flipkart,,Glamour Eye Charming Hazel By Visions India Monthly Contact Lens,India's Best Selling Cosmetic Contact Lenses Manufactured In Korea,Glamour Eye,http://dl.flipkart.com/dl/glamour-eye-charming-hazel-visions-india-monthly-contact-lens/p/itmeh8c3zafeavqt?pid=CTLEH8C3DHG3EH2Y&affid=siddarthk,http://img.fkcdn.com/image/contact-lens-new/m/2/r/glamour-eye-2-charming-hazel-by-visions-india-12-50-200x200-imaegjh57djgrcfy.jpeg,Health and Beauty>Eye Care>Contact Lenses,2600.0,625.0,625.0,true,CTLEH8C3DHG3EH2Y,CTLEH8C3DHG3EH2Y
Flipkart,,"Ciba Vision Freshlook Colorblends Monthly Contact Lens(-8.00, Honey, Pack of 2)","Freshlook Colorblends in affordable opaque colors with maximum possible lens concentration blends 3 colours into one to create the subtle, natural depth of your eyes. Replace it frequently to enjoy a comfortable wear.",Ciba Vision,http://dl.flipkart.com/dl/ciba-vision-freshlook-colorblends-monthly-contact-lens/p/itmearmgbbr2gkvy?pid=CTLEARMGPEZR7QBP&affid=siddarthk,http://img.fkcdn.com/image/contact-lens-new/5/7/t/ciba-vision-2-freshlook-colorblends-honey-by-visions-india-1-00-200x200-imaearggnngzjft9.jpeg,Health and Beauty>Eye Care>Contact Lenses,995.0,699.0,699.0,true,CTLEARMGPEZR7QBP,CTLEARMGPEZR7QBP
Flipkart,,"Bausch & Lomb Lacelle Blue Monthly Contact Lens with Biotrue 60ml Solution by Visions India Monthly Contact Lens(-6.00, Blue, Pack of 2)",,Bausch & Lomb,http://dl.flipkart.com/dl/bausch-lomb-lacelle-blue-monthly-contact-lens-biotrue-60ml-solution-visions-india/p/itmeemccy8fmrhzm?pid=CTLEEMCCCBRJZ2WE&affid=siddarthk,http://img.fkcdn.com/image/contact-lens-new/t/b/e/bausch-lomb-2-lacelle-blue-monthly-contact-lens-with-biotrue-200x200-imaeek8pwhmcrknq.jpeg,Health and Beauty>Eye Care>Contact Lenses,1000.0,789.0,789.0,true,CTLEEMCCCBRJZ2WE,CTLEEMCCCBRJZ2WE
Flipkart,,Optokart Two Tone Color Made In USA By Visions India Yearly Contact Lens,"These have been specially designed keeping the youth in mind. Most Attractive Colors These easy to handle and comfortable to use lenses come in Yearly disposable modality and hence are hygienic. Grey,Green,Turquoise,Brown.",Optokart,http://dl.flipkart.com/dl/optokart-two-tone-color-made-usa-visions-india-yearly-contact-lens/p/itmehe8ngx5ubgcw?pid=CTLEHE8NNJGMMPGJ&affid=siddarthk,http://img.fkcdn.com/image/contact-lens-new/z/j/n/optokart-2-two-tone-color-made-in-usa-by-visions-india-6-00-200x200-imaehdp5ygggddze.jpeg,Health and Beauty>Eye Care>Contact Lenses,2300.0,649.0,649.0,true,CTLEHE8NNJGMMPGJ,CTLEHE8NNJGMMPGJ
Flipkart,,Aryan Tri Tone Hazel By Visions India Yearly Contact Lens,"Aryan tri tone cosmetic lenses are developed and designed by the best in the business to match with the characteristics of the cornea and are intended to make one’s eyes more beautiful and more natural. Due consideration is given to the colour and size of the pupil and the health of the eye. These lenses are available in six colours – Sky Blue, Aqua Blue, Green , Hazel, Grey and Brown.",Aryan,http://dl.flipkart.com/dl/aryan-tri-tone-hazel-visions-india-yearly-contact-lens/p/itmegys98erraezv?pid=CTLEH5SQ3PFF4GWG&affid=siddarthk,http://img.fkcdn.com/image/contact-lens-new/4/s/h/aryan-2-tri-tone-hazel-by-visions-india-9-00-200x200-imaeh5he6nxncbxx.jpeg,Health and Beauty>Eye Care>Contact Lenses,2600.0,1599.0,1599.0,true,CTLEH5SQ3PFF4GWG,CTLEH5SQ3PFF4GWG
Flipkart,,"Ciba Vision Dailies Aquacomfort Plus Daily Contact Lens(-4.75, Black, Pack of 30)","Dailies AquaComfort Plus contact lenses are designed to aid in maximum moisture retention and provide wearers with a very comfortable fit, keeping eyes feeling good all day long. Dailies AquaComfort Plus’ triple action moisture system, including cushioning lubricant to provide comfort right from the start, a hydropholic wetting agent that keeps moisture throughout the day, and a blink-activated moisturizing agent to fight off dryness at the end of the wearing period. Dailies AquaComfort Plus contact lenses are a daily disposable lens, so at the end of the day, toss them away and start every day off with a fresh pair. These lenses also have a slight tint to the lens so it is easy to locate it in solution and makes for easy application.",Ciba Vision,http://dl.flipkart.com/dl/ciba-vision-dailies-aquacomfort-plus-daily-contact-lens/p/itmeaq5nc5ka6wcz?pid=CTLEAQ5NSHCD7UU6&affid=siddarthk,http://img.fkcdn.com/image/contact-lens-new/v/c/d/ciba-vision-30-dailies-aquacomfort-plus-2-25-200x200-imaeaz2tyzg2emdv.jpeg,Health and Beauty>Eye Care>Contact Lenses,1600.0,1499.0,1499.0,true,CTLEAQ5NSHCD7UU6,CTLEAQ5NSHCD7UU6
Flipkart,,"Ciba Vision Freshlook Colorblends Monthly Contact Lens(-1.00, Honey, Pack of 2)","Freshlook Colorblends in affordable opaque colors with maximum possible lens concentration blends 3 colours into one to create the subtle, natural depth of your eyes. Replace it frequently to enjoy a comfortable wear.",Ciba Vision,http://dl.flipkart.com/dl/ciba-vision-freshlook-colorblends-monthly-contact-lens/p/itmearmgx2vqyzxd?pid=CTLEARMGJG8EWH5W&affid=siddarthk,http://img.fkcdn.com/image/contact-lens-new/5/7/t/ciba-vision-2-freshlook-colorblends-honey-by-visions-india-1-00-200x200-imaearggnngzjft9.jpeg,Health and Beauty>Eye Care>Contact Lenses,995.0,699.0,699.0,true,CTLEARMGJG8EWH5W,CTLEARMGJG8EWH5W
Flipkart,,Glamour Eye Satin Grey By Visions India Monthly Contact Lens,India's Best Selling Cosmetic Contact Lenses Manufactured In Korea,Glamour Eye,http://dl.flipkart.com/dl/glamour-eye-satin-grey-visions-india-monthly-contact-lens/p/itmeghwujzbnetw5?pid=CTLEGHWUJTASGYHA&affid=siddarthk,http://img.fkcdn.com/image/contact-lens-new/v/h/3/glamour-eye-2-satin-grey-by-visions-india-12-50-200x200-imaegezs2azh677s.jpeg,Health and Beauty>Eye Care>Contact Lenses,995.0,625.0,625.0,true,CTLEGHWUJTASGYHA,CTLEGHWUJTASGYHA
Flipkart,,"Bausch & Lomb Soflens 59 With UV Sunglasses Monthly Contact Lens(-1.75, Clear, Pack of 6)","Deliver Excellent Clarity in Vision with a Very Comfortable Experience Throughout the Day, Lenses are Made from Hilafilcon B Polymer which Gives Unique Combination of Visual Acuity, Excellent Performance and Comfort, Giving the Patient Comfortable Daily Wear. TommyBlack Sunglasses Give You 100% uv proction agains UV Rays",Bausch & Lomb,http://dl.flipkart.com/dl/bausch-lomb-soflens-59-uv-sunglasses-monthly-contact-lens/p/itmehhfsxf3aghha?pid=CTLEHHFSMFNGWUJR&affid=siddarthk,http://img.fkcdn.com/image/contact-lens-new/x/z/q/bausch-lomb-6-soflens-59-with-uv-sunglasses-2-200x200-imaehjyvjatefbjv.jpeg,Health and Beauty>Eye Care>Contact Lenses,1195.0,999.0,999.0,true,CTLEHHFSMFNGWUJR,CTLEHHFSMFNGWUJR
Flipkart,,"Ciba Vision Freshlook Colorblends Brilliant Blue By Visions India Monthly Contact Lens(-2.25, Brilliant Blue, Pack of 2)","Freshlook Colorblends in affordable opaque colors with maximum possible lens concentration blends 3 colours into one to create the subtle, natural depth of your eyes. Replace it frequently to enjoy a comfortable wear.",Ciba Vision,http://dl.flipkart.com/dl/ciba-vision-freshlook-colorblends-brilliant-blue-visions-india-monthly-contact-lens/p/itmedn9mz63fbk8n?pid=CTLEDN9HZHX3K2XC&affid=siddarthk,http://img.fkcdn.com/image/contact-lens-new/p/z/d/ciba-vision-2-freshlook-colorblends-brilliant-blue-by-visions-200x200-imaedmzhz5epdfyd.jpeg,Health and Beauty>Eye Care>Contact Lenses,995.0,699.0,699.0,true,CTLEDN9HZHX3K2XC,CTLEDN9HZHX3K2XC
Flipkart,,"Bausch & Lomb HO4 with Biotrue 60ml Solution by Visions India Yearly Contact Lens(-18.00, Clear, Pack of 1)",If you are first time contact lens user you are naturally a little anxious about the experience. The Bausch & Lomb B4 is just the lens that you are looking for. Once you try and use these you will never go for another lens. Now you can get your myopia and hypermetropia corrected while wearing your lenses daily. Bausch & Lomb B4 comes with a unique spin-cast technology that keeps the moisture level constant and gives a spark to your eyes. They are extremely durable lenses and are easy to handle. They are made of polymacon in a computer-controlled process. The Bausch & Lomb B4 contact lens is the first choice of lenses for new contact lens wearers. It provides for excellent vision with handling comfort at a great price make them the most popular lenses in India. The lenses offer reliable performance and great value. The water content of 38.6% for durability and reduced protein deposits.,Bausch & Lomb,http://dl.flipkart.com/dl/bausch-lomb-ho4-biotrue-60ml-solution-visions-india-yearly-contact-lens/p/itmef3fnghfxdftg?pid=CTLEF3FNHCPDUTHU&affid=siddarthk,http://img.fkcdn.com/image/contact-lens-new/m/d/u/bausch-lomb-1-ho4-with-biotrue-60ml-solution-by-visions-india-11-200x200-imaeet9ek5bmyfvp.jpeg,Health and Beauty>Eye Care>Contact Lenses,915.0,799.0,799.0,true,CTLEF3FNHCPDUTHU,CTLEF3FNHCPDUTHU
Flipkart,,Glamour Eye Sapphire Blue By Visions India Monthly Contact Lens,India's Best Selling Cosmetic Contact Lenses Manufactured In Korea,Glamour Eye,http://dl.flipkart.com/dl/glamour-eye-sapphire-blue-visions-india-monthly-contact-lens/p/itmeghw5g4dhdapc?pid=CTLEGHW5AE8GXGDK&affid=siddarthk,http://img.fkcdn.com/image/contact-lens-new/g/n/n/glamour-eye-2-sapphire-blue-by-visions-india-15-00-200x200-imaegexvcgffcqgb.jpeg,Health and Beauty>Eye Care>Contact Lenses,995.0,625.0,625.0,true,CTLEGHW5AE8GXGDK,CTLEGHW5AE8GXGDK
Flipkart,,Sparkle Tri Tone By Visions India Yearly Contact Lens,Premium Color Yearly Contact Lens,Sparkle,http://dl.flipkart.com/dl/sparkle-tri-tone-visions-india-yearly-contact-lens/p/itmehrh436trmgrd?pid=CTLEHRH4HVDHKNZZ&affid=siddarthk,http://img.fkcdn.com/image/contact-lens-new/m/v/8/sparkle-2-tri-tone-by-visions-india-10-00-200x200-imaehpwjvgsj454e.jpeg,Health and Beauty>Eye Care>Contact Lenses,1500.0,999.0,999.0,true,CTLEHRH4HVDHKNZZ,CTLEHRH4HVDHKNZZ
Flipkart,,"Aryan 2 Tone Sky Blue By Visions India Yearly Contact Lens(-0.00, Sky Blue, Pack of 2)","Aryan two tone cosmetic lenses are developed and designed by the best in the business to match with the characteristics of the cornea and are intended to make one’s eyes more beautiful and more natural. Due consideration is given to the colour and size of the pupil and the health of the eye. These lenses are available in six colours – sky blue, Sky Blue, Sky Blue, brown, Sky Blue and Sky Blue along with the contact lens solution.",Aryan,http://dl.flipkart.com/dl/aryan-2-tone-sky-blue-visions-india-yearly-contact-lens/p/itmees7fhnrsf2ts?pid=CTLEES7F7NHHTTEQ&affid=siddarthk,http://img.fkcdn.com/image/contact-lens-new/f/u/r/aryan-2-2-tone-sky-blue-by-visions-india-9-00-200x200-imaee9252nrnpdd4.jpeg,Health and Beauty>Eye Care>Contact Lenses,2300.0,1599.0,1599.0,true,CTLEES7F7NHHTTEQ,CTLEES7F7NHHTTEQ
Flipkart,,"Aryan Tri Tone Hazel By Visions India Yearly Contact Lens(-2.25, Hazel, Pack of 2)","Aryan tri tone cosmetic lenses are developed and designed by the best in the business to match with the characteristics of the cornea and are intended to make one’s eyes more beautiful and more natural. Due consideration is given to the colour and size of the pupil and the health of the eye. These lenses are available in six colours – Sky Blue, Aqua Blue, Green , Hazel, Grey and Brown.",Aryan,http://dl.flipkart.com/dl/aryan-tri-tone-hazel-visions-india-yearly-contact-lens/p/itmegys9hmhsgfps?pid=CTLEH5SNVJM7XZKS&affid=siddarthk,http://img.fkcdn.com/image/contact-lens-new/4/s/h/aryan-2-tri-tone-hazel-by-visions-india-9-00-200x200-imaeh5he6nxncbxx.jpeg,Health and Beauty>Eye Care>Contact Lenses,2600.0,1599.0,1599.0,true,CTLEH5SNVJM7XZKS,CTLEH5SNVJM7XZKS
Flipkart,,"Bausch & Lomb Biotrue 1 Day with Biotrue 60ml Solution Kit By Visions India Daily Contact Lens(-0.50, Clear, Pack of 30)","Biotrue ONEday contact lenses are inspired by the biology of your eyes. While other lenses dry out as the day passes, Biotrue ONEday contacts retain moisture naturally produced by the eye. The result is consistently clear vision and comfort until the moment you take them out. With added High Definition Optics, Biotrue lenses help reduce halos and glare in low light situations. Try Biotrue ONEday daily disposables and see how naturally good your eyes can feel in contact lenses. Note: All items have latest expiry. Minimum expiry on any product will be not less than 2 years. 100% authentic item. Opened boxes cannot be replaced under any circumstance. We advise to check the product before opening them.",Bausch & Lomb,http://dl.flipkart.com/dl/bausch-lomb-biotrue-1-day-60ml-solution-kit-visions-india-daily-contact-lens/p/itmef6g4emzrepyz?pid=CTLEF6G4UAHQXNR2&affid=siddarthk,http://img.fkcdn.com/image/contact-lens-new/z/k/r/bausch-lomb-30-biotrue-1-day-with-biotrue-60ml-solution-kit-by-200x200-imaef42vfmtzvuuk.jpeg,Health and Beauty>Eye Care>Contact Lenses,2500.0,1554.0,1554.0,true,CTLEF6G4UAHQXNR2,CTLEF6G4UAHQXNR2
Flipkart,,"Bausch & Lomb Lacelle Blue Monthly Contact Lens with Biotrue 60ml Solution by Visions India Monthly Contact Lens(-8.50, Blue, Pack of 2)",,Bausch & Lomb,http://dl.flipkart.com/dl/bausch-lomb-lacelle-blue-monthly-contact-lens-biotrue-60ml-solution-visions-india/p/itmeemccthagxrht?pid=CTLEEMCCTF7GGCKG&affid=siddarthk,http://img.fkcdn.com/image/contact-lens-new/t/b/e/bausch-lomb-2-lacelle-blue-monthly-contact-lens-with-biotrue-200x200-imaeek8pwhmcrknq.jpeg,Health and Beauty>Eye Care>Contact Lenses,1000.0,789.0,789.0,true,CTLEEMCCTF7GGCKG,CTLEEMCCTF7GGCKG
