PartnerName,Id,Title,Description,Brand,Link,ImageLink,CategoryName,Mrp,OfferPrice,EffectivePrice,Availability,PartnerIdFromUrl,PartnerIdFromDb
Flipkart,,ARKES AR-02 Weighing Scale(White),"Personal Digital Weighing Scale This Stylish Bath Weighing Scale Is A Must Have. Monitor Your Health, Monitor Your Weight. This One Measure Your Weight In Kilograms (Kg) Or In Pounds (Lbs.) At Reliable Digital Measurements Every Single Time. Very Accurate. Features A Thick Tempered Glass That Is Virtually Unbreakable With Normal Use (And Normal Human Being Use, 180 Kg Capacity). The Scale Is Equipped With Four High Precision Strain Gauge And Load Cell Sensors, Ensuring Accurate Reading. High Quality Materials (Tempered Glass, Stainless Steel) Ensure Long Lasting Life Time. Auto Power-On (Just Tap The Glass With Your Foot) And Auto Shut-Off To Save On Batteries. It Has A Large Digital Lcd Display That Makes Reading So Easy.",ARKES,http://dl.flipkart.com/dl/arkes-ar-02-weighing-scale/p/itmemd2zvq2sfcpu?pid=WSLEMD2ZFJDY9SJ7&affid=siddarthk,http://img.fkcdn.com/image/weighing-scale/s/j/7/round-digital-personal-arkes-ar-02-200x200-imaemcytgzy5jqsy.jpeg,Household>Housekeeping & Laundry>Bathroom Accessories>Mats,1999.0,560.0,560.0,true,WSLEMD2ZFJDY9SJ7,WSLEMD2ZFJDY9SJ7
Flipkart,,Kitchenara WS01 Weighing Scale(Silver),"Features - Capacity: 500 gm x 0-1gm. Convenient simple operation and easy to read LCD display. 5 weighing modes : g/oz/ct/tl/gn. Range: Tare Full Capacity. Auto Off (default) : 30 seconds off. Display : Green / Blue back light. Button : Rubber / Plastic. Powered by 2AAA 1.5V batteries (included). Electronic pocket scale MH Series. The offered scale is designed using premium quality material and sophisticated tools, under the guidance of skilled professionals. It is tried on various stages by our quality controllers, as per the set industrial norms. This scale is used for measuring weight in grams, ounces and small unit of items like gold, silver, platinum, etc. Top protective cover also becomes a sturdy tray.",Kitchenara,http://dl.flipkart.com/dl/kitchenara-ws01-weighing-scale/p/itmebwqpwhc9fvsa?pid=WSLEBWQPZ28JKNEG&affid=siddarthk,http://img.fkcdn.com/image/weighing-scale/n/e/g/tmnps-kitchenara-ws01-200x200-imaebg5dzrrghdyg.jpeg,Household>Kitchen Tools>Weights & Measures>Kitchen Weights,800.0,377.0,377.0,true,WSLEBWQPZ28JKNEG,WSLEBWQPZ28JKNEG
Flipkart,,Citizon Electronic Digital Personal Bathroom Health Body Weighing Scale(Transparent),"Visually Attractive, High Quality Glass, Long Lasting Battery,Upto 180 Kgs",Citizon,http://dl.flipkart.com/dl/citizon-electronic-digital-personal-bathroom-health-body-weighing-scale/p/itmege5eah5hzgmp?pid=WSLEGE5ECJTQHBFR&affid=siddarthk,http://img.fkcdn.com/image/weighing-scale/b/f/r/hsb200p-citizon-electronic-digital-personal-bathroom-health-body-200x200-imaehw43n8zy2abd.jpeg,Health and Beauty>Health Care>Health Care Devices>Weighing Scales,999.0,699.0,699.0,true,WSLEGE5ECJTQHBFR,WSLEGE5ECJTQHBFR
Flipkart,,FDP WH-A14LB-BLACK Weighing Scale(Black),"This heavy duty weighing scale has a high precision strain gauge sensor system. It?s an excellent product for family & travel due to its compact design & light weight which is easy to carry anywhere. It is excellently designed hand grip to support facilitate easy weighing of luggage without hurting hands and fingers. It has a capacity to upto 50kg with 10gm readability show in selectable unit gm, kg, lb and oz accurately. It has LCD screen display on top with blue backlight. Stainless steel hanging hook to hold anything upto 50kg with auto power off after 30sec or manually power off instantly.",FDP,http://dl.flipkart.com/dl/fdp-wh-a14lb-black-weighing-scale/p/itmdwefgeb7whyat?pid=WSLDWEFGYNCEWCKB&affid=siddarthk,http://img.fkcdn.com/image/weighing-scale/c/k/b/wh-a14lb-black-fdp-wh-a14lb-black-200x200-imadwezehaphs5hu.jpeg,Lifestyle>Leather & Travel Accessories>Luggage>Weighing Scales,1199.0,329.0,329.0,true,WSLDWEFGYNCEWCKB,WSLDWEFGYNCEWCKB
Flipkart,,Salter Super Samson 2kg Weighing Scale(Black),"Salter Hanging Scale, International Quality, Accurate & Reliable, Corrosion Protected Springs, Easy To Carry, Specially Designed For Harsh Conditions, Overload Protection, Tough Body Made Out Of Virtually Unbreakable Nylon",Salter,http://dl.flipkart.com/dl/salter-super-samson-2kg-weighing-scale/p/itme3jrm9m2pyuqm?pid=WSLE3JRM7UWXXXFF&affid=siddarthk,http://img.fkcdn.com/image/weighing-scale/3/z/m/super-samson-10kg-salter-super-samson-10kg-200x200-imae3jwghyj64kzj.jpeg,Lifestyle>Leather & Travel Accessories>Luggage>Weighing Scales,415.0,415.0,415.0,true,WSLE3JRM7UWXXXFF,WSLE3JRM7UWXXXFF
Flipkart,,Salter Model-9004 Weighing Scale(Clear),"Electronic Glass Platform Weighing Scale, Extra High Capacity Scale, Attractive Glass Platform With Accents",Salter,http://dl.flipkart.com/dl/salter-model-9004-weighing-scale/p/itme3jrmqzexg3cj?pid=WSLE3JRM8E7MN4NJ&affid=siddarthk,http://img.fkcdn.com/image/weighing-scale/4/n/j/model-9004-salter-model-9004-200x200-imae3jwjqazk2fgh.jpeg,Health and Beauty>Health Care>Health Care Devices>Weighing Scales,2800.0,1699.0,1699.0,false,WSLE3JRM8E7MN4NJ,WSLE3JRM8E7MN4NJ
Flipkart,,Ideal Home Digital Square Weighing Scale(Transparent),"""While you need a weighing scale, you want it to blend in with your style. Marvel brings to you this electronic weighing scales made out of patterned glass combined with a large LCD display. Accuracy, elegance and Sturdiness – all combined into one. Features• Slim Design• 5mm Tempered Glass Platform• Large Platform Size 300 x 300 mm• Weighing Capacity 150 kg X 100g • Extra Large LCD Display – 22 mm• Simple Step on to Auto ON Function• Low Battery / Overload Indication• Power: 1 x 3V Lithium Battery – Included""",Ideal Home,http://dl.flipkart.com/dl/ideal-home-digital-square-weighing-scale/p/itmearwbk6fzzykv?pid=WSLEARWBA5KEKDBV&affid=siddarthk,http://img.fkcdn.com/image/weighing-scale/d/b/v/ih-15111-ideal-home-digital-square-200x200-imaeacbys8mashzc.jpeg,Household>Housekeeping & Laundry>Bathroom Accessories>Mats,1299.0,545.0,545.0,true,WSLEARWBA5KEKDBV,WSLEARWBA5KEKDBV
Flipkart,,Salter Glass Bathroom Weighing Scale(Beige),,Salter,http://dl.flipkart.com/dl/salter-glass-bathroom-weighing-scale/p/itmeazghzatsmwhh?pid=WSLEAZGHGVUBJX36&affid=siddarthk,http://img.fkcdn.com/image/weighing-scale/x/3/6/9069-nu-salter-glass-bathroom-200x200-imaeaza4kb8gygg3.jpeg,Health and Beauty>Health Care>Health Care Devices>Weighing Scales,2380.0,1490.0,1490.0,true,WSLEAZGHGVUBJX36,WSLEAZGHGVUBJX36
Flipkart,,Salter Super Samson 5kg Weighing Scale(Black),"Salter Hanging Scale, International Quality, Accurate & Reliable, Corrosion Protected Springs, Easy To Carry, Specially Designed For Harsh Conditions, Overload Protection, Tough Body Made Out Of Virtually Unbreakable Nylon",Salter,http://dl.flipkart.com/dl/salter-super-samson-5kg-weighing-scale/p/itme3jrmjzjzpfzt?pid=WSLE3JRMFUPK4TXY&affid=siddarthk,http://img.fkcdn.com/image/weighing-scale/3/z/m/super-samson-10kg-salter-super-samson-10kg-200x200-imae3jwghyj64kzj.jpeg,Lifestyle>Leather & Travel Accessories>Luggage>Weighing Scales,415.0,415.0,415.0,true,WSLE3JRMFUPK4TXY,WSLE3JRMFUPK4TXY
Flipkart,,Samso Bmi 150kg Weighing Scale,"Samso Personal Weighing Scale, Slimline Compact International Design, Accurate And Sensitive Machanism, Extra Large View Scratch Resistant Lens, Anti Rust Coated Parts",Samso,http://dl.flipkart.com/dl/samso-bmi-150kg-weighing-scale/p/itme3jrmqgpx87du?pid=WSLE3JRMBRTGGKJG&affid=siddarthk,http://img.fkcdn.com/image/weighing-scale/k/j/g/bmi-150kg-samso-bmi-150kg-200x200-imae3jwjfnszcqzm.jpeg,Health and Beauty>Health Care>Health Care Devices>Weighing Scales,1250.0,1150.0,1150.0,true,WSLE3JRMBRTGGKJG,WSLE3JRMBRTGGKJG
Flipkart,,Salter 235-6m 200kg Weighing Scale(Grey),"Salter Hanging Scale, International Quality, Accurate & Reliable, Corrosion Protected Springs, Stainless Steel Hooks, Large Dial Protected By An Acrylic Cover,",Salter,http://dl.flipkart.com/dl/salter-235-6m-200kg-weighing-scale/p/itme3jrmvzeggwvq?pid=WSLE3JRMK54JKXER&affid=siddarthk,http://img.fkcdn.com/image/weighing-scale/p/a/x/235-6m-100kg-salter-235-6m-100kg-200x200-imae3jwmuuddvv98.jpeg,Lifestyle>Leather & Travel Accessories>Luggage>Weighing Scales,2050.0,1950.0,1950.0,true,WSLE3JRMK54JKXER,WSLE3JRMK54JKXER
Flipkart,,Salter 235-6m 50kg With Handle & Soft Bag Weighing Scale(Grey),"Salter Gas Weighing Scale With Handle &Soft Bag,International Quality, Accurate & Reliable, Corrosion Protected Springs, Stainless Steel Hooks, Large Dial Protected By An Acrylic Cover,",Salter,http://dl.flipkart.com/dl/salter-235-6m-50kg-handle-soft-bag-weighing-scale/p/itme3jrmz6vdfzyy?pid=WSLE3JRMMFZZZFDB&affid=siddarthk,http://img.fkcdn.com/image/weighing-scale/f/d/b/235-6m-50kg-with-handle-soft-bag-salter-235-6m-50kg-with-handle-200x200-imae3jwmxzmybz2m.jpeg,Lifestyle>Leather & Travel Accessories>Luggage>Weighing Scales,2050.0,1950.0,1950.0,true,WSLE3JRMMFZZZFDB,WSLE3JRMMFZZZFDB
Flipkart,,Salter Model-9069 Pink Weighing Scale(Pink),"Electronic Pink Ultra Glass Platform Weighing Scale,Step On For Instant Weight Reading, Large Platform For Generous Foot Room",Salter,http://dl.flipkart.com/dl/salter-model-9069-pink-weighing-scale/p/itme3jrmwcxqsgwd?pid=WSLE3JRMQSFQZ6BV&affid=siddarthk,http://img.fkcdn.com/image/weighing-scale/6/b/v/model-9069-pink-salter-model-9069-pink-200x200-imae3jwmzebqtxyf.jpeg,Health and Beauty>Health Care>Health Care Devices>Weighing Scales,2380.0,1490.0,1490.0,true,WSLE3JRMQSFQZ6BV,WSLE3JRMQSFQZ6BV
Flipkart,,Salter MODEL-9059 Weighing Scale(Steel),Electronic Ultra Slim Stainless Steel Scale,Salter,http://dl.flipkart.com/dl/salter-model-9059-weighing-scale/p/itme38d7f6tehhx5?pid=WSLE38D7JTNENNXZ&affid=siddarthk,http://img.fkcdn.com/image/weighing-scale/n/x/z/model-9059-salter-model-9059-200x200-imae38f5cdb8thbs.jpeg,Health and Beauty>Health Care>Health Care Devices>Weighing Scales,3000.0,1950.0,1950.0,false,WSLE38D7JTNENNXZ,WSLE38D7JTNENNXZ
Flipkart,,Salter Super Samson 10kg Weighing Scale(Black),"Salter Hanging Scale, International Quality, Accurate & Reliable, Corrosion Protected Springs, Easy To Carry, Specially Designed For Harsh Conditions, Overload Protection, Tough Body Made Out Of Virtually Unbreakable Nylon",Salter,http://dl.flipkart.com/dl/salter-super-samson-10kg-weighing-scale/p/itme3jrmegbjjhzm?pid=WSLE3JRMHFK783ZM&affid=siddarthk,http://img.fkcdn.com/image/weighing-scale/3/z/m/super-samson-10kg-salter-super-samson-10kg-200x200-imae3jwghyj64kzj.jpeg,Lifestyle>Leather & Travel Accessories>Luggage>Weighing Scales,415.0,415.0,415.0,true,WSLE3JRMHFK783ZM,WSLE3JRMHFK783ZM
Flipkart,,Salter Goal Tracker Weighing Scale(White),"Salter, the UK’s leading weighing scales brand celebrated 250 years of precision technology during 2010. From its beginnings in 1760 right through to the present day, Salter products have been developed to enable total confidence in their accuracy, whether in the kitchen, the bathroom, in doctor’s surgeries or in public places. Located in the UK, Germany, Italy, USA, Canada and Australia with distribution to over 100 countries world-wide, Salter is still the UK’s leader in kitchen and bathroom scales",Salter,http://dl.flipkart.com/dl/salter-goal-tracker-weighing-scale/p/itmed8fwtwr5ssrg?pid=WSLED8FWBZFUZNWX&affid=siddarthk,http://img.fkcdn.com/image/weighing-scale/n/w/x/9063-salter-goal-tracker-200x200-imaed897mkdccsqf.jpeg,Health and Beauty>Health Care>Health Care Devices>Weighing Scales,3200.0,1600.0,1600.0,true,WSLED8FWBZFUZNWX,WSLED8FWBZFUZNWX
Flipkart,,Salter Super Samson 5kg Baby Scale Tri Color With Sling Weighing Scale(Black),"Salter Baby Hanging Scale with sling, International Quality, Accurate & Reliable, Corrosion Protected Springs, Easy To Carry, Specially Designed For Harsh Conditions, Overload Protection, Tough Body Made Out Of Virtually Unbreakable Nylon",Salter,http://dl.flipkart.com/dl/salter-super-samson-5kg-baby-scale-tri-color-sling-weighing/p/itme3xyqbwvvgn4c?pid=WSLE3XYQVGJSQT4N&affid=siddarthk,http://img.fkcdn.com/image/weighing-scale/t/4/n/super-samson-5kg-baby-scale-tri-color-with-sling-salter-super-original-imae3x25ca5jceqm.jpeg,Lifestyle>Leather & Travel Accessories>Luggage>Weighing Scales,550.0,550.0,550.0,true,WSLE3XYQVGJSQT4N,WSLE3XYQVGJSQT4N
Flipkart,,Salter 235-6m 100kg Weighing Scale(Grey),"Salter Hanging Scale, International Quality, Accurate & Reliable, Corrosion Protected Springs, Stainless Steel Hooks, Large Dial Protected By An Acrylic Cover,",Salter,http://dl.flipkart.com/dl/salter-235-6m-100kg-weighing-scale/p/itme3jrmgbeqrehv?pid=WSLE3JRMYBAGDPAX&affid=siddarthk,http://img.fkcdn.com/image/weighing-scale/p/a/x/235-6m-100kg-salter-235-6m-100kg-200x200-imae3jwmuuddvv98.jpeg,Lifestyle>Leather & Travel Accessories>Luggage>Weighing Scales,1950.0,1890.0,1890.0,true,WSLE3JRMYBAGDPAX,WSLE3JRMYBAGDPAX
Flipkart,,Salter 235-6m 25kg Weighing Scale(Grey),"Salter Hanging Scale, International Quality, Accurate & Reliable, Corrosion Protected Springs, Stainless Steel Hooks, Large Dial Protected By An Acrylic Cover,",Salter,http://dl.flipkart.com/dl/salter-235-6m-25kg-weighing-scale/p/itme3jrmsfeahsde?pid=WSLE3JRMXHGXNMRY&affid=siddarthk,http://img.fkcdn.com/image/weighing-scale/m/r/y/235-6m-25kg-salter-235-6m-25kg-200x200-imae3jwm5tzxhesf.jpeg,Lifestyle>Leather & Travel Accessories>Luggage>Weighing Scales,1700.0,1400.0,1400.0,true,WSLE3JRMXHGXNMRY,WSLE3JRMXHGXNMRY
Flipkart,,Salter Super Samson 15kg Weighing Scale(Black),"Salter Hanging Scale, International Quality, Accurate & Reliable, Corrosion Protected Springs, Easy To Carry, Specially Designed For Harsh Conditions, Overload Protection, Tough Body Made Out Of Virtually Unbreakable Nylon",Salter,http://dl.flipkart.com/dl/salter-super-samson-15kg-weighing-scale/p/itme3jrm9gegbscm?pid=WSLE3JRMJZBSET78&affid=siddarthk,http://img.fkcdn.com/image/weighing-scale/3/z/m/super-samson-10kg-salter-super-samson-10kg-200x200-imae3jwghyj64kzj.jpeg,Lifestyle>Leather & Travel Accessories>Luggage>Weighing Scales,415.0,415.0,415.0,true,WSLE3JRMJZBSET78,WSLE3JRMJZBSET78
Flipkart,,Salter Super Samson 1kg Weighing Scale(Black),"Salter Hanging Scale, International Quality, Accurate & Reliable, Corrosion Protected Springs, Easy To Carry, Specially Designed For Harsh Conditions, Overload Protection, Tough Body Made Out Of Virtually Unbreakable Nylon",Salter,http://dl.flipkart.com/dl/salter-super-samson-1kg-weighing-scale/p/itme3jrmvrwgpcpv?pid=WSLE3JRM6YHHYFEZ&affid=siddarthk,http://img.fkcdn.com/image/weighing-scale/3/z/m/super-samson-10kg-salter-super-samson-10kg-200x200-imae3jwghyj64kzj.jpeg,Lifestyle>Leather & Travel Accessories>Luggage>Weighing Scales,390.0,390.0,390.0,true,WSLE3JRM6YHHYFEZ,WSLE3JRM6YHHYFEZ
Flipkart,,Salter Model-9000 Weighing Scale(Silver),Electronic Weighing Scales,Salter,http://dl.flipkart.com/dl/salter-model-9000-weighing-scale/p/itme3fcpcehwxaag?pid=WSLE3FCPRHFPC7MQ&affid=siddarthk,http://img.fkcdn.com/image/weighing-scale/7/m/q/model-9000-salter-model-9000-200x200-imae3fehgha35pzx.jpeg,Health and Beauty>Health Care>Health Care Devices>Weighing Scales,2400.0,1150.0,1150.0,true,WSLE3FCPRHFPC7MQ,WSLE3FCPRHFPC7MQ
Flipkart,,Salter Super Samson 20kg Weighing Scale(Black),"Salter Hanging Scale, International Quality, Accurate & Reliable, Corrosion Protected Springs, Easy To Carry, Specially Designed For Harsh Conditions, Overload Protection, Tough Body Made Out Of Virtually Unbreakable Nylon",Salter,http://dl.flipkart.com/dl/salter-super-samson-20kg-weighing-scale/p/itme3jrmp5pa4hmp?pid=WSLE3JRMHF6Z6BGM&affid=siddarthk,http://img.fkcdn.com/image/weighing-scale/3/z/m/super-samson-10kg-salter-super-samson-10kg-200x200-imae3jwghyj64kzj.jpeg,Lifestyle>Leather & Travel Accessories>Luggage>Weighing Scales,490.0,490.0,490.0,true,WSLE3JRMHF6Z6BGM,WSLE3JRMHF6Z6BGM
Flipkart,,Salter 235-6m 10kg Weighing Scale(Grey),"Salter Hanging Scale, International Quality, Accurate & Reliable, Corrosion Protected Springs, Stainless Steel Hooks, Large Dial Protected By An Acrylic Cover,",Salter,http://dl.flipkart.com/dl/salter-235-6m-10kg-weighing-scale/p/itme3jrmjcmfdn8w?pid=WSLE3JRMEVY7R2CJ&affid=siddarthk,http://img.fkcdn.com/image/weighing-scale/p/g/d/235-6m-5kg-salter-235-6m-5kg-200x200-imae3jwgrc9t2yye.jpeg,Lifestyle>Leather & Travel Accessories>Luggage>Weighing Scales,1520.0,1520.0,1520.0,true,WSLE3JRMEVY7R2CJ,WSLE3JRMEVY7R2CJ
Flipkart,,Samso Slimweigh 150kg Weighing Scale,"Digital Weighing Scales, Stylish Design, Durable Sheet Metal Platform, Carpet Feet",Samso,http://dl.flipkart.com/dl/samso-slimweigh-150kg-weighing-scale/p/itme3jrmzuyg6wba?pid=WSLE3JRMGB4ZFZQD&affid=siddarthk,http://img.fkcdn.com/image/weighing-scale/z/q/d/slimweigh-150kg-samso-slimweigh-150kg-200x200-imae3jwmkhyx9jqf.jpeg,Health and Beauty>Health Care>Health Care Devices>Weighing Scales,1940.0,1390.0,1390.0,true,WSLE3JRMGB4ZFZQD,WSLE3JRMGB4ZFZQD
Flipkart,,Samso Digital Person Weighing Scale(Rose Gold / Black),Digital Bathroom Weighing Scale With Stainless Steel Top in Rose Gold Color,Samso,http://dl.flipkart.com/dl/samso-digital-person-weighing-scale/p/itmemfygytcrau7b?pid=WSLEMFYGVGNRY83H&affid=siddarthk,http://img.fkcdn.com/image/weighing-scale/8/3/h/grand-samso-digital-person-200x200-imaehxpv652uzjnh.jpeg,Health and Beauty>Health Care>Health Care Devices>Weighing Scales,2390.0,1790.0,1790.0,true,WSLEMFYGVGNRY83H,WSLEMFYGVGNRY83H
Flipkart,,Salter Super Samson 25kg Weighing Scale(Black),"Salter Hanging Scale, International Quality, Accurate & Reliable, Corrosion Protected Springs, Easy To Carry, Specially Designed For Harsh Conditions, Overload Protection, Tough Body Made Out Of Virtually Unbreakable Nylon",Salter,http://dl.flipkart.com/dl/salter-super-samson-25kg-weighing-scale/p/itme3jrmgmdeqfvq?pid=WSLE3JRMDVNCKUJF&affid=siddarthk,http://img.fkcdn.com/image/weighing-scale/3/z/m/super-samson-10kg-salter-super-samson-10kg-200x200-imae3jwghyj64kzj.jpeg,Lifestyle>Leather & Travel Accessories>Luggage>Weighing Scales,490.0,490.0,490.0,true,WSLE3JRMDVNCKUJF,WSLE3JRMDVNCKUJF
Flipkart,,Rudham 50 Kg A14 Portable Electronic Luggage Weighing Scale(Black),Portable Pocket Weighing Scale Elctronic. Weight upto 50kg. PICTURE IS FOR DESIGN REFERENCE ONLY. COLOR OF THE MODEL CAN DIFFER AS PER STOCK. DESIGN & MODEL WILL BE SAME.,Rudham,http://dl.flipkart.com/dl/rudham-50-kg-a14-portable-electronic-luggage-weighing-scale/p/itme6ef7xskqjcvt?pid=WSLE6EF7PHGK7PQU&affid=siddarthk,http://img.fkcdn.com/image/weighing-scale/n/q/z/a-14-dyna-a14-pocket-200x200-imae6cxmck5g6zxj.jpeg,Electronics>Appliances>Kitchen Appliances>Weighing Scales,1499.0,350.0,350.0,true,WSLE6EF7PHGK7PQU,WSLE6EF7PHGK7PQU
Flipkart,,"Healthsense Chef-Mate Digital Kitchen Weighing Scale(Black, Silver)","This Chef Mate Digital Kitchen weighing scale from Health Sense lets you add ingredients to your dishes with the perfect measurement. With this weighing scale on your kitchen counter, you can now say goodbye to all those guessing games that have at times, even spoilt your dish.",Healthsense,http://dl.flipkart.com/dl/healthsense-chef-mate-digital-kitchen-weighing-scale/p/itme9ydpuh9hhfrg?pid=WSLE9YDPKGDBWEMM&affid=siddarthk,http://img.fkcdn.com/image/weighing-scale/e/m/m/ks-33-healthsense-chef-mate-digital-kitchen-200x200-imaeaywc4ac6crue.jpeg,Household>Bakeware>Weights & Measures>Kitchen Weights,1899.0,1099.0,1099.0,true,WSLE9YDPKGDBWEMM,WSLE9YDPKGDBWEMM
Flipkart,,Dr. Morepen MS-03 Weighing Scale,"Features: Analog Display, Max Load: 130 Kgs, Graduation: 1 kg, Dimensions: 24.2 cms X 26.7 cms X 4 cms. Specifications: Accuracy: 0 to 60 kgs: +-1.2 digits, Accuracy: >60 to 130 kgs: +-2 .0 digits, Correct Placing: Place the scale on a solid level floor because a surface such as carpet can seriously effect the readings, Correct Using: Stand gently & straight on the scale without leaning forward or backward.",Dr. Morepen,http://dl.flipkart.com/dl/dr-morepen-ms-03-weighing-scale/p/itmdz6g4npy2psfh?pid=WSLDZ6FYFE9QFQNP&affid=siddarthk,http://img.fkcdn.com/image/weighing-scale/q/n/p/ms-03-yellow-dr-morepen-ms-03-200x200-imadz6jhx9dgfpgy.jpeg,Health and Beauty>Health Care>Health Care Devices>Weighing Scales,995.0,779.0,779.0,false,WSLDZ6FYFE9QFQNP,WSLDZ6FYFE9QFQNP
Flipkart,,Dr. Morepen MS-02 Weighing Scale,"Features: Analog Display, Non Slip Platform, Max Load 125 Kgs, Extra Large Displayion, 1 Kg graduation, 1 Year Warranty. Specifications: Dimensions - 26.8 cms X 29.7 cms X 4 cms, Accuracy: The scale is designed for personal body weighing . Accuracy is guaranteed by the digit indicated below: 0 to 60 kg( 130 Lbs): +-1.2 digits, o >60-125 kg(271 Lbs): +-2.0 digits, Correct Usage: Stand gently & straight on the scale without leaning forward or backward, Adjustment to 0: To adjust dial to zero turn taring wheel given at the base of the scale, Cleaning: Use a soft cloth slightly moistened with mild detergent solution.",Dr. Morepen,http://dl.flipkart.com/dl/dr-morepen-ms-02-weighing-scale/p/itmdz6g4z7ruhzxm?pid=WSLDZ6FY4YMCRGZB&affid=siddarthk,http://img.fkcdn.com/image/weighing-scale/g/z/b/ms-02-white-dr-morepen-ms-02-200x200-imadz6jhvzzsfgty.jpeg,Health and Beauty>Health Care>Health Care Devices>Weighing Scales,1295.0,1099.0,1099.0,true,WSLDZ6FY4YMCRGZB,WSLDZ6FY4YMCRGZB
Flipkart,,Dr. Morepen DS-08 Weighing Scale,"Features: Approved by Weight & Measurement Dept, Govt of India, Super Tempered Glass Platform, LCD Display, Auto On-off, Automatic Zero Resetting, Overload And Low Battery Indication, Capacity 150 kg, Graduation 100g, Digital Bathroom Scale, 1 X CR 2032 Battery Included, 1 Year limited Warranty .",Dr. Morepen,http://dl.flipkart.com/dl/dr-morepen-ds-08-weighing-scale/p/itmdz6g4k8qbz9tr?pid=WSLDZ6FYCZ5SCR6P&affid=siddarthk,http://img.fkcdn.com/image/weighing-scale/r/6/p/ds-08-dr-morepen-ds-08-200x200-imadz6jhzhnp3ezj.jpeg,Health and Beauty>Health Care>Health Care Devices>Weighing Scales,2750.0,2099.0,2099.0,false,WSLDZ6FYCZ5SCR6P,WSLDZ6FYCZ5SCR6P
Flipkart,,"NSC Venus Weighing Scale(Black, White)",,NSC,http://dl.flipkart.com/dl/nsc-venus-weighing-scale/p/itmenzgh5tuwd7a9?pid=WSLENZGHHSYRHYBY&affid=siddarthk,http://img.fkcdn.com/image/weighing-scale/y/b/y/body-nsc-venus-200x200-imaenxzjp8ggfncr.jpeg,Health and Beauty>Health Care>Health Care Devices>Weighing Scales,1200.0,850.0,850.0,true,WSLENZGHHSYRHYBY,WSLENZGHHSYRHYBY
Flipkart,,HRH Mh-200 Weighing Scale(Silver),,HRH,http://dl.flipkart.com/dl/hrh-mh-200-weighing-scale/p/itmeguj6nbwnwhjz?pid=WSLEGUJ66WMJVZSM&affid=siddarthk,http://img.fkcdn.com/image/weighing-scale/z/s/m/200-hrh-mh-200-200x200-imaegrg8fse9y48v.jpeg,Household>Kitchen Tools>Weights & Measures>Kitchen Weights,1000.0,298.0,298.0,true,WSLEGUJ66WMJVZSM,WSLEGUJ66WMJVZSM
Flipkart,,Venus Bs-927 Weighing Scale,"Indulge in lip-smacking delicacies occasionally and keep a check on your weight at the same time with the help of this personal Venus weighing machine. Analog Display This simple weighing machine comes with an analog display which has bold markings and an easy-to-read dial. Body Design Designed from a durable metal, this square-shaped weighing scale has a black body with a non-slippery leather finish. You can place it in any room and check your weight at any time. Weighing Capacity This Venus weighing machine has a maximum weighing capacity of 130 kgs.",Venus,http://dl.flipkart.com/dl/venus-bs-927-weighing-scale/p/itmdzy7prwhdzvze?pid=WSLDZY7PSZ2JWGG9&affid=siddarthk,http://img.fkcdn.com/image/weighing-scale/g/g/9/venus-bs-927-200x200-imadzfejt2gqnzq5.jpeg,Household>Housekeeping & Laundry>Bathroom Accessories>Mats,1099.0,649.0,649.0,true,WSLDZY7PSZ2JWGG9,WSLDZY7PSZ2JWGG9
Flipkart,,Venus Manual Metal Body Weighing Scale(Brown),"Exquisite styling defines this stylish Metal Body Manual Weighing scale. It is built with quality materials and with the highest quality standards. Features: Capacity-130 kg, Graduation-? kg, Size-29 X 27 X 5 cm, Metal Body, Leather Finish Matting",Venus,http://dl.flipkart.com/dl/venus-manual-metal-body-weighing-scale/p/itmdqzga7ymzpm4q?pid=WSLDQZG9UZMWRBPF&affid=siddarthk,http://img.fkcdn.com/image/weighing-scale/b/p/f/venus-manual-metal-body-200x200-imadqzgz2udnhvzb.jpeg,Health and Beauty>Health Care>Health Care Devices>Weighing Scales,1299.0,649.0,649.0,true,WSLDQZG9UZMWRBPF,WSLDQZG9UZMWRBPF
Flipkart,,Lion Transparent Square Weighing Scale(Silver),"With this stylish bath weighing scale, you get accurate and reliable digital measurements every time. The weighing scale features a thick tempered glass which is ideal for everyday use.",Lion,http://dl.flipkart.com/dl/lion-transparent-square-weighing-scale/p/itmea9zfqznpgpyn?pid=WSLEA9ZFKEGZFGF4&affid=siddarthk,http://img.fkcdn.com/image/weighing-scale/g/f/4/ls-2201-lion-transparent-square-200x200-imaeaarfdgydypn9.jpeg,Health and Beauty>Health Care>Health Care Devices>Weighing Scales,2999.0,649.0,649.0,true,WSLEA9ZFKEGZFGF4,WSLEA9ZFKEGZFGF4
