PartnerName,Id,Title,Description,Brand,Link,ImageLink,CategoryName,Mrp,OfferPrice,EffectivePrice,Availability,PartnerIdFromUrl,PartnerIdFromDb
Flipkart,,"Manforce Jasmine, Butterscotch, Coffee Condom(Set of 3, 30S)","Jasmine Condom Pack of 10's, Butterscotch Condom Pack of 10's, Coffee Condom Pack of 10's",Manforce,http://dl.flipkart.com/dl/manforce-jasmine-butterscotch-coffee-condom/p/itme9pteqcfecewh?pid=CDME9PTENTFYDPJP&affid=siddarthk,http://img.fkcdn.com/image/condom/p/j/p/3-30-manforce-jasmine-butterscotch-coffee-200x200-imae9t8swzuka96p.jpeg,Health and Beauty>Sexual Wellness>Condoms>For Him,240.0,189.0,189.0,true,CDME9PTENTFYDPJP,CDME9PTENTFYDPJP
Flipkart,,Bare Essentials Small Brush,,Bare Essentials,http://dl.flipkart.com/dl/bare-essentials-small-brush/p/itmdhmyfuxfaevej?pid=HRBDHHP3H3SVZGUG&affid=siddarthk,http://img.fkcdn.com/image/hair-brush/g/u/g/bare-essentials-small-brush-200x200-imadhhp8a722zpkb.jpeg,Baby Care>Grooming>Hair Brushes,99.0,99.0,99.0,false,HRBDHHP3H3SVZGUG,HRBDHHP3H3SVZGUG
Flipkart,,Vega Flat Brush,"VEGA Flat Hair BrushIdeal for daily styling for styles that require body and volume. These brushes are designed to smooth, shape and polish all hair lengths and texture. Ball tips nylon bristle gently massage the scalp and helps in detangling and add root lift. Suitable for all hair lengths.",Vega,http://dl.flipkart.com/dl/vega-flat-brush/p/itme3smkzznuwtdq?pid=HRBE3SMKKUGV5FCN&affid=siddarthk,http://img.fkcdn.com/image/hair-brush/f/c/n/e3-fb-vega-flat-brush-200x200-imae3spcht69sek3.jpeg,Baby Care>Grooming>Hair Brushes,275.0,231.0,231.0,false,HRBE3SMKKUGV5FCN,HRBE3SMKKUGV5FCN
Flipkart,,DCS Designer Hair Clip(Multicolor),This is an fancy hair clip especially made for women with attractive design.,DCS,http://dl.flipkart.com/dl/dcs-designer-hair-clip/p/itmecqpgxjgbajyy?pid=HACECQPG9NKF42SM&affid=siddarthk,http://img.fkcdn.com/image/hair-accessory/2/s/m/5490-1-dcs-hair-clip-designer-200x200-imaecpnrnsadrwdn.jpeg,Health and Beauty>Hair Care>Hair Care Accessories>Hair Accessories,199.0,115.0,115.0,false,HACECQPG9NKF42SM,HACECQPG9NKF42SM
Flipkart,,DCS Elastic Wollen White Hair Band(White),Your Love of Hair just got fonder with this Woolen Charming Delight Hair Band. It Is Made Of Pure Wool And Elastic. It is a combination of exquisite colored hair bands.,DCS,http://dl.flipkart.com/dl/dcs-elastic-wollen-white-hair-band/p/itmecpzqjhhzrj3a?pid=HACECPZQ5AXYHH94&affid=siddarthk,http://img.fkcdn.com/image/hair-accessory/h/9/4/5441-1-dcs-hair-band-elastic-wollen-white-200x200-imaecm6qbxcnsdzj.jpeg,Health and Beauty>Hair Care>Hair Care Accessories>Hair Accessories,150.0,110.0,110.0,true,HACECPZQ5AXYHH94,HACECPZQ5AXYHH94
Flipkart,,DCS Traditional Artificial Hair Accessory Set(Black),This Traditional is especially made for women with attractive design.Its looks more natural and easy to wear with adjust the hooks inside.You will be amazed by the quality. It will bring you more confidence.It adds volume to your hair.Easy to clean and store wig.,DCS,http://dl.flipkart.com/dl/dcs-traditional-artificial-hair-accessory-set/p/itmef8ksgqz5aq3z?pid=HACEF8KSHARQG9YE&affid=siddarthk,http://img.fkcdn.com/image/hair-accessory/9/y/e/7525-1-dcs-traditional-artificial-200x200-imaef7h5whrc2gpt.jpeg,Health and Beauty>Hair Care>Hair Care Accessories>Hair Accessories,899.0,699.0,699.0,true,HACEF8KSHARQG9YE,HACEF8KSHARQG9YE
Flipkart,,DCS Elastic Woolen Red Rubber Band(Red),Your Love of Hair just got fonder with this Woolen Charming Delight Hair Band. It Is Made Of Pure Wool And Elastic. It is a combination of exquisite colored hair bands,DCS,http://dl.flipkart.com/dl/dcs-elastic-woolen-red-rubber-band/p/itmecndxm9d3ctjn?pid=HACECNDXEKHAZD6H&affid=siddarthk,http://img.fkcdn.com/image/hair-accessory/d/6/h/5451-1-dcs-rubber-band-elastic-woolen-red-200x200-imaecm8fghnnm6hh.jpeg,Health and Beauty>Hair Care>Hair Care Accessories>Hair Accessories,155.0,120.0,120.0,true,HACECNDXEKHAZD6H,HACECNDXEKHAZD6H
Flipkart,,DCS Designer Women's Hair Wig Braid Extension(Black),This stylish wig is especially made for women with attractive design.Its looks more natural and easy to wear with adjust the hooks inside.You will be amazed by the quality. It will bring you more confidence.It adds volume to your hair.Easy to clean and store wig.,DCS,http://dl.flipkart.com/dl/dcs-designer-women-s-hair-wig-braid-extension/p/itmef8ksgwrn55pp?pid=HACEF8KSKKS9YMBP&affid=siddarthk,http://img.fkcdn.com/image/hair-accessory/m/b/p/7466-1-dcs-designer-women-s-hair-wig-200x200-imaef7k6s3ff8fsx.jpeg,Health and Beauty>Hair Care>Hair Care Accessories>Hair Accessories,650.0,460.0,460.0,true,HACEF8KSKKS9YMBP,HACEF8KSKKS9YMBP
Flipkart,,DCS Elastic Woolen Yellow Rubber Band(Yellow),Your Love of Hair just got fonder with this Woolen Charming Delight Hair Band. It Is Made Of Pure Wool And Elastic. It is a combination of exquisite colored hair bands,DCS,http://dl.flipkart.com/dl/dcs-elastic-woolen-yellow-rubber-band/p/itmecndygwfnwyzk?pid=HACECNDYJWZZTKDA&affid=siddarthk,http://img.fkcdn.com/image/hair-accessory/k/d/a/5447-1-dcs-rubber-band-elastic-woolen-yellow-200x200-imaecm78yc7jwdte.jpeg,Health and Beauty>Hair Care>Hair Care Accessories>Hair Accessories,155.0,110.0,110.0,true,HACECNDYJWZZTKDA,HACECNDYJWZZTKDA
Flipkart,,Maayra Sober Designer Hair Claw(Purple),"Designed in Designer work, this Hair Clutcher is made of lead & nickel-free, best-quality Plastic. This Purple - coloured Hair Accessory design will best meet your College Party requirements. In terms of their wearing method, this Hair Clutcher has a",Maayra,http://dl.flipkart.com/dl/maayra-sober-designer-hair-claw/p/itme932trqrtzmzk?pid=HACE932T4M3DTFDZ&affid=siddarthk,http://img.fkcdn.com/image/hair-accessory/f/d/z/my2840-1-maayra-hair-claw-sober-designer-200x200-imae8yybv8pwpm8k.jpeg,Health and Beauty>Hair Care>Hair Care Accessories>Hair Accessories,550.0,299.0,374.0,true,HACE932T4M3DTFDZ,HACE932T4M3DTFDZ
Flipkart,,AccessHer Designer Tic Tac Clip,Crafted By AccessHer Using Premium Quality Metals and Stones to give it a superior grip to hold your hair as you desire.Make an impact with the all different hair style variations you've always desired combining our superior grip hair pins .Or You could just match it with your attire and get that super cute look . #ownyourstyle,AccessHer,http://dl.flipkart.com/dl/accessher-designer-tic-tac-clip/p/itmec88zrh6zganv?pid=HACEC88ZVNUTUAAT&affid=siddarthk,http://img.fkcdn.com/image/hair-accessory/a/a/t/acttfud17clrblk-2-accessher-tic-tac-clip-designer-200x200-imaec5p59agfzuzz.jpeg,Health and Beauty>Hair Care>Hair Care Accessories>Hair Accessories,845.0,450.0,450.0,true,HACEC88ZVNUTUAAT,HACEC88ZVNUTUAAT
Flipkart,,AccessHer Floral Designer Clip Hair Pin,Crafted By AccessHer Using Premium Quality Metals and Stones to give it a superior grip to hold your hair as you desire.Make an impact with the all different hair style variations you've always desired combining our superior grip hair pins .Or You could just match it with your attire and get that super cute look . #ownyourstyle,AccessHer,http://dl.flipkart.com/dl/accessher-floral-designer-clip-hair-pin/p/itmecdetv9pphgw6?pid=HACECDETQXVU2NBH&affid=siddarthk,http://img.fkcdn.com/image/hair-accessory/n/b/h/acshpfud18bclr-1-accessher-hair-pin-floral-designer-clip-200x200-imaecb5pand8tkbx.jpeg,Health and Beauty>Hair Care>Hair Care Accessories>Hair Accessories,845.0,450.0,450.0,true,HACECDETQXVU2NBH,HACECDETQXVU2NBH
Flipkart,,Jillcart Kunjalam Hair Band(Gold),,Jillcart,http://dl.flipkart.com/dl/jillcart-kunjalam-hair-band/p/itmefjytun4arawc?pid=HACEFJYTBEZWNZFU&affid=siddarthk,http://img.fkcdn.com/image/hair-accessory/z/f/u/kj01-1-jillcart-kunjalam-200x200-imaegbfh4ggcrhfn.jpeg,Health and Beauty>Hair Care>Hair Care Accessories>Hair Accessories,3800.0,1100.0,1100.0,false,HACEFJYTBEZWNZFU,HACEFJYTBEZWNZFU
Flipkart,,L'Oreal Paris Eversleek Sulfate-Free Smoothing System Reparative Smoothing Conditioner(250 ml),,L'Oreal Paris,http://dl.flipkart.com/dl/l-oreal-paris-eversleek-sulfate-free-smoothing-system-reparative-conditioner/p/itmeg9fg4gcvjyue?pid=CNDEG9FGXBVHT47P&affid=siddarthk,http://img.fkcdn.com/image/conditioner/4/7/p/l-oreal-paris-250-eversleek-sulfate-free-smoothing-system-200x200-imaegac8zywzrmwz.jpeg,Health and Beauty>Hair Care>Conditioners,4056.0,3224.0,3583.0,true,CNDEG9FGXBVHT47P,CNDEG9FGXBVHT47P
Flipkart,,Coolntape 0248 Crepe Bandage,"Cool'n tape is the only complete, non-drug treatment for sprains, strains, aches, pains and other soft tissue injuries. Where there are a variety of compression bandages (i.e.Tensor), ice packs, ice pack wraps (Cryo-cuff), oil and alcohol infused dressings and plasters, and moist wraps that provide evaporative cooling, Cool'n tape is the only compression wrap that provides elastic compression and cool therapy - all in one! These two fundamental principles stem back from Hippocrates and are found within standard medical practice (R.I.C.E). Cool'n tape has an elastic compression similar to gauze or tensors, that will also allow swelling to expand the dressing for severe injuries, and prevent over tightening. The benefit of compression versus just an ice pack is that compression will resist edema (swelling) from occurring and damaging the surrounding tissues.On the other hand, the application of cold (4ºC-10ºC) tends to lend itself to a cold shock response by the tissue- shunting off blood flow and causing tissue hypothermia. Cool'n tape uses a water based gel system that self-regulates a temperature found scientifically to be optimal for cooling, between 15-18ºC. Unlike several plasters and evaporative wraps on the market, Cool'n tape not only provides the sensation of cold and cool temperatures, but it acts as a heat sink to draw heat away from the body. Inflammation causes heat and too much heat can lead to destructive biological mechanisms. Cool'n tape gradually and consistently pulls the heat away cooling the skin on average 8ºC, and in turn reduces blood flow allowing healing to persist in a controlled manner.Altogether Cool'n tape is a far superior product to its close competitors, lacking many of the adverse effects caused by similar products (reddening, irritation and skin dryness). It is the only hydrogel cooling wrap with a heat wicking technology that allows you to use the dressing both on and off the field. Unlike ice, Cool'n tape can be used in between exercising or even worn at the office for periods of an 1-2hs. It is reusable, non-toxic, affordable and safe for all ages. It is easy to apply by oneself and can be used without refrigeration - right out of the package! Whether you are a professional athlete or a weekend warrior Cool'n tape will help to speed up recovery from pain and inflammation.",Coolntape,http://dl.flipkart.com/dl/coolntape-0248-crepe-bandage/p/itme5hctfeazdpng?pid=CRPE5HCTQDKVZ6BR&affid=siddarthk,http://img.fkcdn.com/image/crepe-bandage/f/g/e/fingerwrap-2-5-coolntape-0124-200x200-imae5gdgvzrecnzh.jpeg,Health and Beauty>Health Care>Medicines & Treatment,1690.0,1690.0,1690.0,true,CRPE5HCTQDKVZ6BR,CRPE5HCTQDKVZ6BR
Flipkart,,Coolntape 0372 Crepe Bandage,"Cool'n tape is the only complete, non-drug treatment for sprains, strains, aches, pains and other soft tissue injuries. Where there are a variety of compression bandages (i.e.Tensor), ice packs, ice pack wraps (Cryo-cuff), oil and alcohol infused dressings and plasters, and moist wraps that provide evaporative cooling, Cool'n tape is the only compression wrap that provides elastic compression and cool therapy - all in one! These two fundamental principles stem back from Hippocrates and are found within standard medical practice (R.I.C.E). Cool'n tape has an elastic compression similar to gauze or tensors, that will also allow swelling to expand the dressing for severe injuries, and prevent over tightening. The benefit of compression versus just an ice pack is that compression will resist edema (swelling) from occurring and damaging the surrounding tissues.On the other hand, the application of cold (4ºC-10ºC) tends to lend itself to a cold shock response by the tissue- shunting off blood flow and causing tissue hypothermia. Cool'n tape uses a water based gel system that self-regulates a temperature found scientifically to be optimal for cooling, between 15-18ºC. Unlike several plasters and evaporative wraps on the market, Cool'n tape not only provides the sensation of cold and cool temperatures, but it acts as a heat sink to draw heat away from the body. Inflammation causes heat and too much heat can lead to destructive biological mechanisms. Cool'n tape gradually and consistently pulls the heat away cooling the skin on average 8ºC, and in turn reduces blood flow allowing healing to persist in a controlled manner.Altogether Cool'n tape is a far superior product to its close competitors, lacking many of the adverse effects caused by similar products (reddening, irritation and skin dryness). It is the only hydrogel cooling wrap with a heat wicking technology that allows you to use the dressing both on and off the field. Unlike ice, Cool'n tape can be used in between exercising or even worn at the office for periods of an 1-2hs. It is reusable, non-toxic, affordable and safe for all ages. It is easy to apply by oneself and can be used without refrigeration - right out of the package! Whether you are a professional athlete or a weekend warrior Cool'n tape will help to speed up recovery from pain and inflammation.",Coolntape,http://dl.flipkart.com/dl/coolntape-0372-crepe-bandage/p/itme5hct6f5f6g24?pid=CRPE5HCTMGGXVCSN&affid=siddarthk,http://img.fkcdn.com/image/crepe-bandage/c/s/n/large-7-5-coolntape-0372-200x200-imae5hctttzbwkzy.jpeg,Health and Beauty>Health Care>Medicines & Treatment,2040.0,2040.0,2040.0,true,CRPE5HCTMGGXVCSN,CRPE5HCTMGGXVCSN
Flipkart,,Coolntape 0124 Crepe Bandage(2.5 cm),"Cool'n tape is the only complete, non-drug treatment for sprains, strains, aches, pains and other soft tissue injuries. Where there are a variety of compression bandages (i.e.Tensor), ice packs, ice pack wraps (Cryo-cuff), oil and alcohol infused dressings and plasters, and moist wraps that provide evaporative cooling, Cool'n tape is the only compression wrap that provides elastic compression and cool therapy - all in one! These two fundamental principles stem back from Hippocrates and are found within standard medical practice (R.I.C.E). Cool'n tape has an elastic compression similar to gauze or tensors, that will also allow swelling to expand the dressing for severe injuries, and prevent over tightening. The benefit of compression versus just an ice pack is that compression will resist edema (swelling) from occurring and damaging the surrounding tissues.On the other hand, the application of cold (4ºC-10ºC) tends to lend itself to a cold shock response by the tissue- shunting off blood flow and causing tissue hypothermia. Cool'n tape uses a water based gel system that self-regulates a temperature found scientifically to be optimal for cooling, between 15-18ºC. Unlike several plasters and evaporative wraps on the market, Cool'n tape not only provides the sensation of cold and cool temperatures, but it acts as a heat sink to draw heat away from the body. Inflammation causes heat and too much heat can lead to destructive biological mechanisms. Cool'n tape gradually and consistently pulls the heat away cooling the skin on average 8ºC, and in turn reduces blood flow allowing healing to persist in a controlled manner.Altogether Cool'n tape is a far superior product to its close competitors, lacking many of the adverse effects caused by similar products (reddening, irritation and skin dryness). It is the only hydrogel cooling wrap with a heat wicking technology that allows you to use the dressing both on and off the field. Unlike ice, Cool'n tape can be used in between exercising or even worn at the office for periods of an 1-2hs. It is reusable, non-toxic, affordable and safe for all ages. It is easy to apply by oneself and can be used without refrigeration - right out of the package! Whether you are a professional athlete or a weekend warrior Cool'n tape will help to speed up recovery from pain and inflammation.",Coolntape,http://dl.flipkart.com/dl/coolntape-0124-crepe-bandage/p/itme5hctjwtwxgzc?pid=CRPE5HCTQUXXEFGE&affid=siddarthk,http://img.fkcdn.com/image/crepe-bandage/f/g/e/fingerwrap-2-5-coolntape-0124-200x200-imae5gdgvzrecnzh.jpeg,Health and Beauty>Health Care>Medicines & Treatment,1530.0,1530.0,1530.0,true,CRPE5HCTQUXXEFGE,CRPE5HCTQUXXEFGE
Flipkart,,Coolntape 03720248 Crepe Bandage,"Cool'n tape is the only complete, non-drug treatment for sprains, strains, aches, pains and other soft tissue injuries. Where there are a variety of compression bandages (i.e.Tensor), ice packs, ice pack wraps (Cryo-cuff), oil and alcohol infused dressings and plasters, and moist wraps that provide evaporative cooling, Cool'n tape is the only compression wrap that provides elastic compression and cool therapy - all in one! These two fundamental principles stem back from Hippocrates and are found within standard medical practice (R.I.C.E). Cool'n tape has an elastic compression similar to gauze or tensors, that will also allow swelling to expand the dressing for severe injuries, and prevent over tightening. The benefit of compression versus just an ice pack is that compression will resist edema (swelling) from occurring and damaging the surrounding tissues.On the other hand, the application of cold (4ºC-10ºC) tends to lend itself to a cold shock response by the tissue- shunting off blood flow and causing tissue hypothermia. Cool'n tape uses a water based gel system that self-regulates a temperature found scientifically to be optimal for cooling, between 15-18ºC. Unlike several plasters and evaporative wraps on the market, Cool'n tape not only provides the sensation of cold and cool temperatures, but it acts as a heat sink to draw heat away from the body. Inflammation causes heat and too much heat can lead to destructive biological mechanisms. Cool'n tape gradually and consistently pulls the heat away cooling the skin on average 8ºC, and in turn reduces blood flow allowing healing to persist in a controlled manner.Altogether Cool'n tape is a far superior product to its close competitors, lacking many of the adverse effects caused by similar products (reddening, irritation and skin dryness). It is the only hydrogel cooling wrap with a heat wicking technology that allows you to use the dressing both on and off the field. Unlike ice, Cool'n tape can be used in between exercising or even worn at the office for periods of an 1-2hs. It is reusable, non-toxic, affordable and safe for all ages. It is easy to apply by oneself and can be used without refrigeration - right out of the package! Whether you are a professional athlete or a weekend warrior Cool'n tape will help to speed up recovery from pain and inflammation.",Coolntape,http://dl.flipkart.com/dl/coolntape-03720248-crepe-bandage/p/itme5hct96kzqdnc?pid=CRPE5HCTCYYBYAFR&affid=siddarthk,http://img.fkcdn.com/image/crepe-bandage/f/g/e/fingerwrap-2-5-coolntape-0124-200x200-imae5gdgvzrecnzh.jpeg,Health and Beauty>Health Care>Medicines & Treatment,3730.0,3730.0,3730.0,true,CRPE5HCTCYYBYAFR,CRPE5HCTCYYBYAFR
Flipkart,,Coolntape 02480248 Crepe Bandage,"Cool'n tape is the only complete, non-drug treatment for sprains, strains, aches, pains and other soft tissue injuries. Where there are a variety of compression bandages (i.e.Tensor), ice packs, ice pack wraps (Cryo-cuff), oil and alcohol infused dressings and plasters, and moist wraps that provide evaporative cooling, Cool'n tape is the only compression wrap that provides elastic compression and cool therapy - all in one! These two fundamental principles stem back from Hippocrates and are found within standard medical practice (R.I.C.E). Cool'n tape has an elastic compression similar to gauze or tensors, that will also allow swelling to expand the dressing for severe injuries, and prevent over tightening. The benefit of compression versus just an ice pack is that compression will resist edema (swelling) from occurring and damaging the surrounding tissues.On the other hand, the application of cold (4ºC-10ºC) tends to lend itself to a cold shock response by the tissue- shunting off blood flow and causing tissue hypothermia. Cool'n tape uses a water based gel system that self-regulates a temperature found scientifically to be optimal for cooling, between 15-18ºC. Unlike several plasters and evaporative wraps on the market, Cool'n tape not only provides the sensation of cold and cool temperatures, but it acts as a heat sink to draw heat away from the body. Inflammation causes heat and too much heat can lead to destructive biological mechanisms. Cool'n tape gradually and consistently pulls the heat away cooling the skin on average 8ºC, and in turn reduces blood flow allowing healing to persist in a controlled manner.Altogether Cool'n tape is a far superior product to its close competitors, lacking many of the adverse effects caused by similar products (reddening, irritation and skin dryness). It is the only hydrogel cooling wrap with a heat wicking technology that allows you to use the dressing both on and off the field. Unlike ice, Cool'n tape can be used in between exercising or even worn at the office for periods of an 1-2hs. It is reusable, non-toxic, affordable and safe for all ages. It is easy to apply by oneself and can be used without refrigeration - right out of the package! Whether you are a professional athlete or a weekend warrior Cool'n tape will help to speed up recovery from pain and inflammation.",Coolntape,http://dl.flipkart.com/dl/coolntape-02480248-crepe-bandage/p/itme5hctgbfjmjgv?pid=CRPE5HCT5ZVUFYKS&affid=siddarthk,http://img.fkcdn.com/image/crepe-bandage/f/g/e/fingerwrap-2-5-coolntape-0124-200x200-imae5gdgvzrecnzh.jpeg,Health and Beauty>Health Care>Medicines & Treatment,3380.0,3380.0,3380.0,true,CRPE5HCT5ZVUFYKS,CRPE5HCT5ZVUFYKS
Flipkart,,Kandy Floss Dressing Comb,,Kandy Floss,http://dl.flipkart.com/dl/kandy-floss-dressing-comb/p/itmeggwmnbuzbnds?pid=HCBEGGWMEYJFJYXS&affid=siddarthk,http://img.fkcdn.com/image/hair-comb/y/x/s/bc197950-kandyfloss-dressing-comb-200x200-imaegfxh6nj6ybdz.jpeg,Health and Beauty>Hair Care>Hair Care Accessories>Hair Combs,249.0,134.0,149.0,true,HCBEGGWMEYJFJYXS,HCBEGGWMEYJFJYXS
Flipkart,,Kandy Floss Dressing Comb,,Kandy Floss,http://dl.flipkart.com/dl/kandy-floss-dressing-comb/p/itmeggvxdfaevywq?pid=HCBEGGVXYXHZZ9KN&affid=siddarthk,http://img.fkcdn.com/image/hair-comb/9/k/n/bc197951-kandyfloss-dressing-comb-200x200-imaegfxsccuczpfa.jpeg,Health and Beauty>Hair Care>Hair Care Accessories>Hair Combs,249.0,139.0,199.0,true,HCBEGGVXYXHZZ9KN,HCBEGGVXYXHZZ9KN
Flipkart,,Kandy Floss Dressing Comb,,Kandy Floss,http://dl.flipkart.com/dl/kandy-floss-dressing-comb/p/itmeggvv2gmemngf?pid=HCBEGGVVSWRGBDFY&affid=siddarthk,http://img.fkcdn.com/image/hair-comb/d/f/y/bc197992-kandyfloss-dressing-comb-200x200-imaegfxyczyqzqcr.jpeg,Health and Beauty>Hair Care>Hair Care Accessories>Hair Combs,249.0,104.0,149.0,true,HCBEGGVVSWRGBDFY,HCBEGGVVSWRGBDFY
Flipkart,,Craftchakra HANDCARVED FISH SHAPED WOODEN COMB,This beautiful two-sided fish-shaped comb has been hand-carved from sheesham wood. An exotic addition to your dresser,Craftchakra,http://dl.flipkart.com/dl/craftchakra-handcarved-fish-shaped-wooden-comb/p/itmeggj4yfqfgym2?pid=HCBEGGJ4YTUR4QW6&affid=siddarthk,http://img.fkcdn.com/image/hair-comb/q/w/6/wc03-craftchakra-handcarved-fish-shaped-wooden-comb-200x200-imaeggfvmnk8p2hs.jpeg,Health and Beauty>Hair Care>Hair Care Accessories>Hair Combs,350.0,350.0,350.0,false,HCBEGGJ4YTUR4QW6,HCBEGGJ4YTUR4QW6
Flipkart,,ARIP Styling Eyelash Day and Night Pack,"Arip Lashes Are Perfect For Any Special Occasion Or A Night Out On The Town. These eyelashes are Reusable, Easy-To-Apply And Give The Desired, Glamorous Look Of Long, Beautiful Lashes. Application Directions: Thoroughly Clean Your Eyelashes And Eyelids So They Are Make-Up And Oil Free. 1)Check Fit Lay Lash On Top Of Your Natural Lash. If It Extends Beyond Your Lash Line, Trim The Excess With Small Scissors. 2) Apply Adhesive Squeeze A Thin Line Of Lashgrip Adhesive Along The Lash Band. A Toothpick Can Be Used To Spread It Evenly. Wait About 30 Seconds For Adhesive To Set 3)Apply Lash Place The Lash As Close To Your Natural Lash Line As Possible. Use Your Fingertip To Gently Press Along The Band To Secure In Place.",ARIP,http://dl.flipkart.com/dl/arip-styling-eyelash-day-night-pack/p/itmeggf3gmt9zzd4?pid=FLSEGGF3GFAMNMJD&affid=siddarthk,http://img.fkcdn.com/image/false-eyelash/m/j/d/12-007-arip-styling-eyelash-day-and-night-pack-200x200-imaegh64pn28hufc.jpeg,Health and Beauty>Beauty Accessories>Makeup Accessories>False Eyelashes,3299.0,628.0,698.0,true,FLSEGGF3GFAMNMJD,FLSEGGF3GFAMNMJD
Flipkart,,M.A.C Pro Longwear  Concealer(NW15),"A lightweight fluid concealer that provides medium to full coverage with a comfortable, natural matte finish. Color-true formula lasts up to 15 hours. Helps conceal and correct the look of under-eye circles and discolorations. Comes in a clear glass vial with a matte black pump. Color(s): nc15, nc20, nc25, nc30, nc35, nc42, nc45, nc50, nw15, nw20, nw25, nw30, nw35, nw40, nw45, nw50. Brand: M.A.C.. Style Name: MAC 'Pro Longwear' Concealer. Style Number: 323920. Available In Stores. Manufacturer part number MGT9",M.A.C,http://dl.flipkart.com/dl/m-a-c-pro-longwear-concealer/p/itmeh4azjaxgfwyk?pid=CLREG9FFVNFZ4HGU&affid=siddarthk,http://img.fkcdn.com/image/concealer/h/g/u/m-a-c-pro-longwear-concealer-200x200-imaegac8db6ggdpg.jpeg,Health and Beauty>Makeup>Face>Concealers,6131.0,4519.0,5022.0,true,CLREG9FFVNFZ4HGU,CLREG9FFVNFZ4HGU
