PartnerName,Id,Title,Description,Brand,Link,ImageLink,CategoryName,Mrp,OfferPrice,EffectivePrice,Availability,PartnerIdFromUrl,PartnerIdFromDb
Flipkart,,Sarah Polka Dot Rubber Band(Pink),"Sarah Pink Fabric Rabbit Ear Hair Rubber Band for Women. The String Inside the bow fabric gives you the flexibility of changing the shape of the bow. These Hair Bands will keep your hairstyle in place, and it will add a pop of cute colour to your look, our range of Hair bands will style your hair with simplicity.",Sarah,http://dl.flipkart.com/dl/sarah-polka-dot-rubber-band/p/itmejuhspxqnznyu?pid=HACEJUHSX2KXFNMN&affid=siddarthk,http://img.fkcdn.com/image/hair-accessory/n/m/n/ha10503rb-1-sarah-polka-dot-200x200-imaejvtvddxdganq.jpeg,Health and Beauty>Hair Care>Hair Care Accessories>Hair Accessories,195.0,195.0,195.0,true,HACEJUHSX2KXFNMN,HACEJUHSX2KXFNMN
Flipkart,,Sarah Lace Trimming Rubber Band(Beige),"Sarah Lace Trimming Off-White Fabric Rubber Band for Women. This Hair Clutcher measures approx. inches. These Rubber Band will keep hairstyle in place, and it will add a pop of cute colour to the look, our range of Rubber Band will style your hair with simplicity.",Sarah,http://dl.flipkart.com/dl/sarah-lace-trimming-rubber-band/p/itmejuhd6sukrhxa?pid=HACEJUHDRJKZQRWT&affid=siddarthk,http://img.fkcdn.com/image/hair-accessory/r/w/t/ha11211rb-1-sarah-lace-trimming-200x200-imaejubzasp7gp6u.jpeg,Health and Beauty>Hair Care>Hair Care Accessories>Hair Accessories,125.0,125.0,125.0,true,HACEJUHDRJKZQRWT,HACEJUHDRJKZQRWT
Flipkart,,Trendy Nuts Hotty Hat Rubber Band(Multicolor),Trendy Nuts Hotty Hat hair rubber band is best accessory to keep your hairs tied and look beautiful.,Trendy Nuts,http://dl.flipkart.com/dl/trendy-nuts-hotty-hat-rubber-band/p/itmejxfghxgvbpgj?pid=HACEJXFGXJNGZ76F&affid=siddarthk,http://img.fkcdn.com/image/hair-accessory/7/6/f/tnrbhhsp4-1-trendy-nuts-hotty-hat-200x200-imaejvm2w2z2bgvp.jpeg,Health and Beauty>Hair Care>Hair Care Accessories>Hair Accessories,499.0,299.0,299.0,true,HACEJXFGXJNGZ76F,HACEJXFGXJNGZ76F
Flipkart,,Sarah Double Layered Rubber Band(Green),"Sarah Green Fabric Hair Rubber Band for Women with Blue color Bows. These Hair Bands will keep your hairstyle in place, and it will add a pop of cute colour to your look, our range of Hair bands will style your hair with simplicity.",Sarah,http://dl.flipkart.com/dl/sarah-double-layered-rubber-band/p/itmejuhdpbkh4fcg?pid=HACEJUHDSXEGUG7H&affid=siddarthk,http://img.fkcdn.com/image/hair-accessory/g/7/h/ha10629rb-1-sarah-double-layered-200x200-imaejvttr2mcv8kf.jpeg,Health and Beauty>Hair Care>Hair Care Accessories>Hair Accessories,275.0,275.0,275.0,true,HACEJUHDSXEGUG7H,HACEJUHDSXEGUG7H
Flipkart,,Yashasvi Pretty Hair Band(Pink),"Dress your baby girl in this stylish hair band which will beautify the simple look of the hair of your baby girl by making her look more fashionable and stylish.This hairband is great for any occasion like princess party, Birthday party & Halloween.",Yashasvi,http://dl.flipkart.com/dl/yashasvi-pretty-hair-band/p/itmejzzfgcfpcmfw?pid=HACEJZZFJE4DW4FG&affid=siddarthk,http://img.fkcdn.com/image/hair-accessory/4/f/g/cayb-b9002-pk-1-yashasvi-pretty-200x200-imaejyzmppcmmmfz.jpeg,Health and Beauty>Hair Care>Hair Care Accessories>Hair Accessories,299.0,159.0,199.0,true,HACEJZZFJE4DW4FG,HACEJZZFJE4DW4FG
Flipkart,,its 4 u new triangle Hair Claw(Multicolor),,its 4 u,http://dl.flipkart.com/dl/its-4-u-new-triangle-hair-claw/p/itmefrv2tukh7hyy?pid=HACEFRV2BJKN5D3V&affid=siddarthk,http://img.fkcdn.com/image/hair-accessory/g/4/a/21-1-iha-hair-butterflies-200x200-imaefrg55qgfmgpq.jpeg,Health and Beauty>Hair Care>Hair Care Accessories>Hair Accessories,449.0,310.0,310.0,false,HACEFRV2BJKN5D3V,HACEFRV2BJKN5D3V
Flipkart,,Sarah Denim Print Hair Clip(Multicolor),,Sarah,http://dl.flipkart.com/dl/sarah-denim-print-hair-clip/p/itmehdqchbhfdch2?pid=HACEHDQCYFWGKRYF&affid=siddarthk,http://img.fkcdn.com/image/hair-accessory/r/y/f/jha10109cl-1-sarah-denim-print-200x200-imaehdhttsfxuhky.jpeg,Health and Beauty>Hair Care>Hair Care Accessories>Hair Accessories,345.0,345.0,345.0,true,HACEHDQCYFWGKRYF,HACEHDQCYFWGKRYF
Flipkart,,BGS Diva Elastics Head Band(Multicolor),,BGS,http://dl.flipkart.com/dl/bgs-diva-elastics-head-band/p/itmeeddkqefzfdfy?pid=HACEEDDKFVG8678X&affid=siddarthk,http://img.fkcdn.com/image/hair-accessory/7/8/x/hb-339-1-bgs-diva-elastics-200x200-imaeebgvt3uwyyta.jpeg,Health and Beauty>Hair Care>Hair Care Accessories>Hair Accessories,299.0,149.0,149.0,false,HACEEDDKFVG8678X,HACEEDDKFVG8678X
Flipkart,,Sarah Plain Pink Fabric Hair Rubber Band for Women Rubber Band(Pink),"Sarah Pink Fabric Hair Rubber Band for Women for Everyday wear. Whether you need Hair Clutcher- Hair Claw Clip to keep your hairstyle in place, or you want to add a pop of cute colour to your look, our range of clips and grips will style your hair with simplicity.",Sarah,http://dl.flipkart.com/dl/sarah-plain-pink-fabric-hair-rubber-band-women/p/itmee3rqqpmjawg7?pid=HACEE3RQTGEUYYMC&affid=siddarthk,http://img.fkcdn.com/image/hair-accessory/y/m/c/ha10478rb-1-sarah-plain-pink-fabric-hair-rubber-band-for-women-200x200-imaeebc2sgzu4vne.jpeg,Health and Beauty>Hair Care>Hair Care Accessories>Hair Accessories,275.0,275.0,275.0,true,HACEE3RQTGEUYYMC,HACEE3RQTGEUYYMC
Flipkart,,BGS Diva Elastics Head Band(Multicolor),,BGS,http://dl.flipkart.com/dl/bgs-diva-elastics-head-band/p/itmeeddkxrdxd8gk?pid=HACEEDDK2Y2YVQBZ&affid=siddarthk,http://img.fkcdn.com/image/hair-accessory/q/b/z/hb-347-1-bgs-diva-elastics-200x200-imaeebgvhppkegue.jpeg,Health and Beauty>Hair Care>Hair Care Accessories>Hair Accessories,299.0,149.0,149.0,false,HACEEDDK2Y2YVQBZ,HACEEDDK2Y2YVQBZ
Flipkart,,"Sarah Set of 3 Rubber Band for Women - Red, Grey & Pink Head Band(Red)","Sarah Red, Grey & Pink Fabric Rubber Band for Women for Everyday wear. Whether you need Hair Clutcher- Hair Claw Clip to keep your hairstyle in place, or you want to add a pop of cute colour to your look, our range of clips and grips will style your hair with simplicity.",Sarah,http://dl.flipkart.com/dl/sarah-set-3-rubber-band-women-red-grey-pink-head/p/itmee3rqrg2hwr9q?pid=HACEE3RQH3TSGA7Q&affid=siddarthk,http://img.fkcdn.com/image/hair-accessory/a/7/q/ha10950rb-1-sarah-head-band-set-of-3-rubber-band-for-women-red-200x200-imaee3g6dzgpkyt9.jpeg,Health and Beauty>Hair Care>Hair Care Accessories>Hair Accessories,345.0,345.0,345.0,true,HACEE3RQH3TSGA7Q,HACEE3RQH3TSGA7Q
Flipkart,,BGS Diva Elastics Head Band(Multicolor),,BGS,http://dl.flipkart.com/dl/bgs-diva-elastics-head-band/p/itmeeddkezxb4muz?pid=HACEEDDKCZ5YC4NJ&affid=siddarthk,http://img.fkcdn.com/image/hair-accessory/4/n/j/hb-333-1-bgs-diva-elastics-200x200-imaeebgvpq9pwgbj.jpeg,Health and Beauty>Hair Care>Hair Care Accessories>Hair Accessories,599.0,299.0,299.0,true,HACEEDDKCZ5YC4NJ,HACEEDDKCZ5YC4NJ
Flipkart,,BGS Diva Elastics Hair Claw(Multicolor),,BGS,http://dl.flipkart.com/dl/bgs-diva-elastics-hair-claw/p/itmeeddkzwbsrruh?pid=HACEEDDKUNJKF3YQ&affid=siddarthk,http://img.fkcdn.com/image/hair-accessory/3/y/q/cl-330-1-bgs-diva-elastics-200x200-imaeebgv7zqj2vrz.jpeg,Health and Beauty>Hair Care>Hair Care Accessories>Hair Accessories,399.0,199.0,199.0,true,HACEEDDKUNJKF3YQ,HACEEDDKUNJKF3YQ
Flipkart,,Sarah Plastic Hair Clutcher for Women - Pink Hair Clip(Pink),"Sarah Pink Plastic Hair Clutcher for Women for Everyday wear. Whether you need Hair Clutcher- Hair Claw Clip to keep your hairstyle in place, or you want to add a pop of cute colour to your look, our range of clips and grips will style your hair with simplicity.",Sarah,http://dl.flipkart.com/dl/sarah-plastic-hair-clutcher-women-pink-clip/p/itmee3rqfgqdzssp?pid=HACEE3RQRHYYEJHB&affid=siddarthk,http://img.fkcdn.com/image/hair-accessory/j/h/b/ha10894cl-1-sarah-hair-clip-plastic-hair-clutcher-for-women-pink-200x200-imaee3g7jnvrvhaq.jpeg,Health and Beauty>Hair Care>Hair Care Accessories>Hair Accessories,285.0,285.0,285.0,true,HACEE3RQRHYYEJHB,HACEE3RQRHYYEJHB
Flipkart,,Sarah Set of Three Abstract Printed Hair Clip(Multicolor),,Sarah,http://dl.flipkart.com/dl/sarah-set-three-abstract-printed-hair-clip/p/itmehdqczxn7ud85?pid=HACEHDQCTCWUCKGH&affid=siddarthk,http://img.fkcdn.com/image/hair-accessory/k/g/h/jha10130cl-3-sarah-set-of-three-abstract-printed-200x200-imaehdhtsh9y7hc9.jpeg,Health and Beauty>Hair Care>Hair Care Accessories>Hair Accessories,875.0,875.0,875.0,true,HACEHDQCTCWUCKGH,HACEHDQCTCWUCKGH
Flipkart,,BGS Diva Elastics Hair Clip(Multicolor),,BGS,http://dl.flipkart.com/dl/bgs-diva-elastics-hair-clip/p/itmeeddkdqgyhcgu?pid=HACEEDDKYUJDWATH&affid=siddarthk,http://img.fkcdn.com/image/hair-accessory/a/t/h/sc-315-2-bgs-diva-elastics-200x200-imaeebgvf2fjagbr.jpeg,Health and Beauty>Hair Care>Hair Care Accessories>Hair Accessories,699.0,349.0,349.0,true,HACEEDDKYUJDWATH,HACEEDDKYUJDWATH
Flipkart,,Sarah Geometric Print Hair Clip(Multicolor),,Sarah,http://dl.flipkart.com/dl/sarah-geometric-print-hair-clip/p/itmehdqcbzfgh5f7?pid=HACEHDQCXQAKYB5M&affid=siddarthk,http://img.fkcdn.com/image/hair-accessory/b/5/m/jha10083cl-1-sarah-geometric-print-200x200-imaehdhtt4vphmtv.jpeg,Health and Beauty>Hair Care>Hair Care Accessories>Hair Accessories,345.0,345.0,345.0,true,HACEHDQCXQAKYB5M,HACEHDQCXQAKYB5M
Flipkart,,"Sarah Set of 3 Rubber Band for Women - Grey, Black & Blue Head Band(Grey)","Sarah Grey, Black & Blue Fabric Rubber Band for Women for Everyday wear. Whether you need Hair Clutcher- Hair Claw Clip to keep your hairstyle in place, or you want to add a pop of cute colour to your look, our range of clips and grips will style your hair with simplicity.",Sarah,http://dl.flipkart.com/dl/sarah-set-3-rubber-band-women-grey-black-blue-head/p/itmee3rqxxuus2hp?pid=HACEE3RQGUZM6HUH&affid=siddarthk,http://img.fkcdn.com/image/hair-accessory/h/u/h/ha10951rb-1-sarah-head-band-set-of-3-rubber-band-for-women-grey-original-imaee3g6x3fygaeh.jpeg,Health and Beauty>Hair Care>Hair Care Accessories>Hair Accessories,345.0,345.0,345.0,true,HACEE3RQGUZM6HUH,HACEE3RQGUZM6HUH
Flipkart,,BGS Diva Elastics Head Band(Multicolor),,BGS,http://dl.flipkart.com/dl/bgs-diva-elastics-head-band/p/itmeeddk6ezw9gc5?pid=HACEEDDKFEDSFENK&affid=siddarthk,http://img.fkcdn.com/image/hair-accessory/e/n/k/hb-315-1-bgs-diva-elastics-200x200-imaeebgvfezvhfgh.jpeg,Health and Beauty>Hair Care>Hair Care Accessories>Hair Accessories,499.0,249.0,249.0,true,HACEEDDKFEDSFENK,HACEEDDKFEDSFENK
Flipkart,,Taj Pearl Designer Hair Clip(Gold),,Taj Pearl,http://dl.flipkart.com/dl/taj-pearl-designer-hair-clip/p/itmeh4ywsayrv4x5?pid=HACEH4YWZUQXVFAB&affid=siddarthk,http://img.fkcdn.com/image/hair-accessory/f/a/b/hr-283-1-taj-pearl-designer-200x200-imaeh4xfzumagqjs.jpeg,Health and Beauty>Hair Care>Hair Care Accessories>Hair Accessories,1000.0,599.0,599.0,true,HACEH4YWZUQXVFAB,HACEH4YWZUQXVFAB
Flipkart,,BGS Diva Elastics Hair Clip(Multicolor),,BGS,http://dl.flipkart.com/dl/bgs-diva-elastics-hair-clip/p/itmeeddkbfn3wzhp?pid=HACEEDDKYGGGVJZP&affid=siddarthk,http://img.fkcdn.com/image/hair-accessory/j/z/p/sc-316-2-bgs-diva-elastics-200x200-imaeebgwytqhgfmy.jpeg,Health and Beauty>Hair Care>Hair Care Accessories>Hair Accessories,699.0,349.0,349.0,true,HACEEDDKYGGGVJZP,HACEEDDKYGGGVJZP
Flipkart,,Best & Lowest Stylish Tik Tak Hair Pins - Set Of 6 Multicolor Peers Tic Tac Clip(Multicolor),TikTak pins are good to fix your hairs with style. In this package you will get 6 peers of different colors for you and your princess.,Best & Lowest,http://dl.flipkart.com/dl/best-lowest-stylish-tik-tak-hair-pins-set-6-multicolor-peers-tic-tac-clip/p/itmefrhwgjz6azkb?pid=HACEFRHWEWAXG5AZ&affid=siddarthk,http://img.fkcdn.com/image/hair-accessory/5/a/z/bnl007-6-best-lowest-stylish-tik-tak-hair-pins-set-of-6-200x200-imaefqkrykhzxxyn.jpeg,Health and Beauty>Hair Care>Hair Care Accessories>Hair Accessories,249.0,199.0,199.0,true,HACEFRHWEWAXG5AZ,HACEFRHWEWAXG5AZ
Flipkart,,DCS Elastic woolen Pink Rubber Band(Pink),Your Love of Hair just got fonder with this Woolen Charming Delight Hair Band. It Is Made Of Pure Wool And Elastic. It is a combination of exquisite colored hair bands,DCS,http://dl.flipkart.com/dl/dcs-elastic-woolen-pink-rubber-band/p/itmecndxgf5uey5v?pid=HACECNDXDGZZMPKT&affid=siddarthk,http://img.fkcdn.com/image/hair-accessory/p/k/t/5448-1-dcs-rubber-band-elastic-woolen-pink-200x200-imaecm7dsgwk5kxg.jpeg,Health and Beauty>Hair Care>Hair Care Accessories>Hair Accessories,155.0,110.0,110.0,true,HACECNDXDGZZMPKT,HACECNDXDGZZMPKT
Flipkart,,Swan Creation fancy diamond amboda clip Hair Clip(Black),,Swan Creation,http://dl.flipkart.com/dl/swan-creation-fancy-diamond-amboda-clip-hair/p/itmemwqdqr2pzdhv?pid=HACEMWQDPCYNCUXH&affid=siddarthk,http://img.fkcdn.com/image/hair-accessory/u/x/h/dac-01-2-swancreation-fancy-diamond-amboda-clip-200x200-imaemwhk7zcxzdz4.jpeg,Health and Beauty>Hair Care>Hair Care Accessories>Hair Accessories,200.0,200.0,200.0,true,HACEMWQDPCYNCUXH,HACEMWQDPCYNCUXH
Flipkart,,NeedyBee Satin Rosette for Babies and Little Princess Head Band(Black),"Fabric : Elastic | SatinBand Measures: 12"" (circumference/ unstretched)Recommended Age: Infant to 4 yearsColor: Black",NeedyBee,http://dl.flipkart.com/dl/needybee-satin-rosette-babies-little-princess-head-band/p/itme2zrtnskgxf9v?pid=HACE2ZRTVYUD7YPR&affid=siddarthk,http://img.fkcdn.com/image/hair-accessory/y/p/r/nsa84bk-1-needybee-head-band-satin-rosette-for-babies-and-little-200x200-imae2zgjsrhwbk4s.jpeg,Health and Beauty>Hair Care>Hair Care Accessories>Hair Accessories,181.0,181.0,181.0,false,HACE2ZRTVYUD7YPR,HACE2ZRTVYUD7YPR
Flipkart,,NeedyBee Newborn Rosette Bow for Girls Head Band(Pink),NeedyBee NewBorn Rosette Bow Headband will surely make your little one cute.This headband is perfect for newborns and little babies. It is so light and delicately beautiful. Features a single bow made with rose rosettes material and comes adorned to a matching headband.One size fits newborn to toddlers,NeedyBee,http://dl.flipkart.com/dl/needybee-newborn-rosette-bow-girls-head-band/p/itme2xfnr7juzwph?pid=HACE2XFNSGGHBHJZ&affid=siddarthk,http://img.fkcdn.com/image/hair-accessory/t/c/g/clp01-1-av-shop-head-band-newborn-rosette-light-pink-bow-200x200-imae2x3kyn26vvyx.jpeg,Health and Beauty>Hair Care>Hair Care Accessories>Hair Accessories,182.0,182.0,182.0,false,HACE2XFNSGGHBHJZ,HACE2XFNSGGHBHJZ
Flipkart,,NeedyBee Newborn Flower Bunch Kids Baby Headband and Barefoot Sandal Hair Accessory Set(Multicolor),"A perfect matching head to toe accessory combo. Matching Headband that will fit your baby till 4 years with Matching barefoot sandals that can be worn as is or over socks or shoe to accessories and give a funky look.Super cute and comfy infant barefoot sandals!Made with soft pink elastic, and a ight grey and pink shabby chic rosette with rhinestones; these little sandals will make a great summer accessory!Bare foot sandals can be made to fit babies newborn to 24 months!Dimension: Headband- circumference 15"", Barefoot sandal circumference 5"" (unstreched) and One Flower Size: 2.5"" * 2.5""Material: Georgette, Elastic, Pearl And CrystalRecommended Age: Newborn to 2 YearsColor: Sales Package: 2 Barefoot Sandal and 1 HeadbandWeight: 14 gms",NeedyBee,http://dl.flipkart.com/dl/needybee-newborn-flower-bunch-kids-baby-headband-barefoot-sandal-hair-accessory-set/p/itme9yd9rqq3hfky?pid=HACE9YD9TAP8EKDV&affid=siddarthk,http://img.fkcdn.com/image/hair-accessory/k/d/v/combo22yewh-3-needybee-hair-accessory-set-newborn-flower-bunch-200x200-imae9xkscmakmcgy.jpeg,Health and Beauty>Hair Care>Hair Care Accessories>Hair Accessories,532.0,532.0,532.0,true,HACE9YD9TAP8EKDV,HACE9YD9TAP8EKDV
Flipkart,,ToniQ Floral Mania Hair Clip(Multicolor),"Give your strands a ‘lil petal power with this bulldog clip, designed with colourful floral prints.",ToniQ,http://dl.flipkart.com/dl/toniq-floral-mania-hair-clip/p/itmemxbcxg5zewwz?pid=HACEMXBBXGVUGSUT&affid=siddarthk,http://img.fkcdn.com/image/hair-accessory/s/u/t/oaw16hr63-e-1-toniq-floral-mania-200x200-imaemx8ccawgavsd.jpeg,Health and Beauty>Hair Care>Hair Care Accessories>Hair Accessories,500.0,250.0,250.0,true,HACEMXBBXGVUGSUT,HACEMXBBXGVUGSUT
Flipkart,,Swan Creation Fancy Diamond Ball Pin Bun Stick(Multicolor),,Swan Creation,http://dl.flipkart.com/dl/swan-creation-fancy-diamond-ball-pin-bun-stick/p/itmemwqdbehfxzk2?pid=HACEMWQDTQGYPZZ6&affid=siddarthk,http://img.fkcdn.com/image/hair-accessory/z/z/6/dbp-01-12-swancreation-fancy-diamond-ball-pin-200x200-imaemwkup8n69ep3.jpeg,Health and Beauty>Hair Care>Hair Care Accessories>Hair Accessories,350.0,235.0,235.0,true,HACEMWQDTQGYPZZ6,HACEMWQDTQGYPZZ6
Flipkart,,"NeedyBee Soft Elastic Head Band(Beige, Cream)",NeedyBee Beige soft elastic headband with bow is brightly coloured and seems as if the shade of beige meadows has come alive on your girl's head. This soft and stretchy beige/cream coloured headband with a bow is made of grosgrain ribbon and heat sealed to prevent fraying.,NeedyBee,http://dl.flipkart.com/dl/needybee-soft-elastic-head-band/p/itmdwnv3rmwepvwc?pid=HACDWNV35DB8TUNG&affid=siddarthk,http://img.fkcdn.com/image/hair-accessory/u/n/g/nha193be-1-needybee-head-band-soft-elastic-200x200-imadvr8sgnhu5bbf.jpeg,Health and Beauty>Hair Care>Hair Care Accessories>Hair Accessories,140.0,140.0,140.0,false,HACDWNV35DB8TUNG,HACDWNV35DB8TUNG
Flipkart,,NeedyBee Toddlers Elastic Toe Blooms Barefoot Sandals and Rosset Headband Set Hair Accessory Set(Pink),"NeedyBee Fuchsia Pink Toe Blooms Newborn and Toddlers Barefoot Sandals and Headband SetDimension: Headband- circumference 14"", Barefoot Sandal circumference 6"" (unstreched) and One Flower Size: 3.5"" * 3.5""Material: Satin, Net and ElasticRecommended Age: Newborn to 2 YearsColor: Fuchsia PinkSales Package: 2 Barefoot Sandal and 1 HeadbandWeight: 22 gms",NeedyBee,http://dl.flipkart.com/dl/needybee-toddlers-elastic-toe-blooms-barefoot-sandals-rosset-headband-set-hair-accessory/p/itme9yd9udmd2gy4?pid=HACE9YD9BPHHF5YS&affid=siddarthk,http://img.fkcdn.com/image/hair-accessory/5/y/s/combo37fp-3-needybee-hair-accessory-set-toddlers-elastic-toe-200x200-imae9xkssxqkrtdc.jpeg,Health and Beauty>Hair Care>Hair Care Accessories>Hair Accessories,506.0,506.0,506.0,true,HACE9YD9BPHHF5YS,HACE9YD9BPHHF5YS
Flipkart,,NeedyBee Butterfly Hair Clip(Red),Needy Bee Butterfly Clip,NeedyBee,http://dl.flipkart.com/dl/needybee-butterfly-hair-clip/p/itme2xfmdfm7hqdy?pid=HACE2XFMSA4S4YWS&affid=siddarthk,http://img.fkcdn.com/image/hair-accessory/y/w/s/nha07re-1-needybee-hair-clip-butterfly-200x200-imae2x3kuw5uxzcs.jpeg,Health and Beauty>Hair Care>Hair Care Accessories>Hair Accessories,350.0,350.0,350.0,true,HACE2XFMSA4S4YWS,HACE2XFMSA4S4YWS
Flipkart,,NeedyBee Newborn Pink Heart diamond rossette Flower Baby Glitter Elastic Head Band(Pink),"Newborn Pink Heart Glitter Diamond Rossette Flower Baby Elastic HeadbandDimension: Band Circumference: 15""; Heart: 4""x4""Material: Chiffon and ElasticRecommended Age: Newborn to 4 YearsColor: PinkSales Package: 1 HeadbandWeight: 2 gms",NeedyBee,http://dl.flipkart.com/dl/needybee-newborn-pink-heart-diamond-rossette-flower-baby-glitter-elastic-head-band/p/itme9wkwwyzupvvt?pid=HACE9WKWJTYNSQ6D&affid=siddarthk,http://img.fkcdn.com/image/hair-accessory/q/6/d/nsa298pi-1-needybee-head-band-newborn-pink-heart-diamond-200x200-imae9yh8frwv6c3b.jpeg,Health and Beauty>Hair Care>Hair Care Accessories>Hair Accessories,350.0,350.0,350.0,false,HACE9WKWJTYNSQ6D,HACE9WKWJTYNSQ6D
Flipkart,,NeedyBee Big Bow Hair Clip(Pink),NeedyBee Pink Big Bow clip,NeedyBee,http://dl.flipkart.com/dl/needybee-big-bow-hair-clip/p/itme2xfmjxgjn9gr?pid=HACE2XFMHPYGAU5Q&affid=siddarthk,http://img.fkcdn.com/image/hair-accessory/u/5/q/nha299pi-1-needybee-hair-clip-big-bow-200x200-imae2x3k4ygst6ss.jpeg,Health and Beauty>Hair Care>Hair Care Accessories>Hair Accessories,170.0,170.0,170.0,true,HACE2XFMHPYGAU5Q,HACE2XFMHPYGAU5Q
Flipkart,,NeedyBee Soft Elastic Head Band(Silver),NeedyBee Silver soft elastic headband with bow is brightly coloured and seems as if the colour of lush green meadows has come alive on your girl's head. This soft and stretchy neon green coloured headband with a bow is made of grosgrain ribbon and heat sealed to prevent fraying.,NeedyBee,http://dl.flipkart.com/dl/needybee-soft-elastic-head-band/p/itmdwnv3aeaskz6f?pid=HACDWNV3RZC5C67J&affid=siddarthk,http://img.fkcdn.com/image/hair-accessory/6/7/j/nha193si-1-needybee-head-band-soft-elastic-200x200-imadvr8sgnzmgj9d.jpeg,Health and Beauty>Hair Care>Hair Care Accessories>Hair Accessories,140.0,140.0,140.0,true,HACDWNV3RZC5C67J,HACDWNV3RZC5C67J
Flipkart,,NeedyBee NewBorn Infants Ivory Satin Flower Soft Elastic Baby Head Band(Beige),"Ivory NewBorn Soft Elastic Headband with Satin FlowerDimension:Band Circumference -11""Flower size:3.5""x3.5""Material:Grosgrain ribbon and crochet elasticRecommended Age: Newborn to 3 YearsColor:BeigeSales Package: 1 HeadbandWeight: 14gms",NeedyBee,http://dl.flipkart.com/dl/needybee-newborn-infants-ivory-satin-flower-soft-elastic-baby-head-band/p/itme7m5fbmx6pymw?pid=HACE7M5FTBTGEMDF&affid=siddarthk,http://img.fkcdn.com/image/hair-accessory/m/d/f/nha272be-1-needybee-head-band-newborn-infants-ivory-satin-flower-200x200-imae7ky27cp6hhje.jpeg,Health and Beauty>Hair Care>Hair Care Accessories>Hair Accessories,225.0,225.0,225.0,true,HACE7M5FTBTGEMDF,HACE7M5FTBTGEMDF
Flipkart,,NeedyBee Gerberra Flower Hair Clip(Purple),"Gerberra Clip with Alligator Clip on Back. Beautiful Flower Look with Rhinestone CenterFabric : GrosgrainDimension - 4"" X4""Clip Style : Alligator ClipColor: PurpleRecommended Age - 3 years onwardsPlease note that the actual color may vary slightly from the picture",NeedyBee,http://dl.flipkart.com/dl/needybee-gerberra-flower-hair-clip/p/itme2zrun9he3bts?pid=HACE2ZRU3HQDYHKC&affid=siddarthk,http://img.fkcdn.com/image/hair-accessory/h/k/c/nsa137pu-1-needybee-hair-clip-gerberra-flower-200x200-imae2zgjeqegqxn5.jpeg,Health and Beauty>Hair Care>Hair Care Accessories>Hair Accessories,150.0,150.0,150.0,false,HACE2ZRU3HQDYHKC,HACE2ZRU3HQDYHKC
Flipkart,,NeedyBee Gota Patti Ethnic Bootie for Babies and Little Girls Head Band(Green),Buy online Green Ethnic Bootie Headband for Babies and Little Girls by NeedyBeeRecommended Age: 0-5 yearsElastic Headband with a fancy Zardozi and Rhinestone Bootie.,NeedyBee,http://dl.flipkart.com/dl/needybee-gota-patti-ethnic-bootie-babies-little-girls-head-band/p/itme2zruhbzbqzbu?pid=HACE2ZRTMHE4UUSZ&affid=siddarthk,http://img.fkcdn.com/image/hair-accessory/u/s/z/nsa211-1-needybee-head-band-gota-patti-ethnic-bootie-for-babies-200x200-imae2zgkzpgg5fak.jpeg,Health and Beauty>Hair Care>Hair Care Accessories>Hair Accessories,140.0,140.0,140.0,false,HACE2ZRTMHE4UUSZ,HACE2ZRTMHE4UUSZ
Flipkart,,NeedyBee Baby Girls Elastic Embellished with Diamond Pearl Flowers Head Band(Beige),Size: Flower about 9cm; Headband: about 36cm(0.59*14.17 inch elastic)Age: Newborn to 4 yearsColor: Peach Baby Girls Elastic Headband Embellished with Diamond Pearl Flowers by NeedyBee,NeedyBee,http://dl.flipkart.com/dl/needybee-baby-girls-elastic-embellished-diamond-pearl-flowers-head-band/p/itme2zruwjh3vxgy?pid=HACE2ZRUBSKRYDPY&affid=siddarthk,http://img.fkcdn.com/image/hair-accessory/d/p/y/nsa167pe-1-needybee-head-band-baby-girls-elastic-embellished-200x200-imae2zgjydhwzhjc.jpeg,Health and Beauty>Hair Care>Hair Care Accessories>Hair Accessories,225.0,225.0,225.0,false,HACE2ZRUBSKRYDPY,HACE2ZRUBSKRYDPY
Flipkart,,NeedyBee Shiny Lace for Newborn and Baby Girls Head Band(White),All of our designs are a one of a kind with your princess in mind. Your goodies will be wrapped in tissue paper and shipped right to your front door. Each ribbon used has been heat sealed to prevent fraying.We use the best materials.,NeedyBee,http://dl.flipkart.com/dl/needybee-shiny-lace-newborn-baby-girls-head-band/p/itme2zrtyyp7fz69?pid=HACE2ZRTDNGKYYEG&affid=siddarthk,http://img.fkcdn.com/image/hair-accessory/y/e/g/nsa82-1-needybee-head-band-shiny-lace-for-newborn-and-baby-girls-200x200-imae2zgkydzzaghn.jpeg,Health and Beauty>Hair Care>Hair Care Accessories>Hair Accessories,150.0,150.0,150.0,false,HACE2ZRTDNGKYYEG,HACE2ZRTDNGKYYEG
Flipkart,,NeedyBee Baby Bow Head Band(Red),NeedyBee NewBorn Rosette Bow Headband will surely make your little one cute.This headband is perfect for newborns and little babies. It is so light and delicately beautiful. Features a single bow made with rose rosettes material and comes adorned to a matching headband.One size fits newborn to toddlers,NeedyBee,http://dl.flipkart.com/dl/needybee-baby-bow-head-band/p/itme2zrthfb6cdpm?pid=HACE2ZRTECARD8XP&affid=siddarthk,http://img.fkcdn.com/image/hair-accessory/8/x/p/nha01re-1-needybee-head-band-baby-bow-200x200-imae2zbx75dahhc7.jpeg,Health and Beauty>Hair Care>Hair Care Accessories>Hair Accessories,182.0,182.0,182.0,false,HACE2ZRTECARD8XP,HACE2ZRTECARD8XP
Flipkart,,NeedyBee Soft Lace with A Center Bow with Roses Embellishment Head Band(Pink),Elastic LaceKeeps hair in place without pullingSpot clean; ImportedColor: PinkStyle: BowRecommended Age: 0-5 years (Free Size),NeedyBee,http://dl.flipkart.com/dl/needybee-soft-lace-center-bow-roses-embellishment-head-band/p/itme2zrupnkspjax?pid=HACE2ZRUZSMNGC5F&affid=siddarthk,http://img.fkcdn.com/image/hair-accessory/c/5/f/nsa224pi-1-needybee-head-band-soft-lace-with-a-center-bow-with-200x200-imae2zgkhyrahhpj.jpeg,Health and Beauty>Hair Care>Hair Care Accessories>Hair Accessories,225.0,225.0,225.0,false,HACE2ZRUZSMNGC5F,HACE2ZRUZSMNGC5F
