PartnerName,Id,Title,Description,Brand,Link,ImageLink,CategoryName,Mrp,OfferPrice,EffectivePrice,Availability,PartnerIdFromUrl,PartnerIdFromDb
Flipkart,,Nike 5th Element EDT  -  150 ml(For Men),"Nike presents 5th Element Eau de Toilette which invigorates your senses while complementing the subtlety, calm authority and understated elegance of your personality.  Top Note A spicy note of cardamom, pepper and caraway on the top lends an aura of mystery to this fragrance that is captivating.  Heart Note The floral heart note of sage, Spanish labdanum and iris adds character and definition to this masculine fragrance.  Base Note An earthy base note of sandalwood, guaiac and cedar with a touch of vanilla adds another dimension to this fragrance.",Nike,http://dl.flipkart.com/dl/nike-5th-element-edt-150-ml/p/itmdtczthejqpfzj?pid=PERD8AYKHPGRVAFH&affid=siddarthk,http://img.fkcdn.com/image/perfume/a/f/h/eau-de-toilette-men-nike-150-5th-element-200x200-imad86uuxpxhctyf.jpeg,Health and Beauty>Fragrances>Perfumes>Eaux De Toilette,1100.0,828.0,828.0,true,PERD8AYKHPGRVAFH,PERD8AYKHPGRVAFH
Flipkart,,"Fog Scent Make My Day Perfume 90 Ml For Women Eau de Parfum  -  90 ml(For Girls, Women)",,Fog,http://dl.flipkart.com/dl/fog-scent-make-my-day-perfume-90-ml-women-eau-de-parfum/p/itmef3fmdr52gfkp?pid=PEREF3FMCAZBZJXM&affid=siddarthk,http://img.fkcdn.com/image/perfume/a/j/x/eau-de-parfum-fogg-100-scent-make-my-day-original-imaeeyn5gxvuj9x5.jpeg,Health and Beauty>Fragrances>Perfumes>Eaux De Parfum,499.0,495.0,495.0,true,PEREF3FMCAZBZJXM,PEREF3FMCAZBZJXM
Flipkart,,FCUK Summer EDT  -  100 ml(For Men),"FCUK Summer Him?by?FCUK?is a Woody Aromatic fragrance for men.?FCUK Summer Him?was launched in 2011. Top notes are bergamot, sea water and nutmeg; middle notes are seaweed, sage, papyrus and lavender; base notes are woodsy notes, teak wood, musk and amber.",FCUK,http://dl.flipkart.com/dl/fcuk-summer-edt-100-ml/p/itmdu5sbeyweby2u?pid=PERDU5SBEYWEBY2U&affid=siddarthk,http://img.fkcdn.com/image/perfume/y/2/u/eau-de-toilette-fcuk-100-summer-200x200-imadu6wz3jfyg6ej.jpeg,Health and Beauty>Fragrances>Perfumes>Eaux De Toilette,3750.0,1500.0,1500.0,false,PERDU5SBEYWEBY2U,PERDU5SBEYWEBY2U
Flipkart,,Bvlgari Extreme EDC  -  100 ml(For Men),"His designer shirt is as flawless as his profile as he shrugs into his dinner jacket and offers his arm to the lady. As he leads her into the restaurant, the power of his luxury fragrance sweeps through her reiterating the effect of his personality and charm on her. The fragrance connoisseurs at Bvlgari designed Extreme to complement the man he is, the potency of his dashing good looks. Heads turn as he strides in and the Eau de Toilette precedes him, announcing his arrival. The deep woody notes of the perfume accentuate the slight ruggedness of his personality blurring the line between handsome and feral. The creator of Bvlgari Extreme plays with the crisp, cool notes to present you with a fragrance the enamours the senses. Warring accords of spicy coriander, herbaceous lavender, galbanum, light tea, juicy grapefruit, neroli, petit grain and zesty bergamot incite the opening notes into dancing flames. The pure heart notes secrete the accords of spice with nutmeg, pepper and cardamom. A slight woodiness colors the heart in the presence of the balsam fir, brazilian rosewood and guaiac wood. As the dry down fades away from your person, accords of iris, sandalwood, oakmoss, cedar and powdery musk make their presence felt, softening the bite of the fragrance. Presented elegantly in a rectangular flacon with simple lines dedicated to minimalism, the slight smoky grey of the fragrance is reflected in the dark depths of his unspeaking eyes. The silver stopper lends elegance, a touch of class to the fragrance. Dance with the devil and live dangerously with Bvlgari Extreme, the fragrance of a man who owns the game.  ",Bvlgari,http://dl.flipkart.com/dl/bvlgari-extreme-edc-100-ml/p/itme3z3hwqzfhf69?pid=PERD8AYGZWQZCQHF&affid=siddarthk,http://img.fkcdn.com/image/perfume/q/h/f/eau-de-toilette-men-bvlgari-100-extreme-200x200-imad86v8kka37jhq.jpeg,Health and Beauty>Fragrances>Perfumes>Eaux De Cologne,4400.0,3000.0,3000.0,true,PERD8AYGZWQZCQHF,PERD8AYGZWQZCQHF
Flipkart,,"Rasasi Sahar EDP  -  18 ml(For Men, Women)","Sahar by Rasasi is a finely blended floral woody musk fragrance for women and men. The top notes flow with an oriental and floral theme that is followed by woody, spicy, ambery and rose notes. The fragrance winds up with a balsamic, musky and animalic aroma that stays on for a very long time. Sahar is an enchanting and wonderfully smooth, warm and soft fragrance in concentrated perfume oil form. This exquisite perfume is presented in a solid metal bottle, decorated with feroza crystals and intricate design elements.",Rasasi,http://dl.flipkart.com/dl/rasasi-sahar-edp-18-ml/p/itme3ytghrcrm7vd?pid=PERE3YTGZBJJGSTC&affid=siddarthk,http://img.fkcdn.com/image/perfume/s/t/c/parfum-rasasi-18-sahar-200x200-imae2zxja3zmkzvd.jpeg,Health and Beauty>Fragrances>Perfumes>Eaux De Parfum,1995.0,1495.0,1495.0,false,PERE3YTGZBJJGSTC,PERE3YTGZBJJGSTC
Flipkart,,Christian Dior Fahrenheit By Christian EDT  -  100 ml(For Men),"For the 21st birthday of the Fahrenheit fragrance, Dior introduces its heir - Fahrenheit Absolute, more intensive and darker that the original. The composition is stronger and more powerful, with the intensified popular aromas of the original. The violet aroma is extremely emphasized, blended with noble aromas of myrrh, incense and Aaoud.",Christian Dior,http://dl.flipkart.com/dl/christian-dior-fahrenheit-edt-100-ml/p/itmdtauczff9r8wk?pid=PERDKWCBSPHQSSF8&affid=siddarthk,http://img.fkcdn.com/image/perfume/b/k/a/eau-de-toilette-men-christian-dior-100-fahrenheit-200x200-imadkwhrxqgrpjdg.jpeg,Health and Beauty>Fragrances>Perfumes>Eaux De Toilette,8000.0,6100.0,6100.0,true,PERDKWCBSPHQSSF8,PERDKWCBSPHQSSF8
Flipkart,,Nike Casual EDT  -  75 ml(For Women),"Getting you high with every whiff, Nike's Casual EDT is a fragrance that tingles through your senses and leaves you at awe. Sail through summer with ease and poise with this fragrance that is enriched with feminine oriental notes. Celebrate each day by dabbing this perfume that is extremely opulent and fresh. Energize your senses and take on a new day with the right fervour with this fragrance. Reveal your irresistible charm by wearing this perfume that conveys your charisma to the world.",Nike,http://dl.flipkart.com/dl/nike-casual-edt-75-ml/p/itmdthjej8pbavy5?pid=PERD8AYKASKDDYCK&affid=siddarthk,http://img.fkcdn.com/image/perfume/y/c/k/eau-de-toilette-nike-75-casual-200x200-imadu5p5zpgjfzcf.jpeg,Health and Beauty>Fragrances>Perfumes>Eaux De Toilette,699.0,580.0,580.0,true,PERD8AYKASKDDYCK,PERD8AYKASKDDYCK
Flipkart,,Victoria's Secret Live Pink Vanilla Sky EDP  -  100 ml(For Women),"A Seductive mix of fragrant Moroccan orange flower, Italian orris, and Madagascar vanilla, this parfum from Victoria's Secret is a keeper. Spritzing on a few drops of the parfum onto your body after a bath will allow it to diffuse from the body, thus allowing it to leave a scintillating scent. Clean and Fresh Victoria's Secret Live Pink Vanilla Sky parfum for women makes use of ingredients that have an invigorating and clean smell. The fresh scent will linger, thus helping you stay rejuvenated all through the day.    For Long Lasting Fragrance Spraying on the perfume when the skin is hydrated i.e. just after a bath allows it to fully absorb the scent. To maximize the aroma, it is also wise to apply petroleum jelly onto your pulse points before spraying on the perfume. ",Victoria's Secret,http://dl.flipkart.com/dl/victoria-s-secret-live-pink-vanilla-sky-edp-100-ml/p/itmdyd2zn6bhnyzh?pid=PERDYD2N3ZNHHYVZ&affid=siddarthk,http://img.fkcdn.com/image/perfume/y/v/z/eau-de-parfum-victoria-s-secret-100-live-pink-vanilla-sky-200x200-imadyg3tpvufcues.jpeg,Health and Beauty>Fragrances>Perfumes>Eaux De Parfum,2800.0,1800.0,1800.0,false,PERDYD2N3ZNHHYVZ,PERDYD2N3ZNHHYVZ
Flipkart,,Paco Rabanne Ultra Violet EDP  -  80 ml(For Women),"Paco Rabanne weaves magic with this perfume that is so bewitching and leaves the passionate woman in you in a state of ecstatic bliss. An Audacious and Sophisticated, Radiant and Sensual Fragrance Revealing the diva’s uninhibited charm and feminine beauty, Ultra Violet Eau de Parfum is audacious, sophisticated, radiant and sensual. Floral Oriental Family Take delight in this fresh and clean perfume that belongs to the floral oriental family and spreads its enigmatic aura around when worn.",Paco Rabanne,http://dl.flipkart.com/dl/paco-rabanne-ultra-violet-edp-80-ml/p/itmdthje6axxgbfz?pid=PERD9GMBQBPVK69T&affid=siddarthk,http://img.fkcdn.com/image/perfume/6/9/t/eau-de-parfum-paco-rabanne-80-ultra-violet-200x200-imadu5hw46knhvxr.jpeg,Health and Beauty>Fragrances>Perfumes>Eaux De Parfum,4950.0,2786.0,3096.0,true,PERD9GMBQBPVK69T,PERD9GMBQBPVK69T
Flipkart,,"Casela Red Means Go Eau de Toilette  -  150 ml(For Boys, Men)",,Casela,http://dl.flipkart.com/dl/casela-red-means-go-eau-de-toilette-150-ml/p/itmecccgyrufyyjh?pid=PERECCCG4EEXRS9P&affid=siddarthk,http://img.fkcdn.com/image/perfume/s/9/p/eau-de-toilette-casela-150-red-means-go-200x200-imaefpc5knydrgyg.jpeg,Health and Beauty>Fragrances>Perfumes>Eaux De Toilette,4499.0,999.0,999.0,false,PERECCCG4EEXRS9P,PERECCCG4EEXRS9P
Flipkart,,"Casela Absolute Eau de Toilette  -  100 ml(For Boys, Men)",,Casela,http://dl.flipkart.com/dl/casela-absolute-eau-de-toilette-100-ml/p/itmecccgyqh5ztwc?pid=PERECCCGARDBTFWV&affid=siddarthk,http://img.fkcdn.com/image/perfume/f/w/v/eau-de-toilette-casela-100-absolute-200x200-imaefpc5rbzm3bnd.jpeg,Health and Beauty>Fragrances>Perfumes>Eaux De Toilette,4499.0,999.0,999.0,false,PERECCCGARDBTFWV,PERECCCGARDBTFWV
Flipkart,,"Casela Limited Edition Eau de Toilette  -  90 ml(For Boys, Men)",,Casela,http://dl.flipkart.com/dl/casela-limited-eau-de-toilette-90-ml/p/itmecccgzhxz4jnm?pid=PERECCCGZDUDBZZH&affid=siddarthk,http://img.fkcdn.com/image/perfume/z/z/h/eau-de-toilette-casela-90-limited-edition-200x200-imaefpc5kdyjtyst.jpeg,Health and Beauty>Fragrances>Perfumes>Eaux De Toilette,4499.0,999.0,999.0,false,PERECCCGZDUDBZZH,PERECCCGZDUDBZZH
Flipkart,,"Casela Absolute Eau de Parfum  -  100 ml(For Boys, Men)",,Casela,http://dl.flipkart.com/dl/casela-absolute-eau-de-parfum-100-ml/p/itmecccgrbnfsdhb?pid=PERECCCGJET8QMTG&affid=siddarthk,http://img.fkcdn.com/image/perfume/b/d/x/eau-de-toilette-casela-100-rich-opulence-fragrance-61-200x200-imaefpc5zbkyzw7f.jpeg,Health and Beauty>Fragrances>Perfumes>Eaux De Parfum,4499.0,999.0,999.0,false,PERECCCGJET8QMTG,PERECCCGJET8QMTG
Flipkart,,"Red Silk Absolute Night xy Eau de Parfum  -  80 ml(For Girls, Women)",,Red Silk,http://dl.flipkart.com/dl/red-silk-absolute-night-xy-eau-de-parfum-80-ml/p/itmed7gxmcrx385v?pid=PERED7GX7TYR5ZW7&affid=siddarthk,http://img.fkcdn.com/image/perfume/3/f/h/eau-de-parfum-redcot-80-absolute-night-x-200x200-imaefpc5fgfjzyfw.jpeg,Health and Beauty>Fragrances>Perfumes>Eaux De Parfum,4499.0,999.0,999.0,false,PERED7GX7TYR5ZW7,PERED7GX7TYR5ZW7
Flipkart,,"Red Silk Classic Black Winter xy Eau de Toilette  -  100 ml(For Boys, Men)",,Red Silk,http://dl.flipkart.com/dl/red-silk-classic-black-winter-xy-eau-de-toilette-100-ml/p/itmed7gxfzrhynns?pid=PERED7GXDNJHZM6N&affid=siddarthk,http://img.fkcdn.com/image/perfume/9/h/z/eau-de-toilette-casela-100-rich-opulence-fragrance-79-200x200-imaefpc5ah4e9gyf.jpeg,Health and Beauty>Fragrances>Perfumes>Eaux De Toilette,4499.0,999.0,999.0,false,PERED7GXDNJHZM6N,PERED7GXDNJHZM6N
Flipkart,,Red Silk Red Power Hot xy Eau de Toilette  -  125 ml,,Red Silk,http://dl.flipkart.com/dl/red-silk-power-hot-xy-eau-de-toilette-125-ml/p/itmed7gxemdwxmwq?pid=PERED7GXCX8XRZAX&affid=siddarthk,http://img.fkcdn.com/image/perfume/z/a/x/eau-de-toilette-red-silk-125-red-power-hot-xy-200x200-imaefpc5mw2xf6wb.jpeg,Health and Beauty>Fragrances>Perfumes>Eaux De Toilette,4499.0,999.0,999.0,false,PERED7GXCX8XRZAX,PERED7GXCX8XRZAX
Flipkart,,"Red Silk Versense Freshness xy Eau de Toilette  -  100 ml(For Girls, Women)",,Red Silk,http://dl.flipkart.com/dl/red-silk-versense-freshness-xy-eau-de-toilette-100-ml/p/itmed7gxsqdjzhqh?pid=PERED7GXBVBDNPPK&affid=siddarthk,http://img.fkcdn.com/image/perfume/p/p/k/eau-de-toilette-red-silk-100-versense-freshness-xy-200x200-imaefpc5df42tfms.jpeg,Health and Beauty>Fragrances>Perfumes>Eaux De Toilette,4499.0,999.0,999.0,false,PERED7GXBVBDNPPK,PERED7GXBVBDNPPK
Flipkart,,"Red Silk Wessaitlaurent Winter xy Eau de Toilette  -  100 ml(For Boys, Men)",,Red Silk,http://dl.flipkart.com/dl/red-silk-wessaitlaurent-winter-xy-eau-de-toilette-100-ml/p/itmed7gxsgzfgnrq?pid=PERED7GXJ2KMZPFK&affid=siddarthk,http://img.fkcdn.com/image/perfume/y/f/y/eau-de-toilette-casela-100-rich-opulence-fragrance-77-200x200-imaefpc5ya7khfmw.jpeg,Health and Beauty>Fragrances>Perfumes>Eaux De Toilette,4499.0,999.0,999.0,false,PERED7GXJ2KMZPFK,PERED7GXJ2KMZPFK
Flipkart,,"Red Silk Eros Winter xy Eau de Toilette  -  100 ml(For Boys, Men)",,Red Silk,http://dl.flipkart.com/dl/red-silk-eros-winter-xy-eau-de-toilette-100-ml/p/itmed7gxgwhpaay8?pid=PERED7GXZCB5R4CP&affid=siddarthk,http://img.fkcdn.com/image/perfume/4/c/p/eau-de-toilette-red-silk-100-eros-winter-xy-200x200-imaehy5yguzdfbub.jpeg,Health and Beauty>Fragrances>Perfumes>Eaux De Toilette,4499.0,999.0,999.0,false,PERED7GXZCB5R4CP,PERED7GXZCB5R4CP
Flipkart,,Redcot Limited Edition Winter x Eau de Toilette  -  90 ml,,Redcot,http://dl.flipkart.com/dl/redcot-limited-winter-x-eau-de-toilette-90-ml/p/itmed7gxh6erpwcj?pid=PERED7GXYMACAPMF&affid=siddarthk,http://img.fkcdn.com/image/perfume/p/m/f/eau-de-toilette-redcot-90-limited-edition-winter-x-200x200-imaehy5shmbsgzpm.jpeg,Health and Beauty>Fragrances>Perfumes>Eaux De Toilette,4499.0,999.0,999.0,false,PERED7GXYMACAPMF,PERED7GXYMACAPMF
Flipkart,,"Redcot Limited Edition Friendly x Eau de Toilette  -  90 ml(For Boys, Men)",,Redcot,http://dl.flipkart.com/dl/redcot-limited-friendly-x-eau-de-toilette-90-ml/p/itmed7gxeqjfta8g?pid=PERED7GXQTE9FUC2&affid=siddarthk,http://img.fkcdn.com/image/perfume/u/c/2/eau-de-toilette-redcot-90-limited-edition-friendly-x-200x200-imaehy5qgubpkkhz.jpeg,Health and Beauty>Fragrances>Perfumes>Eaux De Toilette,4499.0,999.0,999.0,false,PERED7GXQTE9FUC2,PERED7GXQTE9FUC2
Flipkart,,"Casela Diamond Limited Edition Eau de Toilette  -  75 ml(For Girls, Women)",,Casela,http://dl.flipkart.com/dl/casela-diamond-limited-eau-de-toilette-75-ml/p/itmecccg53a5fa65?pid=PERECCCGC2E9UKXX&affid=siddarthk,http://img.fkcdn.com/image/perfume/k/x/x/eau-de-toilette-casela-75-diamond-limited-edition-200x200-imaefpc5gbhhfvjt.jpeg,Health and Beauty>Fragrances>Perfumes>Eaux De Toilette,4499.0,999.0,999.0,false,PERECCCGC2E9UKXX,PERECCCGC2E9UKXX
Flipkart,,"Red Silk Pour Homme Winter xy Eau de Toilette  -  90 ml(For Boys, Men)",,Red Silk,http://dl.flipkart.com/dl/red-silk-pour-homme-winter-xy-eau-de-toilette-90-ml/p/itmed7gxnztzegfu?pid=PERED7GXVQXUKESY&affid=siddarthk,http://img.fkcdn.com/image/perfume/b/n/r/eau-de-toilette-casela-90-rich-opulence-fragrance-55-200x200-imaefpc5eyhawudw.jpeg,Health and Beauty>Fragrances>Perfumes>Eaux De Toilette,4499.0,999.0,999.0,false,PERED7GXVQXUKESY,PERED7GXVQXUKESY
Flipkart,,"Casela Absolute Eau de Parfum  -  90 ml(For Girls, Women)",,Casela,http://dl.flipkart.com/dl/casela-absolute-eau-de-parfum-90-ml/p/itmecccgyn5wfrky?pid=PERECCCGCX3HGSPX&affid=siddarthk,http://img.fkcdn.com/image/perfume/h/b/7/eau-de-toilette-casela-90-rich-opulence-fragrance-60-200x200-imaefpc5ymzk7zp9.jpeg,Health and Beauty>Fragrances>Perfumes>Eaux De Parfum,4499.0,999.0,999.0,false,PERECCCGCX3HGSPX,PERECCCGCX3HGSPX
Flipkart,,"Red Silk Limited Edition Friendly xy Eau de Toilette  -  90 ml(For Boys, Men)",,Red Silk,http://dl.flipkart.com/dl/red-silk-limited-friendly-xy-eau-de-toilette-90-ml/p/itmed7gxjtzmwmak?pid=PERED7GXY6SYDYSE&affid=siddarthk,http://img.fkcdn.com/image/perfume/b/n/r/eau-de-toilette-casela-90-rich-opulence-fragrance-55-200x200-imaefpc5eyhawudw.jpeg,Health and Beauty>Fragrances>Perfumes>Eaux De Toilette,4499.0,999.0,999.0,false,PERED7GXY6SYDYSE,PERED7GXY6SYDYSE
Flipkart,,"Redcot Insensitive x Eau de Toilette  -  100 ml(For Boys, Men)",,Redcot,http://dl.flipkart.com/dl/redcot-insensitive-x-eau-de-toilette-100-ml/p/itmed7gxgphpbz2v?pid=PERED7GXZK2AB3VG&affid=siddarthk,http://img.fkcdn.com/image/perfume/3/v/g/eau-de-toilette-redcot-100-insensitive-x-200x200-imaefy8ybznufuwn.jpeg,Health and Beauty>Fragrances>Perfumes>Eaux De Toilette,4499.0,999.0,999.0,false,PERED7GXZK2AB3VG,PERED7GXZK2AB3VG
Flipkart,,"Casela Senorita Eau de Parfum  -  90 ml(For Girls, Women)",,Casela,http://dl.flipkart.com/dl/casela-senorita-eau-de-parfum-90-ml/p/itmecccggzays2xg?pid=PERECCCGTMGCFFKU&affid=siddarthk,http://img.fkcdn.com/image/perfume/z/4/2/eau-de-parfum-casela-90-natural-fragrance-0156-200x200-imaefpc5futvc97u.jpeg,Health and Beauty>Fragrances>Perfumes>Eaux De Parfum,4499.0,999.0,999.0,false,PERECCCGTMGCFFKU,PERECCCGTMGCFFKU
Flipkart,,"Casela New Attraction Eau de Parfum  -  30 ml(For Girls, Women)",,Casela,http://dl.flipkart.com/dl/casela-new-attraction-eau-de-parfum-30-ml/p/itmecccg4ea7mxab?pid=PERECCCGSVGQWGQD&affid=siddarthk,http://img.fkcdn.com/image/perfume/g/g/3/eau-de-toilette-casela-75-rich-opulence-fragrance-74-200x200-imaefpc5excuxuzg.jpeg,Health and Beauty>Fragrances>Perfumes>Eaux De Parfum,4499.0,999.0,999.0,false,PERECCCGSVGQWGQD,PERECCCGSVGQWGQD
Flipkart,,Casela Intense Eau de Toilette  -  100 ml,,Casela,http://dl.flipkart.com/dl/casela-intense-eau-de-toilette-100-ml/p/itmecccgv6azzrhw?pid=PERECCCGV4MRWGXZ&affid=siddarthk,http://img.fkcdn.com/image/perfume/g/x/z/eau-de-toilette-casela-100-intense-200x200-imaefpc5hvtgreyq.jpeg,Health and Beauty>Fragrances>Perfumes>Eaux De Toilette,4499.0,999.0,999.0,false,PERECCCGV4MRWGXZ,PERECCCGV4MRWGXZ
Flipkart,,"Red Silk one Night xy Eau de Toilette  -  100 ml(For Girls, Women)",,Red Silk,http://dl.flipkart.com/dl/red-silk-one-night-xy-eau-de-toilette-100-ml/p/itmed7gxjey6eydr?pid=PERED7GX5NPKJDFX&affid=siddarthk,http://img.fkcdn.com/image/perfume/d/f/x/eau-de-toilette-red-silk-100-one-night-xy-200x200-imaefpc5rnxddggb.jpeg,Health and Beauty>Fragrances>Perfumes>Eaux De Toilette,4499.0,999.0,999.0,false,PERED7GX5NPKJDFX,PERED7GX5NPKJDFX
Flipkart,,"Red Silk Absolute Sexy xy Eau de Toilette  -  100 ml(For Boys, Men)",,Red Silk,http://dl.flipkart.com/dl/red-silk-absolute-sexy-xy-eau-de-toilette-100-ml/p/itmed7gxbhabbxg3?pid=PERED7GX8FP4KXW4&affid=siddarthk,http://img.fkcdn.com/image/perfume/x/w/4/eau-de-toilette-red-silk-100-absolute-sexy-xy-200x200-imaefy6jtpfpz4kh.jpeg,Health and Beauty>Fragrances>Perfumes>Eaux De Toilette,4499.0,999.0,999.0,false,PERED7GX8FP4KXW4,PERED7GX8FP4KXW4
Flipkart,,"Redcot Absolute Night x Eau de Parfum  -  80 ml(For Girls, Women)",,Redcot,http://dl.flipkart.com/dl/redcot-absolute-night-x-eau-de-parfum-80-ml/p/itmed7gxpe6chgg9?pid=PERED7GX8V4ND3FH&affid=siddarthk,http://img.fkcdn.com/image/perfume/3/f/h/eau-de-parfum-redcot-80-absolute-night-x-200x200-imaefpc5fgfjzyfw.jpeg,Health and Beauty>Fragrances>Perfumes>Eaux De Parfum,4499.0,999.0,999.0,false,PERED7GX8V4ND3FH,PERED7GX8V4ND3FH
Flipkart,,"Redcot Sports Winter x Eau de Toilette  -  100 ml(For Boys, Men)",,Redcot,http://dl.flipkart.com/dl/redcot-sports-winter-x-eau-de-toilette-100-ml/p/itmed7gxzavjgjky?pid=PERED7GXC2TAF2H3&affid=siddarthk,http://img.fkcdn.com/image/perfume/2/h/3/eau-de-toilette-redcot-100-sports-winter-x-200x200-imaehyfqxpqjfkkz.jpeg,Health and Beauty>Fragrances>Perfumes>Eaux De Toilette,4499.0,999.0,999.0,false,PERED7GXC2TAF2H3,PERED7GXC2TAF2H3
Flipkart,,"Casela Classic Black Eau de Toilette  -  100 ml(For Boys, Men)",,Casela,http://dl.flipkart.com/dl/casela-classic-black-eau-de-toilette-100-ml/p/itmecccgdcdxcqgr?pid=PERECCCGJ66YY3DY&affid=siddarthk,http://img.fkcdn.com/image/perfume/u/s/4/eau-de-toilette-casela-100-rich-opulence-fragrance-80-200x200-imaefpc5ch7ztnu2.jpeg,Health and Beauty>Fragrances>Perfumes>Eaux De Toilette,4499.0,999.0,999.0,false,PERECCCGJ66YY3DY,PERECCCGJ66YY3DY
Flipkart,,"Red Silk Sexy Men be xy Eau de Toilette  -  100 ml(For Boys, Men)",,Red Silk,http://dl.flipkart.com/dl/red-silk-sexy-men-xy-eau-de-toilette-100-ml/p/itmed7gxsd3jsxuf?pid=PERED7GXBHZWFFSD&affid=siddarthk,http://img.fkcdn.com/image/perfume/f/s/d/eau-de-toilette-red-silk-100-sexy-men-be-xy-200x200-imaefpc5bbfnz4ue.jpeg,Health and Beauty>Fragrances>Perfumes>Eaux De Toilette,4499.0,999.0,999.0,false,PERED7GXBHZWFFSD,PERED7GXBHZWFFSD
Flipkart,,"Redcot Eros Winter x Eau de Toilette  -  100 ml(For Boys, Men)",,Redcot,http://dl.flipkart.com/dl/redcot-eros-winter-x-eau-de-toilette-100-ml/p/itmed7gxyzx6bpua?pid=PERED7GXGFAYZ8MY&affid=siddarthk,http://img.fkcdn.com/image/perfume/6/g/4/eau-de-toilette-redcot-100-sports-the-real-men-x-200x200-imaefpc5udpsrwwb.jpeg,Health and Beauty>Fragrances>Perfumes>Eaux De Toilette,4499.0,999.0,999.0,false,PERED7GXGFAYZ8MY,PERED7GXGFAYZ8MY
Flipkart,,"Red Silk Limited Edition Hero xy Eau de Toilette  -  100 ml(For Boys, Men)",,Red Silk,http://dl.flipkart.com/dl/red-silk-limited-hero-xy-eau-de-toilette-100-ml/p/itmed7gxcyxkyg8e?pid=PERED7GXQ4BCUNVU&affid=siddarthk,http://img.fkcdn.com/image/perfume/n/v/u/eau-de-toilette-red-silk-100-limited-edition-hero-xy-200x200-imaefpc5xajrg2gs.jpeg,Health and Beauty>Fragrances>Perfumes>Eaux De Toilette,4499.0,999.0,999.0,false,PERED7GXQ4BCUNVU,PERED7GXQ4BCUNVU
Flipkart,,"Casela Desire Blue Eau de Toilette  -  100 ml(For Boys, Men)",,Casela,http://dl.flipkart.com/dl/casela-desire-blue-eau-de-toilette-100-ml/p/itmecccgfmuygt7a?pid=PERECCCGHKCUHYHS&affid=siddarthk,http://img.fkcdn.com/image/perfume/y/h/s/eau-de-toilette-casela-100-desire-blue-200x200-imaefpc5ph6rgynd.jpeg,Health and Beauty>Fragrances>Perfumes>Eaux De Toilette,4499.0,999.0,999.0,false,PERECCCGHKCUHYHS,PERECCCGHKCUHYHS
Flipkart,,"Red Silk Champion The Hero xy Eau de Toilette  -  90 ml(For Boys, Men)",,Red Silk,http://dl.flipkart.com/dl/red-silk-champion-hero-xy-eau-de-toilette-90-ml/p/itmed7gxsszzsgc2?pid=PERED7GX8W7HRBJD&affid=siddarthk,http://img.fkcdn.com/image/perfume/9/w/d/eau-de-toilette-casela-90-rich-opulence-fragrance-42-200x200-imaefpc5rtj7gsgh.jpeg,Health and Beauty>Fragrances>Perfumes>Eaux De Toilette,4499.0,999.0,999.0,false,PERED7GX8W7HRBJD,PERED7GX8W7HRBJD
Flipkart,,"Red Silk The New Fragrance Edition xy Eau de Parfum  -  75 ml(For Girls, Women)",,Red Silk,http://dl.flipkart.com/dl/red-silk-new-fragrance-xy-eau-de-parfum-75-ml/p/itmed7gxxhzbahah?pid=PERED7GXQQREKB7W&affid=siddarthk,http://img.fkcdn.com/image/perfume/b/7/w/eau-de-parfum-red-silk-75-the-new-fragrance-edition-xy-200x200-imaecxcnymyayhmf.jpeg,Health and Beauty>Fragrances>Perfumes>Eaux De Parfum,4499.0,999.0,999.0,false,PERED7GXQQREKB7W,PERED7GXQQREKB7W
Flipkart,,"Casela Limited Edition Eau de Toilette  -  150 ml(For Boys, Men)",,Casela,http://dl.flipkart.com/dl/casela-limited-eau-de-toilette-150-ml/p/itmecccgzhxz4jnm?pid=PERECCCGZYWXWUAQ&affid=siddarthk,http://img.fkcdn.com/image/perfume/u/a/q/eau-de-toilette-casela-150-limited-edition-200x200-imaefpc5fxmphgua.jpeg,Health and Beauty>Fragrances>Perfumes>Eaux De Toilette,4499.0,999.0,999.0,false,PERECCCGZYWXWUAQ,PERECCCGZYWXWUAQ
Flipkart,,"Redcot Ralph Lauren Blue Dude x Eau de Toilette  -  125 ml(For Boys, Men)",,Redcot,http://dl.flipkart.com/dl/redcot-ralph-lauren-blue-dude-x-eau-de-toilette-125-ml/p/itmed7gxfgnqehzv?pid=PERED7GXFJURNTFF&affid=siddarthk,http://img.fkcdn.com/image/perfume/h/t/s/eau-de-toilette-red-silk-125-ralph-lauren-blue-dude-xy-200x200-imaehyftytmjgkzk.jpeg,Health and Beauty>Fragrances>Perfumes>Eaux De Toilette,4499.0,999.0,999.0,false,PERED7GXFJURNTFF,PERED7GXFJURNTFF
Flipkart,,"Jungle Magic Naughty Teddy Eau de Toilette  -  60 ml(For Boys, Girls, Men, Women)",Highlights:Age: 3+Pure-Natural-Fruit basedDermatologically TestedNon Irritant & Safe for Children?s Skin.Eau deToiletteQuantity: 60 mlProduct Description: Jungle Magic Perfumes contain elements of essential oils. Aroma from essential oils helps in making a child feel fresh and revitalized.,Jungle Magic,http://dl.flipkart.com/dl/jungle-magic-naughty-teddy-eau-de-toilette-60-ml/p/itme32fzmn3sf4bq?pid=PERE32FZTJRYBYQR&affid=siddarthk,http://img.fkcdn.com/image/perfume/y/q/r/eau-de-toilette-jungle-magic-60-naughty-teddy-200x200-imaefp39kyanrdh6.jpeg,Health and Beauty>Fragrances>Perfumes>Eaux De Toilette,299.0,299.0,299.0,true,PERE32FZTJRYBYQR,PERE32FZTJRYBYQR
