PartnerName,Id,Title,Description,Brand,Link,ImageLink,CategoryName,Mrp,OfferPrice,EffectivePrice,Availability,PartnerIdFromUrl,PartnerIdFromDb
Flipkart,,"Bausch & Lomb Biotrue 1 Day with Biotrue 60ml Solution Kit By Visions India Daily Contact Lens(-2.50, Clear, Pack of 30)","Biotrue ONEday contact lenses are inspired by the biology of your eyes. While other lenses dry out as the day passes, Biotrue ONEday contacts retain moisture naturally produced by the eye. The result is consistently clear vision and comfort until the moment you take them out. With added High Definition Optics, Biotrue lenses help reduce halos and glare in low light situations. Try Biotrue ONEday daily disposables and see how naturally good your eyes can feel in contact lenses. Note: All items have latest expiry. Minimum expiry on any product will be not less than 2 years. 100% authentic item. Opened boxes cannot be replaced under any circumstance. We advise to check the product before opening them.",Bausch & Lomb,http://dl.flipkart.com/dl/bausch-lomb-biotrue-1-day-60ml-solution-kit-visions-india-daily-contact-lens/p/itmef6g5ng6hfcyu?pid=CTLEF6G5H3EDSP5D&affid=siddarthk,http://img.fkcdn.com/image/contact-lens-new/z/k/r/bausch-lomb-30-biotrue-1-day-with-biotrue-60ml-solution-kit-by-200x200-imaef42vfmtzvuuk.jpeg,Health and Beauty>Eye Care>Contact Lenses,2500.0,1785.0,1785.0,true,CTLEF6G5H3EDSP5D,CTLEF6G5H3EDSP5D
Flipkart,,Glamour Eye Warm Brown By Visions India Monthly Contact Lens,India's Best Selling Cosmetic Contact Lenses Manufactured In Korea,Glamour Eye,http://dl.flipkart.com/dl/glamour-eye-warm-brown-visions-india-monthly-contact-lens/p/itmeghwxbmzuguky?pid=CTLEGHWXRBWGGJYE&affid=siddarthk,http://img.fkcdn.com/image/contact-lens-new/m/2/r/glamour-eye-2-charming-hazel-by-visions-india-12-50-200x200-imaegjh57djgrcfy.jpeg,Health and Beauty>Eye Care>Contact Lenses,995.0,625.0,625.0,true,CTLEGHWXRBWGGJYE,CTLEGHWXRBWGGJYE
Flipkart,,"Ciba Vision Freshlook Colors Violet By Visions India Monthly Contact Lens(-4.25, Violet, Pack of 2)","Freshlook Colors is affordable opaque colors with maximum possible lens concentration colours, natural depth of your eyes. Replace it frequently to enjoy a comfortable wear.",Ciba Vision,http://dl.flipkart.com/dl/ciba-vision-freshlook-colors-violetby-visions-india-monthly-contact-lens/p/itmefjrdtqpwe4y9?pid=CTLEFJRD2Q925ZHH&affid=siddarthk,http://img.fkcdn.com/image/contact-lens-new/b/e/q/ciba-vision-2-freshlook-colors-violet-by-visions-india-8-00-200x200-imaefjzb3peggt3y.jpeg,Health and Beauty>Eye Care>Contact Lenses,995.0,699.0,699.0,true,CTLEFJRD2Q925ZHH,CTLEFJRD2Q925ZHH
Flipkart,,Glamour Eye Wild Violet By Visions India Monthly Contact Lens,India's Best Selling Cosmetic Contact Lenses Manufactured In Korea,Glamour Eye,http://dl.flipkart.com/dl/glamour-eye-wild-violet-visions-india-monthly-contact-lens/p/itmeghwxts43bex5?pid=CTLEGHWXEHXQGYAF&affid=siddarthk,http://img.fkcdn.com/image/contact-lens-new/m/2/r/glamour-eye-2-charming-hazel-by-visions-india-12-50-200x200-imaegjh57djgrcfy.jpeg,Health and Beauty>Eye Care>Contact Lenses,995.0,625.0,625.0,true,CTLEGHWXEHXQGYAF,CTLEGHWXEHXQGYAF
Flipkart,,Optokart Two Tone Color With Case Made In USA By Visions India Yearly Contact Lens,"These have been specially designed keeping the youth in mind. Most Attractive Colors These easy to handle and comfortable to use lenses come in Yearly disposable modality and hence are hygienic. Grey,Green,Turquoise,Brown.",Optokart,http://dl.flipkart.com/dl/optokart-two-tone-color-case-made-usa-visions-india-yearly-contact-lens/p/itmehenyhv96yhsf?pid=CTLEHENXDRHSVVGJ&affid=siddarthk,http://img.fkcdn.com/image/contact-lens-new/t/g/c/optokart-2-two-tone-color-with-case-made-in-usa-by-visions-india-200x200-imaeheg9vr9ckhje.jpeg,Health and Beauty>Eye Care>Contact Lenses,2300.0,649.0,649.0,true,CTLEHENXDRHSVVGJ,CTLEHENXDRHSVVGJ
Flipkart,,"Ciba Vision Freshlook Colorblends Honey By Visions India Monthly Contact Lens(0.00, Honey, Pack of 2)","Freshlook Colorblends in affordable opaque colors with maximum possible lens concentration blends 3 colours into one to create the subtle, natural depth of your eyes. Replace it frequently to enjoy a comfortable wear.",Ciba Vision,http://dl.flipkart.com/dl/ciba-vision-freshlook-colorblends-honey-visions-india-monthly-contact-lens/p/itmeeyfu3fvg3fkz?pid=CTLEEYFUR3DFYHWN&affid=siddarthk,http://img.fkcdn.com/image/contact-lens-new/5/7/t/ciba-vision-2-freshlook-colorblends-honey-by-visions-india-1-00-200x200-imaearggnngzjft9.jpeg,Health and Beauty>Eye Care>Contact Lenses,995.0,589.0,589.0,true,CTLEEYFUR3DFYHWN,CTLEEYFUR3DFYHWN
Flipkart,,Glamour Eye Pure Aqua By Visions India Monthly Contact Lens,India's Best Selling Cosmetic Contact Lenses Manufactured In Korea,Glamour Eye,http://dl.flipkart.com/dl/glamour-eye-pure-aqua-visions-india-monthly-contact-lens/p/itmeghw3cfjjnm58?pid=CTLEGHW3CPRFEFXG&affid=siddarthk,http://img.fkcdn.com/image/contact-lens-new/s/g/m/glamour-eye-2-pure-aqua-by-visions-india-14-50-200x200-imaegeyenyukxgus.jpeg,Health and Beauty>Eye Care>Contact Lenses,995.0,625.0,625.0,true,CTLEGHW3CPRFEFXG,CTLEGHW3CPRFEFXG
Flipkart,,Glamour Eye Warm Brown By Visions India Monthly Contact Lens,India's Best Selling Cosmetic Contact Lenses Manufactured In Korea,Glamour Eye,http://dl.flipkart.com/dl/glamour-eye-warm-brown-visions-india-monthly-contact-lens/p/itmeghwxfxbhdffh?pid=CTLEGHWXYFBYVPE2&affid=siddarthk,http://img.fkcdn.com/image/contact-lens-new/m/2/r/glamour-eye-2-charming-hazel-by-visions-india-12-50-200x200-imaegjh57djgrcfy.jpeg,Health and Beauty>Eye Care>Contact Lenses,995.0,625.0,625.0,true,CTLEGHWXYFBYVPE2,CTLEGHWXYFBYVPE2
Flipkart,,Glamour Eye Wild Violet By Visions India Monthly Contact Lens,India's Best Selling Cosmetic Contact Lenses Manufactured In Korea,Glamour Eye,http://dl.flipkart.com/dl/glamour-eye-wild-violet-visions-india-monthly-contact-lens/p/itmeghwx6nz93vhz?pid=CTLEGHWXSTGJWUZU&affid=siddarthk,http://img.fkcdn.com/image/contact-lens-new/m/2/r/glamour-eye-2-charming-hazel-by-visions-india-12-50-200x200-imaegjh57djgrcfy.jpeg,Health and Beauty>Eye Care>Contact Lenses,995.0,625.0,625.0,true,CTLEGHWXSTGJWUZU,CTLEGHWXSTGJWUZU
Flipkart,,Ciba Vision Freshlook Colors Green By Visions India Monthly Contact Lens,"Freshlook Colors is affordable opaque colors with maximum possible lens concentration colours, natural depth of your eyes. Replace it frequently to enjoy a comfortable wear.",Ciba Vision,http://dl.flipkart.com/dl/ciba-vision-freshlook-colors-greenby-visions-india-monthly-contact-lens/p/itmefjrd8apshkfq?pid=CTLEFJRDGRETAWPR&affid=siddarthk,http://img.fkcdn.com/image/contact-lens-new/2/z/x/ciba-vision-2-freshlook-colors-green-by-visions-india-6-50-200x200-imaefjz5kyyzakds.jpeg,Health and Beauty>Eye Care>Contact Lenses,995.0,699.0,699.0,true,CTLEFJRDGRETAWPR,CTLEFJRDGRETAWPR
Flipkart,,Optokart Two Tone Color With Kit Made In USA By Visions India Yearly Contact Lens,"These have been specially designed keeping the youth in mind. Most Attractive Colors These easy to handle and comfortable to use lenses come in Yearly disposable modality and hence are hygienic. Grey,Green,Turquoise,Brown.",Optokart,http://dl.flipkart.com/dl/optokart-two-tone-color-kit-made-usa-visions-india-yearly-contact-lens/p/itmehghymz4redsg?pid=CTLEHGHYFF32FCST&affid=siddarthk,http://img.fkcdn.com/image/contact-lens-new/h/b/g/optokart-2-two-tone-color-with-kit-made-in-usa-by-visions-india-200x200-imaehej7urze8uwp.jpeg,Health and Beauty>Eye Care>Contact Lenses,2300.0,699.0,699.0,true,CTLEHGHYFF32FCST,CTLEHGHYFF32FCST
Flipkart,,"Ciba Vision Freshlook Colours Monthly Contact Lens(-5, Hazel, Pack of 2)","Freshlook Colors in affordable opaque colors with maximum possible lens concentration blends natural colours into one to create the subtle, natural depth of your eyes. Replace it frequently to enjoy a comfortable wear.",Ciba Vision,http://dl.flipkart.com/dl/ciba-vision-freshlook-colours-monthly-contact-lens/p/itmedhdpdjafykwj?pid=CTLEDHDPHGBXZUC9&affid=siddarthk,http://img.fkcdn.com/image/contact-lens-new/d/q/w/ciba-vision-2-freshlook-colours-1-5-original-imaedfff9x6kgamm.jpeg,Health and Beauty>Eye Care>Contact Lenses,995.0,699.0,699.0,true,CTLEDHDPHGBXZUC9,CTLEDHDPHGBXZUC9
Flipkart,,"Glamour Eye Pure Aqua By Visions India Monthly Contact Lens(-3.75, Pure Aqua, Pack of 2)",India's Best Selling Cosmetic Contact Lenses Manufactured In Korea,Glamour Eye,http://dl.flipkart.com/dl/glamour-eye-pure-aqua-visions-india-monthly-contact-lens/p/itmeghw3afwcmteb?pid=CTLEGHW3C23ZNZWM&affid=siddarthk,http://img.fkcdn.com/image/contact-lens-new/s/g/m/glamour-eye-2-pure-aqua-by-visions-india-14-50-200x200-imaegeyenyukxgus.jpeg,Health and Beauty>Eye Care>Contact Lenses,995.0,625.0,625.0,true,CTLEGHW3C23ZNZWM,CTLEGHW3C23ZNZWM
Flipkart,,Aryan Tri Tone Hazel By Visions India Yearly Contact Lens,"Aryan tri tone cosmetic lenses are developed and designed by the best in the business to match with the characteristics of the cornea and are intended to make one’s eyes more beautiful and more natural. Due consideration is given to the colour and size of the pupil and the health of the eye. These lenses are available in six colours – Sky Blue, Aqua Blue, Green , Hazel, Grey and Brown.",Aryan,http://dl.flipkart.com/dl/aryan-tri-tone-hazel-visions-india-yearly-contact-lens/p/itmegys9zhwfh8mf?pid=CTLEH5SP5JFY9F5W&affid=siddarthk,http://img.fkcdn.com/image/contact-lens-new/4/s/h/aryan-2-tri-tone-hazel-by-visions-india-9-00-200x200-imaeh5he6nxncbxx.jpeg,Health and Beauty>Eye Care>Contact Lenses,2600.0,1599.0,1599.0,true,CTLEH5SP5JFY9F5W,CTLEH5SP5JFY9F5W
Flipkart,,"Ciba Vision Freshlook Colors Green By Visions India Monthly Contact Lens(-0.75, Green, Pack of 2)","Freshlook Colors is affordable opaque colors with maximum possible lens concentration colours, natural depth of your eyes. Replace it frequently to enjoy a comfortable wear.",Ciba Vision,http://dl.flipkart.com/dl/ciba-vision-freshlook-colors-greenby-visions-india-monthly-contact-lens/p/itmefjrd2gmtgmfx?pid=CTLEFJRDBBTGZZ6F&affid=siddarthk,http://img.fkcdn.com/image/contact-lens-new/2/z/x/ciba-vision-2-freshlook-colors-green-by-visions-india-6-50-200x200-imaefjz5kyyzakds.jpeg,Health and Beauty>Eye Care>Contact Lenses,995.0,699.0,699.0,true,CTLEFJRDBBTGZZ6F,CTLEFJRDBBTGZZ6F
Flipkart,,Optokart Two Tone Color With Case Made In USA By Visions India Yearly Contact Lens,"These have been specially designed keeping the youth in mind. Most Attractive Colors These easy to handle and comfortable to use lenses come in Yearly disposable modality and hence are hygienic. Grey,Green,Turquoise,Brown.",Optokart,http://dl.flipkart.com/dl/optokart-two-tone-color-case-made-usa-visions-india-yearly-contact-lens/p/itmehep2f9t6gfhw?pid=CTLEHEP2TAHMNGGS&affid=siddarthk,http://img.fkcdn.com/image/contact-lens-new/y/y/f/optokart-2-two-tone-color-with-case-made-in-usa-by-visions-india-200x200-imaehehbhfm2mhnq.jpeg,Health and Beauty>Eye Care>Contact Lenses,2300.0,649.0,649.0,true,CTLEHEP2TAHMNGGS,CTLEHEP2TAHMNGGS
Flipkart,,"Optokart Two Tone Color With Case Made In USA By Visions India Yearly Contact Lens(-1.25, Green, Pack of 2)","These have been specially designed keeping the youth in mind. Most Attractive Colors These easy to handle and comfortable to use lenses come in Yearly disposable modality and hence are hygienic. Green,Grey,Turquoise,Brown.",Optokart,http://dl.flipkart.com/dl/optokart-two-tone-color-case-made-usa-visions-india-yearly-contact-lens/p/itmehen3bhwhyzzu?pid=CTLEHEN3JJBGS3Z5&affid=siddarthk,http://img.fkcdn.com/image/contact-lens-new/b/b/2/optokart-2-two-tone-color-with-case-made-in-usa-by-visions-india-200x200-imaehehhuaxhzd7b.jpeg,Health and Beauty>Eye Care>Contact Lenses,2300.0,649.0,649.0,true,CTLEHEN3JJBGS3Z5,CTLEHEN3JJBGS3Z5
Flipkart,,"Ciba Vision Freshlook Colorblends Monthly Contact Lens(-1.50, Honey, Pack of 2)","Freshlook Colorblends in affordable opaque colors with maximum possible lens concentration blends 3 colours into one to create the subtle, natural depth of your eyes. Replace it frequently to enjoy a comfortable wear.",Ciba Vision,http://dl.flipkart.com/dl/ciba-vision-freshlook-colorblends-monthly-contact-lens/p/itmearmgeezfnsw2?pid=CTLEARMGZXHYSXFE&affid=siddarthk,http://img.fkcdn.com/image/contact-lens-new/5/7/t/ciba-vision-2-freshlook-colorblends-honey-by-visions-india-1-00-200x200-imaearggnngzjft9.jpeg,Health and Beauty>Eye Care>Contact Lenses,995.0,699.0,699.0,true,CTLEARMGZXHYSXFE,CTLEARMGZXHYSXFE
Flipkart,,Optokart Two Tone Color With Case Made In USA By Visions India Yearly Contact Lens,"These have been specially designed keeping the youth in mind. Most Attractive Colors These easy to handle and comfortable to use lenses come in Yearly disposable modality and hence are hygienic. Green,Grey,Turquoise,Brown.",Optokart,http://dl.flipkart.com/dl/optokart-two-tone-color-case-made-usa-visions-india-yearly-contact-lens/p/itmehen3ntyhgeah?pid=CTLEHEN37NGAN6HG&affid=siddarthk,http://img.fkcdn.com/image/contact-lens-new/b/b/2/optokart-2-two-tone-color-with-case-made-in-usa-by-visions-india-200x200-imaehehhuaxhzd7b.jpeg,Health and Beauty>Eye Care>Contact Lenses,2300.0,649.0,649.0,true,CTLEHEN37NGAN6HG,CTLEHEN37NGAN6HG
Flipkart,,Aryan 2 Tone Hazel By Visions India Yearly Contact Lens,"Aryan two tone cosmetic lenses are developed and designed by the best in the business to match with the characteristics of the cornea and are intended to make one’s eyes more beautiful and more natural. Due consideration is given to the colour and size of the pupil and the health of the eye. These lenses are available in six colours – sky blue, hazel, Hazel, brown, Hazel and Hazel along with the contact lens solution.",Aryan,http://dl.flipkart.com/dl/aryan-2-tone-hazel-visions-india-yearly-contact-lens/p/itmees7fgzfeyfrv?pid=CTLEES7FFD5ZHTAS&affid=siddarthk,http://img.fkcdn.com/image/contact-lens-new/h/g/a/aryan-2-2-tone-hazel-by-visions-india-4-50-200x200-imaee87dwwbgxufj.jpeg,Health and Beauty>Eye Care>Contact Lenses,2300.0,1599.0,1599.0,true,CTLEES7FFD5ZHTAS,CTLEES7FFD5ZHTAS
Flipkart,,"Glamour Eye Pure Aqua By Visions India Monthly Contact Lens(-13.50, Pure Aqua, Pack of 2)",India's Best Selling Cosmetic Contact Lenses Manufactured In Korea,Glamour Eye,http://dl.flipkart.com/dl/glamour-eye-pure-aqua-visions-india-monthly-contact-lens/p/itmeghw3ukjzzzgy?pid=CTLEGHW3FP6KTS39&affid=siddarthk,http://img.fkcdn.com/image/contact-lens-new/s/g/m/glamour-eye-2-pure-aqua-by-visions-india-14-50-200x200-imaegeyenyukxgus.jpeg,Health and Beauty>Eye Care>Contact Lenses,995.0,625.0,625.0,true,CTLEGHW3FP6KTS39,CTLEGHW3FP6KTS39
Flipkart,,"Ciba Vision Freshlook Colorblends Amethyst By Visions India Monthly Contact Lens(-7.50, Amethyst, Pack of 2)","Freshlook Colorblends in affordable opaque colors with maximum possible lens concentration blends 3 colours into one to create the subtle, natural depth of your eyes. Replace it frequently to enjoy a comfortable wear.",Ciba Vision,http://dl.flipkart.com/dl/ciba-vision-freshlook-colorblends-amethyst-visions-india-monthly-contact-lens/p/itmedmyzyen5cgb3?pid=CTLEDMYZKMMRKAZA&affid=siddarthk,http://img.fkcdn.com/image/contact-lens-new/g/p/x/ciba-vision-2-freshlook-colorblends-amethyst-by-visions-india-4-200x200-imaeaz3ead6drfzq.jpeg,Health and Beauty>Eye Care>Contact Lenses,995.0,699.0,699.0,true,CTLEDMYZKMMRKAZA,CTLEDMYZKMMRKAZA
Flipkart,,Glamour Eye Pure Aqua By Visions India Monthly Contact Lens,India's Best Selling Cosmetic Contact Lenses Manufactured In Korea,Glamour Eye,http://dl.flipkart.com/dl/glamour-eye-pure-aqua-visions-india-monthly-contact-lens/p/itmeghw3kk7xhyzp?pid=CTLEGHW3HQXNRSYT&affid=siddarthk,http://img.fkcdn.com/image/contact-lens-new/s/g/m/glamour-eye-2-pure-aqua-by-visions-india-14-50-200x200-imaegeyenyukxgus.jpeg,Health and Beauty>Eye Care>Contact Lenses,995.0,625.0,625.0,true,CTLEGHW3HQXNRSYT,CTLEGHW3HQXNRSYT
Flipkart,,"Flamboyant Disposable Colour Monthly Contact Lens(0, Pure Hazel, Pack of 2)","Flamboyant Fantasy Color Contact Lenses are monthly disposable lenses, available in many shades within the same colour including gray, green, blue, violet, honey, brown, pure hazel, silk gray and turquoise green. So now, creating your very own style statement has become so easy! The soft lenses dont hurt the eyes as they provide only a soft covering over the eyes.",Flamboyant,http://dl.flipkart.com/dl/flamboyant-disposable-colour-monthly-contact-lens/p/itmeeyjp7f79nftk?pid=CTLEEYJPEWGKTRU3&affid=siddarthk,http://img.fkcdn.com/image/contact-lens-new/k/k/v/flamboyant-2-disposable-colour-6-5-200x200-imaedvrh8m9cen4p.jpeg,Health and Beauty>Eye Care>Contact Lenses,999.0,649.0,649.0,true,CTLEEYJPEWGKTRU3,CTLEEYJPEWGKTRU3
Flipkart,,Aryan Tri Tone Green Visions India Yearly Contact Lens,"Aryan tri tone cosmetic lenses are developed and designed by the best in the business to match with the characteristics of the cornea and are intended to make one’s eyes more beautiful and more natural. Due consideration is given to the colour and size of the pupil and the health of the eye. These lenses are available in six colours – Sky Blue, Aqua Blue, Green , Hazel, Grey and Brown.",Aryan,http://dl.flipkart.com/dl/aryan-tri-tone-green-visions-india-yearly-contact-lens/p/itmegysnzygr8huv?pid=CTLEH8FCUGEM6QQF&affid=siddarthk,http://img.fkcdn.com/image/contact-lens-new/f/r/4/aryan-2-tri-tone-green-visions-india-9-00-200x200-imaeh5p34mqj36tv.jpeg,Health and Beauty>Eye Care>Contact Lenses,2600.0,1599.0,1599.0,true,CTLEH8FCUGEM6QQF,CTLEH8FCUGEM6QQF
Flipkart,,"Ciba Vision FreshLook COLORBLENDS Blue by Vision India Monthly Contact Lens(-0.50, Blue, Pack of 2)","Freshlook Colorblends in affordable opaque colors with maximum possible lens concentration blends 3 colours into one to create the subtle, natural depth of your eyes. Replace it frequently to enjoy a comfortable wear.",Ciba Vision,http://dl.flipkart.com/dl/ciba-vision-freshlook-colorblends-blue-india-monthly-contact-lens/p/itmedkwfczgc6uxy?pid=CTLEDKWFTASHEMFN&affid=siddarthk,http://img.fkcdn.com/image/contact-lens-new/w/t/j/ciba-vision-2-freshlook-colorblends-blue-by-vision-india-1-50-200x200-imaearhhghektsna.jpeg,Health and Beauty>Eye Care>Contact Lenses,995.0,699.0,699.0,true,CTLEDKWFTASHEMFN,CTLEDKWFTASHEMFN
Flipkart,,"Ciba Vision Freshlook Colorblends Turquoise By Vision India Monthly Contact Lens(-7.00, Turquoise, Pack of 2)","Freshlook Colorblends In Affordable Opaque Colors With Maximum Possible Lens Concentration Blends 3 Colours Into One To Create The Subtle, Natural Depth Of Your Eyes. Replace It Frequently To Enjoy A Comfortable Wear.",Ciba Vision,http://dl.flipkart.com/dl/ciba-vision-freshlook-colorblends-turquoise-india-monthly-contact-lens/p/itmedtp3whwz6uax?pid=CTLEDTP33SYGWJYP&affid=siddarthk,http://img.fkcdn.com/image/contact-lens-new/h/p/k/ciba-vision-2-freshlook-colorblends-turquoise-by-vision-india-8-200x200-imaedtcwecgr892m.jpeg,Health and Beauty>Eye Care>Contact Lenses,995.0,699.0,699.0,true,CTLEDTP33SYGWJYP,CTLEDTP33SYGWJYP
Flipkart,,"Optokart Two Tone Color With Case Made In USA By Visions India Yearly Contact Lens(-4.75, Green, Pack of 2)","These have been specially designed keeping the youth in mind. Most Attractive Colors These easy to handle and comfortable to use lenses come in Yearly disposable modality and hence are hygienic. Green,Grey,Turquoise,Brown.",Optokart,http://dl.flipkart.com/dl/optokart-two-tone-color-case-made-usa-visions-india-yearly-contact-lens/p/itmehen3t3rmkjuu?pid=CTLEHEN3THCGWH3G&affid=siddarthk,http://img.fkcdn.com/image/contact-lens-new/b/b/2/optokart-2-two-tone-color-with-case-made-in-usa-by-visions-india-200x200-imaehehhuaxhzd7b.jpeg,Health and Beauty>Eye Care>Contact Lenses,2300.0,649.0,649.0,true,CTLEHEN3THCGWH3G,CTLEHEN3THCGWH3G
Flipkart,,Optokart Two Tone Color With Kit Made In USA By Visions India Yearly Contact Lens,"These have been specially designed keeping the youth in mind. Most Attractive Colors These easy to handle and comfortable to use lenses come in Yearly disposable modality and hence are hygienic. Grey,Green,Turquoise,Brown.",Optokart,http://dl.flipkart.com/dl/optokart-two-tone-color-kit-made-usa-visions-india-yearly-contact-lens/p/itmehghygazxaqay?pid=CTLEHGHYEKUZTV7Y&affid=siddarthk,http://img.fkcdn.com/image/contact-lens-new/h/b/g/optokart-2-two-tone-color-with-kit-made-in-usa-by-visions-india-200x200-imaehej7urze8uwp.jpeg,Health and Beauty>Eye Care>Contact Lenses,2300.0,699.0,699.0,true,CTLEHGHYEKUZTV7Y,CTLEHGHYEKUZTV7Y
Flipkart,,"Aquasoft Visiblu With 60ml Lens Solution Kit by Visions India Yearly Contact Lens(-18.00, Clear, Pack of 2)","A truly World class, value-for-money, soft lens. Manufactured in the Netherlands at an ISO 9001, EN46001 and CE certified facility using the latest and most sophisticated lathe cutting technology.offerings the ultimate in wearing comfort and clarify of vision. One more step forward in Aquasoft’s mission to bring you world class eye care at an affordable price.",Aquasoft,http://dl.flipkart.com/dl/aquasoft-visiblu-60ml-lens-solution-kit-visions-india-yearly-contact/p/itmef3frynzzpgrf?pid=CTLEF3FR6YCAAZZW&affid=siddarthk,http://img.fkcdn.com/image/contact-lens-new/e/7/b/aquasoft-2-visiblu-with-60ml-lens-solution-kit-by-visions-india-200x200-imaeexn8j5yg6zdf.jpeg,Health and Beauty>Eye Care>Contact Lenses,1862.0,1399.0,1399.0,true,CTLEF3FR6YCAAZZW,CTLEF3FR6YCAAZZW
Flipkart,,"Ciba Vision Freshlook Colorblends Turquoise By Vision India Monthly Contact Lens(-5.75, Turquoise, Pack of 2)","Freshlook Colorblends In Affordable Opaque Colors With Maximum Possible Lens Concentration Blends 3 Colours Into One To Create The Subtle, Natural Depth Of Your Eyes. Replace It Frequently To Enjoy A Comfortable Wear.",Ciba Vision,http://dl.flipkart.com/dl/ciba-vision-freshlook-colorblends-turquoise-india-monthly-contact-lens/p/itmedtp3hn4nxh36?pid=CTLEDTP3TFKST2YS&affid=siddarthk,http://img.fkcdn.com/image/contact-lens-new/h/p/k/ciba-vision-2-freshlook-colorblends-turquoise-by-vision-india-8-200x200-imaedtcwecgr892m.jpeg,Health and Beauty>Eye Care>Contact Lenses,995.0,699.0,699.0,true,CTLEDTP3TFKST2YS,CTLEDTP3TFKST2YS
Flipkart,,"Bausch & Lomb Purevision 2 with Lens Case By Visions India Monthly Contact Lens(-0.50, Clear, Pack of 6)","New Bausch + Lomb PureVision®2 HD contact lenses feature HD Optics are designed to reduce halos and glare and deliver the clear, crisp vision that you should demand. Plus, this monthly replacement lens offers design advances for outstanding comfort and breath-ability.",Bausch & Lomb,http://dl.flipkart.com/dl/bausch-lomb-purevision-2-lens-case-visions-india-monthly-contact/p/itmef3fzeqrzcunm?pid=CTLEF3FZAPPEZRMY&affid=siddarthk,http://img.fkcdn.com/image/contact-lens-new/8/f/a/bausch-lomb-6-purevision-2-with-lens-case-by-visions-india-6-00-200x200-imaeg9m9g3pqergf.jpeg,Health and Beauty>Eye Care>Contact Lenses,2100.0,1620.0,1620.0,true,CTLEF3FZAPPEZRMY,CTLEF3FZAPPEZRMY
Flipkart,,"Bausch & Lomb Biotrue 1 Day with Lens Case By Visions India Daily Contact Lens(-3.75, Clear, Pack of 30)","Biotrue ONEday contact lenses are inspired by the biology of your eyes. While other lenses dry out as the day passes, Biotrue ONEday contacts retain moisture naturally produced by the eye. The result is consistently clear vision and comfort until the moment you take them out. With added High Definition Optics, Biotrue lenses help reduce halos and glare in low light situations. Try Biotrue ONEday daily disposables and see how naturally good your eyes can feel in contact lenses. Note: All items have latest expiry. Minimum expiry on any product will be not less than 2 years. 100% authentic item. Opened boxes cannot be replaced under any circumstance. We advise to check the product before opening them.",Bausch & Lomb,http://dl.flipkart.com/dl/bausch-lomb-biotrue-1-day-lens-case-visions-india-daily-contact/p/itmef6g5ewwf75hc?pid=CTLEF6G5GN2SHVYH&affid=siddarthk,http://img.fkcdn.com/image/contact-lens-new/u/q/b/bausch-lomb-30-biotrue-1-day-with-lens-case-by-visions-india-8-200x200-imaehhc7tytgfxn5.jpeg,Health and Beauty>Eye Care>Contact Lenses,2500.0,1749.0,1749.0,true,CTLEF6G5GN2SHVYH,CTLEF6G5GN2SHVYH
Flipkart,,"Ciba Vision Freshlook Colorblends Grey By Vision India Monthly Contact Lens(-3.25, Grey, Pack of 2)","Freshlook Colorblends in affordable opaque colors with maximum possible lens concentration blends 3 colours into one to create the subtle, natural depth of your eyes. Replace it frequently to enjoy a comfortable wear.",Ciba Vision,http://dl.flipkart.com/dl/ciba-vision-freshlook-colorblends-grey-india-monthly-contact-lens/p/itmedks2agvbehhz?pid=CTLEDKS2RATCQYN6&affid=siddarthk,http://img.fkcdn.com/image/contact-lens-new/j/k/b/ciba-vision-2-freshlook-colorblends-grey-by-vision-india-1-00-200x200-imaearg8vtwnbyfs.jpeg,Health and Beauty>Eye Care>Contact Lenses,995.0,699.0,699.0,true,CTLEDKS2RATCQYN6,CTLEDKS2RATCQYN6
Flipkart,,"Ciba Vision Freshlook Colorblends Monthly Contact Lens(-4.25, Honey, Pack of 2)","Freshlook Colorblends in affordable opaque colors with maximum possible lens concentration blends 3 colours into one to create the subtle, natural depth of your eyes. Replace it frequently to enjoy a comfortable wear.",Ciba Vision,http://dl.flipkart.com/dl/ciba-vision-freshlook-colorblends-monthly-contact-lens/p/itmearmghbwswz4z?pid=CTLEARMGX3JQATCB&affid=siddarthk,http://img.fkcdn.com/image/contact-lens-new/5/7/t/ciba-vision-2-freshlook-colorblends-honey-by-visions-india-1-00-200x200-imaearggnngzjft9.jpeg,Health and Beauty>Eye Care>Contact Lenses,995.0,699.0,699.0,true,CTLEARMGX3JQATCB,CTLEARMGX3JQATCB
