PartnerName,Id,Title,Description,Brand,Link,ImageLink,CategoryName,Mrp,OfferPrice,EffectivePrice,Availability,PartnerIdFromUrl,PartnerIdFromDb
Flipkart,,Hijeen Neem for all Skin Types Face Wash,"Hijeen Neem Face Wash specially formulated to prevent pimples. Soap free face wash gently removes impurities. Neem is a well-known anti-bacterial, deeply cleans & stops pimple reoccurrence. The neem will help treat the acne and pimples in your skin.Neem helps cure skin infections and also signs of eczema and psoriasis.It is a soap-free daily face wash gel that removes excess oil without drying your skin.It contains neem and turmeric which help control acne and pimples and eliminate trouble causing bacteria.The face wash is best suited for oily skin.Hijeen Neem Face wash (GEL)•Hijeen Neem Face wash is a soap free face wash.•Hijeen Neem Face wash is antibacterial with its Neem content•Hijeen Neem Face wash contains surfactants made from Coconut extracts Act as cleansing agents helps maintain pimple/Acne free soft Face•Hijeen Neem Face wash helps eliminate eczema n Psoriasis conditions•Hijeen Neem Face wash helps removal of excess oil from the face without drying the skin.•Hijeen Neem Face wash contains Brahmi , stimulates and provides regeneration facial cellss and improves Facial skin complexion •Hijeen Neem Face wash contains Aloevera (moisturizing effect) helps maintain Glowing facial skinHijeen Neem Face wash (GEL) helps maintain a pimple free non oily, Glowing Face.",Hijeen,http://dl.flipkart.com/dl/hijeen-neem-all-skin-types-face-wash/p/itmejyrymyk28ggm?pid=FCWEJYRYGH3ZYUJZ&affid=siddarthk,http://img.fkcdn.com/image/face-wash/u/j/z/hijeen-50-neem-for-all-skin-types-200x200-imaegwq8buczsy8h.jpeg,Health and Beauty>Body and Skin Care>Face Care>Face Washes,225.0,127.0,127.0,true,FCWEJYRYGH3ZYUJZ,FCWEJYRYGH3ZYUJZ
Flipkart,,Aryanveda Advance UV Protection Pollutend  Face Wash,Aryanveda Pollutend Face Wash is brimming with antioxidant active agents to fight pollution causing skin blemishes effectively. A unique combination of Sepitonic M3 offers the skin a new 'life force' to fight the detrimental effects of pollution and has chrono-energising effect at the cellular level of the skin. The all new Aryanveda Pollutend Face Wash unboxes an immaculate skin care solution for special 'you'. It's scientifically prepared formula with Sepitonic M3 energises your skin. The skin looks younger and luminous because of Anti Glycation action.HOW TO USE : Take a required amount of Pollutend Face Wash on your finger tips. Apply it gently on your face & massage in a circular motion till lather is formed. Rinse with water and pat your skin dry. Use two to three times in a day to look your face young and fresh.,Aryanveda,http://dl.flipkart.com/dl/aryanveda-advance-uv-protection-pollutend-face-wash/p/itmehjzmumpgzgft?pid=FCWEHJZHXRF7GCAU&affid=siddarthk,http://img.fkcdn.com/image/face-wash/c/a/u/aryanveda-60-advance-uv-protection-pollutend-face-wash-200x200-imaehjdsyrn9z9uz.jpeg,Health and Beauty>Body and Skin Care>Face Care>Face Washes,149.0,149.0,149.0,false,FCWEHJZHXRF7GCAU,FCWEHJZHXRF7GCAU
Flipkart,,La France Aloe Neem  Face Wash,"La France Aloe Neem Face Wash gives skin new energy level, with an inbuilt resistance against skin ages.Direction For Use:Dampen Face and neck. Place small amount of La France Face Wash on tips and massage into entire face using circular movements. Rinse off with tepid water.",La France,http://dl.flipkart.com/dl/la-france-aloe-neem-face-wash/p/itmefgtx4bqm3nu5?pid=FCWEFGTXBGZZGSFW&affid=siddarthk,http://img.fkcdn.com/image/face-wash/s/f/w/la-france-100-aloe-neem-face-wash-200x200-imaefe8f3gwttw3e.jpeg,Health and Beauty>Body and Skin Care>Face Care>Face Washes,300.0,175.0,250.0,true,FCWEFGTXBGZZGSFW,FCWEFGTXBGZZGSFW
Flipkart,,Krishkare Aloevera Face Wash,,Krishkare,http://dl.flipkart.com/dl/krishkare-aloevera-face-wash/p/itme7wgdh4xewv3m?pid=FCWE7WGDES3FAGNP&affid=siddarthk,http://img.fkcdn.com/image/face-wash/g/n/p/krishkare-100-aloevera-200x200-imae7w8gupzrvrxd.jpeg,Health and Beauty>Body and Skin Care>Face Care>Face Washes,99.0,99.0,99.0,true,FCWE7WGDES3FAGNP,FCWE7WGDES3FAGNP
Flipkart,,Evana Phytocell Age Defying Face Wash,"This luxuriant facial wash lavishes your skin with its silky smooth texture, instantly removing signs of dryness and dullness after one wash. Skin is significantly soothed and hydrated without any feeling of tightness. Skin is thus prepared for the subsequent treatmentExtracted from an endangered type of apples grown only in the Swiss Alps, it is a breakthrough in anti-aging. Rich in epigenetic factors and metabolites, its main functions include triggering the skin’s stem cell driven potential for infinite regeneration, stimulating its self renewing capacity of skin stem cells and insuring longevity of skin cellsHas strong moisturizing and film-forming properties. The hyaluronic acid film helps preserve the most important characteristics of youthful, healthy skin, such as suppleness, elasticity and tone.A natural and extremely gentle exfoliant. It boosts the exfoliation process and helps stimulate superficial cell growth while soothing the skin",Evana,http://dl.flipkart.com/dl/evana-phytocell-age-defying-face-wash/p/itmebxrrfq2b3zbh?pid=FCWEBXRRMVAHNDPJ&affid=siddarthk,http://img.fkcdn.com/image/face-wash/d/p/j/evana-500-phytocell-age-defying-200x200-imaebsfhx6fxewas.jpeg,Health and Beauty>Body and Skin Care>Face Care>Face Washes,2483.0,1600.0,1600.0,true,FCWEBXRRMVAHNDPJ,FCWEBXRRMVAHNDPJ
Flipkart,,Glowing Buzz Combo of 2 Herbal Aloe  Face Wash,"This combo of 2 Aloe Face Wash for Normal to Dry skin from the Glowing Buzz contains Aloe Vera in sufficient quantity with all its goodness i.e.,moisturising, emollient, healing, anti inflammatory and antioxidant properties. Directions of Use: Squeez out a small quantity onto your palm, work up lather and gently massage on your face. Rinse with water and pat skin dry. Use in place of soap morning and night. Follow with Glowing Buzz Carrot Moisturiser for normal to dry skin.",Glowing Buzz,http://dl.flipkart.com/dl/glowing-buzz-combo-2-herbal-aloe-face-wash/p/itmeg73y6cbsgkxn?pid=FCWEG73YGVQQGMNB&affid=siddarthk,http://img.fkcdn.com/image/face-wash/m/n/b/glowing-buzz-330-combo-of-2-herbal-aloe-face-wash-200x200-imaeg68wxjhnq4wf.jpeg,Health and Beauty>Body and Skin Care>Face Care>Face Washes,597.0,399.0,499.0,true,FCWEG73YGVQQGMNB,FCWEG73YGVQQGMNB
Flipkart,,Vasu Uva Herbal Face Wash,Use at least twice daily for effective result,Vasu Uva,http://dl.flipkart.com/dl/vasu-uva-herbal-face-wash/p/itmebfghhpmvf4wh?pid=FCWECKE2HW2MFUBK&affid=siddarthk,http://img.fkcdn.com/image/face-wash/u/b/k/vasu-uva-60-herbal-200x200-imaeck5ahjmy5h58.jpeg,Health and Beauty>Body and Skin Care>Face Care>Face Washes,65.0,65.0,65.0,false,FCWECKE2HW2MFUBK,FCWECKE2HW2MFUBK
Flipkart,,Aryanveda Advance Tan Remover Tanend  Face Wash,"Aryanveda Face Wash,synergized with refreshing herbal ingredients and natural goodness of activated charcoal, not only improves skin tone but also fills the skin with the confidence of freshness. It’s refreshing formula cleanses the skin and improves elasticity by sustaining moisture balance, essential for summers. It gently treats the photo-aged skin and works as an excellent anti-oxidant agents. Presence of charcoal cleanses the skin and wipes of toxins from skin. Bet! Your skin will speak volumes of its health while exuding a natural glow you always craved for.HOW TO USE :Take a required amount of Tanend Face Wash on your fingertips. Apply it gently on your face & massage in a circular motion till lather is formed. Rinse with water and pat your skin dry. Use two to three times in a day to look your face young and fresh.Hot throbbing summer doubles up your skin worries,especially skin darkening issues dampens your spirits and you are forced to stay in.Dont be,Go out with confidence and let everyone see the glow of your skin with aryanveda tanend face wash.",Aryanveda,http://dl.flipkart.com/dl/aryanveda-advance-tan-remover-tanend-face-wash/p/itmehjzhwqgp8qbh?pid=FCWEHJZHSJRFUFAW&affid=siddarthk,http://img.fkcdn.com/image/face-wash/f/a/w/aryanveda-60-advance-tan-remover-tanend-face-wash-200x200-imaehjdsq62ayju2.jpeg,Health and Beauty>Body and Skin Care>Face Care>Face Washes,149.0,149.0,149.0,false,FCWEHJZHSJRFUFAW,FCWEHJZHSJRFUFAW
Flipkart,,Aryanveda Millicapsule Face Wash,Cleansing agents in Aryanveda Face Wash unclogs skin pores and anti-bacterial properties of key ingredients in the face wash removes acne causing bacteria from skin. It further balances oil content in skin.,Aryanveda,http://dl.flipkart.com/dl/aryanveda-millicapsule-face-wash/p/itmdhczuykhhgcjh?pid=FCWDHCZGTHWT6HUC&affid=siddarthk,http://img.fkcdn.com/image/face-wash/h/u/c/aryanveda-120-millicapsule-200x200-imadhdf7w7xhgwhz.jpeg,Health and Beauty>Body and Skin Care>Face Care>Face Washes,110.0,77.0,110.0,false,FCWDHCZGTHWT6HUC,FCWDHCZGTHWT6HUC
Flipkart,,Joy Skin Fruits Oil Control Face Wash for Oily Skin Face Wash 65 ml - (Pack of 2) Face Wash(65 ml),"Exfoliates skin and deep cleanses blackheads, dirt, grind and clogged pores.Pack Of Two",Joy,http://dl.flipkart.com/dl/joy-skin-fruits-oil-control-face-wash-oily-65-ml-pack-2/p/itmds3dqhrdwyytm?pid=FCWDRKR8F9RVE2FJ&affid=siddarthk,http://img.fkcdn.com/image/face-wash/2/f/j/joy-65-joy-skin-fruits-oil-control-face-wash-for-oily-skin-200x200-imadrkrhevgfgwrc.jpeg,Health and Beauty>Body and Skin Care>Face Care>Face Washes,100.0,98.0,98.0,true,FCWDRKR8F9RVE2FJ,FCWDRKR8F9RVE2FJ
Flipkart,,Inatur Herbals Charcoal Cleanser Face Wash,"The new secret that for your skin that deeply cleanses, detoxifies and heals it from within, freeing from impurities and making it soft and radiant.It is gentle enough to be used twice daily. It is PH balanced, sulphate-free and paraben-free.",Inatur Herbals,http://dl.flipkart.com/dl/inatur-herbals-charcoal-cleanser-face-wash/p/itmefzh2yjj3jnf3?pid=FCWEFZH2R5ZRHM8U&affid=siddarthk,http://img.fkcdn.com/image/face-wash/m/8/u/inatur-herbals-200-charcoal-cleanser-200x200-imaefwyvzxrqqn2b.jpeg,Health and Beauty>Body and Skin Care>Face Care>Face Washes,350.0,350.0,350.0,true,FCWEFZH2R5ZRHM8U,FCWEFZH2R5ZRHM8U
Flipkart,,Vichy Ideal White Brightening Deep Cleansing Foam Face Wash(100 ml),,Vichy,http://dl.flipkart.com/dl/vichy-ideal-white-brightening-deep-cleansing-foam-face-wash/p/itme97xffagytkrr?pid=FCWE97XFMJXSAPAD&affid=siddarthk,http://img.fkcdn.com/image/face-wash/p/a/d/vichy-100-ideal-white-brightening-deep-cleansing-foam-200x200-imae97t7msmkzwnk.jpeg,Health and Beauty>Body and Skin Care>Face Care>Face Washes,1550.0,1379.0,1533.0,true,FCWE97XFMJXSAPAD,FCWE97XFMJXSAPAD
Flipkart,,O3+ Men Tea Tree Mela Derm Cleansing Gel Face Wash(50 ml),"Specifically made for the tough male skin, this O3+ Tea Tree Mela Derm Cleansing Gel brightens skin and washes away impurities from deep within the pores so your skin feels clean and hydrated. Improves Texture and Appearance of Skin The powerful gel gently evens out skin and makes it smoother with each wash. Ideal for Dull Skin This deep cleansing face wash is ideal for oily and dull skin. It gradually brightens skin and makes it fresh and radiant. Dermatologically Tested The innovative formula has gone through rigorous testing and is approved by dermatologists. Daily Use The formula is gentle and can be used on a daily basis to improve the appearance of skin. Brightens Skin Containing tea tree extracts, this O3+ Men Cleansing Gel penetrates deep and works to make your skin look brighter and renewed. Cleanses without Irritating Skin The effective cleansing gel also contains soothing aloe vera extracts that calm your skin and prevent irritations.",O3+,http://dl.flipkart.com/dl/o3-men-tea-tree-mela-derm-cleansing-gel-face-wash/p/itmdvyxf9pzxhf4z?pid=FCWDVYDDFGQK2YJX&affid=siddarthk,http://img.fkcdn.com/image/face-wash/y/j/x/o3-50-men-tea-tree-mela-derm-cleansing-gel-200x200-imadw2nmryft7aey.jpeg,Health and Beauty>Body and Skin Care>Face Care>Face Washes,195.0,162.0,162.0,true,FCWDVYDDFGQK2YJX,FCWDVYDDFGQK2YJX
Flipkart,,Neutrogena Visibly Clear Pink Grapefruit Facial Wash Face Wash(200 ml),,Neutrogena,http://dl.flipkart.com/dl/neutrogena-visibly-clear-pink-grapefruit-facial-wash-face/p/itmdx2e36ae3aayh?pid=FCWDX2DQPZRGUN6T&affid=siddarthk,http://img.fkcdn.com/image/face-wash/n/6/t/neutrogena-200-visibly-clear-pink-grapefruit-facial-wash-200x200-imadx8zmzgegxhkm.jpeg,Health and Beauty>Body and Skin Care>Face Care>Face Washes,999.0,899.0,899.0,true,FCWDX2DQPZRGUN6T,FCWDX2DQPZRGUN6T
Flipkart,,Shahnaz Husain Tulsi-Neem 50 Gm(Pack of 5) Face Wash(250 g),,Shahnaz Husain,http://dl.flipkart.com/dl/shahnaz-husain-tulsi-neem-50-gm-pack-5-face-wash/p/itmecndycejhrgqv?pid=FCWECNDYGCHFFUPK&affid=siddarthk,http://img.fkcdn.com/image/face-wash/u/p/k/shahnaz-husain-250-tulsi-neem-50-gm-pack-of-5-200x200-imaecn9bytsynvjf.jpeg,Health and Beauty>Body and Skin Care>Face Care>Face Washes,675.0,675.0,675.0,true,FCWECNDYGCHFFUPK,FCWECNDYGCHFFUPK
Flipkart,,Bonjour Paris Color Cap Nail polish 51 12 ml,,Bonjour Paris,http://dl.flipkart.com/dl/bonjour-paris-color-cap-nail-polish-51-12-ml/p/itme8fazzgzgnwtf?pid=NLPE8FAZHDMPFWDK&affid=siddarthk,http://img.fkcdn.com/image/nail-polish/w/d/k/bonjour-paris-12-color-cap-nail-polish-51-200x200-imae8f668qhdwwt3.jpeg,Health and Beauty>Makeup>Nails>Nail Polishes,345.0,148.0,148.0,true,NLPE8FAZHDMPFWDK,NLPE8FAZHDMPFWDK
Flipkart,,Fashion Bar Neon Nail Polish Combo 8 76 ml,,Fashion Bar,http://dl.flipkart.com/dl/fashion-bar-neon-nail-polish-combo-8-76-ml/p/itmecuxgmhgews7g?pid=NLPECUXGN4QPPEBQ&affid=siddarthk,http://img.fkcdn.com/image/nail-polish/e/b/q/fashion-bar-76-neon-nail-polish-combo-8-200x200-imaecug3pwky2jtk.jpeg,Health and Beauty>Makeup>Nails>Nail Polishes,720.0,286.0,302.0,true,NLPECUXGN4QPPEBQ,NLPECUXGN4QPPEBQ
Flipkart,,Fashion Bar Silver Cap Nail Polish New 3 28.5 ml,,Fashion Bar,http://dl.flipkart.com/dl/fashion-bar-silver-cap-nail-polish-new-3-28-5-ml/p/itmeejgexfuuztye?pid=NLPEEJGERZCZHCXX&affid=siddarthk,http://img.fkcdn.com/image/nail-polish/c/x/x/fashion-bar-28-5-silver-cap-nail-polish-new-3-200x200-imaeegcnmnrwsdzz.jpeg,Health and Beauty>Makeup>Nails>Nail Polishes,300.0,144.0,144.0,true,NLPEEJGERZCZHCXX,NLPEEJGERZCZHCXX
Flipkart,,Fashion Bar Silver Cap Nail Polish New 16 95 ml,,Fashion Bar,http://dl.flipkart.com/dl/fashion-bar-silver-cap-nail-polish-new-16-95-ml/p/itmeejgecefv3cqa?pid=NLPEEJGEWN6BMYSH&affid=siddarthk,http://img.fkcdn.com/image/nail-polish/y/s/h/fashion-bar-95-silver-cap-nail-polish-new-16-200x200-imaeegcnytksk9kt.jpeg,Health and Beauty>Makeup>Nails>Nail Polishes,1000.0,370.0,370.0,true,NLPEEJGEWN6BMYSH,NLPEEJGEWN6BMYSH
Flipkart,,Fashion Bar Neon Nail Polish Combo 37 57 ml,,Fashion Bar,http://dl.flipkart.com/dl/fashion-bar-neon-nail-polish-combo-37-57-ml/p/itmecvygdgrmadre?pid=NLPECVYGSQHMZRUF&affid=siddarthk,http://img.fkcdn.com/image/nail-polish/r/u/f/fashion-bar-57-neon-nail-polish-combo-37-200x200-imaecvknf8jqcsde.jpeg,Health and Beauty>Makeup>Nails>Nail Polishes,540.0,241.0,241.0,true,NLPECVYGSQHMZRUF,NLPECVYGSQHMZRUF
Flipkart,,Fashion Bar Neon Nail Polish Combo 29 76 ml,,Fashion Bar,http://dl.flipkart.com/dl/fashion-bar-neon-nail-polish-combo-29-76-ml/p/itmecvygdxr75nwh?pid=NLPECVYGF5SFSHSZ&affid=siddarthk,http://img.fkcdn.com/image/nail-polish/h/s/z/fashion-bar-76-neon-nail-polish-combo-29-200x200-imaecvknhwcsnhmz.jpeg,Health and Beauty>Makeup>Nails>Nail Polishes,720.0,321.0,321.0,true,NLPECVYGF5SFSHSZ,NLPECVYGF5SFSHSZ
Flipkart,,Fashion Bar Neon Nail Polish Combo 014 10 ml,,Fashion Bar,http://dl.flipkart.com/dl/fashion-bar-neon-nail-polish-combo-014-10-ml/p/itmee8v3evqzyhxk?pid=NLPEE8V3RKFTJJJN&affid=siddarthk,http://img.fkcdn.com/image/nail-polish/j/j/n/fashion-bar-10-neon-nail-polish-combo-014-200x200-imaee8ejyjvsckat.jpeg,Health and Beauty>Makeup>Nails>Nail Polishes,200.0,107.0,113.0,true,NLPEE8V3RKFTJJJN,NLPEE8V3RKFTJJJN
Flipkart,,Fashion Bar Nail Polish Neon Combo Orange. 20 ml,,Fashion Bar,http://dl.flipkart.com/dl/fashion-bar-nail-polish-neon-combo-orange-20-ml/p/itmee6r7ykvqgbnp?pid=NLPEE6R7XYEGHCHG&affid=siddarthk,http://img.fkcdn.com/image/nail-polish/c/h/g/fashion-bar-20-nail-polish-neon-combo-orange-200x200-imaee2wjvaayzpgw.jpeg,Health and Beauty>Makeup>Nails>Nail Polishes,300.0,153.0,153.0,true,NLPEE6R7XYEGHCHG,NLPEE6R7XYEGHCHG
Flipkart,,Fashion Bar FBH ST Nail Polish Combo 29 60 ml,,Fashion Bar,http://dl.flipkart.com/dl/fashion-bar-fbh-st-nail-polish-combo-29-60-ml/p/itmegn9u7tugfwee?pid=NLPEGN9UNMJUNKA9&affid=siddarthk,http://img.fkcdn.com/image/nail-polish/k/a/9/fashion-bar-60-fbh-st-nail-polish-combo-29-200x200-imaegjz6tukgzurj.jpeg,Health and Beauty>Makeup>Nails>Nail Polishes,1200.0,291.0,291.0,true,NLPEGN9UNMJUNKA9,NLPEGN9UNMJUNKA9
Flipkart,,Deborah Lippmann Nail Polish 15 ml,"Deborah Lippmann, manicurist to the stars, started out as a songstress. As a result, many of her nail colors are named after major pop icons and other A-List celebrities. Bold, glamorous and audaciously on-trend, try one of her nail lacquers if you’re looking to play star for a day.0.5 fl. oz. nail lacquerLong-lastingFortified with biotin, okoume, and green tea",Deborah Lippmann,http://dl.flipkart.com/dl/deborah-lippmann-nail-polish-15-ml/p/itmebtgehhhaes7z?pid=NLPEBTGERMKQ6GDZ&affid=siddarthk,http://img.fkcdn.com/image/nail-polish/g/d/z/deborah-lippmann-15-nail-polish-200x200-imaebtfxefyn6vfe.jpeg,Health and Beauty>Makeup>Nails>Nail Polishes,2300.0,1190.0,1190.0,true,NLPEBTGERMKQ6GDZ,NLPEBTGERMKQ6GDZ
Flipkart,,ADS HIGH COVERAGE CREAMY WITH SMUDGER Concealer(BEIGE),,ADS,http://dl.flipkart.com/dl/ads-high-coverage-creamy-smudger-concealer/p/itmeh96qufmwjcwp?pid=CLREH96QAHQYUXTC&affid=siddarthk,http://img.fkcdn.com/image/concealer/x/t/c/ads-high-coverage-creamy-with-smudger-200x200-imaeh4wdd7ssyzsg.jpeg,Health and Beauty>Makeup>Face>Concealers,499.0,238.0,238.0,true,CLREH96QAHQYUXTC,CLREH96QAHQYUXTC
Flipkart,,Deborah 24 Ore Perfect Concealer,"You are going for your sister’s baby shower party and you have picked up the perfect traditional attire. The stylish footwear and the clutch is sure to create that lasting impression. Something that you are worried about are those minor flaws on your skin. Deborah comes with a 24 Ore Perfect Concealer to give you that complete look. Perfectly designed for women, this Concealer will add that radiant glow to your skin. You will fall in love with the full coverage this Ore Perfect Concealer promises you with. The Deborah 24 Ore Perfect Concealer is dermatologically tested to keep your skin safe and healthy. Also, this Light Beige - 01 shade is sure to give you that stunning look. This creamy textured concealer will perfectly blend into your skin and give you that unique finish. Besides concealing the blemishes and dark spots on your skin, this Deborah 24 Ore Concealer will give you that even skin tone. You can bid farewell to your dark circles with this Deborah Concealer. Additionally, this 24 Perfect Concealer will disguise the minor flaws on your skin and will not clog your pores. You can apply this concealer for a party and look stunning till the end of the party, as this Concealer is long lasting. With the presence of the hypoallergenic formula in this Concealer, you can ensure your skin to be free from irritation. You can now get that soft and supple skin with this Ore Perfect Concealer. Directions for Use Use this Pan Stick Concealer and gently apply on your face.",Deborah,http://dl.flipkart.com/dl/deborah-24-ore-perfect-concealer/p/itmeh4az9newykmz?pid=CLRD9YM23J8JE5FY&affid=siddarthk,http://img.fkcdn.com/image/concealer/5/f/y/deborah-24-ore-perfect-200x200-imaduhynsxzmyjfg.jpeg,Health and Beauty>Makeup>Face>Concealers,615.0,615.0,615.0,false,CLRD9YM23J8JE5FY,CLRD9YM23J8JE5FY
Flipkart,,Playboy Combo Set(Set of 2),1 spicy Deodorant (150 ml) For Women1 spicy EDT (100ml) For Women,Playboy,http://dl.flipkart.com/dl/playboy-combo-set/p/itmefetanpvttkyx?pid=CAGEFETAUZHHFJSD&affid=siddarthk,http://img.fkcdn.com/image/combo-gift-set/j/s/d/playboy-200x200-imaefdwxfrrhpnmk.jpeg,Health and Beauty>Fragrances,999.0,609.0,609.0,false,CAGEFETAUZHHFJSD,CAGEFETAUZHHFJSD
Flipkart,,"Envy 1000 Wink,Blush,Kiss Combo Set(Set of 3)",,ENVY 1000,http://dl.flipkart.com/dl/envy-1000-wink-blush-kiss-combo-set/p/itmebtge4rhdbyhg?pid=CAGEBTGEWTVJZBEG&affid=siddarthk,http://img.fkcdn.com/image/combo-gift-set/b/e/g/envy-1000-200x200-imaebt6vakhdmxuu.jpeg,Health and Beauty>Fragrances>Deodorants>Combos,585.0,558.0,558.0,true,CAGEBTGEWTVJZBEG,CAGEBTGEWTVJZBEG
Flipkart,,Nike Fission Combo Set(Set of 2),,Nike,http://dl.flipkart.com/dl/nike-fission-combo-set/p/itme8x8xc6spggmv?pid=CAGE8X8X3VRPBTWM&affid=siddarthk,http://img.fkcdn.com/image/combo-gift-set/t/w/m/nike-200x200-imae8v2232uewzue.jpeg,Health and Beauty>Fragrances>Deodorants>Combos,588.0,498.0,498.0,true,CAGE8X8X3VRPBTWM,CAGE8X8X3VRPBTWM
Flipkart,,Nike Pinkparadise Combo Set,,Nike,http://dl.flipkart.com/dl/nike-pinkparadise-combo-set/p/itme5jr3dcbmcmch?pid=CAGE5JR3US2UXKQM&affid=siddarthk,http://img.fkcdn.com/image/combo-gift-set/k/q/m/nike-200x200-imae5ghmkuffhjgs.jpeg,Health and Beauty>Fragrances>Deodorants>Combos,539.0,409.0,409.0,true,CAGE5JR3US2UXKQM,CAGE5JR3US2UXKQM
Flipkart,,"Armaf Beaut,Blue Club,Aqua,Priomo Combo Set(Set of 4)",,Armaf,http://dl.flipkart.com/dl/armaf-beaut-blue-club-aqua-priomo-combo-set/p/itmed6hfv3sa3vnh?pid=CAGED6HFHVAXEUAB&affid=siddarthk,http://img.fkcdn.com/image/combo-gift-set/u/a/b/armaf-200x200-imaed6g96yyz8vvn.jpeg,Health and Beauty>Fragrances>Deodorants>Combos,1200.0,900.0,1000.0,false,CAGED6HFHVAXEUAB,CAGED6HFHVAXEUAB
Flipkart,,Armaf PARATY FEMME MYST FEMME DE LA MARQUE HOMME Combo Set(Set of 3),,ARMAF,http://dl.flipkart.com/dl/armaf-paraty-femme-myst-de-la-marque-homme-combo-set/p/itmefdy6dnkgpqru?pid=CAGEFDY6ZDSDGQ7G&affid=siddarthk,http://img.fkcdn.com/image/combo-gift-set/q/7/g/armaf-200x200-imaef7mmsncnbv9h.jpeg,Health and Beauty>Fragrances>Deodorants>Combos,900.0,606.0,674.0,true,CAGEFDY6ZDSDGQ7G,CAGEFDY6ZDSDGQ7G
Flipkart,,Armaf HUNTER HOMME SKYE FEMME Combo Set(Set of 2),,ARMAF,http://dl.flipkart.com/dl/armaf-hunter-homme-skye-femme-combo-set/p/itmefdy654gzsqjz?pid=CAGEFDY6Z98RBYTX&affid=siddarthk,http://img.fkcdn.com/image/combo-gift-set/y/t/x/armaf-200x200-imaef7mmvczcdhyj.jpeg,Health and Beauty>Fragrances>Deodorants>Combos,600.0,404.0,449.0,true,CAGEFDY6Z98RBYTX,CAGEFDY6Z98RBYTX
Flipkart,,Rasasi Chastity Women::Blue Incontournable Combo Set(Set of 2),,Rasasi,http://dl.flipkart.com/dl/rasasi-chastity-women-blue-incontournable-combo-set/p/itmed9yekzzxvhkb?pid=CAGED9YENYVRUSEF&affid=siddarthk,http://img.fkcdn.com/image/combo-gift-set/s/e/f/rasasi-200x200-imaed9ssj4gap8dj.jpeg,Health and Beauty>Fragrances>Deodorants>Combos,600.0,549.0,549.0,true,CAGED9YENYVRUSEF,CAGED9YENYVRUSEF
Flipkart,,Anna Andre Paris & Vincent Valentine Paris Etoile dHomme Nuit & Floralina 100 ml Combo Set,,Anna Andre Paris & Vincent Valentine Paris,http://dl.flipkart.com/dl/anna-andre-paris-vincent-valentine-etoile-dhomme-nuit-floralina-100-ml-combo-set/p/itmej6yttthgjy33?pid=CAGEJ6YTYBPVHH2Q&affid=siddarthk,http://img.fkcdn.com/image/combo-gift-set/h/2/q/anna-andre-paris-vincent-valentine-paris-200x200-imaejy83hz2yqyg2.jpeg,Health and Beauty>Fragrances>Gift Sets,1179.0,900.0,1000.0,false,CAGEJ6YTYBPVHH2Q,CAGEJ6YTYBPVHH2Q
Flipkart,,"Monet Monet Passport Dude ,BodyGuard and Tage Body Spray Combo Set(Set of 3)",,Monet,http://dl.flipkart.com/dl/monet-passport-dude-bodyguard-tage-body-spray-combo-set/p/itmebtge4u3y758g?pid=CAGEBTGEKJQ9JZRV&affid=siddarthk,http://img.fkcdn.com/image/combo-gift-set/z/r/v/monet-200x200-imaebt6dqjuezgyk.jpeg,Health and Beauty>Fragrances>Deodorants>Combos,670.0,669.0,669.0,true,CAGEBTGEKJQ9JZRV,CAGEBTGEKJQ9JZRV
Flipkart,,Oros Turmeric Combo Set,,Oros,http://dl.flipkart.com/dl/oros-turmeric-combo-set/p/itmecsxknqnjxzes?pid=CAGECSXKGEJGEZJF&affid=siddarthk,http://img.fkcdn.com/image/combo-gift-set/z/j/f/oros-200x200-imaecsuuzhtdfpr9.jpeg,Health and Beauty>Fragrances>Deodorants>Combos,150.0,,140.0,false,CAGECSXKGEJGEZJF,CAGECSXKGEJGEZJF
Flipkart,,Anna Andre Paris Floralina & Dark Magic Deodorant Combo Set,,Anna Andre Paris,http://dl.flipkart.com/dl/anna-andre-paris-floralina-dark-magic-deodorant-combo-set/p/itmdtn28mgbuhjhh?pid=CAGDTN27PFX7KYZ4&affid=siddarthk,http://img.fkcdn.com/image/combo-gift-set/y/z/4/anna-andre-paris-200x200-imae3wxhghghrd9y.jpeg,Health and Beauty>Fragrances>Deodorants>Combos,360.0,279.0,310.0,true,CAGDTN27PFX7KYZ4,CAGDTN27PFX7KYZ4
Flipkart,,Slazenger (Classic & Sprint) Combo Set(Set of 2),"Slazenger Set of 2 Deo Sprays for Active sports lifestyle. Ideal for outdoor activities, offers you a collection of long lasting fragrances. Combo of Classic & Sprint. Top Notes Woody and Tangrin.",Slazenger,http://dl.flipkart.com/dl/slazenger-classic-sprint-combo-set/p/itmedpfwckjvfmqz?pid=CAGEDPFW8H5YPNZP&affid=siddarthk,http://img.fkcdn.com/image/combo-gift-set/n/z/p/slazenger-200x200-imaedp7s5tv8tmkg.jpeg,Health and Beauty>Fragrances>Deodorants>Combos,398.0,398.0,398.0,true,CAGEDPFW8H5YPNZP,CAGEDPFW8H5YPNZP
Flipkart,,Iwill Non Alcoholic Perfumes Floral Attar Fancy Ittar 32 ml Combo Set,,Iwill,http://dl.flipkart.com/dl/iwill-non-alcoholic-perfumes-floral-attar-fancy-ittar-32-ml-combo-set/p/itmedd3mbhx8tsa9?pid=CAGEDD3MU3UYNYHK&affid=siddarthk,http://img.fkcdn.com/image/combo-gift-set/y/h/k/iwill-200x200-imaedbs9prfap8z2.jpeg,Health and Beauty>Fragrances>Gift Sets,800.0,349.0,349.0,true,CAGEDD3MU3UYNYHK,CAGEDD3MU3UYNYHK
Flipkart,,Rasasi Relation Men Combo Set(Set of 2),,Rasasi,http://dl.flipkart.com/dl/rasasi-relation-men-combo-set/p/itmededshkdfamnc?pid=CAGEDEDSPVZMWYDG&affid=siddarthk,http://img.fkcdn.com/image/combo-gift-set/y/d/g/rasasi-200x200-imaed9ss2wurqpha.jpeg,Health and Beauty>Fragrances>Deodorants>Combos,600.0,499.0,499.0,true,CAGEDEDSPVZMWYDG,CAGEDEDSPVZMWYDG
